Original,EN,Needs Review
"店裡氣氛超好
原本要去台北或桃園bar
但朋友說來這裡先墊一下時間
晚點在去山下
結果認識不少朋友
超熱鬧的
點了一杯調酒
馬上老闆請了一群人一杯shot杯
邊喝邊聊都是林口各行各業的人
聽到一位哥的專屬的特調熊貓酒
不囉嗦馬上來一杯
一堆人互相請喝酒
一個晚上shot杯不知道喝幾杯
酒量好的一定要來試試看

重點是氣氛真的好
老闆人很好相處

👍","The atmosphere in the store is super good
Originally going to Taipei or Taoyuan Bar
But my friend said that the time came here first
Go to the mountain late
As a result, I know a lot of friends
Hypopular
Ordered a cup of bartending
The boss immediately invited a group of people a cup of SHOT cup
Talking while drinking is all people from Linkou all walks of life
Hearing a brother's exclusive special panda wine
Come to a cup right away
A bunch of people please drink each other
I don’t know how to drink a few cups at night at night
If you have a good amount of alcohol, you must try it

The point is that the atmosphere is really good
The boss is very good

Bleak",False
"老闆真的超讚的啦！
餐點又好吃❤️酒水好喝
水準真的一級棒
但最愛的是甜點師淇淇的手作甜點啦❤️
環境整潔又乾淨
來到林口一定要來嚐鮮🤩","The boss is really amazing!
The meal is delicious ❤️ The drink is delicious
The level is really great
But the favorite is the dessert of the desserter Qi Qi ❤️
The environment is neat and clean
Come to Linkou must come to try something new 🤩",False
"東西用很好吃
調酒也能依據喜好調整甜度、濃度
每次來餐酒館都只恨口袋不夠深😭 …","It is delicious for things
Blooming can also adjust sweetness and concentration according to preferences
Every time I come to the dining tavern, I hate my pockets not deep enough ...",False
"Kane 調的酒好喝，
淇師傅的限量提拉米蘇超好吃！
林口很棒的餐酒bar","Kane adjusted the wine is so delicious,
Master Qi's limited Tiramisu Super!
Linkou's great meal wine Bar",False
"東西好吃到太驚艷 沒有誇張！
酒類也完全被征服，大推！","It's so amazing that it is so amazing and no exaggeration!
The wine is also completely conquered, pushing!",False
不喝酒的我，也能享受超正點的美食和飲品，讚啦,"If you don’t drink alcohol, you can also enjoy the super -righteous food and drinks, like it",False
很棒的用餐體驗 餐食溫度合適佐上焦香味 極度放鬆,"Very great meal experience meal temperature is suitable for coking fragrance, extremely relaxed",False
點了綜合炸物拼盤，炸物酥脆好吃，尤其是那個白色店家特調醬料~超級好吃!!!,"Ordered a comprehensive fried platter, the explosives are crispy and delicious, especially the white shop special sauce ~ super delicious !!!",False
老闆超nice 餐點超強！ 調酒也都很不錯👍 很推薦 …,The boss is super nice meals!Blooming is also very good… It is recommended ...,False
舒適的用餐環境，餐點、甜點及酒精飲料都在水準之上！三五好友吃飯聚會的好地方！,"Comfortable dining environment, meals, desserts and alcoholic beverages are above the standard!A good place for three or five friends to eat party!",False
"氣泡有點粗曠的Ramos Gin Fizz……
調酒師風格蠻獨特的呢……","The bubble is a bit rough Ramos Gin Fizz ...
The bartender style is quite unique ...",False
"東西超級好吃！
酒也很好喝！
有空過來真的讓你會有意想不到的酒吧","East -west is super delicious!
The wine is also delicious!
Come here, really make you really unexpected bars",False
不得不說 Wilson 這邊真的熱情且食物非常不錯 酒水也不會過於淡或者濃而都可以調整 燉飯值得一嚐,I have to say that Wilson is really enthusiastic and the food is very good. The wine will not be too light or thick.,False
"餐點好吃！！ 環境很好！！

放的音樂好聽！！","The meal is delicious!IntersectionThe environment is very good!Intersection

The music is nice!Intersection",False
"一個跟朋友一起暢聊的好地方
氣氛 調酒 美食 👍

下次再來喝閨蜜聊東聊西 聊南聊北❤️","A good place to chat with friends
Atmospheric bartending food 美

Next time I will drink a girlfriend to talk about Donglian, Xiangnan Liao North ❤️",False
"燈光美、氣氛佳 老闆人不錯 林口好所在
店員都俊男美女","Beautiful light, atmosphere, the boss is good, Linkou is good
The clerk is handsome men and beautiful women",False
東西很好吃 老闆人很好 調酒很好喝 林口最頂餐酒館,"The things are very delicious, the boss is very good, bartender, delicious, the top dining tavern",False
沒想到，在這林口沙漠還藏著高手啊。燉飯，陪酒菜都很棒。小小餐酒館，可推。,"Unexpectedly, there are still masters hidden in this Linkou Desert.Stewed rice, accompanying wine and vegetables is great.Small dining tavern, push.",False
"食物好吃
老闆親切","Food is delicious
Boss kind",False
"吃飽飯過去，吃了提拉米蘇，真是厲害
改天一定要去嚐嚐餐點，非常期待
路過的時候老闆推薦裡面有餐點也有甜點，帶著小孩想說吃飽可以來個甜點就走進去了，非常不錯的店","It ’s really amazing after eating a full meal, eating Tiramisu
Be sure to try the meal after another day, I am looking forward to it very much
When you pass by, the boss recommends meals and desserts. With the child who wants to say that you can eat a dessert, you can walk in. Very good shop",False
很用心的酒吧，餐酒都很不錯～～👍 …,"A very attentive bar, the meal wine is very good ~~ 👍 ...",False
下公車經過看到新開的店很特別，一個人進去吃晚餐試試看。點了培根遇見蛋的燉飯，口味非常特別，燉飯中間蛋黃香氣濃郁，很特別的白醬口味（我不是做餐飲可能不是那麼專業，但感覺口味應該叫做中西合併？）總之，真的很特別的口味，可以說是目前吃過最好吃的燉飯！連培根很用心，每一片都煎過，而不是隨便攪在飯裡，連盤子邊都有調味料裝飾，可以感受到廚師的用心，可惜第一次吃沒想這麼多，也沒想說拍照片，下次但家人一起去再補發個評論唄👍 …,"After seeing the newly opened store, getting off the bus is very special.I ordered the stewed rice to meet the eggs of Bacon. The taste is very special. The egg yolk in the middle of the stewed rice is strong, and the special white sauce flavor (I am not a catering may not be so professional, but it feels like the taste of Chinese and Western?) The special taste can be said to be the best stew now!Even bacon is very attentive, and each piece has been fried instead of stirring in the meal. Even the disk is decorated with seasonings. You can feel the chef's intentions. Unfortunately, I didn't think so much for the first time. Photo, next time, but the family go to make a comment together ...",False
"餐點好吃 氣氛佳 服務很好
就算不是去喝酒也是一個很好的選擇","The delicious atmosphere is good. The service is very good.
Even if it's not going to drink, it is a good choice",False
"調酒都滿有水準，調酒師會來介紹適合喜歡的口味，服務生漂亮可愛又nice,老闆帥又好客，小點跟甜點都滿好吃的，下次來試晚餐跟其他調酒👍👍👍 …",The bartending is full of standards. The bartender will introduce the taste that is suitable for favorite. The waiter is beautiful and cute and nice. The boss is handsome and good. 👍👍 👍👍 ...,False
"剛好遇到有算是客座調酒師的一天
整體還不錯，酒單上幾乎都是經典調酒，如果可以增加一些特別or店家特別的調酒相信會更好","I just met a day when there is a guest bartender
The overall is not bad. Almost all of the wine lists are classic bartending. If you can add some special or store special bartender, it will be better",False
酒好喝，氣氛佳～,The wine is delicious and the atmosphere is good ~,False
"餐點很好吃 很用心
其中的醬料不是料理包很棒！
飲料也非常推
甜點現做超厲害👍🏻
這麼好的店不能只有我知道！","The meal is delicious and attentive
The sauce is not a great cooking bag!
The drink is also very pushing
Dessert is now superb 做
I can't just know such a good store!",False
帥老闆很親切，調酒厲害，餐點好吃,"The handsome boss is very kind, the bartender is great, the meal is delicious",False
"林口最頂的就在這裡啦
要吃吃得飽
要喝醉最多讓你醉到你媽都不認識你","The top of Linkou is here
Want to eat
Drunk at most, let you get drunk at most, your mother doesn't know you",False
寵物友善，餐點實在且好吃，一定再訪！,"Pets are friendly, the meals are really delicious, and you must visit again!",False
吃著美食，看著球賽，喝著甜酒，夫復何求,"Eat the food, watch the game, drink sweet wine, how can a husband recover",False
純粹去喝酒🤣，店內很有氣氛，酒不錯喝，服務人員都很親切，還有招待一杯shout，不小心打破杯子，服務人員第一時間問有沒有受傷，態度超好👍🏻有機會會想再去的店 …,"Going to drink simply, there is a very atmosphere in the store, drinking well, the service staff is very kind, and entertaining a cup of Shout, accidentally breaking the cup. The service staff asked if he was injured at the first time. Go to the store ...",False
林口最頂餐酒館！選這間正解✔️💯,Linkou top dining tavern!Choose this time ✔ ️ 正,False
燈光美氣氛佳調酒師人很好會客製化飲品，東西很好吃特別是燉飯 大推👍 …,"The light and beautiful atmosphere is very good to customize the drink, the things are delicious, especially the stew push ...",False
"我是叫外送的
外送價位跟現場價位差了快一倍","I called the delivery
The delivery price is doubled from the on -site price.",False
"跟朋友點了義大利麵還有燉飯都超級好吃
酒也滿好喝的 店內服務人員也都很 Nice 很喜歡","I ordered the pasta with my friends and the stewed rice is super delicious
Wine is also delicious in the store.",False
超級優質的餐點跟調酒,Super high -quality meals and bartending,False
"東西好吃 酒好喝，絕對是林口最讚酒吧！
老闆人超好又會偷偷請客😆 …","The things are delicious and delicious, it is definitely Linkou's most popular bar!
The boss will secretly invite guests ...",False
怎麽會有燉飯這麼好吃的酒吧⋯⋯⋯⋯⋯⋯⋯,How can there be such a delicious bar such a stewed rice ...,False
酒很厚，餐點非常棒！！ 甜點好吃！ 小心老板熱情招待,The wine is very thick and the meals are great!IntersectionThe dessert is delicious!Be careful of the boss enthusiastically entertaining,False
"酒很好喝
清炒牛義大利麵好吃
老闆熱情 調酒師專業
再推薦車友來聚聚","Wine is delicious
Stir -fried beef Italian noodles delicious
Boss enthusiastic bartender major
Recommend car friends to get together",False
淇師傅的甜點很好吃～,Master Qi's dessert is delicious ~,False
"酒好喝 食物好吃
無懈可擊👍","Wine delicious food and delicious food
Inexplicable 👍",False
令人驚艷的餐點～,Stunning meals ~,False
"林口最棒酒吧
沒有之一！！！
Bartender專業
主廚廚藝驚人
甜點也好吃
每週都來報到！","Linkou is the best bars
No one!IntersectionIntersection
Bartender major
Chef cooking is amazing
Dessert is also delicious
Report every week!",False
服務貼心，雖然是餐酒館但連小孩的需求和反應都有照顧到，季節性氣泡飲好好喝,"The service is intimate. Although it is a dining tavern, even the needs and reactions of children have taken care of. Seasonal bubbles drink well",False
真的很讚 酒超好喝 老闆親切 服務100 還會再來！,It's really good to be super delicious. The boss will come again!,False
"老闆很熱情，店內還有很多重機擺設，
酒也好喝！","The boss is very enthusiastic, there are many heavy machine decorations in the store,
The wine is also delicious!",False
"最近新開幕的餐酒館～
餐點不錯，酒也不錯
放鬆心情的好地方😁 …","The newly opened dining tavern recently ~
The meal is good, the wine is also good
A good place to relax 的 ...",False
"老闆人超Nice
淇師傅的甜點超推👍","The boss super nice
Master Qi's dessert is super pushing 👍",False
"餐點夠味
酒調很讚有風味
甜點更是迷人","Dinner enough
The tone is very good and flavorful
Dessert is even more charming",False
"超讚的啦....
林口來過最讚的酒吧
超推ㄉ....","It's amazing ....
Linkou has been here to the best bar
Super push ...",False
蛋黃麵非常好吃，飲料調的也很好喝值得再次回味的一家店,"The egg yolk noodles are very delicious, and the drink is also very delicious.",False
酒好喝 甜點好吃 推推,Wine delicious dessert is delicious and push,False
餐好酒好氣氛佳，大推傲嬌牛 有夠牛,"The meal is good and the atmosphere is good, and it is enough to push pride",False
甜點不容錯過！,Do not miss the dessert!,False
非常棒推薦,Recommended,False
酒跟食物跟服務都很棒!,Both wine and food and service are great!,False
"義大利麵份量足
甜點有夠好吃","Polygonum portal
Dessert is delicious enough",False
目前林口龜山區喝到最好喝的酒吧,"Currently drinking the best bars in Guishan District, Linkou",False
松露蝦蝦超好吃🤤🤤,Tulu shrimp is super delicious 虾,False
❤️,❤️,False
服務親切到位，環境優雅，口味佳。,"The service is in place, the environment is elegant, and the taste is good.",False
威士忌基底的調酒豪好喝～,The bartender of the whiskey base is good ~,False
💯💯💯💯💯💯,💯💯💯💯💯💯,False
老闆店員都超親切！,The boss clerk is super kind!,False
調酒環境都很棒,The bartender environment is great,False
東西好吃，酒好喝,"It's delicious, wine is delicious",False
牛肉炒飯👍👍👍,Beef fried rice,False
非常推薦,Very recommended,False
在林口我很少吃到讓我覺得好吃的餐廳，大部份的評價都讓我覺得過譽…不過這間真的很值得大家去試試看，點了幾樣都覺得超好吃，改天我要再去吃別的～太喜歡這間餐館了,"In Linkou, I rarely eat restaurants that make me feel delicious. Most of the evaluations make me feel good ... But this is really worth trying to try it. I'm going to eat something else ~ I like this restaurant so much",False
"老闆告訴我們說，下次來吃他家的晚餐，晚餐是他家的特色～～
👌
我記住了，下次一定要來吃😋😋
🧾菜單：
｛熱紅酒｝這次的熱紅酒有點酸，酒味較濃，但是加上杯沿上的糖就會好一些

｛尼格羅尼｝就比較普通了

🍃環境：
說實在的，機車真的是很酷，在門口就震驚了，想必掌櫃是個機車愛好者～","The boss told us that coming to have dinner next time, dinner is the characteristics of his family ~~
Bleak
I remember, be sure to come to eat next time
🧾 menu:
次 Hot red wine 的 This time the hot red wine is a bit sour and stronger, but the sugar on the edge of the cup will be better

｝ Nigrini is more ordinary

🍃 Environment:
To be honest, the locomotive is really cool, and it is shocked at the door. Presumably the shopkeeper is a locomotive enthusiast ~",False
食物很好，海鮮拼盤很豐盛，但魷魚和大蝦還不錯。飲料很好,"The food is very good, the seafood platter is rich, but squid and prawns are pretty good.Good drink",False
"美味的食物，優秀的員工和極好的氛圍。

每個味蕾都有多種選擇。強烈推薦。","Delicious food, excellent employees and excellent atmosphere.

Each taste buds have a variety of choices.Strongly recommended.",False
酒吧不僅啤酒的選擇很差，雞尾酒也貴得離譜，而且老闆還向我們收取了兩倍的飲料費。當要求央視複查時，損失方謊稱沒用。非常不誠實而且昂貴。逃離這個地方！,"Not only did the bars choose a poor choice, but the cocktail was also outrageous, and the boss also charged us twice the beverage fee.When CCTV was required to review it, the lied party lied that it was useless.Very dishonest and expensive.Escape from this place!",False
環境很好。起司義大利麵很好吃。配上真正的脆培根。他們有多種飲料和小吃可供選擇。,The environment is very good.The cheese Italian noodles are delicious.With a real crispy bacon.They have a variety of beverages and snacks to choose from.,False
Ramos Gin Fizz 好喝，超推,"Ramos Gin FIZZ is delicious, super push",False
1號,No. 1,False
這是一個很棒的地方，有很棒的食物和飲料，重要的是，服務是最好的🔥♥️♥️ …,"This is a great place, with great food and drink. It is important that service is the best 🔥♥ ️ ♥ ️… ...",False
喝酒和享受家庭時光的好地方。,A good place to drink and enjoy family time.,False
茶酒推推～～～～,Tea wine push push ~~~~,False
好的！,OK!,False
好的,OK,False
到酒吧,To the bar,False
