Original,EN,Needs Review
"手寫黑板的字超級可愛～很喜歡
第一次來都是點黑板上面的推薦菜單

肉醬義大利麵$380
後來重新看了日本影片，老闆應該是加入了很大顆的胡椒，對吧(?)
有種沒吃過但是超級配超級對味的感覺

甕仔雞味雞丁燉飯$450
跟先生都不是很愛吃燉飯的人，那天老闆說是限量的，聽到限量就該點一下吧！
整個雞汁與燉飯融合在一起，香濃的起司味，現在想到就流口水🤤
老闆根本是藝術家！

擔心份量不多的各位可以放心，這個份量絕對足夠男性吃飽，很大份","Handwriting blackboard characters are super cute ~ I like it very much
The first time I came to order the recommended menu on the blackboard

Meat sauce Italian noodles $ 380
Later, I watched Japanese movies again. The boss should have added a large pepper, right (?)
There is a feeling that I have never eaten but it ’s super good for it

Sugaki chicken -flavored chicken stewed rice $ 450
I do n’t like to eat stewed rice. The boss said that the day said that it was limited.
The entire chicken juice is fused with the stewed rice, and the fragrant cheese flavor is drooling now when I think of it.
The boss is the artist at all!

Worried that you can rest assured that this portion is definitely enough for men to eat, which is very large.",False
"雖然是酒吧，但實際上是令人驚豔的餐館。

無論是燉飯、鹹派還是義大利麵與漢堡排，通通都有著驚人水準的口感表現。

尤其是培根蛋黃燉飯，真的是一絕。

老闆態度親切、熱情，談到料理更是流露出滿腔熱血的激情，推薦。","Although it is a bar, it is actually a stunning restaurant.

Whether it is stewed rice, Xianpai or Italian noodles and burgers, all the way has an amazing level of taste.

Especially the bacon egg yolk stew, it is really a must.

The boss's attitude is kind and enthusiastic. When it comes to the dishes, it shows the passion of passion, recommendation.",False
電子菜單的設計醜醜／沒有美感。但是上菜整個嚇到欸，超級無敵好吃，口味非常高級！特調飲料也好棒！列為愛店❤️❤️❤️,"The design of the electronic menu is ugly / there is no beauty.But the whole food was scared, super invincible and delicious, and the taste was very high!Special drinks are great!List as love shop ❤️❤️❤️",False
"第一次用餐就很驚艷
超好吃番茄肉醬搭上胡椒
很特別的口感又不會搶掉義大利麵的濃郁
非常值得嘗試看看新品！
整間店也很舒服
品酒還可以賞車！","I am amazed for the first time
Super delicious tomato meat sauce and pepper
Very special taste and will not snatch the richness of the pasta
Very worth trying to see new products!
The whole store is also very comfortable
You can also enjoy the car for wine!",False
"整個林口我最愛的餐廳，沒有之一！
老闆對美食的堅持，令人敬佩👍
想小酌、大酌～老闆最不缺酒精！
絕對可以度過一個難忘的美食體驗🥹","There is no one of my favorite restaurants in Linkou!
The boss's insistence on food is admirable
Want to drink, Detailure ~ The boss is the least lack of alcohol!
You can definitely spend an unforgettable gourmet experience 🥹",False
"特調有驚喜感
食物份量多且美味
店內環境乾淨
推薦👏","Special surprise
Foods are large and delicious
Clean environment in the store
Recommendation",False
"餐點份量很夠又好吃！！（我是一餐可以吃兩個便當的人），和朋友兩個人來，還很貼心的附上對方的酒給彼此喝（說朋友就是要一起喝），時不時還會招待shot❤️❤️
是會繼續回訪的寶藏店（希望多一點人知道但又不希望太多人來的那種心態有人懂嗎🥹","The meal is very delicious and delicious!Intersection(I am a person who can eat two libraries for a meal), and two of them with friends, and I also attached the other party’s wine to drink each other (saying that friends are drinking together), and from time to time, I will entertain shot❤️❤️ ❤️
Is it a treasure shop that will continue to visit (I hope someone knows more people but doesn’t want too many people to come?",False
"調酒非常好喝，可以依據個人喜好特調，老闆親切好聊。我點了一杯西西里咖啡特調，味道令人驚艷，濃郁的咖啡香帶有淡淡的碳培味，非常有特色。
義大利麵味道濃郁，配料很敢給。
甜點超好吃，大勝一堆甜點店。
用餐環境不會吵雜，氣氛很舒服。

整體餐點都有一定水準，可以感覺得出來老闆對於料理很龜毛。
可說是林口第一的酒吧！","The bartender is very delicious. You can talk about the special tone according to your personal preference.I ordered a cup of coffee coffee. The taste is amazing. The rich coffee flavor has a faint carbon flavor and is very distinctive.
The pasta has a strong taste, and the ingredients dare to give it.
The dessert is super delicious, better than a bunch of dessert shops.
The dining environment will not be noisy, and the atmosphere is very comfortable.

The overall meal has a certain level, and you can feel that the boss is very furious about cooking.
Can be said to be the first bar in Linkou!",False
"老闆很nice
老闆特調也很讚，下酒菜拍起來好看吃起來也好讚
下次要專攻老闆的其他餐點🫶🏻","The boss is very nice
The boss is also very good.
Next time I will specialize in other meals from the boss 🫶🏻",False
"喝了調酒很好喝，同桌點了幾樣燉飯和義大利麵都很好吃，醬濃、麵條Q彈不軟爛，口味偏重，很合我們的口味，每個人都稱讚，目前無踩雷品項、雖然不懂重機，但聽老闆講得眼睛都冒星星✨，就算對重機沒興趣，對好吃的食物也要有興趣吧！這間真的不錯，但今天不知道是不是因為下雨客人不多，真心推👍🏻

平常最怕軟爛麵條，但今天吃的都很Q彈、口味也夠香

·蛋黃遇見培根麵_培根焦香酥脆、加上蛋黃更好吃

·松露蝦蝦麵_口味濃郁、香氣足，蝦子也幫你剝好殼了

·松露奶奶牛飯_喜歡松露味的真的必點！

·起司雞翅_我是乾吃炸物派，但這個炸雞上面的起司醬真的特別，平常不愛吃起司，但這個口味層次多的起司醬真的不膩又很香，原本不愛沾醬的我都單吃了好幾口

·甜點🍰巧克力千層蛋糕_鮮奶油順口，皮的部份巧克力也香、提拉米蘇的手指餅乾有沾酒，香氣豐富口感滑順，拍照也好看++兩樣比起來千層略顯普通，更推薦提拉米蘇～

松露系列是我的最愛，聞起來臭、吃起來香😍","It ’s delicious after drinking bartender. I ordered a few stew and pasta at the table. The sauce and noodles are not soft and bad. The taste is very heavy. Although I do n’t know the heavy machine, although I do n’t know the heavy machine, I listen to the boss's eyes and stars. Even if you are not interested in heavy machines, you must be interested in delicious food!This is really good, but today I don’t know if it ’s because there are not many guests.

I am usually afraid of soft noodles, but I eat it today, and the taste is delicious enough.

· Egg yolk meets the bacon noodles

· Truel shrimp noodles_The taste is rich and aroma, and shrimp will also help you peel the shell

· Grandma Grandma Niu Rice_The people who like truffle flavor must be ordered!

· Cheese chicken wings_I am dry -fried pie, but the cheese sauce on this fried chicken is really special. I usually do not like to eat cheese, but the cheese sauce with many levels of taste is really not greasy and fragrant. I did n’t like to dip the sauce.

· Dessert 🍰 chocolate thousands of cakes_The fresh cream is smooth, some of the skin of the skin is also fragrant, Tiramisu's finger biscuits have wine, the aroma is rich and smooth. , Recommend Tiramisu ~

The truffle series is my favorite, smell stinky and tastes fragrant",False
為之驚艷的一家餐酒館，道道都能感受老闆的用心，就連再平常不過的提拉米蘇和現打果汁，也都能感受多層次口感，絕對值得再訪👍🏻開始期待下回的美味了🫶🏻,A stunning dining tavern can feel the boss's intentions. Even the usually Tiramisu and the current fruit juice can feel the multi -layered taste. It is definitely worth visiting again. It's delicious,False
下次一定會來得及在營業時間用餐的😍這次外帶覺得蛋糕很好吃，長島冰茶也很讚，奶酒特調跟琴通寧很特別，這次沒吃到提拉米酥很可惜，不過最好的大概是大家的服務吧！辛苦了等我們好久,"Next time, I will definitely have time to eat at the business hours. This time, I feel that the cake is delicious, and the long island ice tea is also very good. The milk wine is very special with Qin Tongning. It is a pity that I did n’t eat it. But the best is probably everyone's service!Have worked hard for a long time",False
"主餐跟甜點都很精緻好吃，義大利麵味道很獨特！甜點是由專業甜點師專門製作，十分新鮮！
無酒精特調搭配當季水果也很厲害！林口值得常來的好地方！","The main meals and desserts are delicate and delicious, and the pasta is unique!Dessert is specially produced by professional desserters, which is very fresh!
Alcohol -free special tone with seasonal fruit is also very powerful!Linkou deserves a good place!",False
"N訪
每次來都有不同的驚豔
調酒師的特調都超級好喝~
茶酒的香氣十足，酒感完美融合，超級推薦高粱酒特調與甜點特調，謝謝店家還大方的shot 一下！！
店家餐點都是水準之上，味道濃郁CP值超高，推薦松露牛肉及青醬蝦系列！
甜點更是點睛之筆，帶著酒香，完全滿足女孩子的甜點胃~大推提拉米蘇與布朗尼！！
很開心林口終於有這麼高水準的餐酒吧，適合週末來這邊放鬆一下~~","N visit
Every time I come, there are different stunning
The special adjustment of the bartender is super delicious ~
Tea wine is full of aroma, the wine feels perfectly, and it is super recommended by sorghum wine and dessert specialties. Thank you for the store for a generous shot!Intersection
The shop's meals are all above the level. The rich CP value is very high. It is recommended to be a series of truffle beef and green sauce shrimp!
Dessert is the finishing touch, with the aroma of wine, completely satisfying the girl's dessert stomach ~ Push Titramisu and Brownney!Intersection
I am very happy that Linkou finally has such a high -level meal bar, suitable for relaxing here on weekends ~~",False
"這次點了傲椒牛麵、奶綠蝦飯、鹹派、熱美式，餐點真的非常好吃👍👍👏👏
下次再來試試看調酒～
（K軍團車友必須要來） …","This time I ordered Aojiao Niu noodles, milk green shrimp rice, salty, hot American style, meals are really delicious
Let's try the bartender next time ~
(K -Legion riders must come) ...",False
"因為看到櫥窗內的二台重機，想說妹妹應該會很開心。
帶著三位小朋友，還在猶豫要不要問
親切的店員主動過來說明店內消費說明，聽完說明直接入內用餐🍽
附近停車不難，店內整潔，店員很親切，餐後還招待 百香果柚子茶
超級應景時節，更重要的是好喝
餐點都很好吃😋各有特色
值得三五好友過來聚會喔！","Because I saw the two heavy machines in the window, I wanted to say that my sister should be very happy.
With three children, he is still hesitating to ask
The cordial clerk came to explain the consumption instructions in the store.
It is not difficult to park nearby, the store is neat, the clerk is very kind, and after the meal, he also entertains Passion fruit grapefruit tea
Super response time season, more importantly, delicious food
The meals are delicious 特 each has its own characteristics
It is worth coming to the party for three or five friends!",False
"林口為數不多的餐酒館
平安夜當天用餐有小驚喜薑餅屋
薑餅屋裡面還有小紙條
免費抽中shot
老闆跟所有店員都非常親切、態度超好

📌調酒部分

莫斯科騾子有肉桂、八角味
Bartender說不喜歡的話可以事先跟他們說
但這杯完全不像過往喝的莫斯科騾子
並不是經典酒譜裡的配方

我本身不排斥肉桂八角味
但強烈肉桂跟八角味會蓋過薑汁味
同時似乎沒有喝到檸檬的酸味
個人認為檸檬的酸味可以和薑汁味達到平衡
呈現一種清爽的辛辣感
加入了八角和肉桂會讓我想到熱紅酒
就是非常濃烈的香料味
而非莫斯科騾子

同時一般莫斯科騾子在呈現上
會是略滿杯的碎冰（碎冰會稍超過杯緣）
可能我孤陋寡聞 😂
但我覺得這要呈現的視覺效果比較好
不然可惜了銅杯的外觀

國王谷
這杯就調和的不錯
威士忌基酒很厚
顏色也是引人入勝的綠色
（j個就是我要的效果啊～～）
平安夜來杯綠色系調酒再適合不過

📌餐點部分

提拉米蘇👍
推推推～
可能因為是餐酒館
提拉米蘇的蛋糕層濕潤且酒香濃厚
蛋糕頂層還有巧克力碎屑增加口感
不過我認為起司層可以再柔軟一點

鹹派
味道不錯、料很多、派皮脆👌
但我覺得內餡有點太濕潤
切下去會散開
應該可以提高馬鈴薯的比例

義大利麵
點了傲嬌牛、青醬蝦（忘記名字）
看評論大家都說傲嬌牛好吃
由於我不吃牛肉
男友說牛肉品質普通
而我嘗過麵體後覺得
醬汁太稠變得有點像中式炒麵
麵體有點過軟

而青醬蝦的義大利麵也是同樣醬汁過稠
奶香跟青醬香並不突出
花椒粒賦予了特色
但我覺得其實並不太搭
麵體中夾帶了生硬的洋蔥
真的有在吃中式炒麵的感覺 😂

總結：酒、甜點、小食可以","There are one of the few restaurants in Linkou
There is a small surprise gingerbread house on the day of Ping An Night
There are small note in the gingerbread house
Free to get shot for free
The boss and all the clerks are very kind and have a good attitude

📌 📌 📌 📌

Moscow mules have cinnamon and octagonal flavor
Bartender said that if you don't like it, you can tell them in advance
But this cup is not like the Moscow mule you used to drink in the past
Not the formula in the classic winemaking

I do not exclude the flavor of cinnamon
But strong cinnamon and octagonal flavor will cover the ginger flavor
At the same time, it doesn’t seem to drink the sour taste of the lemon
Personally think that the sour taste of lemon can be balanced with the smell of ginger juice
Show a refreshing spicy feeling
Add octagon and cinnamon will make me think of hot red wine
It's a very strong flavor
Not Moscow mule

At the same time, Moscow mules are presented
It will be a slightly cup of broken ice (broken ice will exceed the cup fate)
Maybe I'm ignorant 陋
But I think the visual effect to present is better
Otherwise, the appearance of the bronze cup

King
This cup is well reconciled
Whiskey base wine is thick
Color is also fascinating green
(J is the effect I want ~~)
Ping An Night Cup Cup of Green Mixing is suitable for bartending

📌 meal part

Tiramisu 苏
Push push ~
Maybe because it is a restaurant
Tiramisu's cake layer is moist and strong
The top layer of the cake also has chocolate debris to increase taste
But I think the cheese can be softened

Salty
Good taste, a lot of ingredients, crispy crispy
But I think the filling is a bit too humid
Cut it down and spread it out
It should be able to increase the proportion of potatoes

pasta
Ordered Aojiao beef, green sauce shrimp (forget the name)
See the comments, everyone said that Aojiao Niu is delicious
Because I don't eat beef
Boyfriend said that beef quality is ordinary
And I feel after I tasted the mask
The sauce is too thick and it becomes a bit like Chinese fried noodles
Monad is a bit soft

The pasta of green sauce shrimp is the same as the sauce too thick
Milk fragrance and green sauce are not prominent
Pepper pepper grain given characteristics
But I don't think it's really good
There is a stiff onion in the facade
I really feel like eating Chinese fried noodles 😂

Summary: wine, dessert, snacks can",False
"老闆Nice，基酒下的夠，味道平衡～
排骨酥也處理的乾爽，不會油膩膩
值得再訪","The boss nice, enough wine, balanced taste ~
The ribs are also processed dry and not greasy
Worth visiting",False
"連續來兩天吃飯喝酒。
環境氣氛都很不錯，是理想中餐酒館的調性。

第一天主要是喝酒，有speaical 特調。
甜點的部分，蘋果派好吃，店員還會隨喜好多加肉桂粉，超讚。

第二天來用餐。義大利麵點的是 1.培根遇見蛋黃 2. 浩克很蝦。都很好吃， 醬濃而不膩，份量足夠。","Come to eat and drink for two consecutive days.
The environmental atmosphere is very good, it is the ideal of the ideal Chinese restaurant.

The first day is mainly drinking, with Speaical special.
In the dessert part, Apple is delicious, and the clerk will also add a lot of cinnamon powder.

Come to dine the next day.Italian noodles are 1. Bacon meets egg yolk 2. Hulk is very shrimp.They are all delicious, the sauce is strong and not greasy, and the portion is sufficient.",False
"招牌料理傲嬌牛義大利麵味道特別 香辣好吃
推薦喜歡吃辣的人可以點來試試看
炸物拼盤很划算很大一盤
聽店員說甜點也都是他們自己做的
這次先點了泡芙試試 酥脆好吃也不會太甜

調酒的話bartender很貼心 會主動詢問喜好調出客人喜歡的酒品

店裡整體氣氛不錯服務人員也都很親切
很開心林口又有新的餐酒館/酒吧
會想再回訪試試看其他產品👍","招牌料理傲嬌牛義大利麵味道特別 香辣好吃
Recommend people who like spicy food can click to try it
The frying platter is very cost -effective
聽店員說甜點也都是他們自己做的
這次先點了泡芙試試 酥脆好吃也不會太甜

If you bloom, Bartender is very intimate and will take the initiative to ask you to call out the wine that the guests like

The overall atmosphere in the store is good.
Very happy Linkou and new dining tavern/bar
Will want to visit again and try other products 会",False
"氣氛好 價格合理 老闆服務生都很耐斯
來過十次以上了

就算不來喝酒
這邊的雞翅 義大利麵 燉飯
也都是超高水準好吃😭😭😭","The atmosphere is good and the price is reasonable.
More than ten times

Even if you don't come to drink
Chicken wings here, pasta stewed rice
They are also super high levels and delicious 高",False
燈光美氣氛佳～無菜單的酒真的很神秘～～（ 完全客製化的酒😍）每杯都想嘗試看看！義大利麵也好吃～～～首訪 大推！！！❤️‍🔥❤️‍🔥❤️‍🔥 …,The light atmosphere is good ~ The wine without menu is really mysterious ~~ (Completely customized wine 😍) Each cup wants to try!The pasta is also delicious ~~~ The first visit!IntersectionIntersection❤️❤❤️‍🔥❤️‍🔥 ...,False
"餐點很棒老闆特製的炙燒臭豆腐與花椒蝦，調酒師調酒的白色佳人與百香紅很好喝、環境很不錯，吧台很有喝酒的Fell,廁所也乾淨。","The meal is great, the boss specially made of roasted stinky tofu and pepper shrimp. The white beauty and Bai Xianghong of the bartender are delicious and the environment is very good. The bar is very drinking Fell, and the toilet is also clean.",False
"店內氣氛佳，餐點美味，餐點食材及醬料吃的出來是店家手做用心調製而成，並非是微波醬料包
鹹派和甜點專人手工製作非常好吃
老闆員工健談好聊nice，店內音樂讚","The atmosphere in the store is good, the meal is delicious, the meal ingredients and sauces are eaten by the store's hand to make the heart, not a microwave sauce bag
Hand -made by salty and desserts is very delicious
The boss and employee talks about Nice, and the music in the store is praised",False
餐點很棒，特調很好喝，身心都很放鬆，服務也很到位，值得再來,"The meal is great, the special adjustment is delicious, the body and mind are very relaxed, the service is in place, it is worth come again",False
"氣氛以及跟老闆的互動感覺不錯，餐點也好吃，是間會持續光顧的店。
是的，我又來了，這次測試了老闆新試品我姑且叫它（咖啡奶香），我發現它的香味以及味道是我喜歡的。酷Bon Jovi,對我來說真的是經典。","The atmosphere and interaction with the boss feel good, and the meals are delicious. It is a shop that will continue to patronize.
Yes, I am here again. This time, I tested the new trial of the boss.Cool Bon Jovi is really classic for me.",False
"餐點非常有水準
吧台甜點師傅琪琪也超親切
就算沒喝酒
餐點也可以令人非常滿足
下班後來享用
太幸福了","The meal is very standard
The bar dessert master Kiki is also super kind
Even if you don't drink
Meals can also be very satisfied
Enjoy it after get off work
Too happy",False
輕鬆舒服但老闆對於自己的選材及口味不會馬虎的空間，林口有這樣的地方真的太好了。,"It is easy and comfortable, but the boss does not have space for his own material and taste. Linkou has such a place like this.",False
偶然在臉書看到廣告，感覺是間很酷的餐酒館，果不其然很有個性，點了傲嬌牛、奶綠蝦跟鹹派，味道層次感很好，鹹派也比吃過的好吃，很喜歡的一家店🤍 …,"I saw an advertisement on Facebook by chance. It felt like a cool dining tavern. , I really like a shop 一 ...",False
"酒類品項可舒服可濃烈

餐點份量足味道也很棒

甜點都是自己手工製作

非常適合朋友聚會或一個人放鬆的好地方","The wine items can be comfortable or strong

The meal is also great in weight

The desserts are handmade by yourself

Very suitable for friends to gather or relax a good place",False
"店員熱情招待很多東西～
空間舒適，適合聊天聚會。

烤鳳梨很好吃！招待的小點心😃😃😃
調酒也很好喝～","The clerk enthusiastically entertains a lot of things ~
Comfortable space, suitable for chatting party.

Baked pineapple is delicious!The snacks of the entertainment 点
I am also delicious ~",False
"店內氛圍舒服，餐酒都很不錯
調酒師真是選擇困難的好朋友
說想要的口味跟酒感就可以有一杯好喝的調酒🤤 …","The atmosphere in the store is comfortable, and the meals are very good
The bartender is really a good friend who chooses difficulties
If you say the taste and wine you want, you can have a cup of delicious bartending ...",False
"喜愛喝調酒的人要來，不喜愛喝的更要來！來了絕對愛上❤️❤️❤️
餐點水準之上，屌打相同價位的餐酒館；氣氛絕佳，播放的音樂品味非常優秀；路過經過不要害怕，走進來就對了，不會後悔👍👍👍","Those who like to drink alcohol must come, and they don't like to drink more!I am absolutely fell in love ❤️❤️❤️
Above the meal level, the dining tavern at the same price; the atmosphere is excellent, the music taste is very good; don’t be afraid to pass by, just come in",False
那天我們去剛好還是店試營運期間，老闆也是重機愛好者也大方，店內的所有人員都非常的nice 👍 …,That day we happened to happen to be in the store's trial operation.,False
"薯條很大一份
調酒也都不錯
培根蛋義大利麵喜歡奶味的可以點","French fries are very large
Alcohol is also good
Bacon Egg Embalogy Noodles can be ordered",False
不錯的環境，來這放鬆心情，悠閒的用餐喝酒，也是一種人生~,"A good environment, come here to relax, leisurely dining and drinking, is also a life ~",False
"到處都有Bar，但這兒有的環境氛圍以及餐點不是開玩笑的舒服與好吃啊。
強推，不論是跟朋友或帶客戶可以來享受放鬆的好地方。","There are BAR everywhere, but some environmental atmosphere and meals here are not a joke and delicious.
Forced push, whether it is a good place to relax with friends or customers.",False
列入口袋名單的店，適合好友們小酌，餐點也好吃，老闆手藝好，隨手調都是好看又好喝的調酒。,"The shop listed in the pocket list is suitable for friends to drink, the meals are delicious, the boss's skills are good, and the hand -tuned tone is a beautiful and delicious bartender.",False
味道與質感兼具的餐廳 老闆與酒侍都好厲害！,The restaurant owner and wine waiter with both taste and texture are great!,False
"義大利麵跟燉飯都很好吃，推
辣台牛極推
前面餐點太好吃來不及拍
附上另一個一樣頂的起司雞翅","The pasta and stewed rice are delicious, push
Hot Tower Niu Ji Push
The meal in front is too delicious to shoot
Attach another cheese chicken wings",False
