Original,EN,Positive,Negative,Neutral,Compound
"蠻推薦豆乳雞義大利麵
還有一個季節酒-荔枝口味的
薯條好吃，冷了不會軟掉，蠻厲害的
會想嘗試其他家字母店","Recommended soy milk chicken pasta
There is also a seasoned wine-lychee flavor
The fries are delicious, it will not soften when it is cold, it is quite powerful
I want to try other home letters",0.247,0.0,0.753,0.8464
"食物份量大，味道平衡非常推薦，酒可以請店員推薦，服務非常好會關心餐點合不合口味。
第一次酒吧初體驗感覺超讚","The food is large, the taste is very recommended, and the wine can be recommended by the clerk. The service is very good to care about the meal and the taste.
The first bars' first experience feels great",0.307,0.0,0.693,0.928
"食物和酒覺得都在水準之上
但是沒有到令人難忘
以這個價錢，會預期更高水準","Food and wine feels on the standard
But it's not unforgettable
At this price, it will be expected to be higher",0.0,0.0,1.0,0.0
"有班蘭口味的的調酒味道很有層次， 店員補水補的很勤也很專業的介紹酒！食物真的都很好吃完全無雷！

座位非常舒適音樂大小適中可以聊天，廁所居然還有冷氣！

喜歡調酒跟食物的可以來，大推","The flavor of Banglan flavor is very layered. The clerk is very diligent and professional!The food is really delicious and thunderous!

The seat is very comfortable and the size of the music can be talked about, and there are actually air -conditioning in the toilet!

If you like bartending and food, you can come, push a lot",0.169,0.0,0.831,0.8993
餐點很好吃，當來吃到飽吃都沒啥在喝只喝兩杯。Bartender人都很幽默，還有試飲能喝～,"The meal is delicious. When you eat enough, you have nothing to drink just two glasses.Bartender is very humorous, and you can drink it if you try it ~",0.196,0.0,0.804,0.7645
"台北市提供最優質餐酒服務的連鎖酒吧（餐酒館），店內服務親切，餐點好吃有水準，有別於一般酒吧只提供基本炸物或起司火腿冷盤，A train 的餐點有更全面的選擇，燉飯、義大利麵、水餃etc.餐酒的搭配也很豐富，可以請服務生依據口味、或酒精濃度進行調整或推薦，個人覺得非常的滿意👍！
用餐時間通常需要預定，加收10%服務費","Taipei City offers the best -quality meal and wine chain bar (meal tavern). The service in the store is cordial and the meals are delicious. It is different from general bars that only provide basic fried or cheese ham cold disks. A Train's meals are more Comprehensive choices, the matching of stew, pasta, and dumplings ETC. meals is also very rich. You can ask the waiter to adjust or recommend it based on the taste or alcohol concentration. I personally feel very satisfied!
The meal time usually needs to be reserved, adding a 10%service fee",0.183,0.012,0.805,0.9621
"這個月二訪慶生，補放美食照。
很高興見到Joker。Howard親切打招呼，太厲害的年輕人，竟然記得我們。服務、餐點真的沒話說，有機會再帶朋友們前來。","Visit the birthday of the second month and reserve food photos.
I am glad to see Joker.Howard greets kindly, too powerful young people remembers us.There is really nothing to say about services and meals, and you have the opportunity to bring friends.",0.314,0.0,0.686,0.9382
"朋友提早訂位 可以提早入座
超愛這盤洋芋片❤️
份量多 酥脆現炸 熱熱吃
朋友說酒甜好喝
麵也好吃 出餐快 服務好
吃飽後現金刷卡街口結帳","Friends can book in early reservation
Love this plate of taro chips ❤️
How crispy and crispy is fried hot and hot
Friends say wine is sweet and delicious
Noodles are also delicious to go to meals and fast service
After eating cash, swipe the street entrance to check out",0.316,0.0,0.684,0.9674
"氣氛好💗調酒也粉讚🍹🍸
閨蜜相聚的好地方🙏","The atmosphere is good 酒 bartending is also praised 🍹🍸
A good place where girlfriends gather together 聚",0.333,0.0,0.667,0.8402
"餐點好吃 酒好喝 氣氛佳
但有人喝到吐 有人聊天非常大聲
不太是一個安靜喝酒的地方
整體比較偏美式風格","Meal delicious wine, good, delicious atmosphere, good atmosphere
But someone drinks it so much that someone chats and chats very loudly
It's not a place to drink quietly
The overall aesthetic style",0.235,0.0,0.765,0.765
週末夜的最佳選擇，調酒好喝，餐點好吃，店內氛圍十分鬆弛，讓人可以敞開心胸的談心。,"The best choice on weekends, sake and delicious bartending, delicious meals, and the atmosphere in the store is very relaxed, so that people can open their hearts.",0.469,0.0,0.531,0.9657
"我點的這杯調酒(Every moment)很好喝耶
我跟店員說說想要有茶基底跟果香甜味的酒～

餐酒館真的好貴💸不過這家算還不錯吃
其中最喜歡🔸鮮蝦干貝南瓜泥筆管麵$390
第一次吃到管徑這麼大的筆管麵

店內燈光真的很昏暗
還有上廁所需要等待","The glass of this cup of bartender is delicious
I told the clerk about the wine base and the sweetness of the fruit ~

The restaurant is really expensive but this one is not bad
Among them, I like the pumpkin pipe noodles of the pumpkin pipe of the pumpkin pipe tube noodles
For the first time, I have a pipe surface with such a large diameter

The lights in the store are really dim
There is also a need to wait for the toilet",0.124,0.0,0.876,0.8879
"舒服愉快渡過了一個晚上
除了酒好飲外
薯片很驚喜😝","Comfortable and happy for one night
Except for drinking
Potato chips are very surprising 很",0.439,0.0,0.561,0.8553
"餐點
📍當天點了雞翅、烘蛋和炸物拼盤，個人覺得雞翅可點，烘蛋雖然不錯但是偏貴～（長得很像起司披薩）（吃起來也很像）
📍調酒部分，可以直接依照個人喜好跟店員點，他會直接推薦貼心得斯，但葡萄冰茶個人覺得沒什麼酒感（有說希望酒感重）有點可惜。

有關於店
📍入口在1樓宮廟的旁邊，有明顯的招牌可以走到2樓，店內氣氛佳，環境偏暗，比起喝酒更適合三五好友相聚聊天，但因為有時間限制，建議還是平日來比較好～比較久未見很多話的話啦（雖然不知道平日有沒有限制）
📍有個店員很可愛。","Meal
翅 On the day, I ordered chicken wings, roasted eggs, and fried pingles. I personally think that chicken wings can be ordered.
依 The section of the section can be directly based on personal preferences. He will directly recommend intimateness, but grape ice tea personally feels that there is no sense of alcohol (there is a sense of hope). It is a pity.

Related to the store
The entrance is next to the palace temple on the 1st floor. There are obvious signboards to go to the second floor. The atmosphere in the store is good and the environment is dull. It is more suitable for three or five friends to meet with friends. Okay ~ I haven't seen a lot of words for a long time (although I don’t know if there are restrictions on weekdays)
爱 There is a clerk very cute.",0.145,0.054,0.8,0.9468
"餐點好吃服務佳
青醬雞肉薄餅大推
水餃也很讚
環境稍顯吵雜然後有人喝到吐有點可怕","Good meal is delicious service
Green sauce chicken cake big push
The dumplings are also very good
The environment is slightly noisy and someone is a bit terrible when someone drinks it",0.235,0.14,0.625,0.7172
"餐點好吃，份量十足。適合正餐也適合宵夜。
不吃東西，小酌也很棒。","The meal is delicious and the portion is full.Suitable for dinner is also suitable for supper.
Don't eat, and it's great.",0.291,0.0,0.709,0.8316
室內的氣氛真的很棒，調酒都很在品質內，這次試點了草莓版的long island ice tea真的很特別，保有濃濃的酒精但多了一股少女味，朋友點了滿滿鳳梨味的ingrid，也超級好喝，很適合妹的調酒。餐點部分我覺得蠻好吃的，但朋友都覺得口味偏鹹，沙拉跟義大利麵很好吃，只是豬腳有點太柴不推，雞翅是每次來必點 好吃好吃~~ 店內用餐人數每次來都滿滿滿，有限制用餐時間，雖然有3小時但還是覺得喝到正嗨的時候，要讓位出來有點扣分，其他整體來說都很滿分，朋友來台北都會帶他們來，期待下次到訪,"The atmosphere of the indoor is really great. The bartending is very intra -quality. This time I tried the strawberry version of the Long Island Ice Tea. The pineapple -flavored Ingrid is also super delicious, which is very suitable for sister's bartending.I feel pretty delicious, but my friends feel that the taste is salty. The salad and the pasta are delicious, but the pig's feet are a bit too good. The number of people in the meal is full every time, there are restrictions on dining time. Although there are 3 hours, they still feel that when they drink Zheng Hi, they need to make a bit deducted. Take them, look forward to the next visit",0.198,0.0,0.802,0.9762
"Susan非常好喝，酒感足好入口，一杯下去立刻有微醺感，CP值高，大推。
青醬牛小排麵，麵體掛上許多醬汁，超好吃，份量稍微有點少。
雞翅重口味，下酒神器，海鮮炸物拼盤也是喝酒良伴。
沙發區位置舒適，整體來說是會再訪的店家！結帳還可以刷卡，讚👍","Susan is very delicious, the wine feels good and the entrance is good. A cup is immediately slightly sloppy, the CP value is high, and pushing.
Green sauce beef noodles, many sauces hanging on the face, super delicious, a little bit of weight.
Chicken wings are heavy, and wine artifacts, seafood frying platter is also a good companion.
The location of the sofa area is comfortable, and the store will be visited as a whole!You can also swipe your card at checkout, like it",0.277,0.0,0.723,0.9814
"提早訂位時已告知人數（8-10人），店家也告知會安排兩張大沙發座位給我們！
到店時才得知位子被分成三區（如下圖），週五晚上快樂來喝酒座位莫名被改成這樣 也沒有提早告知
只能說做生意的不能這樣，真的有被欺騙的感覺","The number of people (8-10) has been informed at the early reservation, and the shop also informed that two large sofa seats will be arranged!
When I arrived at the store, I learned that the seat was divided into three districts (as shown below), and I was unreasonably changed to a happy drinking seat on Friday night.
It can only be said that it is not like this to do business, it really feels deceived",0.061,0.068,0.87,-0.1482
"主題雖然是列車，但除了酒單設計成列車式調酒，其他地方看不出來有列車元素。
餐點雖然好吃，但覺得單價有點太高。
🍴醬燒土雞翅好吃
🍴金盞花蛤蜊土雞湯風味不重，很解酒，好喝

酒的部分原本看酒單覺得也很貴，但送來都超大一杯的
🍹奇異果特調：Vokda基底bartender 問我要淡還是濃，我說淡，結果喝起來比預想中濃很多，但有令我驚豔的好喝，喝得到奇異果顆粒，蠻有誠意的。
🍹Grandpa’s tea party：加了苦精的普洱茶，覺得又烈又苦，喝不下去。
🍹Passion fruit Mojito：超級大一杯，薄荷味很重，百香果味反倒沒有很突出。

整體來說，酒的品質不穩，最後看到帳單有嚇到，蠻貴的～
裝潢算美式，讓我印象深刻的是廁所裝了一台冷氣，而且開21度","Although the theme is a train, except that the wine list is designed as a train -style bartender, there are no train elements in other places.
Although the meal is delicious, I think the unit price is a bit too high.
好 Boiled soil chicken wings are delicious
蜊Chudai clams and chicken soups are not heavy, very drinking, delicious, delicious

The wine part was originally expensive to watch the wine list, but it was all a large cup.
： 调 🍹 🍹: VOKDA base Bartender asked me to be light or thick. I said it was much stronger than expected, but it was amazing and delicious, and it was quite sincere.
Grandpa ’s Tea Party: I added Pu'er tea with bitter essence, I felt strong and bitter, and I couldn't drink it.
FPassion Fruit Mojito: A super large cup, the mint flavor is very heavy, and the flavor of the passion is not very prominent.

Overall, the quality of wine is unstable. Finally, I saw that the bill was scared, and it was quite expensive ~
The decoration is American -style, which impressed me that the toilet was installed with air -conditioning and opened 21 degrees.",0.198,0.076,0.726,0.986
"這家真的給他100分👏👏
數字系列的酒吧！這家是A！果然是優等👍👍
先來說說環境！這種挑高的感覺我很喜歡！沙發坐起來很慵懶，很適合喝個幾杯！
酒類就更棒了！服務人員太會介紹了！我們的需求他一一為我們做出想要的酒！而且都好好喝喔！真的很厲害耶👍👍
餐點也是！好好吃喔！和風炸雞，炒香菇，雞軟骨，烘蛋等等！都很不錯耶！超級強的！
我一定會再來光顧的！這家真的很值得來！棒棒棒👏👏👏","This one really gives him 100 points 他
Digital series bar!This is A!Sure enough
Let's talk about the environment first!I like this high feeling!The sofa is very lazy, it is very suitable for drinking a few cups!
The wine is even better!The service staff will introduce too much!Our needs he make the wine we want one by one!And it's all good!It's really amazing Jean
Means!It's so delicious!And frying chicken, fried shiitake mushrooms, chicken cartilage, roasted eggs and so on!It's all very good!Super strong!
I will definitely visit again!This one is really worth coming!Batt",0.165,0.026,0.809,0.9292
"愛店之一✨餐點很推青醬雞肉薄餅❤️
酒水部分可以給bartender 客製，每次都能喝到不一樣的滋味，也可以從A train 一路喝到東村🤣但要先有心理準備🤣","One of the love shops ✨ meals are very pushing green sauce chicken pork ❤️
The drinking part can be used for BARTENDER, and you can drink a different taste every time. You can also drink from A Train to Dongcun 🤣 🤣",0.212,0.0,0.788,0.9169
"👉低消600元👈
18:00開始營業 位置先滿了一半😂 生意有夠好
酒類是真的蠻貴的！ 但真的很好喝
我點酒味不重的芒果🥭甜甜的感覺 ～好好喝！
有點微醺的感覺！很特別的是還有附小條的甘蔗、芒果小塊果粒，清爽又解膩！

整體來說酒類比餐點優  餐點比較普通一點
用餐三小時 但這裡的氛圍非常棒～❤️❤️

題外話！菜單酒類都是！英文哈哈哈哈哈哈
英文超破只看得懂beer 😂😂😂
欺負poor 英文的人","👈 low 600 yuan 6
At 18:00, the business location is half full. The business is good enough
The wine is really expensive!But it's really delicious
I order the mango with the taste of wine, the sweet feeling ~ delicious!
A little sloppy!It is very special that there are small sugar cane and mango small pieces of fruit, refreshing and greasy!

On the whole
The meal for three hours but the atmosphere here is great ~ ❤️❤️

Title out of words!Menu wine is all!English ha ha ha ha ha ha ha
English super broken can only understand beer 😂😂😂
Bullying Poor English",0.34,0.123,0.537,0.9907
"店內的酒單都是店家自己取名的，看不太懂可以先點餐點再向店員或是bartender詢問推薦的調酒，也可以直接說自己想要的風味讓bartender去調。 朋友點的酒後來覺得太甜，bartender也會調整甜度。
🔸鮮蝦干貝南瓜筆管麵: 要趁熱吃，南瓜味很香，推薦可一試
🔸烘蛋: 中心有放起司、培根和小干貝數個，個人覺得蠻適合配酒?!
🔸酥炸五香黑毛豬: 搭配辣醬和洋蔥很涮嘴，但外皮稍微炸有點硬

有限時，可刷卡 #0909","The wine lists in the store are named by the store themselves. If you don't understand, you can order meals before asking the clerk or Bartnder to ask the recommended bartender. You can also directly say that the flavor you want will let Bartnder call.The wine made by my friend later felt too sweet, and Bartender would adjust the sweetness.
瓜 Fresh shrimp dried scallop pumpkin pen tube: To eat it while it is hot, the pumpkin taste is very fragrant, it is recommended to try it
放 Baked eggs: There are several departments, bacon and scallops in the center. Personally, I think it is quite suitable for wine?!
黑 Crispy fried Wuxiang black hair pig: It is pouting with spicy sauce and onion, but the skin is slightly frying a bit hard

When limited, you can swipe the card #0909",0.082,0.027,0.892,0.63
"A train leads the way to jazz
在八德路上的A train，自2011年經營到現在，仍然屹立不搖！身旁朋友都推薦，今天來一探究竟🤗🤗

◽️蒜香海鮮細扁麵🌶️（可選不辣）340💰
改不辣之後剩下辛香料的微辣感，海鮮包含小卷、魚肉、淡菜*2、鮮蝦*3 麵吸了湯汁，吃起來不單調！ 4.6顆🌟
◽️阿嘉燉飯350💰
加了鹹蛋黃、烏魚子譜出的美妙風味，燉飯很香，裡面還有一顆干貝、櫛瓜、香菇…
4顆🌟
◽️炸魚薯條
炸魚兩大塊！超大塊擺滿盤子🤭
不用擠檸檬就已經有黑胡椒粉調味，外皮酥脆，肉嫩到一切開就跟皮分開了😋
提供兩種醬（塔塔+番茄醬） 4.5顆🌟

酒單很多頁，我們直接請店員介紹
喜歡偏甜微酸口感
🍹Anita sour（草莓🍓）
偏苦，待冰塊融化之後，草莓的甜度在杯子裡化開。酒感4/5顆🌟
🍹She is so fine(鳳梨冰茶）
茶酒表現超讚！ 選鳳梨口味，喝起來也不會像草莓這杯苦苦的，上面還有炙燒焦糖鳳梨切片！推薦！ 酒感3/5顆🌟

墨魚燉飯佐酥炸牡蠣390💰
胡麻牛小排青醬水管麵420💰
-Merry Berries ~380💰
Guava Lover 380💰
l'm Awake Tonight380💰
炸魚薯條佐塔塔醬390💰","A Train Leads The Way to Jazz
A Train on Bade Road has still been standing since its operation in 2011!Friends are recommended by my friends. Let's find out today.

鲜 ️ Fine flat surface of garlic seafood 🌶️ (optional is not spicy) 340💰
After changing the spicy spicy spicy spicy spicy, seafood contains small rolls, fish, light vegetables*2, fresh shrimp*3 aspects of sucking soup, not monotonous!4.6 颗 颗
5️ Aga stewed rice 350 阿
Add the wonderful flavor of salted egg yolk and mulleton. The stew is very fragrant. There is also a scallops, gourd, shiitake mushrooms ...
4 🌟
条️ Fried French fries
Two big pieces of fried fish!Super big pieces are covered with plates 满
Without squeezing lemon, there are already black pepper powder seasoning. The skin is crispy, and the meat is so tender that it is separated from the skin.
Provide two kinds of sauce (Tata+tomato sauce) 4.5 🌟

There are many pages of wine, we directly ask the clerk to introduce
Like sweet sour taste
UAnita Sour (Strawberry 🍓)
Better, after the ice cubes melt, the sweetness of strawberries is opened in the cup.Wine 4/5 5 5 5 5
OShe is so fine (pineapple ice tea)
Tea wine performance is superb!Choose the taste of pineapple, and it will not drink it like a strawberry cup. There are also burning caramel pineapple slices on it!recommend!Wine feeling 3/5 5 5 5

Cordfish stewed rice fried oysters 390 鱼
Small cow small row green sauce pipe noodles 420 胡
-Merry Berries ~ 380 -
GUAVA LOVER 380💰
l'e tonight380💰
Fried French French Order Dagata Sauce 390",0.123,0.007,0.87,0.9864
調酒很棒，葡萄聽說是鎮店之寶，但是我的喜歡順序是荔枝>芭樂>葡萄>葡萄柚茶酒，食物蠻好吃的，點了炸牡蠣燉飯、炒菇、烘蛋都好吃，氣氛很好，適合聊天,"The bartending is great. Grapes heard that it is the treasure of the town shop, but my favorite order is lychee> Bara> Grape> grapefruit tea wine, the food is pretty delicious, ordered fried oyster stew, fried mushrooms, roasted eggs, roasted eggs They are all delicious, the atmosphere is very good, suitable for chatting",0.368,0.0,0.632,0.9815
適合朋友聚會聊天的場所！服務人員親切！調酒好喝、餐點也好吃，庸懶的沙發椅舒服😌,"Suitable for friends to meet and chat!The service staff is kind!The bartending is delicious, the meal is delicious, and the lazy sofa chair is comfortable.",0.39,0.068,0.542,0.9167
可以刷卡，建議用餐前先訂位尤其五六日位子都滿滿的。餐點的部分都很好吃，目前還沒踩到雷😂每次來都會爆點！調酒的部分可以請店員依據你喜歡的口味推薦，酒味重、甜、酸、茶味、水果味的都可以請店員協助👍🏼店員也都很親切很好聊！7個人吃了8000多，還算可以的價位,"You can swipe the card. It is recommended to book a place before dining, especially the five or six days is full.The part of the meal is delicious. At present, I have not stepped on Lei 😂 every time I come!For the bartending part, you can ask the clerk to recommend it according to your favorite taste. Those who have heavy wine, sweet, sour, tea, and fruit flavor can ask the clerk to help the clerk are very kind and good!7 people ate more than 8,000 people, and the price is okay",0.233,0.017,0.751,0.9744
"當天北上與朋友一起吃晚餐，第一次到這間店，生意真的很好👍！
聽說是很多分店的第一間店，而且每間分店的氛圍都不同，下次還要去踩點其他間！
也久違的喝了杯調酒，店員會詢問喜歡的口味來幫你做搭配，但因為個人口味不同的關係，我覺得剛入口是清爽的妹酒，但吞下去後酒味會突然衝上來，會有點嚇到，確實真的不是妹酒😅
餐點的部分與朋友分食，兩個女生點這樣我覺得還算剛好，而且都沒有踩雷，當天點的都很好吃😋！
每一道都非常喜歡！推薦可以去吃晚餐，但酒類因人而異，記得要先訂位。","I went north to have dinner with my friends on the day. For the first time I arrived at this store, the business was really good!
I heard that it is the first store in many branches, and the atmosphere of each branch is different. Next time, I have to step on other rooms!
I also drank a cup of wine for a long time. The clerk would ask your favorite taste to help you match, but because of the different relationship between personal taste, I feel that the entrance is a refreshing girl wine, but after swallowing, the taste of the wine will suddenly rush up. It will be a bit scared, it is really not a girl wine 😅
Part of the meal part of the meal with friends. I think the two girls are just right, and they are not stepping on the thunder. They are delicious!
Everything likes it very much!It is recommended to go to dinner, but the alcohol varies from person to person. Remember to order first.",0.141,0.019,0.839,0.9721
酒類都還蠻不錯的，如果不知道喝什麼調酒可以問服務生他們的建議都還蠻棒的今天點了四杯酒都忘了拍照片，但都蠻好喝的也不貴,"The wine is pretty good. If you don’t know what to drink, you can ask the waiters to ask their suggestions. Today, I ordered four glasses of wine to forget to take photos.",0.161,0.05,0.789,0.6369
"Signature比想像中還好
也可以試試bartender客製化的調酒
還有同行友人說mocktail也不錯
食物比外面許多餐廳好吃倒是意外之喜
下次會想試試classic","Signature is better than expected
You can also try Bartender's customized bartending
There are also friends who say Mocktail are also good
Food is better than many restaurants outside.
I would like to try classic next time",0.309,0.0,0.691,0.9231
"調酒以水果、茶香、威士忌為主，可以告知店員喜歡什麼果香、偏酸偏甜、酒感什麼程度，店員會推薦，食物的部分真的蠻優，搭配調酒很喜歡💕
第4次來訪，一直都很喜歡A Train的調酒，但這次的調酒就算要求不要太甜的都偏甜，好像是因為新進的人員比較多，所以調酒的平衡度跟前幾次來訪有比較不穩定。
蒜味海鮮義大利扁麵調味不ok，沒有蒜香味，另外點了一道3根辣椒的餐點（辣炒海鮮小蘑菇🌶️🌶️🌶️）真的很辣！夠味！
期待下次可以喝到一如往常水準的A train調酒。 …","The bartending is mainly based on fruits, tea aromas, and whiskeys. You can tell the clerk what fruit aroma, acidity and sweetness, and wine feel is recommended. The store will recommend it.
For the fourth visit, I always liked A Train’s bartending, but even if the bartender required not to be too sweet, it seems that because there are more people in the newly entered, so the balance of bartender is followed by the previous few times. The visit is relatively unstable.
The flavoring of garlic seafood Italian flat surface is not OK, there is no garlic aroma, and also ordered a meal of 3 peppers (spicy fried seafood mushrooms 🌶️🌶️🌶️) It is really spicy!Enough!
Looking forward to the next time you can drink A Train, which is as usual.Mowing",0.08,0.041,0.878,0.5696
