Original,EN,Positive,Negative,Neutral,Compound
"調酒每一杯都十分有特色！完全沒有令人作噁的糖漿感，甘蔗攪拌棒很可愛也很環保，不時會拿起來啃😂

餐點怎麼點都沒有雷，很優秀的一間酒吧！

唯一小缺點是同一桌人若超過六人，位子會顯得很擁擠😅","Every cup of bartending is very distinctive!There is no disgusting syrup at all, the sugarcane stirring stick is cute and environmentally friendly, from time to time, I will pick it up

There is no thunder in the meal, a very good bar!

The only small disadvantage is that if there are more than six people at the same table, the seat will appear crowded.",0.184,0.066,0.75,0.8409
字母系列酒吧裡的最愛😍老派復古的裝潢風格，搭配爵士樂整個氣氛超chill超愛…餐點跟調酒好吃好喝，給的份量也都很有誠意🤤和朋友不知道去哪喝酒時就又會默默的回到這裡…,"The favorite of the old -fashioned decoration style in the letters of letters, with the whole atmosphere of jazz music super love ... meals and bartender are delicious and delicious, and they are very sincere. Will return here silently ...",0.387,0.0,0.613,0.9701
來到數不清的次數，台北我最愛火車～每次來都有種回家的感覺～食物調酒從不讓人失望！尤其我愛水餃愛慘了！我帶過太多人來，一開始大家都問號為何我點水餃🥟，吃過之後都懂～但其實每一道都很好吃👍🏻值得每一道都嘗試🥰 …,"When you come to countless times, I love the train most in Taipei ~ Every time I come, I feel like going home ~ Food bartending is never disappointing!Especially I love dumplings and love!I have brought too many people. At the beginning, everyone questioned why I ordered dumplings. After eating it, I knew it after eating ~ But in fact, every one is delicious.",0.137,0.078,0.784,0.8074
A Train系列吃了不少家，現在終於來創始店用餐，整體還是一樣昏黃慵懶的風格，搭配價位實在、份量大的餐點和酒，炸魚薯條不錯吃又大份，酒的部份琴酒基底的莓果特調是今天最滿意，其他的像草苺、哈蜜瓜vodka也不錯，友人點的White Negroni也有水準！,"The A Train series has eaten a lot of homes, and now I finally came to the founding shop for dining. The overall is still the same yellow and lazy style. The berry of the piano wine is the most satisfied today. Others like strawberries and Honeydel Vodka are also good. White Negroni, a friend ordered, also has a level!",0.172,0.036,0.792,0.8585
"低消$600+10%服務費
食物好吃，反而酒類沒有特別順口。
沙發區很矮，沙發很軟不太舒適，環境吵鬧聊天偏費力。
廁所乾淨，跟朋友一同聚餐很歡樂。","Low -eliminate $ 600+10%service fee
The food is delicious, but the alcohol is not particularly smooth.
The sofa area is very short, the sofa is very soft and not comfortable, and the environment is noisy.
The toilet is clean and the dinner with friends is very happy.",0.248,0.114,0.638,0.8856
"非常推薦的酒吧！
該酒吧是系列酒吧，有A-F數間分店在台北各處。
個人覺得A Train的環境蠻大的，桌間距離也相當足夠。
店員及Bartender都相當仔細介紹酒，每杯調酒也都相當也份量並且相當好喝。
很推薦他們以茶為基底的調酒，不會苦澀但又帶有茶香。
菜色部份非常推薦它們的酪梨雞肉沙拉。他們把沙拉包的像蝦鬆一樣加上莎莎醬，不僅好入口也很協調。
生菜蝦鬆的部分也非常優秀。蝦子是整隻的小蝦仁，配料也很優秀。
整體而言是餐點、調酒跟環境都很優秀的一間酒吧。","Recommended bar!
The bar is a series of bars, with A-F several branches around Taipei.
I personally think that the environment of A Train is quite large, and the distance between the table is quite enough.
The clerk and Bartender both introduced the wine very carefully, and each cup of bartender is quite weight and is quite delicious.
It is recommended that they use tea as the base, which will not be bitter but also with tea fragrance.
The dishes are very recommended for their avocado chicken salad.They added Sasha sauce like shrimp pine, not only good entrances but also coordinated.
The part of lettuce shrimp pine is also very good.Shrimp is the whole small shrimp, and the ingredients are also excellent.
Overall is a bar that is excellent in meals, bartender and environment.",0.162,0.02,0.817,0.9614
酒ㄧ樣水準  🤣🤣🤣 必須多來,The wine -like level 来 must be more,0.263,0.0,0.737,0.3612
"嚇死 竟然有餐酒館的 餐跟酒都做到滿分💯
（是真的可以來吃飯的那種 而且好好吃！）
蘆筍跟蟹肉炒得非常的嫩 而且調味很用心
吃得出來小辣的刺激 但不會太辣真的是提個香氣而已 份量足夠 可以點！

南瓜干貝筆管麵 麻煩給我點下去！🎃
冷掉了也一樣好香好濃
筆管麵是偏寬大的已經先加分了
在熟度方便也掌控都很好
不然有些吃起來很像在吃塑膠水管

烤牛肉串很像橙汁排骨的調味 牛肉很嫩 很讚
炸起司條中規中矩 但來餐酒館不成文規定就是一定要點個炸物（？） 芥末醬調的不錯

酒的部分我喝的是Kirin II (?
荔枝跟vodka 不確定是否有加濃 但酒感很重而且又大杯
應該會有很多人喝完這一杯就會掰掰
荔枝很香 而且上面的荔枝好吃 甘蔗也好吃！","A frightened meal and wine in the dining tavern are full.
(It is the kind that can really come to eat and delicious!)
The asparagus and crab meat are very tender and the seasoning is very careful
It can be eaten by the stimulus of Xiaoma but it is not too spicy. It is really a aroma.

Pumpkin pipe tube noodles are troublesome to order me!Bleak
It's so cold that it is so fragrant and strong
The pen tube surface is wide and the points have been added first
It is well controlled in convenient cookedness and is very good
Otherwise, some taste like eating plastic water pipes

Roasted beef skewers are very tender like orange juice ribs.
Frying the Division is quite satisfactory, but the restaurant without writing stipulates that you must order a fried material (?) The mustard sauce is good

I drank Kirin II part of the wine part (??
Lychee and VODKA are not sure if there is a strong but strong, the wine is very heavy and the big cup is
There should be a lot of people who will take this cup and they will be stunned
Litchi is very fragrant and the lychee on it is delicious and delicious!",0.21,0.042,0.749,0.9928
"餐點跟酒都很不錯
氣氛也很棒 🥰","The meals and wine are very good
The atmosphere is also great 很",0.399,0.0,0.601,0.807
"酒吧 ABCD四家店都去過，食物都很好吃。酒吧的主角調酒的表現更是讓人驚豔，不論是各種水果調酒、威士忌調酒、酒精濃度的高或低，店員都非常有耐心的說明及介紹，成品也都讓人滿意！服務速度也非常快。
其中 A Train 的環境是我個人最喜歡的，適當的座位間距，微亮的燈光，讓人放鬆的 Jazz音樂，適合三五好友一起閒聊話家常，值得推薦！","The four stores of Bao BCD have been there, and the food is delicious.The protagonist of the bar's bartender is even more amazing. Whether it is a variety of fruit alcohol, whiskey bartender, and the high or low alcohol concentration, the clerks are very patient with explanation and introduction, and the finished products are also satisfactory!The service speed is also very fast.
Among them, the environment of A Train is my personal favorite. The appropriate seat spacing, slightly bright lights, the relaxed Jazz music, suitable for three or five friends to chat together, it is worth recommending!",0.167,0.019,0.814,0.9467
"東西好吃
每次來必點炸魚薯條 還有辣味雞翅
這次還多點了水餃跟海鮮薄餅
覺得每樣都好吃！推薦大家必點這幾道
水果是特調玫果雞尾酒
搭配點心一覺推薦！","What is delicious
Every time you come, you must order fried fish and potato strips and spicy chicken wings
This time, there are more dumplings and seafood pancakes
I think it's delicious everywhere!Recommend everyone must order these a few
Fruit is a special rose cocktail
Recommended with snacks!",0.219,0.028,0.753,0.8977
"感覺很棒 氣氛很好的酒吧
Susan喝起來很厲害 滿滿葡萄味 外加一支甘蔗 跟檸檬很清爽！","It feels very good atmosphere
Susan is very good to drink grape flavor plus a sugarcane and lemon very refreshing!",0.271,0.0,0.729,0.7703
很有氣氛的餐酒館，點了兩杯調酒，口感上都是不錯的，還有點了墨魚燉飯和炸薯條，都是不錯吃，生意很好，人蠻多的。很適合朋友小酌的地方🙂,"The atmosphere of the meal tavern has two cups of bartending, the taste is good, and there is a little cuttlefish stewed rice and fries. They are all good. The business is very good and there are quite a lot of people.Very suitable for friends to drink 小",0.216,0.0,0.784,0.902
菜色都很好吃，豬腳超美味，酒也可以依照個人口味調整，整體氣氛都很棒，人少人多都適合！一人點一杯酒，平均分攤菜錢的話，人均大概在7-800左右。,"The dishes are delicious, the pig's feet are super delicious, and the wine can also be adjusted according to personal taste. The overall atmosphere is great.If one person ordered a glass of wine, the average per capita is about 7-800.",0.234,0.0,0.766,0.9062
餐點好吃，服務人員一般親切,"The meal is delicious, and the service staff is generally kind",0.441,0.0,0.559,0.7964
"再訪

Woman’s talk!!!!!
女孩兒們的聚會～喝起來❤️
#爐烤脆皮豬腳
#鮮蝦干貝南瓜泥義大利水管麵
#義式干貝鮮蝦蘑菇沙拉
#蒜香炒野菇
#調酒 #餐酒館 #中山區

———————————
#草莓長島冰茶
#百香果白酒（好喝，喜愛酸味的建議）
#炸魚薯條佐塔塔醬
#松露時蔬煙燻花枝
#椒麻迷迭香雞翅

環境舒服。適合週末小酌","Visit

Woman ’s talk !!!!!
Girls' gatherings ~ Drink ❤️
#Crispy skin pig feet
#Fresh shrimp dried shellfish pumpkin mud Italian water pipe noodles
#Fresh shrimp mushroom salad
#Fried wild mushrooms
# # #Zhongshan District

—————————————————
#
#(Delicious, advice to love sour flavor)
#
#
#Rosemary chicken wings

The environment is comfortable.Suitable for weekend drinks",0.208,0.0,0.792,0.9283
"口味甚好，服務親切，氛圍自在。
在地用餐推薦。","The taste is very good, the service is kind, and the atmosphere is free.
Recommended dining on the ground.",0.438,0.0,0.562,0.8932
"不知道點什麼酒可以請bartender 推薦
食物搭配酒剛剛好
環境氛圍不錯","I don’t know what wine can be asked for Bartender to recommend
Food with wine is just right
The environmental atmosphere is good",0.205,0.0,0.795,0.6597
"廁所乾淨（還有冷氣好讚）
食物好吃
喜歡A的氛圍～","The toilet is clean (and the air -conditioning is so good)
Food is delicious
The atmosphere that likes A ~",0.447,0.0,0.553,0.9176
"餐點美味，急著吃都忘了拍照😜
只記得拍調酒🍹🍸
是個適合跟朋友喝一杯🍷或是慶祝多喝兩杯的地方👍👍👍","The meal is delicious, I am anxious to eat and forget to take pictures 😜
Just remember to shoot alcohol 拍
Is it suitable for drinking a cup of 🍷 or celebrating two more cups with friends 👍👍👍",0.185,0.109,0.706,0.7553
食物好吃，調酒菜單是英文的，不懂或是需要推薦都可以詢問店員。氣氛很好，唯一就是燈光有點昏暗看不清楚菜單😅 …,"The food is delicious. The crooked menu is English. If you don't understand or you need to recommend, you can ask the clerk.The atmosphere is very good, the only thing is that the light is a bit dim and can't see the menu ...",0.186,0.0,0.814,0.8553
酒好喝，食物有特色也好吃，服務態度很讚😎,"The wine is delicious, the food is unique and delicious, and the service attitude is great.",0.469,0.0,0.531,0.91
"氣氛超棒的piano bar🍻
很適合三五好友與情侶來小酌聚會
用餐時間座無虛席，記得先電話訂位避免久候
每人低消 $500~

調酒的酒單，super多選擇🥃🍷🍶
幸好服務生會依顧客口味
量身推薦調酒，選擇障礙福音！

點了兩杯水果風味的調酒🍹🍸🥂
都有水果本人跟一根甘蔗當攪拌棒！？
真滴蠻特別的
熟食有快炒/炸物/串燒等等
也都很好吃，很下酒！","Piano Bari, which has a great atmosphere
Very suitable for three or five friends and couples to have a drinking party
The dining time is no seat, remember to call for a long time to avoid waiting for a long time
A low -level per person is $ 500 ~

The wine list of bartending, super choice 🥃🍷🍶
Fortunately, the waiter will depend on the customer's taste
Recommended bartending, choose the gospel of obstacles!

Ordered two glasses of fruit -flavored bartending 🍹🍸🥂
There are fruits to stir with a sugar cane!Intersection
True is pretty special
Cooked foods include fast fried/fried objects/skewers, etc.
It's also delicious, very wine!",0.205,0.065,0.731,0.9673
"二訪更新
這次是自己去的，問了有沒有一個人的位置，店員說可以坐一個小時8點到9點，結果餐點跟酒約8:30上，而8:48店員跑過來跟我說下個客人已經到了請問離開⋯⋯餐點跟酒到我面前20分鐘不到，飯也沒吃完、酒也沒喝完。

以下是一訪：
臨時起意才跑來的，還好有約到吧台的位置
A train系列的調酒果然都不會讓人失望，susan酒感夠
唯一美中不足的地方是當天點的海鮮義大利麵（忘記正確名稱😅）沒有鹹味，應該是忘記加鹽⋯？但跟店員反應還是能調整的
人潮很多建議大家沒訂位的話起碼先打來確認現場候位狀況～","Two visit updates
This time I went to myself. I asked if there was a person's place. The clerk said that he could sit at 8 o'clock to 9 o'clock an hour. As a result, the meal was about 8:30 with wine, and 8:48 The clerk came over to tell me to tell me about me. When the guest has arrived, I would like to leave. I left for less than 20 minutes in front of me. I did n’t finish the rice and did n’t drink the wine.

The following is a visit:
I just came to the temporary intention. Fortunately
A Train series of bartending is really not disappointing, Susan's wine feels enough
The only thing that is in shortness of beauty is that the seafood pasta (forgotten the correct name 😅) that day has no salty taste, should it be forgotten to add salt?But reaction to the clerk can still be adjusted
Many people suggest that if you do n’t reservation, at least first to confirm the waiting situation at the scene ~",0.062,0.038,0.9,0.7584
"調酒好喝👍服務員可以根據你喜歡的味道會幫忙推薦～
喜愛酸的可以點Sour或是Take it easy,Vivian
喜歡酒感重烈一些的推薦For men和Kyoto
Kyoto喝起來非常清爽！真的超級推薦
餐點的薯條也很好吃，搭配三種醬料其中芥末醬很特別!!","Blooming and delicious 👍 The waiter can help recommend it according to your favorite taste ~
You can order sour or take it easy, vivian
Recommended for some of the heavy wine feel for Men and Kyoto
Kyoto is very refreshing!Really recommended
The fries of the meal are also delicious, with three kinds of sauces, the mustard sauce is very special !!",0.327,0.0,0.673,0.9757
大名鼎鼎的A train!果然是被料理耽誤的酒吧 哈哈哈 每一道料理都好吃的不的了！ 但調酒真的也很有實力，喜歡他們家ABCD所有的系列！,"The famous A Train! Sure enough, the bar that was delayed by the cuisine hahaha every dish is delicious!But bartending is really strong, I like all the series of ABCDs in their family!",0.305,0.044,0.651,0.9049
"店員專業且親切,酒水都很有一定的水準。
食物方面很推薦酸辣雞翅以及炸魚薯條,雞翅的刷醬非常過癮,炸魚薯條份量很足而且麵衣炸的很酥,厚薄適中,裡面的魚肉很多汁。","The clerk is professional and kind, and the wine is very standard.
It is recommended to be hot and sour chicken wings and fried fish and butpse strips. The brushing sauce of chicken wings is very enjoyable. The amount of fried fish and potatoes is sufficient and the noodles are very crispy. The thickness is moderate.",0.137,0.0,0.863,0.8122
"身為爵士愛好者完全愛上
而且食物特好吃","As a jazz enthusiast, I love it completely
And the food is delicious",0.51,0.0,0.49,0.886
氣氛輕鬆，調酒還可以量身訂做而且非常好喝，食物新鮮烹調時間剛剛好，調味超美味，親切舒適，好店👍大推薦 …,"The atmosphere is relaxed, the bartending can be tailor -made and very delicious. The fresh cooking time is just right.",0.365,0.0,0.635,0.8676
"牛排（15盎司沙朗牛）850，大雷
千萬不要點
我不介意定價，但品質不能這麼差
送上來馬上吃已是溫偏冷
肉質韌，原先的切塊無法咬爛需自切很小塊
圖中可看出牛肉中間是帶血
這種熟度還沒肉汁這麼硬
我們共四人卻只附一隻刀子，讓人不方便
最不用心地方是有兩塊是油花佔1/3-1/2
一大塊最旁邊油花居然沒切除
扣除肉部分蔬菜、烤蒜、擺盤都很棒
但沒肉汁又不好咬爛又偏冷的牛排令人失望
是目前在台北4.5星以上酒吧中牛排最難吃的

炸雞多汁、酪梨沙拉重口味、薯條，都好吃
第一個帶眼鏡白衣服務員回話口氣偏兇
解釋酒的口味不耐煩，服務態度差
後來服務員則都很好

酒的部份都很不錯
Susan與長島冰茶必點，濃度高但調的好入喉
5shot很嗨又好玩","Steak (15 ounces of Sharon Cow) 850, big thunder
Never order
I don't mind the pricing, but the quality cannot be so bad
It is warm and cold when it is sent to eat immediately
The flesh is tough, the original cut piece cannot be bitten, it is very small
It can be seen in the figure that the middle of the beef is blood
This maturity is not as hard as gravy
We have only one knife in total, which is inconvenient to be inconvenient
The least attentive place is that there are two pieces of oil flowers occupying 1/3-1/2
The oil flower next to a large piece is not cut off
Dessed the meat, grilled garlic, and plates are great
But the steaks that are not gravy and not bitter and cold are disappointing
It is currently the hardest to eat in the bar in Taipei 4.5 stars and above

Fried chicken juicy, avocado salad heavy taste, fries, all delicious
The first one with glasses and white clothing workers with a tone of fierce breath
Explaining the taste of alcohol is impatient and poor service attitude
Later, the waiters were very good

The part of the wine is very good
Susan and Long Island Ice Tea must be ordered.
5SHOT is very hi and fun",0.137,0.108,0.755,0.8227
"非常喜歡這裡放鬆的氛圍，覺得像置身爵士酒吧一般的舒適，真的很希望建議A Train也可以邀請現場Live Jazz band演出，會讓氣氛更出色。
調酒的價位不便宜，落在200-300元，服務生bartender 人都非常親切，由於酒的命名都是充滿創意，少有熟悉的調酒名稱，所以服務生會用像是心理測驗的方式，一路從基酒到喜歡的香氣、口感、味道跟你問清楚之後幫你挑一款最適合你的調酒。
熟食的選項稍微少了一點，但我們點的炒野菇、椒麻雞翅、豬肋排都非常美味，會希望再訪或搜集所有字母xD","I like the relaxed atmosphere here very much. I feel like being in a jazz bar. I really hope that A Train can also invite the live jazz band to perform, which will make the atmosphere better.
The price of bartending is not cheap, and it falls at 200-300 yuan. The waiter Bartender is very kind. Because the naming of the wine is full of creativity, there are few familiar bartending names, so the waiter will use a psychological test method. From the base wine to the favorite aroma, taste, and taste, I will help you pick a bartender that is best for you after you ask you clearly.
The options for cooked food are a little less, but the fried wild mushrooms, pepper chicken wings, and pork ribs we order are very delicious. I want to visit or collect all letters XD",0.224,0.0,0.776,0.9849
"酒是真的挺濃的沒錯
但食物真的很普通
就蠻普通的，但如果想要快快買醉又便宜的話是蠻推這間店的
這間酒精濃度偏中度以上🥴🥴 …","The wine is really strong, right
But food is really ordinary
It's quite ordinary, but if you want to buy drunk and cheap, you can push this store.
This alcohol concentration is above 🥴🥴 ...",0.09,0.074,0.836,-0.0909
"已經來訪數次，永遠都不會失望。
餐點沒話說，謝謝Joker精緻的服務，介紹的調酒都非常符合需求。","It has been visited several times and will never be disappointed.
There is nothing to say for meals. Thank you Joker for your exquisite service.",0.23,0.0,0.77,0.6761
"店員非常親切，推薦的酒超好喝！
因為茫了，只記得是荔枝的調酒
薯條好好吃，鮮蝦干貝奶油筆管麵？應該是這個名字，超好吃，適合配著調酒一起享用，
重點椅子是沙發椅，超適合在這chill一下。
店員真的超級nice","The clerk is very kind, and the recommended wine is super delicious!
Because it is vast, I just remember it is lychee's bartending
French fries are delicious, fresh shrimp dried scallop pipe noodles?It should be this name, super delicious, suitable for enjoying with bartending,
The key chair is a sofa chair, which is super suitable for this Chill.
The clerk is really super nice",0.444,0.0,0.556,0.9915
"人很多
酒都好大杯
平均一杯350
算便宜，是我目前喝過酒杯最大的有嚇到
哈哈哈哈哈
所有水果也都是給真實水果
不是罐頭也不是果醬
還有甘蔗，酒也好喝
缺點的部分見仁見智
我覺得吧台跟客人隔超遠
無法跟調酒師交流有點可惜也看不太到工作台
對於想跟調酒師交流的人這裡無法滿足你
其餘裝潢氣氛什麼的都很好
菜單很有心
很喜歡菜單設計
有鋼琴譜
下去想點蘇珊哈哈哈哈哈哈
有大概看到基酒
似乎是一杯魔王調酒呢","A lot of people
Wine is a big cup
Average one cup 350
Cheap, it's the biggest scared of drinking glass at present
Hahahahaha
All fruits are also for real fruits
Not canned food nor jam
There are sugarcane, and the wine is delicious
Sexuality of the disadvantage
I think the bar is very far away from the guests
It is a bit unfortunate to be able to communicate with the alcoholicist.
For those who want to communicate with the bartender, you can't satisfy you here
The rest of the decoration atmosphere is very good
The menu is very attentive
I like menu design very much
Piano score
Go down and think about Susan Hahahahahahaha
I probably see the base wine
It seems to be a cup of demon king bartender",0.075,0.077,0.847,-0.0576
餐點很棒，點了南瓜燉飯，一人一份太多了建議主食類可以share，調酒超級好喝，價位不貴，非常適合女生小酌聊天的bar，朋友們也都覺得比起別家這間很棒！,The meal is great. I ordered pumpkin stew. There are too many people and one person. It is recommended that the staple food can be shade. The bartending is super delicious and the price is not expensive. This is great!,0.338,0.0,0.662,0.9577
酒不錯而且超大杯超爽 食物也不錯 愛吃水餃的友人表示水餃好吃 推推！,Friends who are good and super large cups and super cool foods are also good. Friends who love dumplings say that dumplings are delicious!,0.66,0.057,0.283,0.9829
"水果類的調酒種類很多，用的都是真材實料的水果，甚至調酒的攪拌棒就是甘蔗。食物和調酒皆具特色而且美味，氛圍營造得十分迷人，我可以理解為什麼這一系列的字母酒吧這麼熱門了！
There are plenty of fruity cocktails all made with real fruits, and they even use sugarcane as swizzle stick. Drinks and food here are all excellent. The ambiance is so charming. If you are a lover of fine cocktails, it’s definitely a must when you are in Taipei!! Btw, it’s an alphabet series: A train, B line, C park, D town and F gallery. I can’t wait to visit all of them:)","There are many types of fruits. There are many types of alcohol. They all use real fruits, and even the mixing rods of sobble are sugar cane.Food and bartending are distinctive and delicious, and the atmosphere is very charming. I can understand why this series of letters is so popular!
There are public. s so charming. If you are a lover of the cocktails, it's definitely a must when you Are in Taipei !! Btw, it's an alphabet server: a track, B line, c party, d town and fallery.",0.243,0.0,0.757,0.9806
