Original,EN,Positive,Negative,Neutral,Compound
"餐點好吃！酒品層次有外觀也華麗，雖然沒有很懂酒🤣；位居二樓的小空間，不至於太寬敞但座位都算舒適；可向店員詢問推薦的酒類，會依你的喜好做推薦，店員都很親切～
這裡餐食飲花費較高，但有機會會想帶朋友來這聚聚 …","The meal is delicious!The level of wine has a gorgeous appearance, although I do n’t know the wine very much; the small space located on the second floor is not too spacious, but the seats are comfortable; you can ask the store staff to ask the recommended alcohol, you will recommend it according to your preferences. The clerk is very kind ~
The cost of drinking and drinking here is high, but if you have the opportunity, you will want to bring your friends to come here ...",0.242,0.0,0.758,0.9765
調酒好喝，酒精濃度夠！餐點也很好吃！洋芋切片和墨魚燉飯都很讚🥰，辣炒海鮮小蘑菇畫了三根辣椒是真的很辣很辣XDD,"Blooming is delicious, alcohol concentration is enough!The meal is also delicious!Togo slices and cuttlefish stewed rice are very good, spicy fried seafood mushrooms draw three peppers, it is really spicy and spicy, XDD",0.194,0.0,0.806,0.8165
cp值高，燉飯跟義大利麵不輸飯店跟外面餐酒館，調酒很多也很有特色；空間很大，其他客人如果講話大聲可能會比較吵，只有這點較不習慣，整體都很ok，服務人員很專業也很親切！已經來三次了～,"The CP value is high. Stew rice and spaghetti do not lose the restaurant and the food room outside. There are many distinctive bartending tavern; there is a lot of space. If other guests speak loudly, it may be more noisy. OK, the service staff is very professional and kind!It's been three times ~",0.085,0.034,0.88,0.451
"對調酒不太認識酒單都看不懂😆
不過店員會先詢問喜歡的酒精濃度還有口感，直接依照喜好調酒
這次點的奇異果，我覺得很好喝
餐點的部分也都有一定水準，義大利麵很濃郁 …","I don’t know how to know the wine list for bartending. I don’t understand 😆
However, the staff will first ask the favorite alcohol concentration and taste, and directly adjust the bartending according to your preference.
I think it is delicious
The part of the meal also has a certain level, and the Italian noodles are strong ...",0.21,0.0,0.79,0.9274
"第一次來A train，沒想到酒種類很多之外，餐點也很不錯吃，點了義大利麵跟松露起司嫩豆腐，味道很不錯。不過fish and chips 覺得魚肉有點太軟太鬆。
整體氣氛也不錯，不知道該點哪種酒店員都會根據喜好幫你推薦。","The first time I came to A Train. I didn't expect that there were many types of wine, and the meal was very good. I ordered the pasta and truffle curl tofu, which tastes very good.But Fish and Chips think the fish is a bit too soft and loose.
The overall atmosphere is also good. I do n’t know which hotel staff will help you recommend it according to your preference.",0.142,0.029,0.829,0.8399
"愛喝酒的我們，這次來都沒喝酒，點了無酒精飲品，跟正餐來吃，聽說這家餐點很美味，是A-F系列最多餐點及位置最適合吃正餐的一家。
我們點了麵食及燉飯，口味真的蠻好吃，可是份量很少，內容物干貝也僅有一顆，飲品部分太多的加工水果濃縮液，不是很好喝。","We who love to drink, we have n’t drunk this time, ordered no alcoholic drinks, and eating with dining. I heard that this meal is delicious. It is the most suitable meal and location for the A-F series.
We ordered pasta and stewed rice. The taste is really delicious, but the portion is very small, and there is only one content of the contents of the contents. There are too many processing fruit concentrated solution of the drinking fruit, which is not very delicious.",0.109,0.08,0.81,0.4165
這是目前最令人滿意的A Train，環境 調酒 食物都很棒，可惜即便平日，店員似乎也很忙，結帳等了好久才確認到眼神,"This is currently the most satisfactory A Train. The environmental bartender foods are great. Unfortunately, even on weekdays, the clerk seems to be very busy. After waiting for a long time, it is confirmed that the eyes are confirmed.",0.152,0.053,0.795,0.6697
"低消是600，bartender 會詢問客人的喜好再建議調酒，這點蠻好的，因為很多人都選擇困難，或者點來點去都是那幾款，這樣可以喝到不一樣的酒。

第一杯是中濃度的調酒（有荔枝那杯），好喝，有濃，不會像水一樣，喝完有一點點飄飄，感覺舒服。很有趣的地方是，調酒沒有附攪拌棒反而附上一根切細的甘蔗梗，本來以為是裝飾，沒想到是每天現切的甘蔗梗，可以增添一些天然甜味，也可以當攪拌棒，當然也是可以吃的 👍第二杯是沒創意的vodka lime，緬懷我的青春時代 🍹🥃

這一次是吃飽才來，所以沒有點餐點只點了炸雞。","The low disappearance is 600. Bartender will ask the guests' preferences and then recommend bartending. This is pretty good, because many people choose difficulties, or you can drink them with different wines.

The first cup is a medium concentration of bartending (with litchi cups). It is delicious and strong, and it will not be like water. It is a little fluttering after drinking, and it feels comfortable.The interesting part is that the bartending mixing rod is not attached to a thin sugarcane stalk. I thought it was decorative. I did not expect that the sugarcane stalks that were cut every day can add some natural sweetness. It can also be used as a stirring stick. Of course, the second cup that can also be eaten is the unspeakable Vodka Lime, remembering my youth 🍹🥃

This time it was enough to eat, so I didn't order a meal. I just ordered the fried chicken.",0.136,0.048,0.816,0.9476
"店內氛圍很有氣氛偏昏暗 現場講話聲較大
風味薯條佐三色醬$320真的是很驚人的份量
但是整體所有的餐點都是偏鹹的
青醬雞肉薄餅吃第一口還很好吃 吃完一整片顯得超重口味 可能真的算下酒菜的概念
調酒可以依應自己喜好去做調配
店員服務都很活躍貼心更甚至親合力十足","The atmosphere in the store is very dim
Flameflossy strip three -color sauce $ 320 is really amazing weight
But all the meals as a whole are salty
The first sip of green sauce chicken cakes is very delicious after eating a whole piece. It looks super heavy.
Barton can be prepared according to your preferences
The clerk service is very active and intimate, even with all the best",0.288,0.0,0.712,0.9809
"前女友說要完成A-F攻略
但還沒完成就沒有機會了
今天第一次來A
原本只是想說來喝酒的
但今天點的餐點
1.鮮蝦義大利麵
那個蝦子真的有瞎到，鮮味有夠明顯
完全把整道料理提升起來
2.和風炸雞
最酷的是他是用哇沙米的椒鹽
本人很愛吃哇沙米，完全可以！
3.鴨胸沙拉？
我只知道一盤沙拉裡面肉量真的非常豐富
而且放的還是黑松露的沾醬，生菜的清爽
跟鴨胸肉的脂肪簡直絕配
再來講講酒的部分
因為本人不是特別懂酒
感謝查斯特一個人超好的bartender
不厭其煩介紹調酒跟shot杯
想要什麼口味的特調他都能幫您處理
總之店裡的氣氛也是會想再光臨的關鍵","The ex-girlfriend said to complete the A-F guide
But there is no chance before it is done
The first time I came to A today
Originally I just wanted to talk about drinking
But the meal at the order today
1. Fresh shrimp pasta
That shrimp is really blind, and the umami taste is obvious enough
Rehears the whole dish
2. He Feng Fried Chicken
The coolest thing is that he uses the salt and pepper of Wakhami
I love to eat wow Sami, it's okay!
3. Duck breast salad?
I only know that the meat in a plate of salad is really rich
And the dipping sauce of Heisonglu, the refreshing lettuce
The fat with duck breasts is perfectly matched
Let's talk about the part of the wine
Because I don't know wine especially
Thank you for a good Bartender for a person alone
I don't tire of my annoyance introduction to bartending and Shot Cup
He can handle the special tone of the taste of the taste
In short, the atmosphere in the store is also the key to visiting again",0.176,0.052,0.771,0.9852
"不論正餐或是只想喝一杯的你都可推薦你來A train，我的點了炸牡蠣🦪：外皮酥香，牡蠣蠻大的，而且不會乾乾的，吃起來很多汁，搭配沾醬很棒
墨魚燉飯佐炸牡蠣：米粒煮得剛剛好，整體的口感很棒！
番茄海鮮薄餅：餡料爆多的餡餅，蠻好吃的，不過餅的部分可以再烤香酥一點，我個人喜歡有點脆脆的口感！

調酒的部分，我選擇了酒感中度，真的有濃！ 哈哈哈哈，酒品的搭配香氣很不錯😌

想再來的一間餐酒館","You can recommend you to A Train, whether dining or just drinking a cup, I ordered fried oysters. great
Ink fish stewed rice fried oysters: The rice grains are just right, and the overall taste is great!
Tomato seafood pancakes: The pie with a lot of filling is pretty delicious, but the cake can be baked and crispy. I personally like a bit of crispy taste!

For the bartending part, I chose the moderate alcohol, which is really strong!Hahahaha, the aroma of the wine is very good 😌

A restaurant that wants to come again",0.211,0.0,0.789,0.9703
字母系列的源頭，水果調酒都很好喝、每次來必點薯條。服務人員熱心幽默，雖然一開始調酒送錯但完全沒有讓人覺得不舒服，馬上就送來正確的了！,"At the source of the letters series, fruit alcohol is very delicious, and you must order fries every time.The service staff is enthusiastic and humorous. Although the bartender was wrong at the beginning, it was not uncomfortable at all, and it was right immediately!",0.226,0.057,0.717,0.8469
"調酒超級超級順和水果也很搭
可以自己選自己喜歡的水果還有濃度
最特別的是上面還有附一根甘蔗！
很適合和三五好友來這裡小酌
氛圍也很好不會太吵","Mixing is super shun and fruit is also very good
You can choose your favorite fruit and concentration
The most special thing is that there is a sugar cane attached above!
Very suitable for coming here with three or five friends to drink here
The atmosphere is also very good, it won't be too noisy",0.306,0.0,0.694,0.9647
"A-F系列搜集完畢✅（雖然這間離捷運站有點距離😮‍💨）
但這系列不論哪間～餐點跟酒基本上都無雷，好吃又好喝！！
而且店員也會熱情介紹酒類口感，服務都很不錯👍👍
會是認真想推薦朋友來用餐、小酌的店💕

不過因為人多，環境比較吵雜一點🤏
聊天真的要比較用力欸🗣","The A-F series is collected (although this is a bit far from the MRT station 😮‍💨)
But no matter which series of this series, the meals are basically thunderous with wine, delicious and delicious!Intersection
And the clerk will also warmly introduce the taste of the wine, the service is very good 👍👍
It will be a shop that I want to recommend my friends to dine and drink 💕 💕 💕 💕

But because of many people, the environment is a bit noisy 🤏
Chatting is really more powerful",0.356,0.022,0.622,0.9949
"餐點烹調及用料非常用心～燉飯超級推！口味特別，口感濃厚，價錢也不會太過昂貴
調酒部分，服務員詳細解說，會依照自己喜歡不同調性的水果酸甜，以及喜歡何種茶類的搭配來推薦調酒，非常用心！！
調酒的配飾外觀也很特別及用心，附了一小根甘蔗讓人也覺得有趣～會想再訪的一間酒吧！","Meal cooking and ingredients are very intentional ~ stewed rice is super push!The taste is special, the taste is strong, and the price will not be too expensive
In the bartending part, the waiter explained in detail that it will be recommended to bartender according to the sweet and sour fruits of different tuning and what kind of tea you like, which is very careful!Intersection
The appearance of bartending accessories is also very special and attentive, with a small sugarcane that makes people feel interesting ~ A bar that you want to visit again!",0.228,0.0,0.772,0.9722
"字母系列餐酒這間很不錯👍
空間安排不至於讓鄰桌講話聲相互干擾
東西也好吃～","The letters series meals are very good
The space arrangement will not let the neighbor table interfere with each other
Things are so delicious ~",0.256,0.0,0.744,0.8374
"2923/9/11
字母連鎖餐酒館系列，不管哪一家都有水準之上的餐點及好喝的調酒。","2923/9/11
The letters chain restaurant series, no matter which one has a standard meal and delicious bartending.",0.187,0.054,0.759,0.5612
"服務態度與氣氛極佳，
餐點好吃，炸魚薯條的魚排很豪邁！
極推：酥炸生蠔、炸魚薯條。
風味雞翅略顯一般，可以考慮點椒麻雞翅；
適合三五好友相約聊天。","The service attitude and atmosphere are excellent,
The meal is delicious, and the fish and fried fish is very bold!
Push: Crispy fried oysters, fried fish and dressed strip.
The flavor chicken wings are slightly general, you can consider some pepper hemp chicken wings;
Suitable for three or five friends to meet.",0.222,0.0,0.778,0.9285
調酒和餐點都很不錯，氣氛棒,"Blooming and meals are very good, the atmosphere is stick",0.262,0.0,0.738,0.4927
"喜歡A似乎勝過B，餐點跟酒都沒有讓人失望！只可惜很難訂位，只能坐2個半小時，還沒喝開就結束，覺得遺憾，下次再來！
---------------------
2023/0106更新
當媽後兩年多沒來！果然還是我最愛的店！沒讓我失望！","I like A. It seems to be better than B. The meals and wine are not disappointing!Unfortunately, it is difficult to book a place. You can only sit for 2 and a half hours, and it will end before drinking. I feel regrettable, come again next time!
-----------------------
2023/0106 update
I haven't come for more than two years!Sure enough, it's my favorite shop!No disappointment!",0.11,0.134,0.757,-0.4344
"聞名而來。適逢晚餐，席間點了香煎自然豬里肌。豬肉使用的是台灣豬，厚度目視有1.5公分左右，一下刀就知道品質不錯，入口後更是軟嫩多汁，口感相當的棒!旁邊附有“黑鹽“，喜歡重口味一點的人，沾一點更是增添鹹香風味，也可以搭著墨西哥辣椒一起吃。下面鋪滿各種蔬菜，有三色椒、花椰菜、兩種菇類、櫛瓜、烤馬鈴薯等非常豐富健康的搭配。激推!
酒類方面，點了all I wanted(不確定有沒有記錯)，這是一杯陽剛味比較重的酒，waiter說是以威士忌跟萊姆酒為主調配而成的，會帶有茶香味。實際上喝起來酒感滿重的，尾韻有種皮革味，像是一個綁著長馬尾的哈雷皮衣浪子。後勁强，回家後瞬倒。
也請吧台調了一杯酒單上沒有的sex on the beach，特地讓bartender加多鳳梨的風味，吸管旁邊還搭了一支細細的甘蔗，滿特別的，喝起來也相當順口。
環境方面，高背沙發除了讓人很放鬆也能保有一些隱私。播放的音樂如同店名，都是Jazz，非常的chill。可惜生意很好，人多講話聲音就大，稍稍影響了用餐感受。不過整體而言是一次很棒的經驗。","Come here.At the time of dinner, the fried natural pig muscles were ordered during the dinner.Pork is used in Taiwanese pigs. The thickness of the thickness is about 1.5 cm. The knife knows that the quality is good. After the entrance, it is soft and juicy, and the taste is quite good! There is ""black salt"" next to it. , Dipping a little more salty flavor, you can also eat it with Mexican pepper.Below is covered with various vegetables, including three -color pepper, cauliflower, two kinds of mushrooms, melon, roasted potatoes, etc. It is very rich and healthy.Push!
In terms of wine, I ordered ALL I WantedIn fact, the wine is full of wine, and the tail rhyme has a kind of leather smell, like a prodigal son -in -law tied to a long horsetail.The stamina was strong and fell immediately after returning home.
Also invite a cup of SEX on the Beach on the wine list, and let Bartender add more pineapple flavor. A thin sugar cane is also equipped next to the straw.
In terms of environment, in addition to making people very relaxed, it can also keep some privacy.The music played like the name of the store is Jazz, which is very Chill.Unfortunately, the business is very good, and the voice of people speak more, which will slightly affect the dining feelings.But overall is a great experience.",0.15,0.0,0.85,0.9885
"餐點十分美味，真的是十分！好好吃😋 點了一份起司通心粉、一盤蒜香炒野菇。，通心粉滿滿的起司，很美式，吃起來好滿足～炒野菇也很棒，味道很香，卻不是蒜泥那種很膩的味，大推！姐妹點了野菇義大利麵，是清炒類的義大利麵，味道很有層次！

酒的部分，朋友說調酒都不錯（我不知道她們點了什麼酒哈..）酒精低，新鮮水果味比較多，小酌是很好的選擇。還有檸檬shot上方有烤檸檬片，會有點焦糖的甜，看上去也美哈。

都市風格的裝潢，很舒適。服務生親切，一直加水，我們喝了好多水..😅 每人低消500+一成服務費。 我們有訂位，平日來也是大概晚餐時間開始餐廳人就滿了，所以建議訂位。 無消費時間限制，這點很棒，可以放鬆和朋友聊天，不過越晚人越多，大家都比大聲，所以九點半後變很吵😅快聽不到我朋友說什麼了..討厭這種氣氛的人別逼自己了～","The meal is very delicious, it is really very!Sweetly ordered a cheese pink powder, a plate of garlic frying wild mushrooms.The cheese full of niche pink is very beautiful, and it tastes good ~ fried wild mushrooms is also great, the taste is very fragrant, but it is not the very greasy taste of garlic, push!The sisters ordered the wild mushroom pasta, which is the pasta of fried categories, and the taste is very layered!

In the wine part, friends say that bartending is good (I don't know what wine they ordered ..) The alcohol is low, the fresh fruit tastes more, and the drinking is a good choice.There are roasted lemon slices above the lemon Shot, which will be a bit sweet, and it looks beautiful.

The urban style decoration is very comfortable.The waiter was kind and kept adding water. We drank a lot of water ..😅 per person to eliminate 500+ percent of the service fee.We have a reservation, and the restaurant is full at dinner time, so it is recommended to book a place.There is no consumption time limit. This is great. You can relax and chat with friends, but the later you are more people, everyone is more loud, so it becomes noisy after 9:30. People with a kind of atmosphere don't force yourself ~",0.217,0.029,0.754,0.9948
很舒服的店. 真的跟B line 是截然不同的感受. 餐點好吃. 調酒好喝. 酒單內容也有自己的特色. 推推推,Very comfortable shop. It really feels very different from B Line. The meal is delicious. The alcoholic is delicious. The content of the wine also has its own characteristics. Push push,0.282,0.0,0.718,0.8999
"來過將近100次（不誇張）
始終是我口袋名單
品質穩定的好
酒我就不說了  沒什麼好說的（雖然漲價了）
食物真的是可以再去開一間餐廳了啦🍴
（雖然種類真的不多但他就是酒吧啊！）
早期以前每週一到週五會有不同的爵士音樂
六日則會放流行與爵士（不一定）
玻璃看不出去且昏暗  現在明亮且玻璃透明
可能法規的關係吧不過這些都不影響我對它的喜愛  雖然這近十年來菜單換了又換有的新增有的淘汰  裝潢也是翻新後再翻新  還新增了廁所🚾然而他依然是那個令我喜愛的Jazz Bar
在我心裡  這次有特殊意義的店
五顆星無法解讀對這間店的感情","Almost 100 times (not exaggerated)
Always my pocket list
Good quality and stable
I wo n’t say anything about wine (although the price has increased)
The food can really open another restaurant.
(Although there are not many types, he is the bar!)
There will be different jazz music every Monday to Friday in the early days
On the sixth, it will be popular and jazz (not necessarily)
Can't see the glass and dim and now bright and transparent glass
Maybe the relationship between regulations, but these do not affect my love for it. Although the menu has been changed in the past ten years, the newly added elimination decoration is also refurbished after renovation and then renovated. My favorite Jazz Bar
In my heart, this time there is a special significance shop
Five stars cannot interpret the feelings for this shop",0.164,0.028,0.808,0.9574
"地點：離捷運站不近，但我相信人氣高的好餐廳不太因為地點稍遠而不肯來

服務：服務員都有經過訓練。針對酒類不太熟的客人針對口味做出很好的建議

餐點： 今天點阿嘉燉飯， 墨西哥玉米脆片，炸魚薯條。
阿嘉燉飯的飯是偏軟，味道是自創，首次來可以試試看。我個人偏愛涼了之後，口感更佳。

墨西哥玉米脆片：是用辣的口味，上面放橄欖跟辣椒，搭配Salsa醬跟sour cream真的很好吃。sour cream嚐起來綿綿的入口即化。

炸魚薯條仍是我的心頭愛，搭上塔塔醬，一邊喝酒一邊吃一邊聊天，這是天堂呀！","Location: Not close to the MRT station, but I believe that good restaurants with high popularity are not very unwilling to come because the location is slightly far away.

Service: The waiters have been trained.For customers who are not familiar with alcohol, make good suggestions for the taste

Meal: Order Aga stew today, Mexican corn crispy slices, fried fish and potato strips.
Aga's stewed rice is soft and the taste is self -made. For the first time, you can try it.After I personally like it, I have a better taste.

Mexican corn crisp: It is spicy, olive and peppers, and Salsa sauce and Sour Cream are really delicious.Sour Cream tastes the entrance.

The fried fish and fries are still my heart love. Take the tower sauce and chat while drinking. This is paradise!",0.227,0.0,0.773,0.991
"鹹食都不錯吃 不過調味有點重～
不管是果汁還是調酒 都很大杯
調酒酒精都偏重但都蠻好喝的
位子有點擠
空調好像沒開 有點悶～
價位中上
可以電話訂位
一個人低消500  位子只能坐2個小時半","The salty food is good, but the seasoning is a bit heavy ~
Whether it is fruit juice or bartender, a large cup
Alcoholic alcohol is heavy but it's pretty delicious
The seat is a bit crowded
The air conditioner seems to be a bit boring ~
High -priced
You can book a call
A person can only sit down for 2 hours and a half",0.148,0.039,0.813,0.8537
"A train 價格非常親切
酒吧環境也是非常溫馨，很像家裡客廳的那種感覺。
服務員跟Bartender 都非常親切，很照顧客人的需要

點了：
茶酒 Jasmine, vodka 為基酒帶出茉莉花香還有荔枝跟甘蔗的口感。酒感偏甜，順口好喝！

Red Hot 很適合冬天寒流來的時候！

Chardonnay 便宜且順口

跨年特調Shot 意外的驚喜！

Fish and Chips 份量很足而且價格才360

邊吃邊喝非常快樂","A train price is very kind
The environment of the bar is also very warm, much like the feeling of the living room at home.
The waiter and Bartender are very kind and take care of the customer's needs

Note:
Tea wine Jasmine, Vodka brings out jasmine flavor and litchi and sugarcane taste for base wine.The wine feels sweet and delicious!

Red HOT is very suitable for the cold current in winter!

Chardonnay is cheap and smooth

New Year's Eve SHOT unexpected surprise!

Fish and Chips is sufficient and the price is only 360

It's very happy to drink while eating",0.252,0.0,0.748,0.983
"朋友慶祝生日～第一次來這裡，氣氛很不錯，餐點也很好吃😋！
今天晚上的餐點
#阿嘉墩飯#蒜香海鮮意大利麵#若即若離的酪梨🥑雞肉沙拉🥗#現打鳳梨🍍汁 …","Friends celebrate their birthday ~ For the first time, the atmosphere is very good, and the meals are delicious!
Meal tonight
###梨 梨 🥑 🥑 🥑 🥑 🥗 🥗#……………………………………………………………………………………#",0.341,0.0,0.659,0.9323
"好久沒和大家分享經典酒吧啦。
今天要和BNI的夥伴酒聚一下，
經無糖律師的推薦，
我們來到這間
A Train Leads The Way To Jazz
這是一間濃厚Jazz風格的酒吧
紅磚牆面噴圖的大師剪影和
投影幕的黑白Jazz演奏真是太棒啦！
來一杯苦中帶甜的調酒—Negroni，
為努力開創事業的自己乾杯😎

#Bni華大分會
#開完大會輕鬆酒聚","I haven't shared the classic bars with you for a long time.
Today, I will get together with BNI's partners,
Recommended by a sugar -free lawyer,
We come to this
A Train Leads The Way to Jazz
This is a strong Jazz style bar
The master of the red brick wall spray picture and the silhouette and
The black and white Jazz performance of the projection screen is great!
Here is a cup of bitter bartending in bitterness -Negroni,
Toast for the creation of your own career 😎 😎 😎 😎

#Bni Huada Branch
#",0.208,0.058,0.734,0.9604
