Original,EN,Positive,Negative,Neutral,Compound
"在條通裡，一個地下室的清幽空間
有著豐富琴酒的選擇，再依照自己喜歡的調性，調配出一個適合你的風味，琴酒愛好者一定會愛上這邊。
有趣的是，店裡還自帶了兩隻狗勾🤭 …","In the Tonglitong, a quiet space in a basement
With the choice of rich piano wine, and according to your favorite tone, mix a flavor that suits you, piano lover will definitely fall in love with this.
Interestingly, the store also brought two dog hooks ...",0.333,0.0,0.667,0.9638
"各式的經典twist都好喝～可以告訴bartender 個人喜好做客制（如不要冰杯、去冰、甜度）
當日order gin tonic, aviation, gimlet , sidecar(can be improved)","All kinds of classic Twist are delicious ~ You can tell Bartender personal preferences to make customs (such as ice cups, ice, sweetness)
Order Gin Tonic, Aviation, Gimlet, Sidecar (Can Be Improved)",0.256,0.0,0.744,0.875
"老闆老頭十分的健談，一個人來也不需要擔心覺得孤單，也非常適合兩三位朋友一起來，適合週五下班後小酌的地方。
這裡沒有酒單，只需要把你今天的心情或是想喝的口味跟老頭講，絕對不會讓你失望！","The boss's old man is very talkative, and a person does not need to worry about feeling lonely. It is also very suitable for two or three friends to come together, suitable for the place where you drink after get off work on Friday.
There is no wine list here, just tell your old man today's mood or the taste you want to drink, it will never disappoint you!",0.14,0.061,0.799,0.6317
"Ps. 只收現金和純信用卡
Ps. 沒有任何行動支付！
無菜單真是讓人傷腦筋，還好家在是今天晚上不太多客人，我們還可以輕鬆的和店員以及調酒師討論，非常令人緊張，但還好店裡面的專家，都很有耐心。但令人困擾的，還有價錢XD，不過本來就規劃以及做好心理準備了，所以怎樣都不奇怪，就是了。旁邊就是通化夜市，肚子餓，可以走出去餵飽肚子，也不知道店內有沒有可以點吃的，不過有被serve巧方蘇吃，但好像只有酒精類的飲料可以點選就是了。但是，無論如何，都是一個滿美好的夜晚，和經驗。","Ps. Only cash and pure credit cards
PS. No action payment!
No menu is really hurting. Fortunately, the good family is not too many guests tonight. We can also discuss with the clerk and the bartender. Fortunately, the experts in the shop are very patient. EssenceBut it is disturbing, and there is a price XD, but it was originally planned and prepared for psychological preparation, so it is not surprising, that is.Next to it is the Tonghua Night Market, who is hungry, you can go out to feed your stomach. I do n’t know if there is any food in the store, but there are Serve Qiao Fang Su, but it seems that only drinks with wine can be selected.However, in any case, it is a beautiful night and experience.",0.083,0.067,0.85,0.6339
氣氛舒服，酒保幽默，對於客人的口味很注重，會仔細的聆聽你想要的味道，調出來都超讚的！很喜歡那天的水果系列(火龍果和荔枝都很棒),氣氛舒服，酒保幽默，對於客人的口味很注重，會仔細的聆聽你想要的味道，調出來都超讚的！很喜歡那天的水果系列(火龍果和荔枝都很棒),0.0,0.0,1.0,0.0
"很日式，可吸菸，燈光偏暗。
酒很猛（種類、數量、味道），有signature、classic，也可以請bartender客製。
食物表現可圈可點，週年還有互動遊戲！","Very Japanese -style, smoking, dark light.
The wine is very fierce (type, quantity, taste), with Signature and Classic, you can also ask Bartender to customize.
Food performance is remarkable, and there are interactive games on the anniversary!",0.098,0.0,0.902,0.5983
在網美酒吧充斥著的這區中，一個清新特殊的存在，狹長的空間與不好坐的位置稱不上舒適，調酒也稱不上有特殊的必訪特色，然而明亮又專業的解說與調酒，絕對是個能找尋安靜的角落，逛累了夜市來這裡享受一杯適合的調酒很不錯。,"In this area full of the net bar, a fresh and special existence, the narrow space and the position of the bad sitting are not comfortable, and the bartender is not a special visits. However, bright and professional commentary. With bartending, it is definitely a quiet corner. I am tired of visiting the night market to enjoy a suitable cup of alcohol.",0.177,0.145,0.678,0.3485
不錯的一間酒吧。服務人員態度很好，果汁調酒非常不錯（有果泥）。,"A good bar.The service staff attitude is very good, and the juice is very good (with fruit mud).",0.382,0.0,0.618,0.8514
氣氛很棒，酒很好喝,"The atmosphere is great, the wine is delicious",0.565,0.0,0.435,0.8316
"價格中高
但杯具和用的水果是有質感的
當天點的草莓調酒剛好不合我的口味，下次再點別的！
裡面可以吸菸","High price
But cups and fruits used are textured
The strawberry bartending that day is just inconsistent with my taste, next time I order something else!
Can smoke",0.0,0.0,1.0,0.0
椅子坐起來不太舒服，Sidecar非常甜，Martini蠻烈的，不錯。,"The chair is not very comfortable to sit, Sidecar is very sweet, Martini is quite strong, good.",0.387,0.112,0.5,0.799
小妍很可愛，餐點好吃，章魚燒大推！,"Xiaoyan is very cute, the meal is delicious, and the octopus is pushed!",0.398,0.0,0.602,0.8066
信義安和最常來的酒吧沒有之一，不浮誇但舒適的小店，適合與朋友小酌,Xinyi'an and the most common bars are none of them.,0.0,0.0,1.0,0.0
吧台老頭擅長藏酒感，平衡感不錯。學徒的專業度有待加強,The old man of the bar is good at hiding wine and a good sense of balance.The professionalism of apprentices needs to be strengthened,0.279,0.071,0.649,0.7506
"最喜歡來這裡跟大家聊天
超放鬆滴～～～❤️","I like to chat with you the most
Ultra -off and loose drip ~~~ ❤️",0.133,0.122,0.745,0.0516
"如此讚的地方
酒好喝 順口 豐富","Such a place of praise
The wine is delicious and smooth",0.448,0.0,0.552,0.8074
"普渡眾生👨🏼‍🦲
經典點起來～ …","Purdue sentient beings
Classic point ~ ...",0.0,0.0,1.0,0.0
明亮輕鬆的氣氛，調酒非常好喝，尤其是讓我驚喜的Martini,"The bright and relaxed atmosphere, the bartender is very delicious, especially Martini, who surprised me",0.527,0.0,0.473,0.9053
很特別，針對個人口味調，很有層次，每一口不同風味,"Very special, for personal taste, very layered, each bite of different flavors",0.214,0.0,0.786,0.4576
舒適安靜的小店，酒也不錯,"A comfortable and quiet shop, the wine is also good",0.437,0.0,0.563,0.7351
條通內好喝的酒吧,The delicious bars in the strip,0.425,0.0,0.575,0.5719
一隻小狗沒出過門似的在店裡面到處亂竄，出來喝個酒還要忍受小狗神經質的腳步聲。Bartender 在吧台抽煙，毫無職人的自覺。,"A puppy did not go out of the door and scrambled everywhere in the shop. When he came out to drink a wine, he had to endure the footsteps of the puppy's nervousness.Bartender smokes in the bar, and is conscious of no person.",0.0,0.05,0.95,-0.296
調酒不錯有力道，適合跟朋友聊天敘舊的地方,"The bartender is good and powerful, suitable for chatting with friends",0.524,0.0,0.476,0.8316
調酒風格明確，深具經典功力，服務更是拳拳到肉，調酒師充滿強大的包容力，每個細節的執行都恰到好處，必然會再訪,"The bartending style is clear, the classic skills are deep, the service is fist to meat, the bartender is full of powerful tolerance, the implementation of each detail is just right, and it will inevitably visit again.",0.183,0.0,0.817,0.765
讚爛了 想繼續喝下去 可惜時間不允許,"It's a pity that it is not allowed to continue to drink, but the time is not allowed",0.0,0.086,0.914,-0.1531
來兩次，第一次點的是百香果。第二次本來想點Ramos Gin Fizz，但鮮奶油沒有了，點了另外一杯甜甜的經典，白巧克力+奶+檸檬，意外的合我口味~,"Come twice, the first ordered is Passion Fruit.The second time I wanted to order Ramos Gin FIZZ, but the fresh cream was gone. I ordered another cup of sweet classic, white chocolate+milk+lemon, unexpectedly merging my taste ~",0.208,0.0,0.792,0.8381
"舒舒服服
還有很多天竺鼠車車","Comfortable service
There are also many Geypse car cars",0.292,0.0,0.708,0.5106
西西里風味的GIN特調 超級棒,Sicily's flavor GIN special superbic,0.403,0.0,0.597,0.4019
"老頭很貼心，會依照客人喜好幫客人選擇適合的
酒；也很健談，是一間可以讓人放鬆的Bar","The old man is very intimate and will help the guests choose the right according to the preferences of the guests
Wine; it's also very talkative, a bar that can make people relax",0.153,0.0,0.847,0.6808
"酒味道好，品質佳。老闆會針對喜好調整味道👍
店內環境舒適，有店狗，不會影響客人～很可愛～ …","The wine tastes good and the quality is good.The boss will adjust the taste for preferences 👍
The environment in the store is comfortable, and there is a shop dog, which will not affect the guests ~ very cute ~ ...",0.196,0.0,0.804,0.8588
經典調酒有夠厲害的日式酒吧,Classic bartending Japanese -style bar,0.0,0.0,1.0,0.0
酒不錯，人不多,"Good wine, not many people",0.42,0.0,0.58,0.4404
"有趣的琴酒吧！
喝到特別的琴酒","Interesting piano bar!
Drink a special piano wine",0.487,0.0,0.513,0.69
"超讚的mojito 店內氛圍很棒
調酒每一杯都非常厲害","The atmosphere in the superb Mojito store is great
Each cup of bartender is very powerful",0.465,0.0,0.535,0.9061
"老闆會依客人喜好做出客人喜歡的酒
是目前最愛的酒吧之一！","The boss will make the wine that the guest likes is based on the preferences of the guests
Is one of the favorite bars!",0.217,0.0,0.783,0.7263
大禹嶺紅茶馬丁尼,Dayu Ridge Black Tea Martinny,0.0,0.0,1.0,0.0
環境舒適 專業好酒👍👍之後會想再去💗💗💗 …,"After the environment is comfortable and professional, you will want to go again ...",0.277,0.0,0.723,0.5574
位於地下室環境靜謐，有得吃有得喝，最近還有A5和牛可以點，下次一定要試試看,"Located in the basement environment is quiet, some have to eat and drink. Recently, there are A5 and cows.",0.0,0.0,1.0,0.0
雖然是在夜市，但是他一個安靜的地方，老闆會根據客人的喜好調整味道,"Although it is in the night market, a quiet place, the boss will adjust the taste according to the guest's preference",0.0,0.0,1.0,0.0
微隱身巷子裡的小酒館，每次來就是來見老朋友，還有可愛的店狗鬧鬧陪玩，讓人放鬆，容易忘記時間的地方,"The small tavern in Weiyin's alley, every time I come to see my old friends, and cute shop dogs, make people relax, and it is easy to forget time.",0.315,0.05,0.635,0.875
適合聊天放鬆的好地方，即使一個人也不會不自在,"Suitable for a good place to chat and relax, even if a person will not be uncomfortable",0.363,0.0,0.637,0.7896
好棒，舒服的空間，親切有趣的老闆，自己來也不會無聊~回想再來😁 …,"Good, comfortable space, kind and interesting boss, I will not be boring by myself ~ I think about it again ...",0.471,0.0,0.529,0.9226
調酒師很風趣，詳細介紹使用酒款,"The bartender is very funny, introduce the use of wine in detail",0.225,0.0,0.775,0.4927
老闆親切 舒適安靜的地方 適合聊天小酌 喜歡!,"The boss is kind, comfortable and quiet, suitable for chatting and drinking!",0.411,0.0,0.589,0.7901
氣氛好 調酒可以依心情選擇 很好喝,"The atmosphere is good, you can choose to choose it according to your mood",0.182,0.0,0.818,0.4404
"優質！
去了就知道 無需多言","high quality!
Go if you go, you don’t need to say more",0.0,0.0,1.0,0.0
"朋友聚會好去處
酒都很好喝","A good place for friends to meet
Wine is delicious",0.581,0.0,0.419,0.8658
老闆人好親切，熟知各種調酒。而且不貴。,The boss is so kind and familiar with all kinds of bartending.And not expensive.,0.251,0.0,0.749,0.656
"好喝的經典
不失個人特色
值得再訪的好地方","A delicious classic
Personal characteristics
Good place worth visiting",0.586,0.0,0.414,0.8176
適合聊天小酌，沒有吵雜音樂與人聲。,"Suitable for chatting and drinking, there are no noisy music and voices.",0.121,0.0,0.879,0.1326
可抽煙..很放鬆,Can smoke ... Very relaxed,0.466,0.0,0.534,0.5413
舒服的明亮的小店，調酒品質很不錯,"A comfortable and bright shop, the quality of alcohol is very good",0.511,0.0,0.489,0.8553
調酒好，又好吃，老闆風趣！,"Blooming, delicious, the boss funny!",0.697,0.0,0.303,0.784
東西很好吃，調酒很好喝！,"Things are delicious, and bartending is delicious!",0.606,0.0,0.394,0.8268
調酒用心 很舒服的一間店,A shop with a very comfortable intention of bartender,0.31,0.0,0.69,0.5563
舒服自在的酒吧！調酒和whiskey皆有很好的水準！,A comfortable bar!Both bartending and Whiskey both have a good level!,0.43,0.0,0.57,0.7772
"陳設簡約明亮,氣氛輕鬆愉快不喧譁吵鬧","The furnishings are simple and bright, the atmosphere is relaxed and happy, noisy noisy",0.441,0.153,0.405,0.8126
氣氛很好、酒好喝！,The atmosphere is very good and the wine is delicious!,0.473,0.0,0.527,0.8012
餐點用心，飲品調酒優質👍 …,"Meal at the heart, drinking beverages high quality ...",0.344,0.0,0.656,0.6369
安靜、調酒好喝,"Quiet, bartender delicious",0.649,0.0,0.351,0.5719
"酒好喝
老闆有特色","Wine
The boss has characteristics",0.0,0.0,1.0,0.0
酒好喝 氣氛棒~~~放鬆,The wine is a good atmosphere ~~~ Relax,0.492,0.0,0.508,0.7003
無酒單來一樣的兩杯...,Two cups with the same wine without wine ...,0.0,0.0,1.0,0.0
讚！老闆是大人物,praise!The boss is a big man,0.0,0.0,1.0,0.0
咖啡好喝，老闆親切。,The coffee is delicious and the boss is kind.,0.504,0.0,0.496,0.7964
調酒好喝、氣氛舒適,Sky mixing is delicious and the atmosphere is comfortable,0.5,0.0,0.5,0.7906
適合放鬆的好所在！,Suitable for relaxation!,0.649,0.0,0.351,0.5707
除了五星還是五星,Except for five stars or five stars,0.0,0.0,1.0,0.0
調酒很棒！,Blooming is great!,0.687,0.0,0.313,0.6588
很難不愛上的地方,It's hard not to fall in love with,0.362,0.121,0.517,0.5859
老闆超讚,Boss,0.0,0.0,1.0,0.0
氣氛好,Good atmosphere,0.744,0.0,0.256,0.4404
豪飲好所在,Drink good place,0.592,0.0,0.408,0.4404
寵物友善,Pet -friendly,0.762,0.0,0.238,0.4939
氣氛非常輕鬆，所有調酒師都很專業而且友好。琴酒愛好者的絕佳琴酒選擇。馬丁濃縮咖啡確實令人印象深刻。絕對推薦！,"The atmosphere is very easy, all bartenders are very professional and friendly.Pinjou enthusiast's excellent piano wine choice.Martin concentrated coffee is indeed impressive.Absolutely recommended!",0.31,0.0,0.69,0.8395
我在台北最喜歡的酒吧。調酒師兼老闆被親切地稱為老頭（“老頭”），他是一位調酒師，對調酒工藝充滿熱愛，而且非常友善。我的三杯酒加一杯，都是客製化的，大約新台幣1700元。,"I am in Taipei's favorite bar.The bartender and boss were affectionately called the old man (""old man""). He is a bartender and is full of love for the bartending technology and is very friendly.My three glasses of wine and one glass are customized, about NT $ 1,700.",0.191,0.0,0.809,0.886
"一定是五🌟ㄉ
低消一人500","It must be Wuyao
Low one person 500",0.0,0.231,0.769,-0.2732
太貴了，而且我覺得雞尾酒真的很甜，不值得這個價格。您的最低費用是固定的，即使您的朋友感到不舒服。您仍然有義務支付最低費用，只喝一杯飲料。一個小酒吧或說精品酒吧，裝飾很好，酒還可以，但是價格昂貴，我認為老闆或調酒師應該更友好，更體貼他們的顧客......,"It's too expensive, and I think cocktails are really sweet, not worth this price.Your minimum fee is fixed, even if your friends are uncomfortable.You still have the obligation to pay the minimum fee and drink only one drink.A small bar or a boutique bar, the decoration is very good, the wine is okay, but the price is expensive. I think the boss or the bartender should be more friendly, and the customer is more physically posing ...",0.147,0.031,0.822,0.8695
來自加拿大，我只是想在訪問期間與家人喝一杯。 Placebo 就在附近，所以我們選擇了它。  除了普通的烈酒或啤酒之外，我找不到任何簡單的飲料，但價格仍然超過 10 加元。氣氛很漂亮，是社交和喝一杯的好地方，如果你喜歡的話。,"From Canada, I just want to have a drink with my family during the visit.Placebo is nearby, so we chose it.Except for ordinary spirits or beer, I can't find any simple drinks, but the price still exceeds 10 yuan.The atmosphere is very beautiful, it is a good place for social and drinking a cup, if you like it.",0.206,0.0,0.794,0.933
台北 mojito 第一名,Taipei Mojito No. 1,0.0,0.0,1.0,0.0
Bar Genao 擁有豐富的威士忌/雞尾酒和熱情好客知識，是一個讓您始終有賓至如歸的感覺的地方。,Bar Genao has rich knowledge of whiskey/cocktail and enthusiastic hospitality. It is a place where you always have guests.,0.286,0.0,0.714,0.7783
出色的調酒師，超級美味的飲料和極其友好的環境。從現在開始我家的酒吧。,"Outstanding bartenders, super delicious drinks and extremely friendly environments.From now on my bar.",0.626,0.0,0.374,0.9441
享受夜晚的好地方。,Enjoy a good place at night.,0.604,0.0,0.396,0.7269
賣淫場所,Places of prostitution,0.0,0.0,1.0,0.0
晚上喝酒的好地方,Good place to drink at night,0.367,0.0,0.633,0.4404
