Original,EN,Positive,Negative,Neutral,Compound
"首先，辛苦chuさん了！！お疲れ様でし。

忠bar是我在台北喝過最棒的日式酒吧、也是最棒的水果調酒，第一次就非常喜歡，也很喜歡chuさん的職人精神、店內環境和下酒菜。每次到台北一定去的bar！！

希望chuさん可以相信遠在高雄的我，就如同我相信chuさん一直都能做出很棒的酒，我和一同前往的朋友都非常喜歡，有機會上去台北就會繼續支持。

請chuさん不要灰心，忠實顧客會繼續喜愛你的bar～お大事に、さあ！","First of all, hard chu 辛 ん!IntersectionFatter.

Zhong Bar is the best Japanese -style bar I have drank in Taipei, and the best fruit alcohol. For the first time, I like it very much. I also like Chu さ ん 's spiritual spirit, in -store environment and jam.Every time you go to Taipei, you must go!Intersection

I hope that Chu さ ん can believe that I am far away in Kaohsiung, just like I believe that Chu さ ん can always make great wine. Friends and friends who go together will like it very much. If you have the opportunity to go to Taipei, you will continue to support it.

Please Chu さ Don't be discouraged, loyal customers will continue to love your Bar ~ お お に に, さあ!",0.295,0.024,0.681,0.992
"玉荷包的水果調酒與草藥Negroni十足非常出彩！餐食部分，Taco rice 跟塔塔醬炸牡蠣好吃到與同行友人下巴都快掉下來了（香菜番茄花椒炸雞當然也同樣美味）

如此令人髮指的美味只能多來幾次了～","The fruits and herbal medicines of Yuhebao Negroni are very brilliant!For meals, TACO RICE and Tata Sauce Fried Oysters are delicious as they are with my friends and friends.

Such a meritable deliciousness can only be a few more times ~",0.26,0.0,0.74,0.9184
"我想給10顆星
真的有夠好喝 尤其水蜜桃smoothie 酒好順又有濃度
柚子 gin sour 酸甜清爽
紅茶梅酒 順口
食物也好吃 整體來說是定價比較高
但我認為值得的bar","I want to give 10 stars
It's really good enough, especially the peach peach Smoothie is smooth and concentrated
Grapefruit Gin Sour is sweet and sour and refreshing
Black tea plum wine smooth
Food is also delicious as a whole
But I think it is worth BAR",0.191,0.0,0.809,0.7874
"📍Taiwan Taipei🌼

🍸忠 Chu
🏠台北市中山區新生北路三段18號
💰$800+10%～
C/P★★★★☆
Atmosphere ★★★☆☆
Service★★★★☆

老闆很可愛！強調是酒吧而不是餐廳🍴但是食物卻好吃到一個爆炸！每一道都衝破味蕾欸不開玩笑！重點一道菜比酒還便宜很多～人生第一次喝一杯$750的調酒，量雖不多但卻很精緻，都是用上好的食材調味，還是日本進口呢～美食真的會想回顧❤️

#cuisine  #foodie #taiwanfood #taiepifood #foodlover #食べ物 #食べローグ #グルメ #음식 #대만 #음식 #요리 #미식가 #台灣 #美食分享 #美食 #幸福 #taiwan #台北美食","Ataiwan Taipei📍

🍸 🍸 chu
No. 18 Section 3, Xinsheng North Road, Zhongshan District, Taipei City
10 $ 800+10%~
C/P ★★★★ ☆
Atmosphere ★★★ ☆☆
Service ★★★★★ ☆

The boss is cute!It is emphasized that it is a bar instead of a restaurant but the food is delicious!Each way breaks the taste buds without joking!The focus of a dish is much cheaper than wine ~ For the first time in life, drink a cup of $ 750 for the first time. Although the amount is not large, it is exquisite.

#cuisine #Foodie #Taiwanfood #TaiPifood #FoodLover #べ べ #べロ べロ べロ べロ #グ グ #음식 #대만 #요리 #미식가 # #幸 #Taiwan #Taipei Food",0.0,0.0,1.0,0.0
"經營者扇野 忠和先生（又稱Chu桑、Kazy桑）具有深厚的餐飲資歷，既具料理天賦亦擅長調酒。味覺敏銳，擅長將水果融入調酒中，創造獨樹一格的水果特調。

早期總是一人獨挑大樑、忙進忙出，熟客們90%為日籍，每每去喝酒，耳邊此起彼落皆日語交談，大家彼此也都很有默契，愉悅地聊著天耐心等候老闆調酒或是烹調。現在比較多是台灣顧客，規矩也訂較多（不接受2人以上團體、不接受電話訂位、不接待僅用餐以及開車前來的客人）雖多了其他店員幫忙，但忙的時候還是需要等待一下。

Chu桑每天一早必定前往濱江市場採買當季時令的新鮮水果及海鮮。餐點部分以和風洋食為主，菜單不定期更換，如：蟹肉可樂餅、奶油鯷魚馬鈴薯塊、海膽料理、紅酒燉豚肉、漢堡排、章魚沙拉、蛋包飯、明太子義大利麵、莫札瑞拉起司酪梨龍蝦、生蠔⋯等等，道道份量與美味兼具！

但別忘了本質終究是以酒吧為主，並不提供食物外帶，且只想單純用餐的話建議前往別處，這裡是服務酒客的地方😊","Mr. Fano Toyo (also known as Chu Sang and Kazy Sang) has deep dining qualifications, which has both the talent and bartender.The taste is keen, and is good at incorporating the fruits into the bartender to create a unique fruit.

In the early days, I always picked up the beams alone, and I was busy. 90%of the mature guests were Japanese. Every time I went to drink, they talked in Japanese in their ears. Everyone also had a tacit understanding. Blooming or cooking.Now there are many customers in Taiwan, and there are more rules (do not accept groups of more than 2 people, do not accept telephone reservations, do not receive guests, but only dine, and drive from driving. Wait.

Chu Sang must go to the Binjiang market every morning to buy fresh fruits and seafood in seasonal season.The meal part is mainly harmonious and ocean food. The menu is changed from time to time, such as: crab meat cake, creamy catfish potato pieces, sea urchin dishes, red wine stewed dolphin meat, burger row, octopus salad, omelet rice, Prince Mingya pasta, Moza, Moza The Ruilagian avocado lobster, oyster, etc., the duke and the deliciousness are both delicious!

But don't forget that the essence is finally based on the bar, does not provide food takes, and if you just want to eat purely, it is recommended to go elsewhere. This is the place to serve the wine guests.",0.121,0.018,0.861,0.9761
終於造訪了 #bar忠chu，放在口袋名單好久好久了。餐點完全超乎期待，#海膽明太子義大利麵 滿滿的海味奔放（麵條硬度簡直完美）、#香菜檸檬山椒炸雞 的風味層次優雅清爽（炸粉到底是哪家的，超優），開胃先來一杯 #柚子Mojido，真的是畢生喝過最誠意十足的一杯，薄荷葉香氣濃郁又不發苦、搭配檸檬清爽酸味恰到好處。餐後當然要來杯必喝的招牌水果調酒，我選了 #日本晴王麝香葡萄 調酒，優雅淡爽的甜味搭配濃郁的果膠口感，很神奇的一杯調酒，我真的非常享受每一口淡淡拓漫在舌尖味蕾的葡萄甜味。,"Finally visited the #bar Zhong Chu, and put it on the pocket list for a long time.The meal is completely beyond expectations. First, a cup of#先 Mojido is really the most sincere cup of life. The mint leaves have a strong aroma without bitterness, and the lemon refreshing sour taste is just right.Of course, after the meal, I have to drink the sake of alcohol that must be drinking. I chose#, elegant and light sweetness with a strong pectin taste, a magical glass of bartending, I really enjoyed very much enjoyment Each bite of grapes with a faint flavor buds of the tongue.",0.214,0.0,0.786,0.9773
"好可愛又真日式的酒吧
有很多的材料是真真實實的來自日本

像是我們點的第一杯
哈密瓜白蘭地
用了來自日本的哈密瓜
和軒尼斯的白蘭地
真的是香甜中的香甜
果香外還加上白蘭地的葡萄香
真的很棒

另一杯是新鮮草莓的調酒
當然也是來自日本的草莓
甜甜中帶一點酸
是草莓自有的酸氣
加上裝飾的三色堇整體很搭
而且酒好平衡順口

當然因為用了日本的水果和好的材料
酒的單價都偏高一點
但一分錢 一分貨很正常的

這兒低消一人八百
所有消費還另加15%哦
有附熱毛巾和小點心

這邊的食物好像也很強下次再來試試","So cute and real -Japanese bar
There are many materials that are true from Japan

Like the first cup we ordered
Cantaloupe Bailan
Use cantaloupe from Japan
And Bailan in Hennis
It's really sweet in sweetness
Fruit aroma also adds the grape fragrance of Bailan Di
It's great

The other cup is a fresh strawberry bartender
Of course, strawberries from Japan
Sweet and sour
It's strawberry's own sourness
Coupled with the decorative three -color 体 加 加 加 加 加
And the wine is good and balanced

Of course
The unit price of wine is higher
But it is normal for a penny and one penny to goods

Here is a low and one person, one person 800
All consumption also adds 15%more
There are hot towels and snacks

The food here seems to be very strong next time I will try again next time",0.145,0.017,0.838,0.9482
水果調酒很厲害 👍🏻 食物也是其他地方沒吃過的料理手法方式 有推,Fruit alcohol is very powerful 物 Food is also a cooking method that has never been eaten elsewhere.,0.154,0.0,0.846,0.4754
"水果調酒好好喝，夏天的玉荷包調酒超讚，濃郁的荔枝香氣，太好喝一下就shot掉
柚子金桔是我近期新歡，酸酸甜甜尾韻帶點溫和辛辣感，大稻埕也很特別且好喝，最後一定點一杯最愛的紫蘇調酒做結尾","Fruit alcohol is good, the summer jade purse is superb, the strong lychee aroma, too delicious, should be dropped when it is too delicious.
Grapefruit kumquats are my new love recently. Sour sour and sweet tail rhyme with a mild and spicy feeling, Dadaocheng is also very special and delicious. Finally, you must order a cup of favorite perilla bartending",0.426,0.0,0.574,0.9885
整體氛圍輕鬆舒服，香菜檸檬炸雞菜品有水準，招待草莓與起司簡單卻不失格調。點了招牌水果調酒（晴王葡萄）有點失望，水果香氣十足可惜沒有酒感，但這其實是偏好，也是店家的取向。感受上價位偏高。,"The overall atmosphere is easy and comfortable. Coriander lemon fried chicken dishes are standard. The entertaining strawberry and cheese are simple but style.It was a bit disappointed after ordering the signature fruit alcohol (Qingwang Grape). Unfortunately, the fruits have no wine, but this is actually a preference and the orientation of the store.Feel the high price.",0.092,0.152,0.756,-0.7184
"我最愛的酒吧❤️
當季水果特調必點～
哈密瓜、蓮霧、釋迦、草莓、百香果、火龍果中，
我最愛的是蓮霧調酒😍😍😍

忠桑很有自己的堅持✊
日式酒吧多半是希望客人低調交談不互相打擾，
所以忠bar只開放給兩人以下入店，
且不接受預約（通常七點開店都會有位置）
（大約八九點之後才會有較多客人）
店內裝潢簡單乾淨，位置大約只能容納16位
洗手間有很貼心的配備（香味噴霧與女性生理用品）
音樂多為翻唱的英文老歌🎵
適合喜歡安靜的人來用餐與享受調酒的地方！","My favorite bar ❤️
The seasonal fruits are specially ordered ~
Cantaloupe, lotus fog, Shakya, strawberry, passion fruit, dragon fruit,
My favorite is the lotus fog alcohol 是

Zhong Sang has his own persistence 有
Most Japanese -style bars want guests to talk low -key and not disturb each other.
So Zhong Bar is only open to the store below two people,
And do not accept the appointment (usually there will be a location at 7 o'clock)
(There will be more guests after about eight or nine o'clock)
The interior decoration of the store is simple and clean, and the location can only accommodate 16 bits
There are very intimate equipment (fragrance spray and female physiological supplies)
Music is mostly covered English old songs 🎵
Suitable for people who like quietness to eat and enjoy bartending!",0.138,0.028,0.834,0.9429
"調酒跟食物都非常美味
味覺搭配的衝突 層次 都滿點
同伴直說逼米其林星級

很喜歡老闆的cool 跟用心","Blooming and food are very delicious
The level of conflict matching of taste is full
The companion said that Michelin star

I really like the boss's COOL and attentive",0.265,0.062,0.674,0.8186
"一家氣氛很好的日式Bar，室內偏安靜。
一人低消800+15%服務費，每人要點一杯飲品。
服務人員也會很有耐心地介紹菜單～

水果調酒非常厲害！
點了一杯🍈哈密瓜x grasshopper
超級好喝！算是喝過數一數二好喝的調酒
口味偏甜，有一點creamy的感覺 超級順口 🙌

點心、漬物、料理也都不錯吃，但感覺最厲害的是水果調酒！","A Japanese -style BAR with a good atmosphere, the room is quiet.
One person eliminates 800+15%service fee, and each person has a drink.
The service staff will also patiently introduce the menu ~

Fruit alcohol is very powerful!
Ordered a cup of cantaloupe X Grasshopper
Super delicious!I have been drinking a few delicious bartender
The taste is sweet, and a little creamy feels super smooth 🙌

Dim ""Dim Sum, stains, and dishes are also good, but the most powerful thing is fruit alcohol!",0.209,0.0,0.791,0.9523
"氣氛超好，低消好像700，很容易點到
裡面蠻暗的，全日式風格
店內空間不是很大，大概只有10來個位子
位子要先打電話預訂比較保險

酒保真的是日本人
我覺得酒的口味蠻特別
像我點的有點像打碎的蘋果泥配氣泡酒
不喜歡泥狀的要三思

真的是讓人很推薦的一家 Bar！","The atmosphere is super good, it seems to be 700 low, it is easy to click
It's darker inside, full -Japanese style
The space in the store is not very large, there are only about 10 digits
The seat must first call and book more insurance

Jiu Bao is really Japanese
I think the taste of wine is quite special
Like me like a bit like a broken apple mud with bubble wine
Think twice if you don't like mud

It is really a recommended BAR!",0.217,0.07,0.713,0.9385
"點了我自己的定番酒，作為評比的標準來說，是我在台灣喝過最好喝的！
但非常可惜，台灣的客人習慣要點餐，每一桌都在吃飯，像是把這裡當餐廳，整間都是飯菜的味道，並且主人不得不一直在廚房裡忙著，不太能站在吧台後面，殊為可惜！","Once my own Dingfan wine, as the criterion for evaluation, it is the best I have drank in Taiwan!
But it is a pity that the guests in Taiwan are used to ordering meals. Each table is eating. It seems to be the taste of meals as a restaurant. The owner has to be busy in the kitchen. It is a pity later!",0.038,0.09,0.872,-0.555
"環境昏暗舒適，服務人員親切會幫忙介紹
店家有一些小細節相當貼心，例如寒冷冬夜一坐下就送上熱的擦手巾；衛生紙是過敏人專用日本才買得到的柔軟衛生紙；廁所內有洗手乳和護手霜

菜單不能拍照，但餐點可以，低消是一人800元加10%服務費
酒類售價大多為500起跳，種類繁多，可以請店員幫忙介紹
店家最有名的各式水果酒則是600起跳，用高級的新鮮水果製作，很值得一試！
餐點部分則是300起跳，但很多都是500.600以上的價位(破千的也不少喔

哈蜜瓜酒是用半顆哈蜜瓜加三種基酒，如果覺得酒味太濃可以把果肉挖下來，用果汁稀釋酒味，因為哈蜜瓜非常非常甜，這道就像甜點一般，很讓人喜愛啊

蜜桃酒是用新鮮蜜桃做的，每一口都是濃厚蜜桃香，也很推薦","The environment is dim and comfortable, and the service staff will help you introduce
There are some small details in the store that are quite intimate. For example, when the cold winter night is sitting down, it will send the hot hand scarf; toilet paper is a soft toilet paper that is only available in Japan for allergic people; hand -washing milk and hand cream in the toilet

The menu cannot be taken, but the meal is okay. The low consumption is 800 yuan per person plus 10%service fee
Most of the alcohol prices are 500 jumps, and there are many types. You can ask the clerk to help introduce
The most famous fruit wine in the store is 600 jumps. It is worth trying with high -level fresh fruits!
The meal part is 300, but many of them are prices above 500.600 (there are a lot of breaking a thousand

Honeydel wine is used with half a Honey melon and three types of basic wine. If the taste of the wine is too strong, you can dug the flesh and dilute the wine with the juice, because the Honeydel is very very sweet, which is like a dessert. Very love

Peach wine is made of fresh peaches. Each bite is strong peach fragrance.",0.193,0.017,0.79,0.9922
氣氛很棒的日式酒吧，只接兩個人以下的客人，琴酒系列很多也很好喝，水果酒也很正，但就是有點高單價，要考慮一下,"The Japanese -style bar with a great atmosphere, only the guests of less than two people, many of the piano wine series are also very delicious, fruit wine is also very positive, but it is a bit high unit price. Consider it.",0.161,0.0,0.839,0.7574
除了新鮮水果調酒之外，經典調酒也很值得嘗試，水準穩定、功力扎實。哈密瓜白蘭地可以先放一下，等哈密瓜充分吸收白蘭地再吃，味道融合得更好。餐點口味也都在水準之上，不過配菜都是一樣口味的沙拉，醬料有芥末會微辣。廁所備品非常齊全，很貼心。,"In addition to fresh fruit alcohol, classic bartending is also worth trying, with stable standards and solid skills.Can put it first in the Hammer Bailan, and wait for the cantaloupe to fully absorb Bailan to eat, and the taste is better.The taste of the meal is also above the standard, but the side dishes are the same flavored salad, and the sauce will be slightly spicy.The toilet reserve is very complete and intimate.",0.08,0.0,0.92,0.4588
"這是一間你來了絕對會後悔的店
花錢還要受氣的地方
四人用餐1500 寫超小的字
而且我們沒有用餐只有喝酒
也要按照用餐的抵消
有種被詐騙的感覺
店員堅持說老闆有請我們看不懂中文的朋友去看規則 但店員也沒有對客人詳細說明
我們沒看清楚或看不懂 都是客人的問題
老闆還說 因為你們四個人坐了位置 他沒辦法接其他組客人有七個人 位置不夠沒辦法接客人都是我們造成的感覺 真的對不起老闆也因為我們沒辦法讓店裏接大客戶們
沒有提供實質的服務例如 介紹菜單等等 還要收15% 一切都是來消費的客人的錯

帶外國朋友來這間店真的是最失敗的決定

If you don’t read Chinese words, be careful coming to this bar. The minimum purchasing requirement weren’t written in English. And it goes up if you have more ppl coming and only written in small words that’s unable to be aware.

The drink was alright, not as impressive. The service needed to be improved.  You are paying extra 15% service fee for basically no service.

I’m sorry with this experience I will never come back again nor introducing to friends.","This is a shop that you will definitely regret when you are here
Where to spend money and get angry
Four people eat 1500 to write super small words
And we have no meals but only drink
Also offset according to the meal
There is a feeling of being fraudulent
The clerk insisted that the boss had friends who asked us not to understand Chinese to see the rules, but the clerk did not explain in detail to the guests
We didn’t see it clearly or could not understand it.
The boss also said that because the four of you were sitting, he couldn't pick up other groups of guests. There were seven people in the position of seven people who did not have enough positions and could not pick up the guests. We felt sorry for the boss.
No substantial service, such as the introduction menu, etc. 15%, and everything is the fault of the guests who come to consume

It is really the most failed decision to bring foreign friends to this shop

If you do n’t read Chinese words, be careful coming to this bar. Ing and only written in small word that ’s unable to be aware.

The drink was alright, not as impressionive. The Service Needed to be Improved. You are paying extra 15% service fee for basical no service.

I ’m sorry with this excelience I will never come back apor introducing to friends.",0.11,0.095,0.794,0.7373
"最喜歡的bar。
很適合一個人安靜、輕鬆的喝杯酒，短暫放空休息一下。
謝謝老闆的堅持以及每次的招待！","Favorite Bar.
It is very suitable for a person to drink a glass of wine quietly and relaxed, and take a short break.
Thank you boss for your persistence and every hospitality!",0.237,0.0,0.763,0.8398
"非常高級的餐酒館
店主對於食物非常講究
東西都是好吃的
不過就是太貴了一點
個人觀感酒並沒有到這麼高的價錢","Very advanced dining tavern
The owner is very particular about food
Things are delicious
But it's just a bit more expensive
Personal view wine is not at such a high price",0.121,0.0,0.879,0.4582
"扇野忠和Chu桑來台9年後自立門戶

坐位不多，放著Jazz的音樂，氣氛悠閒，適合上班族或怕吵的大叔

廚房的油煙味過重以外，因為可以在室內抽煙、雪茄，怕煙味的人千萬別去

日本原汁原味的專業酒吧，很利害的調酒，尤其是用高級的新鮮水果去調，台灣比較少見，食物也有一定的水準 $$$😍","Fan Yezhong and Chu Sang Laitai set up their own portal 9 years later

There are not many sitting positions, with Jazz’s music, leisurely atmosphere, suitable for office workers or uncle who are afraid of noisy

In addition to the heavy smell of oil smoke in the kitchen, because people who can smoke indoors, cigars, people who are afraid of smoke, don’t go

Japan's original professional bar, very interesting bartending, especially using high -level fresh fruits to adjust, Taiwan is relatively rare, and food has a certain level.",0.125,0.018,0.857,0.8516
很多調酒是用高級的日本水果製作，點了枇杷梅酒及草莓調酒，味道很好，適合我這種喜歡水果且酒味不要太重的人。因爲水果的比例很高，價格較高也是可以接受的。店內也有酒體較重的酒，如果在意的話最好點之前先問過。,"Many bartending is made of high -grade Japanese fruits. I ordered plum wine and strawberry bartending. It tastes good. It is suitable for people like me who like fruits and do not have too heavy wine.Because the proportion of fruits is high, the price is highly acceptable.There are also heavy wines in the store.",0.134,0.0,0.866,0.7845
"整體環境相當日式且優雅
是一個可以非常寧靜品酒及享用美食的酒吧
水果系列調酒都是真材實料相當用心精緻","The overall environment is quite Japanese and elegant
It is a bar that can be very peaceful and enjoy food
Fruit series bartend",0.34,0.0,0.66,0.8839
"很棒的酒吧！最喜歡這種可以安靜喝酒的地方了~門口有寫一些關於這家店的規矩需要大家配合~東西好吃酒也好喝
所以的一切都是美味與賣相兼具，愛了愛了","A great bar!I like this place where you can drink quietly ~ There are some rules about this store at the door that requires everyone to cooperate with everyone ~ It ’s delicious and delicious.
So everything is delicious and selling.",0.336,0.0,0.664,0.9599
經典調酒為主，普通正常的味道，也有一些特調，不過個人不喜歡，食物的部分也是由調酒師製作，所以如果點調酒又點食物的話會等比較久，低消800元是信義區的價格,"Classic bartending is the main special taste. There are also some special tunes, but I do n’t like it. Price of Xinyi District",0.258,0.0,0.742,0.714
餐點和酒都有一定水準，做得很細緻，但還是覺得價位有點太高了～,"The meals and wine have a certain level, and they are very detailed, but I still feel that the price is a bit too high ~",0.058,0.0,0.942,0.1406
"店裡整體營造的氣氛很好
味道有股淡淡的香味
音樂有種昭和感
有種回到日本的感覺
調酒、食物跟服務都很棒
值得推薦","The atmosphere created as a whole in the store is very good
The taste has a faint fragrance
Music has a sense of Showa
There is a feeling of returning to Japan
Blooming, food and service are great
Worth recommending",0.266,0.0,0.734,0.8932
布丁超級好吃~~~我吃過最好吃的  ❤️,Pudding is super delicious ~~~ I have eaten the best ❤️,0.567,0.0,0.433,0.9153
"一人抵銷800元，特色是新鮮水果的調酒，單價略高，一杯調酒均價在500元上下，是好喝的。
環境安靜輕鬆舒服不吵雜。","One person is sold for 800 yuan, which is characterized by the bartending of fresh fruits. The unit price is slightly higher. The average price of a cup of bartender is around 500 yuan, which is delicious.
The environment is quiet, relaxed, comfortable.",0.243,0.0,0.757,0.91
只有吧台位，調酒經典中規中矩，但特調類的有點可怕，小扣分一下，但是食物非常好！因為食物跟酒跟一位製作，所以等待時間都蠻久的，不適合沒耐性的朋友！,只有吧台位，調酒經典中規中矩，但特調類的有點可怕，小扣分一下，但是食物非常好！因為食物跟酒跟一位製作，所以等待時間都蠻久的，不適合沒耐性的朋友！,0.0,0.0,1.0,0.0
