Original,EN,Positive,Negative,Neutral,Compound
定價比較高但真的是此生喝過最好喝的水果調酒，服務也很好，店內客人也不會太多太吵，很放鬆,"The pricing is relatively high, but it is really the best fruit and alcohol that I have drank in this life. The service is also very good. The guests in the store will not be too noisy.",0.265,0.0,0.735,0.9229
"友友生日小聚
服務生甜美可愛🌷
布丁美味🍮","Friends birthday gathering
The waiter is sweet and cute 美
Pudding 味",0.503,0.0,0.497,0.8442
水果調酒是招牌，食物超讚，愛店之一,"Fruit alcohol is a signboard, the food is superb, and one of the love shops",0.39,0.0,0.61,0.8519
蓮霧tequila 、哈密瓜martini、香蕉sour的都好好喝👍🏻,"Lotus Mist Tequila, Hantarin Martini, Banana Sour",0.0,0.0,1.0,0.0
日本籍調酒師活用新鮮水果做成水果特色調酒,Japanese bartender uses fresh fruits to make fruit special bartender,0.385,0.0,0.615,0.6124
是朋友帶我來的日式酒吧，有人數上限限制。低消800，一杯酒均價600。所以大致上客單價過千。點了最有名的水果酒，覺得CP值普通。不過朋友覺得他的蓮霧酒很特別。,"It is a Japanese -style bar that a friend brought me. There is a limit on the number of people.The average price of a cup of wine is 600.Therefore, the unit price is generally over a thousand.I ordered the most famous fruit wine and think the CP value is ordinary.But my friend thinks his lotus fogy wine is very special.",0.192,0.0,0.808,0.902
炸雞非常好吃！也很推薦水果調酒，是個氣氛舒適、值得收藏為口袋清單的好酒吧,Fried chicken is very delicious!It is also recommended for fruit alcohol. It is a good bar that is comfortable and worth collecting as a pocket list.,0.317,0.0,0.683,0.8478
抹茶調酒很推 餐點也很有水準 會二訪的店～,Matcha bartendants are very pushing meals and very standardized shops ~,0.0,0.0,1.0,0.0
"很棒的日式酒吧
已經第二次拜訪
日本籍的調酒師很精準跟精緻
現場附有新鮮的當季水果可以挑選
也能直接說想要什麼樣的基酒來調製
食物也非常好吃
不適合過度喧嘩的地方
我覺得整體非常輕鬆舒服","Great Japanese -style bar
Has been visited for the second time
Japanese bartender is very accurate and exquisite
Fresh season fruit can be selected at the scene
You can also say what kind of base wine you want to modulate
Food is also very delicious
Not suitable for excessive noise
I think the whole is very easy and comfortable",0.258,0.0,0.742,0.9549
"我來說一下我喝的感想
本來就知道這家店消費比在一級信義區酒吧來的高（低消800元）
滿心期待的走進去可能真的太期待有所感受不同
我點的是無花果為主的水果調酒（基本500up)
喝起來很特別 但是也沒有特別驚喜及強烈
畢竟它的價錢偏高 酒的比例也不高
另外點了一杯whiskey純飲 bartender推薦
喝起來太普通 不小心上網google了一下
意外發現這支酒折合台幣不到1300元
但我用了450 元品嚐 1oz
店內沒有什麼裝潢 是典型日本酒吧
可能因為語言不通 bartender 比較照顧日本來的朋友 也顯得我們格格不入
另外加點等很久的薯條 很好吃就是了
雖然離我家不到五分鐘的距離 但再訪機率不高","Let me talk about my feelings
I originally knew that this store consumption was higher than the Bar in the first -level Xinyi District (800 yuan low)
I look forward to walking in, maybe I really look forward to it. I feel differently
I ordered the fruits -based fruit alcohol (basically 500up)
Drinking is very special, but there is no particular surprise and strong
After all, the proportion of its high price is not high
In addition, I ordered a glass of Whiskey pure drink Bartender recommendation
Drink too ordinary, accidentally go online Google
I accidentally discovered that this wine was equivalent to less than 1300 yuan
But I used 450 yuan to taste 1OZ
There is no decoration in the store is a typical Japanese bar
Maybe because the language is not connected to Bartender to take care of Japanese friends, we also seem to be incompatible
In addition, add a little waiting for a long time to taste delicious
Although less than five minutes away from my house, the probability of re -visits is not high",0.098,0.077,0.825,0.8113
"招牌哈密瓜及草莓季特調
喜歡水果調酒的人不可錯過之處","Signature cantaloupe and strawberry season special adjustment
People who like fruits and alcohol should not be missed",0.336,0.0,0.664,0.7259
今天海膽賣完，起司非常好吃，酒的部分覺得是全台北最好喝的葡萄調酒！,"After the sea urchin was sold today, the cheese was very delicious.",0.266,0.0,0.734,0.6115
"第一次去，酒好喝，食物好吃😋
服務很好
希望下次能吃到海膽(⁎⁍̴̛ᴗ⁍̴̛⁎) …","For the first time, the wine is delicious and the food is delicious.
The service was excellent
I hope I can eat sea urchin (吃) next time ...",0.368,0.0,0.632,0.9325
"店內規則：不能拍菜單
我們尊重並遵守了！
當下只文字紀錄準備點的酒類與食物，即被視為不尊重，趕出.....
是否太拿翹了.....🙄？
不知道在不開心什麼~🤬？
非常不尊重客人~~😒","Rules in the store: Can't shoot menu
We respect and obey!
At present, the alcohol and food prepared by only text records are considered disrespectful, and they are driven out ...
Is it too tall ...... 了?
I don't know what I'm not happy ~ 开?
Very disrespect for guests ~~ 重",0.126,0.1,0.773,-0.1796
"貌似日本人開的店?!
整間店散發出一股強烈的日式風情
一入內仿佛穿越到東京經典典雅的酒吧
日式炸物配上當季特調水果，新穎別有一番風味
非常舒服的一個避世所，即使一個人來也適合！","Looks like a shop opened by Japanese?!
The entire store exudes a strong Japanese style
As soon as you enter, it seems to cross the classic and elegant bar in Tokyo
Japanese -style fried objects with seasonal special fruits, novels have a flavor
Very comfortable to avoid the world, even if a person comes!",0.238,0.037,0.725,0.9233
"厲害的酒吧！調酒與食物都很完美
店員與老闆也很親切👍👍👍
下次一定要再來！ …","A great bar!Blooming and food are perfect
The clerk and the boss are also very kind 板
Be sure to come again next time!Mowing",0.418,0.0,0.582,0.9369
釋迦琴酒真的很特別，非常寧靜，適合喜歡一個人喝酒的你，兩人約會也不錯，但對剛出社會的年輕人，低消800真的偏貴～,釋迦琴酒真的很特別，非常寧靜，適合喜歡一個人喝酒的你，兩人約會也不錯，但對剛出社會的年輕人，低消800真的偏貴～,0.0,0.0,1.0,0.0
很有層次的調酒，讓人想嘗試各種不同酒款,"Very layered bartending, making people want to try all kinds of different wines",0.098,0.0,0.902,0.0772
日式風格、有menu，因應當季的水果製成調酒，台北必訪的酒吧,"Japanese style and Menu, because the seasonal fruits are made into bartending, the bar that must be visited in Taipei",0.0,0.0,1.0,0.0
第一次喝用新鮮無花果做的調酒，喜歡❤️,"For the first time, drink with fresh figs, like ❤️",0.348,0.0,0.652,0.5859
"價稍高但食物酒品和氛圍的體驗都美好
服務員十足反差萌","The price is slightly higher, but the experience of food and wine and atmosphere is beautiful
The waiter is full of contrast",0.203,0.0,0.797,0.7469
"水果酒酒體清香帶果泥口感 但不具層次感
料理新鮮 服務人員親切","Fruit wine, wine, fragrance with fruit, but not layered
Fresh service staff is cordial",0.0,0.158,0.842,-0.3491
非常棒的酒吧，調酒跟音樂都很有sense，下次還會再來。,"A great bar, bartending and music are very ance, and will come again next time.",0.227,0.0,0.773,0.6249
"這是我去過最溫暖的bar
很不懂為什麼有人不懂老闆的用心
其實尊重別人
別人也會尊重你
店員的用心，老闆的堅持
每一項都尊崇著日本職人心態
一翻開菜單
各項規定寫的很清楚
坐下來代表我尊重老闆的規定
每次去都能得到非常親切的服務
我對調酒不熟
但店員也很用心的推薦適合我的味道
就像店裡的裝潢一樣
給我一股很溫暖的感覺
非常推薦","This is the warmest BAR I have ever been to
I don’t understand why someone doesn't understand the intention of the boss
In fact, respect others
Others will respect you
The intention of the clerk, the boss's persistence
Each item respects the mentality of the Japanese staff
Open the menu
The provisions are written very clearly
Sit down to represent the rules of my boss
Every time you go, you can get a very kind service
I am not familiar with bartending
But the clerk also recommended the taste that suits me
Just like the decoration in the shop
Give me a very warm feeling
Very recommended",0.207,0.0,0.793,0.9637
完美，台北最愛的酒吧，食物美味，酒特別，水果調酒都是用日本空運來台的新鮮水果。老闆親切，雖然中文不好，還是盡力講解，服務人員也會在一進門告知該店規定及消費，不能遵守的客人何必消費？,"Perfect, Taipei's favorite bar, delicious food, special wine, fruit alcohol is fresh fruits that use Japanese air to Taiwan.The boss is kind. Although the Chinese are not good, they still try their best to explain. The service staff will also inform the store as soon as possible and consumption.",0.346,0.036,0.617,0.9665
"寧靜遠離喧囂的日式酒吧🍸

2020／07
#Q比的生活點滴 …","Tranquility away from the hustle and bustle Japanese bar 🍸

2020/07
#Q Life is bitter ...",0.136,0.136,0.728,0.0
令人愉悅的一次經驗😊特別想提及店裡音樂選的非常優秀！加加加分！！ …,A pleasant experience 😊 I especially want to mention the excellent choice of music in the store!Add plus points!IntersectionMowing,0.457,0.0,0.543,0.9346
這裡是我最喜愛的bar，來這邊很多年了，第一次也被日本師傅的規矩多給嚇到，並被一句”不要問為什麼”而不知所以然。然而，多來了幾次，我越來越欣賞師傅的原則與堅持。我認為人與人最重要的互相尊重，你尊重店家的規矩，自然沒有人會來為難你。在這邊，我可以喝到新鮮頂級的水果酒，聽著放鬆舒服的音樂，而且師傅很常更換menu，跟一堆萬年不變的店家完全不同！這就是這裡迷人的地方啊！大家都懂得店家的規矩，就能在一個熟悉的環境度過愉快的時光。我很喜歡這裡，不要問為什麼：p,"This is my favorite BAR. I have been here for many years. For the first time, I was scared by the rules of the Japanese master, and I was ""don't ask why"" and I don't know why.However, after a few more times, I more and more appreciate the principles and persistence of the master.I think the most important respect for people and people. If you respect the rules of the store, no one will embarrass you.Here, I can drink fresh top fruit wine, listen to relaxed and comfortable music, and the master often changes Menu, which is completely different from a bunch of unchanged shops!This is the charming place here!Everyone knows the rules of the store and can spend a pleasant time in a familiar environment.I like it very much, don't ask why: P: P",0.219,0.045,0.737,0.9805
"好喝 也有創意

美中不足的是價位非常高 即便是用比較好的酒 一杯水果調酒台幣750-850的價位是偏高的 比很多紐約、新加坡和香港的日式酒吧還貴

規矩非常多 但店家有入座時說明 不過我的確是看隔壁桌很倒霉一直惹到店家","It's also creative

The disadvantage is that the price is very high, even if the price of 750-850 with a better glass of wine is more expensive than many Japanese bars in New York, Singapore and Hong Kong.

There are a lot of rules, but when the store has a seat, it shows that I did see that the next table is very unlucky.",0.058,0.028,0.913,0.25
"釋迦那杯 真的沒啥平衡可言
Gin fizz  清香還行
食物好吃有餘 驚艷不足","Sakama Cup is really no balance to say at all
GIN FIZZ fragrance is okay
The food is delicious and stunning, insufficient",0.286,0.087,0.627,0.6915
店家規定要點調酒，由於開車不能喝有酒精，也沒有提供軟性飲品還不能用餐點抵，大家請慎選餐廳，服務不好、餐點份量少、衛生也很不佳，整體體驗感覺很差！ 連一顆心都不如,"The store stipulates that you must order bartending. Because you ca n’t drink alcohol when you drive, you do n’t provide a soft drink and you ca n’t get a meal. Please choose the restaurant carefully. Difference!Even a heart is not as good as",0.164,0.047,0.789,0.7083
"新鮮水果為主的調酒是主要特色。單杯主要700起跳…

好喝的果汁。走的是喝到新鮮果粒的那種。

裝潢普普

食物沒吃但看起來是好吃的","Fresh fruits are the main features.Single cup is mainly 700 jump ...

Elyded juice.The kind of fresh fruit is walking.

Decorating

The food is not eaten but it looks delicious",0.233,0.0,0.767,0.8022
服務態度很不好，女服務生講話很不客氣。或許人與人溝通不用這麼使用命令的語氣，讓消費者很不舒服。但或許因為餐廳定價高，對服務有要求，有種花錢受氣的感覺。,"The service attitude is not good, and the female waiter is very polite.Perhaps people do not need to use the command to communicate with people, making consumers uncomfortable.However, maybe because the restaurant has high pricing, it has requirements for services and feels angry.",0.0,0.122,0.878,-0.6914
"我純喝調酒
價格比台灣酒吧略高
味道不是很喜歡，但這很主觀
講些客觀的部分
我在吧台上看到bar tender調好倒進A杯後
可能是吧備拿錯杯子還怎樣
Bar tender直接從A杯倒進B杯
整個味道冰度都會改變吧
以這個價位有這樣的服務我覺得有待改進","I drink bartender purely
The price is slightly higher than the Taiwanese bar
The taste does not like it, but this is very subjective
Speak some objective parts
I saw Bar Tender on the bar and poured into the A cup
Maybe it ’s what if you have the wrong cup
Bar Tender poured directly from the A cup into the B cup
The whole taste will change, right?
At this price, there is such a service. I think it has to be improved",0.046,0.063,0.892,-0.1419
"酒好喝，食物好吃。
是個安靜悠閒的地方，很喜歡。","The wine is delicious and the food is delicious.
It's a quiet and leisure place, I like it very much.",0.368,0.0,0.632,0.872
第一次造訪，感覺像在日本，會找時間再訪。,"For the first visit, it feels like in Japan, and I will find time to visit again.",0.135,0.0,0.865,0.3612
酒與下酒菜都是台北top 10,Both wine and wine are Taipei TOP 10,0.266,0.0,0.734,0.368
新鮮水果調酒好喝👍,Fresh fruit alcohol is delicious 调,0.6,0.0,0.4,0.7184
"低消偏高，一人要800塊錢，等於要2杯起跳。
裝潢不算華麗，但還算舒適。
經典調酒還算不錯，而且真的頗大杯，這樣單價算算其實沒有比較貴。
水果調酒相當優秀，可說不輸銀座的一級店。
一杯雖然要600，但考慮到進口新鮮水果的成本，其實也還好。","The low disappearance is high. One person costs 800 yuan, which is equivalent to 2 cups.
The decoration is not gorgeous, but it is comfortable.
The classic bartending is not bad, and it is really a big cup. This is not more expensive in this unit price.
Fruit alcohol is quite excellent, but it can be said that it is not lost in the first -level store.
Although a cup is 600, considering the cost of importing fresh fruits, it is actually okay.",0.214,0.037,0.749,0.9628
"時間：2021/01/29（3.9）
北海道扇貝咖喱好吃，濃郁微辣，漢堡排普通，偏甜，炸雞也普通。無花果起士花很好吃。酒類的話，草莓不錯，有一款茶酒超級驚艷，兩者酒感不高。整體來說好吃，但價格實在太高，在台北可能有更好的選擇，推薦但應該近期不會二訪","Time: 2021/01/29 (3.9)
Hokkaido scallop curry is delicious, rich and slightly spicy, the burger is ordinary, sweet, and fried chicken is also ordinary.Figs and fruits cheese flowers are delicious.For wine, strawberries are good. There is a tea and wine super stunning, and the wine feels not high.Overall it is delicious, but the price is too high. There may be better choices in Taipei. It is recommended but should not visit in the near future.",0.239,0.0,0.761,0.9473
一開始要點柚子文旦水果酒，吧台說沒有，過了十來分鐘另一組客人進來點一樣的就有了，雖然吧台有來說明是他們的失誤並道歉，但也僅只於此，對於一間高級酒吧來說這樣的處理方式其實頗感意外，生蠔有點腥味，明太子義大利麵還不錯，但是蒜頭炸過頭苦味太重，兩杯調酒還可以，味道稍嫌單調。,"At the beginning, I would like to order grapefruit Wendan fruit wine. For high -end bars, such treatment is actually quite surprising. The oysters are a bit fishy.",0.158,0.0,0.842,0.5984
"超高檔水果使用，調酒一杯不算便宜但跟老闆的身材一樣大器，容量是一般的二杯🤣所以CP值還是超高
照片是老闆多調招待的特大顆白葡萄調酒，基酒是好喝的蘋果蒸餾琴酒Le gin, balance極佳，重點招待一小杯的量，已經別人家的一杯了阿😂 …","Used ultra -high -grade fruits, a cup of bartending is not cheap, but the same as the boss's body, the capacity is the general two cups, so the CP value is still super high
The photo is a large white grape bartender that the boss entertains more. The base wine is a delicious apple distilled piano lew gin. Balance is excellent, focusing on the amount of a small cup of entertainment.",0.295,0.0,0.705,0.9838
"1.Google上的菜單圖片都跟當場吃到的不一樣
炸牡蠣只有三顆？？？？Google上面的是五顆
份量有夠少，是在塞牙縫嗎？
2.而且為什麼製作調酒要用手抓冰塊
非常的不衛生⋯","1. The menu pictures ongoogle are different from eating on the spot
There are only three fried oysters?IntersectionIntersectionIntersectionGoogle is five on top
Is there enough amount of portion, is it stuffing the teeth seam?
2. And why do you need to grab ice cubes by making bartender
Very unhygienic ...",0.042,0.0,0.958,0.2869
老闆的調酒是真功夫，本次點了麝香葡萄調酒（Gin基底）與焙茶Gin Tonic都非常滿意。服務生也絲毫不馬虎，細心介紹每樣酒品，店裡過11點後少了來用餐的人們，反而安靜舒服。很棒的地方！非常推薦！,"The bartender's bartending is a real kung fu. This time, I ordered the musk grape bartender (Gin base) and roast tea GIN TONIC.The waiter was not sloppy, and carefully introduced each wine. After 11 o'clock in the store, the people who came to dine were less and comfortable.A great place!Very recommended!",0.112,0.025,0.863,0.705
特色水果酒很好喝，但價格也頗為高昂,"Featured fruit wine is delicious, but the price is quite high",0.19,0.0,0.81,0.3291
"食物好吃😋調酒好喝☺️非常喜歡這間酒吧的地方在於所有東西都很有品質，可以吃得出來用得原料很好，會再來訪
幾乎每個禮拜都來，菜單也是常常更換不重複，類似的品項也常常會進行微調，所以常常來也每每都被驚喜到💕 …","The food is delicious.
Almost every week, the menu is often replaced and not repeated. Similar items are often fine -tuned, so they often come and be surprised to 💕 ...",0.295,0.0,0.705,0.8934
"好喝的調酒，超好吃的料理，
超推水果系列調酒，
會想再來，一直去！！
限定，三人以下喔，
不過氛圍就是適合放空喝酒，聊點小天，
享受那安靜舒適的氛圍。","Easily bartending, super delicious dishes,
Super push fruit series bartender,
I would like to come again, go all the way!Intersection
Limited, less than three,
But the atmosphere is suitable for drinking and drinking, chatting with little sky,
Enjoy the quiet and comfortable atmosphere.",0.346,0.026,0.628,0.9507
"調酒好喝、季節水果調酒特色十足，料理也相當出色。
老派日式酒吧風格，氣氛輕鬆悠閒，適合單人或雙人前來，不適合團體客人。","The bartending is delicious, the seasonal fruit is full of alcohol, and the cooking is also quite good.
The old -fashioned Japanese bar style, the atmosphere is relaxed and leisurely, suitable for single or double people, not suitable for group guests.",0.21,0.0,0.79,0.8777
日式風格的酒吧，水果酒為主軸，我們選了草莓及釋迦，調出草莓酒及釋迦酒，釋迦酒非常特別，還保有釋迦的果肉，適合喜愛偏甜口味者。環境安靜，另外餐點也十分推薦，非常推薦喜愛水果酒的人試試。,"The Japanese -style bar, fruit wine as the main axis. We chose strawberries and Shakya, transferred strawberry wine and Shakya wine. Shakya wine was very special. It also kept Shakya's flesh, suitable for those who love sweet flavors.The environment is quiet, and the meal is also very recommended. It is recommended that people who love fruit wine are very recommended to try.",0.27,0.0,0.73,0.9606
七點進場點了一堆吃的跟四杯還五杯酒，九點半被老闆請出場，因為後面有其他客人，結帳六千多元，應該比其他桌客單價高吧？感覺很奇妙，還想繼續點，但第一次被趕客,"At seven o'clock, I ordered a bunch of five glasses of wine with four cups of wine. I was invited by the boss at 9:30 because there were other guests in the back. It should be more than 6,000 yuan. Should it be higher than the unit price of other table guests?It feels wonderful, I want to continue, but I was rushed for the first time",0.052,0.0,0.948,0.3612
老闆很沒有禮貌，口氣很差，也不想去了解客人需求。低消$800，但入門消費前，完全不肯提供菜單參考，很奇怪，又不是無菜單料理⋯⋯各種對待客人的方式和態度都令人傻眼。,"The boss is very polite, his tone is poor, and he does not want to understand the needs of guests.It is a low -time $ 800, but before the entry consumption, it is unwilling to provide the menu reference. It is strange, but it is not a menu dish. The ways and attitudes of various treatments and attitudes are dumbfounded.",0.0,0.158,0.842,-0.808
價位中上，品質優等，值得再訪的店家,"The price is high, the quality is excellent, and the store is worth visiting",0.318,0.0,0.682,0.6808
好吃好喝但但總價有點高，雖然品質對得起價錢但感覺也許有人沒辦法接受所有可能還是要注意一下～,"It's delicious, but the total price is a bit high. Although the quality is worth the price, it may be possible to accept everything.",0.278,0.0,0.722,0.7964
台北有很多更好的bar可以選擇,There are many better bar in Taipei to choose from,0.244,0.0,0.756,0.4404
是全台北最喜歡的調酒 ❤️❤️❤️,It is the favorite bartender in Taipei ❤️❤️❤️,0.2,0.0,0.8,0.4588
很喜歡這裡安靜的氛圍，控制人數，可以讓我想休息的人，可以在這好好喝酒，真的很自在，很喜歡這邊，師傅也一直在進步，一直更新調酒、料理，謝謝🙏讓我可以好好休息、放鬆的好地方。 …,I really like the quiet atmosphere here and the number of controlling people. People who make me want to rest can drink well here. I really like this. The master has been improving. I can rest and relax a good place.Mowing,0.364,0.0,0.636,0.9421
價格雖然偏高但是畢竟酒跟水果都是上上之選，加上老闆的調酒技術，也算是很物有所值的， 還有精彩的洋食可吃,"Although the price is high, after all, wine and fruits are the best choices. In addition, the bartending technology of the boss can be considered worthy of money, and there are wonderful foreign foods to eat.",0.247,0.0,0.753,0.8957
水果調酒讓人驚艷❤,Fruit alcohol is amazing ❤,0.667,0.0,0.333,0.8402
"食物非常好吃
酒非常好喝
不來真的是你的不幸
下次絕對會再來","Food is very delicious
Wine is very delicious
It's really your misfortune
I will definitely come again next time",0.4,0.0,0.6,0.893
水果調酒十分美味！老闆很嚴謹的古典日式酒吧。,Fruit alcohol is very delicious!The boss's rigorous classical Japanese bar.,0.0,0.228,0.772,-0.3931
"酒真的不知道怎麼調配的
餐點一般般以外 服務態度真是驚為天人的不舒服
這是貴店經營之道嗎 不敢恭維
附近便利商店的礦泉水 都能讓我比較醉","I really don’t know how to prepare the wine
The service attitude of the meal is generally shocked by the uncomfortableness of heaven and man
Is this the way you operate in your store, dare not compliment
The mineral water of a nearby convenience store can make me more drunk",0.058,0.133,0.809,-0.5018
沒想到平常的食物可以做的這麼美味！,I did not expect that ordinary food can be so delicious!,0.335,0.0,0.665,0.7213
"調酒很好喝，均價一杯600。低消800。人數限3名以下。
環境有點普通。但酒真的很好喝。","The bartender is delicious, the average price is 600.Low 800.The number is limited to less than 3.
The environment is a bit ordinary.But wine is really delicious.",0.265,0.056,0.679,0.796
