Original,EN,Positive,Negative,Neutral,Compound
店裡座位分成吧台、桌椅區和沙發區，沙發區很舒服。雖然餐點種類不多，但每一樣都滿好吃。大推冷肉拼盤，就是一般的生火腿拼盤，非常下酒。八款調酒都偏向熱帶島嶼水果風，酒感都不明顯，會以為在喝水果汁或水果茶，但實際上酒精濃度都不低，喝多會醉的,"The seats in the store are divided into bar tables, tables and chairs areas, and sofa areas. The sofa area is very comfortable.Although there are not many types of meals, they are all delicious.Large pushing cold meat platter is the ordinary raw ham platter, which is very wine.Eight bartending bartending is biased towards tropical island fruit wind, and the wine feels not obvious. I think that drinking water juice or fruit tea, but in fact, the concentration of alcohol is not low, and it will be drunk when drinking more.",0.024,0.05,0.927,-0.3462
"「Isla 612」酒類、餐點和裝潢都極有特色，很適合個人小酌、情侶約會、或與三五朋友聚餐聊天的好地方。特別推薦店家的特調，每一杯都有精心設計，大多都是水果風味，酒精味道都不會太濃，不論是小酌暢飲都很適合，心動的朋友不妨來這嚐美味，很值得一訪再訪喔。🥰🥰🥰

開車不喝酒，喝酒不開車，未成年請勿飲酒","""ISLA 612"" alcohol, meals and decoration are very distinctive, which is very suitable for personal drinking, couple dating, or good places to chat with three or five friends.Special recommendation of the store is specially designed. Most of the fruits are designed with fruit. The taste of alcohol will not be too strong. It is suitable for drinking and drinking. Friends with heart may wish to come here to taste delicious. Visit again.Bleak

Drive without drinking, drink alcohol, do not drive, please do not drink for minors",0.166,0.047,0.788,0.9175
"喜歡葡萄調酒，酒感不重，清爽順口
服務超級友善，謝謝讓我們度過完美的生日
很喜歡整體的裝潢，還有沙發區，跟閨蜜聊天超舒服","I like grapes and alcohol, the wine feels not heavy, refreshing and smooth
Service is super friendly, thank you for letting us spend the perfect birthday
I really like the overall decoration, as well as the sofa area, which is super comfortable to chat with girlfriends",0.43,0.0,0.57,0.9796
"店內的氛圍很棒 給人很放鬆的感覺
酒也不錯
不過我蠻在意店內有油煙味的部分
改善的話會很棒","The atmosphere in the store is great to give people a very relaxed feeling
Wine is also good
But I care about the smell of oil fume in the store
It will be great if you improve",0.408,0.052,0.54,0.9592
"這是我全台北最愛的bar，一進到店內根本就是到南洋島嶼放假呀！
Super chill, super cozy.","This is my favorite BAR in Taipei. As soon as I entered the store, I went to Nanyang Island to take a vacation!
Super Chill, Super Cozy.",0.316,0.0,0.684,0.902
店長人帥又會聊天，調酒好喝味道不單調，找機會帶朋友回訪👍👍,The manager is handsome and chats again.,0.348,0.0,0.652,0.4939
很舒服聊天喝酒的地方 ♥️ 還有一隻毛毛叫花花 😻,Very comfortable to chat and drink ♥ ️ and a hairy called Huahua 😻,0.403,0.0,0.597,0.8955
"氣氛超讚👍點了薯條還有兩杯酒
超好喝又好吃😝
想要喝的酒，調酒師都可以幫妳客製化❤️
超級推薦的一家酒吧
闆娘也有在龍潭夜景區開景觀餐廳（嶺空），非常值得去！！！","The atmosphere is superb, or order the fries and two glasses of wine
Super delicious and delicious 又
The wine you want to drink, the bartender can help you make customer production ❤️
Super recommended a bar
Ban Niang also has an open -air restaurant (Ridge) in Longtan Night Scenic Area, which is worth going!IntersectionIntersection",0.355,0.047,0.598,0.9709
"較適合用晚餐喝小酒之處，如果以晚餐為主，這裡的餐以炸物和墨西哥餐為主，我們這天去似乎只有一個服務人員，內外場都要跑，餐點等了兩個小時才收到最後一道，餐點和飲品也有弄錯的，座位和店內氛圍ok，如果想體驗特色調酒也可以來，想吃飯的話就不建議了！
A place for cocktails rather than food","It is more suitable for drinking small wine for dinner. If dinner is mainly, the meals here are mainly fried and Mexican meals. We seem to have only one service staff this day. I received the last one in the hour, and the meal and drinks were also wrong. The seats and the atmosphere of the store were OK. If you want to experience the special bartending, you can also come. If you want to eat, it is not recommended!
A Place for Cocktails Rather than Food",0.061,0.051,0.889,-0.1739
想體驗歐洲風情感的，還有特色酒吧，這邊在市區附近就有喔！非常不一樣，而且也有外國人跟漂亮外國臉孔老闆娘喔！真的像在國外呢！,"Those who want to experience the European style emotions are also a special bar, here are near the city!Very different, and there are foreigners and beautiful foreign faces.It's really like abroad!",0.295,0.0,0.705,0.8828
女吧台手很漂亮，態度很好,"Women's bar hand is very beautiful, and the attitude is very good",0.54,0.0,0.46,0.8906
"第一次來覺得還不錯
之後會換菜單 有點新菜 鴨
不錯吃 半雞的cp更高

來杯 寶貝睡三天 貴妃賞月嚐柚茶","I think it's pretty good for the first time
After that, I will change the menu and have a new vegetable duck
Good CP that eats half chicken is higher

Come to the cup baby sleep for three days, the concubine enjoy the monthly taste pomelo tea",0.221,0.0,0.779,0.9042
"調酒超級好喝又好看，食物也不馬虎！
老闆和bartender 都超級熱情，介紹和推薦也都很用心也很有耐心！
氣氛非常好！大力推薦！","The bartending is super delicious and beautiful, and the food is not sloppy!
Both the boss and Bartender are super enthusiastic, and the introduction and recommendation are also very careful and patient!
The atmosphere is very good!Great recommendation!",0.404,0.0,0.596,0.9708
"闆娘推薦的煙燻鴨胸跟貴妃賞月嚐柚茶，都很不錯👍
店內氣氛很好，音樂音量也剛好，適合週五下班跟朋友來小酌微醺一下！ …","The smoky duck breasts recommended by Banniang and the concubine to enjoy the monthly grapefruit tea are very good
The atmosphere in the store is very good, and the volume of music is just right. It is suitable for friends to drink with friends on Friday!Mowing",0.309,0.0,0.691,0.9507
意外發現的調酒吧 ，酒很好喝也很有創意 ，玉米脆片和沙拉份量都蠻多的，很適合三五好友一起小聚的地方！,"The accidental bartending bar, the wine is very delicious and creative. The corn crisp and salads are quite large, which is very suitable for three or five friends to gather together!",0.272,0.033,0.695,0.882
店很美，老闆很客氣，這次買外帶茶很好喝！而且發因為是使用立體茶包，回家後還可以再回沖，推推！！！,"The shop is beautiful, the boss is very polite, this time it is delicious to buy tea!And because I use a three -dimensional tea bag, I can rush back after I go home and push!IntersectionIntersection",0.199,0.0,0.801,0.8475
調酒好喝，店員年輕帥氣又會聊天，下次會在來訪,"The bartender is delicious, the clerk is young and handsome, and will chat, and will be visiting next time",0.289,0.0,0.711,0.7845
"調酒好喝，服務也很棒，絕對是林森北路上必試的酒吧！Great bar, cocktails are interesting and service is good!","The bartending is delicious and the service is great. It is definitely a must -try bar on the North Road of Linden!Great Bar, Cocktails Are Interesting and Service Is Good!",0.4,0.0,0.6,0.9492
"意外發現的拉美風調酒吧！🤩
調酒好喝之外，調酒師也親切好聊。環境很令人自在放鬆。有空一定再來！ …","The Latin American Wild Wind Bar!Bleak
In addition to the bartender, the bartender is also kindly talked about.The environment is very relaxed.Come again when you have time!Mowing",0.127,0.0,0.873,0.5837
闆娘很熱情、酒杯有特色，店內有大螢幕可看體育賽事～還不錯的酒吧，環境也舒適,"Ban Niang is very enthusiastic and has a special feature of the wine glass. There are large screens in the store to watch sports events ~ pretty good bar, the environment is also comfortable",0.33,0.076,0.593,0.8999
酒好喝👍bartender 很熱情，會關心客戶喝的適應狀況，介紹的詳細 下班放假聚餐都適合來放鬆喝一杯吃東西！裝潢真的很漂亮💗 …,"The wine is very enthusiastic, and it will care about the adaptation of the customer to drink. The detailed holiday dinners introduced are suitable to relax and drink a glass of food!The decoration is really beautiful ...",0.344,0.0,0.656,0.95
二次回訪，剛好遇到萬聖節活動，店裡內外都有萬聖節裝扮，店內外客人絡繹不絕、嬉鬧聲此起彼落，十分融洽，非常喜歡店內氣氛，店員平易近人且非常貼心和禮貌，適合小憩聊天放鬆的場所。,"In the second visit, I just met Halloween activities. There were Halloween dress inside and outside the store. There were endless streams of guests inside and outside the store. Chat where to relax.",0.083,0.0,0.917,0.4404
"第一次來感覺還不錯....
質感好....
期待下次能有更多驚艷.....","It feels good for the first time ...
Good texture ....
Looking forward to more amazing next time ...",0.382,0.0,0.618,0.8718
非常喜歡，新任店長的特調，又美又好喝，這麼視覺享受兼具的酒吧，怎麼能錯過，喜歡裡面親切的員工們❤️附上美美的酒和美美的我們合照,"I like it very much. The special tone of the new store manager is beautiful and delicious. How can I miss such a visual enjoyment, how can I miss it? I like the friendly employees.",0.434,0.062,0.504,0.9646
"氣氛很好～老闆人Hen Nice！
適合下班小酌！！","The atmosphere is very good ~ boss hen nice!
Suitable for get off work!Intersection",0.354,0.0,0.646,0.7634
"調酒 酒感隱藏的很好 很順很好喝
不知不覺就茫了 很舒服的茫 👍","The winemaking wine is hidden very well, very smooth and delicious
Unconsciously, it's vast and comfortable.",0.426,0.0,0.574,0.8643
有個捲頭髮店員非常沒禮貌 不會再去感謝,There is a rolling hair shop clerk very rude and will not thank you anymore,0.0,0.294,0.706,-0.6601
"牛肉千層面好吃😋
一群人一起吃，上菜有點慢🥺","The beef thousand levels are delicious 层
A group of people eat together, and the food is a bit slow 🥺",0.15,0.0,0.85,0.5719
酒好喝店員親切👍👍,Wine good shop clerk cordially 员,0.367,0.0,0.633,0.4404
"喝得開心
吃得滿足
貼心服務
舒舒服服
值得送上五星祝福","Drink happily
Be satisfied
Intimate service
Comfortable service
It is worth sending five -star blessings",0.602,0.0,0.398,0.9337
"店內佈置很有氣氛
酒單很有特色，種類多樣","The layout in the store is very atmospheric
The wine list is very distinctive and diverse",0.0,0.0,1.0,0.0
店員很有人情味，千層麵超好吃！,"The clerk is very humane, and the thousand levels are super delicious!",0.441,0.0,0.559,0.8356
氣氛好、店員好、酒好,"Good atmosphere, good clerk, good wine",0.744,0.0,0.256,0.8271
氣氛很不錯的酒吧，酒也不錯～貴妃賞月（調酒）很清爽～推推！,"The atmosphere is very good, the wine is also good ~ The concubine enjoy the moon (bartender) very refreshing ~ push!",0.347,0.0,0.653,0.862
環境很舒服，很有峇里島的氛圍！酒和無酒精都好喝，超讚！,"The environment is very comfortable and there is a Bali atmosphere!Alcohol and alcohol are delicious, so amazing!",0.477,0.0,0.523,0.9293
氣氛輕鬆，價位合理，店員十分親切,"The atmosphere is easy, the price is reasonable, and the clerk is very kind",0.355,0.0,0.645,0.7645
"點了貴妃賞月茶（右邊的）
很好喝
除了酒很讚外，還有提供墨西哥帽可以拍照
٩(˃̶͈̀௰˂̶͈́)و","Ordered the concubine to enjoy the moon tea (on the right)
Delicious
In addition to wine, there are also Mexican hats to take pictures
٩ (و) ˃̶͈̀௰˂̶͈́",0.216,0.0,0.784,0.7845
酒好喝，人也非常nice。很適合一個人或多人享受的店。音樂很也水準超有feel,The wine is delicious and the person is very nice.It is very suitable for shops enjoyed by one or more people.Music is also very standard,0.233,0.0,0.767,0.7906
"香草奶昔超好喝，不喝酒的朋友大推🥰
還有懶骨頭位置真的無敵舒服😍 …","Vanilla shakes are super delicious, friends who don't drink alcohol push a lot
There is also the lazy bone position is really invincible and comfortable ...",0.441,0.062,0.497,0.9456
薯條酥脆炸的很棒，調酒很特別，店內氣氛很好..,"The fries are crispy and fried, and the bartender is very special. The atmosphere in the store is very good ..",0.246,0.0,0.754,0.734
"店員算親切
有趣的活動
酒濃甜
不盡有層次
但跟朋友聚會還行","The clerk is kind
Interesting activity
Strong wine
Endless level
But meeting with friends is okay",0.536,0.0,0.464,0.8934
"寶貝睡三天
喝完甜甜入睡，醒來不知道幾年幾月","Baby sleeps for three days
After drinking, I sleep sweetly, I won't know how many years and a few months wake up",0.129,0.0,0.871,0.4767
環境很chill，酒好喝，下班後來一杯超爽的,環境很chill，酒好喝，下班後來一杯超爽的,0.0,0.0,1.0,0.0
"環境讚讚讚 酒好喝
店員也很親切👍 …","Environment praise praise wine is good
The clerk is also very kind ...",0.605,0.0,0.395,0.9299
"這裡供應超浮誇調酒啦🤣🤣🤣
想下班喝一杯很適合❤️ …","Here the supply of super exaggerated wine 🤣🤣🤣 这里 这里 这里 这里 这里
It is very suitable for drinking a cup to get off work. ❤️ ...",0.26,0.027,0.713,0.9201
酒很好喝 環境不錯 老闆娘也很漂亮,"The wine is delicious, the environment is good, the boss lady is also very beautiful",0.474,0.0,0.526,0.8955
溫馨的環境、盡職的吧檯、理想的價格,"Warm environment, due diligence bar, ideal price",0.515,0.0,0.485,0.6486
很喜歡這裡的氛圍，服務人員也很親切，知道我妹妹今天生日，送了梅乾地瓜，又送了五杯shots給我們🥰今天點的酒都是店內推薦的特調，都是以新鮮水果為主，喝起來很順口，也很香甜，非常喜歡☺️謝謝～🙏有機會會在來光顧的😊,很喜歡這裡的氛圍，服務人員也很親切，知道我妹妹今天生日，送了梅乾地瓜，又送了五杯shots給我們🥰今天點的酒都是店內推薦的特調，都是以新鮮水果為主，喝起來很順口，也很香甜，非常喜歡☺️謝謝～🙏有機會會在來光顧的😊,0.522,0.0,0.478,0.9001
店員熱情～細心介紹調酒！聚會好地方！,The clerk is enthusiastic ~ carefully introduce bartending!Good place for party!,0.499,0.0,0.501,0.7896
玩遊戲喝酒坐沙發區很快起來~,Play games and drink and sit in the sofa area soon ~,0.179,0.0,0.821,0.34
炸物都很好吃 調酒有用心,The fried objects are delicious and bartend,0.381,0.0,0.619,0.5719
酒好喝 氣氛跟音樂很異域風情❤️,The good atmosphere and music of the wine are very exotic ❤️,0.195,0.0,0.805,0.4404
燈光氣氛很到位，酒也好喝，推薦啦～,"The light atmosphere is in place, and the wine is delicious. It is recommended ~",0.297,0.0,0.703,0.6705
"環境還滿舒適的
有沙發可以坐😀
服務也不錯 …","The environment is still comfortable
There are sofas to sit
The service is also good ...",0.307,0.0,0.693,0.7351
環境舒服，薯條超級無敵好吃,"The environment is comfortable, the fries are super invincible and delicious",0.668,0.0,0.332,0.9337
大家都很熱情！很開心、氣氛也很好～❤️,"Everyone is very enthusiastic!Very happy, the atmosphere is also good ~ ❤️",0.395,0.0,0.605,0.8004
酒好喝shot很酷老闆娘超讚❤️,"The wine is so good, the cool boss is super happy ❤️",0.607,0.0,0.393,0.9313
酒好喝，氣氛佳，好打卡，非常推薦。,"The wine is delicious, the atmosphere is good, good for checkup, it is very recommended.",0.513,0.0,0.487,0.8908
"剛從海島國家回來
完全回歸
重點是不只瓶裝啤酒
連調酒都大勝小酒吧
Vesper喝過最好喝只有這裡跟Smith&Wollensky 了","剛從海島國家回來
完全回歸
重點是不只瓶裝啤酒
連調酒都大勝小酒吧
Vesper喝過最好喝只有這裡跟Smith&Wollensky 了",0.0,0.0,1.0,0.0
酒好喝老闆也很親切下次會再來,"The good wine boss is also very kind, I will come again next time",0.355,0.0,0.645,0.7645
"一顆星給超舒服又可愛的環境
一顆星給非常親切的服務人員
調酒真的不好喝 有些可惜了那些mezcal & tequila ,裝飾也不好看，如果不在附近不用特別去，或是去享受舒服的環境，但點啤酒或shot就好","A super comfortable and cute environment
A star for very friendly service staff
It's really not good to bartender. Unfortunately, those Mezcal & Tequila, the decoration is not good. If you don't have to go nearby, or enjoy a comfortable environment, you can order beer or shot.",0.307,0.114,0.579,0.9287
"奶油田結束直接走過來，氣氛很舒服，老闆娘超客氣，酒也很讚，結束還可以去隔壁越式按摩（偏題了
應該要第一天經過就直接進來的，總之就是很棒的店","The cream fields came directly, the atmosphere was very comfortable, the boss was super polite, and the wine was very good. You can also go to the next door to the off -next door.
You should come in directly on the first day, in short, it's a great shop.",0.247,0.0,0.753,0.9412
可訂位可刷卡薯條好吃。,You can order the stroke can be delicious.,0.346,0.0,0.654,0.5719
"寶貝醉三天超級無敵推
會二訪三訪無限訪😍 …","Baby drunk three days is super invincible
The second visit and three visit to the unlimited visit 😍 ...",0.331,0.079,0.59,0.8271
調酒很好喝！,The bartender is delicious!,0.571,0.0,0.429,0.6114
"老闆親切
環境音樂都很放鬆","Boss kind
Environmental music is very relaxed",0.58,0.0,0.42,0.7841
"性慾沙灘很好喝
荔枝特調也很好喝","Sexual desire beach is delicious
Litchi special tone is also very delicious",0.621,0.0,0.379,0.92
"氣氛很好又很熱情
找到很好的店想喝酒就來這家","The atmosphere is very good and enthusiastic
Find a good shop and want to drink, come to this house",0.42,0.0,0.58,0.8707
調酒使用新鮮水果，也會詢問口味是否合適，  不足的部分也會幫忙調整， 環境舒適。,"If you use fresh fruits in bartending, you will also ask if the taste is appropriate. The insufficient part will help adjust and the environment is comfortable.",0.257,0.0,0.743,0.8074
難得有南方風格的餐酒館，店家空間設計舒服得體，南美洲音樂🎶聽了讓人想跳舞，墨西哥風味卷餅微辣好吃，食物美味，酒水的命名又有個性，很有心意的文案設計，服務員親切，bartender很tender，很具美感有滿滿舒服的氣氛，適合放鬆相聚。 …,"Rarely southern -style dining tavern, the store's space design is comfortable and decent, South American music is listening to people who want to dance, Mexican flavors are slightly spicy and delicious, food is delicious, the naming of drinks has a personality. , The waiter is kind, Bartender is very Tender, very beautiful and comfortable atmosphere, suitable for relaxation.Mowing",0.312,0.0,0.688,0.9725
"環境舒適 每個角落都用心佈置，
選曲也很優，整間店讓人非常放鬆

Banteng 小哥又帥又親切
值得N訪的bar","The environment is comfortable to arrange every corner,
The selection is also very good, the whole store is very relaxed

Brother Bankng is handsome and kind
BAR worth N visit",0.435,0.0,0.565,0.9551
店內氣氛不錯，飲料也蠻好喝的。雖然沒有點餐點不過看起來價格合宜。唯一不滿意的地方是店內蚊子很多，沒有辦法好好放鬆，希望未來能改進。,店內氣氛不錯，飲料也蠻好喝的。雖然沒有點餐點不過看起來價格合宜。唯一不滿意的地方是店內蚊子很多，沒有辦法好好放鬆，希望未來能改進。,0.0,0.0,1.0,0.0
"店家很親切！
超讚！
每個人都超讚讚
After party 玩得超級開心🩷🩷🥳🥳 …","The store is very kind!
It's amazing!
Everyone is super praised
After party is super happy 🩷🩷🥳🥳 ...",0.704,0.0,0.296,0.9848
舒服輕鬆的放鬆地點😃 …,Comfortable and relaxed place 😃 ...,0.562,0.0,0.438,0.8402
燈光美氣氛佳,Beautiful light atmosphere,0.661,0.0,0.339,0.5994
離家超近的店，讚,"Store that is super closer to home, praise",0.556,0.0,0.444,0.8176
"闆娘超親切的 推薦的酒也超好喝><
會再訪 因為想嘗試其他不同的酒","Ban Niang's super -friendly recommended wine is also super delicious> <
Will visit again because you want to try other different wines",0.489,0.099,0.412,0.9217
創意特調味道很不錯,Creative special taste is very good,0.746,0.0,0.254,0.8313
"酒好喝
音樂很chill
店內擺設很美
老闆人很好
值得推薦的店家☺️","Wine
Music is very chill
The shop's furnishings are beautiful
The boss is very good
Recommended shops ️️",0.379,0.0,0.621,0.847
"環境舒適氣氛好,服務人員很親切，適合三.五好友小聚，調酒不錯喝喔！",The environment is comfortable and the atmosphere is good. The service staff is very kind. It is suitable for three. Five friends gather together.,0.394,0.0,0.606,0.9184
音樂很熱情，以為來到了異國酒吧，推薦大家來這裡同歡，每週六有音樂現場演奏,"The music is very enthusiastic, thinking that I have come to a foreign bar, I recommend everyone to come here with love, every Saturday with music live performances every Saturday",0.274,0.0,0.726,0.8805
環境舒服還有熱情的美女闆娘😍😍隱藏版水果紅酒推推💯 …,環境舒服還有熱情的美女闆娘😍😍隱藏版水果紅酒推推💯 …,0.375,0.0,0.625,0.7184
氣氛好、店員好、酒好,"Good atmosphere, good clerk, good wine",0.744,0.0,0.256,0.8271
讚的調酒 讚的老版 氣氛超級棒 酒又好喝又美到不行！,"The old version of the bartender is superb wine, which is delicious and beautiful!",0.522,0.0,0.478,0.9184
店長人超好很親切，店內氛圍很好，店內也佈置的很漂亮，值得回訪🥰 …,The manager is very good and very kind. The atmosphere in the store is very good. The store is also beautifully arranged. It is worth visiting ...,0.416,0.0,0.584,0.9401
"調酒好喝！
美女姊姊很熱情開朗
還請我們shot 讚讚","Blooming is delicious!
Beautiful sister is very enthusiastic and cheerful
Please ask us Shot praise",0.7,0.0,0.3,0.9684
不錯的場地 喝完去按摩,Good venue to drink and massage,0.367,0.0,0.633,0.4404
調酒超好喝！！,The bartending is so delicious!Intersection,0.0,0.0,1.0,0.0
"1.酒質不錯
2.環境舒服有沙發
3.服務親切
4.有live band","1. Good wine quality
2. The environment is comfortable with the sofa
3. Careful service
4. There are live band",0.315,0.0,0.685,0.7783
"牙買加音樂很道地 連長島都可以調的很好喝
員工也很Nice❤️❤️❤️","Jamaica Music can be tuned very well even
Employees are also very nice ❤️❤️❤️",0.244,0.0,0.756,0.669
"欸超讚 還被招待Tequila 舒服
還不快點來光顧","T 待 欸 is also entertaining Tequila comfortable
Don't come to visit yet",0.36,0.0,0.64,0.7351
調酒特別，好喝，店內氛圍很舒服,"The bartender is special, delicious, and the atmosphere in the store is very comfortable",0.476,0.0,0.524,0.8748
海邊風格酒吧 推薦這間 食物 酒都不錯,Seaside style bar recommends this food wine is good,0.407,0.0,0.593,0.5859
調酒很用心，想不到林森北路會有這樣的cocktail bar,調酒很用心，想不到林森北路會有這樣的cocktail bar,0.0,0.0,1.0,0.0
酒很好喝！！老闆娘超美超親切,The wine is delicious!IntersectionThe boss is super beautiful and kind,0.621,0.0,0.379,0.9098
音樂讓人放鬆，調酒也好喝，值得再來的地方,"The music is relaxed, the bartending is also delicious, it is worthwhile to come again",0.437,0.0,0.563,0.8519
很不錯的酒吧，很讚的服務，調酒有水準,"Very good bar, very good service, bartending is standardized",0.477,0.0,0.523,0.7496
"餐好吃
酒好喝
調酒超爆強！","Delicious meals
Wine
The bartender is super explosive!",0.568,0.0,0.432,0.8356
"酒好喝
氣氛佳","Wine
Good atmosphere",0.592,0.0,0.408,0.4404
老闆好帥、店長的調酒技術好,"The boss is so handsome, the store manager's bartending technology is good",0.412,0.0,0.588,0.7915
酒好喝！店員熱情又美麗👍推👍 …,The wine is delicious!The clerk is enthusiastic and beautiful 👍 push ...,0.402,0.0,0.598,0.8122
老闆超親切！環境氣氛很好呦！,老闆超親切！環境氣氛很好呦！,0.0,0.0,1.0,0.0
氣氛很chill的一間酒吧，調酒好喝！,"The atmosphere is very chil, and the bartender is delicious!",0.307,0.0,0.693,0.6114
氣氛好這邊的（老闆姊姊）人超好,"The atmosphere is good (boss, sister) is super good",0.618,0.0,0.382,0.8658
"酒好喝，好拍照
氣氛很chill
聚會好所在","The wine is delicious, it's good to take pictures
The atmosphere is very chill
The party is good",0.471,0.0,0.529,0.9093
