Original,EN,Positive,Negative,Neutral,Compound
"好喝舒服
闆娘很親切～","好喝舒服
闆娘很親切～",0.0,0.0,1.0,0.0
好適合下班小酌一杯的溫馨地方,好適合下班小酌一杯的溫馨地方,0.0,0.0,1.0,0.0
漂亮姊姊100分 酒超好喝 氣氛超好❣️😳❣️ …,Beautiful sister 100 points is super good at the atmosphere ❣️😳❣️ ...,0.577,0.0,0.423,0.9643
海灘造型超酷！氣氛環境很舒服～～,The beach shape is super cool!The atmosphere environment is very comfortable ~~,0.438,0.0,0.562,0.831
好真誠的一家店真的好喜歡！,What a sincere shop really likes it!,0.549,0.0,0.451,0.7257
氣氛很棒，店員也很親切,"The atmosphere is great, and the clerk is also very kind",0.464,0.0,0.536,0.8313
老闆超級nice💖服務態度以及氛圍超級好‼️ …,The boss super nice 态 service attitude and atmosphere are super good‼️ ...,0.529,0.0,0.471,0.926
氣氛很棒、酒很好喝,"The atmosphere is great, the wine is delicious",0.565,0.0,0.435,0.8316
酒超好喝！喜歡！,The wine is so delicious!like!,0.0,0.0,1.0,0.0
店員很會聊！來會很開心😍 …,The clerk can chat!I will be very happy ...,0.349,0.0,0.651,0.6468
老闆娘人超好 下次一定再來,The boss is super good and will come again next time,0.43,0.0,0.57,0.7783
老闆娘很熱情！柚茶棒棒,The boss is very enthusiastic!Grapefruit tea stick,0.0,0.0,1.0,0.0
氣氛好，沙發區很舒服👌 …,"The atmosphere is good, the sofa area is very comfortable ...",0.419,0.0,0.581,0.7574
氣氛好 調酒好喝～,The atmosphere is good and bartender ~,0.326,0.0,0.674,0.4404
超舒服的酒吧 服務超好,Super comfortable bar service is super good,0.824,0.0,0.176,0.9325
燈光美 氣氛佳 服務很好,Lighting beautiful atmosphere good service is very good,0.667,0.0,0.333,0.8748
氣氛不錯很舒服😌 …,"The atmosphere is good, very comfortable ...",0.565,0.0,0.435,0.7574
鹹食餐點有待加強,Salted meals need to be strengthened,0.359,0.0,0.641,0.4215
好喝~氣氛好~,It's delicious ~ The atmosphere is good ~,0.524,0.0,0.476,0.765
燈光美，氣氛佳,"Beautiful light, good atmosphere",0.773,0.0,0.227,0.7783
老闆娘超讚,The boss is superb,0.577,0.0,0.423,0.6249
特別厲害的bar,Especially powerful Bar,0.607,0.0,0.393,0.4754
Vibe很讚~,VIBE is very good ~,0.444,0.0,0.556,0.4927
店員很帥！,The clerk is handsome!,0.538,0.0,0.462,0.5411
氣氛好的酒吧,Bar with good atmosphere,0.492,0.0,0.508,0.4404
氣氛很棒,The atmosphere is great,0.577,0.0,0.423,0.6249
海灘讚👍👍👍😁讚 …,Beach praise ...,0.643,0.0,0.357,0.5574
南洋異國風情,南洋異國風情,0.0,0.0,1.0,0.0
老闆熱情,Boss enthusiasm,0.744,0.0,0.256,0.4404
店員都長得很秀色可餐☺️服務態度很好👍,The clerks are very beautiful and meal ☺️ The service attitude is very good 👍,0.426,0.0,0.574,0.8856
"絕對是好酒吧！

有一天我騎著摩托車偶然發現這裡，心想這間酒吧多漂亮，我告訴自己有一天一定會來這裡和我的朋友一起喝酒！是的，我做到了😆

正是我所期待的，裝潢、氣氛、員工，最重要的是食物和飲料都很棒👍感覺就像在夏威夷海灘喝啤酒🏖

我和朋友們在這裡玩得很開心，這是一個美好的夜晚，值得花時間坐在這裡玩手機或與您的朋友度過愉快的時光。

會再回到這裡嗎？絕對✌️","Absolutely a good bar!

One day I found here on a motorcycle, thinking how beautiful this bar, I told myself that one day I will come here to drink with my friends!Yes, I did it 做

It is what I expect, decoration, atmosphere, and employees. The most important thing is that food and drinks are great. It feels like drinking beer on the Hawaii Beach.

My friends and I have fun here. This is a beautiful night. It is worth taking time to sit here to play with mobile phones or have a happy time with your friends.

Will you return here again?Absolute ✌ ️",0.306,0.0,0.694,0.9905
中山全新熱帶/拉丁風格酒吧！我們是星期日晚上去的，是唯一的客人。這個地方絕對需要更多的關注！美麗而舒適的休息區，甚至還有一個小“海灘區”和一些戶外座位。古裝也不錯！,"Zhongshan's new tropical/Latin style bar!We went on Sunday evening and were the only guest.You definitely need more attention in this place!The beautiful and comfortable rest area, even a small ""beach area"" and some outdoor seats.The costume is also good!",0.281,0.0,0.719,0.9284
酷炫、優雅。氣氛冰冷。工作人員非常關心一切。有點年輕的氛圍，音樂很有趣……其他人似乎都很高興，所以沒問題。品質非常好的酒吧。,"Cool and elegant.The atmosphere is cold.The staff cares very much.A little young atmosphere, the music is very interesting ... others seem to be very happy, so there is no problem.Bar with very good quality.",0.337,0.054,0.609,0.9188
"不適合舒適的聖誕假期氣氛。  食物（雞肉和牛肉炸玉米餅）充其量只是平庸。蜂蜜（？）啤酒很好喝。  不喜歡這個鏡頭（苦艾酒和百利甜酒）。  許多物品都無法取得。
2922.12","Not suitable for comfortable Christmas holiday atmosphere.Food (chicken and beef fried corn cake) at best is just mediocre.Honey (?) Beer is delicious.I don't like this lens (bitter wine and Belle sweet wine).Many items cannot be obtained.
2922.12",0.204,0.157,0.639,0.5086
一流的雞尾酒，友善的員工，也是喝一品脫啤酒的好地方！,"First -class cocktails, friendly employees, are also a good place to drink apin from beer!",0.33,0.0,0.67,0.75
美味的食物和飲料，非常好的地方,"Delicious food and drinks, very good places",0.58,0.0,0.42,0.7841
對於附近的聚會來說，這是一個可愛的地方，但相對於他們所得到的東西來說，價格有點高。酒類的選擇非常有限，飲料大多是甜的，而且酒量很小。可以在信義/東區以相同的價格喝酒。,"For nearby gatherings, this is a cute place, but compared to what they get, the price is a bit high.The choice of wine is very limited, most of the drinks are sweet, and the amount of alcohol is small.You can drink at the same price in Xinyi/East District.",0.112,0.052,0.837,0.4957
這是一個好地方，音樂和調酒師都很好✨,"This is a good place, music and bartender are very good",0.404,0.0,0.596,0.7264
餐跟酒都很棒。,The meals and wine are great.,0.451,0.0,0.549,0.6249
我想在訪問台北時推薦這個地方！  非常喜歡這裡的雞尾酒，尤其是冰鎮雞尾酒！,"I want to recommend this place when visiting Taipei!I really like the cocktails here, especially the ice cocktail!",0.324,0.0,0.676,0.7333
好好喝喔,Good taste,0.744,0.0,0.256,0.4404
沒關係，飲料有點貴，因為他們在飲料中使用了巨大的冰塊。男工作人員很好，但我不太確定那個女孩......似乎她今天過得很糟糕。,"It doesn't matter, drinks are a bit expensive because they use huge ice cubes in the drink.The male staff member is very good, but I am not sure that the girl ... it seems that she is very bad today.",0.079,0.183,0.738,-0.7116
我剛好路過，就進去了。氣氛很好，調酒師很友善，飲料裝在可愛的盤子裡。,"I just passed by and went in.The atmosphere is very good, the bartender is very friendly, and the beverage is installed on a cute plate.",0.306,0.0,0.694,0.8653
非常好的雞尾酒和非常酷的 Ambiente,Very good cocktail and very cool Ambiente,0.536,0.0,0.464,0.699
以前沒去過這麼棒的酒吧！當我訪問台北時一定會回來,I haven't been to such a great bar before!I will come back when I visit Taipei,0.226,0.0,0.774,0.6588
"酒吧超美～
酒好喝是基本
食物也很好吃～","酒吧超美～
酒好喝是基本
食物也很好吃～",0.0,0.0,1.0,0.0
這是一個放鬆聊天的地方🥰😍我喜歡這裡的氛圍和裝飾！一定會回來♥️ …,This is a place to relax and chat 🥰😍 I like the atmosphere and decoration here!I will definitely come back ♥ ️ ...,0.478,0.0,0.522,0.9716
週五晚上的好地方🥰 …,Good place on Friday night 的 ...,0.326,0.0,0.674,0.4404
美味的雞尾酒和食物以及令人驚嘆的裝飾使其成為與朋友放鬆和聊天的好地方！,The delicious cocktails and food and amazing decoration make it a good place to relax and chat with friends!,0.544,0.0,0.456,0.9493
非常友好的調酒師和美味的雞尾酒！,Very friendly bartender and delicious cocktail!,0.652,0.0,0.348,0.8169
"墨西哥運動酒吧
他們給我端來了一杯龍舌蘭酒。","Mexico Sports Bar
They brought me a glass of agave.",0.0,0.0,1.0,0.0
令人驚嘆的氛圍，是您在台北時參觀的好地方。,The amazing atmosphere is a good place you visit when you are in Taipei.,0.358,0.0,0.642,0.7717
很高興在這裡放鬆。,I'm glad to relax here.,0.663,0.0,0.337,0.7096
酒很好喝👍🏻 …,The wine is delicious 👍🏻 ...,0.291,0.0,0.709,0.5719
向我收取了不屬於我支付的餐費和飲料費,I charged me a meal fee and beverage fee that I did not belong to me,0.0,0.107,0.893,-0.2023
好地方👍 …,Good place 👍 ...,0.42,0.0,0.58,0.4404
適合一個人獨處放鬆一下,Suitable for a person to relax alone,0.293,0.202,0.505,0.2263
Peter酒真的超棒,Peter wine is really great,0.523,0.0,0.477,0.659
不錯的酒吧,Good bar,0.744,0.0,0.256,0.4404
奶昔超好喝！ ！ ！,The milkshake is super delicious!IntersectionIntersection,0.512,0.0,0.488,0.636
好喝,Delicious,1.0,0.0,0.0,0.5719
好喝！,Special!,1.0,0.0,0.0,0.4574
超美！超棒的地方！,Super beautiful!A great place!,0.811,0.0,0.189,0.8619
所以冷靜💛 …,So calm down ...,0.464,0.0,0.536,0.3804
不錯的選擇,Good choice,0.744,0.0,0.256,0.4404
好涼爽的地方,What a cool place,0.434,0.0,0.566,0.3182
好氣勢！,Good momentum!,0.761,0.0,0.239,0.4926
好地方！,Good place!,0.761,0.0,0.239,0.4926
奶昔棒呆,Cowardly,0.0,1.0,0.0,-0.3818
喝完😆😆 …,After drinking 😆😆 ...,0.417,0.0,0.583,0.6124
