Original,EN,Needs Review
"店內環境超有特色（還有一隻孔雀😂，尤其是廁所超愛哈哈）

調酒真的爆乾好喝！想要什麼樣的調酒bartender 都能100%滿足我想要的味道，又有特色！

炸餃子跟其他餐點也超讚，歌單簡直正中我心❤️❤️❤️

重點是店裡擺的香水直接買爆，太香了吧，聽完香水的故事直接每款全包！","The environment in the store is super character (and a peacock, especially the toilet love haha)

The bartending is really dry and delicious!What kind of bartending Bartender you want can 100%satisfy what I want, and have characteristics!

Fried dumplings and other meals are also very happy, the song list is almost in my heart ❤️❤️❤️

The point is that the perfume in the store is directly bought, so it is too fragrant. The story of the perfume is directly all -inclusive!",False
"昨天晚上同事聚會選在花酒間
我覺得調酒師人帥又溫柔也很照顧客人的感受 超棒🤣🤣🤣🤣
辣的炸餃超級無敵好吃大家一定要點
酒單上的酒都不想喝也沒關係
直接跟調酒師說想要喝什麼基底要什麼口味
都做得出來 很厲害😌
還會再去的！！！","Last night colleagues gathering in the flower room
I think the bartender is handsome and gentle and takes care of the guests.
Spicy fried dumplings are super invincible and delicious, everyone must point
It doesn't matter if you don't want to drink the wine on the wine list
Just tell the bartender what the basis wants to drink
All can be done 很
Will go again!IntersectionIntersection",False
調酒喝得出層次，價格也很公道，這兩點是最重要的。老闆和店員都很親切，會仔細介紹調酒，裝潢也很有特色，這兩點也很加分。,The bartending can draw the level and the price is fair. These two points are the most important.Both the boss and the clerk are very kind and will introduce bartending carefully. The decoration is also very distinctive. These two points are also very extra points.,False
三峽酒吧第一名，喝遍了三峽的所有酒吧，只有這家會讓我再訪，除了酒好喝以外調酒師的專業度和知識量都很足夠，調酒師也很健談，在這邊喝酒非常舒服！,"The first place in the Three Gorges Bar, drinking all the bars in the Three Gorges, only this one will make me visit again. The professionalism and knowledge of the winemaker in addition to the good wine are sufficient. The bartender is also very talkative. It is very comfortable to drink while drinking!",False
"突然想吃楊桃就詢問一下
是否可以特調楊桃的
居然可以而且好好喝
而且人都好親切喔
好喜歡","Suddenly I want to eat stalemate, just ask
Can you adjust the beacon?
Actually it can be delicious
And people are so kind
Love",False
"放鬆的好地方～調酒好喝有特色、裝潢別有一番風情。
調酒師有求必應🍷每一杯酒都會介紹一次，就算聽不懂也感受得到用心
這是我住在三峽快三十年，第一次會想再再再再再訪的地方☺️ …","A good place for relaxation ~ The deliciousness of bartender is characteristic and decorated with a different style.
The bartender must be introduced once every glass of wine, even if you don’t understand, you will feel attentive.
This is the place where I lived in the Three Gorges for almost 30 years, and I would like to visit again for the first time ☺️ ...",False
"三峽難得有的酒吧！位置微略隱密在邊邊角角，一個不注意會不小心與他錯過🤣

每一杯調酒的價格都不會太貴落在300、350左右
推推3號酒，喝起來酸酸甜甜的紅酒還有氣泡的口感搭配上匈牙利紅椒的微辣感真的超級搭！

廁所的裝潢很繽紛蠻酷的，所以紀錄一下，整個很復古的感覺🤣

這次一口氣點了四杯酒，原本以為可以倒，但可能因為每一杯的份量比較精緻，所以適合聊天放鬆約會，買醉的話要先看荷包夠不夠深🤣

最後覺得花酒間的店名很美，但可惜酒單的酒沒有特別取個富有詩意的名字而是以數字命名，不然一定也會是個小話題！","There are rare bars in the Three Gorges!The position is slightly hidden at the corner of the edge, one will accidentally miss him if you don't pay attention

The price of each glass of bartender will not be too expensive to fall at around 300, 350
Push the No. 3 wine, drink the sweet and sour red wine, and the taste of bubbles with bubbles with the slight spicy feeling of Hungarian red pepper!

The decoration of the toilet is very colorful and cool, so record it, the whole feeling of retro 🤣

I ordered four glasses of wine in one breath this time. I originally thought it could be poured, but because the weight of each cup was more exquisite, it was suitable for chatting and relaxing and dating.

In the end, I felt that the name of the store in Huajiu was very beautiful, but unfortunately, the wine of wine did not have a particularly poetic name, but it was named after digital, otherwise it would be a small topic!",False
用google查到滿分的這家bar，但到了之後找不太到，旁邊是很大家的豆漿店，才發現這間沒有招牌，只有用投影打在牆上的店名，店內裝潢很有味道，連進來的客人都有點不同時代感，這次平日調酒師只有一位，叫Rico，光介紹酒的細節就非常厲害，我覺得比台北的吧更讓我感受到專業，光聽就很享受，問了一下才知道就是從台北的吧來這開店，酒不貴，但偏小杯，這邊走的是質感喝酒小酌路線，不建議要買醉的時候來哈哈哈哈，挺推那杯有芥末泡泡的⌐╦╦═─,"Use Google to find this BAR with a full score, but afterwards, I ca n’t find it. It ’s a soymilk shop next to it. I found that there is no signboard. Only the name of the shop on the wall with projection. The guests who come in are a bit different. This time there is only one bartender, named Rico, and the details of the wine are very powerful. I think it makes me feel professional than Taipei. After asking, I learned that I came here to open the shop from Taipei. The wine is not expensive, but the cup is a small cup. This is the texture of the texture, drinking and drinking routes. Bubble ⌐╦╦═ -",False
"我從遙遠的南部北上出差
發現這個七點就開始的Bar
bartender 很溫柔  很會調酒也很會挑音樂
充滿舒適愜意的氛圍

牆上有布達佩斯大飯店跟霸王別姬的海報
一個有趣一個苦大愁深的悲情虐戀
我的思緒兩者之間反覆跳躍
忘了工作  忘了身上的疼痛  忘了滿身心的傷口

啜飲一口  含住  最後再吞下
享受來自口腔麻痺的感覺
酒意來了又退了
在最歡愉的時刻（客人還沒有很多的時候）
我選擇起身離開
bartender 再次關心口味是否習慣
最後紳士的幫忙開門送我離開

微雨的夜晚  空蕩蕩的腦袋
謝謝你們的溫柔對待","I went from the distant south to the north business business trip
BAR, which started at seven o'clock
Bartender is very gentle and can bartender and pick music very much
A comfortable and comfortable atmosphere

On the wall is the poster of the Budapest Hotel and Farewell My Concubine
An interesting and bitter sadness of sadness
My thoughts are repeatedly jumping between the two
Forgot to work, forget the pain on your body, forget the wound with your body and mind

Take a sip, hold it, and swallow it and then swallow it
Enjoy the feeling from oral paralysis
The alcohol comes back again
At the most joyful moment (there are not many times the guests are still)
I chose to get up and leave
Bartender again cares about whether the taste is used to
Finally, the gentleman's help open the door and send me to leave

Empty head of the rainy night
Thank you for your tender treatment",False
"很喜歡店內的環境還有擺設
氣氛也很好
調酒的口味都蠻有創意好喝

炸餃子的內餡蠻特別

可惜沒有招牌
路過不太會注意到","I like the environment in the store and there are furnishings
The atmosphere is also very good
The taste of bartender is quite creative and delicious

The filling of fried dumplings is quite special

It's a pity that there is no signboard
I don't pay attention to passing by",False
酒單內容都很有特色介紹也很詳細推推聒噪芭樂！特調也很驚艷😍是享受夜晚的好地方 …,The content of the wine list is very distinctive and introduced in detail.The special tone is also amazing 享 is a good place to enjoy the night ...,False
在調酒方面，能帶著顧客深入的了解一杯調酒的故事、風味、看法…..。在材料方面，也是下重本的去呈現出自己想給顧客帶來的樣貌。在氛圍方面，店內有放鬆的音樂、舒服的座位，也能坐上吧檯與調酒師暢談。,"In terms of bartending, we can take the customer in depth to understand the story, flavor, and opinion of a glass of bartender ...In terms of materials, it is also the appearance that he wants to bring to customers.In terms of atmosphere, there are relaxed music and comfortable seats in the store.",False
"So I had just tried the taste 03 and taste 11 suggested by the bartender, and it was really good!
If want me to say it’s probably the best bar place in this suburb.
I had a great time here. The bartenders were committed to great service and were very friendly. The atmosphere was awesome and I definitely liked that you have a very modern style. Most importantly, every drink on your menu tasted great! Highly recommended!

店內設計風格講究，空間寬敞舒適，調酒師對調酒的用料及調製專業且搭配起來沒有衝突，不會有喝完剩酒氣的問題。
酒單上的料品都讓人覺得很新奇想嘗試，口味清新又有層次。
推推👌🏻","So I have just tric the task 03 and taste 11 suggetster by the backnder, and it was really good!
If WANT Me to say it ’s probably the best bar play in this suburb.
I have a great time here. The Bartenders we committed to gyvice and we very friendly. Tyle. Most Importantly, Every Drink on Your Menu Tasted Great! Highly Recomgeded!

The design style of the store is particular, the space is spacious and comfortable, the bartender has no conflict on the materials and modulation of the bartender, and there will be no conflict. There will be no problem of drinking the remaining alcohol.
The ingredients on the wine list make people feel novel and tried, fresh and layered.
Push",False
調酒好喝，調酒師很帥！全三峽最頂的酒吧，拜託一定要來！,"The bartender is delicious, the bartender is handsome!The bars in the top Three Gorges, please come!",False
"很喜歡店內中國風的復古裝潢跟擺飾~
廁所的霓虹燈好酷!! 讓我也想在家裝一個 哈哈
調酒的風味非常特別，蹦出的滋味是外頭喝不到的唷
剛好本身很喜歡有茶香的調酒~
還有一款喝起來有中藥行涼涼的口感，印象超深刻!","I like the retro decoration and decoration of the Chinese style in the store ~
The neon light of the toilet is so cool !! Let me also want to install one at home haha
The flavor of bartending is very special, the taste of jumping out is not drinking outside
I just like to bartender with tea fragrance ~
There is also a cool taste that drinks Chinese medicine, which is very impressive!",False
第一杯點了15號，好像是叫牛仔什麼的，平常很喜歡看西部電影於是就點來喝了，酒感喝起來比較重，調酒師也提醒我慢慢喝，喝下去味道蠻豐富的。只是第一杯喝下去就有點醉了，就決定用High Ball做Ending了，調酒師拿出已經絕版的老威雀，喝下去果乾味道很重很舒服，下次再來試試看其他調酒。,"I ordered the 15th on the first cup. It seems to be called denim or something. I usually like to watch Western movies, so I just ordered to drink. The wine feels heavier. The bartender also reminded me to drink slowly. of.It's just a bit drunk when I drink it in the first glass, so I decided to use High Ball to ending. The bartender took out the out -of -print Lao Weizi. Essence",False
很放鬆的一間bar，老闆會依客人喜好調酒，而且喝很多杯都超讚，是一間大推的店！,"A very relaxed BAR, the boss will adjust the bartending according to the guest's preference, and drinking a lot of cups is great, it is a large push shop!",False
這邊氣氛真的超棒，餐點也很好吃，帶有花香的長島冰茶也讓我很驚豔，是個放鬆心情的好地方。😆😆😆😆,"The atmosphere here is really great, and the meal is also delicious. Long Island ice tea with floral fragrance also surprised me. It is a good place to relax.Bleak",False
"三峽最讚的酒吧，調酒師非常了解酒類搭配
蠻詳細介紹酒種的及使用材料的

是下班後輕鬆小酌的好去處","Three Gorges's best bars, bartender knows wine matching very well
Introduce the wine species and use materials in detail

It's a good place to drink after get off work",False
高質感調酒欸！超好喝！漂亮的調酒還帶有質感，真的很不錯，食物也好吃,"High -quality sensation!Super delicious!Beautiful bartending also has texture, really good, food is also delicious",False
非常有意思的Bar！年輕的bartender的作品很有深度！喜歡！好喝！,Very interesting bar!The work of young Bartender is very deep!like!Special!,False
調酒風味獨特，很適合跑遍歐美風味可以來這裡品嚐一下,"The flavor of the bartender is unique, and it is very suitable for running through the European and American flavor. You can come here to taste it",False
調酒師會很細心的詢問顧客的要求，最後調出來的酒也非常好喝✨,"The bartender will carefully ask the customer’s request, and the wine that is finally transferred is also very delicious.",False
"酒單上的調酒很好喝
但特調的部分令人驚艷
輕氛佳不吵的酒吧！
很適合來chill～～","The bartender on the wine list is very delicious
But the special part is amazing
The light atmosphere is not noisy!
Very suitable for chill ~~",False
整個店的視覺很復古，調酒材料都很特別，會詳細說明調酒喝起來的感覺跟味道，推推推🤩 …,"The vision of the entire store is very retro, and the bartending material is very special. It will explain the feeling and taste of drinking and drinking in detail, push push ...",False
很特別的酒吧，調酒順口好喝。層次感造就口味獨特，大推👍 …,"Very special bar, bartender is delicious.The layered sense is unique, and it is pushed ...",False
"適合小酌
調酒品質不錯
店內裝潢很有特色","Suitable for drinking
Bart -up quality is good
The interior decoration of the store is very distinctive",False
bartender聊天很舒服，店內氛圍氣氛佳，不論是特調或是指定口味的調酒都很棒。,"Bartender has a comfortable chat, and the atmosphere in the store is good. Whether it is special or specified, it is great.",False
3號調酒真的推推！整個酒吧氛圍很精緻、很chill，離學校又近，一定要來的,"No. 3 bartending really pushes!The atmosphere of the entire bar is very delicate and very chill, and it is close to the school.",False
Bar氣氛氛圍很好，當天一群人每人兩杯 每一杯都非常好喝 很厲害 真的沒有一杯雷的，下次一定還會再回訪。,"The BAR atmosphere is very good. On the day, two cups of people, two cups, were very delicious, and there was no cup of thunder. I would definitely return to visit next time.",False
"肉醬薯條超好吃！
酒也很好喝👍
大推Edward 啦 …","Meat sauce fries are super delicious!
Wine is also delicious 喝
Push Edward ...",False
調酒師不只專業且幽默風趣，想要的風味都能按照要求做出來，非常推薦，第一次來的人要認真找一下，他們坐落在三樹路上的一個角落,The bartender is not only professional and humorous. The flavors they want can be made according to the requirements. It is very recommended. The first time people come to find it carefully. They are located in a corner of Sanshu Road.,False
調酒有臺北酒吧的水準只要花三百塊就能喝到，就算沒有來過，調酒師也會細心的介紹酒單內容及酒類知識，是個很適合放鬆的好地方，很推！,"The level of bartending has the level of the Taipei Bar as long as it can be drunk as long as it is spent three hundred yuan. Even if it is not here, the bartender will carefully introduce the content of the wine list and the knowledge of the wine. It is a good place for relaxation. It is very pushing!",False
"調酒非常特別！而且很好喝！
餐點選項不多但也好吃！
很好聊天！氣氛非常舒服！
Chill Chill 好場所！
大推！","Blooming is very special!And it's delicious!
There are not many meals but delicious!
Good chat!The atmosphere is very comfortable!
Chill Chill a good place!
Push!",False
"是有實力的酒吧
要質感有質感要美味好喝當然有
來這幾次了每次都不讓我失望","Is a powerful bar
If the texture has the texture, it is delicious and delicious. Of course
I won't disappoint me every time I have come here a few times",False
三峽最頂的酒吧！燈光美 氣氛佳 🥺我每天不喝兩杯睡不著 …,The top bar in the Three Gorges!The light atmosphere is good 每 I don’t drink two glasses every day to sleep ...,False
好的酒吧考驗的是調酒師的技術，這家的調酒師絕對是頂尖的，每次點的特調都是我心目中的味道！,The good bar tests the technology of the bartender. This bartender is definitely the top. The special adjustment of each time is the taste in my mind!,False
"帥哥Alan調酒調的好喝
人又騷","Handsome guy Alan bartender is delicious
Crowded again",False
店員及調酒師會來適時關心調酒是否ok，朋友覺得他點的調酒有點太苦，也會仔細解釋為什麼會有這個風味，但如果不喜歡他們也很願意協助調整。 總之⋯⋯⋯大推！👍 …,"The clerk and the bartender will come to care about whether the bartender is OK in a timely manner. Friends feel that the bartender he ordered is a bit too bitter, and he will carefully explain why there is this flavor, but if you don't like them, they are willing to help adjust.In short, push!👍 👍 ...",False
老闆真的是魔法師🧙，特調永遠都有驚喜，已經回訪第三次了，每次都是抱著期待回來，跟一般的酒吧的酒都很不一樣，主打一種獨一無二,"The boss is really a magician, and there are always surprises. He has been returning for the third time. Every time he is looking forward to it, it is very different from the general bar wine.",False
一進店裡就被眼前的蒸餾器經驗到，復古的擺設更添風格，除了裝潢以外，酒也是好喝的沒話說,"As soon as I entered the store, I was experienced by the distillers in front of my eyes. The retro furnishings added style. In addition to the decoration, wine is also delicious.",False
調酒很不錯，老闆很友善，有喜歡的基酒或調性可以客製,"The bartending is very good, the boss is very friendly, you can customize the base wine or tone that you like",False
前幾天路過就進去了，沒想到是這麼厲害的酒吧，除了酒好喝以外，他們的辣餃子也是一絕,"I went in a few days ago. I didn't expect such a powerful bar. In addition to drinking, their spicy dumplings are also a must.",False
"氣氛佳
很適合朋友一起來
Bartender很大方
來的時候被喝請喝shot 有點驚訝到！","Good atmosphere
Very suitable for friends to come together
Bartender is very generous
I was a little surprised when I came when I came!",False
裝潢風格很有特色，喝酒時別有一番風味,"The decoration style is very distinctive, don’t have a flavor when drinking",False
"店美氣氛佳(● ˃̶͈̀ロ˂̶͈́)੭ꠥ⁾⁾
冰塊還會有店Logo太酷了喇","The beautiful atmosphere of the store (●) ੭ꠥ⁾⁾
There will be a shop logo in the ice cubes.",False
這家裝潢獨樹一格，環境昏暗讓人有種安全感，調酒師幽默風趣，在這裡喝酒讓人感到很自在舒服,"This decoration is unique, the environment is dim, it makes people feel secure, the bartender is humorous and funny, and drinking here makes people feel very comfortable and comfortable",False
來了三次，每次都超級喜歡，把酒單上的全點了一遍，沒有雷的，愛喝酒的一定要來試試😍,"Three times, I like it very much each time. I have a full point on the wine list. If there is no thunder, you must try it if you like to drink.",False
"隱藏在三峽角落的酒吧 裝潢也很古典✨
這次點的酒都很清爽好喝🥂
值得再來☺️","Bar hidden in the corner of the Three Gorges is also very classical
The wine this time is very refreshing and delicious 🥂
It's worth come again ️️",False
調酒的味道很好，要是我還沒畢業前開，我一定常常光顧！氣氛跟燈光很舒服，適合鬆懈緊繃的精神方面！pure高腳杯，透著漂亮的光線！,"The taste of bartender is very good. If I have n’t graduated, I will often patronize!The atmosphere and light are very comfortable, suitable for the spirit of relaxation and tightness!Pure goes high with beautiful light!",False
調酒別具匠心，服務優秀且態度誠懇，會主動詢問顧客的要求與喜好，在品飲的過程感覺舒適並有極佳的體驗。店內裝潢與音樂，能讓顧客在步調緊湊的生活之中，使身心得到洗滌並心曠神怡。來光顧一次是值得且必須的。,"The bartending is ingenious, has an excellent service and sincere attitude. He will actively ask customers' requirements and preferences. It feels comfortable and has an excellent experience in the process of drinking.The interior decoration and music of the store can allow customers to be washed and refreshing in the paceing life.It is worthwhile to visit once.",False
三峽樹林區最頂 問心無愧,The topic of the Three Gorges Forest Area,False
調酒好喝 人員很好👍🏻 …,It's good for bartending and delicious people ...,False
店內很熱，進去讓人昏昏欲睡。酒很小杯，而且不濃😅點特調了，說要酒感重也還是不濃😅。直接打斷我們聊天，一直來提醒用餐時間，感受實在很差。不推 …,"The store is very hot, and it is drowsy.The wine is very small, and it is not thick.Interrupt our chat directly, and keep reminding the meal time, and the feeling is really poor.Don't push ...",False
只一位調酒師，從前置作業到最後都由其完成，冰塊仍是自製，從酒架上的酒和介紹時侃侃而談，感受到其專業和堅持，因為聊到調酒書，更感覺其目標的遠大，酒單上雖是特調，但是建立在經典調酒的專業基礎之上，店內用餐氣氛愉快。,"Only one bartender has been completed from the front work to the end. The ice cubes are still self -made. Talking from the wine and introduction from the wine rack, I feel their professionalism and persistence, because I talked about the bartender book. It feels that its goal is far. Although the wine list is special, it is based on the professional basis of classic bartending. The meal atmosphere in the store is happy.",False
"認真用心做酒的好酒吧👍
裝潢也是別有一番品味，整體的氣氛很舒服✨️","Being a good bars who are carefully making wine 认
The decoration is also a taste, the overall atmosphere is very comfortable ✨️",False
酒味道不錯，風味很細緻也很講究，下酒小點也很唰嘴，缺點是調酒師太帥了根本不知道眼神該擺哪🥲 …,"The taste of the wine is good, the flavor is very delicate and particular, and the little wine is very sloppy. The disadvantage is that the bartender is too handsome.",False
"走遍歐美的酒吧
這家台吧真特殊
調酒師灑脫匠氣
臻達了本土極致
01~12種的口感
每杯都是種感動
若是還沒有醉倒
強烈建議特調酒","Wandering all over Europe and the United States
This platform is so special
Boamer
Zhenda's local ultimate
01 ~ 12 kinds of taste
Each cup is moved
If you haven't drunk yet
It is strongly recommended for special bartending",False
讚讚讚，原本以為是很盤的店，結果物超所值,"Praise and praise, originally thought it was a very popular shop, but the result was worth it",False
住家附近輕鬆喝酒的好地方,A good place to drink easily near your home,False
"店內氣氛過於昏暗
環境看起來不像酒吧的感覺
炸薯條有沒熟的
調酒師不錯，都還會請幾杯酒
服務上是讓我最滿意的👍","The atmosphere in the store is too dim
The environment does not look like a bar feeling
Are fries?
The bartender is good, I will invite a few glasses of wine
The service is the most satisfactory 我",False
"氣氛很好 調酒師也很專業！
細心介紹每種調酒～
下次一定還會再來！","The atmosphere is very good and professional!
Carefully introduce each kind of bartender ~
I will definitely come again next time!",False
特調很驚艷，且會詳細介紹每一杯的口味及詢問合不合口味，連假晚上座位大約半滿，與朋友待三小時覺得很舒適～,"The special tone is amazing, and the taste of each cup will be introduced in detail and the inquiry is not the taste. Even the seats in the evening are about half full, and I feel comfortable for three hours with my friends ~",False
