Original,EN,Needs Review
兩位調酒師都很優～介紹的很用心～店內氣氛特別，增添了三峽一些夜生活好去處！100分,"The two bartenders are very good ~ I introduce it very much ~ The atmosphere in the store is special, adding some nightlife in the Three Gorges!100 points",False
"特調好喝一直喝！！！
調酒師很細心 氣氛很棒 很安靜很享受
離家很近😎推推 …","Drink it for special tunes!IntersectionIntersection
The bartender is very atmospheric, great, very quiet and enjoyable
It's close to home, push ...",False
"花前花後日復日，酒醉酒醒年復年。
不願鞠躬車馬前，但願老死花酒間！
調酒真的很棒 會常來的","After flowering before flowering, the drunk wake up the year.
I don't want to bow in front of the car and horse, I hope to die in the flower room!
Blooming is really great and will come often",False
"超。厲。害。
比任何我在台北喝過的酒吧還用心一百萬倍的秘境 絕對不能錯過","overtake.Earthly.Harmful.
I must not miss the secret of one million times more than any of the bars I drank in Taipei.",False
三峽最棒的酒吧!! 酒好喝， Bartender親切、專業，環境也很棒! 是一家用心的店~,"The best bar in the Three Gorges !! The wine is good, Bartender is kind, professional, and the environment is great! It is a hearty shop ~",False
"風味特別的調酒！
重點是氣氛很好，老闆們人都好讚🤩🤩🤩 …","Special flavor bartender!
The point is that the atmosphere is very good, the bosses are so praised ...",False
環境超讚 調酒師人也很好  下次一定會在來 超棒的！！！推薦大家來,The environment is superb ampouler and it will be great next time!IntersectionIntersectionRecommend everyone,False
"新北價位350～380台北的量
裝潢不錯
調酒很特別","New Taipei price 350 ~ 380 Taipei quantity
Good decoration
Blooming is very special",False
是個下課下班後 放鬆心情的好地方！調酒師讚讚！調酒也好喝～～,It is a good place to relax after class!The bartender praises!Blooming is also delicious ~~,False
老闆人都超好🥹🥹 整間氛圍很讚 以後還想再去😍 …,The boss is super good.,False
"調酒很特別,三峽少數好喝的酒吧~調酒師對酒的解說也很詳細","The bartender is very special, the few delicious bars in the Three Gorges ~ The interpretation of the winemaker is also very detailed",False
調酒很好喝，bartender 很親切介紹詳細，給你們一個讚👍🏻 …,"The bartending is delicious, Bartender has a cordial introduction to detail, give you a praise ...",False
比起剛開店時，現在品質好非常多，bartender 也很專業,"Compared to just opening a store, it is very good now, and Bartender is also very professional",False
"三峽開酒吧已經很令人感動了
還給我很好喝 一定是大拇指","The three gorge opening bar is already very moving
Give me a good taste, it must be a thumb",False
Bartender有夠帥，酒調的也很有風味，浪漫優質的好地方👍 …,"Bartender is handsome enough, the wine is also very flavorful, romantic and high -quality good place ...",False
"這裡的Bartender
貼心 細心 適合下班下課小聚的地方
調酒可以依照個人口味調整👍 …","Bartender here
Intimately meticulously meticulously meet the place where you get together for a small gathering
I can adjust according to my personal taste ...",False
三峽花酒間，文人墨客來上一杯，酒香花美，意猶未盡，值得品味。,"In the three gorge flowers, the literati and Mo Ke came to a cup.",False
"放鬆喝酒的好地方，
酒都可以客制，
不會有太水的問題。","Relax and drink a good place,
Wine can be customized,
There will be no problem.",False
三峽最棒酒吧沒有之一,There is no one of the best bars in the Three Gorges,False
隔離完立馬過來喝一杯！真的很不錯～調酒也很好喝,"After the isolation, come over and drink a drink!It's really good ~ bartender is also very delicious",False
"酒好喝 音樂好聽 老闆看起來像是會打八極拳
by 三江水","The wine is delicious and good, the boss looks like you will play Baji Boxing
by Sanjiangshui",False
雞尾酒風味絕佳 服務非常好 三峽有這樣的酒吧真好,The cocktail flavor is excellent service. The service is very good.,False
調酒絕絕子 細品夜晚,Bart -ups are absolutely beautiful at night,False
味道很特別的調酒,Specialty with special taste,False
氣氛很好！每週報到！北大邱比特,The atmosphere is good!Report every week!Peking University,False
店員人很好,The clerk is very good,False
燈光和氣氛很好 bartender 服務的態度很好也很專業,The lighting and atmosphere is very good Bartender service attitude is very good and very professional,False
環境讓工作一整天的緊張情緒得到放鬆～東西好吃😋 …,The environment that makes the work a whole day is relaxed ~ It is delicious ...,False
想喝調酒終於不用每次跑台北惹😍 …,"I want to drink sober, I do n’t have to run in Taipei every time I am ...",False
很不錯 星數很高但不是打卡洗的,"Very good star number is very high, but it is not a lot of stuck",False
"喝酒不能解決問題
但喝水喝牛奶也不能
所以來喝酒
三峽chilllllll","Drinking can not solve the problem
But drinking water and drinking milk can't
So come to drink
Three Gorges Chillllll",False
5號很推，有獨特的泡沫，香氣逼人。,"On the 5th, there is a unique bubble, and the aroma is compelling.",False
調酒師Rico很厲害 🌟🌟🌟🌟🌟,The bartender Rico is very powerful 🌟🌟🌟🌟🌟,False
服務好 氣氛好,Good service atmosphere,False
氣氛很好，Bartender很健談。,"The atmosphere is good, Bartender is talkative.",False
店員好正 還沒喝就醉了,The clerk was drunk before drinking,False
北大附近終於有一間優質酒吧😍 …,There is finally a high -quality bar near Peking University ...,False
調酒好喝 服務很親切,Wine bartending and delicious service is very kind,False
好喝，店員很讚,"It's delicious, the clerk is great",False
沒喝過那麼牛的酒,Haven't drank so beef wine,False
"三峽第一酒吧
推推❤️","Three Gorges Bar
Push ❤️",False
環境很棒～bartender人很奈斯！,The environment is great ~ Bartender is very Nas!,False
調酒好喝！,Blooming is delicious!,False
"學長開的
推爆 三峽最頂","Junior
Blast the top of the Three Gorges",False
氣氛佳調酒好喝,The atmosphere is good,False
Bartender 會吐火 讚,Bartender will vomit fire and praise,False
酒吧的氣氛太chill了～,The atmosphere of the bar is too chill ~,False
店員專業 氣氛超好,The professional atmosphere of the clerk is super good,False
好酒不見，不見好酒。,"Good wine, no good wine.",False
非常厲害的調酒😎😎😎 …,Very powerful bartending 的 ...,False
😊 …,😊 …,False
店員很奈斯！🫶🫶 …,The clerk is very Nas!🫶🫶 🫶🫶 ...,False
長髮男好去處,Long -haired men go,False
三五好友聚會的好地方,A good place for three or five friends gatherings,False
調酒風味豐富有趣,Rich bartending flavor is rich and interesting,False
厲害了我的Edward,It's amazing my edward,False
調酒好喝🍸 …,Blooming is delicious 🍸 ...,False
三峽最頂,Three Gorges top,False
優質浪漫na,High -quality romantic NA,False
氣氛很棒,The atmosphere is great,False
頂爛,Rotten,False
超讚的酒吧,Amazing bar,False
認真做酒,Make wine seriously,False
讚,praise,False
三峽特景,Three Gorges Scenery,False
讚,praise,False
花酒間的調酒真的超級讚，而且調酒師顏值很高，又會聊天，我心目中第一名的酒吧呦～,"The bartender in the flowers and wines is really super praised, and the bartender has a high value, and I can chat. The first place in my mind is ~",False
"喝了Edward調的Ramos Jin fizz
非常驚艷！！","Drinking Edward Ramos Jin FIZZ
Very amazing!Intersection",False
讚,praise,False
酒很有特色 好喝,Wine is very special and delicious,False
牛逼,Puzzle,False
有料,Paid,False
好喝,Delicious,False
好好喝耶,Good,False
此生必去的酒吧之一,One of the bars in this life,False
好喝,Delicious,False
酒好喝,Wine,False
