Original,EN,Needs Review
"奉勸大家！
去這酒吧 沒事的話最好不要拿出手機拍照：）
因為在DJ台上方的燈是使用功率很強的雷射光！！我和朋友的手機鏡頭都遭殃 出現「紫斑」🥲 之前去其他酒吧/夜店也有舞台燈效，就算拍照也沒造成這樣的鏡頭損壞，沒想到第一次去bar24就這樣不愉快

最後給店家建議：
1. 更換雷射燈 / 降低其功率
2. 若無法做到第一點的話，可以在客人入場前給特意提醒：舞台雷射燈有致手機鏡頭損壞的風險","Advise everyone!
If you go to this bar is okay, it is best not to take out your mobile phone to take a picture :)
Because the light above DJ is a laser light with strong power!IntersectionMy friend and my mobile phone lens suffered ""purple spots"". Before going to other bars/nightclubs, there were stage lighting effects. Even if you took pictures, it did not cause such a lens damage.

Finally give the store suggestion:
1. Replace the laser light / reduce its power
2. If the first point cannot be achieved, you can remind the guests before entering the venue: the risk of the stage laser light can cause the mobile phone lens damage",False
"安管很刁難人！
11/3 00:00左右
我左手已經有un手環 兩張證件的給他了 銀行卡兩張簽名也是我的名字
安管還問「你要怎麼證明這是你？」「因為真的長得太不像了。」
要不是朋友的演出
根本不會想來消費。","The security management is very difficult!
11/3 00:00
My left hand already has two UN bracelets two documents gave him a bank card. Two signatures are also my name
The security management also asked, ""How do you prove that this is you?"" ""Because it really looks too much.""
If it weren't for a friend's performance
I don't want to come to consume at all.",False
"之前為了看一場表演特地前往，現場本身雷射光極強，然後現場也完全沒提醒拍攝會損害鏡頭，拍攝完後導致當天手機直接感光元件被雷射光照壞？後來拍攝畫面都會一直出現大片紅點（真的不誇張，手機拍照畫面如圖），拿手機去維修，維修費非常貴⋯為了開心十分鐘，花掉了一大筆維修費真的不值，心情也很糟糕🙄
去了一二十次其他家夜店酒吧，一樣會拿出手機拍攝表演，但也沒發生鏡頭壞掉問題，不知道店家當初在設計舞台，有沒有想過雷射光太誇張這個問題，把客人手機鏡頭照射壞掉又該怎麼辦，總之以後沒事大概不會想再來這家店了，整個大負評🙃","In order to watch a performance, the laser light was very strong, and then the scene did not remind the shooting to damage the camera. After the shooting, the mobile phone directly sensitive component was taken illuminated by the laser?Later, a large red dot will appear in the shooting screen (really no exaggeration, the picture of the mobile phone is shown in the figure). Take the mobile phone to repair it. The maintenance fee is very expensive. For ten minutes, it is not worth it. The mood is also bad
After going to other nightclub bars in other home nightclubs, I will also take out my mobile phone to shoot, but there is no problem with the shot. I do n’t know if the store was designing the stage at the beginning. Have you ever thought that the laser light is too exaggerated? What should I do if the lens is broken?",False
"適合聊天小酌的好地方，音樂大小適中，環境舒適令人放鬆，桌子還可以充電🔋拯救了快沒電的手機🤣好多漂亮的女生耶～😍😍😍
已收藏！以後要聊天更新狀況的聚會場合➕1","Suitable for a good place for chatting and drinking, the music size is moderate, the environment is comfortable and relaxed, the table can also be charged.
Has been collected!In the future, we will talk about the parties of the update status ➕1",False
環境氛圍好，放得音樂也是我喜歡的，店家服務周到，適合跟朋友聚會放鬆的地方，會再回訪的,"The environment atmosphere is good, and the music is also my favorite. The store service is thoughtful. It is suitable for a place where you can relax with friends.",False
"調酒好喝❤️
Bartender 幽默風趣
環境氛圍很好，不會太吵太鬧騰😊 …","Blooming delicious ❤️ ️
Bartender humor
The environment atmosphere is very good, it will not be too noisy and noisy ...",False
"氣氛佳 服務人員態度非常好
原本擔心像評論裡煙味重 但去之後發現根本沒有的事請教信義區 有哪一間酒吧或夜店出來是香的😊😊😊但至於雷射光損壞鏡頭的那幾個評論 不予置評","The attitude of the good atmosphere is very good
Originally worried that the smell of smoke in the comments, but after going, I found that there was nothing at all, please teach Shinyi District which bar or nightclub is fragrant, but as for the comments of the laser light damaged lens, you will not comment.",False
"如果可以打零顆星，真想打零顆星
為什麼現在還會有店整間都是菸味的問題？？？而且還是超濃的那種，包廂的煙灰缸都直接放在桌上，到底是怎樣
都不用考慮到不抽菸的客人嗎
政府不是有規定夜店酒吧都不能室內抽菸了嗎？完全也沒看到任何專屬吸菸區的地方
可以不要做犯法的事嗎
反正都僥倖、沒證據，當真的去查的時候，都嘛叫客人不要抽，查完立馬放人繼續抽，根本沒有用","If you can play zero star, you really want to play zero star
Why is there still a problem of smoke in the whole room?IntersectionIntersectionAnd it's still the kind of super thick, the ashtray of the box is placed directly on the table, what is it?
Do you need to consider the guests who do not smoke?
Doesn't the government stipulate that nightclub bars can not smoke indoors?I didn't see any place in the exclusive smoking area at all
Can you do not do a criminal thing?
Anyway, I am lucky and have no evidence. When I really check it, I will ask the guests not to draw.",False
不是老煙槍別去。女生們去之前想想你的秀髮，那個噁心氣味洗過三四次都還去不掉。,"Don't go, don't go.Think about your hair before the girls go, and the disgusting odor can't go away after washing it three or four times.",False
"酒很好喝、服務人員也很親切
平日安靜質感，氣氛舒服適合聊天
週末氛圍完全不同！好熱鬧好High！！","The wine is delicious and the service staff is very kind
Corresponding texture on weekdays, comfortable atmosphere is suitable for chat
The atmosphere of the weekend is completely different!So lively and high!Intersection",False
來參加富邦angels的活動，這間酒吧的氣氛很不錯，環境很棒，大家可以來喝酒,Come and participate in the event of Fubon Angels. The atmosphere of this bar is very good and the environment is great. You can come to drink,False
"簡約俐落的設計讓人覺得舒服
調酒好喝點心好吃
小酌幾杯～沉醉在這美好的氛圍裡
放鬆的好地方","The simple and neat design makes people feel comfortable
Skymill delicious snacks are delicious
A few cups ~ Drunk in this beautiful atmosphere
Relaxed place",False
酒難喝 音響破 動線爛 領班態度有夠差 領包沒人接待ㄧ問三不知 瞎到爆,"Drinking the sound of the sound of the sound line, the bad pilot attitude is enough, the collar, no one receives, no one receives the three questions, I don’t know if I am blind to explosion",False
週六HIPHOP party人多好好玩,How funny is Hiphop Party on Saturday,False
不尊重駐唱表演者，沒有禁菸，體驗非常差，服務人員態度很沒禮貌,"Those who do not respect the resident performers have no smoking ban, the experience is very poor, and the attitude of the service staff is very rude",False
酒吧非常有質感 酒的種類也很多 酒也很好喝 跟其他酒吧比較來算蠻隱密的 而且就算人多也不會覺得很悶 如果有去的朋友一定要找zaco北台灣最帥調酒師 不想喝菜單上的酒也可以客製化,"The type of bar is very textured. Many wines are also very delicious. Compared with other bars, they are quite secretive and even if there are many people, they will not feel very boring. You can also customize the wine on the menu on the menu",False
"調酒師超帥 酒也很有水準
店裡是車廂主題 很漂亮氣氛很好
不管是跟朋友小聚聊天 或是慶生派對都很適合
信義質感酒吧❤️","The bartender super handsome wine is also very standard
The shop in the shop is very beautiful atmosphere, the atmosphere is very good
It is very suitable whether you are chatting with friends or a celebration party.
Xinyi texture bar ❤️",False
"酒不錯喝，水煙很順口！芒果1100$
內部包廂大概一眼望去有10個
DJ當天放的歌很好聽 比隔壁棚還來的喜歡！
人也不會太多要人擠人","Drink well, and the water cigarette is very smooth!Mango 1100 $
There are about 10 at a glance at a glance at a glance
The song that DJ played was very nice than the shed next door!
No one will be crowded too much",False
哎呀！真不好說....整個Bar就是為這種超質感時尚男女打造的，不得不說，老闆是不是有篩選入店客人呢？俊男靚女齊聚一堂，卻也不會吵雜，很喜歡這裡的氣氛.... Anyway，絕對值得質感男女來此一回。,"oops!It's hard to say .... The whole bar is created for this super -quality fashion men and women. I have to say that the boss has screening guests?The handsome men and beautiful women gathered together, but they would not be noisy. I like the atmosphere here ... Anyway, it is definitely worthy of the texture of men and women.",False
真的很棒的bar 氣氛很好！,The really great BAR atmosphere is good!,False
整個酒吧太有氛圍了！好喜歡這種vibe，每個禮拜下班都會來一次！,"The entire bar is too atmospheric!I really like this kind of VIBE, I will come once every week!",False
"調酒師Zaco 超nice～調的酒超好喝！
氣氛也很棒💓💓💓","The bartender Zaco Super Nice ~ The wine is super delicious!
The atmosphere is also great 很",False
"信義顏值擔當bartender
會調酒又會噴火
經過一定要上去喝兩杯吧🔥🔥 …","Xinyi Yan value is Bartender
Will bartender and spray fire
Be sure to go up and drink for two cups 🔥🔥 ...",False
店長zaco 長的很帥人也親切大家快來這間店找他喝酒,"The manager ZACO is very handsome and kind, everyone will come to this shop to find him to drink",False
燈光氣氛都很柔和優美，整體佈置很喜歡，推薦大家來休閒放鬆一下。,"The light atmosphere is very soft and beautiful, and I like the overall layout. I recommend everyone to relax casually.",False
音樂很好👌，老闆很帥 員工也很正,"The music is very good, the boss is very handsome and employee, and it is very positive",False
"燈光氣氛加！
DJ音樂好！
Bartender噴火帥！","Light atmosphere plus!
DJ music is good!
Bartender spit fire handsome!",False
24超棒 剛隔壁比起來 這也太棒了吧,"24 Superb is just the next door, this is great, right?",False
超讚 音樂超棒 包廂設計也超有趣,The design,False
中分頭那個調酒師很帥,The bartender is very handsome,False
地方很舒服、調酒很好喝🥰 …,"The place is very comfortable, the bartender is very delicious ...",False
調酒超讚！氣氛讚！,Blooming is superb!Atmosphere!,False
體驗良好 酒很好喝,Experience good wine and delicious,False
氛圍拉滿地爽到天頂蓋,The atmosphere is full to the ground cover,False
服務到位，調酒好喝！,"The service is in place, and the bartender is delicious!",False
訂位找kevin準沒錯！👍,It's right to find Kevin if you order!Bleak,False
就最愛Zaco 跟Allen 哥了,I love Zaco and Allen,False
調酒好喝讚讚,"Bartender, good praise",False
有夠好玩的地方,There are fun places,False
調酒好喝！！,Blooming is delicious!Intersection,False
訂位找Kevin🥳,Find Kevin 找,False
讚讚讚 棒棒棒 明天再來！,Zan Zanzan will come again tomorrow!,False
"Bartender ZACO 調酒很頂
🔥🔥🔥🔥🔥🔥🔥🔥🔥 …","Bartender Zaco bartender is very top
🔥🔥🔥🔥🔥🔥🔥🔥🔥 🔥🔥🔥🔥🔥🔥🔥🔥🔥 ...",False
訂位找Kevin ！,Find Kevin!,False
Zaco讚喔,Zaco praise,False
整體很棒,The overall is great,False
信義最讚😻😻,Xinyi is the best,False
讚爆,Praise,False
店員可以,Clerk,False
讚讚,Praise,False
很棒的空間,Great space,False
"這一天充滿了新體驗的興奮！
感謝您在 BAR24 度過了愉快的時光
我對台灣有美好的回憶！
謝謝你留下美好的回憶:)","This day is full of excitement of new experience!
Thank you for spending a pleasant time in Bar24
I have a good memory of Taiwan!
Thank you for leaving beautiful memories :)",False
這是一家非常好的酒吧，擁有私密的氛圍和友善的員工。,This is a very good bar with a private atmosphere and friendly employees.,False
我喜歡他們的飲料和音樂，我一定會回來的！,"I like their drinks and music, I will definitely come back!",False
我出差去了Bar24，在奢華的氛圍和音樂中度過了一段愉快的時光。,"I went to BAR24 on a business trip, and spent a pleasant time in the luxurious atmosphere and music.",False
"我在台灣最喜歡的地方
強烈推薦👍","My favorite place in Taiwan
Strong recommendation 👍",False
服務很棒！,The service is great!,False
👍 …,👍 …,False
最好的服務。氣氛很好。,The best service.The atmosphere is very good.,False
跳舞寶貝舞💋 …,Dancing baby dance 舞 ...,False
良好的氛圍,Good atmosphere,False
很不錯,very nice,False
酒很好喝,Wine is delicious,False
找Zaco喔,Find Zaco,False
超好玩,Super fun,False
