Original,EN,Needs Review
Annie細心介紹酒單，精準推薦我和親友愛喝的類型，下次絕對會再來！！！,"Annie carefully introduces the wine list, and precisely recommends the types of my relatives and friends who love to drink, and will definitely come again next time!IntersectionIntersection",False
"調酒有分微醺和重醺，最喜歡的是紅玉紅茶系列，還有鳳梨果肉
下班經過時，偶爾都會去喝個一兩杯，讓壓力放鬆","There are sake of bartending, and the favorite is the red jade and black tea series, as well as pineapple flesh
Occasionally, I will drink a one or two cups occasionally to relax the pressure",False
Annie 服務態度很好，很詳細的介紹酒單，酒很好喝 之後會再來！,"Annie's service attitude is very good, and the wine list is very detailed, and the wine will come again after the wine is delicious!",False
昨天在DJ場很享受音樂，吧台前的Yui 跟Mini也是有問必答，還會一起推薦我們店裡IG跟FB追蹤新資訊！會再回訪！,"Yesterday, I enjoyed music in the DJ field. YUI and Mini in front of the bar also have questions about questions. I also recommend that IG and FB track new information in our store!Will return to visit again!",False
夜晚喝酒的好去處，氛圍很棒～就是要重醺，打撈月光&悄悄星空大推！,"Drinking a good place at night, the atmosphere is great ~ Just want to heavy, salvage moonlight & quietly push the starry sky!",False
酒好喝，但店員態度很差跟很不會處理事情，我們坐在吧台莫名其妙被有糖的氣泡飲料噴的我們全身都是，另外一位女性友人頭髮全濕頭髮還黏黏的，一句不好意思後就臭臉？？？？ 問號 🙂 真心很不爽，是不是該好好訓練員工處理事情的方式？ 而不是事情發生之後，一句不好意思臭臉帶過吧……. …,"The wine is delicious, but the staff attitude is very poor and can't handle things. We sit on the bar and are inexplicably sprayed by the sugar bubble drinks. Another female friend's hair is full of wet hair and sticky hair. Smelly when you are embarrassed?IntersectionIntersectionIntersectionThe question mark is really upset, should it be a way to train employees to deal with things?Instead of after something happened, a bad face had a stinky face ... ...",False
"非常喜歡店內的風格，坐在吧台與店員聊天也非常開心，謝謝Yui跟William 的熱情❤️

泰奶好喝☺️","I like the style in the store very much. I am also very happy to sit on the bar with the clerk. Thank you yui and William's enthusiasm ❤️

Thai milk is delicious 喝 ️",False
店內氛圍很不錯，tery服務用心，喝得很開心~,The atmosphere in the store is very good. Tery service is attentive and drink very well ~,False
"AVA真的好正 人很好相處 我都要暈船了
怎麼會有這麼漂亮的店員 好愛❤️","Ava is really good and good people are good at each other. I want to halo
How can there be such a beautiful clerk who loves ❤️",False
Annie介紹的很好 很熱情！會依你你需求推薦適合你的酒 下次會再來😍 …,"Annie introduced very well and enthusiastic!I will recommend the wine that suits you next time, you will come again ...",False
店員超正😍特別是一個叫Ava的小姐姐💗酒也很好喝 超推💞,"The clerk Chaozheng 😍, especially a young lady named AVA, is also delicious.",False
Terry Justin的服務很讚！推薦的酒很好喝～,Terry Justin's service is great!The recommended wine is delicious ~,False
喜歡泰式奶茶，環境很棒 如果位子多一點就更好,"I like Thai -style milk tea, the environment is great, if the seat is a bit more, it is better",False
"非常chill,環境明亮,有別於以往的bar,歌也好聽,非常棒！","Very chill, bright environment, different from the previous BAR, songs are also good, very good!",False
"裝潢很清新！喜歡～
酒蠻好喝的！算是中價位再高一點點～
全區自由站位～
不過身為一個腿容易酸ㄉ朋朋，還是希望有個高腳椅可以靠著喝🥲","The decoration is very fresh!Like ~
The wine is pretty delicious!It is a little higher in the medium price ~
Free standing in the region ~
However, as a leg is easy to sour, I still hope that a tall chair can rely on drinking 🥲",False
早上就能邊喝咖啡邊攝取酒精,You can drink coffee in the morning and take alcohol,False
蠻不錯的～謝謝帥弟請喝shot。,"It's pretty good ~ Thank you handsome brother, please drink Shot.",False
櫃檯的小姊姊很漂亮 很溫柔親切 服務周到 飲品好喝 真材實料狠推！,"The little sister of the counter is very beautiful, gentle and kind, and the drink is hot and delicious.",False
超舒服的喝酒放鬆新店家，坐在公園慢慢喝一杯很有特色的酒調飲，放空一下，享受屬於自己的夜晚。,"Relaxing the new store in a super comfortable drink, sitting in the park slowly drink a cup of distinctive wine, let go, and enjoy your own night.",False
"當天點了 搖擺爵士 和 太空漫步，這兩款基底都是在外面很少見的洋梨🍐💚
甜而不膩的味道結合細緻綿密的氣泡，在舌尖上輕盈躍動！真的有徜徉在太空的感覺🥹好想每天都想泡在這裡r 🙌🏻 …","On the same day, I ordered the swing jazz and space. These two bases are rare pears outside.
The sweet but not greasy taste combined with delicate bubbles, jumping lightly on the tip of the tongue!I really feel like I want to soak here every day ...",False
"店面很好看 乾淨整潔 給人感覺很放鬆
特別喜歡yu 人可愛 服務好 還很好聊天😘
調酒也好喝😍","The store is very good -looking, clean and tidy, it feels very relaxed
I especially like Yu people cute service, it’s good to chat 😘
Alcohol is also delicious 喝",False
AVA真的又正又可愛 服務態度也很好 待人親切且有趣 下次會為了她去,"Ava is really good and cute, and the attitude is also very good.",False
"Annie Ted Ava
態度非常良好
店內氣氛佳
店員顏值很高有夠熱情","Annie Ted Ava
A good attitude
The atmosphere in the store is good
The clerk's face value is very high and enthusiastic enough",False
"裝潢很有質感
酒也超好喝（打撈月光100分）
Terry Justin yu三位服務超棒
大家一定要來！！！","The decoration is very textured
The wine is also super delicious (100 points for salvage moonlight)
Terry Justin Yu three services are superb services
Everyone must come!IntersectionIntersection",False
酒點完了結果漏單 酒很troll vibe也很troll,"After ordering the wine, the leakage is very true vibe and Troll",False
"AVA 服務到家
Yui 調酒好喝
Ted 服務態度極佳 給個嘉獎都不夠","Ava service home
YUI bartender is delicious
TED service attitude is excellent, it is not enough to give a prize",False
酒口味蠻特別的 蠻神秘的,The wine tastes pretty very mysterious,False
喜歡gulu guru 的室內設計 酒也好喝 氣氛很chill,I like Gulu Guru's interior design wine and the atmosphere is also very good atmosphere.,False
"空間很舒服很chill
但酒有待加強 很像喝感冒藥水","The space is very comfortable, very chill
But wine has to be strengthened like drinking cold potions",False
新開幕的酒吧 品項好特別🤩🤩,The newly opened bar product is good and special,False
"🌟Scientist 魔藥學 $220
在微醺系列～是好喝的調酒，但也因為是微醺基本上沒什麼酒味！推薦平常不太喝酒的人
週五晚上約九點去 店裡店外人就蠻多的

點餐後會有號碼牌，上面有QR CODE可以讓你知道自己的酒的等待時間～第一次看到覺得很特別
店裡有DJ播放音樂 很chill 很適合平日小酌喔","StScientist potion $ 220
In the Weixi series ~ It is a delicious bartending, but because it is Wei Yan, there is basically no wine!Recommend people who do not drink too much
At about 9 o'clock on Friday night, there are a lot of outsiders in the store in the store

After ordering, there will be number plates, with QR CODE on it to let you know the waiting time of your wine ~ It is very special for the first time to see it.
There is a DJ played music in the store, which is very suitable for dunk on weekdays",False
"魔藥學很好喝 沒什麼酒感
泰奶的話尾巴有一點點酒味但算很輕
謝謝Teddy跟Justin
推薦的酒很不錯!","The potion is very delicious, there is no wine, there is no wine
The tail of Thailand has a little wine taste but very light
Thank you teddy and justin
The recommended wine is very good!",False
"帥哥也太多了吧
全部都180以上 是怎樣
酒很好就不用先說了","There are too many handsome guys, right?
What is all over 180?
Wine is good, so you don't need to talk about it first",False
Terry&Justin 服務很好！還第一時間祝我生日快樂！謝謝！酒都很好喝～～,Terry & Justin is very good!I also wish me a happy birthday for the first time!Thanks!The wine is delicious ~~,False
"已經太喜歡。
結合手搖～酒吧的概念👍🏼
超愛烏龍茶，茶酒系列👌🏼
下班之後都想來一杯🥰🥰🥰 …","I like it too much.
Combine the concept of the bars 👍🏼
Love oolong tea, tea wine series 👌🏼
I want to have a cup after get off work ...",False
Terry and Justin 服務超好，幽默風趣👍👍,"Terry and Justin's service is super good, humorous",False
"喜歡Ava啦～人很好、大長腿！
室內裝潢很有氣氛👍","I like AVA ~ People are very good and long legs!
The interior decoration is very atmospheric 潢",False
帶刺玫瑰屬於暖醺系列的一款熱調酒，聽店員介紹是以熱紅酒為概念出發，但沒有添加香料肉桂，不喜歡肉桂的我蠻喜歡這樣改版，還不錯,"Stabbing roses are a hot -tuning alcohol in the warm series. I listened to the introduction of the concept of hot red wine, but I did n’t add spice cinnamon. I do n’t like cinnamon. I really like this revision.",False
"環境很chill 不像一般所想的酒吧這麼危險
一個人去Terry還會跟你聊天
有機會的話還會請你喝shot哦～
值得推推👍","The environment is very chil, not as dangerous as the bar that I think of it in average
Going to Terry alone will chat with you
If you have a chance, you will ask you to drink Shot ~
It is worth pushing",False
"點微醺的沒有什麼酒感 但蠻便宜的
酒都非常甜  喝到最後很膩","There is no sense of wine, but it is quite cheap
The wine is very sweet until the end is greasy",False
Annie服務態度很好～～～～♡但店內冷氣有點熱,Annie's service attitude is very good ~~~~ but but the air -conditioning in the store is a bit hot,False
裝潢設計時尚，服務人員態度親切，飲品或許未充分將冰塊融合的關係，使得溫度不夠有違和感，偏甜的味道非個人喜好。以價格上來說，商品的內容有進步的空間，200-300台幣，相當日幣1000多，可以在當地純正酒吧喝上一杯調酒。,"The decoration design is fashionable, the service staff has a kind attitude, and the drink may not fully integrate the ice cubes, so that the temperature is not enough to contrary to peace, and the sweet taste is non -personal preference.In terms of price, the content of the product has room for progress, 200-300 Taiwan dollars, and a considerable amount of yen of dollars. You can drink a glass of bartender in a local pure bar.",False
泰奶讚讚/酒精濃度 滿低 可以隨意進來喝一杯,"Thai milk praise/full alcohol concentration, you can come in and drink a drink at will",False
因為等吃飯所以來喝一杯，對喝慣調酒的人來說這邊的酒真的非常淡，只有環境還可以。輕鬆喝的話附近有更好的選擇。,"I have a drink because I wait for meals. For those who drink alcohol, the wine here is really light, only the environment is OK.If you drink it easily, there are better choices nearby.",False
"Ava詳細介紹菜單推薦給我們 還很會聊天
又漂亮又會推薦 暈","AVA Detailed Introduction Menu is recommended to us and can chat very well
Beautiful and recommending dizziness",False
Tery 招待很多酒，服務很好，非常開心,"Tery entertains a lot of wine, the service is very good, very happy",False
喝得好開心啊！還認識了新朋友 yu，有機會還會再去！,"Drink well!I also met new friend YU, and I will go again if I have a chance!",False
Ava超美～～調的酒也很好喝！,AVA is super beautiful ~~ The wine tuned is also delicious!,False
朋友介紹來的，每個就都好喝而且很特別，我喝了shimmer? 就覺得醉了哈哈哈哈位子有點少但是環境不錯，感謝密碼廁所，謝謝大家參加 birthday weekend ! Special thanks to my friend Jared and bartender doc Ted!,"The friend introduced it, each is delicious and very special. I drank Shimmer? I felt drunk hahahaha is a bit small, but the environment is good. Thank you for the password toilet. Thank you for participating in BIRTHDAY Weekend! SPECIAL TO FRINKS to my friend jared jared and Bartender Doc Ted!",False
Ava的服務態度超級好 還是我看過最漂亮的店員😋 …,AVA’s service attitude is super good or I have seen the most beautiful clerk ...,False
"喜歡喝酒的建議點爛醉以上
微醺真的沒什麼酒感😂
但酒很好喝～
服務員Terry的態度也很棒🥰
下次會帶朋友一起去喝！","Suggestions that like drinking are drunk above
There is really no wine feeling 没
But wine is delicious ~
The attitude of the waiter Terry is also great
I will take a friend to drink next time!",False
"酒水很讚，服務很好，可以客製化。
Yu人很可愛服務也很好","The drink is very good, the service is very good, and it can be customized.
YU people are very cute service and very good service",False
"氣氛好，裝潢很摩登，酒超好喝，店員YUI, Willy 人超nice!!!!","The atmosphere is good, the decoration is very modern, the wine is super delicious, the clerk yui, the Willy people super nice !!!!",False
去一定要找AVA喝！她好會玩吹牛哦,Go to find ava to drink!She can play bragging,False
喜歡店裡的感覺，可以輕鬆跟朋友聊天，yu也很親切,"If you like the feeling in the store, you can easily chat with friends, yu is also very kind",False
"9/22 每天下班都會經過的地方，今天終於來喝一杯，剛好有DJ放歌活動！實在讚！林貓王很懂放欸，超Chill！希望之後還有類似活動～～
調酒可以簡單客製化 「酒感重，減糖。」蠻不錯的～","On 9/22, you will pass the get off work every day. I finally come to have a drink today. There is just a DJ singing event!Really!The Lingcong knows how to let go, super chill!Hope there will be similar activities later ~~
Blooming can simply make ""heavy wine, reduce sugar."" It's pretty good ~",False
店家很棒yu給人的服務感覺很滿意 讓我會想再來,The shop is great. Yu gives people's service feel very satisfied. I will want to come again,False
適合小憩的好地方，調酒師超強👍👍,"Suitable for a good place, the bartender is super strong",False
Terry很帥 服務又好 下次一定會再訪,Terry is very handsome service and will be visited again next time,False
店員非常詳細介紹飲品，Terry態度很好,"The clerk introduced the drink in detail, Terry's attitude is very good",False
風味均衡且香氣豐沛純淨，很特別的理念，東西也很好喝唷！,"The flavor is balanced, rich and pure, very special concept, and things are delicious!",False
明亮乾淨，酒精濃度不高,"Bright and clean, the concentration of alcohol is not high",False
Ava人美服務也超好～大推👍🏻❤️,AVA people beauty service is also super good ~ big push 👍🏻❤️,False
"酒是認真調的，濃度/口感 選擇明確
價位合理，門口小叔介紹的很認真
裝潢所費不貲（斯麥特牆、隔音板、水泥地板、大片玻璃牆..等）

去過以後，不會想再去Draft land","Wine is carefully adjusted, and the concentration/taste selection is clear
The price is reasonable, and the uncle at the door introduces very seriously
The decoration is not expensive (Simat Wall, sound insulation board, cement floor, large glass wall .., etc.)

After I am, I won't want to go to Drapt Land again",False
場地很棒，店內風格舒適，店員Yu服務親切，會回訪,"The venue is great, the store's style is comfortable, the clerk YU service is cordial, and the visit will return to visit",False
"一個人午夜買醉
或只是微醺也ok
吧台舒適的聊天氛圍
順勢掃去了整天疲憊

幾杯後又期待下一口味
進入狀態也不捨得停歇
載著些許酒意盡興而歸
日後多了項選擇在台北","Buy drunk at midnight alone
Or just a little bit ok
The comfortable chat atmosphere
I swept away the exhaustion all day

After a few glasses, look forward to the next taste
I don't want to stop in the state
Carry a little wine and return
In the future, there will be more choices in Taipei",False
"氣氛好 是個適合喝酒放鬆的地方
Yu 有問必答","The atmosphere is a place suitable for drinking and relaxing
YU has a question to answer",False
"看起來空間很chill的地方
但酒真的很難喝
如果只是聊聊天不追求酒的話可以來","It looks like there is a place where there is chill
But wine is really hard to drink
If you just chat, you can come if you don’t pursue wine",False
"Annie人很友善 好聊天 介紹酒店單很用心
氣氛好的店","Annie people are very friendly to chat and introduce the hotel. The hotel is very attentive
Good atmosphere shop",False
Ava 超漂亮😻而且酒品質很好！！！,AVA is super beautiful and the quality of the wine is very good!IntersectionIntersection,False
Bartender 長相英俊瀟灑、玉樹臨風，有如潘安再世。重要的是，調出來的酒也是水準之上，難怪客人絡繹不絕，湧入而來。喝酒之餘，還能感受到bartender的幽默，五星好評仍道不上我今晚的愉悅程度。,"Bartender looks handsome and handsome, Yushu is in the wind, like Pan An's re -life.It is important that the wine that is transferred is also above the standard. No wonder the guests are constantly pouring in.After drinking, you can still feel Bartender's humor, and the five -star praise is still not my pleasure tonight.",False
Terry超帥又熱情，大家趕緊來找他,"Terry is handsome and enthusiastic, everyone hurry to come to him",False
Tipsy 系列很清爽！感謝Yui請酒～,The tipsy series is refreshing!Thank you yui for alcohol ~,False
Terry跟jusein還有yu服務真的超讚超棒ㄉ！！terry good,Terry and JUSEIN and YU services are really amazing!IntersectionTerry Good,False
"謝謝幫我頭髮用飲料上了髮膠
還送我臭臉
讚嘆荒謬～～讚嘆啊","Thank you for helping me with a drink on my hair
Also send me stinky face
Praise ridiculous ~~ admiration",False
荔枝好喝重點是音樂好聽氣氛很讚待了不想走手機沒電沒關係因為還有插座可以充電(⁎⁍̴̛ᴗ⁍̴̛⁎),The focus of litchi is the good atmosphere of music. It is very good at the atmosphere of music. I do n’t want to take a mobile phone. It ’s okay because there is a socket to charge (⁎⁍̴̛ᴗ⁍̴̛⁎),False
"在中秋節連假，喝著打撈月光的泰奶，跟當天的月亮一樣的令人陶醉，
藉著微醺抬頭望向月光，
彷彿看到織女吳剛，
明月幾時有，國館爛醉只服序章！","In the Mid -Autumn Festival holiday, the Thai milk that drinks the moonlight is as intoxicating as the moon on the day.
Looking up at the moonlight with slightly,
As if seeing the weaver girl Wu Gang,
When the moon is there, the National Pavilion is drunk and only takes the program!",False
讚讚尤其ava介紹的很好喝,"Zanzan, especially ava, is very delicious",False
調酒都很有特色，每個系列有各種濃度可以選擇，店內的裝潢與氛圍都很棒。,"The bartending is very distinctive. Each series has a variety of concentrations to choose from, and the decoration and atmosphere in the store are great.",False
"Yu超級可愛 又超級會聊天
超可愛的妹子：3","YU super cute and super chatting
Super cute girl: 3",False
AVA做的飲料很好喝，而且很正🤩,"The drink made by ava is delicious, and it is very positive",False
酒好喝；裝潢美,Good wine; beautiful decoration,False
"調酒好喝 調酒師也很nice
店內裝潢很漂亮 但吧檯椅子真的很難坐😂 …","Alcoholic, delicious bartender is also very nice
The interior decoration of the shop is very beautiful, but it is really hard to sit on the table chair ...",False
酒很難喝 椅子非常難坐 是一家外表看起來設計很酷 但進去充滿失望的bar,"It's hard to drink a chair, it's hard to sit. It is a BAR that looks cool but comes in.",False
酒好喝 推terry Annie 服務很讚,The wine is good to push the Terry Annie service,False
annie ted ava 服務態度良好。,Annie Ted Ava has a good service attitude.,False
Yu人很讚，很好聊，技術也很耐斯!,"YU is very good, very good to talk, and the technology is also very robbed!",False
沒固定座位，很 chill,"There is no fixed seat, very chill",False
調酒很像飲料好入口 酒感也不會很重 也能客製化 棒棒的,The bartending is very much like a drink and the entrance is not very heavy. It can be customized.,False
Yui調酒好喝 氣氛很好👍,YUI bartender is delicious atmosphere 👍,False
酒真的太甜，調酒普通，只有環境還行。,"The wine is really sweet, and the bartender is ordinary, only the environment is okay.",False
Terry 跟Jimmy服務態度很讚😎🤙🏻,Terry and Jimmy's service attitude is great 😎🤙🏻,False
店員Ava超美 酒好喝,The clerk ava super wine is so delicious,False
"酒好喝
推推茶口味 很香
但高腳椅不好坐
所以不會久留😂","Wine
Push the tea taste very fragrant
But high -foot chairs are not easy to sit
So I won't stay for a long time",False
Terry很帥服務很好，Justin調酒不錯,"Terry is very handsome service, Justin bartender is good",False
Ana人美服務又好🥰,ANA people beauty service is good,False
"讚 店員很nice！
尤其是Terry跟Justin😂😂","The clerk is very nice!
Especially Terry and Justin其",False
Yu 很會聊天 也很會調酒,YU can chat very well and bartender,False
讚讚的 很新奇😁 …,The praise is very novel ...,False
Terry 跟Jimmy服務態度超讚,Terry and Jimmy's service attitude are superb.,False
來這喝一定要點BURLY特調隱藏版 超級好喝,"Come here to drink, you must order Burly special hidden version of the super delicious version",False
Terry Justin服務超棒氣氛超好,Terry Justin service superba atmosphere is super good,False
工藝版調酒層次豐富 酒感細膩 夢中夢超讚!,The craft version of the bartending level is rich in wine and delicate dreams. Dreams are superb!,False
Justin 很熱情也會推銷朋友，讚讚,"Justin is very enthusiastic and will also sell friends, praise",False
AVA店員好看 服務滿分,AVA clerk good service full score,False
"Yui態度親切
Ted手勢漂亮","YUI is intimate
TED gesture beautiful",False
Yu很可愛 服務態度超級好,YU is very cute service attitude is super good,False
"Terry Justin yu
服務超好 讚讚 推推","Terry Justin yu
Service super good praise, push push",False
"氣氛非常好 飲料很好喝
Bartender Ted 很nice","The atmosphere is very good, the drink is delicious
Bartender Ted is very nice",False
AVA服務態度佳😻💖,AVA service attitude is good,False
Terry 跟Jimmy 服務嘎嘎頂,Terry and Jimmy service quaged top,False
調酒層次普通，紙杯質感不優,"The bartending level is ordinary, and the texture of the paper cup is not good",False
Yu服務很好 店面好看,"YU service is very good, the store is good -looking",False
不守時營業的酒吧 大家不用太早來,Don't come too early to open the bar that is not eager to open too early,False
Terry&justin 服務好 讚讚👍🏻 …,Terry & Justin service is so praise ...,False
Terry服務佳 下次會再來！,Terry service will come again next time!,False
打撈月光 是真的有料 喝完差點變李白,Moonlight is really expected to become Li Bai after drinking,False
"Terry,Justin服務好！","Terry, justin service!",False
Terry 人豪好 服務ㄧ吉棒,Terry people's good service ㄧ Ji Ji,False
悠閒自在的隨手一杯，好喝,"A cup of leisurely, delicious",False
謝謝Terry jimmy 的shot!,Thank you Terry Jimmy for your shopping!,False
Yu調酒快速好喝,YU bartending fast and delicious,False
Terry服務很好！,Terry service is very good!,False
"與朋友一起享用便宜但美味的飲料的好地方！我喜歡他們從清醒到微醺的菜單。

不過，避免他們的吧台座位，金屬座位很不舒服，哈哈","Enjoy cheap but delicious drinks with friends!I like their menu from sober to micro -slug.

However, to avoid their bar seats, metal seats are very uncomfortable, haha",False
喜歡這裡的內飾，但酒吧的椅子太不舒服了。酒的味道很好而且很特別,"I like the interior here, but the chair of the bar is too uncomfortable.The taste of wine is very good and very special",False
