Original,EN,Needs Review
"我有個朋友的朋友說，認為自己的條件也不差，但只能在廁所找到自己！

部分多的女性，各個精心打扮，除了香水不大一樣以外！眼線、唇色、妝感、裝可愛程度都有點雷同。
部分多男性偏多ABC、或頗多家世不差的人類。
音樂好聽、混音超級的舒服！年齡層落在28-40 😂
隨時都覺得人潮眾多","I have a friend of my friend that I think my conditions are not bad, but I can only find myself in the toilet!

Some women, dressed up carefully, except for the perfume is not the same!Eyeline, lip color, makeup, and cuteness are similar.
Some more men have more ABCs, or many people who are not bad in the world.
Music is nice, mixing is super comfortable!The age layer falls at 28-40 年
I think there are many crowds at any time",False
Han跟Vicente服務很好，很貼心，調酒也都好喝順口！,"HAN and Vicente have a good service, intimate, and bartender are also delicious!",False
氛圍令人放鬆，酒跟食物也都很讚！👍🏻💖,"The atmosphere is relaxed, and the wine and food are also very good!Bleak",False
"驗票的女公關吧，臉很臭態度很差勁！
其餘都還不錯，唯一的缺憾就是門面選錯人😊","Female public relations with votes, the face is very stinky!
The rest is not bad, the only regret is the wrong person to choose the wrong person.",False
"12點過後音樂開始大聲 bar轉換成夜店
可惜室內禁菸卻仍濃濃的煙味沒有管制不抽煙","After 12 o'clock, the music begins loudly to convert to a nightclub
Unfortunately, the smoke smell of smoking in the room is still strong, no control, no smoking",False
這裡超好玩，服務熱情親切，音樂很好聽！❤️❤️❤️每次回台灣一定都要來,"It's so fun here, the service is enthusiastic and kind, and the music is very nice!❤️❤️❤️ Every time you return to Taiwan, you must come",False
史上來過最讚的酒吧😻 VICENTE調酒超讚👍愛了愛了,I have come to the most popular bar in history 😻 Vicente bartender is super happy and loves,False
"如果對vvip的朋友 安管主管都是這種事不關己的態度的話,妳各位女生朋友要來的還是自己斟酌一下,貴店是私人企業當然可以有自己的一套準則跟標準,但如果今天任何一個女生的客人（更不要說是VVip的朋友）都是這種態度,我只能說不愧是私人企業👍各位女生朋友妳們自己要顧好自己。
---------------------------------------
回覆更新：
感謝您的回覆,根據您的答覆以下幾點請知悉：
1 .我在向該位安管主管說明友人在內嘔吐需要人照顧時，說的是希望該位安管主管可以“派人 ”不管是清潔人員也好還是女性員工也罷，幫忙照看一下情況,“而非我本人要進女廁照顧”，女廁男賓止步的道理及規矩我不會不懂），至於為何會在當下提此要求，原因是攙扶友人至女廁並目送她走進去時，明顯看出還需要再等候1~2位，而當時友人已手捂口欲似要嘔吐。（當下即便只是向內遞進去一個垃圾袋都讓人能稍微感受有用心在對應）
2.該位安管主管在我送友人至女廁後，確實在第一時間就上前來告知女廁男士禁止進入，我也說明我知道而我並無此意圖,以及友人的情況希望他派人照顧，而該位主管的回答則是：你的朋友在裡面吐,我就讓她在裡面吐，你還要我怎麼處理，麻煩您去外面等。 這就是我所說 的事不關己的態度，貴店也真的不需要把事情經過扭曲到好像是我執意要進女廁一樣。
當下哪怕該位安管主管只是探頭口頭詢問友人是否需要幫助也好，以對講機聯絡其他女性員工來處理也罷，都好過於他當下的不作為。）
3.在被提醒的當下，記憶中我以按照指示離開了女廁門口 ，或許在與該位安管主管爭論的當下所站的位置還是非常靠進女廁通道,這點在爭論的當下或許我沒有顧慮到，這邊可能我也有不適當的地方，若秘錄器呈現的事實真是如此，那我願意針對這點承認疏失並與該位主管與貴店致歉）
4最後希望貴店能真的做到一視同仁以顧客的安全為第一優先， 當晚最後 我送友人下樓前，該位主管在得知是哪位vvip的朋友之後，才補充說到： 你的朋友是◯◯的朋友的話，下次你就早點說是◯◯的朋友就好。當下聽到真的是無語。就像貴店闡述的不管今天是不是VVIP/VIP或者是一般客人，我想都應該被一視同仁的對待。
5.至於最後一點的暗示我也了然於心，致始至終我陳述的都是事實，貴店的公關部門也很盡責的以對公司最有利的方式去處理，若還需要說明，我還是會針對此次的事件到場與貴司調秘錄器釐清疑問，至於貴店往後收不收我這位客人對我來說不太重要。","If the manager of the security supervisor of VVIP is an attitude that is not at your own attitude, what your girl friends want to come and consider yourself. Today, any girl's guest (not to mention the VVIP friend) is this attitude. I can only say that it is worthy of being a private enterprise.
-------------------------------------------------------------------------------------------------------------------------------------------
Reply to update:
Thank you for your reply, please know according to your reply: Please know:
1. When I explained to this security supervisor, when my friend vomiting needs to take care of people, it is hoped that the security supervisor can ""send people"" whether it is cleaning staff or female employees. ""Instead of going to the women's toilet to take care of it,"" the principle and rules of women's toilet men's stops will not understand). As for why I mentioned this request at the moment, because I helped my friends to the women's toilet and sent her to walk in. It is clear that you need to wait for another 1 to 2 digits, and at that time, friends had to vomit with their hands covering their mouths.(At present, even if you just handle a garbage bag inward, people can feel a little bit of intention to be with the corresponding)
2. After I sent friends to the women's toilet, the security supervisor did come to tell the women's toilet men to prohibit entry as soon as possible. I also explained that I knew and I didn't have this intention. Send someone to take care of, and the answer of the supervisor is: your friend vomits inside, and I let her vomit inside. How do you want me to deal with it, trouble you to go outside, etc.This is what I said, nothing to do with myself, and your store really does not need to distort things as if I insist that I want to enter the women's toilet.
At present, even if the security supervisor is only a probe, it is better to ask friends if you need help, and contact other female employees to deal with it in a walkie -talkie, it is better than his current inaction..
3. In the moment I was reminded, in my memory, I left the door of the women's toilet in accordance with the instructions. Perhaps the position of the current position with the current in charge of the security supervisor is still very easy to enter the women's toilet channel. I have no concern, I may have inappropriate places here. If the facts presented by the secret recorder are really the case, then I am willing to acknowledge the loss and apologize to the supervisor with the supervisor).
4 Finally, I hope that your store can really be the first priority to treat the customer's safety. The last night before I sent my friends to go downstairs. After learning which VVIP friend was a friend, I added: Your If your friend is a friend, you will say that you will be a good friend early next time.It was really speechless when I heard it now.Just like whether your store explains whether it is VVIP/VIP or ordinary guests today, I think it should be treated equally.
5. As for the last hint, I also know the facts, from the beginning to the end, it is the fact that the public relations department of Guidian is also responsible for handling it in the most favorable way to the company. I will still clarify their questions with your secretary adjustment of the secrets. As for your shop, it is not important for me to accept me.",False
環境和調酒都是一流的。創意調酒真的很驚人，很喜歡。食物有很有特色，起司漢堡餛飩很有趣。,"The environment and bartending are first -class.Creative bartending is really amazing and likes it very much.Food is very distinctive, and cheese burger is very interesting.",False
來這裡第二次了，女服務人員很熱情，環境很美，音樂佳，味道也很香，適合空閒時候來這裡小酌，酒的味道非常特殊非常好，氣氛超讚。,"It ’s the second time here. The female service staff is very enthusiastic, the environment is beautiful, the music is good, the taste is also very fragrant. It is suitable for coming here to drink here. The taste of the wine is very special, very good, and the atmosphere is great.",False
"樓下工作人員服裝把關的太好了，五顆星實在不夠所以我給六顆星。
對於服裝要求超級雙標，休閒服裝定義是什麼不講清楚，牛仔寬褲不行，其他人都穿窄到爆的褲子就可以，甚至有人穿棉褲，到底誰比較不正式，根本就挑人吧，公告還說絕無歧視性別，員工看不順眼就不行，只要有包廂穿怎樣都可以，要笑死誰，這種店為什麼還沒倒一倒。
————
更新：繼續唬爛啊，只會回罐頭回覆，快要過一年了，我看一點長進都沒有，性別歧視種族歧視照樣發生，沒包廂的人就擋下來，你們面試員工是用膝蓋面的嗎，可不可以選素質好一點的，真的可憐怎麼還沒倒一倒。","The staff downstairs is very good. The five stars are not enough, so I give six stars.
Regarding the super dual standard for clothing requirements, what is the definition of casual clothing is not clear, denim wide pants are not good, others can be worn narrow to explosive pants. Some people even wear cotton pants. The announcement also said that there is no discrimination of gender. Employees do not look at the eye. As long as there is a box, you can wear it. Whoever laughs to death, why this kind of shop has not fallen.
————————
Update: Continue to bluff, I will only reply to the cans. It ’s about a year. I do n’t see a little. Gender discrimination racial discrimination occurs. People without a box are blocked. Do you interview employees with knees? Can you choose a better quality? It's really pitiful.",False
"環境很舒適，第一次來店員也很熱情推薦！
芭樂調酒好喝又特別👍推推
整顆芭樂端上來超Q  可愛發瘋","The environment is very comfortable.
Brune bartend
The whole guava came up to be super Q cute and crazy",False
氣氛佳，吧天德服務良好～尤其是維辰☺️ 很適合和朋友來小飲聊天！,"The atmosphere is good, the Tiande service is good ~ especially Weichen ☺️ is suitable for chatting with friends!",False
不敢相信2024還有這種國際酒吧是多元性別「不」友善店家🏳️‍⚧️🏳️‍🌈 …,"Can't believe 2024 and this international bar is a diversified gender ""no"" friendly shop 🏳️‍⚧️🏳️‍🌈 ...",False
"第一次來Kor!平日跟姐妹們坐在吧台，Vincent,Ziyi跟Kid都很讚！大推😍😍😍🥂🥂🥂","The first time I came to Kor! Sitting with the sisters on weekdays, vincent, ziyi and Kid are all very good!Big Push",False
"整體來說消費水平偏高，KOR 的調酒精緻，特殊招牌很經典的 Quava 芭樂調酒，好喝又濃又有水果吃 ，奶蓋茶酒普通

開包廂的話費用包含香檳
音樂 #🎵 體驗讚

12:00 - 02:00最高峰人最多的時候
位置就在忠孝敦化 Zara 樓上，都在5⃣️樓對面就是 Omni，
在樓下要先管安檢出示身分證","Overall the consumption level is high, KOR's bartending is exquisite, special signboards are classic Quava guava guava bartender, delicious and fruitful, milk cover tea wine is ordinary

The champagne for the champagne of the champagne of the box is champagne
Music #🎵 Experience praise

12:00-02:00 The highest peak is the most time
The location is upstairs in Zara, Zhongxiao Dunhua, all on the opposite side of 5⃣️ are OMNI.
Go downstairs to manage the security check to the identity card",False
"環境舒服放鬆 氣氛佳
辰辰服務態度超好 客氣禮貌又愛笑
很舒服的體驗","The environment is comfortable and relaxed, the atmosphere is good
Chenchen's service attitude is super good, polite and laugh
Very comfortable experience",False
"氣氛舒服 充滿果香味
吧台tender維辰親切又好聊 大推！","The atmosphere is comfortable and full of fruity aroma
Bar TENDER Victoria Carey and Talking!",False
"讚讚～
珍珠調酒跟芭樂調酒好喝！
吧台人很親切～","Praise ~
Pearl bartending and bartender are good!
The people in the bar are very kind ~",False
不愧是得到世界設計大獎的酒吧！令人驚豔的空間設計、經典與創意兼具的調酒、還有世界各地難得一見的稀有烈酒，是全台灣最好的酒吧。,"It is indeed a bar that has won the World Design Awards!The amazing space design, classic and creative bartending, as well as rare spirits that are rare in the world, are the best bars in Taiwan.",False
"服務很Nice 酒很好喝 人都很好聊很親切
愛店就是KOR惹(⁎⁍̴̛ᴗ⁍̴̛⁎)","The service is very nice, very delicious, people are very good, very good, very kind
Love shop is Kor ⁎⁍̴̛ᴗ⁍̴̛⁎ (⁎⁍̴̛ᴗ⁍̴̛⁎)",False
"平日來可以很舒服的喝酒
服務生也很會介紹
療癒好去處","You can drink very comfortably on weekdays
The waiter will also introduce it
Heal",False
氣氛很好 酒就很好喝 音樂好聽 找Vicente 調酒就對了👍🏻,"The atmosphere is very good, so good the music is good to find Vicente sober, right?",False
"台北東區酒吧 KOR taipei
一個特色酒吧
一個自己一個人也適合來的地方
沉浸在音樂
享受認識新朋友","Taipei East District Bar KOR TAIPEI
A specialty bar
A place where one is also suitable for himself
Immersed in music
Enjoy a new friend",False
"第一次來到有dress code的酒吧
非常享受這種chill 的氣氛
下班下課後來一杯
認真放鬆與享受
Bartender 還會很親切的跟你介紹不同的酒和現場的一些運作
非常喜歡這種輕鬆的氣氛👍🏼

另外9:00-11:30會有霸台座位區可以訂位
平日也有開放
非常讚 大推","The first time I came to a bar with Dress Code
Enjoy this kind of chill atmosphere very much
A cup after class after get off work
Carefully relax and enjoy
Bartender will also introduce you to different wines and some operations on the scene with you
I really like this relaxed atmosphere 轻

In addition, 9: 00-11: 30 will have the Batai seat area to book a place
There is also open on weekdays
Very much push",False
"音樂好聽！酒普通啦～
站著的酒吧🥂 …","The music is nice!Wine is ordinary ~
Standing bar 吧 ...",False
不喝酒來這裡也可以喝果汁特調 超讚👍,You can also drink fruit juice here without drinking alcohol.,False
氣氛好，店員也很親切，調酒也非常順口,"The atmosphere is good, the clerk is also very kind, and the bartender is very smooth",False
"ACE調的酒很好喝，態度也很好~~
酒吧的氛圍也讚讚","The wine adjusted by ACE is very delicious, and the attitude is very good ~~
The atmosphere of the bar is also praised",False
氣氛很好～沒想到調酒也好喝🍸 …,The atmosphere is very good ~ I did n’t expect to be bartending and it was delicious ...,False
"什麼叫穿的服裝太休閒不能進場?上面哪一行規定有寫?沒寫清楚你們要不要補上去?
一個留男生頭髮的女生你是要要求他穿的怎麼樣?西裝?露肚裝?迷你裙?洋裝?請問到底要怎樣才符合貴店要求的穿著?不但沒有明文規定還敢要求?1樓的管制人員還有防疫人員也一直反覆說詞…一下說服裝不行.時間太晚不行.散客11點前才開放..
啊 結果 我看了其他評論才發現穿著女裝的男生也被拒絕入場了?沒想到現在還有這種性別歧視? 我想說我也沒有穿的不休閒啊..襯衫+黑牛窄褲..一堆男生穿著T恤+牛窄褲就可以進場!?原來 那怎麼不乾脆直接跟我說中性的女生不開放好啦!?在我面前那邊指指點點 閒言閒語 說什麼人家有包廂我沒有?我在旁邊站了20分鐘也看到好幾個沒包廂跟我穿著類似的男生進去啊..這藉口真的很讓人作噁 一直想隨便找個藉口趕走就算了 最氣的是還用那種輕蔑的眼神看人真的很不尊重人 沒想到只是去個地方喝酒還會受到被管制人員視為異物的眼神看待 真的是個爛地方 制度爛態度也爛","What is the clothing that is too casual to wear? Which party is written on the above stipulation? Do you want to make it clear?
What do you want him to wear a girl who stays with a boy? Suites? Deloged? Mini skirt? Dress? How can I wear it in your requirements? The controller also has the epidemic prevention personnel who has been repeatedly said ... It is said that the clothing is not good. It is too late. The customer will only be open before 11 o'clock ..
Ah, after seeing other comments, I found that the boys wearing women's clothing were also refused to enter? I did n’t expect that there are still such gender discrimination? I want to say that I have n’t worn unwavering .. Shirts+black jealum pants. . A bunch of boys can enter the venue in a T -shirt+narrow pants!? Why don't you just tell me that the neutral girl is not open!? What do you say to gossip in front of me? I do n’t have a box, I do n’t? I stood next to I stood by for 20 minutes and saw a few boys who did n’t wear a room like me .. This excuse really made people want to find an excuse to drive away. It is still using the contempt eyes to see people really disrespect. I did n’t expect that it was just a rotten local system that would be regarded as a foreign body.",False
調酒師非常專業！調酒很好喝😍😍😍,The bartender is very professional!It's delicious for bartending 喝,False
"酒很好喝 氣氛佳🫶🏻
辰辰很熱情態度很好😻","The wine is delicious and the atmosphere is good 气
Chenchen is very enthusiastic, very good",False
"全台北全好玩的酒吧殿堂
酒好喝 氣氛又好 偏Hiphop music
平日2-4現在還有優惠
DD 親切又可愛
有機會都可以去朝聖看看","The fun bar hall in Taipei
The wine is good and the atmosphere is good
There are still discounts on weekdays 2-4 now
DD kind and cute
You can go to the pilgrimage to see if you have a chance",False
芭樂酒超好喝～辰辰服務超好,Barler wine is super delicious ~ Chenchen service is super good,False
現場氣氛很熱鬧，服務員動作迅速，最常來服務的JOY相當熱情，體驗非常棒👍,"The atmosphere at the scene was very lively, the waiter moved quickly, and the most commonly served Joy was very enthusiastic. The experience was great.",False
辰辰服務態度很好！調酒好喝😍,Chenchen's service attitude is very good!Blooming delicious 😍,False
環境舒服、調酒順口、適合下班來聚聚,"The environment is comfortable, the bartender is smooth, suitable for getting together to gather",False
"沒有誇張,看你來不來
來台北必走過一次兩次隨便幾次
總之來就對了!!","No exaggeration, see if you come
Come to Taipei once or twice a few times, just a few times
In short, it's right !!",False
一直都很喜歡的bar🥰 超愛珍奶,"Bar, I always liked BAR Super Love Milk",False
店裡環境好喜歡！辰辰人超好！,I like the environment in the store!Chenchen people are so good!,False
服務生的態度超好！調酒也很好喝又很特殊,The waiter's attitude is super good!Blooming is also delicious and special,False
週末熱鬧的氛圍可以來這裡享受音樂跟著跳舞，平日截然不同，可以好好放鬆跟朋友聊天，感覺都很棒🥹 …,The lively atmosphere of the weekend can come here to enjoy music and dance. It is very different on weekdays. You can relax and chat with friends. It feels great ...,False
裝潢燈光設計都很棒，氛圍一流。調酒也沒話說！但現場包箱座位有一股清潔劑的味道，化學反應讓我氣喘。,"The decoration lighting design is great and the atmosphere is first -rate.There is nothing to say!However, the on -site bag seat has a smell of a cleaner, and the chemical reaction makes me breathless.",False
"平日的氣氛不輸假日
舒服自在的氛圍更讓人沉醉","The usual atmosphere does not lose holiday
The comfortable atmosphere is even more intoxicating",False
"Best way to go for a drink
台北最愛的酒吧 氣氛超讚","Best Way to go for a drink
The atmosphere of the favorite bar in Taipei is great",False
調酒非常好喝💘💘服務生態度很好,Blooming is very delicious 态 The service ecosystem is very good,False
"久違 還是喜歡這邊的氣氛很舒服 ❤️
這個酒感也是很幸福餒🥳🥳🥳","I still like the atmosphere here for a long time, very comfortable ❤️
This wine feels very happy 🥳🥳🥳",False
吧台們都很專業 酒好喝 氣氛很好 每個禮拜都想來,Barmen are very professional and the atmosphere is very good. Every week I want to come every week,False
贈送的腰果超好吃～～讓人停不下來啊✨,The gift of cashews is super delicious ~~ Makes people unable to stop.,False
"服務調酒很棒
有個外國客人講話很沒禮貌  服務人員還應對的有耐心禮貌
服務人員辛苦了👍","Service bartending is great
A foreign guest speaks very rudely. The service staff also responds to patience and politeness
The service staff worked hard 辛",False
很開心的晚上！氣氛很好，音樂很好聽，空間很舒服🫰🏻,"Happy night!The atmosphere is very good, the music is very nice, the space is very comfortable 🫰🏻",False
"Bartender人都很好 調酒都很棒
好喜歡Ryan 推推👍🏼","Bartender is very good for bartending, it's great
I really like Ryan push an",False
趁著壽星大喜之日，調酒好喝😍氛圍很棒,"Taking advantage of Shouxing's happy day, the atmosphere of bartending is great",False
"舒服地空間,enjoy it","Comfortable space, enjoy it",False
第一次來真的很喜歡這裡多氛圍感，工作人員都對我們很客氣！環境很舒服 ，不枉費從 中壢上來玩～,"For the first time, I really like a sense of atmosphere here, and the staff are very polite to us!The environment is very comfortable.",False
Bartender都很帥、珍奶芭樂酒etc 都讚，推,"Bartender is very handsome, and the treasure Bara wine ETC is praised, pushing",False
"平日也可以來
很舒服的喝酒
音樂不錯
服務生也很好
療癒好去處👏🏻","You can also come on weekdays
Very comfortable drinking
Music
The waiter is also very good
Healing and going well",False
氣氛很舒服 服務人員都很好 下次要喝酒一定再來,The atmosphere is very comfortable. The service staff will be very good next time you will drink again,False
環境舒適且音樂好聽，餐點及酒水都很優秀，工作人員態度佳且幽默,"The environment is comfortable and nice, the meals and drinks are excellent, the staff attitude is good and humorous",False
"vinson專業！健談！
做的Ramos Gin Fizz超好喝~","vinson professional!Talk!
The RAMOS GIN FIZZ I made is super delicious ~",False
"Vicente調酒好好喝😍👍🏻
來Kor找他就對了😎😎😎 …","Vicente bartending and drinking 😍👍🏻
Kor is right to find him ...",False
氣氛好 辰辰人很好👍🏻調酒也好喝 …,"The atmosphere is good, Chenchen is very good and sibacy is also delicious ...",False
珍奶超級讚！服務超棒🥰跟閨蜜約會的好地方💕💕💕,Zhen milk is super like!Serving superb a good place to date girlfriends 💕💕💕,False
"芭樂很大顆 很好吃
酒也很好喝 很順口
最愛珍奶🤍","Barler is very delicious and delicious
The wine is also delicious and smooth
Favorite Zhen Milk 奶",False
Vicente 調酒師很熱情專業，服務滿分！,"Vicente bartender is very enthusiastic and professional, with full service!",False
調酒好喝餐點好吃 服務人員joy超親切👍🏻 …,Bart -up and delicious meal delicious service staff joy super friendly ...,False
"有氛圍但不會吵雜
服務人員很友善，聊天不會有壓力～","There is an atmosphere but no noise
The service staff is very friendly, there will be no pressure to chat ~",False
東西很好吃很好喝！來這裡聽音樂吃吃喝喝～～超爽！常常看到一個妹妹頭的外場超可愛又超親切！！（喜歡）,Things are delicious and delicious!Come here to listen to music to eat and drink ~~ Super cool!I often see a younger sister's head out of cuteness and kindness!Intersection(like),False
辰辰服務超好☺️人很nice💗,Chenchen service is super good 很️ People are very nice 很,False
場地漂亮、服務親切！拔剌好吃而且超可愛,The venue is beautiful and kind!It's delicious and cute,False
酒好喝，環境又好，服務員很可愛！！,"The wine is delicious, the environment is good, and the waiter is cute!Intersection",False
酒類都很讚 辰辰親切熱情👍🏻👍🏻,The wine is very good at Chen Chen's kind enthusiastically 👍🏻👍🏻,False
芭樂酒超特別❤️,Barr wine super special ❤️,False
