Original,EN,Needs Review
"酒很好喝
氣氛很棒
是個放鬆的好地點🤩","Wine is delicious
The atmosphere is great
It's a good place to relax 的",False
辰辰好可愛😍人超好 招待的酒也好喝🫰🏻,"Chenchen is so cute, the wine that is super good is also delicious 🫰🏻",False
Bartender很專業 酒很好喝 音樂好聽～,"Bartender is very professional, wine, delicious music, good music ~",False
飲品食物跟調酒師都很棒❤️👍,Drink food and alcoholics are great ❤️,False
氣氛跟服務都很讚的地方～,The atmosphere and the service are very good ~,False
酒很好喝 氣氛又好！,The wine is delicious and the atmosphere is good!,False
"環境舒服空間大
調酒很好喝很適合女生點","The environment is comfortable
Blooming is delicious and suitable for girls.",False
調酒好喝 辰辰服務超好👍😻,"Bart -up is delicious, Chenchen service is super good",False
沒什麼人的星期三晚上。,No one's Wednesday night.,False
"酒好喝，氣氛也好，原本完全沒訂位，但因為很早來，現場就生了兩個吧台的位子給我們，非常感謝
可以呀，可以可以提交","The wine is delicious and the atmosphere is good. Originally, there was no reservation at all, but because it came early, I gave us two seats on the scene. Thank you very much.
Yes, you can submit",False
酒跟氣氛都很讚,The wine and the atmosphere are great,False
點了經典芭樂 / Earl Grey / 和一款mocktail 都超好喝！！！,Once the classic Barl / Earl Grey / and a Mocktail are all delicious!IntersectionIntersection,False
"招牌芭樂調酒是用整顆芭樂原果當酒杯超級特別！Signature cocktails 我們點到的每杯都好喝，位置舒適，服務生也很親切☺️
推薦大家！","The signature guava bartender is super special as a whole guava original fruit!SIGNATURE COCKTAILS we ordered each cup is delicious, the position is comfortable, and the waiter is very kind ☺️
Recommend everyone!",False
好玩 服務熱情 音樂好聽 妹妹頭服務生最可愛😍😍,"Fun service, enthusiastic music, nice sister head waiter is the cutest 😍😍",False
DD自己兄弟 只要DD照顧我們 就願意多開酒喝爆,DD brothers are willing to drink more wine as long as we take care of DD,False
氣氛很好 調酒師很親切,"The atmosphere is very good, the bartender is very kind and very kind",False
調酒好喝！氣氛很好～～,Blooming is delicious!The atmosphere is very good ~~,False
每一杯酒都有wow的感覺 fantastic,"Every glass of wine feels like wow, Fantastic",False
珍奶調酒必點🥰,Zhen milk bartender must be ordered 酒,False
氣氛好，酒好喝🥹🫶🏻🩷,"The atmosphere is good, the wine is delicious 酒",False
"不得不稱讚一下工作人員的反應能力跟鷹眼，有一個很高很壯手臂有刺青的工作人員，眼光掃過一下就發現檯面上有玻璃碎片，馬上用手電筒確認一下，發現真的是玻璃碎片後立馬從樓梯跨過來前往處理並提醒周遭客人，真的是太貼心了！確保了客人的安全因為當下真的很暗很難注意到！太厲害了！
當天跟朋友玩的很開心，從門口的領檯到吧台的工作人員都感受到大家的熱心服務！","I have to praise the staff's response ability and Hawkeye. There is a very tall, strong arms and tattoos. After sweeping it, I found that there are glass fragments on the table. I immediately confirmed it with a flashlight. I found that it was really glass fragmentation. After standing up the staircase, it was too intimate!Ensure that the safety of the guests is really dark at the moment!Too great!
On the same day, I was very happy to play with my friends. The staff from the pilot from the door to the bar feel everyone's enthusiastic service!",False
酒很特別很好喝🤭,Wine is very delicious 别,False
環境加服務很好，調酒好喝，可刷卡。,"The environment is very good, the bartender is delicious, you can swipe the card.",False
氣氛很好！服務人員也超熱情，主動推薦很多好喝的調酒，很值得來👍🏻👍🏻👍🏻第一次來就感受很好,"The atmosphere is good!The service staff is also very enthusiastic, and actively recommend a lot of delicious bartender. It is worth coming to come and feel good for the first time.",False
氣氛很推，餐點很配酒，服務親切100%，重點Bartender很帥😄,"The atmosphere is very pushing, the meal is very good at wine, the service is 100%kind, and the key Bartender is handsome",False
"Babo tea好好喝😚
是個下班喝一杯的好地方","Babo Tea
It's a good place to drink a cup from get off work",False
"喜歡的療癒狂歡酒吧😍😍
酒都好好喝!!🥂🥃 …","Favorite healing carnival bar
The wine is delicious !! 喝 ...",False
特調芭樂很有特色,Special Bavo is very distinctive,False
Vincent調酒超好喝☺️,Vincent bartending is super good ☺️,False
辰辰調酒師招待的就好喝👍,Chenchen Bartender's hospitality is delicious 👍,False
這邊的酒真的都超好喝 Bartender 每位都非常親切 超級推來這邊好好放鬆！,The wine here is really super good. Bartender is very kind and super -pushed here to relax here!,False
他們都好友善. Cocktails 也很棒。,They are all friendly. Cocktails is also great.,False
酒都超好喝，音樂也好聽～～,"The wine is super delicious, and the music is good ~~",False
"Vincent和Chris超棒超可愛～
調酒超好喝！早早來還可以體驗兩種氛圍的Kor！第一次來就愛上😍","Vincent and Chris are super cute ~
The bartending is so delicious!You can also experience the Kor of the two atmosphere early!Fall in love with 就",False
金髮的漂亮服務員服務超級好也很親切！！即使人多我們也可以很快的點到餐點，非常照顧我們～ 辛苦妳了謝謝妳❤️‍🔥,"The beautiful serviceman of the blonde is super good and very kind!IntersectionEven if we have many people, we can quickly order meals, take care of us very much ~ For hard work, thank you ❤️‍🔥",False
"調酒好喝 氣氛佳
服務人員十分積極也親切","The atmosphere of bartender is good
The service staff is very positive and kind",False
"本來和朋友是超愛kor的
但就在10/29號同志大遊行這天發現
Kor是一間LGBT不友善的店家
（一顆星都嫌多）
明顯性別歧視卻一再用dress code來搪塞客人

一行人中有3位朋友都穿著防風材質tracksuit + 球鞋，其中兩位男性給過 另一位較中性的女生就以服裝不符合標準不讓她過
樓下安管還以「穿得不像是來party」拒絕她入場
請問都已經在kor樓下排隊了，不來party難道來睡覺的嗎？女生有打扮的定義是？

正當要離開時，有店員來跟我們說，不想破壞我們的興致，要讓我們上去

後來還是決定不上去了
上不上去已經不是什麼問題

問題在於員工存在性別歧視
這點讓人不能接受

與某位自稱為主管的店員在樓下的對話讓人不以為然
一直鬼打牆以幫客人把關服裝為由來掩蓋性別歧視
評量標準不一，其實根本不是衣服本身，而是誰穿了這樣的衣服吧
今天是Rihanna穿運動服來 擋嗎
不要再說什麼跟循歐美dress code標準了
建議店家幫員工更新一下流行知識&性別多元再教育

Btw別再複製貼上回覆一樣的服裝policy 有點誠意吧！","Originally, I love Kor with my friends
But it was discovered on the day of the comrades No. 10/29
Kor is an unfriendly LGBT shop
(A star is too much)
Obviously gender discrimination has repeatedly used DRESS CODE to confuse guests

Three of the groups of people are wearing windprorsuit + sneakers, and two of them have given another more neutral girl.
The downstairs security tube refuses her to enter
I have already lined up downstairs in KOR. Do n’t you come to sleep?What is the definition of girls?

When I was about to leave, some clerk came to tell us that we do not want to destroy our interest, and let us go up

Later, I still couldn't decide to go up anymore
It's not a problem if you can't get up

The problem is that employees have gender discrimination
This is unacceptable

The dialogue with a clerk who claimed to be the supervisor on the downstairs makes people disapprove
Ghostly hit the wall to help guests cover closing clothing as the origin to cover up gender discrimination
The evaluation standards are different. In fact, it is not the clothes itself, but who wears such clothes.
Is today Rihanna wearing sportswear to block it?
Don't say anything and follow the European and American Dress Code standards
It is recommended that the store help employees to update the popular knowledge & gender diversified re -education

Don't copy the same clothing Policy for BTW.",False
Amis人很熱情，推薦的酒也很好喝，氣氛很舒服，平日沒有低消，點香檳會有辣妹跳舞～,"The AMIS people are very enthusiastic, the recommended wine is also delicious, the atmosphere is very comfortable, there is no low disappearance on weekdays, there will be a hot girl dancing in champagne ~",False
我發現有一位服務生服務很好，無時無刻都照顧包廂客人的狀態，好像叫Joy，有機會下次可以去看看她🎊🎊 …,I found that a waiter has a good service and takes care of the guests of the box guests all the time. It seems to be called Joy. I have the opportunity to go to see her next time ...,False
"員工Joy 很可愛服務態度佳o(*////▽////*)q
Happy Hour 開心🥳 …","Employee Joy is very cute service attitude o (*//// ▽ ////*) Q
Happy Hour is happy 🥳 ...",False
酒很好喝一定要喝拔辣酒🥳 音樂又好聽～～ …,"The wine is delicious, you must drink spicy wine 🥳 music and music ~~ ...",False
"排了快一小時快入場，才和我們說穿帽t不夠正式不能入場喔！一堆進場和離開的男生都穿帽t啊…不讓客人入場也不是這種態度吧⋯⋯
態度有夠差的","After the end of the market, I told us that wearing a hat T not enough to enter the venue!A bunch of boys entering and leaving are wearing hats T ... It is not this attitude to not let guests enter the venue ...
The attitude is poor enough",False
9:30來太棒了！還有位子坐！就像大型餐酒館😍Bartender人都很好～～～～,9:30 is great!There are also sitting!It's like a large dining tavern arBartender is very good ~~~~,False
裝潢設計很美，氣氛很好的酒吧！,The decoration design is beautiful and the atmosphere is very good!,False
氣氛很好～音響👍 …,The atmosphere is very good ~ audio 好 ...,False
媽媽久沒放風～ 來到這裡覺得自己瞬間年輕10歲！完全氣氛超好 ！超漂亮～ 以後放風唯一首選❤️,Mom hasn't let go of the wind for a long time ~ I came here and felt that she was 10 years younger in an instant!The full atmosphere is super good!Super pretty ~ the only choice for the wind in the future ❤️,False
"去了幾次,感覺還不錯
但...
可以不要把不知道是心裡有事還是家裡有事的擺門面嗎？
樓下檢查證件的那個女的臉永遠都那麼臭,
服務態度也很差
看到就很解,大家是來玩的,不是來受氣的
還沒進門就吸收了滿滿的負能量啊","After a few times, I feel pretty good
but...
Can you not know if you do n’t know if something is in your heart or something at home?
The face of the woman who checked downstairs will always be so smelly,
The service attitude is also very poor
It's a solution to see it. Everyone is here to play, not to be angry
I absorbed full of negative energy before entering the door.",False
"這是一個很棒的酒吧，適合和好朋友一起喝一杯，但是，一切都相當昂貴。準備好留下一些錢來享受幾個小時的樂趣。

服務還可以，但是很循規蹈矩，即使你稍微解開襯衫的釦子，他們也不會覺得責備你有什麼不對。服務生總是想把你的飲料拿走，即使沒喝完，所以要用雙手保護它哈哈！

點了披薩之類的零食，這肯定是亮點，這對於心情和飲料來說都是完美的。","This is a great bar, suitable for drinking a drink with good friends, but everything is quite expensive.Ready to leave some money to enjoy for a few hours.

The service is okay, but it is very good. Even if you unbutton the shirt slightly, they will not feel that there is anything wrong with you.The waiter always wants to take your drink away, even if you don't finish it, so protect it with both hands haha!

Ordering pizza and other snacks is definitely a highlight, which is perfect for mood and drinks.",False
很棒的飲料，還有更好的調酒師。非常有趣，是任何台北之旅的必遊之地。,"A great drink and better bartender.Very interesting, it is a must -visit place for any trip to Taipei.",False
這個地方甚至歡迎遊客！氣氛、調酒師、雞尾酒、人群和音樂都很棒。一定會回來的！,"This place even welcome tourists!The atmosphere, bartender, cocktail, crowd and music are great.Will definitely come back!",False
這太好吃了！,This is so delicious!,False
晚餐後喝一杯的好地方。  蒂姆和文森特向我們致意，他們的服務非常出色。告訴他們您想喝什麼，他們會為您調製合適的飲料。  氣氛很好，有很棒的人。,"Drink a good place after dinner.Tim and Vincent tried to us, and their services were very good.Tell them what you want to drink, they will prepare the right drink for you.The atmosphere is very good, there are great people.",False
"台北最好的酒吧/俱樂部/無論怎樣，即使不是最好的酒吧/俱樂部之一。  每個人都習慣了飲料很好但服務很糟糕的地方，服務很好但氣氛很糟糕的地方，或者氣氛很好但飲料很糟糕的地方。  然而 KOR 擁有這一切。

酒吧工作人員看起來更像是一個定制的經典酒吧，而不是一個有震撼音樂和炸雞的地方（順便說一句，這很棒）。  經過深思熟慮和測試的飲品配方，加上熟練、專業的調酒師，打造出無與倫比的組合。","Taipei's best bar/club/no matter what, even one of the best bars/clubs.Everyone is used to places where the drink is very good but the service is bad. The service is good but the atmosphere is bad, or the atmosphere is good but the drink is very bad.But Kor has it all.

Bar staff look more like a customized classic bar instead of a place with shocking music and fried chicken (by the way, this is great).After careful and tested drink formula, and skilled and professional bartenders to create an unparalleled combination.",False
"氣氛非常好，工作人員非常友好。
招牌雞尾酒很好喝，他英文也很好，玩得很開心👀💕","The atmosphere is very good, and the staff is very friendly.
The signature cocktail is very delicious, he is very good in English, and he is very happy 👀💕",False
"雞尾酒和氣氛都很棒
非常感謝文森先生！因為你，我才能享受這個酒吧和美味的飲料！
我強烈推薦這個酒吧！我認為嘗試番石榴雞尾酒並向文森特詢問推薦菜單是個好主意：D！
推薦番石榴雞尾酒！並向文森先生詢問飲料！他是一位出色的調酒師*&","Cocktails and atmosphere are great
Thank you Mr. Vinson!Because of you, I can enjoy this bar and delicious drink!
I highly recommend this bar!I think it is a good idea to try to try guava cocktail and ask Vinson for the recommendation menu: D!
Recommend guava cocktail!And ask Mr. Vinson!He is an excellent bartender*&",False
"去台灣一定要去看看♡.♡
因為氣氛喝醉，喝雞尾酒，又因為零食喝醉。
氣氛比梨泰院任何其他俱樂部或酒吧都要好，而且雞尾酒是最好的♡.♡
如果你喜歡高端俱樂部，我強烈推薦你去。
我去台灣去韓國...哈哈。
如果您正在尋找一家提供優質美味小吃和雞尾酒的俱樂部，那麼這裡是您必去的地方♡","You must go to Taiwan if you go to Taiwan ♡. 去
Drunk at the atmosphere, drinking cocktails, and drunk because of snacks.
The atmosphere is better than any other club or bar in Litaiyuan, and cocktails are the best.
If you like high -end clubs, I strongly recommend you to go.
I go to Taiwan to South Korea ... haha.
If you are looking for a club that provides high -quality delicious snacks and cocktails, then this is where you must go ♡",False
門口的工作人員粗魯且具有歧視性。 DJ 轉換類型的次數太多了。但這是一個非常好的地方。啤酒不太貴。,The staff at the door are rude and discriminatory.There are too many times of DJ conversion types.But this is a very good place.Beer is not too expensive.,False
"KOR 的工作人員非常專業，調製雞尾酒的技術令人驚嘆，而且非常友好。我們參觀了一周，這是我們週二在台北的第一站雞尾酒吧。氛圍休閒，但裝飾和外觀都很優雅。

如果您正在尋找一個坐下來放鬆和喝酒的好地方，我強烈推薦您。有吳時尚！","KOR's staff is very professional. The technology of preparing cocktails is amazing and very friendly.We visited for a week. This was our first cocktail bar in Taipei on Tuesday.The atmosphere is casual, but the decoration and appearance are elegant.

If you are looking for a good place to sit down to relax and drink, I highly recommend you.There are Wu fashion!",False
調酒師非常友好，飲料也很棒！總的來說，氛圍很棒。如果您想在台北市中心度過一段愉快的時光，我強烈推薦這個地方,"The bartender is very friendly and the drink is also great!In general, the atmosphere is great.If you want to spend a happy time in the center of Taipei, I strongly recommend this place",False
高檔夜總會酒廊提供優質雞尾酒和音樂。好的氛圍。好聽的音樂。在台北很有名。,The high -end nightclub lounge provides high -quality cocktails and music.A good atmosphere.Nice music.It is famous in Taipei.,False
關於 Kor，我必須說的一件積極的事情是他們演奏美妙的音樂。這就像老式學校和現代即興演奏的混合體。做得太好了！現在說說我給它3分的原因吧！它通常太擁擠了，而且他們對事情可能非常嚴格。就像我們有一個朋友顯然感覺不舒服，需要坐下一會兒，但保全一直讓我們去接她。我知道她坐在如此擁擠的空間裡並不理想，但我們試圖找到其他朋友，這樣我們就可以回家了。這只是一瞬間的事。他本來可以允許的。另一件事是，大約需要 45 分鐘到 1 小時才能喝一杯。除此之外，我不介意 Kor，這是一個看起來很漂亮的酒吧斜槓俱樂部！,"Regarding Kor, a positive thing I have to say is their beautiful music.This is like a mixture of old schools and modern impromptu performances.Do so well!Now talk about the reason why I gave it 3 points!It is usually too crowded, and they may be very strict with things.Just as a friend of us obviously felt uncomfortable, we needed to sit down for a while, but Bao always let us pick her up.I know that she is not ideal to sit in such a crowded space, but we try to find other friends so that we can go home.This is just a moment.He could have allowed.Another thing is that it takes about 45 minutes to 1 hour to drink a drink.In addition, I don't mind KOR, this is a beautiful bar slash club!",False
"與 Omni 俱樂部位於同一棟大樓內，這是台北頂級的社交俱樂部之一。  這個地方擁有奢華的氛圍和無可挑剔的服務。價格範圍取決於您願意花多少錢，因此請對我的價格範圍持保留態度。

這裡的音樂不會太大聲，俱樂部的燈光也不會關閉，以免分散您的訪問目標。這是有原因的，因為這不是俱樂部。  這是一個社交俱樂部。 您來到這個地方是為了建立聯繫、社交、交往、喝一杯並享受美好時光。

這個地方人滿為患，我確實建議花在一張桌子上以獲得最好的體驗。如果你不奇怪的話，你也可以直接去吧台踢球，然後被邀請到其他桌子。

來這裡會見一些台北最優秀的人並被看到。這個地方以桌子等級的形式設置，最高等級的價格最貴。  這個地方是我每次進城時必須停下來的地方，而且我還沒有失望過。人群非常友好，氣氛非常有趣。

如果您有發起人連接來幫助您進行設置，那將是可取的。週末非常熱鬧，桌子很快就賣完了。

我們總是打開瓶子，這是唯一的方法！  等不及我回來了！ 😜","Located in the same building as the Omni Club, this is one of the top social clubs in Taipei.This place has a luxurious atmosphere and impeccable service.The price range depends on how much you are willing to spend, so please keep your price range.

The music here will not be too loud, and the lights of the club will not be turned off, so as not to disperse your access target.This is a reason because this is not a club.This is a social club.You come to this place to establish a good time, social, social, interact, drink a drink and enjoy a good time.

This place is full of people, and I really recommend spending on a table to get the best experience.If you are not surprised, you can go directly to the bar to play and be invited to other tables.

Come here to meet some of the best people in Taipei and be seen.This place is set in the form of a table level, and the highest level is the most expensive.This place is where I have to stop every time I enter the city, and I have not disappointed.The crowd is very friendly and the atmosphere is very interesting.

If you have a promoter connection to help you set it, it will be desirable.The weekend was very lively, and the table was sold soon.

We always open the bottle, this is the only way!Can't wait for me to come back!Bleak",False
很棒的雞尾酒和服務，工作人員非常友好！,"A great cocktail and service, the staff is very friendly!",False
"與朋友或獨自享受的心情都非常好。因為這裡的人有興趣交新朋友！
給顧客的飲料和服務也很棒👍很滿意！
如果再來台北，我一定會來這裡！","The mood with friends or enjoyment alone is very good.Because people here are interested in making new friends!
Drinks and services for customers are also great and very satisfied!
If you come to Taipei again, I will definitely come here!",False
"*韓國仁的ㄱrG Masek yo的車真好！
請檢查其他評論
我在一位當地朋友的推薦下去了這個地方，他說番石榴雞尾酒很美味。甚至在離開這個國家之前我就抱持著很高的期望。然而，這是一連串非常不愉快的經驗。我以為這是高級酒吧，但哈哈哈哈哈哈哈哈哈哈哈哈哈哈哈哈哈哈哈哈哈哈哈哈哈哈哈哈哈哈哈哈哈哈哈哈哈哈哈哈哈哈哈哈哈哈哈哈哈哈哈哈哈哈哈哈哈哈哈哈哈哈哈哈哈哈哈哈哈哈哈哈哈哈哈哈哈哈哈哈哈哈哈哈哈哈哈哈哈哈哈哈哈哈哈哈哈哈哈哈哈哈哈哈哈哈哈哈哈哈哈哈哈哈哈哈哈哈哈哈哈哈哈哈哈除了ㅇiㅂ以外還聽過ヲｦヲｦヲ嗎？一開始我不知道該怎麼辦，就穿了拖鞋，但他們說不能赤腳去。
哎呀，這可能會發生。我想
我很想去這個酒吧，所以第二天我又去了。
入口處有一個漂亮的女孩試圖檢查你的護照。
昨天見到的男員工偷偷過來，小聲說了一些預約的事情，女員工一聽就不好意思了，問我有沒有預約，說沒有預約就不能進去。
我們聽得懂中文，也說中文，所以一開始我們用英文說，後來又用中文說。我姐姐真的很尷尬。
請不要再瞧不起男員工了。

+服裝要求規定不允許穿涼鞋。
前面的模特兒穿著長裙，腳上的涼鞋露出了腳趾^_^","*Korean Ren's g RG Masek YO's car is so nice!
Please check other comments
I recommend this place in a local friend, and he said that guava cocktails are delicious.Even before leaving this country, I held high expectations.However, this is a series of very unpleasant experience.我以为这是高级酒吧，但哈哈哈哈哈哈哈哈哈哈哈哈哈哈哈哈哈哈哈哈哈哈哈哈哈哈哈哈哈哈哈哈哈哈哈哈哈哈哈哈哈哈哈哈哈哈哈哈哈哈哈哈哈哈哈哈哈哈哈哈哈哈哈哈哈哈哈哈哈哈哈哈哈哈哈哈哈哈哈哈哈哈哈哈哈哈哈哈哈哈哈哈哈哈哈哈哈哈哈哈哈哈哈哈哈哈哈哈哈哈哈哈哈哈哈哈哈哈哈哈哈哈哈哈哈除了ㅇiㅂ以外还听过ヲｦヲｦヲ吗？At first I didn't know what to do, they wore slippers, but they said they could not go barefoot.
Oops, this may happen.I think
I really want to go to this bar, so I went the next day.
There is a beautiful girl at the entrance trying to check your passport.
The male employees I saw yesterday sneaked and whispered some appointments. The female employees were embarrassed as soon as they heard it. They asked me if I made an appointment and said that they could not go in without an appointment.
We can understand Chinese and speak Chinese, so at the beginning we said English in English, and then Chinese said in Chinese.My sister is really embarrassing.
Please don't look down on male employees anymore.

+Clothing requirements are not allowed to wear sandals.
The model in front was wearing a long skirt, and the sandals on the feet exposed the toe^_^",False
