Original,EN,Needs Review
整體每杯都好飲，珍奶Cocktail好夾😂唇印💋個杯就難入口少少，呢杯係一入口個衝擊好大，但個味慢慢散開後都好飲,The overall cup is easy to drink.,False
"雖然調酒普通，但環境裝潢音響很優質
平日去沒什麼人，感謝朋友邀約～","Although the bartending is ordinary, the environmental decoration audio is very high quality
No one is going on weekdays, thank you friends for inviting ~",False
"芭樂調酒很好喝，辰辰服務態度很好
如果有機會下次一定還會再來～","Bavail bartending is very delicious, Chenchen's service attitude is very good
If you have a chance, you will come again next time ~",False
調酒好喝價錢實在，整體氛圍很棒，bartender 都超好聊，大推,"The price of bartender is really good, the overall atmosphere is great, Bartender is very good to talk, push",False
KAI跟VICENTE調酒好讚 人超好 超棒 耶！超照顧我們,Kai and ViceNTE bartending are so good!Out of taking care of us,False
芭樂酒沒有想像好喝，芭樂倒是出奇的甜，摩西多也挺普通，野格蹦杯子用的不對，可能沒杯子了，人很多所以氣氛不錯。,"Barrine is not expected to be delicious. Bava is surprisingly sweet. Moses is also quite ordinary. Wild Grid jumps the cup wrong. There may be no cups. There are many people, so the atmosphere is good.",False
"第一次來KOR 有訂位所以坐在吧台的位置
氣氛很熱鬧
餐點和酒也都不錯
是可以在回訪的酒吧👌🏻
比較可惜的是 餐點沒有提供餐具
吃東西要用手拿取
對於手有嚴重潔癖的我 就是用紙巾包著吃
尋問女店員 有沒有叉子
得到的回應是沒有哦～
隔了一段時間之後 男店員走來問可不可以幫忙評論 有送琴通寧1杯
評論當然ok 沒問題
我又在將剛剛問女店員 沒有叉子的事
跟男店員說 男店員給我的感覺是比較積極的 想找有沒有替代的餐具 有問我旁邊的這種小叉子可以嗎(叉水果裝飾在酒杯上的那種）
我回 東西已經吃完了～
再來有一點是 收費方式有點疑惑🤔️
一進來坐下的時候有給一杯水(免費提供的）
直到差不多要離開的時候 有在像店員要了一杯水
店員這時說水要收費喔～
不知道是什麼特地的時段 水從免費提供 變成要收費 感覺很奇妙🙂","The first time I came to Kor, I had a reservation, so I sat in the bar.
The atmosphere is very lively
Both meals and wine are also good
You can visit the bar at the return visit 访
It is a pity that the meal is not provided for tableware
Take your hands with your hands
For those who have severe cleanliness, I just use paper towels to eat
Ask the female clerk if there is a fork
The response is not available ~
After a period of time, the male clerk came to ask if you can help commented that there are 1 cup of Qin Tongning
Comment is of course OK is no problem
I'm about to ask the female clerk again if there is no fork again
Tell me that the male clerk feels like it is more active to find a tableware that is alternative. Do you ask the small fork next to me?
I have eaten it back ~
One more thing is that the charging method is a bit doubtful 🤔️ ️
When you come in and sit down, give a glass of water (provided free of charge)
Until almost when I left, I asked a glass of water like a clerk
At this time, the clerk said that water should be charged ~
I don’t know what special time is water from free provision to charging. It feels wonderful.",False
"氛圍很棒
餐點和調酒也都不賴","The atmosphere is great
Both meals and bartending are not good",False
"台北東區｜ KOR Taipei 雞尾酒酒吧

KOR 位在台北東區 捷運忠孝敦化站 旁邊，緊鄰ZARA 交通便利，

KOR Taipei 於2016年開幕，是當時全亞洲第一間「伸展式概念」的酒吧，以「Dichotomy（二分法）」為基礎概念， 若從酒吧中間拍攝會看到宛如歌劇院的階梯式伸展台（今天在吧檯側面 沒拍到正面全景），DJ 在伸展台頂端為大家調音，KOR 的音樂對我來說非常享受放鬆，不像一般夜店那般吵雜重音，很喜歡這裡的氣氛❤️

進去會經過一段波形長廊 很漂亮，進入酒吧大廳後 整個大廳超美，比之前去過有名的超美高空酒吧Celavi 還要驚艷，蠻驚喜的🥰

調酒也是近期喝到最好喝的，很久沒喝到這麼喜歡的調酒 今天點的是低酒精濃度以烏龍茶為基底的調酒 非常清新淡雅 不會過甜 帶著優雅的茶香，連不愛喝酒的我都難得喜愛😍

其實大部分的夜店都不太喜歡，很吵很亂 所以不太會去第二次，難得KOR 深得我心，大推囉～","Taipei East District ｜ KOR TAIPEI Cocktail Bar

KOR is located next to Zhongxiao Dunhua Station, MRT of Taipei East District, and is close to ZARA traffic.

KOR TAIPEI opened in 2016. It was the first ""extended concept"" bar in Asia at that time. Based on the ""Dichotomy)"", if you shoot from the middle of the bar (I did n’t take a positive panorama on the side of the bar today.) The DJ tunes for everyone at the top of the stretching table. KOR ’s music is very enjoyable for me. Unlike the noise of the average nightclub, I like the atmosphere here ❤️

I will pass through a wave -shaped promenade very beautifully. After entering the bar lobby, the entire hall is super beautiful. It is more amazing than the famous super high -altitude bar Celavi I have visited before.

I am also drinking the best to drink in the near future. I haven't drank so much for a long time. Today, the bartender with oolong tea is very fresh and elegant. I love to drink alcohol, I rarely love 爱

In fact, most of the nightclubs do n’t like it, very noisy and messy, so I do n’t know how to go for the second time.",False
"中秋夜加開前往KOR吧台消費 很熱鬧的一晚

非常感謝那位T的女性吧台

協助我們在吧台剛開完香檳後

沒喝幾杯就發生被不認識客人偷竊香檳的事件

吧台服務員非常有效率幫我們把那位香檳大盜找回來🥲

雖然已經被偷喝完了 也請小偷賠償我們損失

非常感謝店家完善及和善的處理態度","The Mid -Autumn Festival is added to the KOR bar to consume a very lively one night

Thank you very much for the female bar of T

Help us just open the champagne at the bar

If you do n’t drink a few cups, you do n’t know that you do n’t know the guest to steal champagne

The bar station waiter is very efficient to help us find the champagne thief back.

Although I have been stolen, please compensate us for losses

Thank you very much for your improvement and good handling attitude",False
調酒很特別，調酒師會親自介紹調酒的概念，現在氣氛也很好，很好聊天,The bartending is very special. The bartender will introduce the concept of bartender personally. Now the atmosphere is also very good.,False
店員很可愛❣️酒都好好喝😻,The clerk is very cute 都️ The wine is delicious 😻,False
爲了Bruno Mars 買5000票～根本擠不進去！人數根本沒控管！ 是故意騙我們錢嗎？沒良心的店！有夠黑！,"Buy 5,000 votes for Bruno Mars ~ Can't squeeze in at all!The number of people is not controlled at all!Do you mean to lie to our money?There is no conscience shop!It's dark enough!",False
"果然是名店
每次都人山人海排隊
雖然是酒吧 但有夜店的氛圍
首推芭樂跟珍珠奶茶特色調酒
音樂氣氛很讚","It really is a famous shop
Every time there are people, people line up
Although it is a bar, there is an atmosphere of a nightclub
The first bartender of Bale and Pearl Milk Tea
The music atmosphere is great",False
氣氛佳，調酒非常讚！,"The atmosphere is good, the bartender is very good!",False
"辰辰人很耐斯 推薦的酒都很好喝
氣氛很讚沒有怪味道","The wine recommended by Chenchen is very delicious
The atmosphere is great, no strange taste",False
"酒順口好喝
可以客製口味
推推","Wine is delicious
Can customize the taste
Push",False
"氣氛好酒好～～
辰辰很Q","The atmosphere is good ~~
Chenchen is very Q",False
"KOR 是很受歡迎的 Social Bar，
好玩，品質好，男生多女生也多
有時候蠻多老外的，整體素質都相對高
當然消費水平也比較高些
平日 2-4 沒什麼人，都集中在 5 & 6
雖然 21:00 就開門，
但要到 12:00 - 02:00
才會是最高峰最好玩的時候
人才真的多起來

位置就在忠孝敦化 Zara 樓上，
在樓下要先管安檢
出示身分證 & 疫苗證明，
數位 App 或是小黃卡都可以
對面就是 Omni，基本上兩邊可以來來去去

KOR 的調酒精緻，酒單也會定期換，
我大推 Old Fashioned，跟伯爵茶調酒
還有很經典的 Quava 芭樂調酒，
好喝又濃又有水果吃
食物像是炸雞、薯條、漢堡也都很精緻
吧台不用錢，但位子不多比較不好搶
左右兩側和其他裡面的座位都是包廂，
有低消

從 5,000 - 幾萬不等，
個人經驗是通常都會到低消的 2-3 倍左右
15,000 的包廂可能要花到 4-5 萬

服務生 & Bartender 都蠻會 Social，
比較常來的還會招待 Shot
開包廂的服務也很好

是個蠻適合認識人的場合，整體體驗讚","Kor is a very popular Social Bar,
Fun, good quality, more boys and girls
Sometimes there are quite a lot of foreigners, and the overall quality is relatively high
Of course, the consumption level is also higher
There are no one on weekdays, all of which are concentrated in 5 & 6
Although open the door at 21:00,
But to 12:00-02:00
It will be the best time to the highest peak
There are so many talents

The location is on the Zara floor of Zhongxiao Dunhua,
Go downstairs to manage security first
Show the ID card & vaccine certificate,
Digital apps or small yellow cards are fine
The opposite is omni, basically the two sides can come and go

Kor's bartending is exquisite, and the wine list will be changed regularly.
I push Old Fashioned, and mix with Earl tea
There is also a very classic quava guava bartender,
It's delicious and strong and fruit to eat
Food is like fried chicken, fries, and burgers.
The bar doesn’t need money, but the seat is not much better to grab
The seats on the left and right and the other are the boxes,
Downside

No wait from 5,000- million to tens of thousands,
Personal experience is usually about 2-3 times low
The 15,000 box may spend 40,000-50,000

The waiter & Bartnder is quite avcial,
Those who come more often will entertain Shot
The service for opening a box is also very good

It's a places that are pretty suitable for people, and the overall experience likes",False
"酒還不錯
音樂很大聲
沒有很好搭訕人的感覺
適合跟朋友來享受氛圍
但是蠻吵的
不是那種安靜的酒吧
但是也沒人在跳舞🤣","Wine is not bad
Music loud
There is no good feeling of chattering
Suitable for friends to enjoy the atmosphere
But noisy
It's not the kind of quiet bar
But no one is dancing 在",False
"這裡氣氛很好👍🏻 很適合跟朋友來
推薦喜歡品酒的人","The atmosphere here is very good.
Recommend people who like wine tasting",False
第一次來這麼高級的地方，環境舒適，調酒很好喝！,"For the first time, come to such a high -end place, the environment is comfortable, and bartending is delicious!",False
Kai真的太棒了，來玩找他就對了。,"Kai is really great, just come and find him.",False
判斷服裝標準真的很爛 雙標到不行啊  當天就是縮口褲加adidas EQT的鞋子  明明跟朋友穿差不多被刁難 如果是沒包廂不給進就實講,The judgment of the clothing standard is really bad.,False
氛圍很好的酒吧！Vincent人帥氣服務超級好，調酒🍹好喝，餐點也不錯。很好放鬆😎的地方😊😊😊,"Bar with good atmosphere!Vincent is handsome and good -looking, bartending is delicious, and the meal is also good.Very good place to relax 😎",False
"第一次來，滿新鮮的。
點Dream Girl，好喝😋

Bartender 很親切，有推👍","The first time, full of fresh.
Click Dream Girl, delicious

Bartender is very kind, there is a push",False
第一次來，調酒很不錯，詢問的話推薦的酒都蠻合口味的，環境滿美的，來的女生顏值都很高😍,"For the first time, the bartending is very good. The recommended wine recommended by the question is quite good. The environment is full of beauty.",False
"：清爽的 酒感重一點的
來了一杯無敵滿意的甜不膩柑橘感的美酒
Bartender 很優秀",": The refreshing wine feels a bit heavier
Here is a glass of invincible sweet and not greasy citrus wine
Bartender is excellent",False
"平日來人少少的還蠻舒服的
炸雞很多🤩
G&G鳳梨味很重 清爽好喝！ …","There are few people who come on weekdays, it's quite comfortable
A lot of fried chicken
G & G pineapple flavor is very refreshing and delicious!Mowing",False
"入口標示可以清楚一點嗎
櫃檯標誌前面永遠都站著一個人擋住入口標誌
請在改善","Can the entry mark be clear?
There will always be a person standing in front of the counter logo to block the entrance logo
Please improve",False
辰辰好可愛😍快來找他玩,Chenchen is so cute 找 Come to play with him,False
那個留鬍子的bartender好帥喔😍,That Bartender who stayed beard so handsome 😍,False
燈光美，音響效果讚！好吃多變的食物，快樂跳舞放鬆，安全管理認真，業者怎麼用心，加油喔！,"The light is beautiful, the sound effect is praised!Delicious food, happy dancing and loosening, serious safety management, how can the industry be attentive and come on!",False
"夜店式的音樂氣氛很好，bartender人都很好，調酒很好喝，也有純飲可以點。
越晚會越多人，建議想要好好喝酒、想要享受氣氛的人可以早一點來，很讚💛","The nightclub -style music atmosphere is very good. Bartender is very good. The bartending is delicious, and there are pure drinks to order.
The more evening nights, the more people, it is recommended that people who want to drink well and want to enjoy the atmosphere can come earlier.",False
"大約11點先進場後 店內的芭樂調酒很好喝
Bartender 跟內場的人都很nice
結果朋友到了之後被說要訂位才能入場現在不接受散客，但店內這時候超級空。
覺得很疑惑所以下去接他上來，結果門口的店員回覆還是一樣不接受散客（我朋友服裝非常正式得體，可能想不到理由擋一直鬼打牆上面人很多），但期間一直放非常多散客進場。最後又去問一次說剛剛看到你們放很多散客入場，請問你們是有在挑客人嗎？ 結果男店員只用手指一下告示牌，看到一句KOR有權利婉拒客人入場，只能摸摸鼻子，上去把酒喝一喝就馬上離開，體驗超差。
雖然很喜歡芭樂調酒，不過以後還是算了，會跟朋友們說這裡會拿理由亂擋客人，絕不推薦，誰想要一群朋友出來玩結果自己被擋在門外。","At about 11 o'clock, the bartender in the store in the store is very delicious
Bartnder and the people in the field are very nice
As a result, my friend was said to be reservations to enter the venue to enter the venue.
I felt very puzzled, so I went down to pick him up. As a result, the clerk at the door still did not accept the scattered guests (my friend's clothing was very formal and decent, and you may not have thought that there were many people who had been hitting the wall), but during the period field.Finally, I asked again that I just saw that you put a lot of scattered guests to enter the venue. Do you have any guests?As a result, the male clerk only used his fingers to make a notice sign, and saw that Kor had the right to reject the guests to enter the venue. He could only touch his nose. Go up and drink the wine and leave immediately.
Although I like Berli bartender, I still count it in the future. I will tell my friends that they will block the guests here. I will never recommend it. Who wants a group of friends to come out and get out of the door.",False
"門口的女生不知道在跩什麼，態度也太差。
你們店的形象還沒進去就已經破壞殆盡。","The girls at the door didn't know what she was, and her attitude was too bad.
The image of your store has been destroyed before entering.",False
謝謝joy的服務，很貼心還給辣妹的我們毯子，穿短裙的辣妹們不用怕冷，服務生都是帥哥，近視也看得出很帥😍,"Thank you Joy for your service. Our blankets who are very intimately given to the hot girl. The hot girls in short skirts do not have to be afraid of cold. The waiters are handsome guys, and myopia can also see very handsome.",False
氣氛很棒的一家店！而且有賣我最喜歡的cookie Dpt 餅乾🍪超棒！服務很好。,A shop with great atmosphere!And there are my favorite cookie DPT biscuits 🍪 superb!The service was excellent.,False
"調酒師vincent 很會推薦酒
人超好～～來這裡真的很放鬆👍🏻","The bartender Vincent will recommend wine very much
People are so good ~~ It's really relaxed here",False
台北最有設計質感的酒吧和夜店！音樂不會過大聲，燈光也不會過暗看不到人,"The most designed bar and nightclub in Taipei!The music will not be loud, and the light will not be too dark and you can't see anyone",False
"我覺得dress code沒有嚴格落實，
半正式的要求但裡面大多男生只穿了件短T

覺得有些可惜","I think Dress Code has not been implemented strictly,
The semi -formal request, but most boys in it only wear short T

I feel a little sorry",False
"The best bar in Taipei!!
週末夜人爆炸多 (排隊的話要排很久)
之前來都是喝shot喝whiskey 喝一些經典又無聊的東西😂 這次嘗試了朋友推薦的芭樂調酒跟網上介紹的珍奶調酒
芭樂調酒很香，濃濃的芭樂味很喜歡
珍奶調酒的珍珠Q彈程度可能打趴很多外面飲料店，喝的我欲罷不能😝
調酒師好厲害好親切好貼心
朋友說自己剛喝完一攤，調酒師就說那給她來杯不混酒的淡調酒先，喝完再看下一杯要不要調整， 而且有問必答，不會有不耐煩臉👍🏻","The best bar in Taipei !!
Weekend night people exploded a lot (if the queue is queuing for a long time)
I used to drink Shot, who drink Whiskey, drink some classic and boring things.
Bavail bartender is very fragrant, and the thick guava flavor likes it very much
The degree of pearl q bullets of Zhen milk bartender may be played with many beverage shops outside. I can’t stop it if you drink
The bartender is so powerful, kind and intimate
My friend said that he had just finished drinking, and the bartender said that he gave her a cup of lighter wine without wine. After drinking after drinking, do you want to adjust? If you have any questions, you will not be impatient. Bleak",False
Nice 東西也好吃，芭樂調酒很好喝,"Nice is also delicious, and can bartender very delicious",False
酒保、DJ、氛圍都很不錯的一家bar,"A family with good wine insurance, DJ, and atmosphere is very good",False
很棒 調酒厲害,Very great bartending,False
酒非常好喝 氣氛超棒 歌好聽 調酒師友善,"The wine is very delicious, the atmosphere is super song, the bartender is friendly",False
高質感好地方💯👍🏻,High -quality place 地方,False
ACE很親切很讚！我很喜歡芭樂酒XD尤其還有梅粉的味道好台好喜歡😍 …,"Ace is very kind and great!I like Bero wine XD, especially the taste of plum powder is good. I like it ...",False
Vicente yi fan Lin 很棒很親切！👍🏻,Vicente Yi Fan Lin is great and kind!Bleak,False
"燈光美氣氛佳
調酒也很好喝","Beautiful light atmosphere
Alcohol is also very delicious",False
第一次讓學長介紹來感受氛圍，覺得這裡的氣氛很棒、員工以及調酒都表現很優秀～大推!!!!!!,"For the first time, let the senior introduce to feel the atmosphere. I feel that the atmosphere here is great, employees and bartending are excellent ~ Push !!!!!!",False
"店內布置很精美，酒的種類很多很特別，原本點起司口味的沒了，店員推薦一杯伯爵茶（？）的意外地好喝，個人也推薦珍奶的，酒的苦味完全結合於奶茶中，變得像焦糖珍奶！
好的講完了，現在來講貴店的入場審核機制，當天穿著正裝，因搭配的關係穿的是全黑的Keen Uneek（有穿襪子），結果被拒絕進入說我穿得太休閒（？），請我去旁邊zara購買其他鞋子，官網上完全沒提及此事，就算現場有公告，但不是每個人家裡都住旁邊或有閒錢隨便買一雙鞋ㄟ，好，我也認了，畢竟有朋友生日，之後進場後卻發現一堆男生穿著T-shirt、短褲加球鞋，甚麼意思呢...穿得像一個在籃球場打一對一鬥牛的體育生就可以輕易進入，阿特別打扮卻被說得毫無價值，有點失望。","The layout of the store is very exquisite, the types of wine are very special. Originally, the cheese flavor was gone. The clerk recommended a glass of Pear Tea (?) Unexpectedly delicious. I personally recommend treasure milk. The bitterness of the wine is completely combined with milk tea. It becomes like caramel milk!
After talking about it, now I will talk about the entry audit mechanism of your store. Wearing a formal dress that day, because of the matching relationship, I wear all black Keen Uneek (wearing socks). As a result, I was refused to enter and say that I was too casual (? ), Ask me to go to ZARA to buy other shoes. The official website did not mention the matter at all. Even if there was an announcement at the scene, not everyone lived next to it or had a free money to buy a pair of shoes. Well, I recognized it, after all, after all, I recognized it. After all There was a friend's birthday. After entering the field, I found a bunch of boys wearing T-Shirt, shorts and sneakers. What does it mean? It can be easily entered like a sports student who played a pair of bullfighting in the basketball court. The dress was worthless and a little disappointed.",False
"非常舒適的夜店型酒吧，音樂還行，空間視覺感很不錯，包廂也非常舒適。這次點了珍奶調酒、芭樂調酒、檸檬紅茶調酒、炸薯條、炸雞。珍奶調酒內的黑糖粉圓Q彈好吃，奶茶與基酒融合的非常好。芭樂調酒是使用整顆芭樂來當酒杯，酸甜酒感強，喝完可以把整個杯子吃掉非常有趣。此店的炸雞有夠好吃，來店必點。
建議早點到場，過12點後排隊人潮湧現，然後目前疫情關係必須攜帶健保卡和疫苗卡以及打兩劑疫苗。","Very comfortable nightclub -type bar, music is okay, the visual sense of space is very good, and the box is very comfortable.This time I ordered Zhen milk bartending, bartender, lemon black tea, fries, fried chicken.The brown sugar powder in the bartender of Zhen milk is delicious, and the milk tea and the base wine are very good.Bavail bartender uses a whole Bara to be a wine glass. The sweet and sour wine is strong. It is very interesting to eat the entire cup after drinking.The fried chicken in this shop is delicious enough.
It is recommended to come early, and after 12 o'clock, the crowd of people will emerge, and then the epidemic relationship must carry a health insurance card and vaccine card and a two -dose vaccine.",False
"調酒好喝、氣氛佳。
調酒師Vincenté懂推，和顧客互動也很好。","The bartender is delicious and the atmosphere is good.
The bartender Vincenté understands the push and interacts with customers well.",False
氣氛好、調酒好喝，重點調酒師都長的帥(˶‾᷄ ⁻̫ ‾᷅˵),"The atmosphere is good, the bartender is good, the key bartender is handsome (˶‾᷄ ⁻̫ ‾᷅˵)",False
裝潢很讚 調酒有特色,The decoration is very good to bartender and has characteristics,False
"成人珍奶很值得點（當你很想喝手搖又想喝酒的時候），英式下午茶酒也很好喝（適合不愛酒味的人）
Sangria 就普通囉，裝潢氣氛都很不錯！","Adult Zhenmai is worthy of point (when you want to drink hands and want to drink), British afternoon tea wine is also delicious (suitable for people who do not love wine)
Sangria is ordinary, and the decoration atmosphere is very good!",False
"很fancy的地方，裝潢很漂亮，適合跟朋友來聚聚。
唯洋酒單價極高（酒行的四倍以上），坐久了有點稍感無聊不知道要幹嘛","Fancy is very beautiful, suitable for gathering with friends.
Weiyangjiu is extremely high (more than four times the wine), I feel a little boring after sitting for a long time, I don’t know what to do.",False
燈光美氣氛佳，還有一個妹妹頭的服務生很親切，她依照我們的人數推薦我們開酒，一切都很棒,"The lights of the lights are good, and the waiter of a sister's head is very kind. She recommends us to open wine according to the number of us, everything is great",False
