Original,EN,Needs Review
"在被恩熙俊安利後慕名而來
果然超級好喝
而且店家的服務超好

今天總共點了三杯
第一杯是「沒有愛情你還有疫情」
這杯苦甜平衡的非常好
高酒精濃度完全感受不出來
及桔子的味道佔了大概60%
但後面煙燻、木頭的味道獨特又不失美感

第二杯是「難過的時候不留淚 眼淚也不算悲傷」
這杯很順口 但沒什麼獨特的印象
是一杯好喝的酒

第三杯是「茉莉·茉莉」
這杯水準超高
不愧是bartender 推薦出訪必點
很適合當開場的第一杯酒
清爽 香味很精彩 有點像是輕熟女的香水味
推爆！！！！","Come here after being held by Enxijun
Sure enough
And the service of the store is super good

I ordered three cups in total today
The first cup is ""You still have an epidemic without love""
This cup of bitter and sweet balance is very good
The concentration of high wine can not feel completely
The taste of oranges accounts for about 60%
But the taste of smoke and wood in the back is unique without losing beauty

The second cup is ""It's not sad if you don't leave tears when you are sad.""
This cup is very smooth but there is no unique impression
It's a glass of delicious wine

The third cup is ""Jasmine Jasmine""
This cup is super high
It is worthy of Bartender's recommendation to visit
Very suitable for the opening of the first glass of wine
The refreshing fragrance is very exciting and a bit like a perfume flavor of a light mature woman
Explosion!IntersectionIntersectionIntersection",False
"一直客滿的潮店，調酒師與服務人員的態度都不錯
但也就只是裝潢特別的潮店，酒水量給的不多，剛入口覺得好喝，然而喝了幾口後會感覺膩口
攪拌與雪克的動作粗暴不細膩，座位擁擠，對熟客比較友善
歸類上是個適合打卡的潮店","The trendy shop that has been full, the attitude of the bartender and the service staff is good
But it is just a special tide shop. There are not many drinks. I feel delicious when I just take a few mouthfuls. However
Stir with Xueke's movements rude and not delicate, crowded seats, and more friendly to cooked customers
Classified is a tide shop that is suitable for check -in",False
"氣氛不錯
酒有特色
調酒用中國元素取代部分
‘老菸槍與玫瑰’滿有特色
可惜不適合單數人或太多人來！
因為位子有限三人不給坐四人座","The atmosphere is good
Wine is characteristic
Alcohol is replaced with Chinese elements
‘Old smoke gun and rose’ are full of characteristics
Unfortunately, it is not suitable for single or too many people!
Because the three -person three people do not give a four -person seat",False
"一間氛圍很奇妙的酒吧
裝潢走古典風 調酒名稱有創意
調酒下方有註明內容物
滷味很好吃 價格中上
適合下班或週末小酌
靠近臨江街夜市","A bar with a wonderful atmosphere
The name of the classical style bartender is creative
There are indications below the bartender
Loi is very delicious, the price is medium to the top
Suitable for get off work or weekend drink
Near Linjiang Street Night Market",False
"價格比較高 但整體來說是很不錯的消費經驗
酒好喝 酒精很濃 划算
滷味拼盤也沒有失望
週末店裡很擠 我們坐一整排
有點吵 聊天不方便 是比較可惜一點","The price is relatively high but overall is a very good consumption experience
Good wine and alcohol is very cost -effective
There is no disappointment for the four platter
The weekend shop is squeezed in our whole row
It's a pity that it's a bit noisy to chat.",False
相當的有特色，每種調酒感受的出來想表現出的意境，是個週末下班適合小酌一杯的好去處。,It is quite distinctive. The artistic conception of each bartending feeling is a good place to take a drink for a drink on the weekend.,False
調酒厲害好喝，滷味拼盤皮蛋豆腐水餃炸物都好吃，bartender很有趣,"The bartender is great and delicious, and the ruin platter's egg tofu dumplings are delicious, Bartender is very interesting",False
"在這邊交到喝掛就會跳街舞的朋友
跟 夜遊台北的情侶黨

我是沒有進去消費🤣
坐在店門外等人就有很多故事","Friends who will jump on the street when you make a drink here
Follow the couple party of Taipei in the night

I didn't go in to consume 去
There are many stories when sitting outside the store and waiting for people",False
碗公系列調酒超澎湃，讚啦！拿出來超有面子而且超好喝的。,"The bowl of bartender is super surging, praise!Take it out to be super face and good.",False
"很有趣的體驗
如此大一盆的調酒
也不是任何調酒師做得到啊
好玩好醉的一晚
隔天同行的友人
喝完變成急性腸胃炎","Very interesting experience
Such a pot of bartender
It's not that any bartender can do it
Fun and drunk all night
Friends who are traveling the next day
After drinking, it becomes acute gastroenteritis",False
酒單一極棒，今天點了：住東京英國朋友發明的清酒馬丁尼、黑鳳梨、我們都很厭世卻得活下來，每杯都很有特色！是一定會再訪的Bar，服務跟介紹說明都很清楚專業～,"The wine is a great one, and I ordered today: Martini, Black Pineapple, which is invented by friends in British friends in Tokyo, we are all weary but we have to survive. Each cup is very distinctive!The BAR who will definitely visit again, the service and introduction instructions are very clear -professional ~",False
"週五人潮眾多建議訂位 低消每人700
整體裝潢很中國風 不過店內位子不大 桌子都比較靠近 講話聲音也比較大
酒表現6.5/10吧","There are many suggestions on Friday, and there are many suggestions for reservation lows 700 per person
The overall decoration is very Chinese, but the seats in the store are not large and the tables are relatively close to the speech.
Leou performance 6.5/10, right?",False
"我們這桌一共點了8杯調酒
每一杯都不雷
順口又好喝
酒單上的酒都是400元 特調除外
有加一成服務費

用衛生紙當杯墊
質感下滑一點點","Our table ordered a total of 8 glasses of wine
Every cup is not thunderous
Outlet and delicious
The wine on the wine list is 400 yuan, except for special adjustment
Add a 10 % service fee

Use sanitary paper as a coaster
The texture fell a little bit",False
"酒名稱每個都很有特色
每杯酒的味道都很棒
除了使用不同的杯子外
有些酒還會有小甜點🍰
滷味也相當好吃😋
會在關顧的酒吧🍷
非常推薦愛喝酒的朋友👬","The name of the wine is very distinctive
The taste of each glass of wine is great
In addition to using different cups
Some wines will have small desserts 会
Lifi is also quite delicious 相
Will be in the bar that is concerned 的
I really recommend friends who love drinking 酒",False
"很喜歡整間店的氛圍~~
這邊的調酒名字都很有趣也好喝，點的水餃跟滷味都好吃 大推辣椒醬很香
如果酒單上面沒有的可以問問店員是否可以出
裡面座位不多，如果要去 建議提早去候位唷

**menu不定期會換唷","I really like the atmosphere of the whole store ~~
The names of the bartender here are very interesting and delicious.
If you don't have any on the wine list, you can ask the clerk if you can get out
There are not many seats inside.

** Menu will change it from time to time",False
"慕名而來
真的推
不多說自己來試試就對了","Come here
Really push
Not much to say it is right to try it yourself",False
"地點很舒服😌 很古色古香 店員有很幽默😝 重點是！！！！菜單超級有創意！！！
滷味拼盤跟辣椒超級讚👍
最推「熱紅酒」不敢喝酒的我超愛 喝完胃暖暖的好舒服 雖然後來滴在白色褲子上😁😁 …","The location is very comfortable 色 Very antique shop assistants are very humorous. The focus is!IntersectionIntersectionIntersectionThe menu is super creative!IntersectionIntersection
Lochi platter and peppers are super like 👍
The most pushing ""hot red wine"" who dare not drink, I love to drink the warmth of the stomach, although it is later dripping on white pants ...",False
酒很舒服 滷味一絕 非常chill的環境 Bartender 的技藝令人讚嘆不已,The wine is very comfortable.,False
氣氛很好，吧台位子個人很喜歡，冷氣夠冷，酒單也很有特色。,"The atmosphere is very good, the bar is personally liked, the air is cold enough, and the wine list is also very distinctive.",False
"炸排骨很脆，旁邊附的蘿蔔干好吃
我點的酒剛好都偏中藥味","The frying ribs are crispy, and the radish attached next to it is delicious
The wine I ordered is just a Chinese medicine flavor",False
非常有趣的一間酒吧。酒單跟調酒本身內外兼具，可以拍出很適合上傳ig的照片。空間較小，推薦平日晚間來較適合放鬆。,"A very interesting bar.The wine list is both inside and outside, and you can take photos that are suitable for uploading IG.The space is small, and it is more suitable for relaxation when it is recommended to come on weekdays.",False
"路過很多次覺得風格特殊 終於有機會入內
不會品酒 但滷味盤的雞肉份量很夠","I passed many times, I felt that the style was special and finally had a chance to enter
Can't taste wine, but the chickens of the lochi plate are enough",False
調酒好喝～多種選擇。吃的也好吃！調酒師服務態度好。,Blooming is delicious ~ multiple choices.It's so delicious!The bartender service attitude is good.,False
店面有點小，依現場人數安排桌位，服務很好，酒都蠻特別蠻好喝的~趴數也很高,"The store is a bit small, arranging the tables according to the number of people at the scene, the service is very good, the wine is quite good ~ The number of parties is also very high",False
一大缸很好喝，可以多人共享（$5000只能抵最多五人低消）可依照喜好選擇口味甜度跟酒種客製。,"A large cylinder is delicious, and you can share it by more ($ 5000 can only reach up to five people low).",False
"裝潢真的讓人有逃離現實世界的錯覺，調酒更是特別、用心，可以依據客人喜好的口味調整酒譜，非常貼心！
另外推薦滷味拼盤，煙燻雞好吃～","The decoration really makes people have the illusion of escaping the real world, and bartending is special and attentive. You can adjust the winemark according to the taste of the guest's preference. It is very intimate!
In addition, it is recommended to be a loquat platter, the smoky chicken is delicious ~",False
"對於常喝酒的人來說，有點兒淡，但是是好入口那種可以喝很多杯。注意假日低消是700（一杯酒是400），需收服務費。
PS 要檢查疫苗接種紀錄。","For those who drink often, it is a bit faint, but it is a good entrance to drink a lot of cups.Note that the low holiday is 700 (a glass of wine is 400), and the service fee is required.
PS should check the vaccination record.",False
與朋友小酌的行去處 價位也不會太貴 氣氛不錯 把台也滿多位子,The price of a drink with friends will not be too expensive. The atmosphere is good.,False
"蠻有意思的一家店，店內處處可見古色古香的裝飾；同行友人一致最愛的是轉學來的女孩。
值得注意的是這裡的低消大約要點到兩杯酒/人。","A shop that is quite interesting, antique decorations can be seen everywhere in the store; those who are friends with friends are the girl who transferred to school.
It is worth noting that the low consumption here is about two glasses of wine/person.",False
"價格中上，茶酒shot跟食物都不錯。
調酒口味不差，但對我來說有一點太偏妹酒。","In terms of price, tea wine is good and food.
The taste of bartender is not bad, but it is a bit too much for me.",False
"服務超好
餐點有夠讚的，調酒也相當有特色
非常推薦給每一個找酒吧的人","The service is super good
The meal is praised enough, and the bartending is also quite distinctive
I am very recommended to everyone who is looking for a bar",False
"酒好喝 （是哪種順順的 但很有後勁）服務也很好
唯一缺點就是真的場地太小了
開門前就開始排隊 又不能預約
建議先來留電話 再去夜市吃吃東西 也不會覺得等太久
今天喝了 安慰劑-咖啡蘭姆酒+花生
是個大人感的酒 每次喝咖啡酒 都覺得到底是要清醒還是要微醺？
單桶Whisky-蘇軾
用白酒桶陳年過 60%酒精 燒喉卻順口","The service is good (which kind of smooth but very stamina). The service is also very good
The only disadvantage is that the venue is too small
Before opening the door, start in line and cannot make an appointment
It is recommended to leave the phone first and then go to the night market to eat.
I drank the placebo today-coffee Lim wine+peanut
Is it a big wine to drink coffee wine every time you drink coffee wine?
Single bucket whisky-Su Shi
Boil your throat by 60%of alcohol with alcohol with liquor barrels",False
給酒很紮實，調酒有較強的威士忌味，適合成人口感 較強烈，店內沒煙味 這點很好 ，客人很多 見議20-21點來 不然太晚沒位子,"It is very solid to the wine. The bartending has a strong whiskey flavor, which is suitable for a strong sense of population. There is no smoke in the store. It ’s good to discuss a lot of guests at 20-21.",False
"氣氛很好 裝潢古色古香蠻有特色的
整晚下對這杯➡️桂花滴滿手中傘，思怨如煙街頭散 最有印象
覺得很值得下次回訪再點
另外炸物拼盤的雞米花超好吃😋推薦給想吃點東西墊胃的人試試看 …","The atmosphere is very good decorated with antiques and antique.
All night 桂️ 花 花 花 整 整 整 整 整 整 整 整 整 整 整 整 整 整 整 整 整 整 整 整 整 整
I think it's worthwhile to return to the next time
In addition, the chicken rice flower of the fried object is super delicious 😋 Recommended for those who want to eat something to pad the stomach ...",False
推薦來嘗試的地方，沒有疫情時，生意非常好，為了不白跑，建議先打電話確認有沒有位置。,"When you recommend it, when there is no epidemic, the business is very good. In order not to run in vain, it is recommended to call to confirm whether there is a place.",False
"整間店很有特色，每杯名字都很特殊
『為情留下的眼淚不是珍珠是笨的像豬』
我是先被名字吸引看完材料覺得這是一杯我自己會愛的酒又偏酸超棒，那皮蛋豆腐超好吃一口塞進嘴裏會有很多層次在嘴裡呈現。 （2021/03/07）","The whole store is very distinctive, and the name of each cup is very special
""The tears left for love are not pearls or stupid.""
I was attracted to the materials first, and I felt that this was a glass of wine that I would love and was acidic. The preserved egg tofu was super delicious and stuffed into my mouth.(2021/03/07)",False
"調酒不錯
份量大，香味很濃，空氣的綿密感也不錯
鹹豬肉普普，個人認為味道不夠重，但也是好吃的
不過抱歉在來這裡前已經先走訪3間酒吧
吃到後面太撐了沒吃完

氣氛很棒
吧台區隱私性也夠","Blooming is good
The portion is large, the fragrance is very strong, and the density of the air is also good
Salted pork Pop, I personally think that the taste is not heavy enough, but it is also delicious
But sorry to visit 3 bars before you come here
After eating, it's too supported and not finished

The atmosphere is great
The privacy of the bar area is enough",False
整體服務非    常    好 ！雖然沒有提供訂位服務但可以當天撥打電話去候位，週六去的時候人非常多但店員沒有不耐煩或是忽略等待位置的客人，會一直出來詢問需不需要什麼服務，調酒也很好喝，Bartender 也會適時的詢問調酒還可以嗎，不會感覺被打擾外又覺得超貼心，總之推就對了！,"The overall service is not very good!Although no booking service is provided, you can call on the same day. When there are many people on Saturday, there are many people who are impatient or ignore the waiting location. It ’s delicious, Bartender will also ask for bartending in a timely manner? Do n’t feel that you feel super intimate, in short, you just push it!",False
"點了好大一碗五個人喝大家都微醺了
四千塊不便宜
滷味水餃一般般
店裡很古色古香
一下子座無虛席","Ordered a big bowl of five people to drink, everyone is slightly stunned
Four thousand yuan is not cheap
Lochi dumplings are generally like
The shop is very antique
Suddenly seat",False
酒好喝 服務也好 冷盤炸盤也好吃。只是貴了點 酒都要400 星期六低消一人700,"Wine good service is also good for cold disks.It's just a little more expensive, it takes 400 Saturday to disappear 700",False
不太懂為何評價那麼高。第一次來，很幸運有位置不用排隊。酒單很新看得出今年剛換很多款調酒；結果跟朋友點到的都很難喝。一杯像藥水還不是感冒糖漿那樣甜甜的，而且兩杯都沒什麼酒味。拿紙巾當杯墊整個low掉。週五、六的低消要700，其他時候400。,"I don't know why the evaluation is so high.For the first time, I was fortunate to have a place without lining up.The wine list is very new to see that this year just changed a lot of bartender; as a result, it was difficult to drink with friends.A cup of potion is not as sweet as a cold syrup, and there is no wine taste in both cups.Take a tissue as a coaster and drop the entire LOW.The low and Saturday's low consumption is 700, other times 400.",False
"客棧酒樓的裝潢風格，10坪不到的空間，使用中式的雕花木椅，加上吧台大概可以容納20-25人左右。如果打算週五晚上或週末拜訪，務必要做好客滿的心理準備(其實也不用心理準備，95%機率會沒位置)，即便電話接不完、現場客人川流不息，服務人員每次的應對態度都和善至極(這點就值得先給個google 4顆星)，建議可以留下電話，到對街的臨江街夜市逛逛，準備狂喝的可以先吃點東西墊墊胃。﻿
﻿
安慰劑的調酒名稱都又長又有趣，第一次去的女生朋友我都會推薦「好一朵美麗的茉莉花」經典口味，酒單怎麼換都歷久不衰。基本上每一款調酒送上桌都是裝飾典雅，調配的讓你喝得開心。﻿(除了調酒，威士忌跟啤酒愛好者也能在這找到愛)
另外，不能不提的還有食物，不論是滷味還是乾麵，絕對不是外面吃得到的口味，如果肚子有空間，不妨嚐看看。﻿
﻿
最後講到營業時間，熱愛酒精的人一定懂還沒喝過癮，或是還沒進入乙醇在體內揮發的境界就要結束是多麼讓人生氣。安慰劑營業時間到03:00，google評分5顆星已按！","The decoration style of the Inn Restaurant, less than 10 pings, using Chinese carved wooden chairs, plus the bar can accommodate about 20-25 people.If you plan to visit on Friday night or weekend, you must make full psychological preparations (in fact, you do n’t have to prepare psychological preparation, the 95%chance will have no place). He is good (this is worth a Google 4 star). It is recommended that you can leave the phone and go to the Linjiang Street Night Market on the street. If you are ready to drink, you can eat something.﻿
﻿
The names of the sibling of placebo are long and interesting. For the first time, the girl friends will recommend the classic flavor of ""a beautiful jasmine"".Basically, each sake is made to the table with elegant decoration, and the deployment will make you drink happily.(In addition to bartending, whiskey and beer lovers can also find love here)
In addition, there must be food that must be mentioned. Whether it is loquat or dry noodles, it is definitely not a taste that can be eaten outside. If you have space in your belly, you might as well look at it.﻿
﻿
In the end, when it comes to business hours, people who love alcohol must understand how angry it is to end without entering the state of volatilization in the body before entering the body.The opening time of the placebo is 03: 00, the Google score 5 stars have been pressed!",False
酒很好喝，餐點也很讚，很舒適的環境！,"The wine is delicious, the meal is also very good, and the comfortable environment!",False
"東方風格裝潢～
環境很放鬆
調酒很厲害👍
東西也很好吃❤️❤️ …","Oriental style decoration ~
The environment is relaxed
Blooming is very powerful
Things are also delicious ❤️❤️ ...",False
"刻意刁難分開結帳，態度囂張，要求只能付現。
絕對不想再訪。","Deliberately making it difficult to separate the checkout, the attitude is arrogant, and it is required to only be paid.
Never want to visit again.",False
熱紅酒真的滿好喝的，然後酒單名稱很療癒還隨時都會更新酒單,"The hot red wine is really delicious, and the name of the wine list is very healed and the wine list will be updated at any time.",False
用心做調酒的好店家，裝潢也跟餐酒都搭配的很好，可惜店內空間小位置偏少。,"Good shops for bartending with your heart, the decoration is also well matched with meals, but unfortunately, there are fewer space in the store.",False
"特色性十足的店，位子不多
每一杯都具備自己的想法跟杯子

第一次可以喝看看安慰劑
偏甜","There are not many seats with full characteristics
Every cup has its own ideas and cups

For the first time, you can drink and see the placebo
Sweet",False
餐點蠻好吃的，酒類選擇多樣，命名也非常有意思，如果有特別想喝的口味（偏甜、了解基酒）可以再請人員特別介紹，飲酒氣氛好、店內有復古的設計風格，我們當天在裡面替同事慶生，也蠻愉快的！附近也有夜市～可以逛逛,"The meal is pretty delicious, the wine choices are diverse, and the naming is also very interesting. If you have a special taste (sweet, understand the base wine), you can ask the personnel to introduce it. The atmosphere of drinking is good. We celebrated our colleagues on the same day, and we were quite happy!There are also night markets nearby ~ you can stroll around",False
"酒單的選擇很多，酒名很有創意～
但有幾杯沒有合我胃口，所以小扣一顆星
醉雞好吃😋
被招待shot，店員人真好❤️ …","There are a lot of wine lists, and the name of the wine is very creative ~
But there are a few cups without my stomach, so a small buckle star
Drunk chicken is delicious 吃
It was entertained shot, the clerk is so good ❤️ ...",False
"氣氛很好，酒不錯，吃的也不錯。
價格中高。","The atmosphere is very good, the wine is good, and it is good to eat.
The price is high.",False
"假日低消要點到2杯酒（400元/杯），酒喝起來普通，但服務態度非常不好👎
剛入店只告知低消，並未告知「有限時」，菜單也未標明，但後來一直趕人，只是有朋友有事先離開，三人從四人桌變成兩人桌到請我們先結單，本來是想說給店家方便，結果最後竟然說請我們跟外面候位的客人換位子🤷🏻‍♀️
就不說請店員來介紹酒單，只是問有沒有茶酒，竟然回說上面都有寫啊，本來與朋友相聚的好心情也被打壞了，真的是非常不舒服的一次體驗😡","The main points of holidays to 2 glasses of wine (400 yuan/cup), the wine is ordinary, but the service attitude is very difficult 👎
I just told the low -consumption when I entered the store, and did not tell the ""limited time"", and the menu was not marked, but then I have been rushing to people, but some friends have left beforehand. The three have changed from four -person tables to two tables to ask us to settle first. Single, I originally wanted to say that it was convenient for the store, but in the end, I said that we asked us to change the position with the guests waiting outside 🤷🏻‍♀️
I do n’t say that I would like to ask the clerk to introduce the wine list, but just asked if there was a tea and wine, but I said that there were all writing on it. The good mood of meeting with friends was also destroyed. It was really a very uncomfortable experience.",False
"裝潢風格中國風連餐具都很徹底，非常喜歡
酒單介紹詳細 個人推薦黑鳳梨&熱紅酒，餐點也好吃推羊肉湯麵
不能訂位、假日低消$700/人
唯獨廁所部分有點雜亂，可能同時是倉庫的關係（？！）哈哈","The decoration style of Chinese wind Lianlian tableware is very thorough, I like it very much
Introduction to wine list Details Recommended black pineapple & hot red wine, and the meal is also delicious to push mutton soup noodles
Can't book a place, low holidays to disappear $ 700/person
Only the toilet part is a bit messy, maybe the relationship between the warehouse (?!) Haha",False
"需要被安慰
翩翩君子身上的氣味
京都純情心酸羅曼史
但有繁鬚開浪漫，曾無輕片見摧殘。","Need to be comforted
The smell of the gentle gentleman
Kyoto's innocence romance history
However, there are fascinating romances, and there are no light movies to see.",False
