Original,EN,Needs Review
第一次被約來這。 調酒的取名很有意思。 週末夜晚客滿。 建議大家要去的話可以早點去。,The first time came here.The name of bartending is very interesting.The weekend night is full.It is recommended that you go early.,False
"✅服務費

🔸DSN'T BEING WEAK $400
🔸SUMNER BREEZE $400
🔸SNOM WHITE $400
🔸水餃 $200

菜單上的名字都很有趣🤣
有點水餃的一定要記得加辣椒！！
酒隨便點都很讚，位置不多氣氛很好❤️

20210314","✅ service fee

Edsn't Being Weak $ 400
ReSumner Breeze $ 400
TSnom White $ 400
🔸 Dumpling $ 200

The names on the menu are very interesting 菜
Those who are a little dumpling must remember to add peppers!Intersection
The wine is very good, the position is not much atmospheric ❤️

20210314",False
漂亮的擺設，很有中國風味，連酒吧都有台灣特色調酒，真的很棒！,Beautiful furnishings are very Chinese. Even the bar has a special bartender in Taiwan. It is really great!,False
"氣氛很讚很酷的酒吧
有低消 一人700 所以另外點了滷味
發現滷味也好吃","The atmosphere is very cool and cool bar
There is a low elimination of one person 700, so I ordered the lofli
It is delicious if you find that you are also delicious",False
"氣氛很好
中國風 臉上才的方式也很棒
居然還有滷味 水餃也是好吃😋","The atmosphere is very good
The way of Chinese style face is also great
There are actually lovry dumplings are also delicious",False
每個調酒都超好喝，遠超我的預期，超讚的。調酒前兩頁是酒感沒那麼重的，大推“朝著妳的方向走來”,"Each bartending is super delicious, far exceeding my expectations, superb.Before the bartender, the two pages are not so heavy, and push ""coming in your direction""",False
"每一杯都不雷 順口又好喝，尤其喜歡一大碗客製化巨型潘趣酒碗，適合多人一起分享。

安慰劑酒吧很小，沒有預訂，有沒有位置要碰碰運氣了。","Each cup is not thunderous and delicious. I especially like a large bowl of giant Panquan wine bowls, which are suitable for sharing with many people.

The placement bar is very small, no booking, is there any place to touch luck.",False
"酒好喝 名字特別 很難選 炸物也蠻不錯的
酒幾乎不雷 👍","It's very difficult to choose a good name for wine, it's pretty good
Alcohol is almost not thunderous 不",False
"調酒非常有水準
喝的出來有層次
有機會很想把這邊酒單喝一遍
當然跟對的人喝很重要
謝謝EN和其他調酒師","Blooming is very standard
Drink out of the level
I have a chance to drink the wine list here
Of course drinking with the right person is important
Thank you en and other bartender",False
酒、食物、氛圍一切都好棒，因為選擇障礙太嚴重，有請調酒師自行發揮創意，也是非常成功！滷味、水餃（敢吃辣一定要加辣椒）也是必點🌶️,"Everything is great in wine, food, and atmosphere, because the choice of obstacles is too serious. If you have any creative ideas, it is also very successful!Loi, dumplings (you must add chili with spicy spicy), it is also necessary to order 🌶️",False
通化街外圍，店面不大，一進去一眼掃過就是全店面範圍，有低消一人700。調酒沒酒味，根本像喝果汁，一杯400非常沒有喝調酒的價值感。八點半進來跟友人各自續點了兩杯調酒，不到11：00，bartender就直接問還要點酒嗎，我們搖頭，這位先生竟然直接說那可以請你們去買單嗎。當下有點傻眼，因為第二杯都還沒喝完！這裡有低消就算了，明明不限時被催趕買單，酒真的跟其他大安區酒吧比起來也很普普，到訪經驗很差，不知道知名度這麼高是怎麼評價的？,"There is a small store on the periphery of Tonghua Street. As soon as you go in and sweep, the entire store is scheduled.There is no smell of alcohol, it is like drinking fruit juice. A cup of 400 is very worthwhile.I came in at 8:00 and continued two cups of bartending with my friends. Within less than 11:00, Bartender directly asked if we ordered a little alcohol. We shook our heads. The gentleman said that you can ask you to pay.It's a bit dumb now, because the second cup hasn't finished drinking!There is a low disappearance here. It is obviously urged to pay for it when it is unlimited. The wine is really very popular compared with other Barbus of Da'an District. The visitor has a poor experience. I do n’t know how the popularity is so high?",False
"外觀好低調，以為是一般民宅，不會發現是餐酒館，別有創意，帶點中國古典味道，位子因為不多，一開店就會客滿，錯過八點左右的入場，就得等到快十點才有位置，沒有預約，必須要現場排哦。昏紅的燈光，微醺的夜晚，適合下班來小酌。有低消，是家不便宜的餐酒館🤣不過食物調酒還不錯。
--
酒單選擇很多，也有下酒菜，調酒一杯400元，選擇障礙或對酒不太清楚的都可以請店員推薦，整體喝下來都覺得不錯哦，還有用超大碗公裝的調酒，當然不便宜就是🤣","The appearance is very low -key. I think it is a general house. I will not find that it is a dining tavern. Do n’t have creativity. Because of the Chinese classical flavor, because the seat is not much, it will be full when you open the store. If you miss it around eight o'clock There is only a place at ten o'clock. There is no appointment. You must arrange it on the spot.The light red light, a slightly sloppy night, is suitable for drinking to drink.There is a low consumption. It is a dining restaurant that is not cheap.
-
There are a lot of wine lists, and there are also wine and vegetables. A cup of bartending is 400 yuan. Those who choose obstacles or are not clear about wine can ask the clerk to recommend it. The overall drinking is good. Qi is 🤣 🤣",False
"店內氣氛舒適，bartender細心講解，沒有服務費而且酒真的不錯，以下為印象較深刻的酒款附在照片說明。
覺得這間店的幾款調酒厲害在能找到與基酒特色相符的果汁或糖漿等等，把該基酒的特色變得更能讓所有人接受","The atmosphere in the store is comfortable, Bartender explained carefully, there is no service fee and the wine is really good. The following is a deeper wine attached to the photo description.
I feel that several sake in this store can find fruit juice or syrup that is consistent with the characteristics of the base wine, etc., and make the characteristics of the base wine more acceptable to everyone.",False
"安慰劑酒吧 地點非常的棒
從通化夜市吃飽就可以來喝酒小酌
店內偏亮，屬於中式風格
這一盆調酒真的很好喝 $4000
基本上典一個基底酒 再選一個口味 他們就會幫你調出來
四個人平分，一個人大約可以喝到4-5杯
因為假日有低消所以四個人點這個非常大過癮 推薦👍","The place where the place is great is great
You can drink a drink from Tonghua Night Market
The store is bright, belongs to Chinese style
This pot of bartender is really delicious $ 4000
Basically, if you choose a flavor of a base wine, they will help you out
Four people are divided, one person can drink about 4-5 cups
Because there is a low disappearance of holidays, four people order this very enjoyable. Recommended 👍",False
"好像不定期會換酒單，每次去都有驚喜🥳

如果有喜歡的酒但酒單上剛好沒有，可以請調酒師特調，特調的部分也是有貼心又滿滿的驚喜。

特調會先問我是否可接受肉桂味或咖啡，都有先詢問。簡直避雷守門員。

安慰劑94好讚(˶‾᷄ ⁻̫ ‾᷅˵)","It seems that I will change the liquor from time to time, and I have surprises every time I go.

If you have a favorite wine, but there is just no wine list, you can ask the winemaker specially. The special part is also intimate and full of surprises.

I will ask me if I can accept cinnamon or coffee first.It's almost a thunderbolt.

Placement 94 Praise (⁻̫ ⁻̫ ‾᷅˵ ‾᷅˵)",False
"多次回訪
中式風格裝潢 用的酒具也很氛圍
調酒酒單一年約換1～2次
調酒都很有創意 名稱跟內容都很有趣

可以跟bartender討論喜歡得味道請他們推薦
甚至可以出不同的特調
這次有嘗試茶的shot 喜歡茶的調酒的人一定要試試看","Visited multiple times
The wine for Chinese style decoration is also very atmospheric
Slip -regulating wine for a single year for about 1 to 2 times a year
Blooming is very creative name and content very interesting

You can discuss with Bartender for your favorite taste, please recommend them
You can even produce different special adjustments
People who like tea who like to try tea this time must try it",False
"初來乍到以為是麻辣鍋店來著
高朋滿座人山人海的氛圍真的是很熱鬧的酒吧
調酒均一價 $400 （低消700元/人）
分別喝了
1.「但有繁鬚開爛漫 曾無輕片見摧殘」
這杯超適合女生和起手杯😂極度清爽很香的西洋梨口感🍐
2.「在愛情世界裡 能否ㄧ起吃早餐端看緣分」上面有（小西點）當配料，但我忘了口感
3.「世界的盡頭」酒感很重，也是有附ㄧ碟小菜😂喝完讓我的胃經過4小時消化後大反胃，真的以為我到了的世界盡頭🥴
4.「泰國情哥」喜歡泰式風情榴槤味的必須點！朋友很怕，但我覺得超好喝！有濃厚的榴槤香和椰奶！
此外，好友點了符合他自己的「愛的嘆息」ㄧ杯深不見底的紅酒調酒🤣「黑鳳梨」就像爺爺泡的茶深不可測，最後來個最符合他本質的「粗硬大黑龍240釐米砲」🤣🤣🤣🤣🤣這杯調酒真的又粗又直😂😂😂高粱琴酒混搭直搗黃龍境界😏

沒有訂位，但很幸運有table坐不用坐在桌面很高的吧檯🤣服務很親切友善！很可以再去喲！","When I first arrived, I thought it was a spicy pot restaurant
The atmosphere of Gao Peng is full of people and the sea is really a very lively bar
The average price of bartending is $ 400 (low 700 yuan/person)
Drink separately
1. ""But there are no light films to see the destruction""
This cup is suitable for girls and starting cups.
2. ""Can I get a breakfast in the love world and look at the fate"" (Xiaoxi Point) as the ingredient, but I forgot the taste
3. The ""end of the world"" is very heavy, and there is a dish that has attached a plate of dishes. After drinking it, my stomach is disgusted after 4 hours of digestion.
4. ""Thai Love Brother"" likes the Thai style durian flavor!Friends are scared, but I think it's super delicious!There are strong durian fragrance and coconut milk!
In addition, my friend ordered his own ""love sigh"" cup of red wine bartender. ""Black pineapple"" is like the tea made of grandpa. Big Black Dragon 240 cm cannon ""🤣🤣🤣🤣🤣 This cup of bartending is really thick and straight 😂😂😂 😂😂😂 😂😂😂 😂😂😂 琴 琴 qin wine mixes the yellow dragon realm 😏

There is no reservation, but fortunately, there are TABLE sitting without sitting on the desktop bar.You can go again!",False
"好美中式的酒吧
座位很少的，水餃跟滷味都好吃
辣椒也不錯","Good Chinese -style bar
There are very few seats, dumplings are delicious
Chili is also good",False
裝潢風格中式茶樓，店內佈置&酒單都有濃厚的中國歷史感，酒👍🏻👍🏻👍🏻有特色、風格多樣，因為太知名而不好排到座位..服務算親切與積極，調酒師反應快能即時注意顧客狀態給予服務，對於品項的介紹&特色也很詳細，當日的「別為過去的悲傷留下新的眼淚」、「魅惑天空」和一杯海洋風味的Gin調酒(？) 相當滿意與推薦～ …,"In the decoration style Chinese -style tea house, the shop's layout & wine list has a strong sense of Chinese history. The wine is characteristic and diverse in style, because it is too well -known but not good to arrange the seats .. The service is cordial and positive, and bartender. The teacher's response can quickly pay attention to the service of the customer in the state of the customer. The introduction of the item & characteristics is also very detailed. )) Quite satisfaction and recommendation ~ ...",False
"每杯調酒的名稱都別具巧思，
讓閱讀酒單變成一件驚喜的事。

或許是別緻的名稱讓人抱有太多期待，
看到喝到調酒本人後有著些許失望。

不過音樂與氣氛非常不錯。","The name of each cup of bartender is unique,
Let the reading wine list become a surprise.

Perhaps the unique name makes people look forward to it.
I was a little disappointed after seeing drinking until I was sober.

But music and atmosphere are very good.",False
"調酒都好好喝還能依個人喜好調整
是目前最喜歡的bar之一
但是完全不能訂位有點麻煩","Alcohol is good and can be adjusted according to personal preferences
Is one of the favorite BARs currently
But it is a bit troublesome to make a place",False
"上次不經意經過 進去喝看看
結果都不錯喝 店員也很會介紹
酒名都取的蠻厲害的
第二次特意去 還好禮拜天有位置
跟上次酒單不一樣 還不錯都有更新
讓人有新鮮感 可以又喝不一樣的
這次喝也好喝 店員真的很會推薦
下次還會再來喝","Last time I went through inadvertently
As a result, the clerk will also introduce it very well
The wine names are very powerful
The second time I went to have a place for a good day.
Different from the last time the wine list is not bad, there are updates
It makes people feel fresh and can drink differently
It ’s really recommended to drink it if you drink it this time.
I will drink again next time",False
"可愛的店，感恩的心❤︎
沒有可怕的酒味，每一款都舒服順口多層次
即便是亂許願的客製款也都超級喜歡喔💕 …","Cute shop, grateful heart ❤ 可
There is no terrible wine, each one is comfortable and smooth
Even the customer -based customs models are very much like ...",False
"假日低消700有點貴，另收10%服務費，共770。酒很濃，口味中上，聊天氣氛好，但這樣的酒吧台北很多間，喜歡中式調酒氣氛可去西門HANKO60(低消才500服務又好，也沒有那麼想賺錢，個人覺得他的酒比較好喝一點)。

來這消費的整體心得是：感覺店家很想賺錢。服務的感受就是來收錢討錢；介紹酒的時候不太理人，服務的程度大概像在30元切仔麵店一樣，客人趕快點我趕快送餐收餐送客。但算錢算低消的時候態度超積極，管你有沒有把低消金額都點成酒，管你酒有沒有都送出去，你人頭來幾個店家只要拿到錢就不管了，其他一概不回答。","Holidays are a bit expensive, with another 10%service fee, a total of 770.The wine is very strong, and the taste is good, and the atmosphere of the chat is good, but there are many such bars in Taipei. If you like the atmosphere of Chinese bartender, you can go to Ximen Hanko60 (low -consumption 500 service is good, and you do n’t want to make money. I personally think that his wine is compared A little bit).

The overall experience of coming here is: I feel like the store wants to make money.The feeling of service is to collect money and ask for money; when introducing wine, the service is not very ignorant. The degree of service is probably like cutting noodle shops at 30 yuan. The guests quickly order me to deliver meals and meals.However, when the money is low, the attitude is super positive. Regardless of whether you have ordered the low -consumption amount into wine, no matter if you have any wine, you can just get a few shops. Don't answer.",False
"調酒很好喝，超好喝，風味很明顯，搭配很特別很有趣。
特調部分朋友也都很滿意。
餐點選擇比較少，滷味冷盤很好吃～","The bartender is delicious, delicious, the flavor is obvious, and the matching is particularly interesting.
Some friends of special adjustments are also very satisfied.
There are relatively few meals, and the cold disk is delicious ~",False
我覺得好不好喝看個人口味但服務態度不好就沒救了，創意調酒尚可有些難喝有些還行，經典調酒非常非常難喝，亂調一通手法粗魯聽說調酒師很有名我也是醉了。食物好吃價格稍高兩片排骨就要300元。整體感覺價格偏高水準卻對不上的難喝網美店！,"I think it ’s good or delicious, but I’ m not saved if the service attitude is not good. Creative bartending can be a bit difficult to drink. Classic bartending is very very difficult to drink. I am drunk too.The food is delicious and the price is slightly higher. Two pork ribs cost 300 yuan.Overall feels that the price is high, but it is not difficult to drink online beautiful shops!",False
一個怎麼樣累都能夠在這裡待上一會兒的好地方，喜歡什麼樣的酒，都能跟Bartender 溝通一下就能得到屬於自己的一杯酒，當然菜單上的每一杯都非常想點過一輪就是。佐酒小食也很棒，建議先點一盤水餃之後再開始喝吧！,"A good place to stay here for a while, what kind of wine you like, can communicate with Bartender to get a glass of wine that belongs to it. Of course EssenceZuojiu snacks are also great. It is recommended to order a plate of dumplings first and then start drinking!",False
餐廳的氣氛不錯，下酒菜很不錯，調酒方面也很好喝。 很適合和朋友聊天的地方。👍,"The atmosphere of the restaurant is good, the dishes are very good, and the bartending is also delicious.It is very suitable for chatting with friends.Bleak",False
"離臨江街觀光夜市很近 大約在尾端離光復南路較近
裝潢的很有中國風特色 菜單蠻有趣的
各有幽默風趣寫實的梗在裡頭
看的出店家當初設計的用心
環境不大 無法預約 人數較多臨時來會比較麻煩
另外廁所也不髒但也沒有特別香（這很重要）
————————
我喜歡今天向他們指定「蛋白」入酒的這杯
很有層次感 發揮的挺好的👌喝起來也很順口
外觀也不會太樸實 畢竟女生還是喜歡fancy的調酒
縱觀其它喝的七杯調酒最喜歡之一
會想再訪 坐在bar檯 這裡是個輕鬆舒服的地方
————————
二訪 覺得今日調酒酒感偏低 尤其是綠色那杯⋯
帶友人來 她覺得失望🤨","It is close to the end of Linjiang Street Tourism Night Market about the end of the rejuvenation.
The decoration is very interesting Chinese style menu pretty interesting
Each humorous and realistic stalk is inside
The intention of the shop that was designed at the beginning
The environment is not large, and the number of reservations can be more troublesome. It will be more troublesome
In addition, the toilet is not dirty but not particularly fragrant (this is important)
—————————————
I like this cup of ""protein"" to wine to them today
I have a very layered sense of play, very good, and it is very smooth.
The appearance will not be too simple. After all, girls still like Fancy's bartending
Throughout the other seven cups of sake, one of the most favorite
I want to visit again at BAR Table. This is a relaxed and comfortable place
—————————————
The second visit feels that today's alcoholic wine feels low, especially the green cup ...
She feels disappointed with a friend 来",False
去了兩次，因為才兩三個朋友點不了大碗公好可惜，上面有蘋果乾的那杯最好喝😍，送的三杯小杯的也很讚，鹹豬肉讚但真的要一上菜就趕快吃不然後面有點油，炸物還好普普 …,"I went twice, because it was a pity that only two or three friends couldn't order the big bowl. It is a pity that the cup of apple dried on it was the best to drink. After serving, you can eat a little bit after eating, and the fried object is good for Pupu ...",False
偏中國風的Bar，必須現場侯位，但餐點很不錯吃，酒更是五花八門，酒感重的酒真的不輕，要微醺太容易，一不小心就過醺了。,"BAR, who is partially Chinese, must be on the spot, but the meal is very good, the wine is diverse. The wine with heavy wine is really not light. It is too easy to be slightly stubborn.",False
"調酒🍸超好喝
食物也很好吃
氛圍很好，很適合放鬆😎","Bartending 🍸 is super delicious
The food is also delicious
The atmosphere is very good, it is very suitable for relaxation 😎",False
很棒，食物好吃，調酒就是認真看酒單介紹應該就可以挑到自己喜歡的，好喝！,"Great, the food is delicious. Introduction to see the wine list should be picked to what I like, delicious!",False
多年後再次來安慰劑，滷味拼盤依舊很強，調酒也都各具風味，儼然是個值得再來的bar.,"After many years, I came to placeot again. The loquat platter is still very strong, and the bartending has its own flavors. It seems to be a BAR.",False
做為一家在台北市市中心的商店，有刷卡機，但小額不能刷卡，小額是多少也沒有定義，也沒有清楚的標示告知消費者，請大家注意，兩三千才能刷卡！,"As a store in the center of Taipei City, there are swiping machines, but small amounts cannot be swiped. There is no definition of a small amount. There is no clear marker to inform consumers. Please note that you can swipe the card in two or three thousand!",False
"酒還蠻好喝的
還有滷味拼盤很特別
炸物拼盤倒是普普
但價位偏高 且不能刷卡、行動支付
要來小酌記得先領錢","The wine is pretty delicious
There is also a special
The frying platter is Popp
But the price is high and can not swipe cards, mobile payment
Remember to receive money first",False
"酒品名稱很長，光看menu就可以看很久
滿有趣，至於我點了什麼已經記不太得了，照片那杯好像是什麼你的蜜桃臀之類的","The name of the wine is very long, you can watch menu for a long time
Full of fun, as for what I ordered, I don’t remember it. What does the photo of the photo seem to be your peach hips?",False
"服務好，調酒不錯
當天去的時候上錯了一杯酒，反映了之後直接補一杯給我們，很夠意思
那個麵很好吃，辣醬很辣小心不要加太多","Good service, good bartending
I went wrong when I went that day, which reflected it to make up a glass after it was reflected. It was enough.
That noodles are delicious, hot sauce is very spicy and careful, don't add too much too much",False
人超多的！！必需七點多就先來排隊！店內氣氛好中國風，調酒蠻好喝的，喜歡「翩翩君子身上的氣味」、茉莉花也很不錯。,"There are so many people!IntersectionCome in line first!The atmosphere in the store is good in Chinese, and the bartending is pretty delicious. I like ""the smell of the gentleman"" and jasmine.",False
酒單的取名跟酒譜都很有創意🤩🤩 魅惑天空讓人很驚艷，下酒菜的部分吃了滷味拼盤，水餃，炸物拼盤跟魚柳條，表現都很不錯🤭🤭 …,"The names of the wine list are very creative. The charm of the sky is amazing. The part of the jams ate Jiewei platter, dumplings, fried platter and fish wicker.",False
"推薦水餃必點
滷味也不錯吃但豆干有點鹹
調酒品項很多而且不錯喝
店內裝潢和餐具搭配的很有味道
小缺點是店內真的稍嫌擁擠","Recommended dumplings must order
Loi is also good to eat, but dried tofu is a bit salty
There are a lot of bartending items and good drinking
The interior decoration and tableware are very delicious
The small disadvantage is that the store is really a little crowded",False
"裝潢屬於中國風、很有特色，但店內氛圍比較嘈雜一點，桌與桌離得很近，所以聊天起來比較吃力。

店員服務普普通通，調酒算還可以，酒單有創意。","The decoration belongs to the Chinese style and is very distinctive, but the atmosphere in the store is a bit noisy, and the table is close to the table, so the chat is more difficult.

The clerk service is ordinary, and the bartending is okay. The wine list is creative.",False
很有趣的酒吧，酒單上的酒名都很有故事感，配方也很有性格，當晚嚐了6杯，味道也都很不錯，請調酒師推薦也能推薦到合適的口味，是會讓人想再去的地方,"Very interesting bar, the wine name on the wine list is very storytelling, and the formula is also very personal. I tasted 6 cups that night, and the taste was very good. Please recommend it to the appropriate taste. Where people want to go again",False
