Original,EN,Needs Review,Positive,Negative,Neutral,Compound
本以為在西門町邊陲會比較少人，沒想到客人超多，還有人打赤膊，太嗨了吧。啤酒的選擇很多，可請店員推薦。店裡沒有收服務費，但服務比要收的還好。餐點選擇有英式和台式可選，都可以試試看，各有巧妙,"I thought that there would be fewer people in the side of Ximending. I didn't expect that there were many guests, and some people were shirtless.There are many choices for beer, you can recommend it.There is no service fee in the store, but the service is better than the receipt.The meal selection is available in English and desktop, you can try it all, each is clever",False,0.131,0.022,0.847,0.8402
"氛圍很適合三五好友聚會，這次剛好是奧運期間過來，還有比賽轉播！
這次點芭樂啤酒，有芭樂的香氣，是順口好喝的啤酒
店員給推🙌🙌很忙的情況下，服務態度還是很好，辛苦了","The atmosphere is very suitable for three or five friends gatherings. This time, it happened to be during the Olympic Games, and there was a broadcast of the game!
This time I order guavo beer, with the aroma of guava, it is a delicious beer
When the clerk is very busy, the service attitude is still very good.",False,0.158,0.0,0.842,0.883
餐點非常好吃，啤酒種類多，非常值得推薦！,"The meal is very delicious, there are many types of beer, it is worth recommending!",False,0.322,0.0,0.678,0.7339
貪方便，在民宿附近找到這間英式酒吧，雖然沒有很特色，但裡面啤酒的選擇蠻多的，也有英式小食提供，很適合跟朋友去踫踫杯，痛快地喝個冰凍的啤酒，把白天的煩惱拋開。,"It is convenient to find this British bar near the homestay. Although it is not very unique, there are quite a lot of beer choices. It is also provided by British snacks. Put aside the trouble during the day.",False,0.0,0.066,0.934,-0.4019
"我直接這麼說吧，這間真的讓我服了南北價差這一說

我在台南有次去了一間同性質的美式餐廳（不是瞎掰的，在統帥大飯店附近，自己查），點了個260的牛肉漢堡，一杯100可樂（美式行情價），為了怕吃不飽，我又額外點了一份160的洋蔥圈
東西一端上來我就知道死定了，那份漢堡用大家都能理解的東西來描述，就是四五倍大的老麥雙層四盎司+大薯+6塊雞塊，我最後是拼了命把洋蔥圈和著可樂吞下去的，撐死但就是爽翻了

這次一有空上台北，第一晚就興沖沖的要找一間美式餐廳大呼過癮一下。
結果200一片羅馬式披薩，勉強行吧畢竟真的不錯吃，雖然他一份就跟UBE點的必勝客個人披薩差不多，尺寸還一樣
洋蔥圈一份10圈120？老哥認真？一圈12？
吃完一頓420（含100元美式可樂），現在還要下樓等外送老麥，佛都發火了真的是

建議真的有事情喬、能喝酒、意不在吃飽而是氣氛再來，有時候我真的不清楚這些名字裡有bar的到底哪間能吃飽，個體差異真的大","Let me just say that, this really allows me to serve the north -south price difference.

I went to a American restaurant of the same nature in Tainan (not blindly, near the coach restaurant, checked it by myself), ordered a 260 beef burger, a cup of 100 cola (American market price), in order to be afraid to eat or not Full, I ordered another 160 onion ring
I know that the east -west ends, and I know that it is dead. That burger uses things that everyone can understand to describe, that is, four or five times old wheat double -layer four ounces+big potato+6 chicken pieces. I finally worked hard. Swallowed the onion circle and cola, it is to death but it is refreshing

As soon as I was free to go to Taipei this time, I was looking for an American restaurant to be addicted to the first night.
As a result, a Roman -style pizza is barely eaten after all.
A 10th circle 120 onion circles?My brother is serious?One circle 12?
After eating a meal 420 (including 100 yuan American cola), I still have to go downstairs and wait for the old wheat.

It is recommended that there are things that Joe, drinking, and not being full, but the atmosphere is coming again. Sometimes I really don't know which one in these names can be full. The individual differences are really big.",False,0.03,0.026,0.944,0.4386
"服務態度良好，上菜速度也蠻快的
重點是餐點很好吃！
炸物份量意外的多
薄皮比薩大推👏
酒也好喝～
是一間cp值很高的餐酒館👍👍👍","The service attitude is good, and the speed of serving is quite fast
The point is that the meal is delicious!
Fried objects are more unexpected
Bo Pippi Big Push
The wine is also delicious ~
Is a restaurant with a high CP value 👍👍👍",False,0.22,0.0,0.78,0.9184
位於西門町邊緣的開封街上，門面不寬但以大紅色油漆引人注目。店內空間不大，座位約2-30個，人多時會較顯擁擠，人員進出移動不便。主要提供精釀啤酒，種類繁多國產或進口都有，也有些炸物等下酒菜，來了幾次皆單喝啤酒，餐點沒點過也無從評論。避免選擇障礙或踩雷，建議先由自己熟悉啤酒開始，之後再請服務人員推薦。空白牆面佈滿畫框，有些是老照片，有些是海報，圖片，還有些像簽名的塗鴨，一個人來時可邊欣賞邊放空。稍高桌子跟高腳圓凳椅，可能有人會覺得不夠舒適，但這使得坐著跟站著幾乎等高，也許這就是店家標榜英倫酒吧的特色吧。,"Located on Kaifeng Street on the edge of Ximending, the facade is not wide, but it is noticeable with big red paint.The space in the store is not large, and the seats are about 2-30. For a long time, people will be more crowded, and people enter and exit.It mainly provides craft beer. There are many types of domestic or imported. There are also some fried materials and other wines. After several times, you drink beer.Avoid choosing obstacles or stepping on thunder, it is recommended to start with the beer first, and then ask the service staff to recommend it.The blank wall is covered with painting frames, some of which are old photos, some are posters, pictures, and some like signs. When they come, they can enjoy while enjoying it.Slightly high tables and high -footed round stool chairs may feel that it may not be comfortable enough, but this makes sitting and standing almost as high as standing. Maybe this is the characteristic of the store that advertises the British bar.",False,0.093,0.037,0.87,0.8921
"店內氣氛很好，食物也很好吃，店員很用心推薦
They can use English to recommend to u💕 and so friendly!!","The atmosphere in the store is very good, the food is also delicious, and the clerk is recommended by it carefully
They can use English to callment to u💕 and so friendly !!",False,0.39,0.0,0.61,0.9557
"氣氛不錯的小小啤酒吧，簡簡單單的裝潢，很適合和朋友一起來熱鬧熱鬧

啤酒的選擇炸多，各式台灣精釀品牌和口味，應該有上百種吧！！！
可我還是能踩滿地雷也是醉了ಥ_ಥ

The 58精釀，頗苦，朋友是蠻喜歡的

啤酒頭小滿冬瓜茶啤酒，一入口真的有濃濃的冬瓜茶味耶！本日唯一喜歡～可要快點喝掉，放一下後還是會苦苦的

芭樂鹽小麥，非常非常非常的酸，味道怪到懷疑人生，但勉強還可以喝完

蘋行宇宙 蘋果啤酒，為什麼很像在喝雞湯還雞精，味道太神奇之完全無法乾掉，從此成為反指標ಥ_ಥ

餐點最喜歡牧羊人派，個人喜好，焗烤馬鈴薯無敵！
其他都覺得還好～","Little beer bars with good atmosphere, simple decoration, very suitable for lively with friends

The choice of beer is fried, and various types of Taiwan craft brands and flavors should be hundreds of kinds!IntersectionIntersection
But I can still step on the mines and drunk ಥ_ಥ

The 58 craft is quite bitter, my friends like it quite

The beer head is full of winter melon tea beer.The only like this day ~ I have to drink it quickly, and it will still be hard after it is put.

Bava salt and wheat, very, very sour, the taste is so strange that he is suspicious of life, but you can barely finish drinking

Pingxing cosmic apple beer, why is it very much like drinking chicken soup and chicken essence, the taste is too amazing, it can not be killed at all, since then it becomes an anti -indicator ಥ_ಥ

Meals like the shepherds, personal preferences, baked potatoes are invincible!
Everything else feels okay ~",False,0.203,0.089,0.708,0.9758
"看完大稻埕煙火後漫步經過，感覺氣氛很好就走進來了。剛出爐的瑪格麗特比薩焦香薄脆；The 58精釀啤酒大推，聞起來有淡淡花果，但喝起來比金牌還要濃郁，非常好喝😁👍

現在還有評分送shot的活動喲！","After watching the Dadaocheng fireworks, strolling through, I felt that the atmosphere was good and came in.The newly released Margaret is more crispy than the fragrant fragrance; The 58 craft beer pushes, it smells a faint flower, but it is more rich than the gold medal, very delicious

There are still activities to send shots!",False,0.252,0.0,0.748,0.9597
氣氛很棒 食物真的超好吃 配上酒在跟朋友們一起聊天 真的很放鬆 下次還會再來,The atmosphere is great. The food is really delicious and delicious. Chat with friends is really relaxed. I will come again next time.,False,0.509,0.0,0.491,0.962
座位區狹小，雖然是要仿照外國酒吧的感覺，但是椅子很難坐，完全沒辦法放鬆，配酒用的炸物也不太好吃，不過生啤不錯喝,"The seat area is small. Although it is to imitate the feeling of foreign bars, it is difficult to sit in the chair. There is no way to relax.",False,0.129,0.138,0.733,-0.0772
"世足賽事開始
當然要找間酒吧吃吃喝喝看球賽
最後選擇這間 58 bar爲自己看球賽揭開序幕
6點第一場賽事剛好店家開始營業
1樓的環境頗佳看球賽很適合
因為是第一個顧客
很幸運的可以選擇看球最佳位置
點了一杯氣泡飲檸檬香橙
微微酒精加上氣泡很順口
因為持續健身關係
只好先點了一份雞柳條來暖暖身
份量給的很足是6 oz
吃起來口感很紮實
酥脆外皮沾醬非常好吃
整體而言相當滿意
無論店內氛圍、餐點、飲品都給過
讓我決定這屆世足賽要再次光顧
並點其他餐點爲自己喜歡的球隊加油","World Football Event Start
Of course, find a bar to eat, drink, drink and watch the game game
Finally, choose this 58 BAR to kick the game for yourself
At 6 o'clock, the first event just happened to start business
The environment on the first floor is quite good to watch the game game is very suitable
Because it is the first customer
Fortunately, you can choose to watch the best place to watch the ball
Ordered a cup of bubbles to drink lemon orange
Micro wine and bubbles are very smooth
Because of continuous fitness relationship
I had to order a chicken willow bars to warm up
The amount is given enough to be 6 oz
It tastes very solid
Crispy outer skin dipping sauce is very delicious
Overall is quite satisfied
No matter the atmosphere, meals, or drinks in the store
Let me decide that this World Football Championship will be patronized again
And order other meals to cheer for your favorite team",False,0.167,0.007,0.826,0.9809
"路過很渴喝一杯
58精釀生啤很解渴
太舒服的平日了","Drink a cup of thirsty by passing by
58 Cast beer is thirsty thirst
Too comfortable on weekdays",False,0.163,0.0,0.837,0.5106
國內的精釀啤酒也很好喝！這間店是台灣自釀啤酒專賣店，英式小酒館的氣氛，有大電視看運動比賽，下酒菜還不錯吃,Domestic craft beer is also very delicious!This shop is a Taiwanese self -breed beer store. The atmosphere of British tavern has a big TV watching competition.,False,0.0,0.0,1.0,0.0
"餐點ok,環境乾淨，室內空調空氣很好，很適合聚餐，有無酒精飲料，黑啤酒有材燒味微苦，味道很好","The meal is ok, the environment is clean, the indoor air conditioner air is very good, it is very suitable for dinner, there is no alcoholic drink, the black beer has a slightly bitter smell, the taste is very good",False,0.186,0.096,0.717,0.6574
BBQ雞肉薄皮披薩，餅皮酥脆'肉好吃。蘋果酒香烤豬排，肉彈多汁。詢問店員推薦的精釀啤酒都好喝喔~,"BBQ chicken thin skin pizza, cake skin is crispy 'meat is delicious.Apple wine grilled pork chop, juicy meat bomb.Ask the craft beer recommended by the clerk ~",False,0.065,0.0,0.935,0.2023
適合週末小酌看奧運賽事放鬆的地方,Suitable for a place where you can relax on weekends to watch the Olympic Games,False,0.172,0.0,0.828,0.4404
"店員人超好！！！就也很好喝～～～
而且很像來到國外，大家都講英文(((o(*ﾟ▽ﾟ*)o)))","The clerk is super good!IntersectionIntersectionIt's also delicious ~~~
And it is very similar to coming abroad, everyone speaks English ((((((((((((*▽ ﾟ) o)))",False,0.283,0.0,0.717,0.8356
難得看到台灣有這樣的一家bar ，全部都是以台灣精釀啤酒為主，常見的啤酒頭、北台灣麥酒與職人手作等等精釀啤酒廠的啤酒都有，來這真的可以喝的很有趣，這是幾個大男孩一同努力的夢想，餐點的部份也不遜色啤酒，其中一位合夥人到英國去學習的料理，魚排真的很道地感，今晚喝五款有趣的啤酒。,"It is rare to see such a BAR in Taiwan, all of which are based on Taiwan craft beer. Common beer heads, northern Taiwan wheat wine and staff handicrafts, and other craft beer plants are available. It is very interesting. This is the dream of a few big boys work together. The part of the meal is not inferior to the beer. One of the partners went to the UK to learn the dishes. Interesting beer.",False,0.121,0.0,0.879,0.8381
"600/人(6人)，點餐340，酒260。不推
位子很小， 不適合多人聚餐，點餐 還要下去樓下請他上來才能點，應用一些比較智慧型的點餐方式，出菜很亂常常出錯菜，食物種類很少，酒種類多但是沒有很好喝","600/person (6 people), ordering 340, 260 wine.Not push
The seat is very small, it is not suitable for multi -person dinner, you have to go downstairs and ask him to order to order. Apply some smarter ordering methods. Not very delicious",False,0.066,0.071,0.863,-0.0554
"裝潢很有風格～

店員都很親戚～

也有小點、比薩及炸物可享用

台灣酒釀啤酒🍻很好喝","The decoration is very stylish ~

The clerk is very relative ~

There are also small, pizza and fried objects to enjoy

Taiwan wine brewing beer is delicious",False,0.21,0.0,0.79,0.7845
"桂圓黑啤酒很好喝，後面的桂圓味不會過重，推薦，帶甜味👍
炸物比較一般，可是酒好喝，就別在意餐點
威士忌Shot很好喝，不會太烈口，後味帶甜

整體上是間舒服的店，不會過多的推銷與快速收桌","Guiyuan Dark Beer is very delicious, and the flavor of the laurel behind will not be too heavy. Recommended, with sweetness 👍
The fried objects are more average, but the wine is good, so don't care about the meal
The whiskey shot is delicious, it will not be too strong, the back taste is sweet

Overall is a comfortable shop, not too much sales and quickly collecting tables",False,0.257,0.082,0.661,0.9426
氣氛好，平日小酌適合，交通方便,"The atmosphere is good, the drinking is suitable for weekdays, and the traffic is convenient",False,0.172,0.0,0.828,0.4404
"服務人員介紹很仔細，餐點還不錯
陸陸續續都有客人來，生意很棒～
外國客人很多","The introduction of the service staff is very careful, the meal is not bad
There are guests one after another, and the business is great ~
Many foreign guests",False,0.254,0.0,0.746,0.8335
沒想到用小米酒調的調酒蠻好喝的耶！,I did not expect that the bartender with Xiaomi wine was pretty delicious!,False,0.395,0.0,0.605,0.8016
氣氛很好～ 還有播我最愛的足球，服務員也很好,"The atmosphere is very good ~ There are also my favorite football, the waiter is also very good",False,0.385,0.0,0.615,0.855
朋友介紹的。西門附近的小店居然有這麼多的手工啤酒，而且價錢不貴。食品種類也多不過沒有試過。氣氛不錯的。,"Friends introduced.There are so many handmade beer in the small shop near Ximen, and the price is not expensive.There are many types of food but have never tried it.The atmosphere is good.",False,0.164,0.0,0.836,0.7096
"酒吧內幾乎都是台灣釀的酒
很有特色
想找節氣啤酒在這邊也都找到了
棒棒","Almost all of the wines in the bar are wines brewed in Taiwan
Very distinctive
I want to find solar terms beer and I found it here
Great",False,0.179,0.0,0.821,0.6872
氣氛不錯，雖然空間有點小，但是很適合下班靜靜喝一杯,"The atmosphere is good, although the space is a bit small, it is very suitable for drinking a cup quietly from get off work",False,0.112,0.0,0.888,0.4404
食物好吃 酒也很喜歡✨,Food delicious wine also likes 酒 酒 酒 酒 酒 酒,False,0.419,0.0,0.581,0.7579
"在開封路上，在西門町附近但也不算近，但整家店很有風格，賣很多台灣特色啤酒，而且價格也很親民，雖然整家店不大，位子也有限，可是真的很適合三五好友一起來聊天喝酒
我是點芭樂啤酒，酒精濃度不高，只有4.5%的酒精成分，喝起來很順口很好喝，而且芭樂味很重，喜歡芭樂的人喝了應該會蠻愛的！而且只要230元，他們還會貼心附上冰酒杯可以裝啤酒，整個很有feel～
而且如果不知道喝什麼，問服務生他們也會貼心在桌邊幫你介紹，總之推推這家有風格的店

另外打卡就可以送一盤薯條喔！","On Kaifeng Road, it is near Ximending, but it is not close, but the whole store is very stylish, sells many Taiwanese characteristic beer, and the price is also very close to the people. Although the entire store is not large, the seat is limited, but it is really suitable for it. Three or five friends come and chat together
I am a guava beer. The concentration of alcohol is not high. Only 4.5%of the alcohol ingredients are delicious and delicious. Berlite is very heavy. People who like Bale should be quite loved when they drink it!And as long as 230 yuan, they will also be intimately attached to the ice wine glass to install beer, the whole is very Feel ~
And if you don’t know what to drink, ask the waiter to help you introduce at the table at the table. In short, push this style of stores

In addition, you can send a plate of fries!",False,0.151,0.013,0.836,0.9819
餐點道道美味，隱藏版燉牛肉超棒，墨西哥捲餅跟炸魚薯條超好吃，調酒價格適宜co高，草莓啤酒擄獲我的味蕾，週六日還有駐唱超放鬆～～nice,"The meal is delicious, the hidden version of the beef stew is super stick, the Mexican burrier and fried fish and potato strips are super delicious, the price of alcohol is suitable for high Co, strawberry beer captures my taste buds, there is also a resident singing super loose on Saturday and Sunday ~~ nice",False,0.303,0.032,0.665,0.9666
這個有非常非常多的台灣在地釀造的各式各樣啤酒， 每種風味都不太一樣， 也很特別  ，只是價位偏高 ，若想要喝飽請不要來這邊 ，若想要嘗試各種不同的口味，歡迎揪朋友一起來品嚐,"There are a lot of beer brewing in Taiwan in Taiwan. Each flavor is not the same, and it is very special, but the price is high. If you want to be full, please do not come here. If you want to try each Falling different flavors, welcome to taste together to taste together",False,0.192,0.031,0.777,0.8379
"有很多不同種類的酒！
多到會讓你選擇障礙😍","There are many different types of wine!
It will make you choose obstacles 你",False,0.0,0.182,0.818,-0.4389
週六20：00來有音樂可聽，大58 beer NT200，酒種多、套裝組合也多，謝謝男店長（？）常請我吃魷魚絲，女店員漂亮但沒有魷魚絲吃...，不知怎點就從大58入手吧...附近全喝過一輪，每次都在旁邊吃完包子後進來。,"On Saturday 20:00, there are music to listen to, 58 beer NT200, there are many wines and many sets of sets, thank you male shop chiefs (?) I often ask me to eat squid shreds. I don't know how to start with the big 58 ... I drank all the rounds nearby, and I came in every time after eating the buns.",False,0.039,0.0,0.961,0.3612
和丈夫在吃完宵夜後，意猶未盡意外尋到的買醉之地。冷氣很涼、啤酒很冰、氣氛很好，讓只喜歡喝啤酒的韓國老公表示印象深刻！,"After eating the supper with her husband, I still had an unexpected buying a drunk place.The air -conditioning is very cold, the beer is very ice, and the atmosphere is very good. The Korean husband who only likes to drink beer is impressed!",False,0.185,0.047,0.768,0.7897
多次回訪，西門最優啤酒吧,"Visiting multiple times, Ximen best beer bars",False,0.412,0.0,0.588,0.6369
店員服務態度超好。推！,The clerk's service attitude is super good.push!,False,0.411,0.0,0.589,0.636
齊全的台灣啤酒品項 歡迎有興趣的人來此小酌 非常適合帶外國朋友來,Complete Taiwan beer items are welcome to come here to drink very suitable for foreign friends,False,0.303,0.0,0.697,0.7269
氛圍很喜歡，有各式啤酒可以選擇。❤️,"I like the atmosphere, there are all kinds of beer to choose from.❤️",False,0.152,0.0,0.848,0.3612
各大喊得出名字，有在漁人碼頭啤酒節出現過的在地精釀，這裡都找得到。吃飽飯來此小酌也是很愜意的！每天都有不同的促銷活動，超棒的！女士們可以選擇星期四去光顧唷 😘 …,"The names of each shout can be named, and there are local crafts that have appeared at the Fisherman's Wharf Beer Festival, which can be found here.It is also very pleasant to eat here!There are different promotional activities every day, superb!Women can choose to visit on Thursday ...",False,0.138,0.0,0.862,0.8114
"啤酒種類非常多，也有限時優惠
適合朋友小酌聊心事的地方，而店裡也會播球賽
下班放鬆好去處！","There are many types of beer, and there are also limited time discounts
Suitable for friends to talk about things, and the store will also broadcast the game
Relax from get off work!",False,0.165,0.05,0.786,0.6588
酒類選擇超級多 來這裡看奧運就對了！,The choice of wine is superb to see the Olympic Games here!,False,0.285,0.0,0.715,0.6588
酒超好喝氣氛也很好♡♡,The atmosphere of the wine is also very good 气,False,0.262,0.0,0.738,0.4927
"很多種台灣啤酒🍻很特別！
食物也還ok! …","Many kinds of Taiwanese beer 别 are very special!
The food is also ok! ...",False,0.204,0.0,0.796,0.554
"服務態度良好🔥
餐廳裝潢很有風格😆 …","Good service attitude
The restaurant decoration is very stylish ...",False,0.244,0.0,0.756,0.4404
用很多啤酒🍻瓶還有鈔票等物品裝飾，很用心裝飾👍 …,"Use a lot of beer bottle and banknotes and other items to decorate, decorate 👍 👍 👍 👍 👍 ...",False,0.0,0.0,1.0,0.0
"非常溫馨又很自在
有很多台灣在地精釀啤酒
可以試試看","Very warm and very comfortable
There are many Taiwan craft beer in local local brewing
Can try it",False,0.266,0.0,0.734,0.699
啤酒選擇很好 讚👍🏻音樂好聽 很舒服的小酒館 …,Beer choice is very good.,False,0.444,0.0,0.556,0.4927
店裡氣氛氛圍佳,The atmosphere in the store is good,False,0.326,0.0,0.674,0.4404
餐點好吃 氣氛佳 適合朋友聚餐🤩,The delicious atmosphere is good for friends to dinner 🤩,False,0.581,0.0,0.419,0.8658
"週末聚會的好地方
現在還有世足活動！！！","Good place for weekend gatherings
There is still a World Football event!IntersectionIntersection",False,0.225,0.0,0.775,0.4926
萊姆伏特加讚讚,Lim Vodka praise,False,0.643,0.0,0.357,0.5574
台灣精釀啤酒的瓶裝選擇是我看過最完整的，但價格也相對高,"The bottle selection of Taiwan craft beer is the most complete, but the price is relatively high",False,0.0,0.0,1.0,0.0
食物啤酒都普普通通，位置狹小，坐著都會被人撞到，反應想坐大桌，還被換成狹小的位置，明明客人也不多，只能坐狹小靠門口的位置，餐點點比較多，價格也不便宜，食物放得很擠，門口吸煙區的菸味一直飄進室內，整體體驗很差。,"Food beer is generally common, with a small position, and people will be hit by people. They want to sit on a large table. They are also replaced with a narrow position. There are not many guests. There are many, the price is not cheap, the food is crowded, the smoke smell of the smoking area at the door has been drifting into the room, and the overall experience is poor.",False,0.018,0.042,0.94,-0.4215
與朋友輕鬆聊天的好地方，精釀種類繁多。,There are many types of crafts in chatting with friends to chat easily.,False,0.333,0.0,0.667,0.6705
我喜歡這裡，店員很有耐心的推薦酒類，不來第二次不行欸！,I like it here. The clerk has patiently recommended wine.,False,0.35,0.0,0.65,0.5106
氛圍不錯，每天都要活動讚！,"The atmosphere is good, and you have to praise every day!",False,0.43,0.0,0.57,0.7777
餐點都很好吃讚讚！酒好喝也便宜～,The meals are very delicious!It is cheap to drink wine ~,False,0.0,0.0,1.0,0.0
