Original,EN,Needs Review,Positive,Negative,Neutral,Compound
就很特別，東西又很好吃，人員也很親切,"It's very special, the things are delicious, and the personnel are very kind",False,0.509,0.0,0.491,0.8856
酒類選項多，食物也好吃，值得一再造訪的店！,"There are many alcohol options, and the food is also delicious, and it is worth visiting!",False,0.296,0.0,0.704,0.7088
獨立啤酒很好喝 推,Independent beer is very delicious,False,0.5,0.0,0.5,0.6115
"各式各樣的台灣精釀, 餐點好吃","All kinds of Taiwan crafts, delicious meals",False,0.381,0.0,0.619,0.5719
很多啤酒可以選擇 酒好喝 音樂好聽 staff很貼心 一定要來❤️,"Many beer can choose wine to drink good music, good music. Staff is very intimate.",False,0.309,0.0,0.691,0.7003
喜歡的音樂和喜歡的酒～😍😍 …,Favorite music and like wine ~ 😍😍 ...,False,0.511,0.0,0.489,0.8885
餐點好吃 酒類眾多！,There are many delicious alcohol!,False,0.499,0.0,0.501,0.6114
啤酒很好喝音樂很讚,Beer is very delicious and music is great,False,0.574,0.0,0.426,0.8439
生啤酒很新鮮順口，店內雖然不大但是空間不擁擠，餐點也弄得還不錯，選擇很多很適合啤酒愛好者，門口外有設置抽煙位可以讓走跳夥伴無壓力,"Raw beer is very fresh and smooth. Although the store is not large, the space is not crowded, and the meal is pretty good. Choose a lot of very suitable beer enthusiasts. There is a smoking position outside the door.",False,0.24,0.0,0.76,0.8849
台灣精釀啤酒種類多，非常值得來喝！,"There are many types of craft beer in Taiwan, which is worth drinking!",False,0.154,0.0,0.846,0.2942
瑪格麗特披薩很不錯,Margaret pizza is very good,False,0.444,0.0,0.556,0.4927
氣氛佳，琥珀艾爾很好喝❤️,"Good atmosphere, Amber El is very delicious ❤️",False,0.496,0.0,0.504,0.7841
環境不錯，很適合跟朋友兩個人來小酌,"The environment is good, very suitable for two people with friends to drink",False,0.353,0.0,0.647,0.7184
店員很親切，啤酒種類很多，熱食也很好吃,"The clerk is very kind, there are many types of beer, and the hot food is also delicious",False,0.316,0.0,0.684,0.8122
舒適氣氛佳 推推～～,A comfortable atmosphere push ~~,False,0.452,0.0,0.548,0.5106
啤酒選擇多樣，口味順口，價格合理。食物是英美式小吃，以酒吧而言算中規中矩，不特別令人印象深刻。店內環境寬敞舒適，服務親切周到，氣氛也相當不錯。平入晚上好像只有我們一組客人，沒有時間壓力。我們五個人平均花了500元，整體CP值不差。如果平日晚上想跟一群朋友一起喝個啤酒聊整晚，享受工作外悠閒的片刻，這家是不錯的選擇。,"Beer choices are diverse, the taste is smooth, and the price is reasonable.Food is a British -American snack. It is not particularly impressive as a bar as a bar.The environment in the store is spacious and comfortable, the service is kind and thoughtful, and the atmosphere is quite good.It seems that there is only one group of guests at night in the evening, without time pressure.The average five of us spent 500 yuan, and the overall CP value was not bad.If you want to have a beer with a group of friends on weekdays, you will have a good choice for a while to enjoy a whole night and enjoy a leisurely moment outside the work.",False,0.18,0.031,0.79,0.9636
"溫馨小店，
啤酒選擇多，名稱有趣
適合朋友小聚閒聊","Warm shop,
There are many beer selection, the name is interesting
Suitable for friends to gossip",False,0.36,0.079,0.561,0.7184
酒好喝、店員正、老闆帥，沒辦法按更多讚了！,"The wine is delicious, the clerk is right, and the boss is handsome, there is no way to like more!",False,0.347,0.079,0.574,0.8172
啤酒總類很多，可以來這品嚐各種啤酒哦！,"There are a lot of beer categories, you can come here to taste all kinds of beer!",False,0.0,0.0,1.0,0.0
到西門町喝酒，基本上都優先來這邊,"Drinking alcohol in Ximending, basically all are here to come here",False,0.0,0.0,1.0,0.0
喝一個愛台灣的感覺，酒單豐富，雞塊超推！,"Drink a feeling of loving Taiwan, the wine is rich, and the chicken nuggets are over!",False,0.417,0.0,0.583,0.8516
"小小的酒吧但員工非常親切,只是菜品的選項有些少,口味普通,但因我們是使用飯店的優惠前來有免費啤酒,所以給四顆星","The small bar but the employees are very kind, but the dishes are a little less options, and the taste is ordinary, but because we are using the hotel's discount to have free beer, we give four stars.",False,0.209,0.0,0.791,0.8883
建議點瓶裝的，調酒不行,It is recommended to be a bottle.,False,0.231,0.0,0.769,0.2023
住家旁的啤酒館，太有緣了。兩人做了第一次的造訪，非常友好的聊天聚會環境，因為是餐酒館而不是酒吧，所以大家會準時last call回家，也比較不吵。至於啤酒的種類和選擇，那就參考其他各位的評論吧，愛喝啤酒的我肯定會常來的。,"The beer hall next to the home is too fate.The two made their first visit. The very friendly chat party environment, because it is a dining tavern instead of a bar, so everyone will go home on time, and it is less noisy.As for the types and choices of beer, please refer to other comments. I will definitely come often.",False,0.17,0.0,0.83,0.8874
啤酒種類多元，多是台灣本土的精釀啤酒，是一個可以好好品嚐台灣風土釀出來的酒的好所在！吃的部分，炸魚條真的非常～～～好吃，很推薦三五好友來喝酒聊天。,"There are diverse types of beer, mostly in Taiwan's native craft beer, and it is a good place to taste the wine that can taste Taiwan's local customs!For the food, the fried fish bar is really very delicious. It is recommended to drink and chat with three or five friends.",False,0.212,0.0,0.788,0.9074
擁有非常多款台灣品牌的瓶裝啤酒，包含小品牌的瓶裝也能找到，推薦給喜歡或想嘗試不同國產風味啤酒的人，店內也有手壓啤酒、餐點提供，拼盤份量多適合多人聚會share，偶有現場音樂表演及平日的放樂蠻不錯，蠻多外國人也愛來的地方,"There are many bottle beer with many Taiwanese brands, and the bottles of small brands can also be found. It is recommended to people who like or try to try different domestic flavor beer. There are also hand -pressed beer and meals in the store. Occasionally on -site music performances and daily music are pretty good, many foreigners also love to come.",False,0.241,0.0,0.759,0.9501
啤酒選擇多樣，調酒好喝,"Beer choices are diverse, bartender is delicious and delicious",False,0.514,0.0,0.486,0.8126
"生意很好，啤酒豐富，輕鬆聊天的好地方
可以三五好友一起來","Good business, rich beer, good place to chat easily
You can come together for three or five friends",False,0.534,0.0,0.466,0.9313
地點不錯很方便，店內一整面多款台灣精釀啤酒，非常壯觀，很適合帶國外朋友來小酌！店內氣氛好、音樂也好,"The location is good and convenient. A variety of Taiwanese craft beer in the store in the store is very spectacular. It is very suitable for bringing foreign friends to drink!The atmosphere in the store is good, the music is good",False,0.246,0.0,0.754,0.902
很棒的氛圍，啤酒選項很多,"A great atmosphere, there are many beer options",False,0.369,0.0,0.631,0.6249
"58精釀這家店應該是西門町地區精釀啤酒的指標
另外還會提及last order很有質感的餐酒館。
西門還有一家geography bar創意調酒很厲害。
這3家相互距離不遠，分屬不同領域型態，戰況打得激烈啊!!","58 Craft Store should be the indicator of craft beer in Ximending area
In addition, Last Order's very textured dining tavern will be mentioned.
There is also a Geography Bar creative bartending in Ximen.
These three are not far from each other, belonging to different fields, and the situation of the battle is fierce !!",False,0.059,0.044,0.897,0.2225
"感覺很好的一個地方,工作人員都好熱情,好舒服
也有很多不同的啤酒可以嘗😍讚 …","It feels very good, the staff are so enthusiastic, so comfortable
There are also many different beer to taste like ...",False,0.458,0.0,0.542,0.9369
酒很順，發現上錯菜店員也馬上處理甚至請客，超讚ㄉ🥵🥵 …,"The wine was very smooth, and found that the wrong dish shop clerk also handled or even invited, super happy ...",False,0.265,0.108,0.627,0.6705
"首先 台灣鮮釀就要推 *****
氛圍佳 尤其是中間的大桌 ****
酒品溫度與杯具不錯 ***
食物還是選擇旁邊的 麵太郎 **
喜歡啤酒 一定來品嘗台灣自釀!!!","First of all, Taiwan fresh brewing will push *****
The atmosphere is good, especially in the middle table ****
Wine temperature and cup are good ***
Food still chooses the Madaro next to it **
If you like beer, you must taste Taiwan's own brewing !!!",False,0.215,0.0,0.785,0.8879
餐點好吃，啤酒多樣化，一些市面上喝不到的啤酒在這都有,"The meal is delicious, the beer is diverse, and some beer that can’t be drunk on the market has all.",False,0.154,0.1,0.747,0.3182
牧羊人派、披薩都好吃，啤酒種類超多！服務親切，用餐環境佳👍 還可以看球賽讚讚！ …,"The shepherds and pizza are delicious, and there are many types of beer!The service is cordial, and the dining environment is good. You can also watch the ball game!Mowing",False,0.21,0.0,0.79,0.8011
"適合朋友相聚
酒好喝 店員友善
還可以免費幫拍拍立得 暈爆💓 …","Suitable for friends
Wine good shopkeeper friendly
You can also help you stand freely 💓 💓 💓 💓 ...",False,0.657,0.162,0.181,0.9825
在FunNow上購買的方案，隨買隨用超方便的，店家的精釀啤酒也超對味，下次一定會再來訪。,The plan to buy on Funnow is super convenient to buy as it is used.,False,0.218,0.0,0.782,0.5994
Pizza蠻好吃，餐點蠻道地英式口味，啤酒種類超多的！,Pizza is pretty delicious.,False,0.775,0.0,0.225,0.7845
穩得一匹,Be stable,False,0.688,0.0,0.312,0.296
餐飲服務佳，不是第一次來嘍！,"The food service is good, not for the first time!",False,0.262,0.0,0.738,0.4926
"東西好吃 服務態度好
吃得很開心🥳","Good service attitude is good
I am very happy 心",False,0.583,0.0,0.417,0.8687
酒品選項多介紹豐富且服務不敷衍不怠慢，店內超適合小酌with三五好友！,The wine options introduce more richness and unpacformable services.,False,0.304,0.0,0.696,0.5413
看球賽喝酒的好地方！,A good place to watch the game!,False,0.347,0.0,0.653,0.4926
東西好吃。酒類總類多。環境雖小。但很輕鬆。二樓也有座位,Things are delicious.There are many wines.Although the environment is small.But it's easy.There are also seats on the second floor,False,0.0,0.0,1.0,0.0
老闆娘人很親切 位子不多但氣氛不錯 是可以談天的溫馨小酒館,"The boss is very intimate, but the atmosphere is good, but the atmosphere is a warm tavern.",False,0.292,0.0,0.708,0.7351
啤酒特別又好喝！東西好吃氣氛好！很適合朋友聚會喔！,Beer is particularly delicious!The thing is delicious!Very suitable for friends gatherings!,False,0.284,0.0,0.716,0.6093
第一次跟朋友去，覺得不錯，東西好吃，重點是酒類超多樣,"I went with friends for the first time, I think it is good, the things are delicious, the point is that the alcohol is super diverse",False,0.382,0.0,0.618,0.9274
適合放鬆談天的好地方，啤酒種類琳瑯滿目，下酒食物也屬一絕。,"Suitable for a good place to relax and talk about the sky, the types of beer are full of types, and the food and food are also a must.",False,0.177,0.0,0.823,0.7003
啤酒好喝，適合3-5好友同學一起去，老闆跟服務人員都很親切,"Beer is delicious, suitable for 3-5 friends and classmates, the boss and the service staff are very kind",False,0.412,0.0,0.588,0.8883
調酒很棒，餐點也很精緻，價格實惠,"The bartending is great, the meal is also exquisite, the price is affordable",False,0.255,0.0,0.745,0.6249
"喜歡整個裝潢跟氛圍
薯條好大盤
有兩支Tap 瓶裝選擇多","Like the whole decoration and atmosphere
French fries
There are two TAP bottle selection",False,0.161,0.0,0.839,0.3612
薯條好吃哈哈哈😋 …,French fries are delicious hahaha 好 ...,False,0.593,0.0,0.407,0.8074
氣氛佳 服務態度好 ❤️,Good atmosphere service attitude is good ❤️,False,0.492,0.0,0.508,0.7003
自家的釀啤酒有果香味和啤酒的苦味平衡得不錯,Your own brewed beer has a fruitful scent and the bitterness of beer.,False,0.0,0.184,0.816,-0.4019
氣氛佳，店員親切漂亮，酒也好喝，會再來,"The atmosphere is good, the clerk is kind and beautiful, the wine is also delicious, and it will come again",False,0.465,0.0,0.535,0.9313
啤酒特別而且很好喝，氣氛也不錯，還會再來!!!!,"Beer is particularly delicious and delicious, and the atmosphere is good, and it will come again !!!!",False,0.462,0.0,0.538,0.919
東西好好吃哦店員還很會拍照😻😻 …,The things are delicious. The clerk is still taking pictures 😻😻 ...,False,0.35,0.0,0.65,0.8658
氣氛不錯，即使客滿也偏向比較安靜的酒吧,"The atmosphere is good, even if it is full, it is more quiet bar",False,0.182,0.0,0.818,0.4404
環境讚 店員超正 酒好喝好喜翻❤️❤️,Environmental praise store clerk super righteous wine is so delicious ❤️❤️,False,0.527,0.0,0.473,0.9223
非常舒服的環境👍🏻 …,Very comfortable environment 的 ...,False,0.473,0.0,0.527,0.5563
長島冰茶必喝！精釀啤酒也很好喝！,Long Island Ice Tea must drink!Cast beer is also very delicious!,False,0.314,0.0,0.686,0.6785
很多特別的啤酒口味可以挑選，牧羊人派很好吃,"Many special beer flavors can be selected, and the shepherds are delicious",False,0.39,0.0,0.61,0.7506
來喝一點飲料,Come and drink a little drink,False,0.0,0.0,1.0,0.0
店內環境很棒，服務生也很友善,"The environment in the store is great, and the waiter is also very friendly",False,0.388,0.0,0.612,0.8221
生啤酒很好喝 氣氛很讚 就是有點窄,"The raw beer is very delicious and the atmosphere is great, but it is a bit narrow",False,0.252,0.0,0.748,0.6183
店員很親切，酒不錯喝，來了蠻多次了,"The clerk is very kind, the wine is good to drink, it has been here many times",False,0.305,0.0,0.695,0.7645
讚到瘋 喝得好開心,Just like to drink it so happy,False,0.592,0.0,0.408,0.8042
氣氛不錯的bar 酒單豐富 店員服務好,BAR wine single rich clerk service with good atmosphere,False,0.481,0.0,0.519,0.7579
臘腸披薩的起司好吃，牧羊人派也不賴,"The cheese of the sausage pizza is delicious, and the shepherds are not bad",False,0.353,0.0,0.647,0.7615
"服務很好 炸魚薯條 好吃
廁所很乾淨 啤酒很多樣","The service is very good, fried fish and butpse strip is delicious
The toilet is very clean beer",False,0.397,0.0,0.603,0.8716
非常好喝的特調!!!下次帶朋友來,Very delicious special tone !!! Let's bring friends next time,False,0.61,0.0,0.39,0.8989
"很有特色的啤酒專賣,離火車站不遠可步行","Very distinctive beer monopoly, not far from the railway station to walk",False,0.0,0.0,1.0,0.0
種類眾多！可惜今天沒喝到他們自己的58精釀...,"There are many types!Unfortunately, I didn't drink their own 58 crafts today ...",False,0.0,0.0,1.0,0.0
酒類種類豐富,Rich alcohol type,False,0.643,0.0,0.357,0.5574
啤酒很多選擇，很有特色。,"There are many options for beer, which is very distinctive.",False,0.0,0.0,1.0,0.0
很多MIT啤酒，喜歡特別口味的一定要來,"Many MIT beer, those who like special tastes must come",False,0.394,0.0,0.606,0.6369
啤酒不錯，服務員親切。,Beer is good and the waiter is kind.,False,0.512,0.0,0.488,0.743
"主要是bottle
選擇滿多
店員也蠻專業","Mainly bottle
Choose a lot
The clerk is also quite professional",False,0.0,0.0,1.0,0.0
做活動玩文字遊戲，店員不解釋內容，態度不佳,"Play text games for activities, the clerk does not explain the content, and the attitude is not good",False,0.115,0.116,0.769,-0.0015
店員親切 食物好吃,The clerk's kind food is delicious,False,0.64,0.0,0.36,0.7964
啤酒種類非常豐富，價格在自釀啤酒裡中高,"The type of beer is very rich, and the price is high in self -brew beer",False,0.206,0.0,0.794,0.5984
台灣超多不同特有啤酒 讚讚讚 音樂播的好聽,There are many different unique beer in Taiwan praised the nice music broadcast,False,0.353,0.0,0.647,0.7184
有風格，氣氛佳,"There are styles, good atmosphere",False,0.42,0.0,0.58,0.4404
看恰恰退休，服務親切，氣氛很好的酒館,"Seeing the taverns with retirement, intimate service, and good atmosphere",False,0.244,0.0,0.756,0.4404
店員很爛，會騙客人，不誠實，完全不推,"The clerk is bad, and he will cheat guests, dishonent, and not pushed at all.",False,0.0,0.333,0.667,-0.7579
服務員很貼心 歌單選的很好,The waiter is very intimately selected by the song list very well,False,0.179,0.0,0.821,0.3384
啤酒種類多樣～二樓有包廂,There are diverse types of beer ~ there are boxes on the second floor,False,0.0,0.0,1.0,0.0
酒很好喝pizza也很讚！,"The wine is delicious, and Pizza is also very good!",False,0.473,0.0,0.527,0.8012
酒好喝、食物好吃、老闆帥,"Good wine, delicious food, handsome boss",False,0.766,0.0,0.234,0.8689
很喜歡這裡的環境 服務生服務很好,I really like the environmental waiter here very well,False,0.426,0.0,0.574,0.6353
精釀種類很多，店員服務也不錯,"There are many types of crafts, and the clerk service is also good",False,0.195,0.0,0.805,0.4404
看運動比賽的好地方～,Watch a good place to watch sports competition ~,False,0.266,0.0,0.734,0.4404
啤酒有特色！！服務態度很好！！！,Beer has characteristics!IntersectionThe service attitude is very good!IntersectionIntersection,False,0.0,0.0,1.0,0.0
店員很帥😍,The clerk is handsome 帅,False,0.444,0.0,0.556,0.4939
超級好的bar!,Super good BAR!,False,0.876,0.0,0.124,0.7959
酒…很好…喝…大家…快來…,Wine ... very good ... drink ... everyone ... Come ... hurry up ...,False,0.197,0.0,0.803,0.4927
安靜可以好好聊天👍🏼 …,Quiet can chat well ...,False,0.344,0.0,0.656,0.2732
比較適合去喝whiskey shot的方案,It is more suitable for drinking WHISKEY ShOT,False,0.0,0.0,1.0,0.0
偶然路過～nice place!,Passing by accident ~ Nice Place!,False,0.275,0.333,0.392,-0.1511
啤酒種類多 餐點好吃,Beer types are delicious for meals,False,0.425,0.0,0.575,0.5719
一個全是在地啤酒的酒吧,A bar full of local beer,False,0.0,0.0,1.0,0.0
推薦自家精釀生啤酒,Recommend your own craft raw beer,False,0.333,0.0,0.667,0.3612
啤酒種類很多～推,There are many types of beer ~ push,False,0.0,0.0,1.0,0.0
氣氛好 酒品多,The atmosphere is good,False,0.492,0.0,0.508,0.4404
店員可愛❤️服務優質,The clerk is cute ❤️ High -quality service,False,0.273,0.0,0.727,0.4588
西門町喝酒的好去處,The good place to drink in Ximending,False,0.326,0.0,0.674,0.4404
服務很好,The service was excellent,False,0.552,0.0,0.448,0.5719
啤酒百百種任你挑,Hundreds of beer to pick you up,False,0.0,0.0,1.0,0.0
優秀,excellent,False,1.0,0.0,0.0,0.5719
有很多外國人的酒吧。我去那裡以為啤酒有很多種，但不可能的菜單比可能的菜單還要多。與其他地方相比，價格並不便宜，但它很有異國情調，因為參觀的是外國人，而不是亞洲人。我點的啤酒配的雞肉酥脆，但是有台灣的味道，女服務生大聲擤了好幾次鼻子，沒洗手就給我們上菜了。但這是一段令人滿足的時光。,"There are many foreigners' bars.I went there and thought there were many beer, but the impossible menu had more menu than possible menu.Compared with other places, the price is not cheap, but it is very exotic because they are visiting foreigners, not Asians.The chicken I ordered the chicken was crispy, but with the taste of Taiwan. The waitress loudly squeezed her nose several times, and she gave us food without washing my hands.But this is a satisfying time.",False,0.049,0.0,0.951,0.6124
如果你喜歡啤酒的話，這是一個值得一去的地方，雖然只有兩種水龍頭，但他們提供各種台灣當地的瓶裝啤酒。內部雖小，但我喜歡這個空間所散發出的平靜氛圍。,"If you like beer, this is a place worth visiting. Although there are only two kinds of faucets, they provide various local bottle beer in Taiwan.Although the interior is small, I like the calm atmosphere emitted by this space.",False,0.208,0.0,0.792,0.802
店裡有很多台灣手工藝品。有很多可供選擇。有很多食品贈品促銷活動。我透過出示護照得到了免費的雞塊，透過評論餐廳得到了免費的薯條。,There are many Taiwan handicrafts in the store.There are many options.There are many food gift promotion activities.I got free chicken nuggets through presenting the passport and got free fries through the restaurant.,False,0.247,0.0,0.753,0.8591
氣氛好，位置好。許多啤酒可供選擇，許多食物可供嘗試。台北必嚐的精釀啤酒吧！我一定會回來的。,"The atmosphere is good and the location is good.Many beer are available, and many foods are tried.Taipei Must taste the craft beer bar!I will definitely come back.",False,0.191,0.0,0.809,0.7088
"友善且會說英語的服務。我喜歡音樂，氣氛也很好。
推薦在酒吧直接釀造的58精釀啤酒，因為它是IPA啤酒，味道清淡，香氣濃鬱，喝起來很清爽。
這裡還有歡樂時光，所以如果你在附近的話，快速喝一杯會很不錯。","Friendly and speak English service.I like music, and the atmosphere is also very good.
It is recommended to be directly brewed in the bar for 58 craft beer, because it is an IPA beer, which has a light taste, strong aroma, and is very refreshing.
There are joy here, so if you are nearby, it will be good to drink a drink quickly.",False,0.27,0.0,0.73,0.9623
"這是一棟如此美妙又美味的房子。
老闆很熱情，食物品質也很棒。
我強烈推薦韓國人來！聚集在一起！

這是一個美妙而美味的地方。老闆也很熱情，食物的品質也很棒。我強烈推薦韓國人來這裡！集合起來！","This is such a beautiful and delicious house.
The boss is very enthusiastic and the quality of food is also great.
I strongly recommend Koreans!Gathering together!

This is a wonderful and delicious place.The boss is also very enthusiastic, and the quality of food is also great.I strongly recommend Koreans to come here!Gathering!",False,0.471,0.0,0.529,0.9886
這是一家位於北門站附近的英式啤酒吧。氣氛很英國，但賣的啤酒大多是台灣啤酒。有幾個台灣啤酒龍頭和來自不同地區的精選台灣精釀啤酒。我嘗試了酸啤酒和IPA，但味道只是一般，不是很令人印象深刻。我喜歡工作人員會說英語，這樣很容易回覆。,"This is a British beer bar near Beimen Station.The atmosphere is very British, but most of the beer sold in Taiwan is Taiwan beer.There are several Taiwanese beer faucets and selected Taiwan craft beer from different regions.I tried sour beer and IPA, but the taste was just average, not very impressive.I like the staff to speak English, so it is easy to reply.",False,0.062,0.044,0.894,0.3119
寬敞的空間和一些優質的桶裝啤酒。他們還有大量當地生產的瓶裝啤酒。缺黑啤酒嗎？他們為任何人提供了很好的選擇。他們還有一些看起來很棒的食物。氣氛也相當迷人。這是一個小而舒適的空間，有友好的工作人員。,Spacious space and some high -quality barrel beer.They also have a large number of local bottle beer.Is there a lack of dark beer?They provide a good choice for anyone.They also have some good foods.The atmosphere is also quite charming.This is a small and comfortable space with friendly staff.,False,0.235,0.04,0.725,0.8834
這是我第一次旅行，但我不知道該怎麼辦，南京宮老闆的態度是2分鐘和30分鐘後。,"This is my first trip, but I don't know what to do. The attitude of the boss of Nanjing Palace is 2 minutes and 30 minutes later.",False,0.0,0.0,1.0,0.0
"瀏覽時間：2023.10.29-30
如果你想在西門喝桶裝精釀啤酒，請點這裡。距離西門站步行6-7分鐘。

它很小但很放鬆。這家店原價58的龍頭售價270元。這個好吃。","Browse time: 2023.10.29-30
If you want to drink barrels of craft beer in Ximen, please click here.Walk 6-7 minutes from Ximen Station.

It is small but relaxed.The original price of this store is priced at 270 yuan.This is delicious.",False,0.236,0.0,0.764,0.8689
食物很美味，店員也很友善❤️,"The food is delicious, and the clerk is also very friendly ❤️",False,0.395,0.0,0.605,0.8016
"這個地方位於穿過複雜的西門街之後。
餐廳氣氛很棒
啤酒餐廳
很高興能和愛人以良好的心情結束台北之行的最後一晚。","This place is located behind the complex Ximen Street.
The restaurant atmosphere is great
Beer restaurant
I am glad to end the last night of Taipei with my lover in a good mood.",False,0.322,0.0,0.678,0.93
