Original,EN,Needs Review,Positive,Negative,Neutral,Compound
我去了住所附近一個氣氛很好的地方。我推薦這個地方，在良好的氛圍中喝啤酒。作為回顧活動贈送的薯條也很好吃。,I went to a place with a good atmosphere near my residence.I recommend this place to drink beer in a good atmosphere.The fries given by the activity are also delicious.,False,0.316,0.0,0.684,0.9001
"溫馨的氛圍。
一個可以品嚐台灣當地啤酒的地方。
工作人員英語說得很好，而且很友好，所以很舒服。
薯條也很好吃！","A warm atmosphere.
A place that can taste local beer in Taiwan.
The staff speaks well and is very friendly, so it is very comfortable.
French fries are also delicious!",False,0.376,0.0,0.624,0.9334
"58 是牆上的一個舒適的洞，可以走出台北的大雨，快速喝一杯。這個地方完全是台灣人對英國酒吧的想像，撥打 11 即可。

您將獲得一批有趣的英國啤酒，但不要沉迷於他們庫存的當地精釀啤酒。

無論您是在度過美好的夜晚之前進行賽前準備，還是在狂歡之夜結束後放鬆身心，這裡都是您與朋友聚會的好地方。

附：這裡的音樂非常好聽，如果你迷路了，三樓還有一家旅館可以過夜。","58 is a comfortable hole on the wall that can walk out of the heavy rain in Taipei and drink a cup quickly.This place is completely the imagination of the Taiwanese for British bars, just call 11.

You will get a group of interesting British beer, but don't add to the local craft beer of their inventory.

Whether you are preparing before the match before the good night, or relaxing your body and mind after the end of the carnival night, this is a good place for you to meet with your friends.

Attachment: The music here is very nice. If you get lost, there is a hotel on the third floor that can spend the night.",False,0.196,0.021,0.782,0.9754
"氣氛溫馨美好。
58 啤酒特別香，特別好吃：）
披薩也適合作為便餐。","The atmosphere is warm and beautiful.
58 Beer is particularly fragrant and delicious :)
Pizza is also suitable as a lax meal.",False,0.415,0.0,0.585,0.9147
蘋果汁醃製的豬排很好吃。啤酒也是自釀的，具有非常好的獨特風味。我現在一個人吃飯，感覺很好。,The pork chop marinated by apple juice is delicious.Beer is also self -brewed and has a very good unique flavor.I eat alone now and feel very good.,False,0.197,0.062,0.741,0.6582
由於我是P的，所以就去了最上面的地方，去的時候氣氛真的很好，所以有點吵，但是我也喜歡這個地方，所以我就去了。評論所示，工作人員會說英語，所以我們溝通得很好。,"Because I was P, I went to the top place. The atmosphere was really good when I went, so I was a bit noisy, but I also like this place, so I went.In the comments, the staff can speak English, so we communicate well.",False,0.195,0.027,0.778,0.8147
牆上有洞，牆上有字！似乎很吸引外國人——練習普通話的好地方。台灣啤酒和工藝瓶。,"There are holes on the wall, there are words on the wall!Seems to attract foreigners -a good place to practice calling.Taiwan beer and craft bottle.",False,0.198,0.0,0.802,0.69
非常好的啤酒選擇。我只希望他們有超過 2 瓶桶裝啤酒。位置和室內裝飾都很棒。,Very good beer choice.I just hope they have more than 2 bottle of barrel beer.The location and interior decoration are great.,False,0.362,0.0,0.638,0.8805
如果你不喜歡韓國菜，最好不要來，我就一直吃酸橙…（這不是小吃菜單，我想要的）披薩真的很好吃！小吃很便宜，但是啤酒有點貴，如果你喜歡軟生啤酒，一定要嚐嚐，生啤酒是世界上最順口的！請注意，收據是兩份小吃+6L生啤酒+黑啤酒的價格！ ！,"If you don't like Korean cuisine, it is best not to come, I always eat lime ... (this is not a snack menu, what I want) pizza is really delicious!Snacks are cheap, but beer is a bit expensive. If you like soft beer, you must try it. Raw beer is the most smooth in the world!Please note that the receipt is the price of two snacks+6L raw beer+black beer!Intersection",False,0.106,0.021,0.873,0.7447
如果您想快速喝點啤酒、吃點小吃並與調酒師有趣地聊天，那麼這是一個很棒的地方。這裡尤其以提供來自該地區的精選精釀啤酒而聞名，但他們也提供桶裝台灣啤酒。每次我在城裡時，我都會來這裡。 😁,"If you want to drink some beer quickly, eat some snacks, and chat with the bartender funny, then this is a great place.It is especially famous for providing selected craft beer from the area, but they also provide barrels of Taiwanese beer.Every time I am in the city, I will come here.Bleak",False,0.103,0.0,0.897,0.5647
令人驚嘆的當地精釀啤酒。我每年都會來台北，這是我每年必去的地方。,"Amazing local craft beer.I come to Taipei every year, this is where I will go every year.",False,0.192,0.0,0.808,0.5859
這個地方位於西門町，服務很好，還有各種台灣啤酒，還有很多小吃，非常適合消除旅行後的疲勞。,"This place is located in Ximending. The service is very good. There are various Taiwanese beer and many snacks, which are very suitable for eliminating fatigue after travel.",False,0.102,0.064,0.834,0.2944
毫不誇張地說，我每次回到台北都必須去參觀。它具有潛水的特點，常客回來後知道他們坐在哪裡。友好的工作人員。,"It is no exaggeration to say that every time I return to Taipei, I have to visit.It has the characteristics of diving, and the frequent guests know where they are sitting when they come back.Friendly staff.",False,0.035,0.059,0.907,-0.2263
超好的工藝品選擇，小而舒適的氛圍。別忘了在牆上留下你的標記。很有趣，尤其是當你和朋友一起去的時候。,"Super good handicraft selection, small and comfortable atmosphere.Don't forget to leave your mark on the wall.Very interesting, especially when you go with your friends.",False,0.524,0.0,0.476,0.9495
"儘管我的英語很差，但訂單還是以友好的方式處理了。
台灣精釀啤酒瓶種類繁多。如果您告訴我們您的偏好，他們會提出建議。
店內提供的桶裝啤酒也香氣撲鼻，美妙極了。","Although my English is poor, the order is processed in a friendly way.
There are many types of craft beer bottles in Taiwan.If you tell us your preferences, they will make suggestions.
The bucket beer provided in the store is also fragrant, which is very wonderful.",False,0.135,0.058,0.807,0.624
"生啤酒清爽可口。
工作人員英語說得很好，溝通也沒有問題。","Raw beer is refreshing and delicious.
The staff's English is very good, and there is no problem with communication.",False,0.364,0.0,0.636,0.8462
"雖然我們在第一天下午就發現了酒吧，但直到最後一個晚上我們才到達那裡，而且酒吧已經開放了（這裡的喝酒通常似乎是在黃昏後才開始的）。
我需要強調的是，這是我們偶然發現的該地區唯一的經典酒吧。
音樂很棒，員工非常有同情心，啤酒很涼爽，而且是現點現喝的。
謝謝你所做的一切🤗","Although we discovered the bar on the first afternoon, we did not arrive there until the last night, and the bar has been opened (the drinking here usually seems to start after dusk).
What I need to emphasize is that this is the only classic bar in the region we discovered by chance.
The music is great, the employees are very sympathetic, the beer is very cool, and it is now ordered.
Thank you for everything 的 的 的 的 的",False,0.163,0.0,0.837,0.9298
"真的很酷的牆上洞吧！我沒有喝酒，但如果我喝酒，我可以無限期地留下來。

它小而舒適，很有特色，工作人員會說英語，很友好，樂於助人。

有時一定會回去喝飲料和食物","Really cool walls!I didn't drink, but if I drink, I can stay indefinitely.

It is small and comfortable and very distinctive. The staff will speak English, very friendly, and helpful.

Sometimes I will go back to drink drinks and food",False,0.299,0.0,0.701,0.9466
與美味的當地啤酒一起享用，這家連鎖店特別精製的 IPA 與每種食物都超級美味。我想週末晚上再去一次！,Enjoy it with delicious local beer. The specially refined IPA and each food in this chain store are super delicious.I want to go again on weekends!,False,0.36,0.0,0.64,0.908
這是一個有趣的空間，非常適合在旅途中過夜。,"This is an interesting space, which is very suitable for spending overnight on the journey.",False,0.162,0.0,0.838,0.4019
這個地方小而舒適。這是一個漂亮的小角落酒吧，有一個漂亮的主題酒吧。薯條和披薩很美味，啤酒的選擇也很豐富。當我再次訪問這座城市時肯定會考慮回來,"This place is small and comfortable.This is a beautiful small horns, with a beautiful theme bar.French fries and pizza are delicious, and the choice of beer is also rich.When I visit the city again, I will definitely consider returning",False,0.289,0.0,0.711,0.9349
每週一都有不同種類的酒，所以我喝得很便宜，我推薦它！,"There are different types of wine every Monday, so I drink it cheaply, I recommend it!",False,0.157,0.0,0.843,0.4199
"離西門市中心很近，步行時順便來也不錯~
他們提供台灣生產的啤酒，你可以品嚐一些很棒的啤酒。特別是生啤酒感覺很新鮮，因為他們似乎很好地照顧了啤酒花！來西門的人中，推薦給想喝淡啤酒的人~~！","It's close to the center of Ximen, and it is good to come by by the way when walking ~
They provide beer produced in Taiwan, you can taste some great beer.Especially raw beer feels fresh, because they seem to take care of the beer!Among the people who come to Ximen, I recommend it to those who want to drink light beer ~~!",False,0.229,0.0,0.771,0.9421
喝台灣生啤酒！味道有點像大麥茶……所以我毫不猶豫地喝了！老闆會說英語，所以氣氛也很好👍👍。,"Drinking Taiwanese beer!The taste is a bit like barley tea ... so I drank it without hesitation!The boss will speak English, so the atmosphere is also very good.",False,0.194,0.0,0.806,0.7412
歡樂時光 630 點至晚上 9 點，台灣生啤酒 130 美元。服務很好，飲料種類豐富。,"Happy time from 630 to 9 pm, Taiwan raw beer for $ 130.The service is very good, and the types of beverages are rich.",False,0.333,0.0,0.667,0.8883
這是一個小酒吧，有底層和上面一層。如果您一大群人前來，很可能您需要提前預訂或可能需要等待。他們提供多種精釀啤酒和台灣當地釀造的生啤酒。,"This is a small bar, with the bottom and the top layer.If you come from a large group, you are likely you need to book in advance or you may need to wait.They provide a variety of craft beer and raw beer brewed in Taiwan.",False,0.039,0.0,0.961,0.2023
是個喝美味啤酒、與朋友聊天、放鬆身心的好地方。氣氛很好，精釀啤酒的選擇也很好。小吃的選擇不多，但每樣都很好吃。機構本身並不大，但在我看來，這對氣氛來說是相當有利的。,"It is a good place to drink delicious beer, chat with friends, and relax.The atmosphere is good, and the choice of craft beer is also very good.There are not many choices of snacks, but every time it is delicious.The institution itself is not big, but in my opinion, this is quite beneficial to the atmosphere.",False,0.201,0.0,0.799,0.8907
"精釀啤酒有很多種
氣氛也很好◎
我順便過來是因為我周圍的商店很早就關門了，但他們營業到很晚。","There are many types of craft beer
The atmosphere is also very good ◎
By the way, I came here because the shops around me closed their doors very early, but they were open very late.",False,0.057,0.0,0.943,0.2724
酷說話容易。非常好的精釀啤酒。詹姆斯布朗、妮娜西蒙、柯蒂斯梅菲爾德對聲音系統的看法很酷。,"It's easy to speak.Very good craft beer.James Brown, Nina Simon, Curtis Meifeld's view of the sound system is cool.",False,0.336,0.0,0.664,0.7964
"這是一家充滿時尚氛圍的酒吧。
可以喝到各種台灣精釀啤酒。","This is a bar full of fashion atmosphere.
You can drink various Taiwanese craft beer.",False,0.0,0.0,1.0,0.0
這家店的老闆很友善。店前的氣氛嬌小的如果還有機會再來台北一定會來這家店的。,"The owner of this shop is very friendly.The atmosphere in front of the store is petite. If you still have a chance to come to Taipei again, you will come to this store.",False,0.059,0.0,0.941,0.25
良好的氛圍，超級友好的員工，還有大量的精釀啤酒供您嘗試！歡迎所有外國人，因為這裡的每個人都能說流利的英語❤️❤️,"A good atmosphere, super -friendly employees, and a large number of craft beer for you to try!Welcome all foreigners, because everyone here can speak fluent English ❤️❤️",False,0.308,0.0,0.692,0.8908
對我個人來說太擁擠了，但它在西門，所以有什麼可期待的。氣氛很好，工作人員非常友好，啤酒很美味。,"It is too crowded to me, but it is in Ximen, so what to look forward to.The atmosphere is very good, the staff is very friendly, and the beer is delicious.",False,0.335,0.0,0.665,0.944
非常可愛的啤酒吧，有很棒的飲料可供選擇，員工也很棒！,"Very cute beer bar, there are great beverages to choose from, and employees are also great!",False,0.475,0.0,0.525,0.915
您可以品嚐到來自台北地區的數十種精釀啤酒。只是瓶裝啤酒，水龍頭是我們自己的淡色艾爾和普通的台灣啤酒。啤酒的味道在很多方面都是台灣的，但你可以品嚐到各種各樣的瓶裝當地啤酒。工作人員英語說得很好，所以很容易獲得推薦。當然，如果你對啤酒不是特別有興趣，我建議去別的地方。,"You can taste dozens of craft beer from Taipei.It's just a bottle of beer. The faucet is our own pale Alle and ordinary Taiwanese beer.The taste of beer is in many ways in many ways, but you can taste a variety of bottled local beer.The staff's English is very good, so it is easy to get recommended.Of course, if you are not particularly interested in beer, I suggest going to other places.",False,0.106,0.04,0.855,0.7448
在大多數餐廳裡，您甚至不知道這裡有精釀啤酒。您當然也不會期望茶啤酒或茉莉花IPA 是個好主意。但是...這個地方有很多意想不到的選擇，會讓您感到驚訝和驚喜。我強烈推薦它。食物沒什麼特別的……基本的西式油膩酒吧食物（我猜如果你碰巧想吃的話那就太好了），但是氛圍、服務和啤酒選擇才是這個地方很棒的真正原因。這也是一個促進互動的環境。我在那裡遇到了很多有趣的人！你花多少錢取決於你選擇了多少啤酒...,"In most restaurants, you don't even know that there are craft beer here.Of course you don't expect tea beer or jasmine ipa to be a good idea.But ... there are many unexpected choices in this place, which will surprise and surprise you.I highly recommend it.There is nothing special about food ... Basic Western -style greasy bar food (I guess it would be great if you happened to want to eat), but the atmosphere, service and beer choices are the real reason for this place.This is also an environment to promote interaction.I met a lot of interesting people there!How much do you spend depends on how much beer you choose ...",False,0.148,0.014,0.838,0.9226
其他客人說：“30塊錢，不知道熱不熱，但別去了。”,"Other guests said, ""30 yuan, don't know if it is hot, but don't go.""",False,0.0,0.0,1.0,0.0
就像酒吧一樣。環境很好，還有不錯的精釀啤酒和生啤酒吧。一定會再來這裡喝酒,"Just like a bar.The environment is very good, and there are good craft beer and raw beer bars.I will definitely come here to drink again",False,0.35,0.0,0.65,0.8832
長週末散步後放鬆身心的好地方。良好的氛圍和合理的價格,Relax your body and mind after walking for a long weekend.Good atmosphere and reasonable price,False,0.172,0.0,0.828,0.4404
迄今為止我發現的最好的當地啤酒。一切都可以留下或離開，後者可享 10% 的折扣。只有兩種桶裝啤酒，但瓶子的選擇令人印象深刻。氣氛輕鬆友善。,"The best local beer I discovered so far.Everything can be left or left, and the latter can enjoy a 10% discount.There are only two types of barrel beer, but the choice of bottle is impressive.The atmosphere is relaxed and friendly.",False,0.27,0.0,0.73,0.9231
發現了這家很酷的小型精釀啤酒吧，裡面有精選的本地和進口啤酒。這個地方有一種舒適和涼爽的感覺，客戶服務非常好。我希望下次來西門町時能回來。,"I found this cool small craft beer bar, which contains selected local and imported beer.There is a feeling of comfort and coolness in this place, and customer service is very good.I hope to come back next time I come to Ximending.",False,0.209,0.0,0.791,0.8318
炸魚薯條和謝潑德派還不錯，只是價格偏貴。魚和薯條 420nt。,"Fried fish and fries are not bad, but the price is expensive.Fish and fries 420NT.",False,0.121,0.0,0.879,0.2323
"一個很棒的酒吧來結束一天
他們自己釀造的淡色啤酒品質相當好。","A great bar to end one day
The quality of light beer they brew is quite good.",False,0.327,0.0,0.673,0.807
"酗酒愛好者的地方
尤其是啤酒
啤酒有很多種☺️

酒吧有二樓
也許下次我們可以試試🤩

S觀點：如果你想嘗試多種不同的啤酒，你應該來這裡。

希望你跟我一樣喜歡這裡😆","Where the alcoholic enthusiasts
Especially beer
There are many kinds of beer 很多️

Bar has a second floor
Maybe next time we can try 我们

S: If you want to try a variety of different beer, you should come here.

I hope you like it like me here 一样",False,0.202,0.049,0.749,0.7761
店裡的精釀啤酒味道真好。,The craft beer in the store tastes good.,False,0.293,0.0,0.707,0.4404
正在尋找觀看世界盃的地方，來到了 58 酒吧。,I was looking for a place to watch the World Cup and came to the 58 bar.,False,0.0,0.0,1.0,0.0
58 招牌精釀啤酒和爆米花雞肉很棒,58 signature craft beer and popcorn chicken are great,False,0.339,0.0,0.661,0.6249
樓下的地方很小，要做好準備，與其他人共用桌子時可能會很擁擠。來自美國昂貴的地區，我仍然對這個地方的昂貴程度感到驚訝。 10到11塊的炸雞售價為新台幣300元。,"The place downstairs is very small. Be prepared, and it may be crowded when sharing the table with others.From the expensive regions of the United States, I am still surprised by the extent of this place.The price of 10 to 11 fried chicken is priced at NT $ 300.",False,0.177,0.0,0.823,0.8255
"舒適的隱藏酒吧，最好的印象
許多瓶台灣當地精釀啤酒","Comfortable hidden bar, the best impression
Many bottles of local craft beer in Taiwan",False,0.461,0.0,0.539,0.8555
"這家酒吧不僅提供啤酒，而且提供的所有小吃都很美味。
最重要的是，這個酒吧的音樂播放清單讓我興奮不已。
大床，交流/直流，
還有星街OST！
事實上，這家酒吧的工作人員和我一樣喜歡這部電影（歌曲街），這讓我感到驚訝和高興。
在這個酒吧待上兩個小時是我在台北經歷過的最好的經歷之一。","This bar not only provides beer, but also all the snacks provided are delicious.
Most importantly, the music playlist of this bar excited me.
Big bed, communication/DC,
There is also Star Street OST!
In fact, the staff of this bar likes this movie (song street) like me, which surprised and happy.
Two hours in this bar are one of the best experiences I have experienced in Taipei.",False,0.352,0.0,0.648,0.9872
"非常好！
這是西門町附近的一家酒吧。
我喜歡這種情感
你很善良。
真好吃💕❤️","very good!
This is a bar near Ximending.
I like this emotion
You are kind.
It's so delicious 💕 ❤️",False,0.513,0.0,0.487,0.958
我和妻子去台北玩了幾天，在西門町散步並在 58 酒吧喝了一杯，度過了最美好的時光。啤酒和雞尾酒菜單很豐富，我很高興在我的 Untapp'd 帳戶中大量添加台灣當地啤酒。強烈推薦！,"My wife and I went to Taipei for a few days, walked in Ximending and drank a drink in the 58 bar, and spent the best time.Beer and cocktail menu is very rich. I am very happy to add a lot of local beer in my Untapp'D account.Recommended strongly!",False,0.243,0.0,0.757,0.938
"音樂很棒，服務員很友善
還有各種各樣的啤酒","The music is great, the waiter is very friendly
There are also various beer",False,0.388,0.0,0.612,0.8221
這裡有各種各樣的精釀啤酒……如果你對台灣產的啤酒感到好奇，就去那裡吧。,"There are all kinds of craft beer here ... If you are curious about the beer made of Taiwan, go there.",False,0.103,0.0,0.897,0.3182
舒適的角落有很多瓶裝精釀啤酒。喜歡 58 IPA 草案。,There are many bottle of craft beer in a comfortable corner.Like 58 IPA draft.,False,0.202,0.0,0.798,0.5106
我參加了他們舉辦的一個活動，他們不讓我參加，直到我買了一些飲料。然後當我試圖取回我的卡時，我被忽略了。當我檢查帳單時，同一瓶啤酒被收取了兩次費用。,"I participated in a event they held, and they did not let me participate until I bought some drinks.Then when I tried to get back my card, I was ignored.When I checked the bill, the same bottle of beer was charged twice.",False,0.0,0.042,0.958,-0.2023
"服務棒極了！喜歡這裡是一個非常舒適的地方，為我們服務的那位女士（齊肩長髮）非常有禮貌和貼心。我沒有寫這篇評論，因為他們免費給了我一碗薯條。甚至在我看菜單之前我就真誠地寫了這篇文章。

順便說一句，薯條很好吃！你必須嘗試一下","The service is great!I like this very comfortable place, the lady (long hair) who serves us is very polite and intimate.I didn't write this comment because they gave me a bowl of fries for free.Even before I looked at the menu, I wrote this article sincerely.

By the way, the fries are delicious!You must try it",False,0.156,0.0,0.844,0.8682
各種台灣本土啤酒。這是一個和朋友喝酒的好地方,All kinds of local beer in Taiwan.This is a good place to drink with friends,False,0.316,0.0,0.684,0.7184
台灣生產的啤酒種類之多，令人難以置信。不錯的小另類酒吧,"There are many types of beer produced in Taiwan, which is incredible.Good small alternative bar",False,0.0,0.0,1.0,0.0
很棒的啤酒選擇和非常友好的工作人員。嚐嚐烏龍茶啤酒！,A great beer choice and very friendly staff.Taste oolong tea beer!,False,0.467,0.0,0.533,0.8353
台灣啤酒的大集合。我們喜歡鳳梨味和荔枝味❤️,The large collection of Taiwan beer.We like pineapple flavor and litchi flavor ❤️,False,0.161,0.0,0.839,0.3612
不錯的酒吧，啤酒價格不錯。歡樂時光至 21 點,"Good bar, beer price is good.Happy time until 21 o'clock",False,0.244,0.0,0.756,0.4404
"58 beer 很好喝
service 也很好
especially pizza 很好吃","58 Beer is delicious
Service is also very good
Especially pizza is delicious",False,0.521,0.0,0.479,0.8969
"友善的氣氛
和朋友一起喝酒很開心😊","Friendly atmosphere
I am very happy to drink with friends 酒",False,0.563,0.0,0.437,0.8832
最好的員工。讓我們的旅行變得很棒。,The best employee.Make our trip great.,False,0.675,0.0,0.325,0.8519
喜歡這裡的氣氛。超級涼爽和舒適。服務很棒！,Like the atmosphere here.Super cool and comfortable.The service is great!,False,0.568,0.0,0.432,0.8478
這是一家小酒吧，主要供應精釀啤酒。很容易享受，店裡的工作人員也非常樂於助人。受到推崇的。,"This is a small bar, which mainly supplies craft beer.It is easy to enjoy, and the staff in the store are also very helpful.Promoted.",False,0.217,0.0,0.783,0.7269
台灣本土自釀啤酒全集！如果您喜歡當地啤酒，那麼您一定可以在這裡找到您喜歡的東西。,"Taiwan's local self -brewed beer complete works!If you like local beer, you can definitely find what you like here.",False,0.333,0.0,0.667,0.7901
不錯的酒吧，提供多種啤酒可供選擇。停下來喝杯啤酒放鬆的好地方。大部分都是瓶裝啤酒。,Good bars provide a variety of beer to choose from.Stop to drink a glass of beer to relax.Most of them are bottle beer.,False,0.116,0.0,0.884,0.4404
來喝啤酒和食物，但很明顯，當我們吃完第一杯啤酒後，沒有人來為我們服務時，我們根本不重要。服務生坐在後面只有兩公尺遠的地方，但由於他不來，想看看我們是否要再來一杯啤酒，我們只好去找他要帳單，所以我們就付了錢就離開了。,"Come to drink beer and food, but it is obvious that when we eat the first glass of beer and no one comes to serve us, we are not important at all.The waiter was sitting only two meters far behind, but because he didn't come, he wanted to see if we had to come with another glass of beer. We had to go to him to ask for a bill, so we paid the money and left.",False,0.0,0.059,0.941,-0.5702
很高興在中國情人節煙火晚會之後享用,I am glad to enjoy it after the Chinese Valentine's Day Fireworks Gala,False,0.36,0.0,0.64,0.7351
