Original,EN,Needs Review,Positive,Negative,Neutral,Compound
他們有多種杯裝葡萄酒可供選擇。您可以在台灣找到許多有趣的葡萄品種。強烈推薦！,They have a variety of cups of wine to choose from.You can find many interesting grape varieties in Taiwan.Recommended strongly!,False,0.221,0.0,0.779,0.6239
友好的工作人員非常寒冷的地方！與朋友一起度過的美好夜晚！,Friendly staff is very cold!A wonderful night spent with friends!,False,0.608,0.0,0.392,0.8971
酒吧...真的嗎？  酒吧後面的人根本不關心他的顧客，紅酒供應得太冷了，對葡萄酒沒有任何解釋。  迄今為止我訪問台灣最大也是唯一的失望。,"Bar ... Really?The people behind the bar did not care about his customers. The red wine was too cold, and there was no explanation of wine.So far I have visited Taiwan's biggest and only disappointment.",False,0.0,0.203,0.797,-0.798
酒窖裡有各種有趣的葡萄酒。爵士樂般的休息室氛圍。喜歡這個地方喝一杯舒適的紅色！,There are various interesting wines in the wine cellar.Jazz -like lounge atmosphere.Like this place to drink a cup of comfortable red!,False,0.328,0.0,0.672,0.8313
真的很酷的氛圍。戶外座位很棒。價格實惠的葡萄酒。,A cool atmosphere.Outdoor seats are great.Price wine.,False,0.277,0.0,0.723,0.3182
祝你有個美好的夜晚~🥰 …,I wish you a beautiful night ~ 🥰 ...,False,0.607,0.0,0.393,0.9313
天然葡萄酒的絕佳體驗，一定要去！,"The excellent experience of natural wine, be sure to go!",False,0.557,0.0,0.443,0.8313
台北排名前 5 名的酒吧。,The top 5 bars in Taipei.,False,0.265,0.0,0.735,0.2023
台北唯一一家生物酒專賣店？,The only biological wine store in Taipei?,False,0.0,0.0,1.0,0.0
氣氛很好，有很多選擇。,"The atmosphere is very good, there are many options.",False,0.285,0.0,0.715,0.4927
很酷的地方，有很好的人。,"A cool place, there are very good people.",False,0.478,0.0,0.522,0.6697
晚上放空喝酒好地方,Put in a good place to drink at night,False,0.266,0.0,0.734,0.4404
葡萄酒專業人士,Wine professionals,False,0.0,0.0,1.0,0.0
極好的！,Excellent!,False,1.0,0.0,0.0,0.6114
超棒的地方,Great place,False,0.804,0.0,0.196,0.6249
