Original,EN,Needs Review,Positive,Negative,Neutral,Compound
小小的店很舒適。酒款多，自然酒也多。,"The small shop is very comfortable.There are many wines, and there are many natural wines.",False,0.152,0.0,0.848,0.3612
店員很專業，對酒類介紹詳細，店內音樂跟氛圍都很棒,"The clerk is very professional, the introduction of the wine is detailed, the music and the atmosphere in the store are great",False,0.163,0.0,0.837,0.6249
"環境舒適，提供的酒類選擇非常的多主要以紅白酒為主，老闆可依據喜好推薦酒品，這次喝的三支紅酒都很不錯，價格可接受。外帶的話會有折扣。
有戶外區及地下室座位，可先預定座位晚上客人較多。","The environment is comfortable, and the choice of alcohol provided is mainly mainly red and white wine. The boss can recommend wine based on preferences. The three red wines you drink this time are very good, and the price is acceptable.There will be discounts if you take it.
There are outdoor areas and basement seats. You can book more seats at night.",False,0.132,0.0,0.868,0.8399
自然酒好喝，火腿拼盤可以點，若點單杯酒而不是單瓶，要非常主動詢問店員才會仔細介紹產品，部分座位音樂偏大聲，光線有些太亮,"Natural wine is delicious. The ham platter can be ordered. If you order a single glass of wine instead of a single bottle, you must take the initiative to ask the clerk to introduce the product carefully. Some seats are loud and the light is too bright.",False,0.198,0.0,0.802,0.8625
自然酒選擇多、地點在安靜小巷、有戶外桌,"There are many natural wine selection, the place is in the quiet alley, there are outdoor tables",False,0.135,0.0,0.865,0.3612
"能選的酒種滿多的，單杯160價格很實惠

能自己叫外賣只需付清潔費（100/人）即可","There are a lot of wine that can be selected, and the price of a single cup 160 is very affordable

You can call your own takeaway and just pay the cleaning fee (100/person)",False,0.0,0.041,0.959,-0.1027
酒是不錯，但店員的態度令人膽怯，我們其實很好奇許多酒款，但幾句話之後沒人敢發問，店員感覺心情超不好，很不耐煩又冷淡，怕爆,"The wine is good, but the shop staff's attitude is timid. We are actually curious about many wines, but no one dares to ask after a few words.",False,0.143,0.155,0.702,-0.1027
店裡的人都蠻專業，介紹酒款都非常詳細，這裡的自然酒可以找到很多驚喜感，非常推薦偶爾來一下。晚上九點人會開始爆滿，可以盡早來喝酒,"The people in the store are quite professional, and the introduction of wine is very detailed. The natural wine here can find a lot of surprises. It is recommended to come occasionally.Nine o'clock in the evening will start full, and you can drink as soon as possible",False,0.128,0.0,0.872,0.6666
"之前朋友知道我喜歡喝酒，介紹了這家店。星期五特地來放鬆一下。去過一次後私心收藏起來，因為環境跟氛圍都好舒服。
這裡的酒以紅白酒為主，自然酒的選擇特別多，傾向像是tapas bar的那種。
因為喝得太高興了所以這次只拍了兩張照片😂
這裡的紅白酒選擇不少，價格也不高，連不常見的格魯吉亞酒也有耶！ （amber wine) 之前在格魯吉亞沒有喝過這種（都只喝過紅白酒和啤酒），沒想到會在這裡看見新東西😂
這裡的酒是可以外帶的，在別的地方也沒有很常見，喜歡的話買回家喝會更划算
不過店內的氣氛很好，店員也很好聊，平常的星期五會有音樂表演，碰巧去的那天樂隊成員要回家投票所以表演暫停一次。","I used to know that I liked to drink and introduced this shop.Come and relax on Friday.After I visited once, I was collected privately because the environment and atmosphere were so comfortable.
The wine here is mainly red and white wine. There are many choices of natural wine. The tendency is like the type of Tapas Bar.
Because I was so happy, I took only two photos this time 😂
There are a lot of red and white wine here, and the price is not high, and even the uncommon Georgian wine is available!(Amber Wine) I haven't drank this kind of Georgia before (I have only drank red and white wine and beer), but I did not expect to see a new thing here.
The wine here can take it out, and it is not very common elsewhere. If you like it, it will be more cost -effective to buy it home and drink
However, the atmosphere in the store is very good, and the clerk is also very good to talk. Usually there will be music performances on Friday. The band members will go home to vote on the day when they happen to go.",False,0.144,0.007,0.849,0.9826
西班牙風味的個性小店 在八德路的巷子裡 有特色酒 有品牌酒 最高級的是自己心裡的酒  開心的周日下午 喜歡3:00鐘的酒精,Spanish -style personalized shops have special wines in the alleys of Bade Road. The brand wine is the highest.,False,0.13,0.0,0.87,0.4019
"友善良好，傳達對酒的熱情，永遠都有新發現。
浪漫感性，找到屬於自己的角落，品飲酒文化之豐富底蘊。
繽紛燦爛，由此出發，酒的嚮導帶我環遊世界。
愛酒的人都很棒🖤 謝謝大象🐘 …","Good friendship, conveying the enthusiasm for wine, will always find new discoveries.
Romantic sensation, find your own corner, and the richness of drinking culture.
Colorful and splendid, starting from this, the guidance of the wine brought me around the world.
Everyone who loves wine is great 大 Thank you Elephant ...",False,0.406,0.0,0.594,0.9812
日本朋友帶我們來的，喝了有機白酒和自然白酒，學到好多自然酒的事，yay~,"Japanese friends brought us, drank organic liquor and natural liquor, and learned a lot of natural wine, yay ~",False,0.434,0.0,0.566,0.8885
"這是下午的第一站,疫情間人不多,台北不多可以少數單杯喝的地方,品項很多價格也很美麗,喝單杯再帶酒的話會有很棒的折扣,紅白都有,點了杯vico是濃郁的覆盆莓,酸度不會太高
地下室的品項很多,有所謂的自然酒跟氣泡酒也有,我上次買了一瓶白的送朋友她們也很喜歡,有空可以來坐坐","This is the first stop in the afternoon. There are not many people in the epidemic. There are not many places where there can be a few single cups in Taipei. Many items are also very beautiful. If you drink a single cup, you will have great discounts. Yes, ordered a cup of Vico is a strong raspberry, the acidity will not be too high
There are many items in the basement, and there are so -called natural wine and bubble wine. I bought a bottle of white to send friends last time. They also liked them.",False,0.201,0.019,0.78,0.9673
"有原酒、自然酒多種選擇~
酒很好喝，可以喝到外面沒看過的酒，外帶酒也有提供折扣~","There are many choices of original wine and natural wine ~
The wine is delicious, you can drink the wine that you haven't seen outside, and there are discounts for taking wine ~",False,0.221,0.0,0.779,0.8176
"一個葡萄酒單杯很便宜，的wine bar，西班牙酒很便宜、種類也非常多樣化，法國酒也很推薦，現場還有爵士鼓演奏可以欣賞(但是隨機的!)。
非常適合想要來喝一杯葡萄酒或是嘗試很多不同類型葡萄酒的人來，每一杯的單價大約就是一支酒的牌價除於8～10杯的價格!!","A wine single cup is very cheap, Wine Bar, Spanish wine is very cheap, variety and diverse, French wine is also recommended. There are jazz drum performances on the scene to enjoy (but random!).
It is very suitable for people who want to drink a glass of wine or try a lot of different types of wine. The unit price of each cup is about the price of a brand except for 8-10 cups !!",False,0.075,0.0,0.925,0.5894
小小的空間但坐起來挺舒服，老闆選酒選的好，價格蠻實在的，外帶還有折扣！,The small space is very comfortable to sit up. The boss chooses a good choice. The price is quite solid.,False,0.33,0.0,0.67,0.8119
適合小酌的地方！店內位置不多，酒類品項十分有趣！極度推薦,"Suitable for drinking!There are not many locations in the store, and wine items are very interesting!Extreme recommendation",False,0.0,0.0,1.0,0.0
蠻有特色的酒吧，喜歡自然酒的人可以來。提供單杯用coravin。,"There are quite distinctive bars, and people who like natural wine can come.Provide a single cup with Coravin.",False,0.238,0.0,0.762,0.6124
舒適親切的空間，有多種葡萄酒可供嘗試，推薦！只是稍微不易到達,"A comfortable and friendly space, there are a variety of wines to try, recommend!It's just a little hard to reach",False,0.271,0.091,0.638,0.7595
"偶然發現的店家
讚耶，好店，好酒，店員專業","The shops discovered by accident
Zanye, good shop, good wine, clerk professional",False,0.324,0.173,0.503,0.4019
紅白酒氣泡酒藏酒很多 單杯或整支的都有 很棒的店,Many single cups or whole -expenses of red and white wine bubble wine have great shops,False,0.215,0.0,0.785,0.6249
"很讓人覺得舒服的地方。有室外座位和室內座位。裡面小小的，只有幾桌，可是落地窗打開感覺就寬大。服務人員都很有耐心的解釋每種酒款，讓你選到最適合你心情和口味的一杯/瓶酒。自然酒選擇也很多。大大推薦！

Highly recommend! Amazing selection of natural and convention wine by the bottle or glass. The staff there are friendly and willing to explain and answer any questions you may have. Also a tiny selection of bar snacks like cured meats and cheese. Allows outside food.

The place is very intimate with only a few tables, but it does have an outdoor section. The indoor section has sliding doors that open all the way, which basically makes it feel like outdoor seating.","It makes people feel comfortable.There are outdoor seats and indoor seats.There are only a few tables inside, but the floor -to -ceiling window feels wide.The service staff has a patient explanation of each wine, allowing you to choose a glass/bottle of wine that is best for your mood and taste.Natural wine choices are also many.Great recommendation!

Highly Recomge! Amazing Selection of Nature and Convention Wine by the Bottle or Glass. The Staff theRe Friendly and Willing to Explain and ANSAER ANY Questions OU May have. Also a tiny selection of Bar Snacks like cured meats and cheese. Allows outside fish.

The Place is very intimate with only a few tables, but it does have an outdoor sections. akes it feeling outdoor seative.",False,0.154,0.0,0.846,0.9729
酒類選擇很多，晚上在戶外座位小酌很舒服,"There are a lot of wine choices, it is very comfortable to drink at the outdoor seat at night",False,0.166,0.0,0.834,0.5563
"店內座位不多，沒有供正餐，有起司麵包火腿等一些點心可搭配，比較像是讓人閒聊輕鬆喝酒的小酒館，外帶食物會酌收清潔費100元

可以選擇單杯或開瓶，單杯基本上就是看當天開什麼酒，一次會有四罐左右讓客人選，價位當天有聽到200-400左右，如果那罐被客人點完，會再開新的，所以選擇上其實蠻豐富的，也會介紹國家葡萄品飲特色，新手也不用太擔心

酒單部份有耳聞店內滿多自然酒，當天也聽到滿多是自然酒的，如開單罐，可享外帶同瓶酒六折的折扣","There are not many seats in the store, there are no meals, there are some snacks such as bread ham, which can be matched. It is more like a tavern that makes people drink and drink easily.

You can choose a single cup or bottle. The single cup is basically to see what wine was opened on the day. There will be about four cans for the guests to choose. On the day of the price, there will be about 200-400. New, so the choice is actually quite rich, and it will also introduce the characteristics of national grape drinks, and novices need to worry too much about

There are a lot of natural wine in the shop. I also heard a lot of natural wine on the same day. If you open a single can, you can enjoy a 40 % discount on the same bottle of wine.",False,0.106,0.031,0.863,0.9039
還不錯的一個喝紅酒的地方,A good place to drink red wine,False,0.326,0.0,0.674,0.4404
自然酒的好地方，選擇很多，價格也不錯，內用還有打折，,"There are a good place for natural wine, there are a lot of choices, and the price is good, and there are discounts internally.",False,0.283,0.0,0.717,0.8074
可以單杯品酒，消費平價，還要推薦老闆煮水餃,"You can make a single cup of wine, consumption is affordable, and the boss is recommended to cook dumplings",False,0.09,0.065,0.846,0.128
"謝謝店長的解說
門市人員人很親切, 有價格漂亮而且種類多樣的自然酒
那照店長的說法，他家選的酒都比較不甜, 有酸度","Thank you for your explanation
Store staff are very kind, have beautiful prices and diverse types of natural wine
Then the manager said that the wine he chose at home is not sweet, and there is acidity",False,0.272,0.052,0.676,0.8854
自然酒為主，店員很樂意做介紹，可以單杯喝也可以開瓶,"Natural wine is mainly based, the clerk is happy to introduce, you can drink a single cup or open a bottle",False,0.246,0.0,0.754,0.7351
有多樣單杯品質不錯紅酒白酒，適合喜愛實際與酒接觸認識嚐鮮的人，讓人可以放鬆以酒相聚的私密基地，有興趣的人可以多留意店家參與或舉辦的活動,"There are a variety of single cups of good quality wine and white wine, suitable for those who love actual contact with wine, so that people can relax the private bases that gather with wine. Those who are interested can pay more attention to the participation of the store participation or organizing activities.",False,0.205,0.023,0.773,0.9062
氣氛舒服自在，酒類選擇眾多，值得再訪～,"The atmosphere is comfortable, there are many choices of alcohol, it is worth visiting ~",False,0.286,0.0,0.714,0.6369
可以喝單杯葡萄酒的好地方，尤其是自然酒，經常有新的酒可以喝，並且推薦的酒喝起來都相當令人滿意。,"You can drink a good place to drink a glass of wine, especially natural wine. There are often new wines to drink, and the recommended wine is quite satisfactory.",False,0.292,0.0,0.708,0.8514
有超過50款的單杯紅酒，standing吧，b1有獨立包廂，氣氛好，年輕老闆人也很客氣,"There are more than 50 single cups of red wine, Standing, B1 has an independent box, the atmosphere is good, and the young boss is also very polite",False,0.097,0.0,0.903,0.4404
買酒順便看看徐美鳳在不在家,Take a look at the wine and see Xu Meifeng at home,False,0.0,0.0,1.0,0.0
在住宅區營業到深夜，還放任顧客在店外喧嘩，嚴重影響附近鄰居生活。自私又惡劣的店家！,"It was opened in the residential area until late at night, and the customers were loud outside the store, which seriously affected the lives of nearby neighbors.Selfish and harsh shops!",False,0.0,0.194,0.806,-0.6696
開在住宅區營業到三更半夜，客人大聲暄嘩也不制止，根本擾民。,"Opening in the residential area until the middle of the night, the guests did not stop loudly, and they disturbed the people at all.",False,0.071,0.098,0.831,-0.1808
自然酒種類多，每次去都像尋寶，期待開瓶的驚喜,"There are many types of natural wines, every time I go like treasure hunt, I look forward to the surprise of the bottle opening",False,0.317,0.0,0.683,0.8074
"很棒的地方
專賣西班牙紅白氣泡酒","Great place
Specializing in Spain Red and White Pubb",False,0.339,0.0,0.661,0.6249
店員專業，店雖不大，但很舒服，而且有自然酒，風味令人著迷！,"The clerk is professional. Although the store is not big, it is very comfortable and has natural wines. The flavor is fascinating!",False,0.342,0.0,0.658,0.8716
還不錯 店內讓人感覺舒服 紅酒好喝不酸澀,"It's not bad that the shop makes people feel comfortable with red wine, it's sour and astringent",False,0.291,0.0,0.709,0.7311
老闆們很了解自家酒類，cp值高的一家店,"The bosses know their own wine, a store with a high CP value",False,0.167,0.0,0.833,0.34
紅酒好喝 店員會給予專業推薦,Red wine delicious shop staff will give professional recommendations,False,0.316,0.0,0.684,0.5719
親切 放鬆 享受 的場所,Careful relaxation and enjoyment place,False,0.811,0.0,0.189,0.8225
眾多西班牙葡萄酒，都可點單杯品飲。,Many Spanish wines can order single cups.,False,0.0,0.0,1.0,0.0
可以喝很多種類的單杯，自然酒很棒,"You can drink a lot of single cups, natural wine is great",False,0.398,0.0,0.602,0.765
輕鬆喝酒的好地方，還可以外帶！,"A good place to drink easily, you can also take it!",False,0.383,0.0,0.617,0.68
品嚐不同葡萄酒也吸取很多專業知識的好地方,Taste different wines to learn a lot of professional knowledge,False,0.0,0.0,1.0,0.0
店家很專業，手機沒電還很熱心幫我充電，感謝🙏 …,"The store is very professional, and the mobile phone is very enthusiastic about helping me charge me, thank you ...",False,0.332,0.0,0.668,0.8155
可以外帶食物的酒吧真好~~٩(♡ε♡ )۶,It ’s great to take food with food ~~ ٩ (♡ ε ♡) ۶,False,0.24,0.0,0.76,0.6249
可吃外食，提供單杯紅酒的好去處,"You can eat outside food, and provide a good place to provide a single glass of red wine",False,0.146,0.0,0.854,0.4404
單杯的最佳去處，酒品選擇超多！,"The best place for a single cup, there are many choices of wine!",False,0.272,0.0,0.728,0.6696
可單杯品嚐許多很棒的西班牙紅酒,You can taste a lot of great Spanish red wine in a single cup,False,0.24,0.0,0.76,0.6249
空間小小 但酒的選項充足，非常喜歡,"The space is small but the wine is sufficient, I like it very much",False,0.2,0.0,0.8,0.5023
服務人員小姓很細心的服務，而且態度很好。,"The service staff has a very careful service, and has a good attitude.",False,0.303,0.0,0.697,0.5849
提供西班牙各產區的紅酒，很棒,It is great to provide red wine in various production areas in Spain,False,0.255,0.0,0.745,0.6249
環境優美，葡萄酒多樣化的好地方,"Beautiful environment, a good place for wine",False,0.576,0.0,0.424,0.7783
氣氛很好，親切，酒價合理,"The atmosphere is very good, kind, and reasonable",False,0.534,0.0,0.466,0.7828
氣氛好、酒好喝、價格實在！,"Good atmosphere, delicious wine, real price!",False,0.633,0.0,0.367,0.784
買酒又可以試飲的好地方👍 …,You can try a good place to buy wine 试 ...,False,0.225,0.0,0.775,0.4404
服務親切，適合小酌和聚會,"Careful service, suitable for drinking and gathering",False,0.211,0.0,0.789,0.1531
適合社區小聚，vibe不錯,"Suitable for community gathering, VIBE is good",False,0.326,0.0,0.674,0.4404
自然酒品項豐富～,Natural wines are rich ~,False,0.67,0.0,0.33,0.7269
小燕服務很好～👍 …,Xiaoyan's service is very good ~ 好 ...,False,0.313,0.0,0.687,0.4927
小吧檯妹@@！,Xiaoya Table girl @@!,False,0.0,0.0,1.0,0.0
"喝小酒
放鬆的好所在","Drink a small wine
Relax is good",False,0.537,0.0,0.463,0.7003
讚啦,Praise,False,1.0,0.0,0.0,0.5574
十分出色的酒單。,Very excellent wine list.,False,0.571,0.0,0.429,0.6115
這家附近的酒吧氣氛很好。  不幸的是，這些「天然」葡萄酒的味道更像是比利時蘭比克啤酒，而不是葡萄酒。  令人失望的是無法飲用的葡萄酒。  菜單上沒有價格，伺服器上的價格是任意和隨機的。,"The atmosphere of the bar nearby is very good.Unfortunately, these ""natural"" wine tastes more like Belgian Lami Bik beer, not wine.What is disappointing is the wine that cannot be consumed.There is no price on the menu, and the price on the server is arbitrary and random.",False,0.156,0.042,0.802,0.7171
一顆隱藏的小寶石。非常友好的氣氛和良好的服務。我猜他們可能總是有不同的服務器，從而導致葡萄酒知識水平不同，以及評論中顯示的不同體驗。我們去的時候喝了一瓶清爽的天然橙酒，玩得很開心。顯然，他們在周五晚上也有爵士樂舞台。,"A hidden little gem.Very friendly atmosphere and good service.I guess they may always have different servers, which leads to different levels of wine knowledge and different experiences displayed in the comments.When we went, we drank a bottle of refreshing natural orange wine and played very well.Obviously, they also have a jazz stage on Friday night.",False,0.174,0.0,0.826,0.8665
選擇多種多樣，從天然葡萄酒到傳統葡萄酒，有杯裝（200-400 美元）或瓶裝（800-2000 美元）。購買後可享 20% 折扣！強烈推薦熟食店！,"Choose a variety of diverse, from natural wine to traditional wine, with cups ($ 200-400) or bottle ($ 800).After buying, you can enjoy a 20% discount!Strongly recommend cooked food stores!",False,0.245,0.0,0.755,0.8309
一家挑剔的葡萄酒商店。公園就在您的面前。你可以在這裡喝酒消磨時光，也可以買酒帶到附近的海鮮餐廳。酒存在於日常生活中。就是這樣的一家店。謝謝你請的這頓飯。,"A fussy wine shop.The park is in front of you.You can drink here and spend time, or you can buy wine and bring to a nearby seafood restaurant.Wine is stored in daily life.It's such a shop.Thank you for this meal.",False,0.0,0.0,1.0,0.0
帶露台的小酒吧，擁有令人難以置信的參考資料，與巴黎的同等規模的餐廳相比，簡直相形見絀！義大利起司很好，店主很友好，很樂意為您提供眼鏡，幫助您探索他們的酒窖！氣氛也非常有利於鄰居之間的討論：去那裡喝酒、開會吧！我們在台北的位置:),"The bar with a terrace has an incredible reference material. Compared with the same -scale restaurants in Paris, it is dwarfed!The Italian cheese is very good. The owner is very friendly. He is happy to provide you with glasses and help you explore their wine cellar!The atmosphere is also very conducive to the discussion between neighbors: Go there to drink and meet!Our location in Taipei :)",False,0.218,0.0,0.782,0.9514
完美的小酒吧靠近台北市中心，有一個小露台（這是非常罕見的）。他們進口各種各樣的葡萄酒，但我覺得天然葡萄酒最值得一提。他們有一個令人驚嘆的杯裝葡萄酒計劃，每週都會開放不同的葡萄酒供顧客品嚐。他們還提供起司和火腿。台北最適合喝酒的地方！,"The perfect bar is close to the center of Taipei, and there is a small terrace (this is very rare).They import a variety of wines, but I think natural wine is the most worth mentioning.They have a amazing cup of wine plan, which will open different wines every week for customers to taste.They also provide cheese and ham.Taipei is most suitable for drinking!",False,0.19,0.0,0.81,0.931
葡萄酒的選擇範圍很廣，但紅酒不應該是朋友提供的冷飲，份量很小，不感興趣的人提供的服務令人失望。他沒有提供葡萄酒等的詳細資訊。,"The selection range of wine is wide, but red wine should not be a cold drink provided by friends. The amount is small, and the services provided by people who are not interested are disappointing.He did not provide detailed information about wine.",False,0.088,0.061,0.85,0.31
"在台北同樣舒適溫馨的環境中，品嚐精選的天然葡萄酒，包括橙酒。

燈光和裝飾都很到位。

有幾則評論抱怨男調酒師不感興趣，但女調酒師很棒。她和我們聊了一整夜，給我們詳細解釋了葡萄酒，我們第二次去那裡時，她一直給我們帶來她個人的葡萄酒和巧克力樣品讓我們嘗試！

等不及明年再回去。","In a comfortable and warm environment in Taipei, taste selected natural wines, including orange wine.

The lights and decoration are in place.

There are several comments complaining that the male alcoholics are not interested, but the feminine winemaker is great.She talked to us all night and explained the wine in detail. When we went there for the second time, she kept bringing us her personal wine and chocolate sample for us to try!

Can't wait to go back next year.",False,0.067,0.036,0.896,0.3845
"好酒好音樂讓人放鬆
喜歡這裡的氣氛","Good wine and good music make people relax
Like the atmosphere here",False,0.583,0.0,0.417,0.8807
確實是很好的天然酒。不便宜，但就是這樣。,"It is really a good natural wine.Not cheap, but that's it.",False,0.306,0.0,0.694,0.4536
"氣氛良好的小酒吧，專門供應西班牙葡萄酒。
只有簡單的起司麵包堅果和公司酒。有 60 多瓶玻璃瓶可供訂購。如果你在附近，推薦這個地方喝！","A good atmosphere, specializing in Spanish wine.
Only simple cheese bread nuts and company wine.There are more than 60 bottles of glass bottle to order.If you are nearby, recommend this place to drink!",False,0.15,0.061,0.79,0.5255
"我時間不多，所以我們就買了一些酒，聊了一會兒。
我認為沒有多少商店庫存有這麼多天然葡萄酒。
我覺得在這裡買，去餐廳或是飯店喝還是不錯的。
這是一家我不想告訴你的商店，因為它太棒了。","I don't have much time, so we bought some wine and talked for a while.
I don't think many store inventory has so many natural wines.
I think buying here, going to a restaurant or restaurant is still good.
This is a shop I don't want to tell you because it is great.",False,0.163,0.02,0.817,0.861
