Original,EN,Needs Review,Positive,Negative,Neutral,Compound
"氣氛佳 老闆帥氣
適合來放鬆的好地方","The atmosphere is handsome
Suitable for a good place to relax",False,0.529,0.0,0.471,0.8402
服務讓人不太滿意，有位子卻不讓我們換位，有限時，時間一到一直催人買單，趕我們走，明明現場還有很多空的位置。,"The service is not very satisfactory, but some of them do not let us change their positions. When limited, time, the time has been urged to pay for it, rushing us away, and there are many empty positions on the scene.",False,0.0,0.174,0.826,-0.7016
全台北最喜歡的酒吧沒有之一！bartenders 細心又專業，空間放鬆又舒服❤️❤️,"There is no one in Taipei's favorite bar!Bartenders is careful and professional, relaxed and comfortable in the space ❤️❤️",False,0.372,0.072,0.556,0.8478
酒好喝 食物好吃 非常推薦 有六星絕對可以六星,"Good wine is delicious and delicious, it is recommended that six stars can definitely six stars",False,0.574,0.0,0.426,0.93
很棒的體驗，氣氛跟酒都不錯,"A great experience, the atmosphere and wine are good",False,0.5,0.0,0.5,0.7906
"bartender 特調一定要來嘗試！酒感重、好喝！真心推薦！！！已經成主顧了🤣🤣🤣
尤其是茶類的琴酒很棒😆😆😆
口感都可以跟bartender 溝通想要的味道！大推🥰 …","Bartender must try it!The wine feels heavy and delicious!Recommended sincerely!IntersectionIntersectionHas become the Lord 了
Especially the tea of ​​tea is great 😆😆😆
You can communicate with Bartnder to communicate with the taste you want!Big push ...",False,0.242,0.0,0.758,0.9147
"朋友到臺北玩 一定會帶來這間酒吧
酒非常有水準 而且水餃是隱藏版美食","Friends will bring this bar when they come to Taipei to play
The wine is very standardized and the dumplings are hidden foods",False,0.205,0.049,0.746,0.6369
適合下班放鬆喝一杯的地方,Suitable for relaxing a drink from get off work,False,0.286,0.0,0.714,0.4939
熱騰騰的毛豆原來這麼讚！,The hot edamame was so good!,False,0.446,0.0,0.554,0.6166
椒麻水餃🥟非常好吃！！！！！！ …,Pepper Mahuma dumplings are very delicious!IntersectionIntersectionIntersectionIntersectionIntersectionMowing,False,0.0,0.242,0.758,-0.1511
環境很棒 老闆很親切,"The environment is great, the boss is very kind",False,0.527,0.0,0.473,0.8313
"服務完美
餐酒好吃
氣氛很讚","Perfection
Food wine is delicious
The atmosphere is great",False,0.657,0.0,0.343,0.91
"這家日式酒吧是我至今為止最喜歡的地方之一！一進門，你就會被那個充滿日本現代風格特色的內部裝潢吸引。木質家具和暖色調的燈光創造出一個極為舒適和寧靜的環境。

服務員不僅專業，而且非常友善。他們會詳細介紹各種不同的酒款和飲品，讓你能夠根據自己的喜好做出最佳選擇。我尤其喜歡他們的洛神花調酒，種類多且都非常優質。

食物方面，我推薦他們的水餃和熔岩蛋糕。新鮮、美味，與酒品完美搭配。

如果你正在尋找一個有品質、有氛圍，並且能提供出色服務的日式酒吧，這家絕對值得一試。我會毫不猶豫地再次光臨，也會推薦給所有尋找高品質日式體驗的朋友！","This Japanese bar is one of my favorite places so far!As soon as you enter the door, you will be attracted by the interior decoration full of Japanese modern style.Wooden furniture and warm -colored lights create an extremely comfortable and peaceful environment.

The waiter is not only professional, but also very friendly.They will introduce a variety of different wines and drinks in detail so that you can make the best choice according to your preference.I especially like their Luo Shenhua bartending. There are many types and high quality.

In terms of food, I recommend their dumplings and lava cakes.Fresh, delicious, perfectly matched with wine.

If you are looking for a Japanese -style bar with quality, atmosphere, and can provide excellent services, this one is definitely worth trying.I will come again without hesitation, and I will recommend it to all friends who look for high -quality Japanese experience!",False,0.298,0.008,0.695,0.9948
老闆很幽默 很有人情味哈哈哈   酒好喝～,"The boss is very humorous, very humorous hahaha alcohol is good ~",False,0.616,0.0,0.384,0.9157
期待開放內用的那一刻🥺 …,Looking forward to the moment of opening in interior 🥺 ...,False,0.0,0.0,1.0,0.0
貼心友善,Intimate and friendly,False,0.615,0.0,0.385,0.4939
"調酒不錯，氣氛也很好
比較失望的是巧克力熔岩蛋糕似乎過熟，切開完全沒有熔岩@@","The bartender is good, and the atmosphere is also very good
What is more disappointed is that the chocolate lava cake seems to be too familiar, and there is no lava at all.",False,0.15,0.137,0.713,0.128
"店內氣氛良好、店員親切。
調酒多為經典調酒，也有一些琴酒的特調，大致上口味偏平易近人，也可以要求客製
整體而言體驗非常舒適。","The atmosphere in the store is good and the clerk is kind.
Most of the bartending is classic alcohol, and there are some special tunes of piano wine. The taste is roughly flat and approachable. You can also ask for customs.
Overall experience is very comfortable.",False,0.231,0.0,0.769,0.9117
空間、燈光、氛圍挺不錯。調酒也算中上。不擁擠，聲量適中，不會太昏暗。美中不足：桌椅高低不太符合人體工學，主要是桌面過低。女服務員專業度不足，可能是新手，ㄧ問三不知。（但很客氣）期待繼續進步，願意二訪。,"Space, lighting, and atmosphere are pretty good.The bartending is also considered to be medium.Not crowded, moderate sound volume, not too dim.Insufficient in the United States and China: The height of tables and chairs is not in line with ergonomics, mainly because the desktop is too low.The female waiter is not professional, and it may be a novice.(But very polite) Looking forward to continuing progress, willing to visit the second visit.",False,0.116,0.0,0.884,0.8316
趕快來喝🍻🍻 …,Come and drink ...,False,0.0,0.0,1.0,0.0
酒好好喝☺️服務超好,Wine is good ☺️ The service is super good,False,0.679,0.0,0.321,0.9136
絕對要五星好評的，Bartender 又專業又帥,"Absolutely five -star praise, Bartender is professional and handsome",False,0.502,0.0,0.498,0.7943
適合和朋友來喝酒聊天，氣氛很輕鬆~,"Suitable for drinking and chatting with friends, the atmosphere is very easy ~",False,0.364,0.0,0.636,0.7425
"1. 店內未先告知不能喧嘩，氣氛體驗差（當天跨年）
跨年夜要多安靜？？？？？？？？？？？
2. 一樣店內也未告知店內可吸菸欸，bartender在店內抽菸，想大家吸二手菸到死嗎？","1. I did not tell the noise in the store first, and the atmosphere experience was poor (New Year's Eve on the day)
How quiet do I need to be in New Year's Eve?IntersectionIntersectionIntersectionIntersectionIntersectionIntersectionIntersectionIntersectionIntersectionIntersection
2. The store can not be informed that the store can smoke in the store. Bartender smokes in the store. Do you want everyone to suck the second -hand smoke and die?",False,0.059,0.135,0.805,-0.7757
"支持新開優質店家
外送調酒的品質維持的跟店裡一樣
大推👍👍 …","Support new open high -quality stores
The quality of the delivery of bartender is maintained as in the store
Big push ...",False,0.114,0.0,0.886,0.4019
好想再喝一次有烤過的草莓果醬吐司氣味的熱紅酒🥰 …,I really want to drink the hot red wine with the grilled strawberry jam toast again ...,False,0.091,0.0,0.909,0.1513
"很放鬆 輕鬆的地方
茶酒很有特色","Very relaxed place
Tea wine is very distinctive",False,0.333,0.0,0.667,0.5413
環境幽清，適合三五好友一起聚餐,"The environment is quiet, suitable for three or five friends to dinner together",False,0.205,0.0,0.795,0.4767
忙碌緊湊的生活步調，是該到這裡來，點上一杯chill的酒飲，舒適恬靜的氛圍，絕對可以忘卻煩惱。,"The busy and compact pace of life is to come here, order a cup of Chill's drinking, a comfortable and quiet atmosphere, you can definitely forget your troubles.",False,0.172,0.14,0.688,0.2732
翔太人超好又帥！這裡酒超好喝！！！,Xiang Tai is super good and handsome!The wine here is so delicious!IntersectionIntersection,False,0.425,0.0,0.575,0.8118
服務態度很棒！乾淨放鬆值得來訪,The service attitude is great!Clean and relax worth visiting,False,0.421,0.0,0.579,0.6239
放鬆一下,Relax,False,1.0,0.0,0.0,0.4404
美賣,Sell,False,0.0,0.0,1.0,0.0
推薦酒好喝,Recommended wine is good,False,0.701,0.0,0.299,0.5719
謝謝Danny！酒很好喝,Thank you Danny!Wine is delicious,False,0.684,0.0,0.316,0.7574
"Shota 給我們喝shot,很帥","Shota for us to drink shot, very handsome",False,0.333,0.0,0.667,0.5413
有夠好喝 😍 …,Have enough deliciousness 喝 ...,False,0.412,0.0,0.588,0.4215
翔太老闆人超幽默😂😂 …,Xiang Tai's boss is super humorous ...,False,0.565,0.0,0.435,0.7579
專業 舒服,Professional and comfortable,False,0.623,0.0,0.377,0.5106
好讚,Praise,False,1.0,0.0,0.0,0.5574
讚,praise,False,1.0,0.0,0.0,0.5574
推薦,recommend,False,1.0,0.0,0.0,0.3612
我進去只是提到了我想喝的龍舌蘭酒/梅斯卡爾雞尾酒的種類，並做了簡短的描述，我不得不說，這些調酒師不會錯過！,"I went in just mentioned the types of agave/Messcar cocktail I wanted to drink, and made a brief description. I have to say that these bartenders will not miss it!",False,0.056,0.0,0.944,0.1867
"輕鬆、私密的酒吧提供創意飲品和周到、積極主動的團隊。在這裡聊天很容易，因為桌子之間有足夠的空間，而且音量很小。

酒吧裡有一些清淡的食物，但不應該成為參觀的理由：它們都是剛從冷凍狀態重新加熱的。

酒吧後面的團隊是純粹的一流團隊。當我們到達時，我們遇到了傾盆大雨，看起來就像《魔戒》中的女孩。酒保沒有退縮，歡迎我們，並小心翼翼地在浴室裡放了吹風機。","Easy and private bars provide creative drinks and thoughtful and proactive teams.It is easy to chat here, because there is enough space between the tables, and the volume is small.

There are some light foods in the bar, but they should not be the reason for visiting: they are just heated from the frozen state.

The team behind the bar is a pure first -class team.When we arrived, we encountered heavy rain, looking like a girl in ""The Lord of the Rings"".The bartender did not shrink, welcome us, and carefully put a hair dryer in the bathroom.",False,0.136,0.03,0.834,0.809
我們偶然發現了這顆小寶石，很高興我們做到了。這是一個安靜的雨夜，非常適合與約會對像或朋友一起喝一杯冰鎮飲料，聆聽輕柔的法國曲調。工作人員很細心但不打擾。如果我們住在台北，這將是我們當地的酒吧。,"We accidentally discovered this little gem, and we were very glad that we did it.This is a quiet rainy night. It is very suitable for drinking a glass of ice drinks with a date or friend to listen to the soft French tune.The staff is very careful but not disturbed.If we live in Taipei, this will be our local bar.",False,0.09,0.045,0.866,0.4297
和我妻子度假時偶然發現了這顆寶石。這個酒吧的一切都很棒。兩位調酒師完全一致地工作，在同一時間為我們準備好飲料。我去過的酒吧很少有如此詳細的。這是一次美好的經驗。,I accidentally discovered the gem during vacation with my wife.Everything in this bar is great.The two bartenders work completely and prepare drinks for us at the same time.The bar I have been there is rarely so detailed.This is a wonderful experience.,False,0.082,0.053,0.865,0.3182
一切都很完美😎 …,Everything is perfect ...,False,0.552,0.0,0.448,0.5719
您可以喝到用水果和傳統茶調製的創意雞尾酒。氣氛很好，老闆會說英語和日語。,"You can drink creative cocktails with fruits and traditional tea.The atmosphere is good, the boss will speak English and Japanese.",False,0.244,0.0,0.756,0.7003
有趣的bartender ，酒很好喝😆 …,"Interesting Bartender, the wine is delicious 😆 ...",False,0.56,0.0,0.44,0.836
台北必去的地方,Must go to Taipei,False,0.0,0.0,1.0,0.0
太niceeee的一家店🥳 …,Too niceeee's shop 🥳 ...,False,0.342,0.0,0.658,0.3818
酒好好喝,Wine,False,0.0,0.0,1.0,0.0
酒好好喝,Wine,False,0.0,0.0,1.0,0.0
不好喝,Not good,False,0.0,0.706,0.294,-0.3412
Shota超讚,Shota,False,0.0,0.0,1.0,0.0
喝得好,Drank well,False,0.677,0.0,0.323,0.2732
蕭塔咕咕咕咕,Xiao Tower Cuckoo,False,0.0,0.0,1.0,0.0
好的,OK,False,1.0,0.0,0.0,0.296
