Original,EN,Needs Review,Positive,Negative,Neutral,Compound
"服務人員態度佳，店內氣氛好，適合約會，價格稍高，整體體驗不錯。

第一次來用餐，點了：
- Encounter 遇見／$350
有葡萄柚香氣的調酒，酸中帶點微微苦韻。
- 烤物拼盤／$450
拼盤含法式鴨胸、真菇鵝肝捲、烤雞翅、生菜沙拉。鴨胸的口感有點像香腸，如果再切薄一點口感會更好。鵝肝捲是拼盤內最出色的。烤雞翅調味有一點鹹。沙拉中規中矩。
- 明太子起司披薩／$280
起司的味道很明顯，明太子分布感覺有一些些不平均，餅皮是薄脆口感，整體還不錯吃，推！
- 焗烤泡菜雞肉／$230
會附上六片烤過的小吐司，可以配著焗烤享用。調味適中，雞肉很嫩，泡菜的味道不會太突出，還吃得到起司的香氣，推！

不知道是不是新年的緣故，結帳時還招待兩杯shots，心情都好了起來😆","The service staff has a good attitude, the atmosphere in the store is good, suitable for dating, the price is slightly higher, and the overall experience is good.

Come to dinner for the first time and order:
-ENCOUNTER meets / $ 350
There is a grapefruit aroma bartending, and the acid is slightly bitter.
-Bak -baked Pack / $ 450
The platter contains French duck breasts, real mushrooms, foie gras, roasted chicken wings, and lettuce salads.The taste of duck breasts is a bit like sausage, and it will be better if it is thinner.The foie gras is the best in the platter.The grilled chicken wings are a little salty.Salads are satisfactory.
-Profee Cheese Pizza / $ 280
The taste of the cheese is obvious. The distribution of Prince Ming feels that there are some unevenness. The cake skin is crispy and the whole is pretty good.
-Baked kimchi chicken / $ 230
There will be six grilled small toasts, which can be used with baked to enjoy.Moderate flavoring, chicken is very tender, the taste of kimchi will not be too prominent, and you can eat the aroma of the cheese, push it!

I don’t know if it is the reason for the New Year. I still entertain two cups of Shots at the checkout.",False,0.124,0.019,0.857,0.9743
"酒精濃度低到找不到，調味也不協調～
低消限制得點兩杯才會達到，算是被迫喝兩杯難喝的酒。
結論是目前喝過最難喝的酒吧，不懂分數為什麼這麼高～","The alcohol concentration is low to find, and the seasoning is not coordinated ~
It will be achieved by two cups of low limit, which is forced to drink two cups of difficult wine.
The conclusion is the hardest bar that has been drinking at present, and I don’t know why the score is so high ~",False,0.0,0.155,0.845,-0.8271
座位還算舒適，入座後會提供熱毛巾擦手，酒單以基底作為分類的類別，品項價格大致落在350-400之間。調酒味道還可以，但如果沒有特別說想要喝酒精濃度高一點的話，預設的調酒濃度會偏淡，整體感覺可以再做一些調整會更好,"The seats are quite comfortable. After the seat, it will provide hot towels. The wine list will be based on the category. The price of the item is roughly between 350-400.The taste of bartending is okay, but if you do not specifically say that if you want to drink a little more concentration, the preset bartending concentration will be lighter, and the overall feeling can be made better.",False,0.146,0.0,0.854,0.8315
"先表示此評價是個人觀感，會因人喜好而異。

去過不多不少的酒吧，而這是第一間我想盡快吃完喝完離開，絕不再訪的酒吧。

先說茉莉花茶酒，非常的甜膩，我得一直啜飲著白開水；吧台桌擺放著酒，所以其實客人吧檯區略顯窄，也會一直近距離感受到酒瓶放下的聲音；Bartender介紹菜單沒有讓我感覺到熱情，取而代之的是提醒低消的價位感。

會建議店家可以去Staff only Club和Le chamber餐酒館看看Bartender是如何透過聊天拉近客人距離的，還有參考別家店的酒是如何調的好喝爽口。

以上純屬個人親自蒞訪的感受。","First that this evaluation is a personal perception, which will vary from person to person preferences.

I have been to the bars that I have been to a lot, and this is the first bar I want to eat and drink as soon as possible.

Let's talk about the jasmine tea wine, which is very sweet. I have to sip the boiled water all the time; the bar table is placed with wine, so in fact, the guest bar area is slightly narrower, and I will always feel the sound of the bottle of the bottle. The menu did not make me feel enthusiastic, and instead reminded the low price of low and disappearing.

It is recommended that the store can go to Staff only Club and Le Chamber restaurant to see how Bartender closes the guest distance through chat, and refer to how the wine of other shops is delicious and refreshing.

The above is purely a person who visits individuals in person.",False,0.076,0.024,0.9,0.8439
推推明太子pizza，茶酒跟水果酒都好喝～生日有送shot，謝謝店家🤍整體環境食物酒都讚讚！(⁎⁍̴̛ᴗ⁍̴̛⁎) …,"Push Pasta Pizza, tea wine and fruit wine are delicious ~ there are shots for birthdays, thank you for the overall environment of food and wine!(⁎⁍̴̛ᴗ⁍̴̛⁎) ...",False,0.206,0.0,0.794,0.7574
"太專注跟朋友敘舊都忘記拍照😹
但氣氛跟調酒都還不錯 會想再訪💞 …","I am too focused on my friends to forget to take pictures 😹
But the atmosphere and bartending are not bad, I want to visit again ...",False,0.255,0.108,0.637,0.7777
好地方，菜跟酒都很好，適合下班後放鬆,"Good places, vegetables and wine are very good, suitable for relaxation after get off work",False,0.442,0.0,0.558,0.8588
"店裡很放鬆 像是回到家喝一杯的感覺
推薦","The shop is very relaxed as if I go home to drink a cup
recommend",False,0.316,0.0,0.684,0.7178
一個輕鬆的環境，搭配精準到位的一杯酒,"A relaxed environment, with a cup of wine in place",False,0.262,0.0,0.738,0.4939
"在小巨蛋跟南京三民中間的巷子裡，裡面環境很舒服，服務態度也超優👍🏼用餐前會遞上濕毛巾給我們擦手。點餐的話是掃QRcode看線上菜單後到櫃檯點餐。

這次點的每一樣東西都很好吃。尤其是餐點讓我們很驚豔，他們的披薩是薄皮的，起司加了很多跟明太子的味道很融洽的共存！烤肉拼盤的組合有雞翅、沙拉、厚肉片，都很適合泡酒，價錢也不貴！最後點的泡菜豬肉焗烤，旁邊還有附上烤的脆脆的吐司，我也超喜歡😋

可惜這次沒有椒麻水餃了😭很想吃，希望下次去有機會吃到。

酒的部分，也都不雷，茶酒👍🏼不清楚想喝什麼的人也可以請店家推薦～他們人都很好👍🏼","In the alleys between the big dome and the three people in Nanjing, the environment is very comfortable, and the service attitude is super preferential. Before the meal, we will hand the wet towels to wipe us.If you order, sweep the QRCODE to watch the online menu and order to order at the counter.

Everything at the order this time is delicious.Especially the meals are amazing. Their pizza is thin skin. The cheese adds a lot of coexistence with the taste of Prince Ming!The combination of barbecue platter is chicken wings, salads, and thick meat slices, which are all suitable for brewing wine, and the price is not expensive!The last cooked kimchi pork is grilled, and there is a crunchy toast with a grilled toast next to it. I also like it.

Unfortunately, there is no pepperma dumplings this time. I want to eat it. I hope to have the opportunity to eat next time.

The part of the wine is not thunderous. People who do n’t know what to drink can also ask the store to recommend it ~ They are very good",False,0.152,0.022,0.826,0.9774
"氛圍好，酒好喝（特愛New York sour & Negroni）bar tender 有執事感很棒😆
是個很適合和朋友放鬆喝酒的好地方♥️ …","The atmosphere is good, the wine is good (love new York Sour & Negroni) BAR TENDER has a sense of deacon
It is a good place that is very suitable for relaxing drinking with friends ♥ ️ ...",False,0.425,0.0,0.575,0.974
環境舒適、氣氛很好。服務態度100分。酒好喝、椒麻水餃夠味。調酒的價位偏高（350元/杯），但是很值得。推薦！,"The environment is comfortable and the atmosphere is very good.The service attitude is 100 points.The wine is delicious, and the pepper hemp dumplings are enough.The price of bartender is high (350 yuan/cup), but it is worth it.recommend!",False,0.173,0.028,0.799,0.7177
"有限時2小時，網路訂位沒有告知，有點措手不及…
食物中上，但肉類（鴨胸、鵝肝捲）切薄一點口感會更好；奶油義大利麵有點太油。酒類中等。
服務生蠻積極，會主動幫忙開門、加水、收盤子。剛進門的熱毛巾也很讚～","2 hours limited time, the online booking is not notified, it is a bit caught ...
In the top of the food, but the meat (duck breast, foie gras) is thinner and the taste will be better; the creamy Italian noodles are a bit too oily.The wine is medium.
The waiter is quite active and will take the initiative to help open the door, add water, and close the market.The hot towel just entered the door is also very good ~",False,0.183,0.016,0.802,0.9488
氣氛佳 酒也很好喝唷💓 …,The atmosphere is also delicious 酒 ...,False,0.381,0.0,0.619,0.5719
算是很舒服的酒吧，服務很好,"It's a very comfortable bar, the service is very good",False,0.459,0.0,0.541,0.7774
溫暖的店家，調酒很好喝，值得您ㄧ試喔,"The warm shop, the bartender is delicious, it is worth your try",False,0.455,0.0,0.545,0.7579
"店員友善，調酒好喝、環境漂亮！
適合三五好友聚聚聊天～另外周邊很方便～

酒類嘗試兩杯，茶酒好喝無雷，特調可以依口味稍作調整，很貼心，會提醒口味偏酸偏甜等，儘量符合顧客口味，推薦🙌🏻","The clerk is friendly, the bartender is delicious, and the environment is beautiful!
Suitable for three or five friends to gather and chat ~ In addition, the surroundings are very convenient ~

Try two cups of wine, tea and wine are delicious and thunderous. The special adjustment can be adjusted slightly according to the taste. It is very intimate and reminds the taste of the taste and sweetness.",False,0.281,0.0,0.719,0.9744
一聽到我跟朋友一個今天生日、另一個人明天生日，馬上搬出凍過的vodka招待我們shots+全體員工祝我們生日快樂><太開心啦😆😆 …,"When I heard that my friend and my friends today, the other person will move out of the frozen Vodka to entertain our SHOTS+all employees to wish us a happy birthday> <So happy 😆😆 ...",False,0.425,0.0,0.575,0.9709
調酒順口好喝、鹹食很不錯、環境舒適，每個角落都可以感受到店主的用心佈置，搭配播放的音樂，好久沒有微醺、靜謐、放鬆的感覺，很愉快的體驗！,"The bartending is delicious, the salty food is very good, and the environment is comfortable. In every corner, you can feel the shop owner's intentions. With the music played, there is no sense of tranquility, quietness, and relaxation for a long time. A happy experience!",False,0.368,0.035,0.597,0.9665
"燈光美，氣氛佳。
室內沒有煙味加分！","The light is beautiful and the atmosphere is good.
There is no smoke in the room!",False,0.318,0.099,0.583,0.7088
"店內氣氛很好

調酒蠻好喝的 除了菜單上的品項好像也能客製化調酒

巧克力熔岩蛋糕普通（沒有熔岩","The atmosphere in the store is very good

The bartending is pretty delicious. In addition to the items on the menu, it seems that it can be customized.

Chocolate lava cake is ordinary (no lava",False,0.24,0.0,0.76,0.8777
"去年三級警戒剛開幕時期，室友點了茶酒套組外送，那時候喝到的是《到彼岸》覺得非常驚艷，至今仍念念不忘；時隔一年多再度托前室友聚的福到這間酒吧捧場，到彼岸還是一樣好喝！
另外點的其他調酒也都很好喝，bartender也都很親切頗有氣質。
已把隅意收藏為口袋名單，下次再帶其他朋友來開喝。","During the opening period of the third -level warning last year, the roommate ordered the tea and wine set to deliver. At that time, the ""On the other side"" felt very amazing, and I still missed it to this day. Barbuka, it is still as delicious as the other side!
In addition, other bartending bartender are also delicious, Bartender is also very kind and temperamental.
I have collected the meaning as a pocket list, and take other friends to drink next time.",False,0.189,0.047,0.764,0.943
"酒吧有點不太起眼，住在這附近第一次去吃
不敢喝威士忌的我 點了一杯血與沙（威士忌為基底）的調酒
非常順口！顛覆對威士忌的烈口印象！
會再二訪的一間酒吧","The bar is a bit eye -catching.
I dare not drink whiskey, I ordered a cup of blood and sand (whiskey) bartender
Very smooth!Under the impression of the hardship of whiskey!
A bar I will visit again",False,0.054,0.072,0.874,-0.1828
"環境很好
吧台跟店員都很熱情
很棒 下次再來!!!","Good environment
The bar and the clerk are very enthusiastic
It's great next time !!!",False,0.492,0.0,0.508,0.9124
個人心目中松山酒吧前三名之一，酒吧是走日式風格，環境優雅舒適，調酒師技術精煉，讓你不用到日本就能享受到日式酒吧的服務跟職人精神。,"One of the top three in Songshan Bar in personal mind. The bar is a Japanese style, elegant and comfortable environment, and the bartender technology is refined, so that you can enjoy the service and the spirit of the staff without using Japan.",False,0.256,0.0,0.744,0.9022
"好喝的調酒當然必須支持🎉
外帶跟內用一樣好喝，不管是經典或是妹酒，Danny跟Jason都能調給你👍🏻 …","Of course, the delicious bartender must be supported 酒
Own is as delicious as inside. Whether it is classic or sister wine, Danny and Jason can be tuned for you ...",False,0.257,0.0,0.743,0.8658
氣氛 & 品質都在水平以上，調酒品質穩定度高，帶朋友來從來沒有失望過。,"The atmosphere & quality is above the level, the quality of alcoholic is high, and it has never been disappointed with friends.",False,0.22,0.0,0.78,0.6862
"經典調酒最高！客製化也很👍👍
選曲跟氛圍愜意舒適❤️ …","The highest classic bartending!Customerization is also very 也
Choose songs and atmosphere comfortable and comfortable ❤️ ...",False,0.301,0.0,0.699,0.784
在朋友推薦下來了隅意，環境舒服，重點酒好喝，每杯酒都很有細微的層次感💕💕 …,"I have recommended it in my friends, the environment is comfortable, the key wine is delicious, and each glass of wine has a slight sense of layering 💕💕 ...",False,0.441,0.0,0.559,0.9661
"有時候老闆太忙顧不了太多
但還是儘量給大家一個溫暖的服務
感受很好","Sometimes the boss can't take care of too much
But try to give you a warm service
Feel very good",False,0.261,0.071,0.668,0.7027
氣氛好、燈光美～微醺之餘亦享受著美食饗宴，值得再訪！,"The atmosphere is good, the light is beautiful ~ I also enjoy the gourmet feast, it is worth visiting!",False,0.448,0.0,0.552,0.9041
"喜歡這間店，大家人都很好，第一次去的時候喝到一杯好喝的蘋果調酒但不知道名字，酒單上也沒有。
心心念念那杯酒，第二次去跟調酒師講了一下，他就重現出那杯酒ㄌ，讚！","I like this store, everyone is very good. When I first went, I drank a cup of delicious apple alcohol but I didn't know the name. There was no wine list.
He thought about that glass of wine, and went to talk to the bartender for the second time, and he reappeared that glass of wine, praise!",False,0.172,0.042,0.786,0.8219
老闆調酒真的讚，推推，宇治梅酒很棒可以點,"The boss is really praised by bartending, pushing, Uriji wine is great to order",False,0.388,0.0,0.612,0.8221
調酒很厲害很用心,Blooming is very powerful and attentive,False,0.382,0.0,0.618,0.4754
"推推金萱茶酒 很清爽口味酸甜
服務都很親切 雞翅鴨胸都好吃👍
非常推薦👍 …","Pushing Jin Xuan tea wine is refreshing and sweet, sweet and sour
The services are very good, chicken wings, duck breasts are delicious 👍
I recommend 👍 ...",False,0.381,0.0,0.619,0.9371
"給喜歡喝酒的、下班想小酌的大推薦，
氣氛好，調酒又好喝，Bartender好相處
連食物都很好吃   愛店😄😄 …","Recommend for those who like to drink and want to drink after get off work,
The atmosphere is good, the bartender is delicious, Bartender gets along well
Even the food is delicious.",False,0.428,0.0,0.572,0.9493
"調酒、食物都是水準之上
推水餃  辣味和高麗菜都好吃
也推炸物雞球跟雞塊
調酒的品質很穩定且多樣
室內環境非常舒適，廁所乾淨、漂亮
工作人員也很用心、服務周到，會隨時注意客人的需求，是會再來二訪的酒吧！","Blooming and food are all above the level
Push dumplings and spicy flavor and Korean vegetables are delicious
Also push fried chicken balls and chicken pieces
The quality of bartending is very stable and diverse
The indoor environment is very comfortable, the toilet is clean and beautiful
The staff is also very attentive and thoughtful, and they will always pay attention to the needs of the guests at any time. They will come to the bar for the second visit!",False,0.207,0.029,0.764,0.9574
有氣氛又舒適的酒吧，調酒和飲品都很有水準，菜單多樣，水餃很好吃！店員很親切熱情，服務態度都很好，值得再來！,"Bar with atmosphere and comfortable atmosphere, bartending and drinking are very standard, the menu is diverse, and the dumplings are delicious!The clerk is very enthusiastic, the service attitude is very good, it is worth come again!",False,0.279,0.029,0.692,0.9036
"氣氛喜歡,  老闆很親切, 很適合比較放鬆的跟朋友一起聊天","I like the atmosphere, the boss is very kind, it is very suitable to chat with friends who are more relaxed",False,0.429,0.0,0.571,0.915
"店內的設計跟氣氛超級好～
品嚐bartender 親自調的隱藏酒單，在搭配與朋友們的聊天一整個超級放鬆，而且店員也都超級親切熱情  服務真的是一級棒💪🏻💪🏻  來Bar Histoire 隅意絕對是首選唷 …","The design and atmosphere in the store are super good ~
Taste Bartender's hidden wine list personally, and chat with friends with friends, and the clerk is also super friendly and enthusiastic service.",False,0.473,0.0,0.527,0.9729
空間不錯，但調酒可以再好喝一點,"The space is good, but the bartender can be better",False,0.42,0.0,0.58,0.7003
安靜舒適的空間，店員友善，茶酒系列和經典調酒都很好。,"The quiet and comfortable space, the clerk is friendly, the tea and wine series and the classic bartender are very good.",False,0.35,0.0,0.65,0.8655
食物跟酒很棒，老闆很有趣😂 …,"Food and wine are great, the boss is very interesting ...",False,0.441,0.0,0.559,0.796
酒好喝 餐好吃 調酒師帥～,"Wine delicious meals, delicious bartenders are handsome ~",False,0.679,0.0,0.321,0.891
"隱藏在巷弄中的好地方，
加班加到阿雜時也很適合來，門口有隻黏人可愛的玳瑁貓🐱～
還有有為熱情的老闆們，服務也很好👍
一開始送茶水還附上熱毛巾！義大利麵三種口味都很好吃，跟友人們一致最推薦白醬！
新開兩個月，google地圖街景尚未顯示的到，真是隱藏版的","A good place hidden in the alley,
It is also suitable for overtime to add to Azi. There is a cute and cute cat cat at the door ~
There are also enthusiastic bosses, the service is also very good
At the beginning, the tea is also attached with a hot towel!The three flavors of pasta are delicious, and they are the most recommended white sauce with friends!
For two months, Google Map Street scene has not yet been displayed, it is really a hidden version",False,0.241,0.0,0.759,0.9744
調酒好喝 可惜太晚去時間不夠好好體驗,It's a pity that it is too late to go too late to experience it well enough,False,0.109,0.114,0.777,-0.0258
調酒品項豐富、氣氛很好適合跟朋友一起來小酌聊天，調酒師親切，重點酒很好喝,"The bartending items are rich and the atmosphere is very good for chatting with friends. The bartender is cordial, and the key wine is delicious.",False,0.393,0.0,0.607,0.9273
輕鬆自在的酒吧值得回訪,A relaxed bar is worth visiting,False,0.56,0.0,0.44,0.6249
裝潢很美、調酒好喝（推薦茶系列！）、老闆很親切、門口有浪貓的窩覺得很有愛心❤️玳瑁貓貓好可愛~,"The decoration is very beautiful, the bartender is delicious (recommended tea series!), The boss is very kind, and there is a wave cat at the door.",False,0.383,0.0,0.617,0.9284
"Great ambiance, friendly and professional bartenders.
酒水都很好喝，調酒師跟我一起聊一聊，幫我練習中文。","Great amBiance, Friendly and Professional Bartenders.
The wine is delicious. The bartender talked with me and helped me practice Chinese.",False,0.393,0.0,0.607,0.9001
"U質 價格合理
燈光美氣氛佳
食物跟酒都不錯","UNE quality is reasonable
Beautiful light atmosphere
Food and wine are good",False,0.405,0.0,0.595,0.7783
老闆很親切，店裡氣氛也很棒，喝了幾杯調酒都很喜歡！推推,"The boss is very kind, and the atmosphere in the shop is also great.Push",False,0.221,0.0,0.779,0.5709
茶酒的呈現都很棒，氣氛很好，Bartender也很Nice，讚讚！,"The presentation of tea wine is great, the atmosphere is good, Bartender is also nice, praise!",False,0.533,0.0,0.467,0.9286
"其實很好喝耶
無敵的吧
鴨肉也好吃耶","Actually it is delicious
Invincible
The duck meat is so delicious",False,0.593,0.0,0.407,0.9125
"這家的調酒「伯爵」
還沒喝就可以聞到濃濃的伯爵茶味
輔以英式茶杯組盛裝的外觀
喝下去後發現伯爵茶味跟橘子、檸檬及葡萄柚等柑橘類水果的香氣，以及琴酒完美的融合！真的是嗅覺、視覺跟味覺三感俱佳的酒！另外宇治抹茶梅酒也是挑了一款口味十分融合的，令人感到品味十足。
真心推薦來這家喝～","This bartender ""Earl""
You can smell the thick ear tea without drinking yet
Supplemented with the appearance of the British Tea Cup Group
After drinking it, I found that the aroma of citrus fruits such as the count and oranges, lemon and grapefruit, and the perfect fusion of piano wine!It is really a wine with a sense of smell, vision and taste!In addition, Uji matcha plum wine also picked a very fused taste, which makes people feel full of taste.
I really recommend coming here to drink ~",False,0.096,0.0,0.904,0.8433
"老闆親切，店內氣氛超好！！！
酒很好喝，餐點也很棒","The boss is kind, the atmosphere in the store is super good!IntersectionIntersection
The wine is delicious, and the meal is great",False,0.475,0.0,0.525,0.9468
"Danny師承日本師傅，日文通👌
店內空間適宜，內部有長桌可辦🌟聚會
下班小酌🍸週末放鬆🥃or🍷均可✨ …","Danny teacher inherits Japanese master, Japanese Chinese
The space inside the store is suitable, and there are long tables inside to make a party
Discipline from get off work 放 Relax on weekends 🥃or🍷 can be ✨ ✨ ✨ ✨ ✨ ✨ ✨ ✨ ✨ ✨ ✨ ✨ ✨ ✨ ✨",False,0.52,0.0,0.48,0.9862
"茶酒系列超推！💯💯
Bartender 跟服務生都很讚
因為單子不見 bartender 馬上來補上兩杯shot
餐點好吃 就是份量偏少 建議吃飽再去
很推 烤香腸拼盤 明太子pizza","The tea wine series is super push!Bleak
Bartender and the waiter are very good
Because Bartender will not see Bartender immediately to make up for two cups of SHOT
The delicious meal is that the portion is too small, it is recommended to eat and go again
Very pushing the grilled sausage platter Ming Prince Pizza",False,0.199,0.0,0.801,0.9167
氣氛很好，很放鬆的空間，bartender 也很熱情招待！下次一定還會再來😇 …,"The atmosphere is very good, very relaxed, and Bartender is also very enthusiastic!I will definitely come again next time ...",False,0.375,0.0,0.625,0.8808
調酒很好喝，舒適的空間，非常推薦,"The bartending is delicious, comfortable space, it is very recommended",False,0.565,0.0,0.435,0.8439
酒超讚 每杯特調都好喝 終於找到好酒吧,Jiu Chaozan each cup special tone is delicious and finally found a good bar,False,0.458,0.0,0.542,0.8519
"氣氛、服務都很高分
酒調得非常好喝沒有雷","The atmosphere and service are very high
The wine is very delicious and there is no thunder",False,0.188,0.104,0.708,0.4201
"調酒令人印象深刻，好喝
空間舒適、放鬆","Blooming is impressive and delicious
Space comfort and relaxation",False,0.721,0.0,0.279,0.9169
服務親切環境優。飲品很有特色。,The service is good.Drinks are very distinctive.,False,0.0,0.0,1.0,0.0
東西很小份（紅酒燉牛肉飯印象超深刻的小份，有超過兩塊肉？）、義大利麵超鹹、店員講話超小聲，講完也不管你有沒有聽到甩頭就走,"The things are very small (red wine stewed beef rice is very impressive, there are more than two pieces of meat?), The Italian noodles are super salty, and the clerk speaks super whispering.",False,0.275,0.0,0.725,0.908
