Original,EN,Needs Review,Positive,Negative,Neutral,Compound
"1.海鮮義大利麵中規中矩的好吃，味道偏鹹
2.伊比利豬煎的肉質鮮美軟嫩，小小缺點是醬汁容易打溼下面陪襯的法國麵包，要趕快吃完，但這個是會再回購的餐點
3.如果說前面已經87分了，這道牛小排松露燉飯直接把整體餐點美味指數再拉高到98分，上面5分熟的牛小排鮮甜多汁，肉感十足，上面大塊的起士片用熱熱的燉飯包起來，攪拌一下讓他跟白醬松露燉飯完美融合在一起；接下來最重要的就是燉飯的靈魂了，就是要那種米心剛好熟有點微硬的口感，吃下去忍不住在心裡幫它拍拍手，有夠好吃，還有最重要的事是它的松露白醬罕見的不膩口，吃白醬最怕遇到厚重的奶油麵粉口感，在這邊完全沒發生，松露白醬意外的爽口，即便到最後微涼也不減好吃的程度，堪稱本次最推品項！！
4.我點了一杯無酒精飲料，草莓烏龍（對不起我忘記名字了），上面的那一層奶泡很厲害歷久不衰，草莓的味道不化學，配上茶味非常爽口（那顆草莓乾很好吃），如果不知道要喝什麼的推薦點這杯！絕對不雷！","1. The seafood pasta is delicious and delicious, the taste is salty
2. The flesh of the Ibery Pork fried is delicious and soft. The small disadvantage is that the sauce is easy to wet French bread. It must be eaten quickly, but this is a meal that will be repurchased again.
3. If the previous 87 points are already 87 points, this cow small row of pine -dew stew directly raised the overall meal delicious index to 98 points. The cheese fillet is wrapped in hot stew, stirring it to make him perfectly integrated with the white sauce loosely stewed rice; the most important thing is the soul of the stewed rice, that is, the kind of rice heart is just a bit cooked. It is a bit cooked. The slightly hard taste, I can't help but pat it in my heart to help it pat, it is delicious enough, and the most important thing is that its truffle white sauce is rare and not greasy. Eating white sauce is most afraid of encountering heavy cream The flour taste does not happen here, and the white sauce is unexpectedly refreshing. Even in the end, it does not reduce the degree of deliciousness.Intersection
4. I ordered a cup of alcoholic drink, strawberry oolong (sorry I forgot the name). The layer of milk on it is very powerful for a long time. The taste of strawberries is not chemical. It's delicious), if you don't know what to drink, I recommend this cup!Definitely not thunder!",False,0.178,0.038,0.783,0.9931
餐點跟調酒都很有質感。特別推薦牛小排燉飯。招牌的調酒：悄悄話，顏值很高又好喝👍 …,"Meals and bartending are very textured.It is recommended to stew cotton stew.Signature bartending: whispering, high value and delicious 👍 ...",False,0.312,0.0,0.688,0.8
"路過的一間餐酒館
裝潢非常高級，還有提供水煙
試了一杯酒覺得蠻不錯，上的速度也很快
松露薯條跟其他餐點味道也不錯
現場客人滿多的，都很嗨！
值得來訪看看","A dining tavern passing by
The decoration is very advanced, and there are water smoke
I tried a glass of wine, I feel pretty good, and the speed is fast
Tsoda fries and other meals have good taste
There are a lot of guests at the scene, all of them!
Worth visiting",False,0.223,0.0,0.777,0.9097
很推的一間餐酒館，每一道都很好吃，推薦給大家，願意二訪三訪的店👍🏼,"A very pushing dining tavern, each of which is delicious, recommend it to everyone, is willing to visit the shop with two visits and three visits 👍🏼",False,0.176,0.0,0.824,0.7351
"點的餐雖然跟想象不太一樣，但還算蠻好吃的
伊比利豬很軟嫩，油脂的地方不會軟爛噁心，推推","Although the order of order is not the same as imagination, it is quite delicious
The Iberi pig is very soft and tender, and the oil is not soft and nauseous. Push push",False,0.111,0.0,0.889,0.6115
"餐點不錯～
青醬生牛肉塔吃起來蠻特別有記憶點！好吃
餐點價格也不貴～想要有氣氛吃個東西可以來","The meal is good ~
The green sauce raw beef tower tastes particularly memorable!tasty
The price of the meal is not expensive ~ If you want to have an atmosphere, you can come",False,0.127,0.0,0.873,0.5411
燉飯很好吃，炒泡麵跟炸牡蠣也不錯，調酒好喝後面送的shot用法很有趣，喜歡😊😊,"The stewed rice is delicious, and fried instant noodles and fried oysters are also good. The use of the shot use after bartender is very interesting. I like it",False,0.331,0.0,0.669,0.9073
"很有氣氛的餐酒館👍🏻
餐點很精緻感覺真的很用心💯","Very atmospheric restaurant 的
The meal is very delicate, I feel really attentive",False,0.111,0.0,0.889,0.1263
餐點很好吃（燉飯、義大利麵），調酒也很舒服，還接受我們帶小嬰兒入場。更貼心的是，還播放兒童影片，謝謝貼心的店家，讓爸媽可以享受生活同時育兒。,"The meal is delicious (stewed rice, pasta), and it is also very comfortable to bartender. It also accepts us to take the baby to enter the venue.What is more intimate is that children's movies are also played. Thank you for your caring shops so that parents can enjoy life and parenting.",False,0.322,0.0,0.678,0.9633
"最喜歡油封青花椒蒜味大蝦
大量蝦殼與橄欖油青花椒熬製成，帶有檸檬香
以大火油封，將鮮味鎖在其中
店家不浪費蝦子的任何部位
先幫我們撥好蝦殼，再將蝦殼加以利用炒出香氣添加在料理內
筷子夾住蝦身一口咬下！即刻與蝦頭分離
檸檬的酸味中和了辣味，剩下了花椒的香氣和麻感
從舌頭到嘴唇的酥麻刺激著味覺，這時再配上一口酒
加上店裡昏暗朦朧的燈光，和充滿設計感的裝潢
簡直就是視覺和味覺的雙重饗宴","Favorite oil -sealing green pepper and garlic flavored shrimp
Made of a lot of shrimp shells and olive oil green pepper, with lemon fragrance
Seal with a large fire, lock the umami flavor in it
The store does not waste any part of the shrimp
First help us allocated the shrimp shell, and then add the shrimp shell to add the aroma to add it in the cooking
Claw the shrimp and bite the shrimp!Separate with shrimp head immediately
The sour taste of the lemon is neutral, and the aroma and mochi of the peppercorns remain
The numbness from the tongue to the lips stimulates the taste, then with a bite of wine
Coupled with the dim and hazy lights in the store, and the decoration full of design
It's a double feast of visual and taste",False,0.071,0.031,0.898,0.7026
"燉飯居然是溫溫的⋯有點失望 但調味沒問題
調酒很好喝","The stewed rice is actually warm and a little disappointed, but the seasoning is fine
Blooming is delicious",False,0.354,0.077,0.569,0.778
"燉飯好吃，麵就還好😅

吃完才發現原來可以抽水煙
下次有機會可以試試 …","The stew is delicious, noodles are okay

After eating, I found that I could smoke water and smoke
I can try it next time ...",False,0.196,0.0,0.804,0.6808
章魚🐙、伊比利豬🐷、松露薯條🍟非常好吃！B1有抽水煙、VIP包廂可以唱歌，來這裡慶生真的很開心 …,"Octopus, Ibilia piglet, truffle fries are very delicious!B1 has a smoke and a VIP box to sing. It's really happy to come here to celebrate the birthday ...",False,0.325,0.0,0.675,0.9188
"附近商家有換錢需求我們雖然不太會拒絕
但我們店在週末通常也是很缺零錢的
其實沒有義務幫你們換錢，畢竟我們不是銀行
希望下次來換錢態度可以客氣些，甚至說聲謝謝再離開","Nearby merchants have money to need to change money, although we don't know much about it
But our store usually lacks change on the weekend
In fact, there is no obligation to help you change money, after all, we are not a bank
I hope to change the money next time I can be polite, and even thank you for leaving again",False,0.149,0.039,0.812,0.8338
"室內禁菸
進門右側有個吸菸區

環境裝潢美觀、個人空間相當舒適
上餐、酒速度都快
餐點水平超乎對餐酒館的預期
可以先來這裡吃晚餐加第一輪，接著再去東區續攤
推推

Plum whiskey Sour 400$
梅香又帶點黃瓜清香，蠻有趣的組合
花魁400$
洛神的韻和gin相當平衡

古早味牛油花椒花枝卷義大利麵320$
這道相當精緻，一開始對這個只是嚐嚐，沒想到牛油加的不手軟，炒的火候到位。餐酒館而言完全物超所值的餐點。可以在一般餐廳賣的品項，點了不會後悔。","Indoor smoking
There is a smoking area on the right side of the door

The environmental decoration is beautiful and the personal space is quite comfortable
The speed of mealing and wine is fast
The level of meals is beyond the expectations of the dining tavern
You can come here for dinner and the first round, and then go to the Eastern District to renew
Push

Plum Whiskey Sour 400 $
Mei Xiang also brings some cucumber incense, which is quite interesting combination
Hua Kui 400 $
Luo Shen's rhyme and Gin are quite balanced

Ancient Early Noodle Apocalyptic Pepper Flower Branches 320 $ 320 $
This is quite exquisite. At first, I just tasted this. I did not expect that the butter was not soft, and the frying heat was in place.For meals, the restaurant is completely worthy of money.The items that can be sold in ordinary restaurants will not regret it.",False,0.096,0.026,0.878,0.8912
"燉飯好吃～～
環境也滿舒服
B1應該是可以抽水煙！","Stewed rice delicious ~~
The environment is also comfortable
B1 should be able to smoke water!",False,0.342,0.0,0.658,0.807
昨天和今天都來這邊幫朋友慶生，菜單跟昨天完全不一樣，哈！選到他們換菜單的前後天，也是一個蠻酷的經驗，餐點和酒品都還是一樣優秀，真的還蠻適合在這邊幫朋友慶生的唷！,"I came here yesterday and today to help friends celebrate their birthday. The menu is completely different from yesterday, ha!It is also a cool experience to choose the front of them to change the menu. The meals and wine are still as good. It is really suitable for helping friends here to celebrate his birthday!",False,0.343,0.0,0.657,0.9737
"歡迎追蹤 IG: foodie_fishie  💟
還有其他好吃的東東哦！

限定萬聖組合哪裡找🎃

👉🏻咖喱花椒雞軟骨 ②⑧⓪
👉🏻X.O干貝醬鲜肉水餃 ②②⓪
👉🏻煙花女海鮮義大利麵 ④⓪⓪
👉🏻Gossip悄悄話 ④⓪⓪
👉🏻萬聖節造型調酒

萬聖節不給糖就搗蛋！
tonight推出可可愛愛萬聖組
除了有特別訂製可麗露
還有以白蘭地為基底的南瓜調酒👀
期間限定只到10月底
一上桌立馬被隔壁小姊姊問
身為可麗露控的我老實說
這個幽靈可麗露內外兼具👻
配上大福皮不違和反而很驚艷（？！
又脆又軟又彈的口感讓你一次擁有❤️‍🔥
限定調酒上層鋪滿南瓜泥
還灑上一些假裝是綠豆豆的糖糖
整體酒感偏重
但我個人頗喜歡酒本人😝

另外還有點了悄悄話
沒辦法 我拒絕不了顏值高的他😂
喝起來帶有不錯濃的酒感
稍微偏甜口
呈現蘋果跟微微蜜桃風味
還帶有威士忌及茶香
是店內暢銷款之一哦！

煙花女義大利麵海鮮很澎湃
淡菜、蛤蜊、魚片都很新鮮
麵體部分很有嚼勁
醬料濃郁也很好的扒著麵條不放
而且是我愛的寬麵形式哦😍

雞軟骨超級涮嘴
下酒必點！
重口味的愛💯
脆脆口感再配上滿滿的椒麻花生粒 完美！
還附有小疊泡菜
酸爽解膩 好適合再來一盤臭豆腐？？？
水餃相對平庸些
不過沾醬我很喜
老話一句：重口味👍👍

而且店內還有滿額禮活動哦！
只要消費滿1500摳摳
就能夠有調酒分流shot組
可以自己搖自己調
伏特加尬上蝶豆花烏龍茶再帶點酸甜感
清爽好喝不甜 很值得喝喝看✨✨✨","Welcome to track IG: FOODIE_FISHIE 💟
There are other delicious Dongdong!

Where can I find a limited Halloween group?

鸡 Curry peppercorns, chondrum ② ⓪
酱X.o scallop sauce fresh meat dumplings ②②⓪
Fireworks female seafood pasta ④👉🏻
Gossip whispering ④👉🏻
酒 Halloween style bartender

Halloween is troublesome without giving sugar!
Tonight launched the cute love Halloween group
Except for special customized cocoa
There is also a pumpkin bartender based on Bailan Di 👀
The limited time is only until the end of October
As soon as he was on the table, he was asked by the little sister next door
As a coincidence, I said honestly
This ghost is both inside and outside
It is amazing that it is not violated with Dafupi (?
The crispy, soft and elastic taste allows you to have once ❤️‍🔥
Limited bartending upper layer is covered with pumpkin puree
Sprinkle some sugar sugar with mung bean beans
The overall wine feels heavy
But I personally like wine 颇 颇 颇 颇 颇

Also a little whisper
There is no way I can’t refuse him with high face value. He
Drink a good sense of wine
Slightly sweet
Show the flavor of apples and peach
There are also whiskey and tea fragrance
It's one of the best -selling models in the store!

Fireworks women's Italian surface seafood is very surging
Light vegetables, clams, and fish fillets are very fresh
Mask part is very chewy
The sauce is rich and good, the noodles are not put
And it's the wide face of my love.

Chicken cartilage super pouting
Drunk must order!
Love 爱 爱 爱 爱
脆脆口感再配上滿滿的椒麻花生粒 完美！
還附有小疊泡菜
酸爽解膩 好適合再來一盤臭豆腐？IntersectionIntersection
水餃相對平庸些
不過沾醬我很喜
The old saying: heavy taste ：

And there are full gifts in the store!
As long as you consume over 1500 and pick up
You can have bartending shunt Shot group
You can shake yourself by yourself
Vodka embarrassing butterfly bean flower oolong tea and then a little sweet and sour
Refreshing, delicious, not sweet, it's worth drinking ✨✨✨",False,0.205,0.075,0.72,0.9963
東西好吃 氣氛好👍🏻,The thing is delicious 气,False,0.481,0.0,0.519,0.5719
"超推！這個價位很願意再來一次
燉飯有入味 也有點米心感 牛小排跟鱈魚都很嫩很好吃
酒的部分點了悄悄話和花魁 也都很不錯
悄悄話前調有蘋果香 中掉是威士忌的香味 後掉有茶感 沒有威士忌讓人不舒服的尾韻 覺得很棒
雖然有五星活動 但真的好吃 很願意推廣！","Super push!I am willing to come again at this price
Stewed rice has a taste and a little bit of rice heart, cow small row and cod are very tender and delicious
The part of the wine was tipped and Hua Kui was also very good
Before whispering, there is a scent of whiskey in the fragrance of apple fragrance.
Although there are five -star activities, they are really delicious and willing to promote!",False,0.248,0.0,0.752,0.9733
餐點很好吃，但價格偏高，再調整一下水煙的品用氛圍，會是非常棒的複合水煙館,"The meal is delicious, but the price is high, and then adjust the atmosphere of the water smoke, it will be a great composite water cigarette hall.",False,0.242,0.0,0.758,0.8402
"餐點都超級好吃欸！
微醺後花園好喝很順也真的是微醺🤣🤣 …","The meals are super delicious!
The garden of the back garden is very smooth and it is really a little 🤣🤣 🤣🤣 🤣🤣 ...",False,0.387,0.0,0.613,0.98
好吃好喝環境舒服，絕對想再來,"It's delicious, delicious, and comfortable, absolutely want to come again",False,0.672,0.0,0.328,0.9061
"炸物拼盤好吃😋
今天喝了抹茶蜜柚 跟比佛利山莊冰茶，
調酒好喝、酒感很夠👍👍","Fried objects are delicious 拼
Today I drank matcha honey pomelo and Belle Villa ice tea,
Blooming is delicious, the wine feels enough 调",False,0.252,0.0,0.748,0.8126
"此店家有五星評論送酒活動
但服務生真的很親切
餐點份量少 但味道不錯
酒都很普","This shop has a five -star comment and wine delivery activity
But the waiter is really kind
The meal is small but tastes good
The wine is very universal",False,0.248,0.0,0.752,0.8717
"開頭先說：燉飯跟義大利麵都不錯有值得
但其他都別點了，要不是為了湊「800元的低消」我都不會再點其他任何的餐點，調酒也沒特色卻賣比一般酒吧更貴的價格，工作人員的態度讓我以為我到了一家很有個性的深夜咖啡廳，氣氛也還好，甚至隔壁客人都睡著了🙂
還有一點，請檢查餐具是否有掉漆，雖然環境很暗但看到還是會有點掉價 …","At the beginning, I said: stewed rice and pasta are good and worthy of it.
But don't order others. If it's not to make up ""800 yuan low"", I will not order any other meals. There is no special price for alcohol, but it is more expensive than the average bar. I thought I had a very personal late -night cafe, and the atmosphere was fine, and even the guests next door fell asleep.
One more point, please check whether the tableware has a paint. Although the environment is very dark, it will still be a bit off when you see it ...",False,0.085,0.049,0.866,0.4461
燉飯米心非常棒 是期待的硬度 蝦子椒的麻味很驚艷 每道菜都好吃 酒也好喝 非常用心的店 音樂放的也好 環境舒服乾淨,The stewed rice heart is great is the expectant hardness shrimp pepper.,False,0.454,0.0,0.546,0.8519
調酒有特色，bar food口味不錯～推薦👍🏻,"Blooming is characteristic, Bar Food has a good taste ~ Recommended 👍🏻",False,0.251,0.0,0.749,0.5719
餐點都超級好吃的！燉飯義大利麵調味都超讚👍調酒也很不錯👍,"The meals are super delicious!Stewed rice Italian noodles are superb and bartender, it's also very good 👍",False,0.434,0.0,0.566,0.9097
餐點非常美味，感受得到用心。調酒也有水準，大推,"The meal is very delicious and feel attentive.There is also a level in bartending, push a lot",False,0.2,0.0,0.8,0.6115
和朋友來慶生🎂整體環境很棒，服務生也很親切、服務周到。主食很推薦海鮮干貝燉飯，小菜推薦「伊比利豬上蓋佐青蘋果奶油醬」😊 …,"The overall environment with friends to celebrate the birthday is great, and the waiter is very kind and thoughtful.The staple food is very recommended for seafood scallop stew. The side dishes are recommended ""Iberry pigs on the top of the green apple cream sauce"" 😊 ...",False,0.391,0.0,0.609,0.9758
"餐點無雷很好吃～
酒不管酒感重還是輕都很順口
很棒的一間餐酒館！推推👍","Meal without thunder is delicious ~
Wicker is very smooth, regardless of the wine, whether
A great dining tavern!Push",False,0.18,0.123,0.697,0.3387
"平日每人低消600，外加一成服務費，從頭到尾只有點餐的時候服務員有過來點餐，剩下時間都聚在櫃檯聊天，連水都是我們自己倒、測試了水喝完了也沒有要幫我們裝的意思，最後買單還是到櫃檯買單，服務費是收心酸的？
餐點平均500-700，食材很新鮮，但是能把高級食材料理成這樣真的是很浪費，點了5-6道菜下來居然炸物拼盤最好吃，到底發生什麼事？
連裝都沒有在裝的，份量超小，排盤難看，盤子還缺角，不過因為太難吃了所以我們也沒有吃完🙂
為了避免對不起食材才勉強把料吃完。","Each person eliminates 600 lows, plus 10 % of the service fee. From beginning to end, there is only some meals. The waiter comes to order for meals. The rest of the time is gathered at the counter to chat. There is no intention to help us. Finally, pay or pay at the counter. The service fee is sad?
The average meal is 500-700, and the ingredients are very fresh, but it is really wasteful to cook high-grade food. It is best to order 5-6 dishes. What happened?
Not even installed, the portion is super small, the dishes are ugly, and the plate is still missing, but because it is too ugly, we don’t finish it.
To avoid the ingredients, I barely finish eating the ingredients.",False,0.099,0.149,0.753,-0.5444
"2/10到訪，只記得那天很開心，幾杯黃湯下肚，意識逐漸模糊⋯⋯
2/21二訪，也是爽的啦

照片為「悄悄話」，甜甜的挺好喝的","2/10 visit, I just remember very happy that day, a few cups of yellow soup, the consciousness gradually blurred ...
2/21 two visits, it's also cool

The photo is ""whisper"", sweet and delicious",False,0.309,0.0,0.691,0.9184
和朋友來吃生日餐，燉飯很好吃，用餐空間很不錯，很適合聚餐或慶生，晚上10點過後會有live DJ，氣氛很棒！,"Come to a birthday meal with friends, the stew is delicious, and the dining space is very good. It is very suitable for dinner or birthday. After 10 pm, there will be a Live DJ. The atmosphere is great!",False,0.291,0.0,0.709,0.937
當天剛好有萬聖節擺設很有氣氛，餐點好吃，😋,"On the same day, there was just Halloween furnishings very atmosphere. The meal was delicious, 😋",False,0.179,0.0,0.821,0.5719
餐廳氣氛佳，是下班後與同事、朋友聚會的好地方，餐食獨到美味😋。下回安排晚上9:30後，來感受另一種用餐氛圍。,"The atmosphere of the restaurant is a good place to meet with colleagues and friends after get off work.After 9:30 pm next time, come to feel another dining atmosphere.",False,0.182,0.0,0.818,0.7184
"昨天跟朋友來探新店小酌一下，我們坐位是樓下的ㄇ字型沙發，B1店內氣氛很喜歡，因為我們是一群喝酒會很吵的女人，想嗨的可以來玩！1樓的用餐區還沒上去過～
我點的酒是妹酒的抹茶蜜柚，好喜歡這個組合香香甜甜的，一推薦就是我的愛，真棒！
這家店剛開半年，有任何問題老闆們都親力親為，真的很感人～
老闆加油！祝生意興隆","Yesterday, I came to visit the new store with friends. We sit down the font sofa downstairs. The atmosphere in the B1 shop likes it very much, because we are a group of women with noisy alcohol. If we want to play, we can come and play!The dining area on the first floor has not been up yet ~
The wine I ordered is the matcha honey pomelo of the girl. I really like this combination of fragrant fragrance. It is my love for a recommendation!
This shop has just opened for half a year, and any questions have done it. The bosses are really touching ~
Come on!I wish the business a prosperous",False,0.179,0.013,0.808,0.9664
"餐點好吃氣氛很棒！
空間位子蠻寬敞，有一樓和地下室","The meal is delicious!
The space is quite spacious, with the first floor and the basement",False,0.21,0.0,0.79,0.6114
"食物好吃
酒也不錯不過價位偏高","Food is delicious
The wine is also good, the price is high, the price is high",False,0.32,0.0,0.68,0.765
"食物是好吃，但服務生的態度對應不上餐廳的價值，不曉得收服務費是服務在哪裡，要點餐還要自己離開座位走去櫃檯，站在櫃檯要我自己走過去？第一次遇到這種。
如果是平價自助式餐廳完全沒問題，但如果定位成低消要800的餐廳，不應該是這種服務態度吧？不只是要我走過去，那個對話的隨意程度…，不是說講話要畢恭畢敬，但也感受不到所謂的禮貌，用餐過了幾天想到還是不愉快。
看有些留言說服務生很熱情，跟我去的好像是不同間…當天感受不到任何熱情，可能勉強只有結帳的時候。","The food is delicious, but the attitude of the waiter does not correspond to the value of the restaurant. I do n’t know where the service fee is the service. If you want to order, you have to leave the seat and go to the counter.I encountered this for the first time.
If it is a cheap buffet restaurant, there is no problem, but if the positioning is low to consume 800 restaurants, it should not be this service attitude?It's not just that I walked over, the random degree of the conversation ... It is not respectful to speak, but I can't feel the so -called politeness, and it is still unpleasant after thinking for a few days.
See some messages saying that the waiter is very enthusiastic, and it seems to be different from me ... I ca n’t feel any enthusiasm that day, and I may barely only at the time of checkout.",False,0.105,0.065,0.83,0.7939
食物很好吃，上菜上酒速度有點慢，整體氣氛不錯,"The food is delicious, the speed of drinking is a bit slow, and the overall atmosphere is good",False,0.292,0.0,0.708,0.765
"點了野薔薇，酒單上面寫甜度2顆星，但我覺得甜度大概是5顆星，好甜～後來還跟店員要了冰塊🧊
點水煙等了二十分鐘以上～然後音樂也有待加強！ …","Once the wild rose, the wine list is written on the wine list 2 stars, but I think the sweetness is about 5 stars, so sweet ~ Later, I asked the clerk to ask the ice cubes.
The water smoke waited for more than 20 minutes ~ and then the music needs to be strengthened!Mowing",False,0.157,0.0,0.843,0.8977
酒很好喝來看世足超級好看～～Melody超～親切,"Wine is very delicious, look at the super beautiful look ~~ Melody super ~ kind",False,0.656,0.0,0.344,0.9643
"跟朋友想找一個地方看世足，沒想到找到一間裝潢很棒然後服務員很親切💙💜
他們的楊枝甘露真的超級無敵推喔👍🏻","I want to find a place with friends to see the world, but I did not expect to find a decoration very great and the waiter is very kind.
Their Yangzhi Ganlu is really invincible push 👍🏻",False,0.346,0.0,0.654,0.9641
