Original,EN,Needs Review,Positive,Negative,Neutral,Compound
"餐點很不錯，愛喝酒的可以來，酒很難
而且寵物友善👍👍","The meal is very good, those who love to drink can come, it is difficult to drink
And pet is friendly 友",False,0.341,0.08,0.579,0.8439
"餐點好吃，酒好喝
下次會再來👍🏻 …","The meal is delicious, the wine is delicious
I will come again next time ...",False,0.363,0.0,0.637,0.8126
"食物不錯吃
但….可以請今天的女店員嗓門小一點嗎….真的很吵….所以氣氛給不了太高","Good food
But ... can I ask today's female clerk to be a little smaller .... It is really noisy ... so the atmosphere can't be too high to be too high",False,0.057,0.072,0.871,-0.138
餐點好吃 海鮮燉飯吃得到很多隻蝦子 干貝很甜 酒茶味有出來 好吃 值得推薦,Meal delicious seafood stew rice can get a lot of shrimp dried shells. The sweet tea taste is delicious and delicious,False,0.453,0.0,0.547,0.9337
"本來是進來喝酒
但沒想到食物也很好吃
服務滿好
值得再訪","Originally came in to drink
But I didn't expect the food to be delicious
Good service
Worth visiting",False,0.429,0.0,0.571,0.9052
調酒及餐點都比預期的要好👍,Blooming and meals are better than expected.,False,0.326,0.0,0.674,0.4404
質感滿分，氣氛營造的很棒，酒與餐的搭配讓人放鬆,"The texture is full, the atmosphere is great, and the matching of wine and meals makes people relax",False,0.304,0.0,0.696,0.7906
餐點好吃，酒好喝(⁎⁍̴̛ᴗ⁍̴̛⁎),"The meal is delicious, the wine is delicious (⁎⁍̴̛ᴗ⁍̴̛⁎)",False,0.514,0.0,0.486,0.8126
酒好喝而且可以依據要求做調整（有些酒吧跟他說要很濃還是會很淡），吃得更讚有時候都故意不吃晚餐來吃🤤🤤,"The wine is delicious and can be adjusted according to the requirements (some bars tell him that it will be very strong or light), and it is better to eat it.",False,0.267,0.0,0.733,0.8805
餐點跟酒都很讚,The meals are very good to wine,False,0.347,0.0,0.653,0.4927
調酒跟食物都不錯,Blooming and food are good,False,0.42,0.0,0.58,0.4404
"調酒好喝🍸環境舒服放鬆😌
DJ音樂🎵氣氛棒棒♥️
適合三五好友聚餐小酌的好地方 …","Blooming and delicious 🍸 The environment is comfortable and relaxed 😌
Dj music 🎵 Atmosphere is great ♥ ️
Suitable for a good place for three or five friends to dinner ...",False,0.492,0.0,0.508,0.9801
"點了三款調酒，口感都相當的棒！
餐食的搭配，也很棒","I ordered three types of bartender, and the taste is quite good!
The matching of meals is also great",False,0.309,0.0,0.691,0.8217
店長很讚 調酒很棒☺️✌🏻,The store manager is great.,False,0.506,0.0,0.494,0.6249
帶老婆來用餐體驗超讚，還有幸遇到老闆用心招待，相談甚歡、不亦樂乎，餐點跟酒都屬上品，開心到忘了回家，睡在路邊店員還會幫忙蓋被子，服務實在很好！,"Take your wife to dining and experience, and fortunately encountering the boss with your heart to entertain. He talks very well and is very happy. The meal and wine are all the best. I am happy to forget to go home. The quilt, the service is really good!",False,0.367,0.029,0.604,0.9731
酒食都不錯，炒泡麵超讚,"The wine and food are good, the fried noodles are superb",False,0.438,0.0,0.562,0.7906
東西好好吃！酒也很讚❤️,What is delicious!Wine is also very good ❤️,False,0.303,0.0,0.697,0.54
"很棒的餐酒館
餐點好吃 音樂太會放了 在這聚會很舒服","Great dining tavern
It's so comfortable that the meals are delicious.",False,0.601,0.0,0.399,0.9192
"東西好吃
有KTV包廂
水煙","What is delicious
There is a KTV box
Water cigarette",False,0.291,0.0,0.709,0.5719
東西很好吃～冷氣很涼👍 …,Things are delicious ~ air -conditioning is very cool ...,False,0.44,0.0,0.56,0.7425
"B1配合的DJ放的音樂有待加強，感覺接的很不順，音響效果的Bass不夠，聽起來很刺耳，導致整個氛圍跑掉，去過很多同等價位的餐廳，至少音響品質是好的，個人建議，希望店家更進步..
餐點等太久…要改善
印象還不錯的是，其中一位服務生很用心介紹
其他都在滑手機..","The music of the DJs cooperated with B1 needs to be strengthened. It feels uncomfortable. The sound effect of the audio effect is not enough. It sounds harsh, causing the entire atmosphere to run away. I have been to a lot of restaurants at the same price. Suggestion, I hope the store will improve ..
I have a meal for too long ... I want to improve
What impressed me is that one of the waiters introduced very carefully
Others are sliding mobile phones ..",False,0.178,0.055,0.766,0.8805
舒服的店，東西也好吃😋 …,"A comfortable shop, things are so delicious ...",False,0.573,0.0,0.427,0.8419
故意坐了吧台味，調酒師會聊天，店內特調也超有特色,"Sitting on purpose, the bartender will chat, and the special adjustment in the store is also super characteristic",False,0.292,0.0,0.708,0.765
"1、服務生態度消極不熱情，叫好幾次才過來
2、全店無客人，水煙要等半小時？
3、調酒又貴又淡又難喝
4、價位和品質完全不成正比
總結，不會再訪的店且價格非常高昂","1. The service ecosystem is negative and not enthusiastic, so I came here several times before coming over
2. There are no guests in the whole store. Water smokes have to wait half an hour?
3. Mixing is expensive, light and difficult to drink
4. The price and quality are not proportional at all
To sum up, the store that will not be visited and the price is very high",False,0.0,0.143,0.857,-0.8758
炸物拼盤、牛肝菌牛小排燉飯、烤雞翅好吃～,"Fried grasses, beef liver bacteria beef stewed rice, grilled chicken wings are delicious ~",False,0.222,0.0,0.778,0.5719
餐點好吃！氣氛佳 推👍👍,The meal is delicious!The atmosphere is good,False,0.347,0.0,0.653,0.4926
"燉飯推推💕 調酒🍹很讚
放歌🙌🏻🎵 …","Stew rice push push and bartender 推 very good
Singing 🙌🏻🎵 ...",False,0.158,0.0,0.842,0.4927
"黑頭髮髮長到肩膀的女服務生服務超好
而且又很漂亮😍🫰 …","Women's waiter with black hair to shoulders is super good
And it's very beautiful ...",False,0.478,0.0,0.522,0.8999
"說實話吃的還可以 但是酒真的要再加油…
喝酒的地方牆壁不該用砂石牆 需要扶或跌倒時不就受傷了嗎？服務員都要叫3聲以上才回頭真是謝了","To be honest, you can eat it, but the wine really needs to be cheered ...
Shouldn't the walls be injured when the wall of the wall needs to be supported or falling?The waiters have to call 3 voices before turning back. Thank you so much",False,0.223,0.062,0.715,0.85
服務好👍🏻氣氛佳 適合帶朋友來放鬆😌 …,"The service is good, the atmosphere is suitable for bringing friends to relax ...",False,0.447,0.0,0.553,0.836
有氣氛 店員服務態度佳 推啊,The atmosphere of the atmosphere of the clerk service attitude is good,False,0.209,0.0,0.791,0.4404
調酒好喝又好拍，氣氛超好👍,"Blooming is delicious and easy to shoot, the atmosphere is super good 👍",False,0.54,0.097,0.363,0.9001
服務真的很讚！東西很好吃！一定會推薦👍🏻👍🏻,The service is really good!Things are delicious!I will definitely recommend 👍🏻👍🏻,False,0.243,0.0,0.757,0.6988
"漂亮 氣氛好 酒好喝
店員好nice🫶🏻🫶🏻🫶🏻 …","Beautiful atmosphere, good wine, delicious wine
The clerk is good Nicei ...",False,0.626,0.0,0.374,0.9246
餐點跟飲品都很讚,The meals are very good to the drink,False,0.313,0.0,0.687,0.4927
"環境：滿分，氣氛很足
餐點：餐酒館，走精緻路線，好吃是好吃，缺點份量少，牛肝菌牛排燉飯好吃，米粒口感是傳統的硬。
酒： 點花魁，酸甜酒三體平衡（有請調酒師加強酒感）","Environment: full points, the atmosphere is sufficient
Meal: The dining tavern, the exquisite route, the deliciousness is delicious, the shortcomings are small, the beef liver steak stewed rice is delicious, and the rice grain taste is traditional hard.
Wine: Point Hua Kui, Sweet and Sweet Wine Balance (please barter to strengthen the sense of wine)",False,0.301,0.02,0.679,0.9607
每樣餐點都很好吃，調酒也都很順口！,"Every meal is delicious, and bartending is very smooth!",False,0.333,0.0,0.667,0.6114
東西很好吃 酒也很有特色,Things are very delicious and very distinctive,False,0.4,0.0,0.6,0.6115
燈光食物都很讚！喜歡韓文歌單的不要錯過 ！環境很適合和朋友聚餐 聊天～服務態度交通位置也不錯！離捷運站很近！,Light food is great!Don't miss it if you like Korean song list!The environment is very suitable for meals to chat with friends ~ The service attitude and traffic are also good!Very close to the MRT station!,False,0.199,0.0,0.801,0.8027
有質感，很讓人放鬆，酒也很讚的餐酒館,"There is texture, very relaxed, and wine restaurant with great wine",False,0.458,0.0,0.542,0.8221
牛肝菌燉飯很好吃！,Beef liver stew is delicious!,False,0.499,0.0,0.501,0.6114
"食物超好吃！調酒用心有特色👏🏻
選擇障礙的以下必點👇🏻

牛肝菌牛小排燉飯-
牛小排約5分熟，軟嫩卻沒有一般牛小排的油膩感！燉飯米心保有硬度，吃的出對食物的用心，牛肝菌味濃厚，是會上癮的味道

伊比利豬-
舒肥過的7分熟伊比利豬，入口有強烈橡果味，很有水準

烤章魚腳-
擺盤很精緻，有濃濃的炭香味，有吸盤的部位特別好吃，底部的薯泥也是吃的出水準！力推

炸物拼盤-
炸牡蠣、起司條、薯條..配上濃郁的松露美奶滋極度美味！

明太子干貝海鮮燉飯
這道是我的最愛！干貝的等級毋庸置疑，表面微微炙燒卻不過熟，裡面還保留絕對的鮮味，米心跟其他燉飯一樣有超高水準！請閉眼點這道謝謝

調酒的部分我們點了10幾種，每款都很用心，就看個人喜好～","The food is super delicious!Separation with special characteristics 有
Select the following obstacles 的

Beltic liver bacteria beef stew-stewed rice-
Niu Xiao's row is about 5 points, soft and tender but there is no greasy feeling of general cattle!The stewed rice heart maintains the hardness, and the food is given to the food, and the taste of beef liver is strong.

Ibilia pig-
The 7 -point II Billy pig has a strong rubber flavor at the entrance, which is very standard.

Baked octopus feet-
The plate is exquisite, has a strong charcoal flavor, the parts of the suction cup are particularly delicious, and the potato puree at the bottom is also the level of eating!Push

Fried objects-
Fried oysters, cheese strips, fries .. with a strong truffle beauty milk is extremely delicious!

Ming Prince Dry Scalloping Seafood Stew Rice
This is my favorite!The level of scallop is beyond doubt. The surface is slightly burned but not familiar. It still retains the absolute flavor. Mind is as high as other stewed rice!Please close your eyes. Thank you

We ordered more than 10 types of bartender, each of which is very careful, it depends on personal preference ~",False,0.212,0.039,0.749,0.9934
"炸物很好吃
調酒很有特色","Fried objects are delicious
Blooming is very distinctive",False,0.346,0.0,0.654,0.5719
"為了要慶生 幾天前就已訂好20：00，
剛剛17：58才臨時打來 說
今天無法出餐！
這如果發生在你們身上，你們怎麼看？
總之規劃好的行程 被打亂了 很無奈，
這件事情只怪你們老闆，
不怪打電話通知我的小姐，辛苦了°","In order to celebrate the birthday a few days ago, you have booked 20:00,
Just at 17:58, I will talk temporarily
Can't give meals today!
What do you think if this happens to you?
In short, the planned itinerary is disrupted and helpless,
This thing is just blame your boss,
Don't blame the young lady to call, I worked hard °",False,0.083,0.103,0.814,-0.0915
"餐點好吃酒好喝
滿額還有送章魚喔🐙","Meal delicious wine and drink delicious
There is also a full amount of octopus 送",False,0.363,0.0,0.637,0.8126
燈光美氛圍很好！,The beauty atmosphere is very good!,False,0.646,0.0,0.354,0.8066
好吃又好喝 音樂嗷嗷聽 酒吧必推,Delicious and delicious music. Listening to the bar will push,False,0.481,0.0,0.519,0.8126
餐點精緻美味，茶酒很有特色,"The meals are delicate and delicious, tea wine is very distinctive",False,0.353,0.0,0.647,0.5994
"有洗五星的活動 評論不準
酒吧近期主打看世足 特地跟朋友選在這邊看冠軍賽 結果在最關鍵的好幾次進球 都剛好網路斷線 而且斷線時間蠻長的 店員還剛好在斷線時 來提醒未達低消 說實在感受蠻差的
我們來酒吧的目的是為了看世足 結果重要的關鍵時刻錯過重點 女店員服務態度也有待加強 希望貴酒吧能夠在硬體設施及軟實力都完備的情況下再主打這種會聚集人潮的活動 而不是想著客人來錢進來就好🙂","The comments with five stars were not accurate
The bar has been watching the World Football Team with friends in the near future. The results of the championship results here are just on the most critical goal. To be honest, it is quite poor
The purpose of our bar to the bar is to miss the service attitude of key female clerks at a critical moment at a critical moment. It’s not just thinking about the guests coming in the money.",False,0.098,0.129,0.773,-0.223
還行 聊天的好地方,Good place to chat,False,0.492,0.0,0.508,0.4404
店員熱情、調酒尚可，音樂偏大聲會比較難說話一些。,"The clerk is enthusiastic and alcoholic, and the music will be more difficult to speak.",False,0.168,0.147,0.684,0.1045
我要點的是新鮮果汁，結果是美粒果😅厲害了 …,"I want to order fresh fruit juice, and the result is that the grain fruit is amazing ...",False,0.33,0.0,0.67,0.7506
喜歡 酒很好喝 也很漂亮,Like wine is delicious and very beautiful,False,0.722,0.0,0.278,0.8858
"進來前以為應該就是普通餐酒館，結果酒好喝東西也狠～好吃欸🧚🏻‍♂️
推推洛神琴雷&明太子海鮮頓飯🙌🏻
是真的很讚，可以進來 真的👍 …","I thought it should be an ordinary dining tavern before I came in.
Push Luo Shenqin Thunder & Ming Prince Seafood Dinner 🙌🏻
It's really good, you can come in, it's really ， ...",False,0.079,0.0,0.921,0.4927
"調酒好喝
餐點好吃
服務親切","Blooming is delicious
Meal delicious
Intimate service",False,0.597,0.0,0.403,0.8126
調酒好好喝！氣氛又超好,Bart -up and drink well!The atmosphere is super good,False,0.503,0.0,0.497,0.7959
氣氛非常chill，朋友聚會的好場所,"The atmosphere is very chill, a good place for friends gathering",False,0.41,0.0,0.59,0.7402
悄悄話跟伊比利豬跟海鮮好吃😋 …,Selfish with Iberbig pigs and seafood 😋 😋 😋 😋 ...,False,0.0,0.147,0.853,-0.4767
氣氛很輕鬆，酒跟餐點都在水準之上，非常推薦朋友們來聚會～ 微醺後花園大推推推👍👍👍 …,The atmosphere is very easy. The wine and meals are above the standard. I recommend friends to come to the party ~ Weimin back garden push ...,False,0.333,0.0,0.667,0.8883
氣氛佳 餐點好吃 調酒品質也高 非常推薦,"The atmosphere is good meal, delicious alcohol quality is also high, very recommended",False,0.465,0.0,0.535,0.8268
"調酒師真的很會調👍
要說喜歡的調性就能調出完美的味道！
真的很推！！
而且偷偷說調酒師真的很帥😎 …","The bartender really can adjust it 的
If you say your favorite tone, you can bring up the perfect taste!
Really pushing!Intersection
And secretly said that the bartender is really handsome ...",False,0.271,0.0,0.729,0.8951
餐點好吃酒好喝👍,Meal delicious wine and drink 吃,False,0.425,0.0,0.575,0.5719
餐點不錯，調酒不錯，但一樓的裝潢和樓下氣氛不同，和期待有落差😅然後音樂真的太大聲了…. …,"The meal is good, and the bartender is good, but the decoration on the first floor is different from the atmosphere downstairs. It is too loud to look forward to the gap.",False,0.115,0.0,0.885,0.4404
調酒很漂亮～,The bartender is very beautiful ~,False,0.456,0.0,0.544,0.6361
牛肝菌牛小排燉飯好好吃🫶🏻 …,Niudiuscurus beef stewed rice is delicious ...,False,0.381,0.0,0.619,0.5719
東西好吃，酒水好喝，cp值超高！,"It ’s delicious, the wine is delicious, and the CP value is super high!",False,0.583,0.0,0.417,0.9324
餐點調酒都一百分💯,Dinner bartending is 100 points 酒,False,0.0,0.0,1.0,0.0
"餐點非常好吃，
酒也頗具水準，
下次還會找朋友一起來消費，
非常推薦👍 …","The meal is very delicious,
The wine is also quite standard,
I will find friends to spend together next time,
I recommend 👍 ...",False,0.304,0.0,0.696,0.8622
適合聚會的好去處，餐點好吃,"Suitable for a good place to party, the meals are delicious",False,0.538,0.0,0.462,0.8519
來店第二次，店內氛圍很好，餐點都很好吃會想要再來~!,"For the second time when I came to the store, the atmosphere in the store was very good, and the meals were delicious and I wanted to come again ~!",False,0.204,0.0,0.796,0.8012
女店員第一天見超讚,The female clerk was superb first day,False,0.406,0.0,0.594,0.6249
餐點跟調酒都很有水準～餐廳氛圍很舒服自在，很適合聚餐！,The meals and bartending are very standard ~ The atmosphere of the restaurant is very comfortable and suitable for dinner!,False,0.17,0.0,0.83,0.5974
東西好吃氣氛舒適，來這邊看世足啦！,"The things are delicious and comfortable, come here to see the world football!",False,0.399,0.0,0.601,0.807
"用餐環境👍
調酒👍
餐點 👍","Dining environment 👍
Bartender 👍
Meal 👍 👍 👍",False,0.0,0.0,1.0,0.0
"新開幕餐酒館生意很好欸～
氣氛超好、食物好吃、酒好喝！
假日好去處","The business of the newly opened restaurant is very good ~
The atmosphere is super good, the food is delicious, and the wine is delicious!
Holidays good place",False,0.525,0.0,0.475,0.9725
"萬聖節店裡氣氛佳！
煙花女海鮮義大利麵讚讚","The atmosphere in the Halloween shop is good!
Fireworks female seafood pasta praise",False,0.382,0.0,0.618,0.7777
"好有氣氛的地方
適合跟朋友一起
東西好吃好喝
超讚","What a place with atmosphere
Suitable with friends
Good things delicious and delicious
Pretty",False,0.648,0.0,0.352,0.9485
調酒讚！食物飯店等級！服務人員親切度高！值得來的地方！,Bart -up like!Food hotel level!The service staff is high!It is worth coming!,False,0.218,0.0,0.782,0.471
"Melody服務滿分，可愛有趣又懂聊。
酒水不錯，食物也好吃😋 …","Melody's service is full, cute, interesting and understanding.
The drink is good, and the food is delicious ...",False,0.468,0.0,0.532,0.9062
服務很親切，整間店的氛圍很好，會常常回訪的一間酒吧！,"The service is very kind, the atmosphere of the whole store is very good, and a bar that will often return to visit!",False,0.255,0.0,0.745,0.8008
"水煙好好抽，老闆人好好，東西好好吃
調酒好好喝，環境好漂亮，服務態度好","Water smoke smoke well, the boss is good, the things are delicious and delicious
Bart -ups are good, the environment is beautiful, and the service attitude is good",False,0.513,0.0,0.487,0.9686
"餐點好吃 酒也好喝
店家一直招待
是台北新的好去處","The meals are delicious and delicious
The store has been entertaining
It's a new place in Taipei",False,0.424,0.0,0.576,0.8834
牛肝菌牛小排燉飯很好吃，氣氛佳,"Niu liver bacteria beef stewed rice is delicious, the atmosphere is good",False,0.398,0.0,0.602,0.765
氣氛很棒，餐點認真好吃，老闆人超好~~~,"The atmosphere is great, the meals are serious and delicious, the boss is super good ~~~",False,0.543,0.048,0.409,0.936
酒好喝、服務人員很親切，義大利麵跟燉飯好吃！！,The wine is delicious and the service staff is very kind. The pasta and stew are delicious!Intersection,False,0.339,0.0,0.661,0.8264
"食物很特別 推伊比利豬 煎章魚
調酒也很有水準
水煙也很順口！","Food is special push for Ibish pig fried octopus
Mixing is also very standard
Water smoke is also very smooth!",False,0.136,0.0,0.864,0.4574
餐點好吃、氣氛佳😍,The meal is delicious and the atmosphere is good,False,0.485,0.0,0.515,0.765
服務人員超讚～～ 調酒也很有水準～,The service staff is superb ~~ Alcohol is also very standard ~,False,0.272,0.0,0.728,0.6249
調酒豐富順口，餐點水準不錯，DJ歌放的很舒服～,"The bartending is rich and smooth, the meals are good, and the DJ song is very comfortable ~",False,0.402,0.0,0.598,0.8777
"東西非常好吃
氣氛也很好
下次會再來","Things are very delicious
The atmosphere is also very good
Will come again next time",False,0.356,0.0,0.644,0.8012
老闆好會做生意也好會聊天。重點是帥,The boss is good at business or chat.The point is handsome,False,0.404,0.0,0.596,0.7269
再多給你🦍🦍🦍🦍🦍五個大猩猩,Give you five more gorillas,False,0.0,0.0,1.0,0.0
酒真的猛 厲害 還有海鮮麵必點的,The wine is so powerful and the seafood noodles must be ordered,False,0.247,0.0,0.753,0.5598
餐點好吃、氛圍很棒、價格親民,"The meals are delicious, the atmosphere is great, and the price is affordable",False,0.415,0.0,0.585,0.8316
酒好好喝~氣氛很棒,The wine is delicious ~ The atmosphere is great,False,0.527,0.0,0.473,0.8316
"餐點美味
調酒也很好喝
服務人員親切","Delicious meals
Alcohol is also very delicious
Service staff is kind",False,0.581,0.0,0.419,0.902
餐點好吃！明太子燉飯和蒜味海鮮義大利麵！,The meal is delicious!Ming Prince Stewed rice and garlic -flavored seafood pasta!,False,0.0,0.0,1.0,0.0
餐點好吃 酒好喝💓 …,Meal delicious wine and drink 好 ...,False,0.381,0.0,0.619,0.5719
餐點好吃 酒好喝 氣氛好,"The meals are delicious and delicious, the atmosphere is good",False,0.595,0.0,0.405,0.8834
好吃好拍照～～朋友開的彭場一下,It's delicious and good to take pictures ~~ Let's open a friend Pengchang,False,0.495,0.0,0.505,0.8689
餐點好吃外環境也很放鬆,The meals are delicious and the environment is also very relaxed,False,0.444,0.0,0.556,0.8016
氣氛好，餐在水準之上！,"The atmosphere is good, meals are above the standard!",False,0.285,0.0,0.715,0.4926
氣氛不錯，適合朋友去聚會,"The atmosphere is good, suitable for friends to meet",False,0.462,0.0,0.538,0.7184
氣氛和音樂蠻不錯的～放鬆,The atmosphere and music are pretty good ~ relaxation,False,0.613,0.0,0.387,0.8591
好吃 挑嘴的男友也很愛,The delicious boyfriend who picks up is also very loved,False,0.497,0.0,0.503,0.8357
餐點好吃 酒很好喝,The meals are delicious and delicious,False,0.649,0.0,0.351,0.8126
包廂舒服 餐點好吃,The box comfortable meal is delicious,False,0.636,0.0,0.364,0.7906
太好吃了 好喜歡！！！,It's so delicious! I like it!IntersectionIntersection,False,0.647,0.0,0.353,0.8095
好吃氣氛佳,The delicious atmosphere is good,False,0.688,0.0,0.312,0.765
水煙好好抽☺️,Water cigarettes 抽️,False,0.0,0.0,1.0,0.0
氣氛超讚😚,The atmosphere is superb 赞,False,0.506,0.0,0.494,0.6249
特別的體驗,Special experience,False,0.73,0.0,0.27,0.4019
這裡的食物有點融合風格或對像puttanesca這樣的經典菜餚有所不同。不錯，但沒有更多/令人上癮的品質。有點貴。,"The food here is a bit of a fusion style or a classic dish such as the classic dishes such as Puttanesca.Yes, but there is no more/addictive quality.It's a bit expensive.",False,0.0,0.085,0.915,-0.4215
真的很酷的地方,Really cool place,False,0.565,0.0,0.435,0.3804
好吃一直吃,Nice,False,1.0,0.0,0.0,0.4215
食物好吃 配酒,Food delicious wine,False,0.649,0.0,0.351,0.5719
好喝,Delicious,False,1.0,0.0,0.0,0.5719
燴飯和炒飯真的很棒。飲料都非常好,Rice and fried rice are really great.The drinks are very good,False,0.242,0.0,0.758,0.4927
食物太棒了！喝了很多❤️美好的夜晚🥰,The food is great!I drank a lot ❤️ Beautiful night 🥰,False,0.469,0.0,0.531,0.9098
大安最好的食物和酒。,Daan's best food and wine.,False,0.512,0.0,0.488,0.6369
好吃好喝好玩🧩🧩,"It's delicious, delicious, fun 好",False,0.843,0.0,0.157,0.8934
餐很好吃酒好喝❤️‍🔥 …,The meal is delicious and delicious ❤️‍🔥 …… ...,False,0.416,0.135,0.449,0.7184
Jen很有趣欸！,Jen is very interesting!,False,0.523,0.0,0.477,0.5081
幹貝義大利麵好吃,Dry scallops are delicious,False,0.552,0.0,0.448,0.5719
食物超好吃！大推！,The food is super delicious!Push!,False,0.529,0.0,0.471,0.6688
好吃推薦👍,Delicate recommendation 👍,False,0.286,0.0,0.714,0.0516
環境不錯。強烈推薦約會之夜。,The environment is good.Strongly recommend dating night.,False,0.294,0.0,0.706,0.3612
最好的服務，美味的飲料和餐點:)）,"The best service, delicious drinks and meals :))",False,0.568,0.0,0.432,0.836
先支持一波,Support a wave first,False,0.474,0.0,0.526,0.4019
好吃～推👍🏻,Delicious ~ push 推,False,0.552,0.0,0.448,0.5719
Jasmine Negroni好喝～～！,Jasmine Negroni is delicious ~~!,False,0.499,0.0,0.501,0.6114
推,push,False,0.0,0.0,1.0,0.0
好喝！,Special!,False,1.0,0.0,0.0,0.4574
