Original,EN,Needs Review,Positive,Negative,Neutral,Compound
超級好吃！！！之前吃過其他分店已經很喜歡，路過閃進來被嚇壞了、不論是烤物煮物都好吃到驚為天人。必點味噌湯（超回甘白味噌）、雞肉串、牛橫隔膜、玉子燒/竹村燒、烏龍麵（甜口愛好者會瘋）、烤年糕，全店無雷、大推。,"Super delicious!IntersectionIntersectionI have already liked other branches before, and passed by flashed in.Must -order miso soup (super -back sweet white miso), chicken skewers, beef crossing membranes, Yuzi Roasted/Zhucun Roast, oolong noodles (sweet mouth enthusiasts will crazy), baked rice cakes, all stores are thunderous and pushed.",False,0.323,0.04,0.637,0.9508
"全店無雷，
招牌雞肉串表皮烤的酥脆，裡面卻能夠保留肉汁
烤玉米筍很甜，沒有其他調味就很好吃","There is no thunder in the whole store,
The signature chicken skewers are crispy, but the gravy can be kept in it
Baked corn bamboo shoots are very sweet, and it is delicious without other seasonings",False,0.215,0.036,0.748,0.8717
"一個人的晚餐，梅酒+竹村燒+玉子燒+主廚隱藏料理，飽到不行。
竹村燒非常值得推薦，外面吃不到的口味，玉子燒雖然只是煎蛋但豐富的蛋香仍是讓人回味，主廚料理就因人而異，我今天的清爽感讓我忘了今天體感溫度40度。
總結：值得再來一次的小店。
提醒：位置不多，最好先訂位。","Dinner of a person, plum wine+bamboo village, Yuzi -roast+chef hidden dishes, not enough.
Zhucun is worth recommending. The taste that can not be eaten outside. Although Yuzi Bo is only fried egg, the rich egg fragrance is still reflective, and the chef dishes vary from person to person. My refreshing today makes me forget today's body. Feeling temperature 40 degrees.
Summary: It is worth a small shop.
Reminder: There are not many positions, it is best to order first.",False,0.149,0.022,0.83,0.8807
"超好吃…一定要分享這間在五分埔附近的寶藏店！
有另一家分店，但在信義商圈附近，平時人潮很多，中坡店近松山、內湖，相較之下，提供了更佳舒適的用餐環境，成為下班後犒賞自己的好去處

大讚老闆小賴，很熱情、會聊天，重點是做出來的餐點超好吃！！！

今天一個人來用餐，保守點了幾道平時常點的，吃到當下超驚艷，怎麼會同樣的價格品項，這家竟然更好吃🥹🥹🥹烤功真的了得…

推薦幾個給大家，有機會來一定要試試牛肉蔥捲，蔥超多整個很紮實但很好咀嚼，玉米筍很鮮甜多汁，牛橫隔膜味道超讚，適合愛吃重口的朋友，娃娃菜很大個，爽口鮮甜，還有老闆自創的竹村握壽司🍣鮭魚加上鹹甜調味非常適合

還有！！一定要吃吃小賴的雞腿肉！！！椒鹽口味調得恰好、又超級多汁，旁邊佐沙拉可以解膩，到現在還在回味，直接變成每去必點","Super delicious ... Be sure to share this treasure shop near Wuqi Po!
There is another branch, but near the Xinyi Business District, there are usually many crowds. Zhongpo stores are near Songshan and Neihu. In contrast, a better and comfortable dining environment is provided.

Praise the boss Xiao Lai, very enthusiastic and chatting, the point is that the meals made are super delicious!IntersectionIntersection

Today, I came to dine alone. I conservatively ordered a few times. When I was super stunning at the moment, how could the same price item, this one was better.

I recommend a few for everyone. If you have the opportunity to come, you must try beef and shallots. There are a lot of green onions. The whole is very solid but chewed well. The corn bamboo shoots are very fresh and juicy. Doll vegetables are very large, fresh and sweet, as well as the boss's self -contained bamboo village nipple sushi, salmon and salty sweet seasoning, it is very suitable

besides!IntersectionBe sure to eat Xiao Lai's chicken leg!IntersectionIntersectionThe flavor of the salt and pepper is just right and super juicy. Salad next to the salad can be relieved, and it is still reminiscent.",False,0.336,0.01,0.654,0.998
"第一次來訪 知道這間店許久
但一直沒來吃過
今天意外前來 餐點很好吃！可以感受到老闆的用心🥹","The first visit knows this shop for a long time
But I have never come to eat
It's delicious for meals today!You can feel the boss's intentions 老",False,0.165,0.0,0.835,0.7463
第一天改菜單就來吃了，食物烤的剛剛好，比外面的燒烤店都要好吃，台北唯一單推的居酒屋：）,"On the first day, the menu was changed. The food was baked. It was better than the barbecue restaurants outside.",False,0.132,0.0,0.868,0.4404
餐點好吃，老闆跟工作人員都服務很好，值得來嚐鮮，有機會會在來訪,"The meal is delicious, the boss and the staff are very good service, it is worth trying to try something new, and there will be a chance to visit",False,0.302,0.0,0.698,0.8687
"小賴師傅手藝超好，人超nice，已經回訪很多次每次體驗都很好👍🏻👍🏻👍🏻
這次還喝到自己釀的熟客限定私房梅酒😋😋","Master Lai's craftsmanship is super good, people are super nice, and they have already visited many times. Each experience is very good.
This time I also drank my own cooked customer -limited private room plum wine 😋😋",False,0.306,0.035,0.659,0.9412
"店員很親切
餐點好吃！😋超推娃娃菜和玉子燒，可惜今天沒有玉米筍！！！ 還拿出自釀七個月的梅酒！有夠好喝🥰
下次要再來吃玉米筍","The clerk is very kind
The meal is delicious!和 和 😋 😋 😋 😋 😋 😋 😋 😋 😋, unfortunately there is no corn bamboo shoot today!IntersectionIntersectionI also took out the seven -month -old plum wine!Have enough deliciousness 喝
I will come again next time to eat corn bamboo shoots",False,0.084,0.102,0.814,0.3333
從國中吃到現在，至少有10餘年了，師傅烤功好是居酒屋的重點，在氣氛上也是下班的人必須獲得的歸處良好的下班避風港～,"It has been eaten from the middle school to now, and it has been at least more than 10 years. The master of the master is the focus of the izakaya. In the atmosphere, it is also a good off -work shelter that people who have to get in the atmosphere ~",False,0.054,0.0,0.946,0.4404
"吃光光才想到要拍因為一上桌立刻被清空
真的好吃！唯一指名小賴烤超讚👍
烤魚很嫩、很香
雞肉每個口味都好吃
豬肉跟牛肉也都非常好吃😋
大推這家！！！","I thought to take a picture because I was on the table and was immediately emptied immediately
It's really delicious!The only referring to the name of Xiao Lai
Baked fish is tender and fragrant
Each taste of chicken is delicious
Pork and beef are also very delicious
Push this house!IntersectionIntersection",False,0.145,0.03,0.825,0.8214
"店員熱情 梅酒好喝 還可以點歌哦！
人情味10足
居酒屋首選👍🏻👍🏻👍🏻","The clerk is enthusiastic about plum wine and you can sing it!
Humanistic sense of 10 full
Izakaya preferred 首",False,0.155,0.0,0.845,0.5411
"下了班，來吃一波再喝一杯是最讚的事
好吃之外，服務又好，師傅會關心口味有沒有ok
親切，讚讚讚","After going to work, come to eat a wave of drinking another cup is the best thing
In addition to delicious, the service is good, the master will care about the taste is OK
Careful, praise",False,0.433,0.0,0.567,0.9688
"後山埤一介小地方（？）有竹村這在水準之上上上店，真的是太好了( ´ ▽ ` )ﾉ
串燒類都醃漬入味、熟度剛好、口味適中
燒烤海鮮也都新鮮好吃
店員的服務親切和藹 能關注客人需求
是在地深耕多年且CP值高的居酒屋🤩","Hirosami Aya Simrai (?) There is Zhushan to go to the store at the level, which is really great (´ ▽ `) ﾉ
Ching skewers are marinated and delicious, cooked just right, and the taste is moderate
Barbecue seafood is also fresh and delicious
The service of the clerk is kind and kind to pay attention to the needs of guests
It is the izakaya with a deep cultivation of the ground for many years and the high CP value.",False,0.241,0.014,0.745,0.9716
"食物真的好吃..等的時間其實算可以,畢竟一個人餐點一多時間上一定會稍微會慢，但我覺得居酒屋不就是要慢慢來而享受那氛圍、聊天、喝酒、吃東西時光。
店家服務也很親切真的很棒的👍👍👍👍👍
會再光顧唷！","The food is really delicious .. It is actually possible to wait. After all, a person will be slightly slower for a meal for a while, but I don't think the izakaya just wants to enjoy the atmosphere, chat, drink, eat, eat, eat, eat, eat, eat, eat, eat, eat, eat, eat, and eat. Time.
The store service is also very kind and really great 👍👍👍👍👍
Will see again!",False,0.2,0.0,0.8,0.9648
"滿滿五顆星🌟🌟🌟🌟🌟
小賴師傅無法挑剔😳
準備了私房菜好好吃
餐點也準備的很用心
唯一推薦小賴！！
一定會再來～","Full of five stars 颗
Master Lai can't be picky 傅
I have prepared a private dish and delicious
The meals are also prepared very carefully
The only recommended Xiao Lai!Intersection
I will definitely come again ~",False,0.312,0.0,0.688,0.9019
"燒肉飯跟蛋完美融合
每次來吃飯必點
還有師傅極致的燒烤配上冰箱裡的啤酒完美搭配在一起，最後的下酒菜配上透抽跟午仔魚做完美的收尾~~
宵夜首選竹村No.1","Rice rice and eggs perfectly blended with eggs
Every time you come to eat, you must order
There are also the master's ultimate barbecue with the beer in the refrigerator perfectly matched together.
The preferred bamboo village NO.1",False,0.189,0.0,0.811,0.8555
"餐點好吃～
唯一指名最帥師傅小賴燒烤👍","The meal is delicious ~
The only name for the most handsome master Xiao Lai Barbecue 👍",False,0.31,0.0,0.69,0.8016
"激推！好吃，好喝～
生日來吃，桌上還有店家擺放的生日快樂，超級用心超級感動，餐點都是現做，烤飯糰令人驚豔，很適合三五好友聚餐，小酌一番，烤物也是必推～","Push!It's delicious, delicious ~
Eat on birthdays. There are also happy birthdays on the table. The super -intention is super moved. The meals are all made. The grilled rice ball is amazing. It is very suitable for three or five friends to dinner. ~",False,0.414,0.0,0.586,0.98
口味偏重但整體都很好吃  也比信義店來的優  乳酪豆腐這道超讚  比較少看到居酒屋有這道  推推  可惜出菜頗慢  不曉得為什麼味噌湯一直出不來  到最後結帳離開也沒吃到,"The taste is heavy, but the overall is delicious and more delicious than the Xinyi Store. This is a great thing to see the izakaya with this push. Unfortunately, it is quite slow. I haven't eaten either",False,0.31,0.059,0.631,0.9441
"氛圍很好…很適合小酌一杯
老闆態度很親切的

超推薦👍","The atmosphere is very good ... very suitable for a drink
The boss is very kind

Super recommended 👍",False,0.451,0.0,0.549,0.9206
東西好吃！價格合理！重點是小賴服務超好！,Things are delicious!Reasonable price!The point is that Xiao Lai's service is super good!,False,0.411,0.0,0.589,0.826
"臨時找到的一家居酒屋
覺得餐點口味很不錯，但服務體驗一般，老闆一人烤肉備餐
人手不是太夠，蠻辛苦

一開始人到時，老闆說要全員到
才可以入座，我只好在外面等
後來看裡面沒什麼人，他想了一下就說可以先進來⋯⋯
大概有2桌客人，店內不是太大
大概就是6-7桌

點餐是用畫記送到前台
比較推的有
「明太子烤飯糰」、「烤肥腸」
「美國牛肋串」、「明太子雞肉串」
「烤豆皮」、「味增湯」
這個天氣喝碗湯真的不錯

有收街口支付，這點算很方便
我覺得最大的不滿意是老闆給人
的態度跟口氣還挺不客氣…
身為客人我們盡量配合，但
我們也都會很客氣
這點有改進會更好。","A house where I was temporarily found
I think the taste of the meal is very good, but the service experience is average.
People are not too much, it's quite hard

At the beginning of the person, the boss said that all the members would arrive
I can take a seat, I have to wait outside
Later, there was no one in it. He thought it would say it could come in first ...
There are about 2 table guests, the store is not too big
It is about 6-7 table

Ordering is to send it to the front desk with a picture
More pushed
""Prince Ming Prince Baked Rice ball"", ""Baked Fat Intestine""
""American beef rib skewers"", ""Prince Prince Chicken String""
""Baked Bean Skin"", ""Taste Soup""
It's good to drink a bowl of soup in this weather

There is a collection of street entrances, which is very convenient
I think the biggest dissatisfaction is the boss given people
The attitude and tone are quite polite ...
As guests, we try to cooperate as much as possible, but
We will also be very polite
This will be better to improve.",False,0.066,0.044,0.889,0.6712
"上菜速度快，老闆一人在烤

烤年糕是鹹的口味，嚐鮮
玉米筍有淡淡的奶油味，本身就很甜
肉類串烤外酥內嫩，調味好吃的
竹村燒是大阪燒，外面有烤出一層酥酥的口感
烤飯糰的外層會烤的酥酥脆脆的，米飯口感是柴+硬，不是很習慣
明太子給的份量很充足
整體好吃

環境的話，煮食材香味道混在一起，如果不能接受沾染氣味的話，不推

燈光偏暗黃色，不刺眼
菜單有改版過，牆壁上有些以前的菜色看起來也是令人食慾大開
好吃好吃","Fast speed of serving, the boss is roasting alone

Baked rice cake is a salty taste, early adopters
Corn bamboo shoots have a faint creamy flavor, and it is very sweet itself
The meat skewers are grilled outside and tender, and the seasoning is delicious
The Bamboo Murakama is burned in Osaka, and there is a layer of crispy texture outside
The outer layer of the grilled rice ball is crispy and crispy. The rice taste is firewood+hard, not very used to it
The weight given by Prince Ming is sufficient
Overall delicious

In the environment, the fragrance of the ingredients is mixed together.

The lights are dark yellow, not dazzling
The menu has been revised, and some of the previous dishes on the wall also seem to be appetizing.
Delicious and delicious",False,0.123,0.014,0.863,0.9524
一夜干非常好吃！店員很健談非常放鬆的場合！,It is very delicious overnight!The clerk is very talkative and very relaxed!,False,0.447,0.0,0.553,0.843
"找小賴師傅準沒錯👍🏻👍🏻👍🏻👍🏻👍🏻
服務好手藝好還有隱藏菜色
我是梅酒愛好者自釀梅酒真的沒話說","Master Lai Master is right 师
Good handicrafts and hidden dishes
I am a plum wine enthusiast, self -brewed plum wine really has nothing to say",False,0.184,0.0,0.816,0.6597
推薦燒肉飯跟日式蛋捲還有蔥燒牛肉 每一樣都好吃 帥老闆還會招待！,"Recommended roast meat rice, Japanese egg rolls, and spring onion beef are delicious and handsome bosses will also entertain!",False,0.429,0.0,0.571,0.8832
超好吃，自己釀的梅酒很好喝！！,"It's so delicious, the plum wine I brew is delicious!Intersection",False,0.323,0.0,0.677,0.6468
點了兩顆鮭魚烤飯糰跟烤魚 電話很明確說了兩顆鮭魚飯團、到了現場取餐 發現單子上是明太子1鮭魚1，跟一個瘦瘦的店員反應後，他回答：啊你有說嗎？你又沒有說兩顆鮭魚飯團 你電話沒說，我回答他有啊我電話有講他又跳針說沒有啊你沒有說啊。態度這麼差，多不想上班？餐點很好吃五顆星 服務態度我多給一顆星😀,"I ordered two salmon grilled rice balls and grilled fish. The two salmon rice balls were clear. When I got the meal on the scene, I found that the Salmon 1 was on the list. After responding to a thin clerk, he replied: Ah, do you say, do you say? IntersectionYou didn't say that the two salmon rice balls did not say, I answered him, I said, I said that he had jumped and said no. You didn't say it.The attitude is so bad, do you not want to go to work?The meal is very delicious, the five -star service attitude I give one more star 😀",False,0.082,0.048,0.87,0.6147
食物好吃，梅酒好喝，服務好棒👍,"The food is delicious, the plum wine is delicious, the service is great 👍",False,0.489,0.0,0.511,0.91
"位置很小的店，但東西都蠻好吃的，上菜速度也滿快，整體價格以串燒來說也滿親名的，一支大概50-70元，都蠻大串，可惜的是品項比較少

蛋捲、烤雞皮，明太子雞肉、豆皮都非常好吃很可以點！味噌湯裡面的蛋是半熟荷包蛋很特別，所有的肉串都調味的很好吃，玉米筍也不錯付的調味粉有孜然，吃起來很棒","Stores with a small location, but things are pretty delicious, and the speed of serving is full of fast. The overall price is also full of names in terms of skewers. One is about 50-70 yuan, which is quite large. Unfortunately Less items

Egg rolls, grilled chicken skin, prince chicken and bean skin are very delicious and can be ordered!The eggs in the miso soup are very special, all skewers are delicious, and the flavor of corn bamboo shoots is also good.",False,0.263,0.033,0.704,0.9808
"建議先訂位～

推薦必點：蛋捲、鹽烤雞肉串、玉米筍
其他就看個人喜好！

生意很好，點好後上菜要稍等～","It is recommended to order first ~

Recommended points: Egg rolls, salt grilled chicken skewers, corn bamboo shoots
It depends on personal preferences!

The business is very good. After ordering, wait for the food ~",False,0.181,0.0,0.819,0.7257
"來找小賴師傅就對了
東西美味可口 宵夜晚餐聚餐首選👏👍👍","It's right to come to Master Lai
The first choice of something is delicious, delicious supper dinner dinner 👏👍👍",False,0.252,0.0,0.748,0.8126
"單價不高所以點餐沒考慮價格，想吃什麼就點！
烤物技術好，肉類串燒都用心，
雞心還獨特造型，可能這樣劃開是獨特的烤技！
個人最喜歡烤飯糰和玉米筍，
烤飯糰很香有豐富的包料不會死鹹，
烤得像鍋巴的口感好喜歡喔！
玉米筍就是食材新鮮，烤過還有維持濕潤，真好！
柳葉魚烤得香酥，魚卵好多吃起來好滿足！
還有幾道因為太貪吃沒拍到就先吃完了，
看不到照片來隱藏推一下，烤香菇很好吃喔！
每次去都坐在門口進去第一桌，
不能出國也能重溫日本味！","The unit price is not high, so you do n’t consider the price, just order if you want to eat!
The grilled material technology is good, and the meat skewers are attentive.
The chicken heart is still unique, and it may be unique to bake this way!
Personally like roasted rice balls and corn bamboo shoots,
The grilled rice ball is very fragrant and rich in packaging, it will not die, and it will not die.
It ’s like a pot like a pot!
Corn bamboo shoots are fresh ingredients, and they are roasted and keeping moist, so good!
The willow fish is grilled crispy, and the fish eggs are so satisfied!
There are still a few more because they are too greedy and not taken, they will be eaten first,
I can't see the photos to hide it. The grilled shiitake mushrooms are delicious!
Every time I go, sit at the door and enter the first table,
You can relive the taste of Japan if you can't go abroad!",False,0.203,0.02,0.777,0.9887
"食物很好吃 有10%服務費
推薦烤飯糰 雞肉串 雞皮 肥腸 都很好吃
烏龍麵偏台式偏濕再加上章魚燒口味 還算可以
牛橫膈膜偏油 不知道是不是冷掉 吃起來相較上面的品項遜色一點","Food is delicious and 10%service fee
Recommended grilled rice balls, chicken skin, chicken skin, fat intestines are delicious
Oolong noodles, dampness, and octopus roasted flavor is okay
I don’t know if it is cold and it is a bit inferior.",False,0.227,0.055,0.717,0.8126
好吃，但出餐需要等一下，只有老闆一個人所以速度不會太快,"It's delicious, but you need to wait for meals, only the boss is alone, so the speed will not be too fast",False,0.095,0.101,0.805,-0.0387
"菜單看似沒有太多選擇
但是每道都讓人很驚艷","The menu seems to not have much choice
But every channel is amazing",False,0.302,0.0,0.698,0.7351
這是我第二次造訪了，烤飯糰超好吃，蛋卷我也愛，烤脆雞皮真是一絕！京都啤酒好好喝！下次還要再來！,"This is my second visit. The grilled rice balls are super delicious, and I love the egg rolls. The crispy chicken skin is really a must!Kyoto beer is delicious!I will come again next time!",False,0.29,0.0,0.71,0.9284
"我們予晚上約23：00左右剛在門口看菜單時，老闆面帶微笑，溫暖的聲音歡迎我們的到來，讓我很放鬆入內
享用他們的服務，當享用餐點時，哇！師父烤得五花牛及鷄腿肉真的超棒，肉滑嫩多汁又清甜，尤是炒烏龍
麵及燒肉飯味道超讚，請大家可以來此地一嚐，享受美味，會讓你們回味無窮喔！","When we just watched the menu at the door about 23:00 in the evening, the boss smiled, and the warm voice welcomed our arrival, making me relaxed in it.
Enjoy their services, when enjoying meals, wow!Master grilled porkye beef and chicken legs is really great, smooth and juicy and sweet, especially fried oolong
Noodles and roast meat rice tastes great. Please come here to taste it. Enjoy deliciousness will make you memorable!",False,0.388,0.0,0.612,0.9891
"在這裡,你可以體驗到很日式的居酒屋風情
個人推薦他們家的烤飯糰及肥腸
那個肥腸啊........北部應該找不到比他們家烤得更好的了!!
結帳速度----->可能是換新POS系統吧,感覺要慢慢來","Here, you can experience a very Japanese -style izakaya style
Personally recommend their grilled rice balls and fat intestines
That fat intestine ........ The north should not be able to find better than their house !!
Rating speed -----> Maybe it may be a new POS system, I feel that you need to take it slowly",False,0.1,0.0,0.9,0.717
"居酒屋來說是平價好吃的！
但進去店裡的油煙味有一點重
少了生啤酒😆😆😆抱歉我啤酒派
但整體來說還不錯 …","Izakakaya is cheap and delicious!
But the smell of oil fume in the store is a bit heavy
Lares on raw beer, sorry for my beer school
But overall pretty good ...",False,0.257,0.101,0.642,0.8197
肉串好吃 海鮮新鮮 老闆親切 店內氣氛適合喝酒,"The meat skewers are delicious seafood fresh boss, the atmosphere in the store is suitable for drinking",False,0.286,0.0,0.714,0.7184
服務親切，東西好吃,"The service is cordial, the things are delicious",False,0.346,0.0,0.654,0.5719
燒烤真的很好吃，因為需要等待所以記得一次點好，才不用擔心要等。內用空間小氣氛佳，用餐需10%服務費，開瓶費300。燒肉飯份量好少不要點，寧可等烤雞腿飯好香好嫩♡烤香菇青椒都不錯！鹽烤雞肉串真的很推喔！,"The barbecue is really delicious, because you need to wait, so remember to have a little better at a time, so you don't have to worry about waiting.The small atmosphere of the space is good, the meal requires a 10%service fee, and the bottle opening fee is 300.The roast meat rice is small, so it is better to wait for the grilled chicken legs to be so fragrant and tender.The salt grilled chicken skewers are really pushing!",False,0.176,0.0,0.824,0.9367
"沒什麼好說的 東西好吃 店員夠會聊天
一百分的體驗","Nothing to say something, delicious shop clerk is enough to chat
One hundred points of experience",False,0.198,0.0,0.802,0.5719
"烤鯖魚熟度烤的剛剛好
小賴服務很好 ❤️","Baked fish cooked is just right
Xiao Lai service is very good ❤️",False,0.197,0.0,0.803,0.4927
"雖然只有老闆自己一個人
但上餐速度還算快
東西也都蠻好吃的👍🏻👍🏻
乳酪豆腐我很喜歡❤️","Although the boss is alone
But the meal speed is quite fast
Things are all delicious 蛮
Cheese tofu, I like it very much ❤️",False,0.253,0.046,0.701,0.8316
真的算吃過前幾名好吃的店，店員小賴燒烤技術真的好，氣氛非常好，也謝謝小賴招待了不少餐點～～非常推～～,"I really have eaten the first few delicious shops. The clerk Xiao Lai barbecue technology is really good, and the atmosphere is very good. Thank you Xiao Lai for entertaining a lot of meals ~~ Very pushing ~~",False,0.323,0.0,0.677,0.9409
價錢親民，烤得也蠻好吃的，份量不小可以吃得飽！氣氛算輕鬆，但就像大家說的，服務生的態度不友善，可以理解人手不足忙碌而忽略該有的禮貌，但一再被消費者提出也該檢討才對。,"The price is close to the people, and it is delicious to roast.The atmosphere is easy, but as everyone says, the waiter's attitude is not friendly. It is understandable that people are not busy and ignore the politeness, but it should be reviewed by consumers and should be reviewed.",False,0.126,0.062,0.812,0.366
很多串燒店都容易吃到最後幾乎都同一個味道，這間的不會！好多不同的味道，也都很好吃，很特別！老闆人超好，店裡氛圍也不錯！,"Many skewer shops are easy to eat in the end, almost the same taste, this will not be!A lot of different tastes are delicious and special!The boss is super good, and the atmosphere in the store is also good!",False,0.336,0.0,0.664,0.953
