Original,EN,Needs Review,Positive,Negative,Neutral,Compound
"前幾天去用餐被那邊的師傅（小賴）驚艷到了，平平無奇的雞翅因為師傅的擺盤顯得格外好吃，之後吃了一口後面加上檸檬🍋直接讓味道再上一個檔次！
也推薦燒肉飯配著烤透抽🦑一起下酒，燒肉飯上的肉配酒也非常搭配，燒肉飯吃完接著配著有嚼勁的透抽還有冰箱的啤酒🍻，住這附近的住戶有福了！
來這邊必點烤透抽、日式蛋捲、烤雞翅、燒肉飯！
也感謝廚房師傅（小賴）還有外場弟弟（安哲）招待的私家私釀梅酒！","A few days ago, I was stunned by the master (Xiao Lai) over there. The flat chicken wings were particularly delicious because of the master's plate. After a bite, the lemon cricket was added to make the flavor the same grade!
It is also recommended that roast meat rice with roasted pumps to add wine. The meat and wine on the roast rice rice are also very matched. The nearby residents are blessed!
Come here, you must order roasting, Japanese -style egg rolls, grilled chicken wings, and shredded meat rice!
Thank you also for the kitchen master (Xiao Lai) and the privately -private plum wine enrolled by his brother (An Zhe)!",False,0.111,0.012,0.878,0.9179
比起平日假日來會比較沒有擁擠的感覺，平日每次來幾乎客滿，東西好吃推薦招牌雞肉串、烤豆皮、炒烏龍麵,"Compared to the usual holiday, there will be less crowded. Every time you come every day, you are almost full. It is delicious to recommend signature chicken skewers, roasted bean skin, fried oolong noodles",False,0.223,0.0,0.777,0.836
"餐美味份量很夠，餐廳內的裝飾也很棒！
最推薦
1. 烤飯糰
2. 蛋包味增湯
3. 烤玉蜀黍
好吃會再回訪！","The meal is delicious enough, and the decoration in the restaurant is also great!
Most recommended
1. Baked rice ball
2. Eggbag flavor soup
3. Baked jade
If you are delicious, you will return to visit again!",False,0.301,0.0,0.699,0.9346
食材雖然是基本的樣式，但卻能從師傅的巧手中變得十分美味，這是一家店最精華最重要的部分，裝潢不過於奢華，但這就是居酒屋的原始樣式，下班的人最需要的是這兩項。,"Although the ingredients are basic styles, they can be very delicious from the master of the master. This is the most essence and most important part of the store. The decoration is not too luxurious, but this is the original style of the izakaya. These two items.",False,0.137,0.0,0.863,0.7178
牛肉的品質無話可說，一口肉一口酒，超級感動 。老闆員工的態度都非常得好，一定要來試試,The quality of beef is nothing to say.The attitude of the boss and employee is very good. You must try it,False,0.138,0.0,0.862,0.4927
豪豪吃～剛好遇到颱風天限定招待,Haohao eats ~ just encounter typhoon days limited entertainment,False,0.239,0.162,0.598,0.2263
"初訪這家分店
超喜歡💕沒有雷物🥹
只有好吃和超好吃～梅酒👍🏻
很喜歡這裡的食物、音樂還有店員☺️
一定會再來很多次的🤎","First visit this branch
I like 物 物 物 💕 💕 💕 💕 💕 💕
Only delicious and super delicious ~ plum wine 👍🏻
I like the food, music and the clerk here ☺️
I will definitely come again many times",False,0.551,0.0,0.449,0.9939
東西很好吃耶！！蛋捲、午魚、牛肉串樣樣好吃！！服務人員也親切，尤其是老闆很愛笑,"Things are delicious!IntersectionEgg rolls, noon fish, beef skewers are delicious!IntersectionThe service staff is also kind, especially the boss loves to laugh very much",False,0.366,0.0,0.634,0.9109
牛肋條好吃！直接怒吃八串XD,Ribs are delicious!Eat eight string XD directly,False,0.446,0.0,0.554,0.7027
"串燒實在，明太子雞肉串，滿滿的明太子，非常厚實呢！

雞軟骨口感很脆，很特別，決定軟硬度剛好，豬肉串雖然肥肉稍多，但吃起來的口感依然不錯，推推。

竹村燒跟大阪燒很像，不能出國也小小懷念了國外的口感～","The skewers are real, the Chicken Chicken skewers, full of Ming Prince, is very thick!

The chondrocytes are very crispy and special. It is determined that the softness and hardness are just right. Although the pork skewers are slightly more fat, the taste is still good, pushing.

Takeura Burning is very similar to Osaka, and I can't go abroad and miss the taste of foreign countries ~",False,0.117,0.022,0.861,0.7879
"明太子烤飯糰烤的焦香焦香配著酥脆海苔片，那種縈繞在口腔中的海中氣息真是棒透了！
進口的日本酒讓人看得眼花撩亂，頗有特色。
其他菜色火力不足，需加強","The scorching fragrant fragrant fragrant fragrant fragrance of the Ming prince is covered with crispy sea moss slices. The breath of the sea lingering in the mouth is really great!
The imported Japanese wine is dazzling and distinctive.
Other dishes are insufficient firepower, and it needs to be strengthened",False,0.137,0.0,0.863,0.8169
"經過了就停下來喝一杯吧總希望附近可以找一間不錯的居酒屋 可以當作自己的廚房隨時來喝一杯
店員的服務態度一般般 不算好 現做的烤物上菜速度以及味道倒是還不錯 不過cp值不高 且沒有生啤酒 店裡提供的是琉球啤酒Orion跟Asahi 但不是生啤且是小玻璃瓶 不適合豪飲 只能嚐嚐味道 沒吃晚餐的我 吃下來要近1500了 貴","After passing it, stop and drink a cup. I always hope that a good izakaya can be found nearby.
The service attitude of the clerk is generally not as good as the current grilled items and the taste and taste of the dishes are not bad. However, the CP value is not high and there is no beer in the raw beer. It's not suitable for the huo drink, I can only taste the taste, I don't eat dinner, I eat it nearly 1500, it's expensive.",False,0.114,0.07,0.816,0.6421
雖然久久才來一次，但味道還是很讚喲，尤其是必點的和風沙拉跟燒烤類,"Although it has only been here for a long time, the taste is still very good, especially the must -order Kato salad and barbecue",False,0.122,0.0,0.878,0.4927
蛋捲、玉米筍必吃🍴很適合下班小酌和兩三人小聚的地方。店不大但是佈置跟整體很溫馨 …,"Egg rolls and corn bamboo shoots must be eaten. It is very suitable for get off work drinking and two or three people.The store is not large, but the layout is very warm ...",False,0.078,0.0,0.922,0.4194
"CP值不錯
但出餐比較慢一些，適合不太餓不趕時間的人
服務的女店員態度蠻好的
玉米筍很甜
招牌雞肉串和玉子燒依舊美味","CP value is good
But the meal is relatively slow, suitable for people who are not hungry or not
The female clerk who serves a good attitude
Corn bamboo shoots are very sweet
The signature chicken skewers and Yazi roast are still delicious",False,0.309,0.0,0.691,0.9516
今天來吃推薦的烤透抽+鱈魚肝沙拉，味道和口感直接贏過全台灣所有居酒屋🏮,"Let's eat recommended roasted pump+cod liver salad today, taste and taste directly win all izakaya in Taiwan",False,0.272,0.0,0.728,0.6808
"五分埔這邊難得的好吃店
cp值高
今天偷買宵夜
烤類吃過 塩燒牛、豬五花、玉米筍、孜然羊
烤飯糰很香 外帶回家用附上的海苔包起來 無敵好吃 店員把海苔另外包 不會軟掉 飯也還是熱的
今要點秋刀 沒貨 改點柳葉（120元六隻）
驚艷
調味好 外酥內軟又juicy
整隻好好吃 一下就光了

下次要去回味幾年前點的味增螃蟹湯 （120）
看看是否仍是美味！","The rare delicious shop on Wenpu here
high CP value
Steal the supper today
Bake has eaten roasted beef, pork pork flowers, corn bamboo shoots, cumin sheep
The grilled rice ball is very versatile. Take home the seaweeds attached to the invincible and delicious shop assistants.
Today, some autumn knives are out of stock to change some willow leaves (120 yuan six)
Stunning
Season well and crispy and soft inside and juice
It's just delicious, it's just a bit delicious

The next time I want to remember the flavor of crab soup that I ordered a few years ago (120)
See if it is still delicious!",False,0.236,0.025,0.739,0.9781
"環境不優 蚊子超多 室內空氣不流通 油煙味 煙臭味濃厚
餐點調味不好吃 擺盤隨便 份量較少👎🏻👎🏻👎🏻👎🏻👎🏻👎🏻
服務完全零 還收一成服務費⋯還沒有附水 極度之不推薦
店員自己點餐機沒點到餐點 還直接拒做 說火爐已關閉 傻眼 連半句不好意思都沒說 拒絕往來之戶 很久沒看見這種服務態度不佳的店","The environment is not good, mosquito, and the indoor air does not flow oil smoke flavor, smoke odor, strong smell
The meal is not delicious, the dish is not delicious, and the portion is less.
The service fee is completely zero and the service fee is not recommended.
The clerk did not order the meal machine himself, and he directly refused to say that the stove had been turned off and was dumbfounded even half -sentence.",False,0.053,0.169,0.778,-0.8479
在五分埔旁，停車方便（對面有地下停車場），串燒價格親民，可以盡情點一輪，讓人吃的很盡興，味道還可以。內場、外場各一人，所以如果客人多的話，等候出餐的時間較長。廁所挺有意思的。,"Next to Wuqi Po, the parking is convenient (there is an underground parking lot on the opposite side). The price of the skewers can be affordable.One person in the inside and outside field, so if there are many guests, the waiting time for meals is longer.The toilet is very interesting.",False,0.058,0.0,0.942,0.4576
"老闆人很好
鹽烤雞肉串好吃 玉米筍好吃 蛋捲也好吃
一個人喝了兩瓶👍","The boss is very good
Salt grilled chicken skewers are delicious corn bamboo shoots delicious egg rolls are delicious
Drink two bottles alone 了",False,0.405,0.057,0.538,0.923
餐點和服務滿分，裝潢偏懷舊和窄窄的，店員很熱情的介紹餐飲還提供自製梅酒！忘記拍照片因此只有留言～,"The meal and service are full, and the decoration is old and narrow. The clerk warmly introduces the catering and also provides homemade plum wine!Forget to take a picture therefore, there is only a message ~",False,0.079,0.0,0.921,0.4574
串烤真的很入味喔，老闆人很好很健談，裡面的酒很讚哦！真的好吃,The skewers are really delicious. The boss is very good and talkative. The wine inside is very good!Really delicious,False,0.417,0.0,0.583,0.9092
餐點份量不多，酒也不算太驚艷，整體而言有點普通,"The meal is not much, and the wine is not too amazing.",False,0.0,0.218,0.782,-0.4717
"CP值還行，菜色選擇不多，座位有點少 建議可提早來或是訂位。
餐點部分牛肉都有點過柴，但牛肉蔥卷好吃，日式蛋捲推。
推雞肉串燒系列，鹽味和招牌雞肉都好吃。","The CP value is okay, there are not many dishes, and the seats are a bit less recommended to come early or book.
Some of the beef are a bit of firewood, but the beef green rolls are delicious, and the Japanese -style egg rolls are pushed.
Push chicken skewers, salt flavor and signature chicken are delicious.",False,0.218,0.0,0.782,0.9261
好吃的串燒店，建議可以先預約，店內座位沒有很多，餐點品質算中上，各種酒類，除了廁所沒有肥皂以外其他都很不錯～,"For delicious skewers, it is recommended to make an appointment first. There are not many seats in the store. The quality of the meal is calculated, all kinds of alcohol, and there are no soap except the toilet.",False,0.129,0.052,0.82,0.5106
大推薦CP 值超高～五分埔附近超棒的日本料理店，蛋捲、龍蝦烤飯糰、烤魚…都無敵美味！,"The big recommended CP value is super high ~ The superb Japanese restaurant near Wuqi Po, egg rolls, lobster grilled rice balls, grilled fish ... are invincible and delicious!",False,0.457,0.0,0.543,0.9606
老板人很好，很親切，東西口味也不錯，有看到可以去吃,"The boss is very good, very kind, and the taste of the thing is good. If you see it, you can eat to eat",False,0.324,0.0,0.676,0.8764
餐好吃，價錢實惠，氣氛好，師傅私釀的梅酒好喝，just a wonderful experience :),"The meal is delicious, the price is affordable, the atmosphere is good, the master's private plum wine is delicious, just a wonderoful experience :)",False,0.399,0.0,0.601,0.9231
"吃完拉麵後的第二家店，料理ok
老闆酷酷的","The second store after eating, cooking is OK
Boss cool",False,0.395,0.0,0.605,0.6408
串燒50起跳，玉米筍必點，多汁又好吃，皮都拿起來嗑了，飯糰又一點點烤過頭偏硬，早點起烤架會更好！,"Skewers are 50 jumps, corn bamboo shoots must be ordered, juicy and delicious, the skin is picked up, the rice ball is baked a little bit hard, and it will be better to grill the rack early!",False,0.164,0.027,0.809,0.7763
"招牌的串燒 招牌料理都很美味
推薦的啤酒也好喝 又不貴
會再訪的好店","The skewers of the signboards are all delicious
Recommended beer is also delicious and not expensive
A good shop to visit again",False,0.311,0.081,0.608,0.7779
"東西超好吃，服務人員很nice,以後肯定要常來吃","The things are super delicious, the service staff is very nice, and you must come to eat often in the future",False,0.373,0.0,0.627,0.8932
"10年來的忠實客戶～每個星期必須報到的店、
食材好、服務好👍
超級推薦👍","10 years of loyal customers ~ shops that must be reported every week,
Good ingredients, good service 、
Super recommendation 👍",False,0.416,0.0,0.584,0.9153
店狗需自備唷,Shop dogs need to bring themselves 需,False,0.0,0.0,1.0,0.0
"老闆帥氣又可愛，餐點又好吃
今天喝了私藏梅酒，超好喝的👍👍👍","The boss is handsome and cute, and the meals are delicious
Today I drank a private wine, super delicious 👍👍👍",False,0.467,0.0,0.533,0.9552
昨晚和朋友去小酌，東西好吃，酒也很棒。,I went to drink with my friends last night. The things were delicious and the wine was great.,False,0.421,0.0,0.579,0.8979
梅酒好好喝！餐點也很讚💓 烏龍麵意外很喜歡💓,Plum wine is delicious!The meal is also very good.,False,0.303,0.0,0.697,0.54
店員很認真介紹 也有老闆招待梅酒 但我不敢喝啊啊啊啊,"The clerk carefully introduced that some boss entertaining plum wine, but I dare not drink it ah ah",False,0.167,0.0,0.833,0.296
加班後的小酌，招牌雞肉好好吃，烤飯糰也不賴～～～,"After overtime, the signature chicken is delicious, and the grilled rice ball is not bad ~~~",False,0.319,0.0,0.681,0.7615
這麼貼心的店還不來嗎🤨,Isn't such a thoughtful shop yet?,False,0.0,0.304,0.696,-0.2924
Cp值高，突然想吃點串燒很適合來。,"The CP value is high, and I suddenly want to eat a skewers. It is very suitable.",False,0.198,0.0,0.802,0.4019
"餐點很好吃😋
員工服務很親切
推推大家來🫶🏻","The meal is delicious 好
Employee service is very kind
Push everyone",False,0.425,0.0,0.575,0.8122
東西很好吃！很適合來小酌一下～,Things are delicious!It's very suitable for a drink ~,False,0.0,0.0,1.0,0.0
"料理用心
飯糰、玉米筍好吃","Disquest
Rice ball, corn bamboo shoots are delicious",False,0.346,0.0,0.654,0.5719
以前非常喜歡，但上次吃雞肉串肉不新鮮，烤的也不好，讓人覺得失望。可能不會再去了,"I used to like it very much, but the last time I ate chicken skewers was not fresh, and the roasted was not good, which made people feel disappointed.Maybe I won't go again",False,0.047,0.149,0.804,-0.5862
"店員人很nice
日式蛋捲跟鮭龍燒飯團很好吃🍙 …","The clerk is very nice
Japanese -style egg rolls and salmon dragon rice balls are delicious ...",False,0.312,0.0,0.688,0.7778
"東西好吃 服務蠻好的 整體cp值高！
最喜歡竹村燒！ 很特別","The overall CP value of the good service is high!
Favorite bamboo village!Very special",False,0.537,0.0,0.463,0.8906
非常推薦的一家居酒屋，價格合理而且有好多道串燒都好好吃！推薦雞腿排跟烤飯糰！,"A very recommended izakaya, the price is reasonable and many skewers are delicious!Recommended chicken legs and grilled rice balls!",False,0.129,0.0,0.871,0.3973
小賴笑容非常療癒讓食物變得更美味❤️,"Xiao Lai's smile is very healing, making the food more delicious ❤️",False,0.371,0.0,0.629,0.7574
餐點好吃酒好喝老闆人更棒😍😍😍,"Meal delicious wine, delicious boss, boss is better 😍😍😍",False,0.58,0.0,0.42,0.9601
"服務超級棒
東西超好吃
酒也超好喝","Server
Things are super delicious
Wine is also super delicious",False,0.717,0.0,0.283,0.9451
很便宜的串燒！而且很好吃！來兩次店員都很親切！,Very cheap skewers!And it's delicious!The clerks are very kind!,False,0.364,0.0,0.636,0.6777
超級好吃！很適合聊天喝酒談是非的地方,"Super delicious!Very suitable for chatting and drinking, talking about right and wrong",False,0.242,0.179,0.578,0.2714
"不知道在趕什麼，東西也難吃
肉都是筋，女店員臉不知道在跩什麼，也沒做什麼敢收10%服務費，我去買路邊攤還比較好，還不跟我收服務費","I don’t know what to catch, and things are ugly
The meat is all tendons, the female clerk's face does not know what he is, and he doesn't dare to charge a 10%service fee. It's better to buy the roadside stall.",False,0.063,0.111,0.826,-0.296
燈光美、氣氛佳,Beautiful light and good atmosphere,False,0.694,0.0,0.306,0.7783
都好吃! 推薦雞屁股、羊肉串、玉米筍、柳葉魚,"All delicious! Recommended chicken butt, lamb skewers, corn bamboo shoots, louvey fish",False,0.367,0.0,0.633,0.6996
好吃之外 主要是氣氛很好！,"In addition to delicious, the atmosphere is very good!",False,0.507,0.0,0.493,0.8012
"服務很差 老闆態度很不好
然後餐點等了1個小時
結賬的時候又不能結？！說他的菜要出了 先不要結
傻眼欸
串燒味道正常 但是用餐經驗真的好差","The service is very poor, the attitude is not good
Then I waited for 1 hour
Can't get out of checkout?IntersectionSay that his dishes are about to be released, don't end up first
Dumbfounded
The flavor of skewers is normal, but the experience of dining is really bad",False,0.0,0.198,0.802,-0.8717
"食物的質素還可以其實不差的
合格的

但是我覺得店舖
的人手分配可以好一點

客人等候時間很長
點的餐點數目不多
但等候時間足足1小時有多

整餐晚餐
只有不停的乾等","The quality of food can be not bad
Qualified

But I think shops
The hand -distribution of the person can be better

The guest has a long waiting time
The number of meals is not much
But how much is waiting for one hour

Dinner
Only keep doing it",False,0.204,0.0,0.796,0.8891
"點了很多菜，入店一個半小時，只來了一個蛋燒和干貝燒（難吃，是扁的花枝丸）。隔壁晚來半小時的客人，都已經快吃飽在打嗝了。
外場店員態度很好，但只會道歉，什麼都不會。內場在烤串的超級跩，不想收客就直說，我可以旁邊車站吃大戶屋。
只能說這種店，罄竹難書、擢髮難數，絕對不會光顧第二次。
（店員結帳時跟我說不好意思免服務費的瞬間，我都笑出來了🙂）","I ordered a lot of dishes, entered the store for an hour and a half, and only one egg burned and dried shellfish (unpleasant, it was flat flower Zhi Wan).The guests who came for half an hour next door were almost full of snoring.
The staff in the field is very good, but only apologize and nothing.The inner field is superb, and I do n’t want to collect the guests.
It can only be said that this kind of shop is difficult to write, and it is difficult to count, and it will never patronize for the second time.
(When the clerk told me the moment when the service fee was free, I laughed.)",False,0.145,0.064,0.791,0.8933
本來很喜歡的店，住附近想小酌一杯會去。前一天打電話預約，到場時店家表示沒有訂位紀錄喔，給他看了通話記錄，也確實是他們店裏面的電話，但店內也無座位了，剩門口吧台座位⋯要我們坐外面吹風⋯那我先訂位幹嘛⋯店家接待表現一副要吃不吃隨便你們的態度！真讓人失望！,"The shop I liked very much, I want to have a drink nearby.I called the appointment the day before. When I was present, the store said that there was no booking record. I showed him a call record. It was indeed a phone call in their shop, but there was no seat in the store. So what should I book first? The store's reception performance is to eat or not, just your attitude!It's really disappointing!",False,0.038,0.117,0.844,-0.8197
"想說裝潢看起來蠻日本風
就進去吃點東西再去夜市
但食物也等太久了吧
老闆服務也太差
非常不禮貌!","Want to say that the decoration looks pretty Japanese style
Go in and eat something and go to the night market
But the food has been waiting for too long, right?
The boss service is too poor
Very impolite!",False,0.07,0.178,0.752,-0.7924
玉米筍跟竹村燒好吃,Boil of corn bamboo shoots and bamboo village delicious,False,0.316,0.0,0.684,0.5719
老闆招待自釀梅酒，好喝！,"The boss entertains its own plum wine, delicious!",False,0.552,0.0,0.448,0.8122
住附近但不常來，來了之後卻發現意外的好吃！以後會再來光顧👍支持 …,"Live nearby but don't often come, but after coming, I found the unexpected delicious food!I will come to patronize again in the future ...",False,0.188,0.0,0.812,0.7463
老闆請喝梅酒，超好喝的！,"The boss please drink plum wine, it is super delicious!",False,0.593,0.0,0.407,0.8805
今天與朋友定位8:30，約8:10到，到的時候剛好同時進場2~3組，一次性的點完餐後第一道菜蛋捲出很快，但吃完蛋捲後等了快一個小時才吃到其他串物，串物上桌後還有三道沒上（透抽、玉米筍、雞皮）。等待時（離蛋捲上完約莫過30分鐘）有詢問店員怎麼那麼久，店員也沒問是哪桌就直接回答在烤盤上烤了。吃完串物後又等，真的有點受不了去問店員，跟他反應等待過久的問題，他一臉就是不耐煩懶得解釋的臉，只說烤物比較多她們爐子有限等等。這些理由其實我跟朋友是接受的，但是他的態度實在是讓人不敢恭維。後來隔壁加點的透抽跟我們的一開始點的透抽同時上的時候我們一臉莫名其妙。接著再次去詢問玉米筍得到的答案是已經在烤箱烤了，但因為這餐實在是吃太久了，朋友待會還有事，就決定打包離開。至櫃台結帳時他說：「你們還有雞皮沒上喔。」「不是還有玉米筍嗎？」結果她一臉問號翻了單子說我們沒點，我跟他強調我們一開始就有點他一臉你騙誰啊的臉就算了，中間我去問玉米筍好了沒的時候你說在烤箱烤了是回達心酸的？最後因為沒算到錢也就直接請他幫忙打包了，打包拿來時也是一臉臭臉，謝謝不好意思抱歉等禮貌性用語都沒說，今晚的服務真的讓人非常的不滿意。這家的東西好吃，但今天的服務員真的是很不好，跟之前去的幾次的用餐經驗相比真的差了非常多。,"Positioning with friends at 8:30 today, John 8:10 arrived, just entered the field at the same time at the same time, and the first vegetable egg rolled out after one -time ordering, but after eating the egg rolls It was only an hour to eat other skewers. After the string was on the table, there were three lanes (pumping, corn bamboo shoots, chicken skin).At the time of waiting (30 minutes after the egg roll, it was less than 30 minutes), I asked the clerk for so long, and the clerk did not ask which table was directly answered on the baking sheet to bake.After eating the skewers, I waited, I really couldn't bear to ask the clerk, and responded to him for a long time. He looked at the face that he was too lazy to explain, and only said that there were limited stoves and so on.In fact, I am accepted with my friends, but his attitude is really unintentional.Later, we added a little pump next door to our face at the same time when we were at the beginning of our penetration.Then I went to ask the answer that the corn bamboo shoots got was already baked in the oven, but because this meal had been eaten for too long, my friend would have something to do later, so he decided to pack and leave.At the counter checkout, he said, ""You still have chicken skin."" ""Isn't there still corn bamboo shoots?"" As a result, she turned the question mark and said that we didn't order it. Who do you lie to your face? Even if you ask the corn bamboo shoots in the middle, you say that it is sad to bake in the oven?In the end, because he didn't count the money, he asked him to help it. When he was packaged, he also had a stinky face. Thank you for sorry, sorry, I did n’t say politely. The service tonight was really dissatisfied.This thing is delicious, but today's waiters are really bad. Compared with the dining experience I have gone before, it is really worse than the previous dining experience.",False,0.064,0.067,0.869,0.217
