Original,EN,Needs Review,Positive,Negative,Neutral,Compound
"我個人覺得這家蠻雷的⋯
前幾天帶著朋友，
跟嚷嚷著要吃日本串燒店的女友，
當時在Google日本料理，
找到了這家，
看評價還不錯才去吃 ，
結果消費用餐的過程我只能給一顆星，
每一樣菜都小小的，像煙灰缸大小就算了，
我們從頭到尾，點了七八樣，
不好吃就算了，
重點是！肉串的部份像橡皮筋一樣，
咬都咬不斷，
咬到到最後都直接吐在煙灰缸裡面！
最誇張的是，上菜的速度！
不誇張！
大部分時間你會發現都是在等，等，等
我們最後幾道菜兩三道菜甚至是點餐完一個多小時才送到桌上（重點是店內只坐了一半的人）
我們隔壁桌兩個不認識的大叔也是，
看他們手推在下巴地等，
期間還到櫃檯催促了兩次，
看他們的表情真的很不耐煩，
然後我女朋友一直叫我不要生氣，
他說就算了，以後不要來就好了，
我真的覺得對這家店很失望，
而且也讓我很丟臉，
那天女朋友下班整天沒吃東西、
好不容易找到一間他一直想吃的日式串燒，
結果最後因為肉太硬吃沒幾口，
也等得太久，
然後沒有生啤酒也沒有生魚片這些我們都可以接受，
但以上那真的太誇張了！！
給一顆星只是告訴你們，
裡面唯一能點的可能只有螃蟹湯，
還有服務人員的態度還ok以外，
我完全找不到找不到任何優點。","I personally think this is a little mine ...
I took my friend a few days ago,
Follow the girlfriend who wants to eat Japanese skewers,
At that time in Google Japanese cuisine,
I found this house,
It ’s not bad to see the evaluation.
As a result, the process of consumption meal can only give one star,
Every dish is small, like the size of the ashtray, even the size of the ashtray,
From beginning to end, we ordered seven or eight,
It's not delicious,
The point is!The meat skewers are like rubber bands,
Bite the bite and bite constantly,
Twitted in the ashtray in the end!
The most exaggerated is the speed of serving!
No exaggeration!
Most of the time you will find that you are waiting, waiting, waiting
Our last few dishes, two or three dishes, or even a meal for more than an hour to send it to the table (the point is that only half of the people in the store)
The two uncle who did not know the table next door, too,
See they push their hands in the chin, etc.
During the period, I went to the counter twice,
Seeing their expression is really impatient,
Then my girlfriend always told me not to be angry,
Even if he said, just don't come in the future,
I really feel disappointed with this shop,
And it also made me embarrassed,
My girlfriend did not eat all day that day,
After finally finding a Japanese skewers he always wanted to eat,
In the end, because the meat was too hard to eat a few mouthfuls,
Wait too long,
Then we can accept no beer or raw fish fillets.
But the above is really exaggerated!Intersection
Give a star just tell you,
The only thing that can be ordered in it is the only crab soup,
And the attitude of the service staff is OK,
I can't find any advantages at all.",False,0.033,0.051,0.916,-0.6234
服務滿分、餐好吃👍,"The service is full, the meals are delicious",False,0.346,0.0,0.654,0.5719
"肉質讚
可訂位，需電話預約","Pork
You can book a place, you need to make a call to make an appointment",False,0.0,0.0,1.0,0.0
價格不貴可以吃的好串燒,The price is not expensive and can be eaten well.,False,0.189,0.0,0.811,0.2732
烤肥腸、雞屁股、鯖魚推推❤️,"Roasted fat intestines, chicken butt, catfish push ❤️",False,0.0,0.0,1.0,0.0
料理雖然還不錯，但遠比網路上找到的菜單的品項還少。結帳的方式很原始(手算)且店員人數只有一人，不免讓人有算錯的疑慮。,"Although the cuisine is not bad, it is far less than the menu found on the Internet.The method of checking out is very original (hand -calculated) and the number of clerks is only one person, which can not help but make people have the wrong doubt.",False,0.129,0.164,0.707,-0.6018
東西還滿好吃的，環境也還OK！只是令人傷心的，帶了孩子老婆生日這天來吃，消費了1903請店員3元打個折可以不？還拿出身份證證明真的生日，還是被無情的收到一句生日快樂。。。不過想想也是，人家只是店員。,"The things are delicious, and the environment is OK!It's just sad. I took my child's wife's birthday to eat on the day. Can I ask the clerk for 3 yuan to get a discount?I also took out the ID card to prove the real birthday, but I was ruthlessly received a happy birthday.EssenceEssenceBut think about it, they are just clerks.",False,0.115,0.031,0.854,0.7678
"CP值高的居酒屋，東西便宜好吃，店員小哥記性好，服務到位又親切。
廁所也很乾淨 ，感覺的出來有認真在經營。
4個人平均花費約8百多元(有點酒)，對我來說算是相當平價的好選擇。","The cp is high -value izakaya, which is cheap and delicious, the clerk's brother is good, the service is in place and kind.
The toilet is also very clean, and it feels seriously operating.
The average cost of more than 800 yuan (a little wine) is a good choice for me.",False,0.286,0.027,0.688,0.9485
串燒幾乎都50元，玉米筍、蛋捲和肥腸好好吃，肉倒是一般，烤飯糰也很不錯，是間CP值很高的店，只是店內位子不多，比較適合2-3人小團體來,"Almost all of them are 50 yuan, corn bamboo shoots, egg rolls, and fat intestines are delicious. The meat is average, and the grilled rice balls are also very good. It is a store with a high CP value. Group coming",False,0.196,0.0,0.804,0.8516
東西好吃又不貴,It's delicious and not expensive,False,0.481,0.0,0.519,0.5719
平價，啤酒價格也還行，兩三人小聚一下可。餐點稍微有待加強，上次點的天使蝦過熟，偶爾烤串也會過熟。,"Pakistic and beer prices are okay. Two or three people gather.The meal has to be strengthened slightly. The angel shrimp at the last time was cooked, and occasionally the skewers would be too cooked.",False,0.128,0.0,0.872,0.5719
"雞肉串燒都不錯，
特別推薦蛋捲及味增湯。
適合第二攤喝酒地方。","Chicken skewers are good,
Special recommendation of egg rolls and flavor of soup.
Suitable for the second stall to drink.",False,0.23,0.074,0.697,0.5859
點了玉米筍，第一次吃以為裡面沒熟，請他們再去烤，回來一樣，應該是玉米筍的問題，真的很不好吃...鮭魚烤飯糰像磚頭一樣，根本咬不下去，其他串燒類也很雷，又油又不好吃，附註一點，廁所要出去旁邊的小巷上，這兩顆星全部是給辛苦的服務人員。,"I ordered corn bamboo shoots. For the first time, I thought it was not familiar. Please bake them again. The same is the same as the corn bamboo shoots. It is really not delicious ... salmon grilled rice balls are like bricks. Other skewers are also very thunderous, and they are not delicious. A little bit. The toilet is going to go out on the alley next to it. All these two stars are for hard -working service staff.",False,0.029,0.112,0.859,-0.73
"非常CP, 雖然是因為偶像劇而紅的店
但真心喜歡他們家的食物
推「招牌蛋捲」、「玉米筍」、「烤飯糰」還有各種牛肉串👍👍 …","Very CP, although it is a red shop because of idol dramas
But I really like their food
Push ""signature egg rolls"", ""corn bamboo shoots"", ""grilled rice balls"" and various beef skewers ...",False,0.103,0.0,0.897,0.5704
好吃😋,Delicious,False,1.0,0.0,0.0,0.5719
沒到三星但大概也只能打3.5，知道日式居酒屋的菜都需要等點時間，但這家上菜速度是真的很慢，店內即使只有五成滿也一樣，然後店本身滿小的，但東西還不錯吃，如果很餓的人不要來這家，會餓到生氣。,"I did n’t reach Samsung, but I could only play 3.5. Knowing that the vegetables in Japanese -style izakaya need to have some time, but the speed of this food is really slow. , But things are pretty good. If you are hungry, do n’t come to this house, you will be angry.",False,0.19,0.069,0.741,0.7814
"迎接我的是一隻大蟑螂。

以前常常看到有人排隊，不知道發生啥事？？整個用餐時間，只有我們這一桌！！！","It was a big cockroach that greeted me.

I used to see someone in line before. I don't know what happened?IntersectionThe whole meal time is only our table!IntersectionIntersection",False,0.081,0.0,0.919,0.3382
"慢到很扯 店內沒坐滿 說單多
點單超過40分鐘 桌上除了瓶裝啤酒沒有其他東西
居酒屋的內用 有人是把前面的人的全部做完才做下一單的嗎？","It's so slow that the shop is not full in the store and said it is full.
Click the order for more than 40 minutes. The table has nothing else except bottle beer
Some people in the inner use of izakaya make the next order after doing all the people in front?",False,0.0,0.0,1.0,0.0
輕鬆自在 ～餐點好吃,Easy and comfortable ~ delicious meals,False,0.767,0.0,0.233,0.872
東西好吃，酒也ok，只是師傅只有一個人所以餐點都要等，服務生也只有一個人，所以要來的話要先訂位要不然沒座位，要等很久，但還好店員的服務態度很好,"The things are delicious, and the wine is OK, but the master has only one person, so the meals have to wait, and the waiter has only one person, so if you want to come, you must book a seat or wait for a long time. Good attitude",False,0.152,0.0,0.848,0.7932
知名偶像劇的分店，雖然是分店但維持總店的水準，推薦烤飯糰根烤甜菜，啤酒當然要來一杯，週末記得要預約避免向隅,"The branch of the well -known idol drama, although it is a branch, maintains the level of the main store. It is recommended to roast the roasted beets. Of course, beer must have a cup. Remember to make an appointment on the weekend.",False,0.087,0.0,0.913,0.4404
各位可以不用再來了☺️,You can no longer come again 各️,False,0.0,0.268,0.732,-0.296
"第三攤去的，
第一次到這家，
之前都是去松仁店，
食物差不多，不過好處在不用等位子，YA!
也可能是因為週日晚上啦","The third spread,
The first time I arrived,
I used to go to Songrenjian before,
The food is almost the same, but the advantage is that there is no need to wait for the seat, YA!
It may also be because of Sunday night",False,0.053,0.065,0.883,-0.1511
個人覺得烤飯糰還不錯，肉串燒普普，尤其羊肉的臊味頗重，招牌竹村燒則像是日式大阪燒 味道不差。,"I personally think that the grilled rice balls are not bad. The skewers are boiled, especially the taste of mutton is quite heavy.",False,0.115,0.0,0.885,0.431
平價美食，上餐速度快👍唯一不太滿意是服務費，真的沒什麼服務的地方……有個外場女店員，帶位很慢，態度不是很親切…… …,"Affordable food, fast meal speed 👍 The only thing that is not very satisfied is the service fee, there is really no service ... there is a female clerk in the field, the position is very slow, the attitude is not very kind ... ...",False,0.0,0.157,0.843,-0.7926
今天跟老婆一起去用餐、迎接我們的是一位臭臉的女服務生、坐很久沒人來服務、我們自己拿菜單去前面點、先問有無推薦、臭臉女服務員說菜單上都有自己看、本來想走了、又想說老婆想吃算了不計較、再度等很久比我們晚來的人卻比我們早上菜、已想翻桌、肉也不新鮮雞味很重、再來帳單寫不清楚問他還翻白眼不耐煩，這到底是什麼店啊、東西難吃態度差、還敢收服務費有事嗎,"Today, I went to dine with my wife, and we were a stinky female waiter. No one came to serve for a long time. We took the menu to go to the front point. I asked if there was any recommendation. I saw it myself, I wanted to leave, and I wanted to say that my wife wanted to calculate, regardless of the person who did not care about it, and waited for a long time to come later than us, but we wanted to turn over the table, and the meat was not fresh. I do n’t know how to write it alone and ask him that he is still impatient. What is this store? Is it difficult to eat things?",False,0.0,0.134,0.866,-0.9276
好吃又有ebisu，但是有次遇到一個神經質的女店員，沒有人的平日晚上兩個朋友先到，她硬要等三人到齊才願意看坐，態度也很詭異，所以再也沒去了。,"There are ebisu delicious, but once I met a neurotic female clerk. No one was here on weekdays. She was willing to wait for three people to see them. Go.",False,0.067,0.167,0.766,-0.5499
"座位不多，但環境規劃得滿好的。
燒烤很好吃！酒類選擇也滿多（啤酒、清酒、燒酒等）
推~~~","There are not many seats, but the environmental planning is good.
Barbecue is delicious!Alcohol choices are also full (beer, sake, shochu, etc.)
Push ~~~",False,0.153,0.0,0.847,0.63
大部分一串50-60$，以串燒居酒屋來說算物美價廉了～東西還不錯噢～只是位子不多,"Most of the bunch of 50-60 $, for the skewers, are cheaper for it ~ things are not bad ~ but there are not many seats",False,0.071,0.0,0.929,0.2323
東西雖然好吃，但是女服務生態度不用這麼不好吧！臉不用這麼臭吧！,"Although things are delicious, it is not so bad for women's services!Don't have to be so stinky!",False,0.313,0.129,0.558,0.6835
價格不貴，餐點實在，酒選用有在地台灣特色的，餐後續攤喝酒的好去處！,"The price is not expensive, the meal is real, the wine is used in the local Taiwan characteristics, and the meal will be a good place to drink!",False,0.106,0.0,0.894,0.4926
東西便宜又好吃，尤其是竹村燒在其他地方從來沒見過，厲害！,"It is cheap and delicious, especially Zhucun has never seen it elsewhere, great!",False,0.424,0.0,0.576,0.8439
有像在日本的感覺,There is a feeling in Japan,False,0.231,0.0,0.769,0.128
沒客人出餐依然很慢，店員一副不缺客人的樣子，態度不佳!,No guests are still very slow to go to meals.,False,0.0,0.196,0.804,-0.296
肉都有腥味，紅肉也都過老，應該不會再光顧了！,"The meat has a fishy smell, and the red meat is too old, and it should not be paid anymore!",False,0.0,0.0,1.0,0.0
服務態度很差，不知道在兇什麼～可能覺得客人很多不缺我們幾個，非常不推薦！,"The service attitude is very poor, I do n’t know what is fierce ~ I may think that there are many guests who do n’t lack us, and I do n’t recommend it!",False,0.065,0.156,0.78,-0.54
"好吃，老闆有個性

推薦雞皮跟竹村燒","It's delicious, the boss has personalities

Recommended chicken skin and bamboo village burning",False,0.333,0.0,0.667,0.6705
最強烤魚 - 鯖魚一夜干，必點,"The strongest grilled fish -sturgeon overnight, it must be ordered",False,0.244,0.0,0.756,0.4404
物美價廉！熱清酒很好喝 強烈大推,Masterpiece is cheap!Hot wine is very delicious and strong push,False,0.631,0.0,0.369,0.9177
起司豆腐是腸胃炎都要吃的東西 XD,Cheese tofu is what gastroenteritis is eaten XD,False,0.393,0.0,0.607,0.6739
雞皮超讚，招牌的竹村燒真的推薦必點！！,"Chicken skin is superb, and the signature Takeura Bo is really recommended!Intersection",False,0.285,0.0,0.715,0.6588
味道不錯 但真的等太久了,It tastes good but really waited for too long,False,0.196,0.0,0.804,0.2382
東西不夠新鮮，口味與本店有差異,"The things are not fresh enough, and the taste is different from this shop",False,0.0,0.131,0.869,-0.2411
跟朋友敘敘舊，喝點小酒吃吃肉哈哈哈!,"Syross the old with friends, drink a small wine to eat meat hahaha!",False,0.389,0.0,0.611,0.7901
如果外場多一個人就滿分了,If there is one more person out of the field,False,0.0,0.0,1.0,0.0
環境雖差，但是CP值極高,"Although the environment is poor, the CP value is extremely high",False,0.166,0.214,0.621,-0.1779
味增湯很香,Mi Zeng Tang is very fragrant,False,0.0,0.0,1.0,0.0
平價，cp值中上。,"Capable, cp value.",False,0.833,0.0,0.167,0.6124
等朋友們買東西,Wait for friends to buy things,False,0.383,0.0,0.617,0.4767
烤杏鮑菇好吃,Roasted Pleurotus eryngii is delicious,False,0.481,0.0,0.519,0.5719
餐點好吃,Meal delicious,False,0.787,0.0,0.213,0.5719
讚,praise,False,1.0,0.0,0.0,0.5574
"在我們看來，居酒屋類型的食物不值得4顆星或5顆星。不過，這裡的食物也不是純3的。我確實很喜歡蛋捲，因為我喜歡雞蛋菜😊。
然而，服務和氛圍是我們在這個地方的晚餐體驗的亮點。
清酒（忘了拍照）非常好，我們喝完了一瓶。
它看起來像一個家庭經營的居酒屋。","In our opinion, izakaya -type food is not worth 4 or 5 stars.However, the food here is not pure 3.I really like egg rolls because I like eggs and vegetables.
However, services and atmosphere are the highlights of our dinner experience in this place.
Sake (forgot to take pictures) is very good, we finished a bottle.
It looks like an izakaya operating by a family.",False,0.151,0.023,0.826,0.8526
"🔄交通：津三站下車，步行15分鐘
🔄參觀時間：19:30後
🔄 陪同人員：除您之外的3人
🔄 消費金額：3,000
🔄 願不願意重訪：無

好久沒來竹村了👏👏👏
象山和嵩山附近都有，不過我個人覺得像山氣氛稍微好一點。
雖然預約了，但遲到了15分鐘左右才進去，而且沒有台灣啤酒哈哈😭

零食沒有太大變化，還是很好吃，只是價格漲了一點ㅠㅠ😢瘋狂漲價ㅜ
進口啤酒很多，像是好麗友（Orion）、札幌（Sapporo）等。
以前性價比蠻高的，但現在不介意了🤔

雞皮還是很好吃，五花肉也好吃👍👍👍👍
桌子不多，所以必須預訂，而不是選擇！
衛生方面沒什麼好做的..哈哈。

不過下次我不會去了！
推薦給想感受台灣居酒屋感性的人👏","站 Transportation: Get off at Jin San Station and walk for 15 minutes
3 Visiting time: 19: After 30
您 Accompanying personnel: 3 people except you
, Consumption amount: 3,000
Wish to visit the visit: None

I haven't come to Zhucun for a long time
It is near Xiangshan and Songshan, but I personally feel that the atmosphere is slightly better.
Although the appointment was made, it was only about 15 minutes late, and there was no Taiwanese beer haha.

Snacks have not changed much, it is still delicious, but the price has risen a little ㅠㅠ😢 crazy price increases ㅜ
There are a lot of imported beer, such as ORION, Sapporo, etc.
In the past, the price / performance ratio was quite high, but now I don’t mind anymore 🤔

The chicken skin is still delicious, and the pork belly is delicious.
There are not many tables, so you must book it instead of choice!
There is nothing to do with sanitation ... haha.

But next time I won't go!
Recommended for those who want to feel the emotional alleys of Taiwan 👏 👏 👏 👏",False,0.144,0.051,0.805,0.9713
"日式居酒屋，非常適合下班後與同事小酌一杯。
氣氛很好，還為不能喝的人提供冷茶。
價格對於台灣來說有點高，而且食物需要一段時間才能出來，但我認為等待是居酒屋氛圍的一部分，所以我推薦它！","Japanese -style izakaya is very suitable for a drink with colleagues after get off work.
The atmosphere is very good, and it also provides cold tea for people who can't drink.
The price is a bit high for Taiwan, and it takes a while to come out for food, but I think it is part of the atmosphere of the izakaya, so I recommend it!",False,0.088,0.0,0.912,0.7232
好吃的居酒屋,Delicious izakaya,False,0.787,0.0,0.213,0.5719
串燒太好了。但等待的時間有點長。,The skewers are so good.But the waiting time is a bit long.,False,0.0,0.0,1.0,0.0
我在Songsan Amba Hotel附近閒逛，看看附近有沒有可以喝酒的地方，結果找到了！雖然不太好，但對於便宜的飲料來說已經很不錯了。,"I strolled around SONGSAN AMBA Hotel to see if there was any place nearby, and I found it!Although not very good, it is already very good for cheap drinks.",False,0.105,0.079,0.816,0.2173
"是只有我這麼認為，還是沒有什麼比舒適的居酒屋餐廳更讓人放鬆的了？好吧，竹村會讓你把煩惱留在門口。牆上貼滿了日本商品和活動的海報和廣告。這個地方黑暗而舒適。就像穿上舒適的鞋子。

食物很棒而且很快就拿到了桌子。我推薦竹村燒，這是大阪燒的一個不錯的變種。服務很棒，即使在大城市，也感覺像是一個小地方。","Do I think so, or is there nothing more relaxed than a comfortable izakaya restaurant?Well, Zhucun will let you leave your troubles at the door.The wall is full of posters and advertisements for Japanese products and activities.This place is dark and comfortable.It's like wearing comfortable shoes.

The food was great and quickly got the table.I recommend Takeura Boiling. This is a good variant of Osaka.The service is great, even in a big city, it feels like a small place.",False,0.251,0.07,0.678,0.9593
餐好吃 梅酒好喝,The meal is delicious and delicious,False,0.649,0.0,0.351,0.8126
我們嘗試的一切都很棒。  價格也很公平，尤其是對於某些菜餚的份量。  不錯的小地方。,"Everything we try is great.The price is also fair, especially for the amount of certain dishes.Good small place.",False,0.216,0.0,0.784,0.5267
"Cp值很高 餐點一串都50左右 也都很好吃 無雷
沙朗牛 日式蛋捲 乾貝燒 照燒雞腿排 讓人印象深刻
有超多種進口啤酒 以及各種好好喝的利口酒 清酒 等等
服務貼心","The CP value is very high meal, and a series of meals is around 50 and it is very delicious.
Salon cattle Japanese -style egg rolls, dried scallion, roast chicken legs are impressive
There are a variety of imported beer, and various good wine wines and sake, etc.
Intimate service",False,0.215,0.0,0.785,0.9117
吃了起司蛋捲、奶油起司豆腐、飯糰……對於高檔價格來說，在牆上的一個洞裡，味道很平均。適合搭配啤酒或清酒。,"After eating cheese egg rolls, cream cheese tofu, rice balls ... For high -end prices, in a hole in the wall, it tastes very average.Suitable for beer or sake.",False,0.0,0.0,1.0,0.0
好吃大推,Delicious,False,1.0,0.0,0.0,0.5719
真的很好的食物和周到的服務,Really good food and thoughtful service,False,0.592,0.0,0.408,0.6997
好吃，但上菜速度久,"It's delicious, but the food is long for a long time",False,0.19,0.0,0.81,0.3291
好吃又便宜,Delicious and cheap,False,0.649,0.0,0.351,0.5719
好吃 便宜 高C/P值,"It's delicious, cheap, high C/P value",False,0.604,0.0,0.396,0.7269
食物非常好而且價格合理！,The food is very good and the price is reasonable!,False,0.279,0.0,0.721,0.54
好吃~~~CP值高~~,It's delicious ~~~ CP value is high ~~,False,0.504,0.0,0.496,0.7269
便宜，好吃,"Cheap, delicious",False,0.787,0.0,0.213,0.5719
好吃,tasty,False,0.0,0.0,1.0,0.0
可以小酌一杯！,You can have a drink!,False,0.0,0.0,1.0,0.0
超好吃,Super delicious,False,1.0,0.0,0.0,0.8225
好吃新鮮，親切。,It's delicious and kind.,False,0.78,0.0,0.22,0.7964
好的,OK,False,1.0,0.0,0.0,0.296
便宜好吃…,Cheap and delicious ...,False,0.552,0.0,0.448,0.5719
小而美居酒屋,Koshinmii izakaya,False,0.0,0.0,1.0,0.0
好吃,tasty,False,0.0,0.0,1.0,0.0
OK居酒屋,OK izakaya,False,0.746,0.0,0.254,0.4466
😍😍😍😍 …,😍😍😍😍 …,False,0.48,0.0,0.52,0.9001
便宜好吃！,Cheap and delicious!,False,0.666,0.0,0.334,0.6114
好吃,tasty,False,0.0,0.0,1.0,0.0
