Original,EN,Needs Review
店外裝潢很有趣 第一次進酒吧 還想說真的是這裡嗎www 水餃不錯吃 然後很喜歡蒙娜麗莎的奶酒還有白蘭地香 本來想點牛排吃但運氣不好賣完了 下次一定點🫵💖🐄,The outside of the store is very interesting to enter the bar for the first time and want to say that it is really here? Bleak,False
"環境很特別，酒的別稱也很有趣，還帶了一段敘述，感覺很有帶入感。
外觀看似一堆書的書架，但是進出都是要摸索（很特別）。

日～四 低消 200/人
五六（例假日） 低消400/人

順手把menu 都拍下來 供參 點了 「蒙納麗莎」、「鳳梨冰茶」（無酒精）、「西柚蜜檸」（無酒精）、炸雞翅（我覺我很不錯！）
以調酒為主，沒有常見啤酒品項。(百威、海尼根⋯等都沒有。）
不過「有無酒精」品項還不錯。

去時是星期五，人不多，感覺挺舒適，燈光偏暗，要照相需要打光一下～

#板橋酒吧 #書䏱","The environment is very special, and the alcohol is also very interesting. It also brings a narrative, which feels very increasing.
The appearance looks like a bunch of books, but it is to explore (very special) in and out.

Daily ~ Four lows to eliminate 200/person
Five or six (regular holidays) low 400/person

Picked MENUs for ginseng, ""Monanolisa"", ""Pineapple Ice Tea"" (without alcohol), ""Grapefruit Calm"" (without alcohol), fried chicken wings (I think I am very good!)
Mainly bartending, there is no common beer item.(Belweed, Heingen, etc. There are no.)
But the item of ""or not alcohol"" is not bad.

It was Friday when I went, and there were not many people. They felt very comfortable and the lights were darker.

#Banqiao Bar #Book 板",False
調酒特別有它的特色，環境也很好，店門口設計成書店，進門後有來到另外一個空間，室內有一個專門拍照打卡的佈置,"The bartending is particularly characteristic, and the environment is also very good. The shop entrance is designed as a bookstore. After entering the door",False
"很放鬆又能品嚐到獨特調酒的好地方

每次都會點蘇軾，雖然是高梁但配合梅酒變得更容易入口，畢卡索偏甜但韻味十足

重點是離家好近好方便","Very relaxed and you can taste a good place for unique bartender

Every time I order Su Shi, although it is a sorghum, it becomes easier to enter with plum wine. Picasso is sweet but full of charm.

The point is that it is very close to home",False
"好美好舒服的酒吧，喝酒喝得好優雅，親切的店員、漂亮的調酒師，讓創意滿分的調酒變得更加有趣！每一杯調酒都有故事，很用心的設計～第一次喝到調酒尾韻的舒服感！

很意外的在酒吧可以吃到現煮的餐點！重點是非常好吃！媽媽味的滷味拼盤、手工鵝油米線，還有吉拿棒都無敵美味！","What a beautiful and comfortable bar, drink and drink very elegant, kind clerk, beautiful bartender, make the creative bartending more interesting!Every cup of bartending has a story, very careful design ~ The first time you drink the comfort of the bartender rhyme!

Surprisingly, you can eat cooked meals in the bar!The point is very delicious!Mom tastes the loquat platter, handmade goose oil noodles, and the Ji Run sticks are invincible and delicious!",False
"🔍 𝐈𝐧𝐬𝐭𝐚𝐠𝐫𝐚𝐦: 𝐜𝐚𝐫𝐢𝐧𝐚𝐭𝐢𝐧𝐠_

位於捷運新埔站附近，外觀是整面書牆，按下藏在書牆中的燈紐才敞開大門
從門口吧台沙發區到廁所裝潢都很有心，兒童區書櫃還有復古小電視超Q！
調酒推薦可以點看看專屬的特色調酒，有趣也好入喉，當天喝到醉醺醺也沒起酒疹，體感很舒適
餐點也挺好，吉拿棒酥脆外吃得出來油很乾淨，滷味口感恰好又入味

\ 喝酒前先墊胃 /

膠麻香滷味(牛腱、牛筋、海帶、米血、鳥蛋) $420
牛腱牛筋滷香入味外口感也恰好
米血軟Q帶糯，鳥蛋還用了蔥絲擺了個鳥巢好Q

吉拿棒(4PCS) $100
我愛死吉拿棒，外表酥脆內裡鬆軟外吃得出油很乾淨，肉桂微微的甜香很棒

\ 清新溫柔 /

飯島愛 $350
自製蘋果白蘭地 紅酒 鳳梨 水蜜桃 氣泡水

林黛玉 $350
自製茉莉琴酒 荔枝 氣泡水

兩款都是香香甜甜清新好喝的酒款，飯島愛特別用了玲瓏有緻的曲線杯，林黛玉多付了花型抹茶餅乾配茶，有經典的林黛玉葬花的意涵

\ 閃亮亮水嘎~ /

梵谷 $400
伏特加 琴酒 黑櫻桃 紫羅蘭

拍照起來很閃亮，亮晶晶發光的感覺就像梵谷經典的星空

\ 香甜好喝後勁大 /

蘇軾 $350
高粱 梅酒 紫蘇 生薑 桂花蜜

Bartender私心推薦，雖然高粱是積久但不怕沒有辣喉感，入口也是有香甜的感覺，但畢竟是高粱，初學者小心後勁會讓你想哭爹喊娘

還喝了SHOT跟伏特加調酒，好茫好茫的時候店家貼心遞上蜂蜜水，好暖
當天的Bartender也都好漂亮","𝐜𝐚𝐫𝐢𝐧𝐚𝐭𝐢𝐧𝐠 𝐜𝐚𝐫𝐢𝐧𝐚𝐭𝐢𝐧𝐠: 𝐈𝐧𝐬𝐭𝐚𝐠𝐫𝐚𝐦_

It is located near Xinpu Station of the MRT. The appearance is the entire book wall of the book.
The decoration of the table sofa area from the door of the door is very attentive. The bookcase of the children's area also has a retro small TV super Q!
Introduction to bartending can look at the exclusive specialty bartending, it is fun to enter the throat. I did n’t get drunk when I was drunk on the day.
The meal is also very good. The Ji Run stick is crispy and can be eaten very clean.

\ Before drinking, pad the stomach /

Jiao Ma Xiang Loan (beef tendon, beef tendon, kelp, rice blood, bird egg) $ 420
Bull tendon, beef tendon, fragrant flavor, taste exterior, it is just right
The rice blood is soft Q with waxy, and the bird egg also uses the green onion to set a bird's nest.

Ji Renju (4PCS) $ 100
I love to die with a stick, and the outside is crispy and soft inside can be very clean. The sweet and scent of cinnamon is great

\ Fresh and Gentle /

Inaka Ai $ 350
Homemade Apple Bailan Di Wine Pineapple Pineapple Peach Blippiece Water

Lin Daiyu $ 350
Homemade jasmine wine litchi bubble water

Both are fragrant and sweet and delicious wine. Ishima Ai specially uses the exquisite curve cup. Lin Daiyu paid more flower -type matcha biscuits and tea.

\ Shiny water gag ~ /

Van Gogh $ 400
Volkqin Wine Black Cherry Violet

It's very shiny to take pictures, and the shiny crystals feel like Van Gogh's classic starry sky

\ Sweet and delicious stamina /

Su Shi $ 350
Sorghum plum wine, perilla ginger ginger osmanthus honey

Bartender recommended that although the sorghum is accumulated for a long time, it is not afraid that there is no spicy throat, and the entrance also has a sweet feeling, but after all, it is sorghum. Beginners will make you want to cry.

I also drank shot and vodka bartender.
Bartender that day is also so beautiful",False
"店內空間寬敞，座位很多，琳瑯滿目的書櫃充滿魔幻的感覺，很酷很特別！
服務態度相當親切，會細心介紹餐點

😍喜歡飯島愛和蘇軾！覺得順口且好喝，很推薦點。秦始皇的shot也很讓人印象深刻！
推薦二訪！","The space in the store is spacious, with a lot of seats, and a variety of bookcases are full of magical feelings. It is cool and special!
The service attitude is quite kind, and you will introduce the meals carefully

和 😍 😍 😍 😍 and Su Shi!I feel smooth and delicious, it is recommended.Qin Shihuang's Shot is also very impressive!
Recommend the second visit!",False
"整個環境超級特別，一開始還差點找不到大門XDD
店內是以書櫃為背景，很特別。
這次點的調酒都很厲害呦~~~~","The whole environment is super special, I almost couldn't find the door XDD at first
The store is based on the bookcase, which is very special.
The bartender at this time is very powerful ~~~~",False
"有種躲到9又3/4月台的 與世隔絕感
讓人感到舒服的環境
服務也很讚 招待Shot好好喝♡
🍺🍻🥂🍹🍸🥃🧊💛 …","There is a sense of hiding in the world that hid 9 and 3/7
A comfortable environment
The service is also very entertaining the shot.
🍺🍻🥂🍹🍸🥃🧊💛 🍺🍻🥂🍹🍸🥃🧊💛 ...",False
音樂好聽很有氣氛，酒不錯喝且有特色，環境寬敞舒適自在，店員服務很好又貼心(˶‾᷄ ⁻̫ ‾᷅˵)❤️,"The music sounds very atmospheric, the wine is good and special, the environment is spacious and comfortable, the clerk service is very good and intimate (˶‾᷄ ⁻̫ ‾᷅˵) ❤️",False
"只能給5顆星，氣氛好，食物佳(包括酒&餐)，服務好，已經訂位世界盃期間再次造訪。
拇指姑娘$330：酒精淺，甜味高，量多但不會醉。
薩諾斯$480：有後勁，有威士忌的味道但實際沒有此基底。
水餃$180：也賣高麗菜水餃好意外，好吃😂
吉拿棒$100：看大家都推，量不多但值得，很酥脆口味超棒，點了就是沒有在擔心胖，超肥。","You can only give 5 stars. The atmosphere is good, the food is good (including wine & meals), the service is good, and you have visited the World Cup again.
Thumbs Girl $ 330: Light alcohol, high sweetness, large amount but not drunk.
Sanos $ 480: There is a rear, whiskey tastes but does not actually have this base.
Dumplings $ 180: It is also surprising that it is also good to sell Korean vegetable dumplings, delicious
Ji Renu $ 100: It depends on everyone to push, not much, it is worth it, it is very crispy and superb. If you click, you are not worried about fat, super fat.",False
"酒品超好喝 鹹水雞一級棒
特別的書局風格！
調酒師都很熱情！！！
值得回訪的酒吧🥰 …","The wine is super delicious, salted water chicken first -level stick
Special book style!
The bartender is very enthusiastic!IntersectionIntersection
Bar worth visiting 回 ...",False
上次是朋友已經在裡面坐一陣子了，我進去之後，我沒有點酒，想說也不知道低消如何，但我朋友就是差不多喝完要去下一間的樣子，我姑且想說等店員跟我說話了我再點也行，結果後來店員有注意到有我這個客人入座，還主動遞上一杯水，之後沒有叫我點餐，看向吧台的店員們都是笑臉回迎且態度良好，氣氛很好，小說當牆壁的特色很不錯，另外桌面上的菜單有「課表」（每一天的促銷方式打折模式介紹）很特別，有創意，雖然此次沒有消費，但是我已經介紹給別的朋友了。,"Last time, my friend had been sitting in it for a while. After I went in, I didn't order alcohol, and I didn't know how to disappear, but my friend just went to the next one to go to the next room. The clerk talked to me. I can order it again. As a result, the clerk noticed that I was seated with me, and took the initiative to hand in a glass of water. After that, I did not call me to order. Good atmosphere, the novel is very good as the wall. In addition, the menu on the desktop has a ""course table"" (the introduction of the discount mode of the promotion method every day) is very special. Other friends.",False
"調酒非常的好喝，
老闆非常的有水準，
很仔細的解說調酒的每一個細節，
讓我們喝的開心也很放鬆。

從門口到進去店內真的有種來到另一個世界
的奇幻感覺～
謝謝老闆給了我們一個很棒的夜晚，
對同樣是做服務業的我們，
在每天面對人群的休假時刻
能有個安靜放鬆的環境好好舒壓喝個好酒～
真的超級棒🫡🫡

對了，
老闆的吉拿棒是自己做的 真的超級好吃
我們其實在別的餐廳吃了好飽
但是還是點了3份吉拿棒❤️❤️❤️

謝謝老闆招待我們的爆米花🍿️
會在帶朋友去並且收入口袋名單😬😬😬
再次謝謝老闆給我們一個愉快的夜晚🥹🥹","The bartender is very delicious,
The boss is very standardized,
Carefully explain every detail of bartending,
Let us drink happily and relax.

From the door to the store in the store, there is really a kind of one to another world
The fantasy feeling ~
Thank you, the boss gave us a great night,
For us who are also the same service industry,
Facing the crowd's vacation time every day
Can have a quiet and relaxed environment, so relax and drink a good wine ~
Really superb 🫡🫡

By the way,
The boss's Ji Ran stick is really delicious by himself
We actually ate well in other restaurants
But I still ordered 3 Ji Renbubs ❤️❤️❤️

Thank you boss for entertaining our popcorn 🍿️
Will be taking friends and the list of pockets 😬😬😬
Thank you again for your boss for giving us a happy night 🥹🥹",False
氣氛很好，店長店員都很熱情友善，介紹酒單很詳細不敷衍。酒不貴又好喝，零食也好吃，推薦,"The atmosphere is very good. The shopkeeper is very enthusiastic and friendly, and the introduction of the wine list is very detailed and unpolian.The wine is not expensive and delicious, and the snacks are delicious. It is recommended",False
藏身在隱密的書櫃門後面，環境非常舒服，店員也幫我們調了好喝的奶酒shot，適合與朋友來放鬆休息的地方。,"Hidden behind the hidden bookcase door, the environment is very comfortable. The clerk also helped us adjust the delicious milk wine Shot, which is suitable for relaxation of rest with friends.",False
"秦始皇的六杯shot……介紹說是3杯自製茶酒3杯自製水果酒，就是…大杯一點的shot😖
這組真不推薦…
其他可以試試。","Qin Shihuang's six cups of shot ... Introduction to 3 cups of homemade tea, 3 cups of homemade fruit wine, that is ... big cup a little shot😖
This group is really not recommended ...
Others can try.",False
隱藏在書櫃後的酒吧，年輕調酒師很愛聊天，說自己調不出網美酒，不過卻默默拿出LED杯墊😆，鹹水雞套餐調味不重，雞皮彈牙具脆感、小轟炸派對的炸物完全無膩感，忍不住一口接一口，份量十足。 …,"The bar hidden behind the bookcase, the young bartender loves chatting, saying that he can't adjust the net wine, but silently takes out the LED coasters, the salted water chicken set is not heavy, the chicken skin is crispy, a small bombing party The fried object is completely greasy, and I can't help but take a bite, and the portion is full.Mowing",False
"裝潢的非常有氣氛
真的像一間書局
可惜酒蠻讓人失望的
小小一杯的沒有裝飾
讓人很空虛
本身喝起來蠻普通…","Very atmospheric decoration
Really like a bookstore
It's a pity that the wine is quite disappointing
The little cup is not decorated
Make people very empty
It is quite ordinary ...",False
"結論 氣氛部分滿分
裝潢部分有提供拍照區域 適合網美造訪
酒的部分經驗不差
第一次造訪的時候 Long Island滿驚艷的
很純粹的把長島表現出來 沒有混濁的味道
Bartender也都很好聊天 技巧也不錯
對於酒品的了解也很充足
在我的第三次造訪 Bartender也能完成我的特殊酒品要求
至少在我的造訪經驗中 是非常棒的一間酒店","Conclusion The atmosphere is full score
The decoration part is available for a photo area suitable for network beauty visits
Part of the experience of wine is not bad
Long island was amazing during the first visit
It is purely showing the turbid taste of Long Island
Bartender is also very good to chat skills
There is also sufficient understanding of wine products
In my third visit, Bartender can also complete my special wine requirements
At least in my visit experience is a very good hotel",False
"很特別的一家酒Bar
光是它的門口就會想讓人一探究竟
點了一杯拇指姑娘和世界大戰
對於愛喝甜酒的我真的很可以
還點了鹹水雞和水餃都很好吃
老闆人也很好客
最後還請我們喝一杯小酒
第一次去的感受就蠻好的
會願意二訪的👍🏼","Very special wine BAR
Just at the door, you will want people to find out
I ordered a cup of thumb girl and World War
I am really okay for those who love to drink sweet wine
Also ordered salted water chicken and dumplings are delicious
The boss is also very good
Finally, ask us to have a glass of wine
The feeling of the first time is pretty good
Will be willing to visit the second visit 二",False
"已二訪！
店員服務態度都很親切，酒品也很好喝，大推吉拿棒，牛排也很好吃
內部有一個容納多人的沙發影音區，小小團體感覺很適合在裡面攤著聊天👍🏻 …","Visit!
The clerk's service attitude is very kind, the wine is also very delicious, the big push is a good job, and the steak is also delicious.
There is a sofa audio and video area that accommodates many people. The small group feels very suitable for chatting in it ...",False
"一到入眼簾的是很很特別的裝潢書牆❤️
一進到室內、非常舒服有家的氣氛
適合跟朋友來小酌跟吃東西的好去處！
懷孕的我來這沒喝酒 但喝了「拇指姑娘的初戀」無酒精特調覺得好喝！

還有養樂多橘子🍊果汁也好喝😚
希望可以出更多無酒精特調飲料 🥰
給像我這種不喝酒的客人哈哈哈

吃的部份：吉拿棒非常特別
店家說 從麵粉開始都是他們自己做的哦！
菲力牛排🥩、香香雞、高麗菜、韭菜水餃🥟也都好吃
我明明就剛吃飽才來 來這邊還是挑嘴殘的吃了🤣🤣🤣🤣

重點酒真的算平價🥰期待下次再來🕶️","As soon as I arrived, it is a very special decoration book wall ❤️
As soon as you enter the room, very comfortable and homely atmosphere
Suitable for friends with friends to drink and eat!
When I was pregnant, I did n’t drink here but drank the “first love of the thumb girl” without alcoholic.

There is also Yangle Doro oranges and juice.
Hope you can get more alcoholic special drinks 🥰
Give guests like me who don't drink alcohol hahaha hahaha

The part of the food: the Ji Run stick is very special
The shop said that they made them from the beginning of flour!
Feili steak, fragrant chicken, Korean cabbage, leek dumplings are also delicious
I obviously just came here and I still picked my mouth. I ate it.

The key wine is really cheap 待 Looking forward to the next time 🕶️",False
"進門口的設計很棒很有新意，
裝飾的書面也很用心，
酒店的氣氛很舒適，
適合和朋友一群一起聊天聚會，
酒單有分經典和店內特殊調酒可供選擇，
店內也有空間供拍照（還有補光燈可使用～
點了炸物拼盤 味道品質都感覺到用心( ´▽｀)
是很棒的體驗
下次還會再訪～～","The design at the entrance is great and new,
The decoration is also very attentive,
The atmosphere of the hotel is very comfortable,
Suitable for a group of chats with friends,
The wine list is divided into classic and special bartender in the store to choose from,
There is also space in the store for taking photos (also uses light lights to use ~
I like the taste of the fryer's platter flavor and feel attentive (´ ▽ ｀)
A great experience
I will visit again next time ~~",False
酒好喝，水餃很棒，世界盃期間可以看球，店門口低調，裡面很棒，還有網美拍照區，大推,"The wine is delicious, the dumplings are great. You can watch the ball during the World Cup. The door of the store is low -key, which is very good, and there is a photo area of ​​the net.",False
裝潢很特別，超適合自拍打卡的焦點，調酒的口味好喝，老闆親切又健談風趣。,The decoration is very special. It is super suitable for the focus of self -timer punch cards. The taste of bartending is delicious.,False
"服務態度很不錯，老闆很客氣；
調酒還不錯，但是空養樂多罐非常容易掉下來，建議可以更改一下設計；
另外希望在點餐時就能跟客人說明一下關於店內低消的規範，顧客會比較清楚消費規矩。
當天也有加點酒品但被漏單的情形發生，希望之後能改善～","The service attitude is very good, the boss is very polite;
The bartending is not bad, but it is very easy to fall off the empty cans. It is recommended to change the design;
In addition, I hope that when ordering, we can explain to the guests about the low -consumption specifications in the store, and customers will be more clear about consumer rules.
On the day, there were also some wines but being leaked. I hope it can be improved later ~",False
"有一種聲音叫做「感謝」，那種感謝的語言無法一次說完，有一個方法是道出感謝最感性也最自然的~來「書䏱」吧！
最輕鬆的情境
最舒服的空間
最醇香的杯酒
最熱情的主人

今晚，我們在書䏱回到最初的相遇
明晚~換你們囉！
老規矩，報咱們名字沒有優惠
只有主人們以最熱情的服務來呈現書䏱最有「家」的味道💗","There is a kind of voice called ""thanks"", and the kind of gratitude cannot be finished at once. One way is to say that thank you most emotional and most natural ~ Come ""Book 䏱""!
The easiest situation
The most comfortable space
The most mellow cup of wine
The most enthusiastic master

Tonight, we return to the original encounter in the book 最
Tomorrow ~ change you!
Old rules, there is no discount for our name
Only the owners present the most ""home"" taste of the book with the most enthusiastic services 💗",False
"板橋新地標
店內裝潢超好拍
一個人去不無聊
老闆很會聊天和拍照

食物好吃，酒好喝
消費平價親民
不用跑台北市

值得二訪","Banqiao New Landmark
The interior decoration of the shop is super easy to shoot
It's not boring to go alone
The boss can chat and take pictures

The food is delicious, the wine is delicious
Consumer affordable people
No need to run Taipei City

Worth the second visit",False
我和朋友突然經過一間店全部都是書，不知道在做什麼，查了一下才知道是一間洒吧，好奇的想進去看看，看到都是書不知道怎麼進去，原來有機關，看到一個open，不小心按一下門就開了，很特別的一家店。,"My friends and I suddenly passed through a shop. They were all books. I didn't know what they were doing. After checking it, I knew it was a sprinkler. I wanted to go in curiously. I did n’t know how to go in when I saw it. , Seeing an open, I accidentally pressed the door and opened it, a very special shop.",False
調酒類挺特別，炸物好吃,"The bartender is very special, the fried object is delicious",False
酒很有創意，料理意外簡單好吃⋯可能是我餓了🤤，入口很特別有趣、內部裝潢也很適合拍照 …,"The wine is very creative, the cuisine is unexpectedly simple and delicious. It may be that I am hungry. The entrance is very interesting. The interior decoration is also suitable for taking pictures ...",False
沒有看介紹真的會找不到入口的店，很特別的入場方式！店內環境舒適，服務人員很細心介紹菜單，因為用完餐後才到bar～主要是喝酒沒有點其他餐點，當天喝的梅酒普通偏甜（可能平常梅酒都是喝味道偏酸的～所以覺得還好）但會想再回去嘗試店裡其他品項！是個晚上想放鬆小酌的好去處。「以上為個人用餐心得分享🍽」 …,"If you do n’t read the introduction, you ca n’t find the entrance store, it ’s very special way to enter!The environment in the store is comfortable, and the service staff carefully introduces the menu, because after meals, I arrive at Bar ~ mainly because drinking does not order other meals. The plum wine I drink on the same day is generally sweet (maybe plum wines are usually sour and sour ~ so I think Fortunately) But I would like to go back and try other items in the store!It's a good place to relax and drink at night.""Share above for personal meals 🍽"" ...",False
"店裡的吉拿棒好好吃！！！！還有其他吃得也很棒（一直在吃🤣
還有酒也很特別，可以去喝看看！ …","The Ji Run stick in the shop is delicious!IntersectionIntersectionIntersectionAnd other food is great (I have been eating 🤣 🤣 🤣 🤣
And wine is also very special, you can go and drink!Mowing",False
"小酒吧！😎👍
門口超酷的設計，隱身在都市叢林裡
路過看見小驚喜

很好拍照～
目前尚未未進去用餐！","Bar!Bleak
The cool design at the door, stealth in the urban jungle
See a little surprise passing by passing by

Very good to take pictures ~
I have not yet entered for dining!",False
輕鬆愉快的氛圍，佈置有趣驚喜，調酒不花俏但口味不錯，店員好聊友善，板橋人喝酒好去處,"A relaxed and happy atmosphere, interesting surprises, bartending is not fancy, but the taste is good.",False
"拇指姑娘的初戀甜甜的好好喝！
萬里長城一次可以喝到7種調酒，超特別！
環境舒適 老闆也很熱情 超讚！","The first love of the thumb girl is sweet and delicious!
Wanli Great Wall can drink 7 kinds of alcohol at a time, super special!
The environment is comfortable, the boss is also very enthusiastic!",False
"店員親切，裝潢很酷很特別
調酒好喝👍🏻 炸物也很好吃
吉拿棒是超好吃🤤🤤
不知道是不是店狗但狗狗超可愛❤️❤️ …","The clerk is kind, the decoration is cool and special
Blooming delicious 👍🏻 fried material is also delicious
Ji Renzhu is super delicious 是
I don’t know if it ’s a shop dog, but the dog is super cute ❤️❤️ ...",False
