Original,EN,Needs Review
舒服 酒很讚 環境乾淨 會想一直來,"Comfortable wine is very good, the environment is clean, you will want to come all the time",False
調酒好喝 吉拿棒好吃 十分推薦的一間店,A shop that is delicious for bartending is delicious and delicious.,False
氣氛很好 人都很親切 會想來第二次👍🏻 …,"The atmosphere is very good, everyone is very kind and I want to come for the second time ...",False
"網美酒吧
老闆友善
店員可愛
調酒好喝
食物好吃
還不快來！","Webbin bar
Boss friendly
The clerk is cute
Blooming is delicious
Food is delicious
Come on yet!",False
酒很好喝！調出你想要的感覺,The wine is delicious!Call out the feeling you want,False
自己一個人去喝調酒，調酒師很好聊，酒也有料。,"I went to drink alcohol alone, and the bartender was very good to talk, and the wine was also ingredient.",False
"吉拿棒、鹹水雞好吃必點
老闆人很好 吧台很熱情","Ji Genju, salted water chicken must be delicious
The boss is very good, the platform is very enthusiastic",False
很美的網美酒吧    老闆人很好   品質也很棒,The beautiful online bars boss is very good and great,False
"門口很酷 狗勾很酷
調酒好喝 餐點不錯","The door is cool, the dog hooks very cool
Blooming and delicious meals are good",False
氣氛不錯，還有shot可以喝！,"The atmosphere is good, and there are shots to drink!",False
店內氣氛很好！可以放鬆心情的地方～,The atmosphere in the store is very good!You can relax the place ~,False
店員親切、酒好喝、吉拿棒好吃～,"The clerk is kind, drinks delicious, Ji Na sticks delicious ~",False
氣氛佳，店員非常樂情友善！,"The atmosphere is good, the clerk is very happy and friendly!",False
思思店員好可愛 東西很好吃 調酒很好喝🤤 …,"Sisi clerk is so cute, delicious, sober, very delicious ...",False
店員熱情 調酒創新特殊 相當推薦,The clerk enthusiastic bartender innovation is specially recommended,False
有趣，調酒配吉拿棒,"Interesting, bartender and good luck",False
環境不錯～ 很適合下班小酌,The environment is good ~ very suitable for get off work,False
炸物拼盤推！多了蠻多的酒選項！,Fried objects push!There are quite a lot of wine options!,False
氣氛佳 燈光美 老闆人很帥,"The atmosphere is good, the boss is very handsome",False
東西很好吃 酒也有特色,Things are very delicious and have characteristics,False
氣氛超棒 下次還會來,The atmosphere is great next time I will come,False
海哥我大哥 環境好 酒好喝,"Brother Hai, my eldest brother, the environment is good and drinks",False
神奇的調酒 好喝,Magical bartending delicious,False
吉拿棒跟鬼一樣，有夠屌,"Ji Ra stick is the same as ghosts, there is enough",False
店員親切還送野格shotಥ_ಥ,The clerk is kindly sent to the wild shot ಥ_ಥ_ಥ,False
喝醉跟店員玩骰子就對了❤️❤️,Just drunk and play the dice with the clerk ❤️❤️ ️ ️,False
有情人終成眷屬，很棒的環境,"Lover finally becomes a dependent, a great environment",False
"張寧心好棒 史蒂芬也好棒😍😍😍
東西都好好吃 …","Zhang Ningxin is awesome Stephen is also great 😍😍😍
Everything is delicious ...",False
店員熱情 調酒好喝,The clerk is enthusiastic about bartending and delicious,False
有油煙味 其他都不錯,There are oil fume flavors and other are good,False
服務態度佳！,Good service attitude!,False
好酒好服務 推推,Good wine and good service push,False
調酒師很帥,The bartender is handsome,False
環境很特別❤️,The environment is very special ❤️,False
服務態度超讚👍🏻👍🏻👍🏻 …,The service attitude is superb ...,False
裝潢挺特別的,The decoration is very special,False
水餃好吃,Dumplings are delicious,False
真的很喜歡這個隱藏酒吧的概念和氛圍！工作人員非常友好，飲料也很棒。很欣賞雞尾酒概念化的想法，以及工作人員根據我們的喜好為我們創造獨特飲品的額外主動性：）如果您正在台北尋找一家可以放鬆身心的酒吧，強烈推薦,"I really like the concept and atmosphere of this hidden bar!The staff is very friendly and the drink is also great.I really appreciate the conceptualization of cocktails, and the staff of the staff created the extra initiative for us according to our preferences :) If you are looking for a bar that can relax your body and mind in Taipei, it is highly recommended",False
"BinB 是一家非常舒適的小酒吧，隱藏在圖書館門面後面（只需按發光的書即可），提供精選的招牌和經典雞尾酒，使用當地和進口烈酒以及內部註入的烈酒- 工作人員的知識非常豐富。  賈甚至設法讓高粱變得可口。

他們也提供食物；他們提供的香腸很好，廚房和酒吧一樣開放。

工作人員的英語也說得很好。在我錯過最後一班地鐵後，菲比甚至慷慨地為我叫了一輛計程車，嘗試最後一個簽名並與其他顧客聊天。  如果不是我在台北的最後一晚，我可能會回去——下次我來這座城市時我仍然會回去。

是的，您可以點一份季節性的希特勒雞尾酒，搭配爆米花“頭骨堆”。","BINB is a very comfortable bar, hidden behind the library (just press the light-emitting book), provides a selected signboard and classic cocktail, using local and imported spirits and internal spirits-staff members Knowledge is very rich.Jia even managed to make the sorghum become delicious.

They also provide food; they provide good sausages, and the kitchen is as open as the bar.

The staff's English is also very good.After I missed the last subway, Phoebe even called me a taxi generously, trying the last signature and chatting with other customers.If it weren't for the last night in Taipei, I might go back -I would still go back when I came to this city next time.

Yes, you can order a seasonal Hitler cocktail with popcorn ""skull pile"".",False
氣氛很基本。最吸引人的就是入口處。這本書讓你想到酒吧是一個酒精和思想（教育）完美結合的地方。,The atmosphere is very basic.The most attractive is the entrance.This book reminds you that the bar is a perfect combination of alcohol and thought (education).,False
好喝,Delicious,False
我在這裡度過了一次很棒的經歷，所以第二天晚上我又來了！老闆兼調酒師 Jah 非常關注我們每個人的個人喜好和厭惡。菲比和其他調酒師也非常出色和專業。我建議嘗試一些他們的室內茶雞尾酒。,"I have a great experience here, so I am here the next night!The boss and alcoholics Jah are very concerned about the personal preferences and disgust of each of us.Phoebe and other bartenders are also very good and professional.I suggest trying some indoor tea cocktails.",False
酒很好喝，大家人都很好(⁎⁍̴̛ᴗ⁍̴̛⁎),"The wine is delicious, everyone is very good (⁎⁍̴̛ᴗ⁍̴̛⁎)",False
養樂多酒和煮餃子很好吃(^_^),Yangle Duojiu and cooking dumplings are delicious (^_^)),False
"漂亮舒適的酒吧，裝潢漂亮。
飲料非常好而且工作人員非常友好。","Beautiful and comfortable bar, beautiful decoration.
The drink is very good and the staff is very friendly.",False
"酒很好喝
吉拿棒好吃😂
推 …","Wine is delicious
Ji Napan is delicious 棒 好 好 好 好
push …",False
更多的甜點選擇會更好，整體來說是放鬆的好地方。,"More dessert choices will be better, overall is a good place to relax.",False
很有特色的酒吧,Very distinctive bar,False
很棒 好店,Great shop,False
吉拿棒好好吃 酒也好喝 推推！,Ji La stick is delicious and delicious!,False
酒很好喝 cp值高,Wine is very delicious CP value high,False
"cp值高,Bartender人都很nice，推Steven","CP value is high, Bartender is very nice, push Steven",False
好拍又好喝的店,Good shot and delicious shop,False
推推推 酒好喝,Push push wine,False
一定是大拇指啦,It must be a thumb,False
酒好喝，食物好吃,The wine is delicious and the food is delicious,False
有趣的地方 吉拿棒推,"Interesting place, Ji Renju push",False
精選啤酒,Selected beer,False
非常好喝,Very delicious,False
好的,OK,False
酒跟食物推爆,Wine and food explosion,False
好的,OK,False
推🥰 …,Push ...,False
我好漂亮,I'm so beautiful,False
棒,Great,False
稱讚,commend,False
好喝好喝,It's delicious and delicious,False
好區！ ！ ！,Good area!IntersectionIntersection,False
吉拿棒,Ji Renju,False
喝喝喝,Drink,False
