Original,EN,Needs Review
輕鬆自在小酌，櫃檯美眉很專業,"Easy to drink, the counter is very professional at the counter",False
"近期來過最讚的酒吧
吉拿棒很好吃
酒的價格不會太貴，種類很多
裝潢很酷，大門的設計讓人大開眼界
環境很舒服，適合下班後小酌","I have been here to the best bars recently
Ji Ran stick is delicious
The price of wine will not be too expensive, there are many types
The decoration is cool, and the design of the door is eye -opening
The environment is very comfortable, suitable for drinking after get off work",False
"這氛圍 加分
不知不覺已經喝了7杯調酒
先來個威士忌開胃酒
萬里長城 豐富
是我的菜 下次再來","This atmosphere bonus points
Unconsciously, I have drank 7 glasses of alcohol
Let's first have a whiskey appetizer
Great Wall Rich
It's my dish next time I will come again",False
外觀很隱密，整體設計感不錯。空間寬敞不會感到壓力，很適合聚餐、放鬆,"The appearance is very secretive, and the overall design is good.The spacious space will not feel stressful, it is very suitable for dinner and relaxation",False
美好的週末夜晚，調酒無敵，吉拿棒一定要試試！以後和朋友約板橋就是這裡了！😊 …,"On a beautiful weekend night, the bartending is invincible, the Ji Ren must try it!In the future, I would like to make an appointment with my friends to Banqiao!😊 😊 ...",False
"網美書香風的酒吧，
調酒好喝，吉拿棒超好吃。

PS：老闆太帥，小編太美XD。","Net beauty book incense wind bar,
The bartending is delicious, and the Ji Run stick is super delicious.

PS: The boss is too handsome, Xiaobian is too beautiful XD.",False
一看到外觀差點不知道怎麼進來！酒很好喝又很特別，想喝酒的可以考慮,I almost didn't know how to come in when I saw the appearance!The wine is delicious and special. Those who want to drink can consider,False
"很有特色.氣氛很棒的酒吧,適合小酌,推薦情侶朋友聚會","Very distinctive. The atmosphere is great, suitable for drinking, recommended couple friends gatherings",False
老闆蠻熱情的，酒跟食物都很滿意，裝潢和氣氛很讓人放鬆，大推👍 …,"The boss is very enthusiastic, the wine and the food are very satisfied, the decoration and atmosphere are very relaxed, pushing ...",False
希特樂的世界大戰 上面的焦糖爆米花很加分 覆盆子x萊姆酒基底搭配酸酒 酸甜妹酒很可以喔！但餐出的比較慢，建議肉類先預訂,"The caramel popcorn on Hitle's World War is very bonus.But the meal is relatively slow, it is recommended to book the meat first",False
"板橋好地方
酒濃好喝
食物好吃
價錢公道
門口超有趣
鹹水雞 炸物 吉拿棒
水準之上 喝酒不用跑台北
讚👍推薦","Banqiao good place
Wine thick delicious
Food is delicious
Fair
The door is super interesting
Salted chicken fried object
Drink on the level without running Taipei
Recommended",False
吉拿棒好吃😋 拇指姑娘那杯酒也很好喝，屬於酒精味道不會太重的款式，酸甜口感非常開胃，推薦給酒量不太好但又有小酌的心的人 …,Ji Napan is delicious. The girl of the thumb girl is also very delicious. It belongs to the style that is not too heavy in alcohol. The sweet and sour taste is very appetizing.,False
"調酒師帶你環遊世界🤣
入場是從一本發著光的書本開始，按下後，世界將為你開啟🕊

這間酒吧真的好特別🤪
調酒師也特別鬧，氣氛好好♥️","The bartender takes you around the world 你
The admission is starting from a light book. After pressing it, the world will open for you

This bar is really good
The bartender is also particularly troubled, the atmosphere is good ♥ ️",False
裝潢很有特色，餐點價格也合理，就是燈光實在太暗了，聊天、看手機都覺得蠻不舒服的,"The decoration is very distinctive, and the price of the meal is reasonable, that is, the lights are too dark, and the chat and watching mobile phones feel quite uncomfortable.",False
很不錯的特色餐酒館！,Very good specialty meal tavern!,False
Steven is a legend! 店裡非常有特色，調酒師很健談，讓人很舒服自在的喝酒小天地。,"Steven is a legend! The shop is very distinctive, and the bartender is very talkative and makes people drink a lot of drinking.",False
"店裡裝潢超好看的😍食物也很好吃
調酒也很好喝😋 CP值超高的❤️❤️ …","The super -beautiful tadpole food in the store is also delicious
Alcohol is also very delicious CP value is super high ❤️❤️ ...",False
下班後放鬆的好去處，入場的小巧思很讚！無拘無束的自由喝酒就是一種享受😎 …,"After get off work, relax and go well, the small thoughts who entered the venue are very good!Unrestrained free drinking is a kind of enjoyment ...",False
"很舒適的餐酒館
非常適合一群好友來小酌
餐點也好吃😋店長又親切 …","Very comfortable dining tavern
Very suitable for a group of friends to drink
The meal is also delicious. The manager is kind and kind ...",False
有種秘境的感覺，設計都超貼心，（原本還有點找不到門）進來之後超chill，而且！而且！是女bartender，食物都有種特別的魔力都超好吃，服務生也都很貼心，超推👍👍,"There is a feeling of secrets, the design is super intimate, (there is still a bit of no door), after coming in), after coming in, it is super chill, and!and!It is a female Bartender. The food has a special magic and delicious, and the waiters are very intimate.",False
吃裝潢的⋯酒難喝⋯東西也很難吃⋯超失望💔,"It's hard to eat for decoration, it's hard to eat, it's hard to eat, super disappointed 💔",False
環境舒適 酒類CP值高 而且吉拿棒非常好吃😋 …,Environment comfortable wine CP value is high and the Ji Run stick is very delicious ...,False
氣氛也太讚，重點酒超好喝👍 …,"The atmosphere is too praised, the key wine is super delicious ...",False
氣氛很不錯，下班想跟朋友來一杯非常推薦，而且店員很熱情，一個人來也很推薦喔😆 …,"The atmosphere is very good. I want to come to a friend with friends after get off work, and the clerk is very enthusiastic.",False
這間超棒！酒好喝 老闆人也很親切🤣 …,This is great!The boss is also very kind 🤣 ...,False
用餐區舒適、逛街走累了，可以進來坐坐，適合閨蜜聊天的好所在。,"The dining area is comfortable and tired of shopping. You can come in and sit in, which is suitable for girlfriends to chat.",False
第一次來到這間餐酒館，沒想到店長這麼熱情請我們shot，還會跟客人聊天，整體氛圍不錯，喝的很開心,"When I first came to this dining tavern, I did not expect that the manager was so enthusiastic about asking us to chat with the guests. The overall atmosphere was good and I was very happy.",False
調酒很好喝 下班來喝一杯或三五好友小酌都很適合,It's very suitable for drinking for a delicious drinking to drink a drink or three or five friends. It is very suitable for drinking,False
酒吧非常有特色一開始不知道怎麼進來但非常很有巧思就非常好喝大推吉拿棒有夠好吃,"The bar is very distinctive at first, but I don’t know how to come in but very ingenious.",False
可愛的酒吧 舒服的氛圍 好喝的特調❤️❤️❤️,Cute bar comfortable atmosphere is delicious ❤️❤️❤️ ❤️,False
很特別！人很好！氣氛佳！值得下次再來～,Very special!People are very good!Good atmosphere!It's worth the next time ~,False
"東西超好吃 酒也好喝 而且不貴！
而且bartender 是帥哥！！！
來書䏱一定要點吉拿棒！","It ’s so delicious and not expensive!
And Bartender is a handsome guy!IntersectionIntersection
Come to book, you must order Ji Ran!",False
"店內氣氛很棒，東西也超好吃
超推吉拿棒！","The atmosphere in the store is great, and things are super delicious
Super pushing Ji Jian!",False
好喝 環境很棒 老闆人很好😊 …,"The delicious environment is great, the boss is very good ...",False
氛圍很讚，服務很好，酒很好喝，調酒師很親切😍 …,"The atmosphere is great, the service is very good, the wine is delicious, the bartender is very kind ...",False
"氣氛好,適合與朋友們小酌聊天暢談。
網美牆也很讚👍🏽,拍出來別有一番風情。","The atmosphere is good, suitable for chatting with friends.
The net beauty wall is also very good, and there is a different style.",False
調酒非常好喝，會願意一直再來～,"The bartender is very delicious, and I will be willing to come again ~",False
很好喝 氣氛很好！ 推,Very delicious atmosphere!push,False
"雞翅超好吃！我覺得有雞翅超人在操控我的味蕾
水餃也不錯吃 想睡覺要吃水餃
咬下去的剎那我就不睏了","Chicken wings are super delicious!I think there are chicken wings Superman who controls my taste buds
The dumplings are also good to eat and want to sleep. I want to eat dumplings
I won't be sleepy when I bite",False
"經典調酒的質感都做的很好
特調也都很好喝
餐點好吃（尤其是吉拿棒👍）
老闆阿傑、海哥都很親切
店內氣氛非常好

板橋酒吧首推👍👍👍👍👍","The texture of the classic bartender is very good
The special tone is also very delicious
The meal is delicious (especially the Ji Ran stick 👍)
Boss Ajie and Haige are very kind
The atmosphere in the store is very good

Banqiao Bar first push 吧",False
是只有裝潢的網美點呢，飲料一般，炸物等好久又不像剛炸，很多都溫溫冷冷的早餐店炸物，原本給兩顆但因為服務有夠差在扣一顆。,It is only the beauty of the decoration. Drinks are average. Fried materials are not like just fried for a long time. Many of them are fried in breakfast restaurants with warm and cold and cold. They originally gave two but because the service was bad enough to buckle one.,False
"裝潢不錯 有神秘感的一間店

不確定是不是晚點有訂位就急著收我們盤子
（隔壁吃完的滿漢全席都沒收）
還好朋友隨便點都可以超過低消 還有機會騎車跑下一家","A shop with good decoration and mysterious feeling

I'm not sure if there is a reservation, so I was in a hurry to collect our plate
(The Manchu of Manchu next door is confiscated)
Fortunately, friends can just go more than low, and there is a chance to ride a bike to run the next family",False
菜單上的酒都很好喝，就算菜單上沒有想喝的也可以直接跟調酒師說請她調，吃的東西也都很有水準，不是隨便的食物。很值得去的酒吧！,"The wine on the menu is very delicious. Even if there is no want to drink on the menu, you can tell the bartender directly to ask her to adjust it. The food she eats is very standard, not casual food.Very worth going to the bar!",False
酒很特別 很有造型,Wine is particularly very stylish,False
牛排等了一個小時沒上，吃得喝的都差不多結束掉了好吧想說關心一下進度問下，外場說快好了五分鐘後上，好吧那再等一下好了，等一下然後過了17分鐘依然沒下落，期間外場不聞不問全程只跟別桌招呼，直接要結帳了才說做好了想塞外帶，當初廚房沒法負荷的話直接講真的沒關係不用硬撐….4.9顆星也真的不太懂sorry,"The steak waited for an hour and did not go up. The food and drinking was almost over. Okay, I want to talk about the progress. After the field said, it ’s been five minutes after the field. Well, wait for it. After 17 minutes, I still did not fall. During this period, I did n’t ask the field to say hello to other tables without asking the whole process. I had to check the checkout before I said that if I did it, I could n’t get it. 4.9 stars really don't really understand sorry",False
完全無雷～酒好喝！東西好吃！超愛！要一直來！,It's completely thunderous ~ wine is good!Things are delicious!Love!Always come!,False
"東西很好吃，調酒很好喝
調酒師帥爆了","Things are delicious, bartender is delicious and delicious
The bartender is handsome",False
"與五位友人一同前往小酌
點餐內容如下
炸物大拼盤：雞翅有兩三支有冷凍味感覺放很久，其他都ok
吉拿棒：真D好吃，外酥內軟
鹽水雞：調味ok，好吃
其中一位友人比較晚到，留下的那本菜單酒類重複兩頁，以致沒有點到喜歡的口味，當下也有說喜歡甜一點的，不過點到的酒很不喜歡～
總體來說還不錯","Go with five friends
The content of ordering is as follows
Big frying big platter: There are two or three chicken wings with frozen flavor for a long time, and the others are OK
Ji Ranbang: Really D is delicious, crispy outside and soft inside
Saltwater chicken: seasoning ok, delicious
One of the friends is relatively late, and the menu that is left repeated two pages, so that there is no taste that I like. At the moment, I also say that I like sweetly, but I don’t like it.
Overall is not bad",False
"很棒的一個地方~會越來越好的👍👍👍
推一下鹽水雞跟沒吃到的香香雞😂 …","A great place ~ will get better and better
Push the salt water chicken and the fragrant chicken you haven't eaten ...",False
超美的啦！店員超親切而且酒超好喝,Super beautiful!The clerk is super close and the wine is so good,False
"裝潢氣氛很佳
但漏單也不及時處理還硬凹
一句抱歉也沒有 餐點沒來還算錢 反應之後才退款….","The decorative atmosphere is very good
But the leakage is not processed in time and it is stiff
Sorry, I did n’t have a meal or I did n’t get it. I just refunded it after the reaction of the money ...",False
就是一間吃裝潢的店…..外場服務人員完全沒有注意現場客人餐點狀況，內場人員做餐流程也很讓人滿頭黑人問號❓讓我對於這麼高的評論也是滿頭問號❓,It is a shop that eats decoration ... .. The service staff in the field did not pay attention to the meals of the guests at all. The interior staff's meal process is also full of black question marks.,False
店裡裝潢很酷，氛圍很讚，店員也很用心，好地方！,"The decoration in the store is cool, the atmosphere is very good, and the clerk is also very attentive, a good place!",False
"初次光臨，整個空間融合了［書］及［文青］元素，從入口開始進去，擺設，裝潢，燈源，及店內氣氛，不能說富麗堂皇，卻十足有經營者的用心設計，屬於舒服的小空間，很適合週末夜晚跟三五好友聚聚聊天的地方。

調酒飲品都有意外元素卻不突兀，融合入口之後帶有驚喜，如果不知道喝什麼很適合詢問老闆的推薦。

最後，一般消費者最在意的價位問題，以我個人的今晚消費來說，覺得是親民價位，來這裡消費起來也比較寬鬆自在，不必太拿捏荷包才消費，是良心價，服務也好。","For the first time, the entire space merged the elements of [Book] and [Wenqing]. Starting from the entrance, furnishings, decoration, lamps, and atmosphere in the store. Small space is very suitable for a place where you gather with three or five friends on weekends.

There are unexpected elements but not obtrusive. After the entrance, there are surprises. If you don't know what to drink, it is suitable for asking the boss's recommendation.

Finally, the price of the most concerned about consumers is that for my personal consumption tonight, I feel that it is a price -friendly price. It is relatively loose to come here to consume. You do n’t have to hold too much to consume. It is conscientious and service.",False
環境好、服務生很nice，餐點也很好吃，會想再回訪！,"The environment is good, the waiter is very nice, and the meal is also delicious. I want to return to visit again!",False
"店員很nice
尤其男店員","The clerk is very nice
Especially male clerk",False
"#酒吧 #調酒

老闆人很熱情，每杯酒都在水準之上，是值得再訪的酒吧","# #

The boss is very enthusiastic. Each glass of wine is above the standard. It is a bar worth visiting again.",False
感謝老闆跟帥哥正妹們店員都很健談，酒喝起來順口，吉拿棒必點！超特別的外面都吃不到！推👍🏻 …,"Thanks to the boss and the handsome girls, the clerks are very talkative.I ca n’t eat super special outside!Push ...",False
"餐點和酒類都在水準上
員工也都蠻熱情不錯
地點在板橋很方便 不用往台北市跑
不過店內蚊子很多 被咬一堆包😅 …","Meals and wines are at the level
Employees are also pretty enthusiastic
The location is very convenient to go to Taipei City in Banqiao
But many mosquitoes in the store are bitten a bunch of bags ...",False
好喝的調酒 謝謝好朋友待我來這裡,"A delicious bartender. Thank you, my good friend, wait for me to come here",False
環島到板橋晚上臨時起意和朋友來這邊喝酒，店裡裝潢跟氣氛都很棒，酒很好喝，老闆人也很讚，讓我們環島留下一個美好的回憶❤,Round island to Banqiao temporarily coming to drink with friends at night. The decoration and atmosphere in the store are great. The wine is delicious. The boss is also very good. Let us leave a good memory of the island,False
酒很好喝👍環境也很舒服😌 …,The wine is delicious and the environment is also very comfortable ...,False
"調酒好喝 環境舒適 老闆跟酒保很nice
禮拜一不供餐的時候薯條只要50 超級佛心
推推板橋想要喝酒的在地人 不用跑台北市囉","Bart -up and delicious environment A comfortable boss and wine insurance are very nice
When you do n’t provide meals worship, you only need 50 super -Buddha hearts when you do n’t provide meals
The locals who push the Banqiao who want to drink do not need to run in Taipei City",False
東西好吃，調酒師非常健談親切，老闆人也很好！適合下班或朋友聚會小酌一杯的好地方。,"The things are delicious, the bartender is very talkative, and the bartender is also very good!Suitable for a good place to drink a drink for get off work or friends.",False
"店員服務好 老闆很親近好聊天
環境超舒服鹹水雞超好吃
調酒很有特色好看又好喝
住附近常來完全沒負擔","The clerk service is very close to the boss, very close to chat
The environment is super comfortable and salt water chicken is super delicious
Blooming is very special, beautiful and delicious
There is often no burden on living nearby",False
"親合力滿分的店員和超好的老闆❤️❤️❤️
難得能在板橋喝到這麼好喝的調酒，
終於不用大老遠去台北市了🤪
優質調酒舒服的酒吧，推爆😆 …","The clerk and the super good boss who are full of points ❤️❤️❤️
It is rare to drink such a delicious bartender in Banqiao,
I finally don’t have to go to Taipei City.
High -quality bartending and comfortable bar, explode ...",False
"氣氛很好，調酒師很帥 又隱密，冷氣很爽
但他退追我 先扣分","The atmosphere is very good, the bartender is very handsome and hidden, the air -conditioning is cool
But he retired me to deduct points first",False
"點了兩杯特調，都不太好喝，而且味道都蠻淡的
但是吉拿棒真的好吃","I ordered two cups of special tone, not very delicious, and the taste is quite light
But the Ji Ren stick is really delicious",False
"調酒好拍好看又好喝 調酒師很可愛
吉拿棒好吃 環境很舒服
價格親民 推薦一個聊天放鬆的好地方","Blooming, good, good -looking, delicious bartender is cute
The delicious environment is very comfortable
Recommend a good place to relax the people",False
"老闆跟店員人都超好
環境設計也很特別
值得大家來喝酒聊天","The boss and the clerk are super good
Environmental design is also very special
It's worth drinking and chatting",False
空間舒適放鬆，很適合下班後來這邊小酌，店家也會根據個人喜好推薦飲品！推bartender👍 …,"The space is comfortable and relaxed, which is very suitable for the drinking after get off work. The store will recommend drinking according to personal preference!Push Bartenderen ...",False
酒很好喝！老闆人也很好聊！非常推薦大家下班來這邊喝喝酒！,The wine is very good!The boss is also very good!I highly recommend everyone to go to work and drink and drink!,False
"氣氛不錯，店員親切
但酒沒有很喜歡","The atmosphere is good, the clerk is kind
But wine doesn't like it very much",False
"超讚！！ 環境乾淨、優美，
調酒師親切，酒水好喝，重點是價格不貴。","It's amazing!IntersectionThe environment is clean and beautiful,
The bartender is kind, the wine is delicious, the point is that the price is not expensive.",False
酒好喝 氣氛佳 很棒的一間bar,A good atmosphere of wine is great,False
"酒好喝！老闆好聊～
氛圍不錯！可以常來拍照","The wine is delicious!The boss chats ~
The atmosphere is good!Can come to take pictures often",False
"環境放鬆，調酒師詳盡介紹
而且調酒平衡好，包覆感佳
加上價位佛心；板橋多了一個聚會好地方；十分推薦","Relax of the environment, the bartender details
And the bartending is well balanced, the sense of cover is good
Coupled with the price of the price of the Buddha; there is a good place in Banqiao; it is very recommended",False
店內氣氛佳，店長和店員都很熱情，酒好喝東西也好吃👍🏻👍🏻 …,"The atmosphere in the store is good, the manager and the clerk are very enthusiastic, and the wine is delicious.",False
酒好喝店員親切🥰🥰 …,Good wine clerk 员 ...,False
"調酒非常特別又好喝，服務人員親切又可愛
很放鬆的地方","The bartender is very special and delicious, the service staff is kind and cute
Very relaxed place",False
"好玩的bar,酒好喝，bartender 也非常棒！一定要來，很有特色的吧～","Fun Bar, wine is delicious, Bartender is also great!Must come, very distinctive ~",False
東西都好吃 拍照也好看,Everything is delicious and looks good.,False
"老闆人很nice
裝潢很有趣
酒好喝

常常有很漂亮的妹子.....","The boss is very nice
The decoration is very interesting
Wine

There are often beautiful girls ...",False
調酒好喝，老闆推薦的特調也很讚~氣氛很輕鬆,"The bartender is delicious, and the special adjustment recommended by the boss is also very good ~ The atmosphere is easy",False
很棒的餐酒館。吉拿棒很好吃，特色調酒都很有創意也很好喝👍 …,"Great dining tavern.The Ji Ra stick is delicious, and the specialty bartender is very creative and delicious ...",False
"環境很好 已經去好幾次了！
東西好吃 調酒好喝 價錢很親人！","The environment has been very good has been there several times!
It's a good price for bartending and drinking. The price is very relative!",False
好喝的萬里長城調酒,The delicious Great Wall bartender,False
"裝潢特別
員工人很好
酒也好喝cp值高高
推推推特❤️‍🔥🥲 …","Special decoration
Employees are very good
Wine is also delicious CP value
Push push ❤️ ...",False
調酒師人很好又帥，調的酒又好喝，食物也好吃!,"The bartender is very good and handsome, the wine is delicious, and the food is delicious!",False
🧡酒好喝東西好吃 …,… Wine is delicious ...,False
價格實在，飲料很讚，裝潢很有特色，調酒師很親切,"The price is real, the drink is very good, the decoration is very distinctive, and the bartender is very kind",False
"氣氛很棒的酒吧👍
Bartender 親切又專業","Bar with great atmosphere 棒
Bartender kind and professional",False
"環境很好 適合下班放鬆喝一杯
特調很特別很有想法
水餃真的很好吃！","The environment is very good suitable for relaxing and drinking a cup
Special tone is very very thoughtful
The dumplings are really delicious!",False
氣氛優雅，環境很讓人放鬆，聚會的好地方，還會再回訪,The atmosphere is elegant and the environment is very relaxed. A good place for the party will return to visit again,False
"很棒的感覺～
調酒很棒♥️♥️♥️
味道是問喜歡😘 …","Great feeling ~
Blooming is great ♥ ️ 棒 ️ ♥ ️
The taste is to ask 问 ...",False
調酒風味特別 氣氛不錯 適合聚會,The flavor of the bartender is particularly atmospheric.,False
"快來著cnh跟Steven喝酒
調酒超他媽好喝
還有水餃很好吃","CNH and Steven drink
Blooming is super fucking delicious
And dumplings are delicious",False
酒很好喝！調酒師人很讚！大推！！！,The wine is delicious!The bartender is very good!Push!IntersectionIntersection,False
"酒吧居然有鹹水雞，蠻新奇的😂
環境很舒服，酒也好喝，值得消費！ …","The bar is actually salted chicken, which is quite strange
The environment is very comfortable, the wine is also delicious, it is worth consumption!Mowing",False
爆米花的調酒（世界大戰） 非常特別 能吃到爆米花 又是酸甜口感 很棒！,Skin -rice bartending (World War) is very special to eat popcorn and sweet and sour taste!,False
氣氛很棒 每樣東西都很好吃 就也很棒 ❤️,"The atmosphere is great, everything is delicious, and it is great. ❤️",False
調酒超好喝 調酒師人很好 來必找steven,"I am better to bartender and drink, and I must find Steven",False
