Original,EN,Needs Review
"環境乾淨整潔，氣氛佳～
東西好吃，且份量很足吃的超飽👍👍
下次還會再來～ …","The environment is clean and tidy, and the atmosphere is good ~
The things are delicious, and the portion is sufficient to eat
Will come again next time ~ ...",False
環境👌但出菜速度有點慢  希望有待改進,"The environment is a bit slow, the speed of dishes is a bit slow, I hope to be improved",False
"食物還不錯，熱炒需要的各種重口味都有，以吃飽為前提，每個人平均下來的價位也不高。

一樓有時候會比較吵，像是划酒拳的聲音很大，二樓的話目前吃過幾次都還正常。

算是附近比較好一點的熱炒，週末朋友來家裡聊完天後，會帶來吃的選項之一 。","The food is not bad. The all kinds of heavy taste required for hot stir -fry is that the average price of each person is not high.

Sometimes the first floor is more noisy, like the sound of liquor fist. It is normal for the second floor to eat several times.

It is a better stir -fry nearby. After the weekend friends come to the house to talk about the day, they will bring one of the options they eat.",False
生魚片沒處理好，上來的餐點還有冰沙，口感不佳。,"The sashimi was not handled, and the meals came up with smoothie, and the taste was not good.",False
還不錯，日式料理，喝酒聊天的好地方,"Not bad, a good place for Japanese cuisine, drinking and chatting",False
每道菜都超級香超級好吃，酒也是超級順，唯一缺點就是我的胃太小了,"Each dish is super fragrant and delicious, and wine is also super smooth. The only disadvantage is that my stomach is too small.",False
菜色不錯，服務很差，確認菜單的流程有問題，會送錯單。今天豪華生魚片送到別桌，發現錯誤才拿過來。我們前後單點兩次豪華生魚片，結果只來了一份，問服務生說內場將兩份豪華生魚片放到同一個擺盤中。後來提出質疑，為何只有一個蝦頭，服務生說我不知道，大家如果有吃過豪華生魚片，就知道兩份根本放不下一個擺盤。把顧客裝肖偉，然後才說店家再招待一份。拜託我們原本就點兩份，店家也只是補齊我們該吃的兩份。,"The dishes are good and the service is poor. It is confirmed that there is a problem with the process of the menu, and the wrong form will be sent.Today the luxurious sashimi was delivered to a different table and found the errors.We ordered the luxurious sashimi twice before and after we came, but only one came from. The waiter said that the inner field put two luxury sashimi on the same plate.Later, I questioned why there was only one shrimp head. The waiter said that I don't know. If you have eaten luxury sashimi, you know that two copies can't put a plate at all.Putting the customer Xiao Wei, and then said that the store entertained another one.Please ask us to order two copies, and the store is just two copies we should eat.",False
各方面都蠻不錯的，推薦來試試看。,It is pretty good in all aspects. It is recommended to try it.,False
"大掌櫃-酒食場算是口味比較台的日式料理店，訴求是東西新鮮，價錢合理，不但要好吃還要學生吃得起、吃得飽！不但有菜單上的固定料理，老闆也能依需求量身定做出特色料理，因為好吃又划算。
天使紅蝦、鮭魚肚、紅魽肚、白魽肚、比目魚、乾貝、鮭魚卵等齊聚，口感更添油脂豐腴香氣與軟嫩口感。
老闆完全不怕虧本，就是要你吃好吃滿！而壓低成本的訣竅，就是老闆三天兩頭半夜親自到基隆崁仔頂魚市，直接跟漁夫採買新鮮漁獲，這就是新鮮又確保能低價供應的撇步！
停車方便旁邊就有停車場，5分鐘就可到達海山捷運3號出口 交通非常便利......土城人真的有口福了 讚","Big shopkeeper-wine and food room is a Japanese-style restaurant with a taste comparison. The demand is fresh and the price is reasonable.Not only are there fixed dishes on the menu, the boss can also make special dishes according to the needs, because it is delicious and cost -effective.
Angel red shrimp, salmon belly, red 魽 belly, white -bellied belly, white ravioli, more fish, scallops, salmon eggs, etc. gathered, and the taste adds the rich and soft aroma and tender taste.
The boss is not afraid of loss at all, just want you to eat delicious!The trick of low cost is that the boss went to the top fish market in Keelung in the middle of the night in the middle of the night, and directly bought fresh fishing with the fisherman. This is the fresh and ensured that it can be supplied at low prices!
There is a parking lot next to parking. It is very convenient to reach Haishan MRT No. 3 in 5 minutes ... Tucheng people really have a blessing.",False
"交通：旁邊有停車場，雖沒有簽約，但會看磁扣退一小時費用，方便！
空間：一樓明亮寬敞，OK！但沒啥日式餐廳或居酒屋的裝潢感，電話預約但還是坐在一樓靠近門口的桌子，有人進出就會從背後吹來一陣風，不舒服！
菜色：上菜邏輯奇怪，主食最後才上，已經不想吃了！麻辣鳳螺就是罐頭取出的，還沒給牙籤，吃到快生氣，還要自己跟服務生要牙籤！日式炸雞的油沒瀝乾，還黏在一起，比一般鹹酥雞還難吃，對不起食材！枸杞水蓮的份量只有不到5小口，超鹹，真是開眼界了！其他的菜雖不喜歡、不合口味，但還不至於太扯，只有鮭魚生魚片還不錯！
服務：雖然不會主動發現需求，但是有求必應，還可以！","Transportation: There is a parking lot next to it. Although there is no contract, it will be seen for an hour's fee for one hour, which is convenient!
Space: The first floor is bright and spacious, ok!But there is no decoration of a Japanese -style restaurant or izakaya. The phone appointment is still sitting at the table on the first floor near the door. Someone will blow a gust of wind from behind and out, uncomfortable!
Dishes: The logic of serving is strange, and the staple food is finally up. I don't want to eat anymore!The spicy phoenix snail is taken out by the can. I haven't given the toothpick. I eat it and get angry.The oil of the Japanese fried chicken is not drained and sticks together. It is even more unpalatable than the ordinary salty crispy chicken. I am sorry for ingredients!The amount of wolfberry water lotus is only less than 5 small mouths, super salty, it is really eye -opening!Although other dishes do not like and have no taste, they are not too much. Only salmon sashimi is not bad!
Services: Although they do not actively discover demand, they must respond, and it is okay!",False
來吃好多次囉！小朋友們對這裡的菜色都很喜歡！海鮮也很新鮮！,Come and eat many times!Children like the dishes here!Seafood is also very fresh!,False
口味不錯 份量大,The taste is good,False
裝潢雖然沒有很氣派，但是東西還不錯吃，份量也還不錯，適合家庭或是朋友多人聚餐,"Although the decoration is not very elegant, things are not bad, the portion is also good, suitable for families or friends to dinner",False
花蟹鍋太澎湃,Flower crab pot is too surging,False
海膽壽司鮭魚卵壽司、還有串烤的鹽蔥雞腿串，香辣中卷，酥炸螃蟹，鮭魚炒飯 都很好吃平價又好吃真的很推薦土城又找到口袋名單了！,"Haishuri sushi salmon egg sushi, as well as skewers grilled salted green onion chicken leg skewers, spicy middle rolls, fried crab, salmon fried rice is delicious and cheap and delicious. I really recommend the pocket list again!",False
"食材新鮮～～
非常好吃👍👍
上菜速度很快😊 …","Fresh ingredients ~~
Very delicious 👍👍
The speed of serving is fast 度 ...",False
"樓上只有一位服務阿姨態度沒有很好
餐廳提供的熱茶水很小氣的給，開桌只倒半杯，（有買餐廳的飲料）之後開口想要加熱茶水只加了一次之後就不理，也不給自倒
上錯菜色，還回說價錢一樣
下次聚餐不會再來，也不會推薦
菜色同桌友人覺得很少，菜單上許多也沒有了
東西不難吃也不會好吃到想再訪，價位還行","There is only one service aunt upstairs.
The hot tea provided by the restaurant is very stubborn, and the table is only half a cup. (There are drinks at the restaurant) after you want to heat the tea and just ignore it.
The wrong dish, I also say that the price is the same
The next dinner will not come again, nor will it be recommended
There are very few friends at the same table, and many of the menu is gone.
It ’s not difficult to eat and it’ s not delicious. I want to visit again. The price is okay",False
"最近的口袋名單！更驚豔的是⋯原來前檯不但可以坐著用餐、欣賞大㕑的刀工，還能品嚐大廚私房料理（菜單上沒有的喲）真心推薦給大家～
ps.大廚 榮哥別忘了下次要再讓我見識您更多的私房料理喲～謝謝招待😄😄😄 …","Recent pocket list!What is even more amazing is that the front desk can not only sit on dining and appreciate the swordsman, but also taste the chef's private house dishes (not on the menu). I really recommend it to everyone ~
ps. Grandma Rong brother, don't forget to let me see you more privately food next time ~ Thank you for your hospitality ...",False
"環境舒適.服務人員態度良好有耐心的解說菜色
下次還會再來～","Environment comfortable. The attitude of service staff is good and patiently explained dishes
Will come again next time ~",False
"真的很讚的餐廳！
好吃又新鮮！ 大推！","Really great restaurant!
It's delicious and fresh!Push!",False
"Cp值很高耶 東西也很新鮮 如果品質不變的話 以後一定會常常去吃😍😍😍

服務人員都很親切 但生意太好了
送餐速度有太慢 希望可以改進！ …","The CP value is very high and the things are very fresh. If the quality is unchanged, I will often eat it in the future.

The service staff are very kind but the business is so good
The speed of meals is too slow, hoping to improve!Mowing",False
"好吃 食品新鮮  手藝精緻
料好味美  會想再去吃","Delicious food fresh craftsmanship exquisite
It is good to taste beautiful and want to eat again",False
只能說類日本裝潢的台式快炒店，壽司跟燒烤類說不上美味或是不好吃，單價也不算便宜，吃完後整體來說，就是吃飽了.....,"It can only be said that the desktop fast -fried shops decorated in Japan. Sushi and barbecue are not delicious or not delicious, and the unit price is not cheap. After eating, overall is full ...",False
"東西很好吃很
茶碗蒸CP值很高
日式炸豬排必點，醬料不是番茄醬，不知道是啥不過覺得很對味","Things are delicious and very delicious
Tea bowl steaming CP value is very high
Japanese -style fried pig steaks must be ordered, sauce is not tomato sauce, I don’t know what it is, but it feels right.",False
適合家庭聚餐，就算一個人也可以坐壽司吧台，之前點的東西都蠻好吃的，還有提供熱茶,"Suitable for family dinner, even a person can take the sushi bar.",False
這次服務不好，食材也沒上次好，說打卡送虎蝦，應該一開始就說沒虎蝦了，是麻糬，等打了卡，在最後才說沒蝦了，是麻糬，有點......,"This time the service was not good, and the ingredients were not last time. It was said that the tiger shrimp was given to the punch card. It should be said that there was no tiger shrimp at first. ...",False
金沙中卷好好吃 鹽烤大草蝦也不錯 還有牛蒡片 炸生蠔,"Sands rolls well, salt grilled grass shrimp are also good, as well as beef slices fried oysters",False
大家都推生魚片，實際品嚐發現筋不少 難入口，但快炒類還行,"Everyone pushes sashimi, and actually tastes that there are many difficult to enter the tendon, but the fast frying category is okay.",False
"店內環境乾淨
服務態度良好
離家近 吃飯的好地方❤️","Clean environment in the store
Good service attitude
A good place to eat near home ❤️",False
餐點的衛生有待加強，比剛開幕時差了很多...,"The hygiene of the meal needs to be strengthened, which is much worse than when the opening ...",False
客家小炒沒了,Hakka small frying is gone,False
老闆份量給的很大方，很久沒吃到這麼好吃的茶碗蒸，鍋類也很讚，一定會再來的！,The boss is very generous. I haven't eaten such a delicious tea bowl steaming for a long time.,False
環境舒適料理超好吃也方便停車,Environment comfortable dishes are super delicious and easy to stop,False
"食材新鮮
停車方便
價錢比台北便宜
在附近日式料理便宜有好吃
來用餐絕不需此行","Fresh ingredients
Convenient parking
The price is cheaper than Taipei
It is delicious and delicious in Japanese -style dishes cheaply nearby
There is no need for meals to eat",False
價格公道又好吃！推薦日式炸豬排、蛤蜊蒜湯，非常美味～,"The price is fair and delicious!It is recommended that Japanese -style pork chops and clam garlic soup, very delicious ~",False
"東西好吃
但是不吸煙者建議不要坐在一樓
不然會很痛苦 =-=","What is delicious
But those who do not smoke are recommended not to sit on the first floor
Otherwise it will be painful =-=",False
老闆親切大氣，場所適合聚餐小酌👍,"The boss is kind, and the place is suitable for dinner meals.",False
餐點美味，生啤酒好喝，適合約三五好友聊天暢飲一番~,"The meal is delicious, the raw beer is delicious, suitable for about three or five friends to chat and drink ~",False
好吃CP值高 人員親切 是聚餐的好地方！,The delicious CP value is a good place for dinner!,False
"食材很新鮮 服務很棒
超好吃的 大勞遠來都很值得 推推推👍🏼👍🏼 …","The ingredients are very fresh and the service is great
The super delicious Da Yuan is worth pushing ...",False
服務生親切有禮、廁所乾淨、食物属一般熱炒水準、應有提升空間,"The waiter is kind and polite, the toilet is clean, the food is generally hot -fried level, and there should be room for improvement",False
大部分都好吃，但是烤物真的太鹹建議調整,"Most of them are delicious, but the grilled items are really too salty to adjust",False
環境舒適 價格實在 口味不錯 適合朋友一起來喝酒聊天,The environment is comfortable and the price is really good.,False
東西好吃服務親是用餐好地點。,The delicious service of the things is a good place for meals.,False
生魚片新鮮 明太子花枝好吃 炸物份量多,"The freshness of the sashimi fresh prince is more delicious and fried, and the amount of fried objects is more amount",False
餐點 服務 地點 都很優,The service location of the meal is very good,False
好吃，期待下次聚會，廁所是乾淨的那種..,"It's delicious, look forward to the next party, the toilet is the kind of clean ..",False
量多CP值高～非常適合三五好友聚餐的地方～👍 …,The amount of cp is high ~ very suitable for three or five friends dinner ~ 👍 ...,False
菜色不錯吃，但服務有夠差，很差很不爽,"The dishes are good, but the service is poor enough, very bad and uncomfortable",False
環境乾淨  餐點也還可以  旁邊就有停車場方便,The environment is clean and the meals can also be convenient to have a parking lot next to it.,False
東西都很好吃，沒有什麼雷的菜。,"Things are delicious, there is no thunder dish.",False
口味還行，大多為主食類。價格還算實惠,"The taste is okay, most of which are staple foods.The price is affordable",False
份量少 服務緩慢 價位跟台北市不相上下 實在非常不推薦！,The slow price is not comparable to Taipei City. It is really not recommended!,False
好吃的日式料理店 值得前來一試👍🏼👍🏼🍣🍣🍣 …,The delicious Japanese restaurant is worth trying to try ...,False
中式、日式料理都有水準，價格合理,"Chinese and Japanese dishes are all standard, and the price is reasonable",False
環境好氣氛佳適合聚餐,The environment is good and the atmosphere is good for dinner,False
"海鮮可以
食材新鮮
熱菜口味稍鹹","Seafood
Fresh ingredients
The taste of hot vegetables is slightly salty",False
不會想再去第二次,I don't want to go to the second time,False
食材新鮮、好吃、大推,"Fresh, delicious and pushing",False
店內乾淨舒服,Clean and comfortable in the store,False
很好吃 讚ㄌㄚ,Very delicious,False
"食材1
很新鲜服務很親切","Ingredient 1
Very fresh service, very kind",False
日式風格的熱炒店,Japanese -style hot speculation shop,False
環境舒服 料理更是美味！,Environment comfortable dishes are even more delicious!,False
新鮮好吃場地明亮,Fresh and delicious venue bright,False
不錯吃，環境乾淨,"Good food, clean environment",False
食材新鮮料理讚,Fresh food praise,False
服務態度很親切,The service attitude is very kind,False
服務態度不佳,The service attitude is not good,False
牛小排我來了～,I am here ~,False
平價 好吃,Affordable delicious,False
吃飯喝酒的好地方,A good place to eat and drink,False
平價好吃,Affordable delicious,False
很美味 推推😊 …,Very delicious push ...,False
好吃,tasty,False
菜好吃服務好,The vegetables are delicious,False
好ㄔ,Good -looking,False
好吃,tasty,False
打卡送肉串！,Pickings to the meat skewers!,False
好的,OK,False
又近又好吃,Near and delicious,False
份量真的很少,There are really few portions,False
Hen棒嘛,Hen stick,False
好的,OK,False
