Original,EN,Needs Review
餐點口味還不錯~,The taste of the meal is not bad ~,False
櫃檯服務人員態度太差！有帶嬰兒小孩去用餐，因樓下有人訂滿，所以建議2樓用餐，但是她叫我們整個推車扛上去，1樓找不到任何一個讓我們可以放推車的地方，而且推車是收起來的明明有空間放角落也推說無法放置！ 另外店員搞不清楚訂位的電話號碼還跟我們說不是這一家就乾脆企訂位不去吃改別家！,"The counter service staff is too poor!There are children with infants to dine. Because someone is full downstairs, it is recommended to dine on the second floor, but she told us that the entire cart was carried on the first floor. There is a space for putting it away, and the corner is also pushed to be unable to place it!In addition, the clerk is unable to know that the call number of the reservation is also told us that it is not this family who simply reservations do not go to eat different home!",False
第二次造訪，人多時品質嚴重下降，從進場到點餐完全沒人理睬，太忙了選擇忽略客人，可惜,"For the second visit, the quality of the person has severely declined. From entering the venue to ordering, there is no one to ignore it. I ’m too busy to choose to ignore the guests. Unfortunately",False
食材新鮮，料理美味，價格合理，非常值得再次光臨！,"Fresh ingredients, delicious food, reasonable price, and it is worth visiting again!",False
"單價太高了，份量也小，一桌吃下來快一萬
就是2樓阿姨人好啦，不改善下次不去啦","The unit price is too high, the portion is small, and the table is 10,000.
It's the aunt on the 2nd floor.",False
"很推薦的一間店
聽本資深導遊的話，不會後悔

推薦理由:
1. 價位平價
兩個人點 1200 吃不完還打包 （我們都點比較低價的），但其它料理也很平價

2. 餐點種類多、空間大
適合聚餐小酌

3. 用心好吃
一間餐廳最重要的，就是好吃，還有用心
兩者相同重要
這邊的菜跟熱炒店不同，光是炒水蓮就用了蒜、米酒、辣椒、破布子還有肉絲跟水蓮，吃起來味道更豐富

連打卡送的炒蜆仔也是，蜆仔超多還有加蕃茄！？湯汁不死鹹反而更甜美了

推薦
炒水蓮，酒香，脆又好吃
炸豬排，超大片，外皮酥脆肉很嫩，皮肉不會分離

📸 IG: changwei_tastelife","Recommended shop
If you listen to this senior tour guide, you will not regret it

Recommended reason:
1. Price and parity
Two people can pack 1200 and pack it (we all order low prices), but other dishes are also very affordable

2. There are many types of meals and large space
Suitable for dinner

3. Delicious heart
The most important thing in a restaurant is delicious, but also attentive
The two are the same important
The vegetables here are different from hot stir -fried shops. The fried lotus lotus uses garlic, rice wine, pepper, broken cloth, and shredded pork and water lotus. It tastes more abundant.

Even the fried Taipa sent by punch card, there are many Taipa and tomatoes!IntersectionThe soup is not dead and salty, but the sweetness is more sweet

recommend
Stir -fried lotus lotus, wine fragrance, crispy and delicious
Fried pork chop, super large, crispy and crispy skin is very tender, and the skin will not be separated

G ig: ChangWei_TATATELIFE",False
週五晚上用餐，旁邊有停車場超級方便，東西都很有水準，鮭魚炒飯一定點，熱炒類都算好吃，生魚片以非漁港來說算新鮮，握壽司很讚還有海膽，吃一堆肉該點個青菜，水蓮也不是隨便炒一炒，真的有份量好吃，飲料的部分啤酒選擇很多，非酒精的飲料有點選擇少但麥茶標配倒是有，一二樓都有廁所也算乾淨（只有看過男廁，女廁我去看會被告），店可以刷卡，好像也有集點活動,"Dining on Friday night, there is a parking lot next to it. It is very standard. Salmon fried rice is certain. Hot fried categories are delicious. Raw fish slices are fresh as non -fishing ports. If you eat a bunch of meat, you can order a vegetable, and the water lotus is not stir -fried casually. It really has delicious weight. Some beer selection of drinks. Non -alcoholic drinks are a bit less. There is a clean toilet (only when I have seen men's toilets, I will go to see the defendant in the women's toilet).",False
"炸麻糬一份6顆$100 很划算
調味單純不死甜 很好吃
炒飯這次點了櫻花蝦炒飯 覺得稍微普通
個人比較喜歡上次吃的鮭魚炒飯
鮭魚的香味帶出來比較多 櫻花蝦的就還好","A copy of 6 pieces of fried hemp is very cost -effective
The seasoning is simple, the sweetness is delicious and delicious
Fried rice this time ordered cherry shrimp fried rice, I feel a little ordinary
Personally I like the salmon fried rice that I eat last time
The aroma of salmon is brought out more cherry shrimp.",False
第二次來大掌櫃吃飯，用料好，食材新鮮，價格實惠，適合家庭朋友聚餐，有許多隱藏版的菜色，要先預定才吃的到，建議先訂菜才吃的到好料喔！,"For the second time, I came to the shopkeeper for dinner. The ingredients are good, the ingredients are fresh, the price is affordable. It is suitable for family friends to dinner. There are many hidden versions of dishes. It is recommended to eat it first. It is recommended to order the dishes first to eat it!",False
環境清潔整齊!!裝潢很新!菜色多元化!合併了中日元素!!有台式快炒也有日式料理!都很好吃!!!離捷運站也不遠!可以坐捷運才可以多喝二杯!!這餐才算是完美的啦!!,The environment is neat and neat !! The decoration is very new! The dishes are diversified! The merger is merged !! There are Japanese -style fast fried and Japanese cuisine! It ’s delicious !!! It’ s not far from the MRT station! You can take the MRT Drink two more cups !! This meal is perfect !!,False
乾淨舒適的快炒店，還有專門生魚片吧台，適合晚上來喝酒聊天，出菜速度快，服務親切，輕鬆愉快的用餐經驗！,"Clean and comfortable fast -fried restaurants, as well as specialized fish fillet bars, suitable for drinking and chatting at night, fast food, fast service, easy -to -service, relaxed and happy dining experience!",False
"可能地點關係
價位跟份量不那麼正比
炒飯還行！
普普中規中矩😂","Possible location relationship
The price is not proportional to the portion
Stir -fried rice is okay!
Popping is quite satisfactory 中",False
"好久沒吃到好吃的熱炒了，價格也很便宜！
生魚片厚、沒有筋，新鮮！
水璉就那樣，但好吃，份量有點少，
炒飯大推，家裡人吃完又點一份還吃光！
蛤蜊湯非常好喝，基地是用整顆整顆的大蒜煮到軟還有一點柴魚昆布的味道，蛤蜊品質也極優，這個也大推！
整體價格也是比台北市便宜非常多，用餐環境很好因為很新，特別從板橋跑來算是值得了！❤️❤️
用心做菜的餐廳就是要好好評價讓更多人吃到！","I haven't eaten delicious hot fry for a long time, and the price is very cheap!
Sashimi is thick, no gluten, fresh!
The water is like that, but it is delicious and the portion is a bit less.
The fried rice is pushed, and the family will eat again after eating!
The clam soup is very delicious. The base is cooked with the whole garlic until it is soft and the flavor of a bit of firewood is a bit of firewood. The quality of the clams is also very good.
The overall price is also very cheaper than Taipei City, and the dining environment is very good because it is very new. It is worth it to run from Banqiao!❤️ _ ️ ️
The restaurant for cooking is to evaluate more people to eat!",False
超讚，東西好吃，有大杯1000ml生啤，環境乾淨又新不像一般熱炒店。服務大姐也很開朗，唯一要加強的就是桌上有看到幾隻螞蟻。,"It's so happy, the things are delicious, there are 1000ml raw beer in the big cup, the environment is clean and new is not like a hot stir -fried shop.The elder sister is also very cheerful. The only thing to strengthen is to see a few ants on the table.",False
金沙中卷好吃 生魚片好吃 肉串 烤魚 比目魚握壽司都好吃 海鮮火鍋跟炒飯偏普通一點 但在湯裡有喝到一絲鋼刷的絲…,"Golden Sands rolls delicious sashimi skewers, roasting fish, grilled fish than eye fish nipple sushi are delicious seafood hot pot and fried rice.",False
"熱炒店是台灣人精神寄託的所在，熱炒店菜色總能反應出台菜的流行趨勢，也能夠展現出台菜如何充滿彈性與變化。

居酒屋是小酒館，酒鋪的意思，而今天歪嘴雞介紹的這家「大掌櫃-酒食屋」，就是一間有著熱炒店豪邁的居酒屋。

優點
1. 餐廳旁邊就是停車場，方便且空位多。
2. 有居酒屋吃不到的熱炒，海鮮料理豐富。
3. 酒種繁多，可以小酌，也可以酩酊大醉。

缺點
1. 還24小時訂位系統，需要電話預訂。
2. 旁邊停車場不能折抵，需自行付款。
3. 價格稍貴，不喝酒人均在一千左右。","Hot fried restaurants are the spiritual sustenance of Taiwanese. The dishes of hot fried restaurants can always reflect the popular trend of dishes, and can also show how the dishes are full of flexibility and change.

The izakaya is a small tavern, the wine shop means, and the ""big shopkeeper-wine and food house"" introduced by the crooked chicken today is a izakaya with hot fried restaurants.

advantage
1. The parking lot next to the restaurant is convenient and empty.
2. There is a hot stir -fried fried in the izakaya, and the seafood cuisine is rich.
3. There are many kinds of wine, you can drink it, or you can get drunk.

shortcoming
1. Also reservation system for 24 hours, you need to book call.
2. The parking lot next to the side cannot be discounted, and you need to pay by yourself.
3. The price is slightly more expensive.",False
"和家人8/10晚上用餐，客人蠻多，坐到二樓去，因為廚房在一樓，所以是用小電梯+餐車將餐點送到各桌，結果看到⋯別桌點的炸雞之類的餐點，店員在運送時，掉了1.2塊到餐車上+1塊掉到地上⋯接著直接將全部掉的快速撿回餐盤上，送給客人🙀

餐點算好吃，但是員工的衛生安全教育需加強！","I dine with my family 8/10 in the evening, and there are a lot of guests. Sit on the second floor. Because the kitchen is on the first floor, I use a small elevator+dining car to send the meal to each table. As a result, I saw the fried chicken at the table. During the meal, when the clerk was transported, he dropped 1.2 yuan to the dining car +1 pieces and fell to the ground. Then he directly recovered the dinner plate quickly and gave it to the guests.

The meal is delicious, but the health education of employees needs to be strengthened!",False
身為常客，只能說真心推薦一試，會成主顧的⋯⋯！海鮮的品質很棒，廚師手藝也是值得一提，再加上隨著季節多變化的菜單，滿足各位客官們挑剔的味蕾，說到這，又餓了呀！,"As a frequent visitor, you can only say that you really recommend a try, it will become the patriotic!The quality of seafood is great, and the chef's craftsmanship is also worth mentioning. In addition, with the changing menu of the season to satisfy the discerning taste buds of the guests. Speaking of this, I'm hungry again!",False
"酥炸軟殼蟹夠酥
鮭魚頭火鍋味道足夠好喝
軟殼蟹壽司、花壽司正常發揮
表現都有水準之上
讚👍","Crispy soft shell crab is crispy enough
Salmon head hot pot tastes delicious enough
Soft -shell crab sushi, flower sushi play normally
There are levels of performance above
Praise",False
"真的真的很好吃，價格也很好，店家很大方，
食材用的不錯。第四次來吃了❤️謝謝。","It's really delicious, the price is also very good, the store is very generous,
The ingredients are used well.I came for the fourth time ❤️ Thank you.",False
東西變不好吃 而且出菜超級慢 問了之後攤手說：我們原本四個廚師現在只剩兩個,"After the stuff becomes not delicious, when the food is super slow, I asked, and then spread it and said: We originally four chefs now only have two.",False
"超新鮮的生魚片，
兒子吃到欲罷不能！

手卷也超美味～
塔香蛤蜊鮮又甜

大推！","Super fresh sashimi,
The son can't stop eating!

The hand roll is also super delicious ~
Tower fragrant clams are fresh and sweet

Push!",False
"服務人員動作很快親切，
餐點風味尚可，豬排有點乾","The service staff moves quickly and kind,
The taste of the meal is okay, the pork chop is a bit dry",False
價格中高，東西新鮮，菜色烹調的不錯，只是當天有一位女的老服務員，回答口氣較差點，就餐點而言就還不錯。,"The price is high, the things are fresh, and the dishes are cooked well. However, there was an old waiter who had a woman that day. The answer was almost good.",False
"新開的類日式料理的熱炒店
有輕度裝潢
二樓比較有熱鬧聚會氣份
一樓是整齊的日式風格
有酒促也不錯 氣氛提升
餐點不難吃 氣氛不錯 適合多人聚會

服務人員的訓練有素 服務不錯

有小菜招待 （毛豆）

晚上七點前來 地點不算太好 人不算太多 約半滿
這次人少不好點
照燒雞腿口味可 肉質偏乾
炒飯不油也不會太鹹 （重口人就略過吧 我是可以）
野菇山菜 涼拌菜有柴魚跟不難吃
鮮魚清湯也是偏淡但不錯
味增湯 略鹹
特選六貫壽司 cp值不高","Newly opened hot stir -fry shops for Japanese -style dishes
Mild decoration
The second floor is more lively gathering gas
The first floor is neat Japanese style
There is a good atmosphere to improve with wine promotion
The meal is not difficult to eat the atmosphere, the atmosphere is good, suitable for multiplayer gatherings

The service staff is well -trained service

There is a side dish entertain (edamame)

It's not too good to come to the place at 7 o'clock in the evening
This time, people are less bad
The flavor of the chicken legs can be dried
The fried rice is not too salty or too salty (I can see it if the person is heavy, I can)
Wild mushrooms and mountain vegetables are not unpalatable with firewood
Fresh fish clear soup is also lighter but good
Weizheng Tang is slightly salty
Special selection of Liushan Sushi CP value is not high",False
"母親節假日用餐人很多，多到送餐速度超級慢，隔壁桌待了快一小時，才來一兩道菜，直接放棄結帳不吃了。還好我們早到用餐，只有最後兩三道菜等很久。
另外，外面的煙味會隨著自動門開關飄進來，很不舒服，不喜歡煙味的建議訂位在二樓。
旁邊停車場都是每小時六十，其實可以走一點點路，有每小時三十的公有停車場。
餐點其實都不錯吃，就是出餐太慢。沒吃到軟殼蟹料理，很可惜，因為後來加點的餐，都取消不想等了。","There are a lot of people in my mother on holidays. The meal delivery speed is super slow. The table next door stays for an hour before I have come to one or two dishes.Fortunately, we arrived early, only the last two or three dishes were waiting for a long time.
In addition, the smell of smoke outside will float with the automatic door switch.
The parking lot next to the side is sixty per hour. In fact, you can take a little road, with a public parking lot of 30 per hour.
The meal is actually good, but it is too slow to pay for meals.It is a pity not to eat soft -shell crab dishes, because the meal that was added later was canceled and did not want to wait.",False
"店旁邊有一個付費停車場蠻大的。店有兩樓，價格算評價，日式料理的台灣口味還不錯，環境舒適，適合一家大小或朋友聚餐👍🏻
鹽烤牛小排很嫩💕 …","There is a paid parking lot next to the store.The store has two floors. The price is calculated. The taste of Japanese cuisine is not bad. The environment is comfortable. It is suitable for a family or friends.
Salt grilled beef steak is very tender ...",False
餐點份量剛好及價格也還蠻平價口味也不錯,The amount of meals is just right and the price is quite affordable.,False
常來聚餐的地方，生啤好喝，熱炒口味也很好，推薦炸軟骨，鮭魚炒飯，烤雞腿，水蓮(要交代不要太鹹)，香菇雞湯也很大鍋。,"The place where the meal is often comes, the raw beer is delicious, and the hot fried taste is also very good. It is recommended that fried cartilage, salmon fried rice, grilled chicken legs, and water lotus (to explain too salty).",False
服務人員很親切，生啤酒不夠冰，基本味道可以，味道偏台式,"The service staff is very kind, the raw beer is not ice, the basic taste is okay, the taste is partially",False
東西好吃，人員也客氣，只可惜以前的停車折抵現在沒了，希望你們的生意越來越好喔！！！,"The things are delicious, and the personnel are polite, but unfortunately, the previous parking is out of charge. I hope your business is getting better and better!IntersectionIntersection",False
"這是相隔三個月再次邀約好友---為了提早慶祝“母親節”
也是趁機聚餐---

近乎親人好友，是歌友---是群嚐遍國內外愛吃的不敢說“老饕”但是---愛吃好物---
最愛港式避風塘炒軟殼蟹---一絕---全靠真功夫---酥香的碎碎---軟殼蟹入口即化，香濃有緻，忘我的一口接一口---跟哥們說---嗯---真的有港味---好友老公帶我去香港的港式茶樓---老師傅就是專攻軟殼蟹---道地的避風塘酥炸炒---首推。
孔雀開屏---亮眼有創意
，炸香菇杏鮑菇“只可惜太少”輪到我要挾香菇，杏鮑菇，沒吃到”真可惜，地瓜，芋頭，很多尤其是炸地瓜。

蒸魚，鮮嫩。
炒海鮮蔬菜，菜色鮮艷，每道菜，份量足夠---
德國豬腳，份量稍少---香氣炸酥脆，好吃。
好友訂的是和菜---我要強調我們有吃飽。
敬告各位旅人饕客---大掌櫃的餐廳環境乾淨整潔---女廁打掃的一塵不染---請放心上---
我的日本師父說---廁所能維持乾淨整潔---廚房洗菜做菜---一定也會乾淨---
我會再去吃他們的其他料理---因為我愛吃。

上面的餐聚是今年的小年夜。

昨夜，5/1勞動節的前夕，一大早臨時又決定再次進入“大掌櫃”打牙祭---
11位又聚餐了---

一樣的維持“五星級”打掃化妝室，男女生維護的一塵不染---難得餐廳的客群---參差不齊---首推“大掌櫃”---老闆---跟你們的清潔維護人員“致敬”妳們辛苦了“。

昨晚的餐宴---維持的水準---在物價飆漲的時機---我只能說---老闆---便宜又讓我們吃飽還外帶那鍋湯跟綜合壽司---
唯一的缺憾---最後三道菜全部一起上---有點“急就章”---若能一道道---分次上菜---就是最“美好的“餐宴”---

還是要“謝謝---大掌櫃的廚師---工作人員---辛苦你們了---
加油了---","This is three months apart to invite friends again --- In order to celebrate ""Mother's Day"" early
Also take the opportunity to dinner-

Nearly relatives and friends, it is a singer friend --- I dare not say ""old lady"" who love to eat all over home and abroad, but --- love to eat good things ---
Favorite Hong Kong-style style of frying soft-shell crabs --- One must-rely on real kung fu --- crispy fragrance-the soft shell crab entrance is melted. -This to your buddies --- Well --- really have Hong Kong flavor --- friends and husbands take me to Hong Kong-style tea house in Hong Kong --- The master is specializing in the soft shell crab-the authentic shelter frying-fried- -Phopper.
Peacock opening screen --- bright and creative
, Pleurotus Pleurotus Pleurotus eryngii is ""too little"" is the turn of me. I want to stab the mushrooms, Pleurotus eryngii, and I do n’t eat it. Unfortunately, it ’s a pity that sweet potatoes, taro, and many especially fried sweet potatoes.

Steamed fish, tender.
Stir-fried seafood and vegetables, the dishes are bright, each dish, the portion is sufficient ---
German pig's feet, slightly small in portion-the aroma is crispy and delicious.
My friend ordered a harmonious vegetable-I want to emphasize that we have full.
Talk to all travelers and customers --- The restaurant environment of the big shopkeeper is clean and tidy-the dust of the women's toilet is not dyed --- please rest assured ---
My Japanese master said --- toilet can be kept clean and tidy-kitchen washing vegetables and cooking --- will definitely be clean ---
I will eat their other cuisine again-because I love to eat.

The meal above is the younger night this year.

Last night, on the eve of the 5/1 Labor Day, I temporarily decided to enter the ""big shopkeeper"" again in the early morning to fight the tooth festival ---
The 11th place was dinner again ---

Maintain the ""five-star"" cleansing makeup room, and the dust that men and girls are maintained-rare restaurants' customer bases-unevenness-the first push ""big shopkeeper"" --- boss --- with you Clean maintenance personnel ""pay tribute"" you have worked hard. ""

Last night's feast --- maintained the level-at the timing of the soaring price --- I can only say --- boss --- cheap and let us take the pot soup and comprehensive sushi- - -
The only regrets --- The last three dishes are all on together --- a bit ""urgent"" --- If you can make a channel --- Sub-serving-the most beautiful ""meal banquet"" ---

Still want to ""thank you --- the chef of the big shopkeeper --- staff --- hard work you ---
Come on ---",False
吃東西的感覺很舒服。食材高檔。價位便宜,It feels comfortable to eat.High -end ingredients.Cheap,False
"大宴小酌兩相宜～
謝謝主人家 誠意十足～","Best banquets are suitable for two phases ~
Thank you for your sincere sincerity ~",False
好食CP質高、海鮮火鍋超好喝、比目魚壽司入口即化、啤酒超大杯👍 …,"Good food CP value, high seafood hot pot, super delicious, better than eye fish sushi, is the large cup of beer ...",False
上菜非常慢，點完菜50分才上了一份炒飯，廚房明明早已無法負荷，卻故意不跟客人說，硬要把店內位子塞滿，等了快2小時整點的菜都還沒上完，1顆星都嫌太多,"The food was very slow. After ordering 50 minutes, I got a fried rice. The kitchen was clearly unable to load, but I deliberately did not tell the guests that I had to fill the seat in the store. After finishing, one star is too much",False
服務親切～ 軟殼蟹壽司、炒水蓮好吃！,"Careful service ~ soft shell crab sushi, fried lotus lotus is delicious!",False
"東西好吃 出餐超快
環境氣氛都不錯！","Good food is super fast
The environmental atmosphere is good!",False
超級好吃，改菜單後好吃很多，串燒料理很不錯。菜的話口味很不錯，但量有點少，但能理解，還會再光顧。,"It's super delicious, it is much delicious after changing the menu, and the skewers are very good.The taste of the dishes is very good, but the amount is a bit small, but it can be understood and will patronize.",False
"香菇雞湯菜有蟲，很噁心，
跟店員反應愛理不理的，點餐沒有確認餐點出菜出錯。","Mushroom chicken soup has worms, very disgusting,
I responded to the clerk to ignore the reason, and the order of ordering did not confirm the meal ordered.",False
多人聚會的好地方，價錢也不高，食物也好吃。,"A good place for many people to meet, the price is not high, and the food is delicious.",False
每天下班經過看到都很少人，想說去吃一次看看，終於知道為什麼很少人的原因了，本人喜歡吃握壽司到貴店點握壽司真的非常令人失望，真心覺得迴轉壽司的都比貴店更有性價比，水準真的差很多，希望貴店真的能請一位專業的日本料理師傅。真心不推薦日本料理的部分，還看到了服務人員在跟服務人員在吵架。,"I see very few people after I see it every day. I want to say that I have to eat it once. I finally know why few people are. I like to eat a nipple sushi to Guidian to order a sushi. They are more cost -effective than your store, and the level is really worse. I hope your store can really invite a professional Japanese cooking master.I really do not recommend the part of Japanese cuisine, and I also saw that the service staff were arguing with the service staff.",False
"好吃新鮮～～～👍👍👍
非常溫馨的環境氣氛～值得一來再來 …","It's delicious and fresh ~~~
A very warm environment atmosphere ~ It is worth a comeback ...",False
"台式的熱炒
場地大桌位多
可以多人聚餐","Desktop hot fry
There are many large tables
You can get a meal for many people",False
之前常去金城路那家 感覺很不錯 想說分店比較近去吃看看 特別失望 上菜隨便放一個角落  上菜速度慢得要命 菜一直漏單要才有在上  整個感覺特別差 消費8千多 體驗一次就好 真心不推薦,I used to go to Jincheng Road. I felt very good. I wanted to say that the branches were relatively disappointed to eat. I just put a corner and put a corner. The speed was slow. It's so recommended that you can experience it once,False
