Original,EN,Needs Review
臨時決定來慶生，生日還有半隻龍蝦，真是賺到，服務生會幫忙烤好送上來，真的很用心，很好吃👍。,"The temporary decision to celebrate his birthday, there are half lobster on his birthday, which is really earned. The waiter will help bake and send it. It is really careful and delicious.",False
店員人超級好！男的帥，女的美！餐點好吃，很值得來耶！,"The clerk is super good!Men's handsome, female beauty!The meal is delicious, it is worth visiting!",False
"肉質好 氣氛不錯 沒什麼油煙

店長人好 幫忙烤麻糬☺️ 完美","Good meat and good atmosphere, good atmosphere, no oil fume, no oil fume

The manager is so helpful to bake the hemp 帮️ Perfect",False
餐點本身肉質無話可說的優質，換烤網與服務品質也是無話可說，有求必應的服務態度，加上與服務員小松的有趣應對，絕對是值得再訪的週末聚會小店。,"The meal itself has no quality of the meat, and the quality of the grill and the service is also speechless. If you have a corresponding service attitude, and the interesting response to the waiter Xiaosong, it is definitely a weekend gathering shop worth visiting.",False
"服務超周到 環境很乾淨
東西也很新鮮 感謝小廷的貼心！","The service super long to the environment is very clean
Things are also very fresh. Thank you Xiaoting for your intimateness!",False
"米炭火的烤肉從來不讓人失望
這裡的小廷店員代客烤肉還用心準備小驚喜給客人，非常推薦這家店！","The grilled meat of rice charcoal never disappoints
The small court clerk here also prepares a small surprise to the guests with intention, and I recommend this shop very much!",False
"牛肉很好吃！白蝦已經剝好蝦殼～懶人救星！
第一次用餐的客人，店員會詳細介紹菜品～","The beef is delicious!White shrimp has been peeled with shrimp shell ~ lazy savior!
Guests who dine for the first time, the clerk will introduce the dishes in detail ~",False
"東西是可以的，生啤也好喝
但今天的服務真的感到不愉快，
朋友生日跟他們約這邊，也不是第一次來，能理解尖峰時段比較忙，但過程中餐點或是服務需要的東西講了兩次都沒有來，並且一開始詢問我們壽星表示有附贈的餐點，也拍了身分證做確認，也沒有來我們詢問過一次之後再次確認是不是壽星，覺得算了就結帳離開..","Things are okay, and raw beer is so delicious
But today's service is really unhappy,
My friend's birthday with them is not the first time to understand. I can understand that the peak period is busy, but the meal or what the service required in the process did not come twice, and at the beginning, I asked us that Shousan said that there is a gift with a gift. The meal also took the identity card to confirm, and we did not come to ask if we asked if it was Shouxing once again.",False
"好吃好吃～～元宵節全家大小來吃
服務好
食材新鮮
適合慢慢吃再喝點小酒
真不錯","It's delicious and delicious ~~ Lantern Festival, the whole family, come and eat
Good service
Fresh ingredients
Suitable for eating slowly and drinking a little wine
Really good",False
"是裕民學府周圍唯一一間燒肉店！肉好吃，蛤蠣湯CP值高，烤飯糰雖然大個卻吃不膩。芥末非常特別，是米黃色的，也挺嗆，應該是芥末本來的樣子？？
酒改天再點來喝。
預祝生意興隆🎊","It is the only roast shop around Yumin Xuefu!The meat is delicious, the CP value of the oyster soup is high.Mustard is very special, it is beige, and it is also very embarrassed. Should it look like the mustard?Intersection
Come and drink after the wine.
I wish business prosperous",False
調味好，碳烤香氣十足,"Season well, full of carbon grilled aroma",False
"超好吃❤️
最愛手羽串、五花肉、七里香⋯
還有美好的生蠔🦪招待👍","Super delicious ❤️
Favorite hand feathers, pork belly, Qili Xiang ...
There are beautiful oysters 👍 entertaining 👍",False
"上菜算快，餐點很豐富，
另外也感謝店員「姐姐」的用心服務！
用餐時段人潮眾多很忙碌，
但店員還是很熱心地介紹推薦料理
以及烤肉注意事項，
態度很好，沒有因為繁忙而不耐煩，
給她一個讚👍","The food is fast, the meal is very rich,
In addition, I also thank the clerk ""sister"" for your intention!
There are many people who are very busy during the meal,
But the clerk still enthusiastically introduces recommended dishes
And barbecue precautions,
The attitude is very good, not impatient because of busyness,
Give her a praise",False
"二訪米碳燒肉♡
朋友推薦，吃過愛上","Second visit rice carbon roasted meat 二
Recommended by friends, I have eaten in love",False
食材新鮮，吃起來口感很好！但價格不便宜。魷魚一夜乾烤起來真的蠻鹹的，咬起來很有嚼勁。,"The ingredients are fresh and tastes good!But the price is not cheap.The squid is really salty in drying overnight, and it is very chewy to bite.",False
"超讚的服務，餐點好吃，母親節還有活動送龍蝦🦞
讚啦！","The superb service, the meals are delicious, Mother's Day and event to send lobster 🦞
Like!",False
本來就愛吃米碳火 平常吃新莊迴龍店 今天宵夜想說吃個幾盤肉 經過土城店就來吃了 拜託老闆幫我給小廷加薪 服務太好 又細心 對寵物超友善 為了他以後都來這家米碳火👍,I originally loved to eat rice carbon fire. I usually eat Xinzhuang Huilong Store today and want to say that eating a few plates of meat passed through Tucheng store and asked the boss to help me pay for Xiaoting. He will come to this rice carbon fire in the future,False
"開幕當天來吃
豬肉腥味 有點重😅
山藥明太子不錯吃
飯糰也很好吃喔！裡面有起士
下次在試看看其他菜色
飯後還贈送冰品 還不錯
缺點那個隔壁的油煙都會飄過來","Come to eat on the opening day
The fishy smell of pork is a bit heavy 腥
Yam Mingzi Prince is good to eat
The rice ball is also delicious!There are cheesers
I will try other dishes next time
It is not bad to give me the ice after meals
The disadvantage of the oil fume next door will float",False
這裡招待的生蠔很新鮮又大顆！感謝服務員姐姐熱情招待,The oysters enrolled here are fresh and large!Thanks to the waiter sister for their enthusiastic hospitality,False
"燈光明亮清爽，店員熱情服務且貼心！
重點是店家提供專業烤肉～對於手殘如我的消費者，即便不熟食材特性，也能享受到黃金熟度好滋味！","The lights are bright and refreshing, the clerk is enthusiastic and intimate!
The point is that the store provides professional barbecue ~ For consumers who are residual as me, even if they are not familiar with the characteristics of the ingredients, they can enjoy the good taste of golden maturity!",False
氣氛沒有以前中央路店的好，今天用餐服務人員有點錯餐的狀況，隔壁的客人似乎也有這種狀況，服務上因人員有些忙碌服務上較不即時。,"The atmosphere is not as good as the Central Road Store. Today, the dining service staff has a little wrong meal. The guests next door seem to have this situation. The service in terms of service is relatively busy.",False
"每次來遇到的服務人員都超級親切，尤其是小廷，這間分店的服務人員都超有熱誠，都是很棒的年輕人，食物好吃，服務更是沒話說

也推薦生啤酒和梅酒","Every time the service personnel who come to meet are super kind, especially Xiaoting. The service staff in this branch are super enthusiastic. They are great young people. The food is delicious. The service is nothing to say.

I also recommend raw beer and plum wine",False
"整體用餐體驗還算不錯，但是在最後點麻糬時出現了一點小插曲，上麻糬的時候店員給了我們兩套新的餐具，餐具沾滿了煉乳(盤子、筷子、夾子)，因為那位店員用剛打開煉乳罐的手套拿的餐具。非常明顯，她卻假裝沒看到，讓人懷疑是不是因為快打烊了，所以不耐煩故意這樣做？

但是店員並未告知最後點餐的時間，菜單上也沒寫。如果有這樣的規定，應該在顧客進店時或在菜單上清楚標示出來，這樣能避免不必要的誤會。

好在店裡有位年紀較大的女店員一直態度很好，希望其他員工也能向她學習，提供更好的服務。

雖然這次有點失望，但因為餐廳位置方便，我還是會再來，希望下次能有更好的體驗！","The overall dining experience is pretty good, but a little episode appeared at the last order of the hemp. When he was on the hemp, the clerk gave us two new sets of tableware. Use the set of gloves just opened with the cream jar.Obviously, she pretended not to see it. She doubted whether it was because she was about to snooze, so she was impatient?

However, the clerk did not tell the time of ordering the last meal, and the menu was not written on the menu.If there are such regulations, it should be clearly marked when the customer enters the store or on the menu, so as to avoid unnecessary misunderstandings.

Fortunately, a larger female clerk in the store has always been in a good attitude, hoping that other employees can learn from her and provide better services.

Although I was a bit disappointed this time, because the restaurant is convenient, I will come again. I hope I can have a better experience next time!",False
"情人節打卡送松阪肉
肉質新鮮 還有專人帶烤
非常專業好吃！","Valentine
Fresh meat and special person with roasting
Very professional and delicious!",False
"我覺得基本上餐點完全無雷！
只可惜厚切牛舌自己烤比較不會控制熟度建議可以問店員！

全裸性感白蝦8隻$168，已經撥好的蝦子超讚！
松阪豬、牛五花、帶骨牛小排都好吃！

生食級甜干貝上面還有蟹膏，超推！

串燒類不管是手羽先、明太子雞肉、和牛串也推！
墨魚口味香腸也是必點！把皮處理的超好很脆很好吃！

可樂一罐28，啤酒98真的也是佛心價

我想我會想常常來☺️","I think the meal is basically thunderous!
Unfortunately, it is recommended to ask the clerk if you do n’t control the maturity of the thick cut beef tongue!

Naked sexy white shrimp is 8 $ 168, and the shrimp that has been dial is superb!
Matsusaka pigs, beef pork flowers, and bone cow small steaks are delicious!

There are crab pastes on raw food -grade sweet scallops, super pushing!

Stringing the skewers, whether it is hand feathers, Chica chicken, and cow skewers also push!
Ink fish flavored sausage is also a must!The skin is very crispy and delicious!

Coca -Cola 28, Beer 98 is really the price of Buddha

I think I will think often 会️",False
"用餐環境明亮乾淨
因為懶惰自己烤
都點店家烤好的菜色
涼拌菜可以續
食物吃起來都挺不錯","The dining environment is bright and clean
Because laziness is baked by yourself
Out of the shop to bake good dishes
Cold dishes can be continued
The food tastes pretty good",False
"全土城最好吃燒肉店
帥哥小佑熱心服務❤️
推推夢幻牛五花、牛舌、酒釀蕃茄
菜單隨便點完全沒有雷的菜品
每月必來～～～～","The best roast meat shop in the whole Tucheng
Handsome guy Xiaoyou enthusiastic service ❤️
Push the fantasy beef, beef tongue, and wine to brew tomato
The menu is completely ordered without thunder dishes at all
Come every month ~~~~",False
母親節快樂，順便慶生，來吃好吃的燒肉,"Happy Mother's Day, celebrate his birthday by the way, come to eat delicious roast meat",False
好吃，服務人員都會提醒不同食材的烤法，及一些桌邊服務！最喜歡酒釀蕃茄、烤飯糰囉！,"Delicious, service staff will remind the baking method of different ingredients and some table services!Favorite wine brewed tomatoes and roasted rice balls!",False
雖然知道餐飲業一定避免不了，就是運氣不好了點發生在我們身上，但店員的即時處置有到位，還是建議管理層即刻調整公休日，安排一下全館消毒整潔，避免造成下一個顧客的陰影！再次感謝店員的即時處置！,"Although I know that the catering industry must not be avoided, it is bad luck that happened to us, but the instant disposal of the clerk is in place. It is still recommended that the management adjust the public rest immediately and arrange for the whole museum to disinfect and clean it to avoid causing the shadow of the next customer. IntersectionThank you again for your real -time disposal!",False
"最近裕民路上新開的米炭火燒肉小酒館
店內用餐非常有氛圍，店員的服務也都非常棒
本來以為只是單純的居酒屋
沒想到，有些東西是上了食材讓你親自DIY來燒烤
所有料理，我們最推薦「明太子雞腿捲」「和風牛筋煮」「煉乳麻糬」
當天消費還有招待兩顆鮮蚵，店員也親切的幫我們烤麻糬
雖然以價格與食物綜合來說，CP值不是到特別高
但整體而言，是推薦大家值得一試，宵夜聊天喝酒的好地方
店內也接受LINE Pay付款唷！真的非常方便
推薦大家一定要去試試看👍👍👍","Recently, the newly opened rice charcoal fire roast pork tavern
The meal in the store is very atmospheric, and the service of the clerk is also very good
I thought it was just a simple izakaya
Unexpectedly, some things are made of ingredients for you to diy to grill
For all dishes, we most recommend ""Prince Chicken Chicken Roll"", ""Boil of Wind Beats"", ""Boil of Bowing""
On the day, there were still two fresh crickets for consumption, and the clerk also cordially helped us bake the hemp ravioli
Although in terms of price and food, the CP value is not particularly high
But overall, it is a good place to recommend that everyone is worth trying, chatting and drinking for supper.
The store also accepts LINE Pay payment!It's really convenient
Recommend everyone must try it 去",False
"來訪過多次了 服務品質真的大推！
店內很多帥哥（可以說是夜間仕男燒烤的感覺）
店員都很幽默 ！
烤麻糬很讚！！！","I have visited many times and the quality of service is really pushing!
Many handsome guys in the store (it can be said that it feels like a man's grill at night)
The clerk is very humorous!
Baked hemp is great!IntersectionIntersection",False
小廷超棒的！積極處理我們遇到的問題，我給滿分，烤串超好吃 小廷烤的超嫩 雞腿串會爆汁噢,"Xiaoting is awesome!Actively deal with the problems we encountered, I give full marks, the baking skewers are super delicious, the super tender chicken leg skewers will burst juice",False
"店員態度很好
牛肉很好吃
擺盤也很講究
招待鮮蚵仔還有冰棒 小孩很開心
收盤還有換網介紹都說得清楚","The clerk's attitude is very good
Beef is delicious
Playing is also very particular
I am very happy to entertain fresh Taipa and popsicles
The closing of the network and the introduction of the network can be clearly explained",False
單點烤雞肉串，一個半小時都還沒辦法出現。現在還在等…嗯 寫的時候來了⋯⋯牛肉串半小時，明太子牛肉一小時。,"Single -oriented grilled chicken skewers can not appear for an hour and a half.I am still waiting ... Well, when I write, I came for half an hour when I wrote, and the prince was one hour.",False
生日壽星送龍蝦，來店送鮮柯，分享送帆立貝。,"Birthday Shouxing send lobster, come to the store to send Xianke, and share Fan Libei.",False
"已回訪好幾次！
餐點肉質很棒，服務品質及服務態度還不錯👍🏻，加上偶爾有招待！
值得再訪的串燒燒肉酒館🏮","I have visited several times!
The meal is great, the service quality and service attitude are not bad, plus occasional entertainment!
The skewed roasted meat tavern is worth visiting 🏮",False
店員很有藝術天份，特地問平常有沒有看什麼動漫的習慣，於是就畫了個喬巴給我們😀,"The clerk is very artistic, and asked him about whether he usually watched any anime habit, so he drew a Qiaoba for us.",False
餐點好吃，適合小家庭聚餐，炸丁香魚大推👍 …,"The meal is delicious, suitable for small family dinner, fried clovefish push ...",False
超好吃👍一試成主顧，每逢生日必來報到！烤飯糰真的是我的摯愛😍,"Super delicious 试 Try to make a caregiver, you must come to report every birthday!The roast rice ball is really my beloved 😍",False
餐點很好吃，服務超好,"The meal is delicious, the service is super good",False
價格很平實，服務的人員也非常親切，大推,"The price is very flat, and the service personnel are also very kind.",False
"想吃燒烤跟串燒，土城居然有這個好地方，
燒烤部分表現不俗，肉質都不錯，串燒類口味偏重，就建議搭配一些，解膩的泡菜、剝皮辣椒，都是不錯的選擇。

整體而言還是給到5分喔，服務人員也非常熱心、親切（尤其吧台的服務的大姐👍👍👍）

銬飯糰推到炸。","Want to eat barbecue and skewers, Tucheng actually has this good place,
The barbecue part is not vulgar, and the meat is good. The skewers have a lot of flavor. It is recommended to match some. The noodles and peeling peppers are all good choices.

Overall, it is still 5 points, and the service staff is also very enthusiastic and kind (especially the elder sister of the bar service service)

The cuffd rice ball pushed to the fried.",False
服務很不錯，自己最喜歡鮭魚起司飯糰！可惜一定要生日前後一天才有招待，剛好差一天有點扼腕🥹,"The service is very good, I like salmon cheese rice balls the most!Unfortunately, it must be entertaining a day before and after birthday, just a bit of a bit of a day, a bit of frustration 🥹",False
"CP值低，服務兩光，烤飯糰等了兩個小時，肉都烤完了才上生菜，吃了個空虛🚬

喔，招待的蛤蜊全都是沙 …","The CP value is low, the service of the two lights, the grilled rice ball has waited for two hours, the meat was grilled before I was put on lettuce, and I ate an empty 🚬

Oh, the entertainment clams are all sand ...",False
"環境明亮乾淨
服務熱忱
想買些蔥塩醬帶回去配牛舌
撈了一堆 跟我說不用錢啦
謝謝啦","Bright and clean environment
Enthusiasm
Want to buy some lush sauce and take it back with beef tongue
I told me that I didn't need money to tell me
Thank you",False
"非常好吃！會想要再來二訪的店
送的蛤蜊湯也好好喝哦","Very delicious!I will want to come to the second visit to the second visit
The clam soup given is also delicious",False
食材新鮮品質好、師傅烤功很不賴👍,"The fresh quality of the ingredients, the master's grilled work is not bad 👍",False
食材新鮮，冰酒杯有加分。,"The ingredients are fresh, and the ice wine glass has extra points.",False
"橫隔膜有點小貴，但是非常可口。無骨牛小排簡直令人驚艷，後面帶骨烤真香。豬五花好吃的讓人驚艷，肥肉烤到Q彈。

土城裕民路這邊好吃的店不多，這家店算是拯救了這區食客的味覺。我住在附近，會常常去光顧的～XD","The diaphragm is a bit expensive, but it is very delicious.The boneless beef steak is amazing, and the bone is baked in the back.The pork flowers are delicious, and the fat meat is grilled until Q.

There are not many delicious stores on Yumin Road in Tucheng. This shop can save the taste of diners in this area.I live nearby, I will often patronize ~ XD",False
價位合理、某些品項超值，味道好、環境不錯、冷氣超涼夠涼！應該會常常光顧！,"The price is reasonable, some items are value -for -money, the taste is good, the environment is good, the air conditioner is super cool enough!It should be patronized often!",False
餐點還可以但服務員趕著要下班吃飯有人在旁邊滑手機還要叫他才會起來結帳，東西看看有漏單但也懶得管就直接走了，服務生感覺很冷漠，烤的肉蠻硬的,"The meal is okay, but the waiter rushed to get off work for someone to slide the phone next to him and asked him to get up to check out. If you look at the leakage, but you are too lazy to leave, the waiter feels very indifferent. Pretty",False
"優秀的串燒、燒肉店
肉質都很不錯 佐特製蔥醬或是明太子的都好吃
也有特別給予爐上鐵盤可以烤豬五花

但串燒因為要做很久（一小時以上）
只能點一次 其實很可惜

價格有相當便宜 值得再訪","Excellent skewers and roasted meat shops
The meat is very good. The onion sauce or the prince is delicious.
There are also specially given iron plates on the furnace to roast pigs with five flowers

But skewers have to be done for a long time (more than one hour)
It is a pity that it can only be ordered once

The price is quite cheap and it is worth visiting",False
"母親節活動送龍蝦
來過很多次了，東西好吃服務親切","Mother's Day event to send lobster
I've been here many times, the things are delicious and kinder",False
東西好吃～ 小廷服務很好唷！！,The things are delicious ~ Xiaoting service is very good!Intersection,False
"超級好吃😋
店員很用心 服務很好👍
畫畫超可愛❤️❤️❤️❤️","Super delicious
The clerk is very good at service 心
Painting super cute ❤️❤️❤️❤️",False
態度服務佳 上餐速度也很快 推薦,Attitude service is also recommended quickly,False
好吃的土城燒肉店～服務人員也都很熱情！推推👍🏻,The delicious Tucheng roasted meat shop ~ service staff is also very enthusiastic!Push,False
"服務周到 服務人員態度都超好～
帥🤙","The attitude of thoughtful service personnel is super good ~
Handsome",False
小廷，牛五花條烤的真讚，嫩中帶烤香，百吃不膩,"Xiaoting, the niu pents baked baked praise, tender incense in the tender, not greasy to eat",False
"食材新鮮 👍
服務人員更不用說了～
好的不得了👍貼心又親切 ☺️
值得讓人會一直來的店家～
土城人有福了😆","Fresh ingredients 👍
Not to mention the service staff ~
Good ones 又 Intimate and kind ☺ ️ ️
It is worth the shop that will always come ~
Tucheng people are blessed.",False
音樂太吵 東西好吃 服務人員過於積極 生意很好,The music is too noisy and delicious. The service staff is too positive and the business is very good.,False
服務很讚 食材超棒,"The service is great, the ingredients are great",False
串燒很好吃唷，蛤蜊湯很香原汁原味！ 牛肉也很好吃！雞肉幫我們烤得非常嫩！辛苦的員工們 100分,"The skewers are delicious, clam soup is very fragrant juice!The beef is also delicious!The chicken helped us grilled very tender!Hard employees 100 points",False
"烤飯糰好吃、
牛五花好吃、
墨魚香腸好吃（鮮）、
麻糬好吃、
明太子雞腿好吃、
明太子系列都好吃、
黑毛豬五花好吃、

服務人員服務特別好，真的特別好

壽星當日還有送驚喜禮物唷。

這是很適合三五好友聚會、小酌，放鬆心情我。

非常推薦！！！！","The grilled rice balls are delicious,
Niu Wufeng is delicious,
Demon sausage is delicious (fresh),
Maki is delicious,
The Chicken Chicken Chicken is delicious,
The Ming Prince series is delicious,
Black hair pigs are delicious,

The service personnel service is particularly good, it is really good

Shouxing also gave a surprise gift that day.

This is very suitable for three or five friends gatherings, drinking, and relaxing me.

Very recommended!IntersectionIntersectionIntersection",False
"烤飯糰跟拌飯也很好吃🤪
燈光美氣氛佳，桌邊服務也很快","The grilled rice ball and bibimbap are also delicious 🤪
The lights are beautiful, and the service on the table is also fast",False
"好吃！母親節提前過
老媽說這間的調味很可以 對她這種吃清淡的老人家來說不會過鹹
祝大家母親節快樂❤️","tasty!Mother's Day
My mother said that this seasoning can be very salty for her light -eating elderly people who eat light people.
Happy Mother's Day ❤️",False
帥哥：小廷  對客戶服務棒棒棒，人也帥，東西超好吃，9月生日會再來一次。值得的晚餐 無敵星星,"Handsome guy: Xiaoting serves customers with great service, people are handsome, and things are super delicious.Worth dinner invincible stars",False
食物新鮮，好吃，店員服務佳，強烈推薦,"Food is fresh, delicious, the clerk service is good, strongly recommended",False
"週五晚餐很熱鬧！
氣氛佳～～～
坐在吧檯服務很好～～～
店員有空還會幫忙烤👍👍
肉也新鮮好吃👍","The dinner on Friday is very lively!
The atmosphere is good ~~~
Sitting on the bar service is very good ~~~
The clerk is free and will help bake 店
The meat is also fresh and delicious 鲜",False
