Original,EN,Needs Review
"食材新鮮！！豬五花油脂分布均勻，很好吃😋
魷魚一夜干處理得很好，烤起來很方便！
店員很熱情～
推推，會再訪👍🏻👍🏻","Fresh ingredients!IntersectionPig pork flower oil is evenly distributed, delicious 😋
Squid is well handled overnight, and it is convenient to grill!
The clerk is very enthusiastic ~
Push push, you will visit again",False
今天與家人前往用餐，選擇中秋套餐組合～肉質真的不在話下，有夠啾喜！！吃肉必備的配料店家也給好拉滿～也很新鮮，今天最喜歡的是牛舌和橫隔，彈牙也好吃。店員熱情100%換考網超勤快，招待的海鮮也很完美的好吃😋,"Go to dinner with your family today, choose the Mid -Autumn Festival package combination ~ The meat is really not a word, you have enough joy!IntersectionThe essential ingredient store for eating meat is also full ~ It is also very fresh. Today's favorite is beef tongue and horizontal separation, and the elastic teeth are delicious.The clerk is enthusiastic about 100%to change the test network is super diligent, and the entertaining seafood is also perfect and delicious 😋",False
"2024/08/14
臨時決定來慶生，結果遇到店內當日壽星的活動是送半隻龍蝦(要當日喔)，真是賺到，服務生會幫忙烤好送上來，還會用明太子寫生日快樂，真的很用心，很好吃😘👍。

整體用餐很愉快，沒有遇到一些留言所說的要等烤肉串很久或是態度不好的狀況。這也有可能是因為平日吧。

這次坐在吧台，服務生在他有空的時候有過來幫我們烤戰斧跟帶骨牛小排，還幫忙剪好好的，整個服務真的沒話說👏👏👏

這次用餐兩個人1890，我們都有吃很飽，有人說會吃不飽，其實並不會，看你怎麼點。我們有點一顆飯糰跟一碗牛肉湯跟一份炸物，再搭配自己烤牛豬肉跟店內的肉串，喝著啤酒跟可樂，還有免費的龍蝦，想像一下那個畫面，整個就是舒服啦😆👍。
當然，如果你要像吃到飽那樣一直都狂吃肉，子彈可能要準備多一點才能吃很飽😝。

最後，建議要來的朋友，即使是平日也最好要定位，我用餐的時間大約七點多，就有好幾組人可能看店內還有空位就進來表示想要用餐,服務生確認不是預約客後，查了定位表後，都告知要等一小時左右。看來那些空位都是有人預約好的。所以建議先打電話預約👍","2024/08/14
The temporary decision came to celebrate his birthday. As a result, the event of the birthday star in the store was to send half a lobster (that day). It was really earned. The waiter will help to bake and send it up. Very delicious.

The overall meal is very happy. I have not encountered some messages that have to wait for the barbecue skewers for a long time or a bad attitude.This may also be because of weekdays.

Sitting on the bar this time, the waiter came here to help us bake the Tomahawk and bone cattle for a small steak when he was free.

This time, two people were 1890. We were full. Some people said that they would not be full. In fact, it would not be.We have a rice ball and a bowl of beef soup and a fried material, and then with our roasted beef pork and the skewers in the shop, drinking beer and cola, and free lobster. Imagine that picture, the whole is comfortable. Alas.
Of course, if you have to eat meat like you are full, the bullets may have to prepare a little more to eat.

In the end, it is recommended that friends who come to come, even on weekdays, are best to locate. I dine at about seven o'clock. Several groups of people may come in in the store and say that they want to dine. Later, after checking the positioning table, I informed about one hour.It seems that some of the vacancies are made up.So it is recommended to call to make an appointment first 打",False
"過生日與家人來吃
娘說服務態度很好，
而且食材新鮮，感覺也不錯
說下次吃飯可以再選這一家🤣

小捲 我每次來必點
娘的評價也不錯
松板豬也好吃~
蝦的話殼也是撥好的

生日當天還有送烤龍蝦❤️","Come and eat with your family on your birthday
Mother said that the service attitude is very good,
And the ingredients are fresh, it feels good
Say that you can choose this one next time

I must order every time I come
Mother's evaluation is also good
The pine pig is delicious too ~
The shell of the shrimp is also allocated

There are also baked lobsters on your birthday ❤️",False
"肉品質好👍
用餐環境好👍👍
服務品質更好👍👍👍
換到裕民路後用餐環境更舒適👍👍👍
生日提前2天到店慶生不能被招待龍蝦覺得可惜，但服務人員小廷非常貼心立馬送上鮑魚盤和生日快樂畫板，讓人覺得服務既貼心又用心👍，以後還是會來店裡消費的。","Good meat quality 好
The dining environment is good
Better service quality 好
After changing to Yumin Road, the dining environment is more comfortable 👍👍👍
It is a pity that the birthday to celebrate the birthday in the store can not be entertaining the lobster, but the service staff Xiaoting was very intimate and sent the abalone plate and a happy birthday panel. It made people feel that the service was intimate and attentive.",False
"兩人生日差兩天，少數兩個壽星都給慶生的禮的大器店家（生日在後面的我終於不用再被瓜分生日禮了，我可以自己也有完整的一份，超感動）環境維持很乾淨，師傅跟服務人員都很親切可愛。
因為晚點趕上夜班，吃了一個小時的快速餐，還是被店家照顧的好好的，優雅開心的慶生。
餐飲點了嫩牛 孜然牛 松阪豬 滷腸 起司鮭飯糰，生日禮是龍蝦超狂，沒意外應該會是無雷店家，不固定的招待會讓人小期待，希望這些優秀特色可以延續。

價位的部份，如果以服務、食材+不噴灰的炭火、打掃乾淨的烤爐、很難刷的烤網等成本看下來，就不算貴，很超值，終於在家附近找到有炭火可以自己控制加溫的夢想酒館，因為要上班不敢喝，下次一定要喝兩杯。
綜合以上，從來不主動寫評論的人，忍不住想上來誇獎鼓勵下，沒什麼能回饋好店，只能以後多用新臺幣支持了！","The birthday difference between the two is two days, and a few of the two longevity stars are given to the celebrities of the celebration. Clean, the master and the service staff are very kind and cute.
Because I caught up with the night shift late, I had an hour of fast meal, and I was taken care of by the store well, elegant and happy celebration.
The catering ordered the tender beef cumin beef Matsusaka pork braised kiwoody rice ball. The birthday ceremony is a lobster super crazy. There should be a thunderless shop without an accident. Unfalted enrollment will make people look forward to it. I hope these excellent features can continue.

The price of the price is not expensive, if you use service, ingredients+not ash -spray charcoal fire, cleaning the clean ovens, and difficult to brush the grilled net, it is not expensive, it is very good value, and finally found charcoal fire at home. You can find a charcoal fire. Control the warm -up tavern by yourself, because you dare not drink at work, you must drink two glasses next time.
Based on the above, people who never take the initiative to write comments can not help but want to come up and praise and encourage. There is nothing to give back to good stores. I can only use NT $ more in the future!",False
"東西真的超級好吃🤤🤤🤤回訪很多次了！
有一次連續3週每個禮拜六都來哈哈哈
是真的吃不膩，而且整體CP又高
價格親民、服務好、肉品也很優質😍
店員超喜歡阿佑，人很好笑😉","Things are really so delicious. I have visited many times!
One time I came every six consecutive weeks every Saturday, hahaha, hahaha
It's really not greasy, and the overall CP is high
Price and people, good service, and meat products are also high quality 😍
The clerk likes Ayou, and people are funny 😉",False
"第一次來用餐，是用畫單的方式點餐
轉頭看過去中間都閒下來
向服務生詢問
他們才反應過來有漏單

都點第二輪了
第一輪的東西還沒上
第二輪還漏單
上菜速度慢到吃手手

今天是平日禮拜一欸
晚上9點10點而已欸
離打烊還有一段時間欸

牛肉串 豬肉串 七里香份量嚇到吃手手

優點：
肉的品質值得稱讚是好吃的
鮭魚起司烤飯糰好吃 推一個👍

向服務生詢問漏單的問題
處理態度良好👍
還送了一盤帆貝","The first time for dinner is to order meals by drawing a list
Turn around and look at it in the middle
Ask the waiter
Only then did they respond

It's the second round
The first round of things haven’t been on yet
The second round is missed
Slowly serving is too slow to eat

Today is one week on weekdays
Just 9:10 pm 10
There is still a while before snorting 有

Beef skewers, skewers, seven miles fragrant weight scare food

advantage:
The quality of meat is commendable to be delicious
Salmon cheese grilled rice ball is delicious and push a push 👍

Ask the waiter to ask the missed order
Good handling attitude 度
I also gave a plate of sails",False
"米碳燒肉⋯好好吃唷🫶🏻
兩位帥氣又貼心的小鮮肉😬
阿均細心又貼心鹽蔥調味達人，小廷超強手繪（被燒肉店耽誤的一位人材🤣🤣🤣🤣🤣","Rice carbon roast meat is delicious 🫶🏻 🫶🏻 🫶🏻
Two handsome and caring little fresh meat 😬
A Jun carefully and intimate salt onion seasoning experts, Xiaoting Super Hand -painted (a person who was delayed by a roasted meat shop 🤣🤣🤣🤣🤣",False
"昨天是女兒生日，第一個想到的地方就是“土城米燒肉”小酒館，因為壽星就有大大的龍蝦招待，感覺特別幸福。其它的不用再多介紹了，幾乎這裡的每一款菜品都相當合我們的胃口，口感都非常的好，服務的很好，給個大大的讚！
我這里想説兩句，如果你皮包夠厚，你一定會再回來，如果皮包不是很厚，也會想再回來，如果跟我一樣皮包空空的，也時不時會想辦法回來，就一句話“好吃”。","Yesterday was the birthday of her daughter. The first place to think of is the ""Tucheng Rice Roast Meat"" tavern. Because Shouxing has a large lobster entertaining, it feels particularly happy.There is no need to introduce the others. Almost every dish here is quite good for our appetite. The taste is very good, the service is very good, and give a great praise!
I want to say a few words here. If your leather bag is thick enough, you will definitely come back. If the leather bag is not very thick, you will want to come back. If the leather bag is empty, you will find a way from time to time. tasty"".",False
"這個價位CP值算高，送餐速度服務品質都很棒，基本上每間的的水準品質一至。

然後鹽蔥醬大大方方給上一碗🥣
不可能店員都跟韓星一樣好看吧🤩 #小廷啦","The CP value of this price is high, and the quality of the meal delivery speed service is great. Basically, the standard quality of each room is one.

Then give a bowl of salt onion sauce.
It is impossible for the clerk to look as good as Han Xing. #小 不",False
之前在中央路吃米燒烤員工都不錯，現在到裕民路第一次跟朋友二個人吃8000多塊連個招待都沒有，今天一樣去吃快8000，仔細看帳單帳單上面有打招待，卻沒有招待，況且我ㄧ進門就有問招待的事情店員阿姨他跟我說有棒棒冰跟生蚵，但是等到付完錢還是沒有招待，問他說有沒有招待才拿出來，我們也不是想要你們的招待，只是覺得你有招待為什麼不拿出來給客人，還是員工自己要獨吞？這次之後絕對不再去消費了，而且如果你太晚去點太多每次都看到員工都是不爽的臉，如果不爽做就不要做。,"Before eating rice barbecue employees on Central Road, it was good. Now I have eaten more than 8,000 pieces with friends with friends for the first time in Yumin Road. I do n’t have a hospitality. I ’m going to eat 8000 today. Take a closer look at the bills. However, there was no entertainment. Moreover, when I entered the door, I asked the aunt who asked about the hospitality. Want your hospitality, but do you think you do n’t take it out to the guests, or do you want to swallow it yourself?After this time, I will never spend anymore, and if you go too late, you can see that the employees are uncomfortable every time. If you do n’t do it, do n’t do it.",False
"每次都是臨時想到才跑來吃
就算時間上有點晚 還是服務很好
小寶寶在肚子裡就來光顧
出生後還是帶著一起來吃🤣
招待限定 生蠔超讚👍","Every time I think temporarily, I come to eat
Even if the time is a bit late, the service is very good
The baby is here in his stomach
After birth, I still take it together 带 带 带 带 带
Enrollment limited oyster is superb 定",False
母親節活動送龍蝦😍😍 真是服務很好！餐點美味！火夠旺肉很好烤一下就酥！ 下次會再來,Mother's Day event is really good to send lobster 活动!Meal delicious!The fire is strong enough to grill and it will be crispy!Will come again next time,False
要不是女兒喜歡吃燒烤，也只有這家比較近，服務上覺得還可以，也來好幾次了。 前天晚上再次到店消費，吃完餐也付完費用，離開才發現怎沒有小姐說的會送冰棒？前幾次的消費都有～想想說算了也不是很愛吃冰，但還是要唸一下，當天坦白說沒有什麼客人，而且店員們也應該知道沒有給吧⋯⋯裝傻的服務態度實在不好，不誠實店家也不會再去了,"If it wasn't for the daughter who liked to eat barbecue, only this one was closer, the service thought it was okay, and it would have been here several times.The day before yesterday, I went to the store to consume again. I paid the fee after eating. I found that I did n’t find that the lady would send a popsicle?There are a few previous consumptions ~ If you think about it, you don't like to eat ice, but you still have to read it. On the day, he confessed that there were no guests, and the clerk should also know that it was not given to the silly service attitude. It's not good, the dishonest shop will not go again",False
"拌飯好吃，肉有分為自己烤及店員烤，可根據需求選擇對應的餐點。
生日當天會送龍蝦，下次想去試試","Bibimbap is delicious. The meat is divided into roasted and baked in the shopkeeper. You can choose the corresponding meal according to your needs.
I will send lobster on my birthday, and I want to try it next time",False
味道不錯的燒烤店，人很多，最好先訂位。用餐時間2小時。建議多點些自己烤，少點店家烤的，總覺得沒自己烤的好吃。食量大的可以點起司飯糰、炸物拼盤。肉品都不錯，蝦子也好吃。8月份來店禮是牡蠣和冰棒。生日送龍蝦，8／9去吃，跟女兒合照打卡再送一隻。冷氣超強。如果可以不要那麼吵就更好了。,"There are a lot of people who taste good, and there are many people. It is best to order first.Meals for 2 hours.It is recommended to bake more by yourself and bake less. I always feel that I have not grilled deliciously.If you eat a large amount of food, you can click the cheese rice ball and fried material.The meat is good, and the shrimp is also delicious.Come to the shop in August is oysters and popsicles.Give lobster on your birthday, eat 8/9, take a photo with your daughter and send another one.The air -conditioning is super strong.It would be better if you couldn't be so noisy.",False
"服務態度非常好！即便不會烤的服務生會幫忙
完全可以放100個心！
今日點夢幻牛五花 橫隔膜 牛肋條 豬五花
完全部踩雷！土城吃過第一名首選
（今日晚餐坐二樓 姐姐和男服務生
非常貼心細心）  回家完全無油煙味👍","The service attitude is very good!Even the waiter who can't bake will help
You can put 100 hearts at all!
Today, Dream Cow Penta Flower Cyntives, Cattle Ribs Pig Five Flower
Step on the thunder!Tucheng has eaten the first place for the first choice
(Sitting on the second floor of the second floor of this dinner today
Very thoughtful) Going home is completely without oil smoke 👍",False
"在海山站附近燒肉店，下班經過好多次都沒機會進去，店內氣氛不錯，這次有招待一碗蛤蠣湯，很鮮甜，而且服務人員都會先告知每道料理要怎麼烤，是海山附近難得的美食小館。

串燒
🔹鹿兒島和牛串(每日限量*3): 口感很滑順，咕溜慢慢在口中融化開
🔹明太子加分雞腿肉串*2: 肉質很軟嫩Q彈，有飽足感
🔹鮭魚起士烤飯糰
🔹蔬食有點了明太子山藥、櫛瓜和杏鮑菇等等，但有好幾次都差點被我們烤焦

燒肉
🔸骰子牛*2: 油花與肉質分布很均勻，後來吃不夠又加點XD
🔸松阪豬和豬五花也不錯，推~

#1210","At the roasted meat shop near Haishan Station, I did n’t have the opportunity to go in after work for many times. The atmosphere in the store was good. This time, I entertaining a bowl of oyster soup. A rare gourmet hall nearby.

Skewed
Kagoshima and Niu Chuan (Daily limited*3): The taste is smooth, and the grunt slowly melts in the mouth
鸡 鸡 🔹 🔹 🔹 🔹 🔹 🔹 🔹 🔹 🔹 🔹 🔹: The meat is very soft and tender, and has a full sense of satiety
饭 Salmon cheese roast rice ball
明 Vegetables are a little bit of Ming Prince Yam, Gourd and Pleurotus eryngii, etc., but there are several times that are almost burnt by us

Roast
2 Dice beef*2: The distribution of oil flowers and meat is very uniform, and then I do n’t eat enough and add some XD
猪 🔸 🔸 🔸 🔸 🔸 🔸 🔸 is also good, push ~

#1210",False
"11/14
男友生日，到此用餐～
壽星贈送龍蝦一隻👍🏻🙏🏻🦞

從前都在新店中正路的金炭火用餐，感覺兩間是一樣的啦～美味！

可惜裕民店沒有烤棉花糖，否則我會天天來光顧^ω^","11/14
Boyfriend's birthday, here for dinner ~
Shouxing gives away a lobster 👍🏻🙏🏻🦞

Golden Carbon Fire, who used to be in Zhongzheng Road in Xindian, felt the same as the same ~ delicious!

Unfortunately, Yumin store does not have roasted marshmallow, otherwise I will come to visit every day^ω^",False
"2大1小來用餐，可惜差一天就有送壽星龍蝦，不過仍然大推。
桌邊服務的是小廷帥哥，和小朋友互動也很棒🤜🤛好親切幫我們撥玉米筍（才知道原來玉米鬚可以吃），他推薦的品項加上我們自己點的餐點都好吃（除了烏龍冷麵不推薦）
整體來說用餐放鬆又愉快，以後一定還會來這個好地方。
在好店和好友享用好料理，又能得到好服務👍👍👍開心到顧吃顧聊天，照片也沒什麼拍到，真心享受當下享受那個氣氛。","2 big 1 and small came to eat, but unfortunately there is a long -term lobster for a day, but it is still pushed.
The table at the table is a handsome guy, and it is great to interact with the children. It is good to help us dial corn bamboo shoots (only to know that the original corn must be eaten). (Except for the cold noodles of Oolong), it is not recommended)
On the whole, the meal is loose and happy, and I will definitely come to this good place in the future.
Enjoy good dishes in good shops and friends, and get good service. I am happy to chat and chat, and there is nothing to take pictures. I really enjoy the atmosphere of the moment.",False
"兩人用餐座吧台
招待湯品不錯，服務尚可
當天吃完第一輪餐點，加點了個冷麵
前面製作過程都還好在最後冷卻時放入一個混濁的冰水水裡面（冷食專用）

觀感跟衛生感覺不是很好，畢竟座在吧檯清楚可見冷卻水混濁 餐點再送到面前食入😌
有特別解說冷實專用 這點尚可加強","Both of them dining bar
The entertainment soup is good, the service is acceptable
After eating the first round of meals on the same day, I added a cold noodle
Fortunately, when the production process is finally cooled, put it in a turbid ice water (special cold food) when it is cold (cold food)

Observation and sanitation are not very good. After all, the seats are clearly seen in the bar.
Special commentary can be strengthened",False
品嚐過很多間米碳 最喜歡這間❤️❤️ 不管是服務品質 用餐氣氛 還是餐點內容 都是超乎預期的棒 今天因為離峰 所以幾乎所有餐點 都是服務人員代烤 真幸運～～ (⚠️尖峰時間不能這樣要求喔⚠️) 謝謝小廷的鹽之畫 也謝謝今天現場的各位服務人員,"I have tasted a lot of rice carbon. I like this ❤️❤️ Whether it is service quality, dining atmosphere or meals, which are beyond expectations, today because of leaving the peak, almost all the meals are baked on behalf of the service staff. (⚠️ ⚠️ The peak time cannot be required like this ⚠️) Thank you for the painting of Xiaoting's salt. Thank you for the service staff at the scene today.",False
服務人員超級親切好聊、東西好吃、價格實在,"The service staff is super kind and good, the things are delicious, the price is real, the price is real",False
這不是我第一次吃米，很早期在新莊店就吃過，當時印象就還不錯，此次就地緣之便，來到這家分店，基本自己烤的品項我們都跳過，怕手殘，但因為服務人員一直說會幫烤，不要擔心自己烤會搞砸而點了五花牛，還真是好吃，其他他們烤出來的串燒、魚或是送的蛤蜊湯都很好吃，不過我不推薦點生食，理論上吃東西要先吃生再吃熟食最後，而他們生食上的時間居然比烤物來得久，一回家就肚子不舒服把吃的東西都快速排光了，炸物的部分太乾，我們也沒吃完，所以我推薦大家要為烤物而來，他們烤功還是很厲害，那幫烤這件事，人一多你還是最好自立自強，就別學我嘴饞吃生食。（還有一盤冰凍忘了是透抽？花枝？總之沒拍到）,"This is not the first time I have eaten rice. I have eaten it in Xinzhuang store early. At that time, the impression was pretty good. This time, the stool of the local fate, came to this branch, we all skipped it. Disabled, but because the service staff has always said that he will help bake, don't worry about baking you will messed up and order Wuhua cow, it is really delicious. Other baked skewers, fish or clams soup sent by them are delicious. , But I do n’t recommend raw food. In theory, eat food first and then eat cooked food. The last time they have eaten raw food is longer than the roasted objects. When they go home, they are uncomfortable. The part of the fried object is too dry, and we haven't finished eating it, so I recommend everyone to come for baked objects. They are still very powerful. If you bake this matter, you still have to stand up and strengthen. Don't learn my mouth to eat raw food.(There is still a plate of frozen forgotten?",False
餐點品質不錯。服務態度好。可能週末假日忙碌，少了點熱情，剛好遇到新手女服務人員，都要多問幾次才能明確知道為什麼。整體來說還不錯！可以再來訪。雖然價格略高。,"The quality of the meal is good.Good service attitude.Maybe we are busy on the weekend holiday, and have a little enthusiasm. Just when you meet novice female service staff, you have to ask a few more times to clearly know why.Overall is not bad!You can visit again.Although the price is slightly higher.",False
"介紹很詳細 上餐速度也很快
店員不太忙的時候 還幫忙烤肉
親切到我以為在自己家吃飯😜😜
果然是土城第一名燒肉
還畫了個彌豆子 太扯要多會畫
期待下次再訪！","Introduction is very detailed to the meal speed and fast
When the clerk is not too busy, help barbecue
Careful that I think I eat at my own home 😜😜
Sure enough, it is the first place in Tucheng
I also painted a Mi Dou too much, I need to draw more
Looking forward to the next visit!",False
"服務一級棒 備料環境公開透明 非常乾淨也很講究
已回訪多次！價格合理
假日要先預約
每次來都會有招待","Serving the first -level stick preparation environment is open, transparent, very clean, and very particular
Has returned many times!Reasonable price
Reservations for holidays first
Every time you come, there will be entertainment",False
之前其他分店就去過了，這次來到土城裕民店，所有的感覺依舊一樣美好，餐點好吃，服務人員迅速，適合聚餐喝點小酒的好地方！,"I have been there before. This time I came to the Yumin store of Tucheng, all the feelings are still as good as, the meals are delicious, the service staff is fast, and it is suitable for a good place to drink a small wine!",False
"好吃。雖然單價有點偏貴。
但是有「姐姐」的熱情服務。值得❤️！","tasty.Although the unit price is a bit expensive.
But with the enthusiastic service of ""sister"".It's worth ❤D!",False
