Original,EN,Needs Review
"一次糟糕的用餐經驗，原本開心用餐，結果大家吃的很火大……
1.需自行燒烤類食物，並非點完後一次上齊，多數時烤爐呈現沒東西烤的狀態，待要烤時火炭已經燒了差不多，肉烤了很久還沒好，直到後面加炭火後才很快烤熟
2.串燒類食物通常要等一個小時左右，除非一次點餐完畢，否則用餐時間2小時基本是吃不飽的。
3.點餐時直接漏點一張，建議點菜明細可以放一份在客人桌上，可以讓客人馬上確認下單餐點是否有誤或遺漏的
4.員工服務態度良好，但工作sop真的要檢討一下，下單到上菜時間不該等太久……

結論：餐點好吃，但上菜速度慢、還會送錯餐點，第一次吃飯吃到需認真對帳單……另外還遺漏餐點，待發現時又要等一小時才能上菜，後續只好直接取消餐點，致我們吃了三個小時沒吃飽……。餐廳對此無任何表示，原本覺得評論不錯，想說來吃看看，結果真的感到失望，應該不會再吃第二次了","A bad dining experience, originally happy to eat, as a result, everyone ate very much ...
1. You need to barbecue food by yourself. It is not all the time after ordering. Most of the time, the oven shows that there is nothing to grilled. When it is baked, the fire charcoal has been burned. Soon quickly
2. Bringing foods usually have to wait about an hour. Unless one meal is completed, the meal time is basically unattainable for 2 hours.
3. Direct a point when ordering. It is recommended to order a detail on the guest table, so that the guests can immediately confirm whether the ordering point is wrong or omitted.
4. The employee service attitude is good, but the SOP of the work really has to review it. The time to place the order is not too long ...

Conclusion: The meal is delicious, but the food is slow, and the wrong meal will be delivered. The first time I eat, I need to take the bill carefully ... In addition, I miss the meal. It will take an hour to serve when I find it. , I had to cancel the meal directly, causing us to eat it for three hours and not to eat ...The restaurant has nothing to say about this. Originally, I felt that the comment was good, I wanted to say it, but I was really disappointed. I should not eat it for the second time again",False
小孩慶生，大人小孩都吃得很開心，壽星還送龍蝦喔！,"Children celebrate their birthday, adults and children eat very happy, Shouxing also gives lobster!",False
小廷很帥人很好，服務很周到！,Xiaoting is very handsome and good -looking!,False
小廷及其他服務人員都很讚！貼心還借iphone線👍👍東西也新鮮好吃😋,Xiaoting and other service staff are very good!I also use the iphone line 👍👍 贴 贴 贴 贴 贴 😋 😋 😋,False
"服務超好，東西好吃到頂了！
說認真，美術真的是職業的","The service is super good, the things are so delicious!
Speaking of it seriously, art is really professional",False
食物好吃  服務也👍👍,Food delicious service is also 服务,False
來訪多次，東西好吃服務不錯👍,"Visit many times, good things are delicious, good service 👍",False
"猜想 應該是店長或老闆
很nice~
初次 到店嚐鮮 用餐過程很愉快❤️
有機會會再回訪！","Guess it should be the manager or boss
Very nice ~
The first time I arrived in the store for fresh food, the meal process was very happy ❤️
If you have a chance, you will return to visit again!",False
"肉質好、味道美味！
服務人員耐心講解～
值得一來再來","Good meat and delicious taste!
Service staff patiently explained ~
It's worth a comeback",False
"CP值偏低，份量少食材也沒到那價位，真的是偏貴。上菜速度太慢了…
蠻多細節都需要加強。","The CP value is low, and the amount of ingredients is not at the price, which is really expensive.The speed of serving is too slow ...
Many details need to be strengthened.",False
"超級美味🥰🥰
會想一直回訪的燒肉店
小凱、小廷的服務超貼心 考功一流 讚讚
蔥花牛舌好吃😋","Super delicious
I will want to go back to the roast meat shop
Xiaokai and Xiaoting's service super intimate test first -class praise
Onion beef tongue is delicious 舌",False
最棒的用餐體驗，每次跟女友都吃得非常開心😆 …,"The best dining experience, every time I eat with my girlfriend very happy ...",False
"醃漬蕃茄蘿蔔
自已烤或點熟食…都很好吃
碳烤🦐⋯好吃
服務人員很親切
環境很棒","Pickled tomato carrot
I have grilled or cooked food ... it's all delicious
Carbon roasted 🦐 🦐 delicious
The service staff is very kind
Great environment",False
等了47分鐘，餐點只上兩個飯糰跟兩杯啤酒，果斷離席吃別家，聚會有更好的選擇。,"After waiting for 47 minutes, the meal was only two rice balls and two cups of beer.",False
菜單好吃烤飯糰必點，服務生超可愛,"The menu is delicious, and the waiter is super cute",False
"餐點跟肉都很好吃👍👍
加上店員畫的卡比之星
怎麼可以不給五顆星","The meals and meat are delicious
Plus the stars of Kabi by the clerk
How can I not give five stars",False
東西好吃😋服務好‼️推薦大家,Extra is delicious 好 service 😋 good 😋️ Recommend everyone,False
"肉好好吃🤤，服務到位會主動更換烤網👍🏻，有一二樓，建議要先訂位！

🔔父親節活動，評五星送龍蝦喔！","The meat is delicious, and the service will actively replace the grill in place. There are one or two floors. It is recommended to book a place first!

评 Father's Day event, comment on five -star lobster!",False
"氣氛好，很適合朋友聚會
店家送生蠔很好吃！！！非常新鮮～
生日當天送龍蝦～～～
店家服務很好👍","The atmosphere is good, very suitable for friends gatherings
The shop is delicious to send oysters!IntersectionIntersectionVery fresh ~
Give lobster on your birthday ~~~
The store service is very good 好",False
"寵物友善👍🏻當天生日會招待龍蝦🦞骰子牛,牛舌厚嫩新鮮,牛肉類很推薦～店家還會招待生蠔🦪跟冰棒,冰棒最後吃很解膩小確幸,推薦","Pet friendly 生 On the day of the birthday, the lobster dice is entertained, the beef tongue is thick and fresh, the beef is very recommended ~ the store will also entertain oyster 🦪 and popsicles.",False
很好吃、服務好、酒也好喝,"Very delicious, good service, delicious wine",False
座位寬敞，店內很明亮，不太會有油煙味，肉品很新鮮很棒！,"The seats are spacious, the shop is very bright, there is no smell of oil fume, and the meat is very fresh and great!",False
CP值蠻低，懶得自己烤～點店家烤物，結果每盤都很焦！食材和品質跟不上價格….,"The CP value is quite low, too lazy to bake it yourself ~ order the shopkeeper to bake, but each set is very burnt!Ingredients and quality cannot keep up with the price ...",False
"感謝帥氣的小吳，教我們烤麻糬～
食物美味，服務態度佳，值得再來一次！","Thanks to the handsome Xiao Wu, teach us to bake tatto ~
The food is delicious, the service attitude is good, it is worth it!",False
餐點好吃氣氛佳 👍👍👍,The delicious atmosphere of the meal is good 吃,False
"好吃😋服務好，氣氛不錯👍
來吃好幾次了😊","It's delicious, the atmosphere is good, the atmosphere is good 👍
Come and eat several times 次 次 次 次 次 次",False
"店長小廷服務一極棒
店內裝潢非常的舒服
用餐環境非常的優質環境
土城最佳的燒烤餐廳","The store manager Xiaoting's service is great
The interior decoration is very comfortable
The dining environment is very high -quality environment
The best barbecue restaurant in Tucheng",False
"真的不爽可以不要上班
連最後詢問都沒有詢問還要不要吃
就直接把爐收走？","Really upset, don’t go to work
I didn’t even ask the last question or not to eat it
Just take the furnace away?",False
母親節活動送龍蝦,Mother's Day event to send lobster,False
"好吃的小廷，親切的五花肉。
值得…再來二刷三刷～","The delicious little court, kind pork belly.
It's worth ... to brush again and three brushes ~",False
送來的生菜破破爛爛超級敷衍，要包肉都困難，沒幾片,"The free lettuce is so bad perfunctory, it is difficult to pack meat, there are a few pieces",False
好吃 品質好 服務親切,Delicious quality and good service kind,False
餐點美味好吃又新鮮，服務親切。時不時關心顧客用餐狀況。值得再訪。,"The meal is delicious and fresh, and the service is kind.From time to time, we care about customer dining status.It is worth visiting again.",False
"好吃😋精緻😁美味
服務周到
又不熱 超級美好體驗 …","Delicious 😁 delicate 😁 delicious
Thoughtful
It's not hot and super beautiful ...",False
有最愛的戰斧豬排，大腸頭一定要的！,"With the favorite Tomahawk pork chop, the large intestine must be!",False
"說真的
今天來消費
服務超好
尤其是今天的女服務生很漂亮","Be true
Come to consume today
The service is super good
Especially today's female waiter is very beautiful",False
好吃得沒話說，想要吃一下燒肉的好去處，三五好友相約，解口腹之慾,"It's so delicious, I want to eat a good place to eat roast meat, three or five friends meet, and to relieve the desire of the abdomen.",False
"小廷的服務真的頂天了
烤肉很專業  人很有禮貌又幽默","Xiaoting's service is really topped
Bakers are very professional, polite and humorous",False
天呀，真的太驚艷了！食物新鮮美味，服務即時熱情，整個媲美飛一趟日本！不出國的第一選擇！👍🏻,"Oh my god, it's really amazing!The food is fresh and delicious, the service is instant enthusiastic, and the whole is comparable to Japan!The first choice of not going abroad!Bleak",False
非常不錯、會常來,"Very good, will come often",False
店員親切，餐點水準高，隨便點都好吃，沒有雷～,"The clerk is kind, the meals are high, and the order is delicious, there is no thunder ~",False
肉質鮮嫩超好吃，小廷服務一流又幽默,"The meat is tender and delicious, and the small court service is first -class and humorous",False
CP值超高 ～還準備了驚喜～這家必回訪！,The CP value is super high ~ I also prepared a surprise ~ This must be visited!,False
裕民商圈唯一一間燒烤店，食材肉品品質佳，服務好，好吃,"The only barbecue restaurant in the Yumin business district, good ingredients and meat quality, good service, delicious",False
只能說這間店真的很頂 吃過很多次了,I can only say that this shop has really eaten many times,False
點的東西都好吃😋吧台區很歡樂，服務人員都很nice,"The things that are delicious are delicious. The bar area is very happy, and the service staff are very nice",False
很難訂的餐廳，終於在父親節可以訂位用餐，讚！,"The restaurant that is difficult to order, finally can order dining on Father's Day, praise!",False
餐點品質很棒 服務到位,The quality of the meal is great service in place,False
以前還在中央路時就常吃了，現在換地方後更猛了,"I used to eat it when I was still on the Central Road before, but now it is even fiercer after changing the place.",False
"服務生很親切
會主動烤肉給我們吃
食材品質新鮮好吃😋","The waiter is very kind
Will take the initiative to eat it for us
Fresh and delicious ingredients 新",False
nice place !二訪,Nice Place! Second visit,False
燒肉豪好吃😋,The roasted meat is delicious,False
"超級好吃，服務也棒
尤其是小廷烤的雞腿串超～～好～～吃，又貼心。最後一道一定要點烤年糕，完美的ending 🥰🥰🥰","Super delicious, the service is also great
Especially the chicken legs grilled by Xiaoting are super ~~ Okay ~~ Eat, and intimate.The last one must order the grilled rice cake, the perfect ending 🥰🥰🥰",False
食材新鮮～聚會的好選擇。,Fresh ingredients ~ good choices for party.,False
東西好吃～服務很好～尤其小吳超nice 🥳🥳🥳🥳,The things are delicious ~ the service is very good ~ especially Xiao Wu Chao Nice 🥳🥳🥳🥳 🥳🥳🥳🥳,False
服務人員小廷很親切，食物也很棒，讚讚😀,"The service staff Xiaoting is very kind and the food is also great, praise 😀",False
土城難得有間好吃的烤肉，服務也很好👍,"Tucheng has a rare delicious barbecue, and the service is also very good.",False
離家近，價位優是讓我想來吃的餐酒館,"Near home, the price is the restaurant that makes me want to eat",False
用餐空間寬敞舒適，服務員熱情，餐點多樣化選擇～,"The dining space is spacious and comfortable, the waiter is enthusiastic, and the meal is diverse.",False
母親節活動快樂,Happy Mother's Day activities,False
肉類的品質挺不錯的，醬的調味也很好，但在烏龍麵上加一堆油蔥就有點怪怪的。價位雖然比較高，但服務和食物都有達到這個品質，所以整體是頗滿意的,"The quality of the meat is pretty good, and the flavor of the sauce is also very good, but it is a bit strange to add a bunch of shallots to the oolong noodles.Although the price is relatively high, the service and food have reached this quality, so the overall is quite satisfactory.",False
食材氣氛很不錯👍,The atmosphere of the ingredients is very good 氛,False
"初訪

有打電話預約，有詢問不能提早到，但到現場還有很多空位，感覺座位安排好像有點問題！？

來之前有先查一下推薦項目，
酥炸澎湖小卷：很酥但有點炸過頭，吃起來很韌，感覺沒有到推薦

帶骨牛小排：店員會幫忙烤，筋沒有烤脆

松阪豬：正常表現，可以點

厚切豬五花：沒什麼瘦肉，都是肥油，感覺很吃運氣

戀上牛舌（薄牛舌）：可以點，加蔥鹽好吃

白飯：品質不差的白飯

飯後會有免費的冰棒，小時候福利社會賣的那種要把頭咬掉的兩截冰棒，很童趣。","Initial visit

Some call appointments, some inquiries can not arrive early, but there are still many vacancy at the scene. I feel that the seat arrangement seems to have a problem!Intersection

Check the recommendation project before you come,
Crispy Penghu small roll: very crispy but a bit overwhelmed, it tastes tough, it feels not recommended

With bone cattle small steak: the clerk will help bake, the muscles are not crispy

Matsusaka: Normal performance, you can order

Thick -cut pigs: There are no lean meat, they are fat oil, I feel very lucky

Fall in love with beef tongue (thin beef tongue): you can order, add onion salt to delicious

Rice: Bai rice with no bad quality

There will be free popsicles after a meal. The two swarms that should be bitten off when they were sold when they were young, which was very childlike.",False
貴！完全吃不到什麼！結帳1450元，因為太貴，整個點不下去，也沒有服務要收什麼服務費？！整個就是在敲盤子！吃到有飽足感ㄧ個人可能要破3000，歡迎體驗,"expensive!I can't eat anything at all!At 1450 yuan, because it is too expensive, the whole point can't continue, and there is no service service fee to charge?IntersectionThe whole is knocking on the plate!Eat a sense of fullness ㄧ Personal person may break 3000, welcome to experience",False
"初訪令人驚艷 食材品質對得起價位
調味料都很簡單 能吃到食材最本身的味道
很開心生日能在這過 會再來訪
嫌調味料少東西太貴的不要來 去吃路邊攤碳烤就好 請把位子留給其他想來的人
外場有個戴眼鏡短頭髮的帥哥很細心 互動也很幽默
建議坐公車或是搭Uber來 這附近真的很難停車","The first visit is stunning ingredients and the quality is worth the price
The seasonings are very simple to eat the most taste of ingredients
Very happy birthday to be able to visit here again
Do n’t come and go to the roadside stalls for carbon baking, please leave the seat to the people you want to come.
There is a handsome guy who wears glasses with short hair in the field very carefully and humorous
It is recommended to take a bus or Uber, it is really difficult to stop here",False
"第一次來，肉好吃～

服務好，環境好，👍🏻👍🏻","For the first time, the meat is delicious ~

Good service, good environment, 好",False
"整體蠻失望，
店員們很像無頭蒼蠅，一件事都要提醒多次
叫蔥蔥不來，叫炭炭不來，
餐點也普通，
服務費10%，低消398，
當日消費人均破千，卻吃了寂寞😕","The overall disappointment,
The clerk is very similar to headless flies, and one thing must be reminded many times
It is called lush lush, it is called charcoal, it will not come,
The meal is also ordinary,
The service fee is 10%, the low consumption is 398,
The per capita consumption of the day broke through a thousand, but I ate lonely 😕 😕 😕 😕",False
剛剛接電話人員態度是在差幾點 🙄 …,The attitude of the person who just answered the phone was a few points ...,False
"和牛竟然是先灑滿鹽才烤，重點是真的是灑滿……吃起來有夠鹹，完全不知道在吃什麼
當日壽星送的龍蝦是烤好送上來的，感覺已經烤過頭了，師傅的功力有待加強！","He Niu turned out to be sprinkled with salt before baking. The point is really full ... It tastes salty enough, but I don’t know what to eat.
The lobster sent by Shouxing on the day was baked and sent up. It felt that it had been baked. The master's skills needed to be strengthened!",False
今天招待的蛤蠣湯已經秒吃完👍,The oyster soup enrolled today has been eaten in seconds 👍,False
⬆️食材新鮮氣氛佳，值得聚餐,"氛️ The fresh atmosphere of the ingredients is good, it is worthy of dinner",False
"父親節送龍蝦！
情人節送松阪豬！","Father's Day to send lobster!
Valentine's Day Give Satakusa pigs!",False
單點的雞肉串每串都燒焦味很重，烤功可能要再加強一點，但服務很棒.,"Each skewers of a single -point chicken burn the scorching taste is very heavy, and the grilled work may be strengthened, but the service is great.",False
"環境乾淨而且服務人員親切可愛！
重點是東西超級好吃！
現在父親節活動評分留言送小龍蝦🦞
吃起來！👍🏻👍🏻👍🏻","The environment is clean and the service staff is kind and cute!
The point is that things are super delicious!
Now Father's Day Event Rating Message Message Send Cangels 🦞
It tastes!Bleak",False
回訪多次～食材很新鮮！服務人員態度也很讚～大推！,Visits many times ~ The ingredients are fresh!The attitude of the service staff is also very good ~ Push!,False
經過很多次 今天來吃 讚讚 從訂位到桌邊服務的都很棒🥸👍 …,"After many times, I have come to Zanzan today to serve from the booking to the table.",False
"五花肉配燒啤就是真理啦😍
除了豬五花我也愛死帶骨牛小排跟戰斧豬排🥹
隨便點都好吃的店 還蒜頭鹽蔥無限續 愛了
推推土城人🩷","Pork belly with burning beer is the truth 😍 😍 😍 😍 😍 😍
In addition to pigs, I also love to die with bone cattle and Tomahawk pork chop 🥹
The shops that are delicious and delicious are still garlic salt and shallots continued to love
Push Tucheng",False
不只有炭火燒烤，想要吃點店家烤好的烤串也吃的到，而且店家服務的態度也很好，很適合跟朋友一起來,"Not only the charcoal barbecue, but also to eat some shops to bake skewers, and the attitude of the store service is also very good. It is very suitable for friends with friends.",False
七夕來吃燒肉啦！,Come to eat roast meat on Qixi Festival!,False
店長小廷服務優，專業，讚！,"The manager Xiaoting is good at service, professional, praise!",False
"工作人員提供了友善而熱忱的服務。

他們還給我們每人一根冰棒。","The staff provides friendly and enthusiastic services.

They also gave us a popsicle.",False
感謝你們為我妻子的生日提供的優質服務和食物，也感謝你們免費提供的生日龍蝦。感謝約翰尼讓我們的夜晚變得特別！ *****,"Thank you for the high -quality services and food for my wife's birthday, and thank you for free birthday lobster.Thanks to Johnny for making our night special!*****",False
好好吃😍,Be so delicious 😍,False
非常好吃😋～～ …,Very delicious ～ ~~ ...,False
好吃😋,Delicious,False
超好吃～推,Super delicious ~ push,False
好吃,tasty,False
"依帆她烤的肉串超好吃
有用心喔","Yi Fan's roasted meat skewers are so delicious
Oh",False
好吃😋美女多😎,It's delicious 😎 😎 😋 😋 😋 😋 😋 😋 😋,False
很好吃,Delicious,False
好吃,tasty,False
好吃，Cp值超高,"It's delicious, the CP value is super high",False
很愉快的用餐,Very happy meal,False
好吃呦隔壁98也好喝！,It's delicious next door 98!,False
好吃,tasty,False
好吃,tasty,False
好吃,tasty,False
小丁的烤麻糬超好吃 👍 …,Xiaoding's grilled hemp is so delicious ...,False
好吃,tasty,False
肉類超好吃～～,The meat is super delicious ~~,False
清酒很好喝,Sake is delicious,False
好吃好吃😋！,It's delicious and delicious!,False
"爽啦
好吃","Cool
tasty",False
好吃👍,Delicious,False
好吃😋,Delicious,False
吃很多次了 好吃👍,I have eaten many times delicious 了 好 好 好 好,False
很好吃,Delicious,False
好吃好吃 真好吃,"It's delicious and delicious, it's delicious",False
好吃,tasty,False
好吃😋 …,Delicious 😋 ...,False
好吃,tasty,False
好吃,tasty,False
好吃,tasty,False
好吃,tasty,False
好吃,tasty,False
好吃～,Delicate ~,False
好吃,tasty,False
好吃,tasty,False
CP值高😋,CP value high 值 值,False
好吃,tasty,False
好吃 推推🫶🏻,Delicious push 🫶🏻 🫶🏻 🫶🏻 🫶🏻,False
好吃,tasty,False
好吃,tasty,False
很棒！,great!,False
超高cp值,Ultra -high CP value,False
好吃,tasty,False
很好吃😋,Very delicious 😋,False
非常好吃,Very delicious,False
非常好吃😋 …,Very delicious ...,False
好吃美味,Delicious and delicious,False
非常好吃,Very delicious,False
小廷好棒,Xiaoting is great,False
好吃,tasty,False
好吃,tasty,False
推推！,Push!,False
好吃好吃😋,It's delicious and delicious 😋,False
好好吃😋～～～ …,Be so delicious ～ ~~~ ...,False
好吃,tasty,False
好吃,tasty,False
好吃好玩,Delicious and fun,False
好吃😋 …,Delicious 😋 ...,False
好吃好吃,Delicious and delicious,False
Cp值高,High CP value,False
好好吃😋,Be so delicious 😋,False
好吃！,tasty!,False
好吃😋,Delicious,False
好吃好吃好吃吃～,"It's delicious, delicious, delicious and delicious ~",False
打卡送肉肉🤩🤩 …,Pickup and send meat 肉 ...,False
味道很好！,The taste is very good!,False
食材可口,Ingredients,False
棒,Great,False
超棒！,Bet!,False
超棒🎉🎉🎉,Superb 🎉🎉🎉,False
可口的,Delicious,False
吃肉啦,Eat meat,False
好吃,tasty,False
