Original,EN,Needs Review
小白調酒🍸好喝🈶水準👍食物炸物好吃好ㄕㄨㄚˋ嘴☺️((店家超棒～🉑方便自行點外送來吃😋超好❤️,Xiaobaijun 🍸 准 准 准 👍 👍 👍 Food fried foods are delicious and naked ☺ ️ ((store superb ~ 🉑 🉑 convenience to give it to eat 😋 super good ❤️,False
感謝小白的特製百香果茶酒，喝起來非常驚豔，不知不覺就喝完了，介紹菜單也很詳細能夠分析自己喜歡的口感做搭配，推推,"Thanks to Xiaobai's special Passion fruit tea wine, it is very amazing to drink.",False
環境很棒，12點前禁菸，很開心週末前可以來這麼溫馨的小酒館放鬆一下,"The environment is great, smoking before 12 o'clock, very happy to come to such a warm tavern to relax before 12 o'clock on the weekend.",False
"人很多熱鬧
偶爾聽不到朋友講話 😂😂😂

但老闆nice，朋友點了一杯沒有在酒單上的，也貼心準備，非常感謝～～","Many people are lively
Occasionally I can't hear a friend's speech 不

But the boss nice, my friend ordered a cup and not on the wine list, and was kind to prepare, thank you very much ~~",False
調酒杯與酒名滿符合，氣氛適合工作後放鬆之處,"The wine adjustment glass is full of wine, and the atmosphere is suitable for relaxation after work",False
"店裡氛圍很舒服，水煙、啤酒、調酒一應俱全，餐酒館就是在找尋這令人感動的幸福溫度！飯後娛樂還能玩射飛鏢呢！🥰

厲害的是店內還備有隱藏版特調，例如工作遇到瓶頸、厭世時的上班族可以來一杯「隱藏版特調」轉換心情，調酒師宛如拿出美麗魔法棒，隨手一變就能調製一杯客製化的特調囉~🥳🥳🥳

任何心情都能跟著特調一起提升，只要和調酒師聊聊當天心情，即可品嚐專屬的特調喲！😃
近年酒吧文化日益盛行，夜晚如果想尋覓美酒的話，非常推薦大家來這裡瞧瞧！👍👍👍","The atmosphere in the store is very comfortable. Water smoke, beer, and bartending are all available. The dining tavern is looking for this touching happy temperature!After dinner, you can play darts!Bleak

The amazing thing is that there are hidden editions in the store. For example, when you encounter a bottleneck at work, office workers who are tired of the world can come to a cup of ""hidden version"" to change mood. Make a cup of customer -based special adjustment ~ 🥳🥳🥳

Any mood can be improved with the special adjustment, as long as you talk to the bartender, you can taste the exclusive special specialty!Bleak
In recent years, the bar culture has become increasingly popular. If you want to find wine at night, it is recommended that everyone come here to see it!Bleak",False
"沒想到土城也有水煙館
位在海山捷運站附近
老闆人好
用line上先預約
還幫我提早開店 太佛
中間老闆還特別招待一盤飲品
當月壽星還有炸物三合一
這樣的佛店家
哪裡來呢 推薦啦","I didn't expect Tucheng to have water cigarette halls
Located near Haishan MRT Station
Good boss
Appointment with LINE first
Also help me open a shop early
The middle boss also entertains a plate of drinks
There was a three -in -one in the month of Shouxing and Fried Wire
Such Buddhist shopkeeper
Where are you recommended?",False
"服務很好,東西好吃，想放鬆可以來這裡chill一下！","The service is very good, the things are delicious, you can come here to Chill if you want to relax!",False
調酒CP值非常高，特調300、經典250，酒杯很可愛很華麗，跟酒名搭配，很適合拍照，店員很親切，店內氣氛放鬆，有飛鏢機，還有水煙，冰草莓口味涼又香,"The CP value of the bartender is very high, special adjustment 300, classic 250, wine glass is very cute and gorgeous, with the name of the wine, it is very suitable for taking pictures. The clerk is very kind. The atmosphere in the store is relaxed. fragrant",False
老闆熱心介紹菜單，調酒讚讚，價錢跟環境都很棒～,"The boss enthusiastically introduces the menu, bartender and praise, the price and environment are great ~",False
酒好喝、餐點好吃😋 燈光美氣氛佳👍推推！,The wine is delicious and the meals are delicious.,False
"酒好喝💪🏻
好喝就是讚🥰🥰","Drinking good 💪🏻
It's like a good taste",False
"算是蠻適合拍拍照片的酒吧～
不算非常的網美但是也算有質感的🥰

而且員工人真的很Nice還會一起玩！
（教我們玩遊戲呀！什麼之類的）

我去過蠻多酒吧的～
也知道自己喜歡會互動的酒吧☺️
所以這是一家我以後一定會再光顧的店👍

裡面有一款啤酒我之前都只有看從來沒喝過
一喝不得了！真的好喝
很順而且尾韻有一股香味（喜歡💕）

有射飛鏢的朋友記得帶上自己的工具🧰
如果有開車的話對面也有一天$100上限的停車場喔
（記得～開車不喝酒，喝酒不開車）
店裡面也有販售1杯$50的無酒精飲料🥤
當個快樂的小司機吧🤪😂","It is quite suitable for the bar that is suitable for taking photos ~
It is not a very beautiful, but it is also considered a texture 🥰

And employees are really nice and they will play together!
(Teach us to play games! What or so on)

I have been to a lot of bars ~
I also know that I like interactive bars ☺️
So this is a shop I will definitely patronize in the future.

There is a beer in it.
Can't drink it!Really delicious
Very smooth and the tail rhyme has a fragrance (like 💕)

Friends who shoot darts remember to bring their own tools 🧰
If there is a driving, there is a parking lot on the opposite side of $ 100.
(Remember ~ Drive without drinking, drink without driving)
There are also 1 cups of alcoholic drinks that are sold in the store 🥤
Be a happy little driver.",False
親切地被招待跟介紹酒品，會想要再來的酒吧！因為想要嘗試茶酒，所以也有被精心特調，非常棒，值得來喝酒跟小聚！,"Certainful hospitality and introduction of wine, you will want to come again!Because I want to try tea wine, I have been carefully tuned, great, and it is worth drinking and gathering!",False
氛圍好，有造型特別的酒具，還有娣娣一起玩很有趣😂,"The atmosphere is good, there are special wine utensils, and it is fun to play together.",False
"酒好喝，又有飛鏢
店員妹妹還很可愛
不來嗎？","The wine is delicious, and there are darts again
The clerk sister is still very cute
Don't come?",False
氣氛好讚！莓荔佳人大推😍😍😍  炸物份量好大方！推薦朋朋可以來慶生開趴🤩,The atmosphere is so much!Berry Lineli is so generous!Recommended friends can come to celebrate the birthday,False
服務好，酒也好，氣氛也很棒,"Good service, good wine, and great atmosphere",False
Cp值高～服務人員親切又專業,CP value is high ~ service staff is kind and professional,False
服務很好，小姊姊很會聊🥰,"The service is very good, the little sister can talk about it",False
土城攝取酒精的好選擇，店內環境乾淨，價格合理，店員也會幫客人介紹適合的酒品，適合初心者來，推推。,"Tucheng's good choice for alcohol, the environment in the store is clean and the price is reasonable. The clerk will also help the guests to introduce the suitable wine, which is suitable for the original intention to push.",False
"氣氛佳、酒好喝、店內環境優、店員熱情
是個放鬆的好地方～","Good atmosphere, good wine, excellent environment in the store, enthusiasm for the clerk
It's a good place ~",False
氣氛好 酒很好喝,The atmosphere is delicious,False
"酒都不錯喝
容器都很可愛很特別
適合拍照
交通位置也算方便
適合三五好友來喝酒聊天
還有飛鏢機可以玩","Drink well
The container is very cute and special
Suitable for taking pictures
The transportation location is also convenient
Suitable for three or five friends to drink and chat
There is also a dart machine to play",False
特調超美❤️～ 調酒師可以依客人喜好，實現客製化，超棒的👍🏻 是一家會再回顧的店家，適合三五好友聚會，而且不定期都會推出新活動，下次見唷🤤,"Special super beautiful ❤️ ~ The bartender can be customized according to the preferences of the guests. The superb is a shop that can review again, suitable for three or five friends gatherings, and new activities will be launched from time to time. Bleak",False
酒水好喝，服務姐姐人也很親切，環境舒適，非常推薦土城人來嘗試看看✌🏻✌🏻✌🏻✌🏻,"The drink is delicious, the service sister is also very kind, and the environment is comfortable. It is recommended that Tucheng people come to try to see ✌🏻✌🏻✌🏻✌🏻",False
下班小酌好去處❤️‍🔥,Set up get off work at work ❤️ 下,False
燈光美氣氛佳 老闆服務態度100分❤️下次還會再來,"Lighting Beautiful atmosphere, Boss Boss Service attitude 100 points ❤️ Will you come again next time",False
"酒很好喝，適合一個放鬆的好去處
重點還有年輕咩咩陪伴😍😍😍 …","The wine is delicious, suitable for a good place to relax
The focus is also young 伴 伴 😍😍😍 😍😍😍 😍😍😍 ...",False
"酒好喝
炸物好吃
店內氣氛很好很適合朋友一起來吃吃喝喝","Wine
Fry
The atmosphere in the store is very good, very suitable for friends to eat and drink together",False
"謝謝招待❤️❤️
調酒師人超好 可以客製❤️","Thank you for your hospitality ❤️️ ️
The bartender is super good and can customize ❤️",False
"蝦球跟5合一拼盤很好吃
裡面的姊姊❤️也很好聊天❤️都超級親近❤️","Shrimp ball and 5 -in -one platter are delicious
Sisters in it ❤️ are also very good to chat ❤️ are super close to ❤️",False
餐廳質感超棒，餐點也很好吃～找不到缺點了🥰 …,"The restaurant's texture is great, and the meals are delicious ~ I can’t find the disadvantages ...",False
很讚的地方，老闆親切，調酒好喝，還有水煙。價格平價，土城意外也有的好酒吧,"A great place, the boss is kind, bartender is delicious, as well as water cigarettes.The price is cheap, and Tucheng is also a good bar accident.",False
"很適合跟朋友來小酌地方，也開的夠晚～
老闆，店員，都很親切～有空還會一起玩
調酒也好喝","Very suitable for a drink with friends, and it is too late to open it ~
Boss, clerk, they are very kind ~ I will play together if I have time
Alcohol is also delicious",False
燈光好氣氛佳 酒好喝 適合下班與同事小聚,"Good light atmosphere, good wine, good drink, suitable for get off work with colleagues, gathering together",False
"炸物不油膩
熱熱的好吃😋
酒也美賣～～～還可以打飛鏢讚喔","The explosive is not greasy
Hot and delicious 吃
Wine is also beautiful ~~~ You can also play darts and praise",False
氛圍好 服務親切 放鬆的好去處,"Good atmosphere, good service, relax and relax, good place to go",False
"市區內的小酒館
氣氛不錯 店員也熱情喔","Small tavern in the urban area
The atmosphere is good, the clerk is also enthusiastic",False
好玩 店內氣氛很好 放鬆好去處還有鏢機可以打,"The atmosphere in the fun shop is very good to relax and go, there are dart machines to play",False
環境超舒適，老闆超親切，還會跟我們大家一起玩遊戲，舒壓的好地方，推推👍👍👍 …,"The environment is super comfortable, the boss is super kind, and will also play games with all of us, a good place for comfort, push ...",False
調酒挺對胃的，而且價格實惠！好開心土城終於有酒吧了！！（不用大老遠跑到板橋超讚😍） …,"The bartender is very good for the stomach, and the price is affordable!So happy Tucheng finally has a bar!Intersection(Do not need to run to Banqiao in a long distance, I am super happy) ...",False
"一整個很舒服很棒
店員跟老闆都很好相處
店內氛圍讚","The whole is very comfortable and great
The clerk and the boss get along well
Praise in the store",False
氣氛好，大家一起來喝酒非常適合,"The atmosphere is good, it's very suitable for everyone to drink together",False
"杯子超可愛
點了可可口味的調酒，很順口，沒有很重的酒味，很喜歡","Cup is super cute
I ordered the cocoa taste bartender, very smooth, there is no heavy wine, I like it",False
"環境好 氣氛佳 店員熱情
下班聚會好去處","The environment is good atmosphere, the clerk is enthusiastic
Go to get off work together",False
食物好吃 音樂好聽 氣氛佳❤️,Food delicious music is good atmosphere good atmosphere ❤️,False
打卡會送招待Shot!價格合理！讚👍🏻,Pickings will be given a reasonable price!Praise,False
氛圍很棒，當月壽星還有招待shot,The atmosphere is great.,False
"超開心土城有水煙館😍
終於可以跟朋友來嚐一下鮮了～","Super Kaishin Tucheng has the Water Tobacco Pavilion 城
Finally, you can have a taste with your friends ~",False
"小白調酒師很可愛🤫
很溫馨的地方🥰","Xiaobaijian winemaker is very cute 师
Very warm place 地方",False
音樂好聽 氣氛不錯 酒吧姐姐人很好,"The good atmosphere of music is good, the sister is very good, the sister is very good",False
小恩老闆很好聊，又帥，調酒師調的酒很讚很好喝，妹子很正，氣氛很好，大推👍🏼👍🏼👍🏼 …,"Xiaoen boss is very good to talk and handsome. The wine tuning wine is very good. The girl is very positive, the atmosphere is very good, and the big push ...",False
氣氛讚 酒好喝 cp值高,The atmosphere praise the wine and drink good CP value high,False
"氛圍很好，店員很親切，調酒很好喝
很推薦，大家帶朋友來酌一下～😍 …","The atmosphere is very good, the clerk is very kind, and the bartender is delicious and delicious
Recommended, everyone takes friends to appropriate ~ 😍 ...",False
"環境好 氣氛佳 👍👍👍
找得到快樂的地方👏👏👏👏 …","The environment is good atmosphere 氛 氛 氛 氛
Find a happy place 乐 ...",False
價格實惠 服務人員也都很客氣人很好 環境舒服 推推！,"Price and service personnel are also very polite, very good, the environment is comfortable and comfortable!",False
店裡氣氛很好，老闆很nice，尤其是老闆特調，超好喝~,"The atmosphere in the store is very good, the boss is very nice, especially the boss specially, it is super delicious ~",False
氣氛粉棒服務員人超好,The atmosphere pink rod waiter is super good,False
氣氛很棒，環境又舒適而且店家人也都很nice ，酒也很讚唷,"The atmosphere is great, the environment is comfortable and the shopkeepers are also very nice, and the wine is also very good.",False
"調酒師好口愛😍
客製化調酒 梅酒好讚😍","The bartender loves 口 口 口 口 口
Customized bartending plum wine 酒",False
酒好喝，調酒師專業，能依客人喜好調配，不用跑到北市就有高品質調酒,"The wine is good, the bartender is professional, and can be prepared according to the preferences of the guests.",False
東西好好吃 哈哈哈 超香的 酒又好喝 很顧客人想喝什麼酒 都會給意見 服務態度又超好 還會再訪,"What is delicious, hahahaha super fragrant wine and delicious, very good, customers want to drink any wine, they will give the opinion service attitude and be super good, and they will visit again.",False
"白白店長人很熱情，調酒口味適當
環境乾淨整潔，適合來拍照打卡唷","White shop chief is very enthusiastic, and the taste of bartender is appropriate
The environment is clean and tidy, suitable for taking pictures and punching cards",False
酒好喝～ 老闆很親切，還可以打鏢🥰🥰🥰 …,"The wine is delicious ~ The boss is very kind, you can also fight darts ...",False
酒很好喝，調酒師很nice,"The wine is delicious, and the bartender is very nice",False
店內氣氛佳 環境乾淨 店員服務佳,"The atmosphere in the store is good, the environment is clean, the clerk service is good",False
"粉紅泡泡好喝
大冰奶是奶酒底
沒有酒感，很順
壽星有招待shot
店家很好客
會跟客人一起玩骰子😃","Pink bubbles are delicious
Big ice milk is a milk base
No wine, very smooth
Shouxing has entertained shot
The store is very good
Will play dice with guests 一起",False
燈光美、氣氛佳，食物美味，適合小聚、談心的小天地,"The lights are beautiful, the atmosphere is good, the food is delicious, and it is suitable for the small world that is suitable for small gatherings and talks.",False
"店家人真的超nice，飛鏢又很厲害（#
氣氛又很棒，音樂👍🏻👍🏻👍🏻 …","The shopkeeper is really super nice, and the darts are very powerful (#
The atmosphere is great, music ...",False
"店內氣氛不錯
服務都很好
值得推薦👍 …","The atmosphere in the store is good
The service is very good
It is worth recommending 👍 ...",False
氣氛好，酒好喝，還能玩桌遊,"The atmosphere is good, the wine is delicious, and you can also play board games",False
"店員很nice,酒很特別","The clerk is very nice, the wine is very special",False
"我很喜歡老闆 很好聊天之超級好相處～
我第一次來～招待shot超大步  辛苦了～
也很謝謝老闆今晚的招待！！還會再來的呢","I like the boss very well to chat with each other ~
I came for the first time ~ entertaining Shot's oversized steps ~
Thank you also for your hospitality tonight!IntersectionWill you come again",False
調酒都好好喝 很有特色，炸魷魚絲一定要點！做吧台店員會陪喝 好讚好喜歡😍,"The bartending is very special, and the fried squid shredded must be ordered!Be a bar shop staff will accompany drinking and praise, so I like it 😍",False
"第一次來 氣氛很好 服務態度優秀
簡直就像人不能沒有月亮和太陽一樣
你需要一間霧都來照亮你","The first time the atmosphere is good, the service attitude is excellent
It's like a person can't have the moon and the sun
You need a fog to illuminate you",False
"環境很舒服
老闆很友善也很專業
下次還會再來","The environment is very comfortable
The boss is very friendly and professional
Will come again next time",False
推 燈美店員好相處 舒適又安心～,"Push Lanmei store clerk, get along well, comfortable and peace of mind ~",False
燈光美氣氛佳 老闆服務態度100分❤️下次還會再來,"Lighting Beautiful atmosphere, Boss Boss Service attitude 100 points ❤️ Will you come again next time",False
老闆很nice! 土城難得有酒館，讚讚！,"The boss is very nice! Tucheng has a rare tavern, praise!",False
"管理人很nice ～～
服務態度超棒～～
整體氛圍很舒服😌 …","Manager is very nice ~~
The service attitude is great ~~
The overall atmosphere is very comfortable 围 ...",False
店員很好聊天 想喝濃的偏甜另外調也很喜歡 這間先收藏😍😍,The clerk is very good to chat and want to drink thick sweetness.,False
很滿意  氣氛好 餐點也好吃 酒也好喝 很有氣氛,"Very satisfactory atmosphere, good meal, good wine, delicious, delicious, very atmospheric atmosphere",False
原本跟姐妹不知道要去哪 結果google 到這家酒吧 真的很超值 cp值超高😝 店家也很親切與熱情 還會教我們玩有趣的小遊戲 必收錄的店家 🌟🌟🌟🌟🌟,"Originally, I did n’t know where to go to the result. Google to this bar is really value -for -money. CP value is super high. The store is very kind and enthusiastic.",False
店長非常親切，有任何問題都會仔細的一一回覆。酒有很多種可以選擇，和朋友們一起點了好幾項都不錯喝～店裡還有飛鏢可以玩！讚讚讚！,"The manager is very kind, and any questions will be carefully responded.There are many options for wine, and I ordered several items with my friends. Drink it ~ There are darts to play in the shop!Praise and praise!",False
店員妹妹很善良,The clerk sister is very kind,False
"調酒好喝，氣氛佳
老闆、調酒敲好聊😎😎😎
推推 …","Blooming is delicious, the atmosphere is good
Boss, bartending tapped 酒
Push ...",False
深夜時段的好去處！,Good place in late night!,False
酒好喝 老闆專業,Drink good boss professionalism,False
氣氛不錯 好喝,The atmosphere is good and delicious,False
態度很好，調酒好喝👍土城少有的優質酒吧 …,"The attitude is very good, the bartending is delicious and delicious 👍 Tucheng rare high -quality bar ...",False
"燈光美氣氛佳超好拍😍
土城難得的水煙館👍🏻👍🏻👍🏻
店長特調很讚又很美
會先過問妳喜歡什麼方向
給妳特製一杯屬於妳的酒酒💕

老闆幽默又好聊
店員很美很親切

可以打鏢還有桌遊彈珠台

很適合平日同事們下班小酌
假日朋友們狂歡聚會❤️🎉","The light and beautiful atmosphere is good and the shot is good 😍
Tucheng's rare water cigarette hall 的
The store manager is very good and beautiful
Will you ask what direction you like first
Give you a glass of wine that belongs to you 💕 💕 💕 💕 💕

The boss is humorous and easy to talk
The clerk is beautiful and kind

You can play darts and board games, Popular Pearl Terrace

It is very suitable for colleagues to drink off work on weekdays
Holiday friends carnival party ❤️ 朋友",False
"老闆親切 酒也好喝
少數有水煙的小酒吧 很特別
也很適合喜歡水煙的人","The boss is kind and delicious
A few small bars with water cigarettes are very special
It is also very suitable for people who like water cigarettes",False
可以打標 喝酒團聚好地方,You can mark a good place for alcoholic,False
很適合週五晚上跟朋友小酌的地方,It is very suitable for the place where I have a drink with friends on Friday night,False
餐點服務都很好,The meal service is very good,False
"店員服務超親切，詳細說明酒類
餐點份量非常足夠讚👍","The clerk service is super kind, explained in detail the wine
The amount of meals is very good enough 👍",False
"音樂好聽酒好喝 氣氛很佳
店員也很親切會推薦每種酒的口感","The music is good and the atmosphere is good
The clerk is also very kind and will recommend the taste of each wine",False
"大冰奶！！超好喝
老闆服務好👌🏻👌🏻👌🏻 …","Big ice milk!IntersectionSuper delicious
The boss service is good ...",False
"氣氛很棒，老闆調酒師都超好聊，非常有趣
水煙上的很快，長島冰茶比一般的還要更厚
在這邊很放鬆，時間一下就過去了，
認真推推！","The atmosphere is great, the bartender bartender is very good, very interesting
The water smoke is very fast, and the long island ice tea is thicker than usual
It's very relaxed here, and the time passed,
Push carefully!",False
老闆無限親切，環境很好，服務讚,"The boss is infinitely kind, the environment is very good, and the service is praised",False
好喝好玩氣氛佳,It's delicious and fun atmosphere,False
調酒好喝，便宜又大碗,"Blooming is delicious, cheap and large bowl",False
水煙很順 讚👍🏻,Water smoke is very good,False
很適合跟朋友來喝酒放鬆👍🏼 …,Very suitable for drinking with friends to relax ...,False
店員貼切，調酒好喝，是會再來的店,"The clerk is appropriate, the bartender is delicious, it is the shop that will come again",False
"老闆人好又帥
還會陪喝酒聊天：）","The boss is so handsome
Can you accompany drinking and chat :)",False
大家趕快來好喝,"Everyone, come and get delicious",False
"有評論活動但店長很Nice☺️
土城人推一下～","There are comments, but the manager is very nice ☺️
Tucheng people push ~",False
"禮拜日來音樂🎵很有氣氛，禮拜六應該更Hight
酒🍷的味道都很順👍👍👍👍👍 …","The music is very atmospheric on worship, and it should be more highT on Saturday
The taste of wine is very smooth ...",False
調酒不錯喝～,Drink well ~,False
很棒，酒很好喝，而且店長好可愛，服務很好真的啊，我想認識一次了發誓,"It's great, the wine is delicious, and the manager is so cute, the service is very good, I want to know the oath once",False
環境乾淨氣氛好 炸物都很好吃～很適合聚會 下次還會再跟朋友們一起來～,The environment is clean and the fryer is delicious ~ It is very suitable for the party to come with friends next time ~,False
酒很好喝！ 店員人也很好都很親切 推薦大家來,"The wine is delicious!The clerk is also very good, I am very kind to recommend everyone to come",False
氣氛很好，酒很好喝,"The atmosphere is very good, the wine is very delicious",False
酒好喝好看 店員服務很親切,"The wine is good -looking, the clerk service is very kind",False
"跟朋友來喝酒～很好喝
調酒都十分有特色👍","Come to drink with friends ~ it's delicious
Blooming is very distinctive 分",False
燈光美氣氛佳,Beautiful light atmosphere,False
"剛好聖誕節前夕來~
很有聖誕氣氛~
很好玩~","Just come on the eve of Christmas ~
Very Christmas atmosphere ~
It's fun ~",False
裡面的餐點很棒❤️,The meal inside is great ❤️,False
服務好 調酒味道很中合 試合大家試試,Serving the taste of bartending is very good. Try it together,False
