Original,EN,Needs Review
工作人員超級親切，以定回頭的店,The staff is super friend,False
"服務人員超級親切
介紹也很細心
我們許願的酒都有了
太感動了🥹 …","The service staff is super kind
The introduction is also very careful
Our wines have all the wines
Too touched 🥹 ...",False
裡面的姊姊很親近❤️,The sister inside is very close ❤️,False
炸的很好吃服務也都很棒😍第一次來整個愛上😍,The fried is delicious. The service is great.,False
酒好喝，店內環境很漂亮，店員也很親切,"The wine is good, the environment in the store is very beautiful, and the clerk is also very kind",False
服務人員非常親切😍😍😍,The service staff is very cordial 切,False
調酒師超漂亮，人很nice，推薦來此喝酒聊天,"The bartender is super beautiful, and the person is very nice. I recommend coming here to drink and chat",False
服務員輕切 值得二訪,The waiter is worth the second visit,False
氣氛好 水菸舒服,The atmosphere is so comfortable that the water smoke is comfortable,False
"Cocktail 便宜 水煙好抽
老闆大方","Cocktail is cheap water cigarette so smoke
Boss generous",False
是個很適合和三五好友聚聚的地方，剛好遇到老闆在，招待拼盤，很棒喔!,It is a place that is very suitable for gathering with three or five friends. I just met the boss and entertain the platter. It was great!,False
氣氛很好！這邊的小姊姊很漂亮,The atmosphere is good!The little sister here is beautiful,False
"調酒還可以接受
但如果有想要在那邊抽水煙的人
真的要三思","Can also be accepted
But if there are people who want to smoke water over there
Really need to think twice",False
"真裡很棒 氛圍很好 服務人員態度佳
店長單身偷偷愛上","It's a great atmosphere very good at the atmosphere, good service staff attitude is good
The store manager secretly loves",False
哦是嗎 水煙很不錯👌🏿 …,"Oh, is the water cigarette very good ...",False
店員蠻熱情的喔🫡,The clerk is quite enthusiastic 热,False
"調酒很好喝，餐點也很好吃喔❤️❤️
然後老闆超親切的唷✌️👍 …","The bartender is delicious, and the meal is also delicious ❤️❤️
Then the boss is super kind 亲 ️👍 ...",False
一杯會醉，店長特調很讚，氛圍很不錯適合假日小酌😌,"A cup will be drunk, the manager is very good, the atmosphere is very good suitable for holiday drinks 😌",False
服務好～酒好喝！,Good service ~ wine is delicious!,False
"推薦酒類很用心～
特色酒也很讚 推推","Recommended wine is very careful ~
Special wine is also very good to push push",False
老闆很熱心 環境很棒 還有飛鏢玩,"The boss is very enthusiastic environment, great, and darts to play",False
土城居然能吸到水煙讚讚,Tucheng can actually suck in water cigarettes and praise,False
不給五顆🌟對不起老闆！ …,Don't give five sorry bosses!Mowing,False
調酒超好喝！！！！店員也很nice,The bartending is so delicious!IntersectionIntersectionIntersectionThe clerk is also very nice,False
推「一顆蛋的故事」這杯酒，下次還會想再喝！,"Push the ""Story of One Egg"", and I will want to drink it next time!",False
服務態度很好 點單快速～ 燈光美氣氛佳 裝潢有質感,The attitude attitude attitude is very good. Single fast -light atmosphere of the light and good decoration with texture,False
酒好喝 氣氛好 女店員很正,"The good atmosphere of the wine is good, the female clerk is very positive",False
"生日聚會來 服務態度超佳 會常來
裡面小姊姊超美❤️","Birthday party to come to service attitude is super good, it will come often
The little sister in it is super beautiful ❤️",False
第一次來這邊喝～～～很讚ㄉ地方！,The first time I came here to drink ~~~ I am very good!,False
妹妹很活潑熱情可愛。 但空間太小🤣 …,My sister is very lively and enthusiastic.But the space is too small ...,False
店裡的氣氛不是很好，可是生意不好，要點飲料還得跑去櫃檯點餐,"The atmosphere in the store is not very good, but the business is not good, and you have to run to the counter to order for a drink.",False
調酒好喝 酒味重很讚😎,The taste of bartender is very good.,False
❤️,❤️,False
酒好喝 服務親切 店員可愛 老闆帥氣,"Wine delicious service, friendly shop clerk, cute boss handsome boss handsome",False
環境很好 酒很好喝 找娣娣喝就對了,"The environment is very good wine, it's delicious, just find a lot of drink, just drink it",False
酒好喝 服務員好聊又熱心,Wine good waiters are good to chat and enthusiastic,False
燈光美 氣氛佳。水煙 美酒 進去就想醉,The lights are beautiful.Water smoke and alcohol you want to get drunk when you go in,False
店員好正酒好喝超讚,"The clerk is so good wine, it's so happy",False
店長、副店服務很到位 酒很好喝,The store manager and sub -store service are in place.,False
"土城人在此認證 土城第一名ㄉbar
獻給我們的小白 🙌🏻🙌🏻🙌🏻服了 …","Tucheng people are here to certify the first place in Tucheng ㄉ Bar
Xiaobai, dedicated to us ...",False
店員親切、價錢合理，最重要的是酒精濃度很夠😍 …,The clerk is kind and reasonable. The most important thing is that the concentration of alcohol is enough ...,False
店員很帥,The clerk is handsome,False
調酒超好喝 老闆人也很好,"The bartending is super delicious, the boss is also very good",False
酒還可以，但是服務可以再加強💪 …,"The wine is okay, but the service can be strengthened ...",False
"服務態度非常好
飲品非常順口
非常值得再來👍","The service attitude is very good
Drinks are very smooth
Very worth coming again 再",False
酒好喝 妹很正 ㄧ訂要來,"Good wine girl is very positive, the order is coming",False
覺得小姐很可愛服務很棒,"I think the young lady is very cute, the service is great",False
好喝，氣氛很讚,"It's delicious, the atmosphere is great",False
好喝好喝 小姊姊好漂釀( ･᷄ὢ･᷅ ),"Good, delicious little sister, good drift (･᷄ὢ･᷅)",False
氣氛很讚酒很好喝姐姐很正,"The atmosphere is great, the wine is very delicious, my sister is very positive",False
酒好喝，服務很親切,The wine is delicious and the service is very kind,False
水煙讚 店員親切 適合小酌的地方,Water smoke praise the clerk to be kindly suitable for drinking,False
適合喝一下的好地方,Suitable for drinking a good place,False
"酒很好喝
店員很正","Wine is delicious
The clerk is very positive",False
店員人很好 9⃣️好喝👍🏻 …,The clerk is very good 9 喝️ is delicious ...,False
普普 服務沒有很好還要收服務費,"Pop service is not very good, but also collects the service fee",False
很棒！服務很優質！,great!The service is very high quality!,False
老闆人超好,The boss is super good,False
讚👍,Praise,False
真好喝！,It's so delicious!,False
酒好喝 炸物好吃😋 …,The wine is delicious and delicious ...,False
良好的氛圍，友好的工作人員，還有美味的飲料。  飲料的價格都很合理。  非常推薦！,"A good atmosphere, friendly staff, and delicious drinks.The price of drinks is reasonable.Very recommended!",False
小酌好地方,Good place,False
好吃有味,Delicious,False
非常好的酒吧。氣氛很舒服，老闆也很友善。像對待朋友一樣對待我們，一定會多次光臨！,"Very good bar.The atmosphere is very comfortable, and the boss is also very friendly.Treat us like a friend, and will definitely come many times!",False
"相當溫馨
氣氛很好，服務也很好","Quite warm
The atmosphere is very good, the service is also very good",False
好喝聚餐好地方,A good place for delicious dinner,False
Luna好聊天,Luna chat,False
微醺之夜♥️,Film Night 夜 ️,False
酒好喝就可以聊天推推,You can chat and push the wine,False
好棒,Great,False
好喝🤙 …,Delicate ...,False
很有特色 很好喝,"Very distinctive, delicious",False
酒很好喝❤️❤️,Wine is delicious ❤️️️,False
200分,200 points,False
好喝,Delicious,False
100分,100 points,False
土城 No.1 酒吧,Tucheng NO.1 Bar,False
好玩好喝,Fun and delicious,False
超棒的,Awesome,False
不錯的酒吧,Good bar,False
很棒！,great!,False
交通便利的酒吧,Convenient transportation bar,False
酒非常好喝,Wine is very delicious,False
酒很好喝,Wine is delicious,False
好的,OK,False
好喝！,Special!,False
好地方！,Good place!,False
有特色,Characteristic,False
水,water,False
姐姐很nice,Sister is very nice,False
舒服,Comfortable,False
超棒🥰🥰🥰 …,Superb ...,False
推推🙌🙌 …,Push 🙌🙌 ...,False
好喝喝喝喝,Drink and drink,False
不錯👍👍👍👍👍👍 …,Not bad 👍👍👍👍👍👍 ...,False
