Original,EN,Needs Review,Positive,Negative,Neutral,Compound
"在這家酒吧喝一杯，體驗不一樣的體驗！非常棒，團隊也非常熱情。
去和丹尼斯談談，他會和你分享他在法國的烹飪經驗。你用法語改變了我。
和一個朋友一起去了那裡，度過了一段愉快的時光。","Drink a drink in this bar, experience a different experience!Great, the team is also very enthusiastic.
To talk to Dennis, he will share his cooking experience in France with you.You changed me in French.
I went there with a friend and spent a happy time.",False,0.239,0.0,0.761,0.9167
丹尼斯製作美味的飲料和美味的食物。我們真的很喜歡和他聊天。非常強烈推薦！,Dennis makes delicious drinks and delicious food.We really like to chat with him.Very strong recommendation!,False,0.556,0.0,0.444,0.9298
"我喝過雞尾酒的最好的酒吧之一
服務無可挑剔，工作人員會說法語，這是一個優點。  我也能滿足一點小小的飢餓","I have drank one of the best bars in cocktails
The service is impeccable, and the staff can speak French, which is an advantage.I can also satisfy a little hunger",False,0.201,0.048,0.752,0.7574
"親愛的先生，美好的一天。
毫無疑問，烏克蘭美食日是如此獨特和精彩。
非常感謝您的告知以及為活動所做的努力。
祝您一切順利，生意興隆。
問候！
石庫
3 月 10 日。 2024年","Dear gentleman, a beautiful day.
There is no doubt that Ukraine Food Day is so unique and wonderful.
Thank you very much for your notification and your efforts for the event.
I wish you all the best and business.
greeting!
Stone bank
March 10.2024",False,0.409,0.0,0.591,0.9746
非常放鬆的地方…非常尖端的感官匹配技能。,Very relaxed place ... Very cutting -edge sensory matching skills.,False,0.263,0.135,0.602,0.4019
"這個地方是台北市中心的一顆隱藏的寶石。雞尾酒的選擇令人驚訝，我很高興看到在食譜中融入法式風味付出了多少努力。
我一定會回到那裡，因為那裡的氛圍很涼爽，丹尼斯的團隊會盡力確保您度過愉快的時光！","This place is a hidden gem in the center of Taipei.The choice of cocktails is surprising. I am glad to see how much effort has been made in the recipes.
I will definitely return there, because the atmosphere there is very cool, Dennis's team will try to ensure that you have a happy time!",False,0.261,0.0,0.739,0.9431
"如果你來台灣，就是這個地方！
雞尾酒配茶和酒很棒！

老闆很帥，氣氛輕鬆。
非常喜歡聽樓主的背景
蛋糕也很好吃！","If you come to Taiwan, this place!
Cocktails with tea and wine are great!

The boss is very handsome and the atmosphere is easy.
I really like to listen to the background of the host
The cake is also delicious!",False,0.338,0.0,0.662,0.9575
相當不錯的酒吧，我喜歡我們點的所有雞尾酒和甜點，調酒師也很友善。我和我的朋友們玩得很開心。,"The very good bar, I like all the cocktails and desserts we ordered, and the bartender is also very friendly.My friends and I played very happily.",False,0.423,0.0,0.577,0.9367
"當您除了公共光周圍的人群之外還想找一家提供專業雞尾酒的私密酒吧時，
來酒吧節吧。很棒的飲料，小酒吧很棒的老闆讓你有賓至如歸的感覺","When you also want to find a private bar to provide a professional cocktail in addition to the crowd around the public light,
Come to the Bar Festival.A great drink, the boss with a great bar makes you feel like a guest.",False,0.24,0.0,0.76,0.9001
好喝的雞尾酒🍸,A delicious cocktail 鸡,False,0.552,0.0,0.448,0.5719
絕對令人驚嘆的服務，很棒的小地方 10/10,"Absolutely amazing service, great small place 10/10",False,0.628,0.0,0.372,0.8576
好的,OK,False,1.0,0.0,0.0,0.296
舒適的小酒吧，提供高品質飲料、甜點和小吃。,"A comfortable bar offers high -quality drinks, desserts and snacks.",False,0.268,0.0,0.732,0.5106
推推,Push,False,0.0,0.0,1.0,0.0
一個放鬆的好地方！推薦給大家！,A good place to relax!Recommend to everyone!,False,0.367,0.0,0.633,0.5399
很棒,great,False,1.0,0.0,0.0,0.6249
草莓塔很好吃！ ！ ！,The strawberry tower is delicious!IntersectionIntersection,False,0.0,0.0,1.0,0.0
這是一個不錯的酒吧,This is a good bar,False,0.42,0.0,0.58,0.4404
台北真的很酷的一個地方，甜點很棒，廚師很專業！啤酒也很好喝！現在我會推薦我所有的朋友來參觀！,"Taipei is really cool place, the dessert is great, the chef is very professional!Beer is also very delicious!Now I will recommend all my friends to visit!",False,0.374,0.0,0.626,0.9212
