Original,EN,Needs Review,Positive,Negative,Neutral,Compound
海鮮燉飯很好吃！但老闆說大家也可以試試看其他燉飯哈哈哈，然後調酒很棒👍（我有些酒評👉🏻IG: professional_joke_,"Seafood stew is delicious!But the boss said that everyone can also try other stewed rice hahaha, and then the bartender is great 👍 (I have some wine reviews 👉🏻Ig: Professional_joke_",False,0.186,0.0,0.814,0.8398
"公館的寶藏酒吧🥺 趁學生都在放暑假大家趕快來🤣

今天喝了諾曼第夏天，整杯很清甜喝的時候可以聞到蘋果肉桂的香氣好喜歡～

離開時老闆還給了Bye Bye Shot 是精華版的桂花巷茶樓，金萱融合的超讚的，說喜歡這個濃度下次來也可以跟他說🤣 另外還有香片茶的組合也好特別！

餐點吃了西班牙海鮮燉飯有魚肉、蝦子、花枝帶一點微辣很好吃，不知不覺就吃完了🤣

三人派對炸雞有孜然香料醃過，味道很香肉也很嫩❤️❤️❤️

下次來想試試甜點😆","Mansion's treasure bar

I drank the summer of Norman today. When the whole cup is very sweet, you can smell the aroma of apple cinnamon. I like it ~

When he left, the boss also gave Bye Bye Shot as the essence version of the osmanthus alleys. Jin Xuan fused and praised. He said that he liked this concentration next time you can tell him that there is a combination of fragrant tea tea!

The meal ate the Spanish seafood stewed rice with fish, shrimp, and flower branches with a little spicy and delicious.

The three -person party fried chicken has cumin spices, and the taste is very fragrant and tender ❤️❤️❤️

Next time I want to try the dessert 试",False,0.155,0.0,0.845,0.9624
"無論是甜點和鹹食，表現都很不錯，尤其是義大利肉腸，令人驚艷。
肉桂捲不輸名店，肉桂香氣濃厚不死甜，會讓人為這甜點再訪！
Dennis和Jade（店主）非常nice，也好好聊，在這裡氣氛真的很棒哪。

一定會讓人再訪的一家店✨✨","Whether it is dessert and salty food, the performance is very good, especially the Italian fleshy intestines, which is amazing.
The cinnamon roll is not lost in the famous shop. The cinnamon is strong and unsteady, which will make people visit this dessert again!
Dennis and Jade (owner) are very nice and talk well. The atmosphere is really great here.

A shop that will definitely visit again 一定",False,0.293,0.0,0.707,0.9745
"老闆人很親切，酒蠻好喝的
威士忌布丁好吃😋
海鮮燉飯也不錯！","The boss is very kind, the wine is pretty delicious
The whiskey pudding is delicious 忌
Seafood stewed rice is also good!",False,0.507,0.0,0.493,0.9551
品嚐店裡提供六種調酒的其中四種，都非常的順口，對於諾曼地帶有肉桂香氣的風味印象深刻，下次會回訪嚐嚐其他的調酒，離開前老闆還給了清爽的BYE BYE SHOT，讓接近尾聲的這一天充滿了喜悅😁,"Four of the six kinds of bartending in the taste store, all of which are very smooth. It is impressed by the flavor of Norman with cinnamon aroma. The next time I will return to taste the other bartender. Bye Shot, the day of the end of the end is full of joy.",False,0.119,0.0,0.881,0.7845
"住附近常常來喝🥳🥳
威士忌布丁很好吃！調酒很好喝！老闆人很好！","I often come to drink nearby 常 常 常 常 常 常
The whiskey pudding is delicious!The bartender is delicious!The boss is very good!",False,0.15,0.0,0.85,0.6211
"整體佈置十分有格調！有大螢幕超級chill
店長很有品味 然後店員介紹本店特調也十分用心
本店特調的表現真的都很優秀😍 超級喜歡
然後甜點我們是點提拉米蘇 淡淡的酒味真的吃起來十分美味(*ºωº)
希望可以更多人發現這家寶藏酒吧！價位在台北我覺得相對平價
但好怕之後想來光顧 人太多沒有位子
-
二訪喝的調酒表現就不太好
老闆感覺也很忙 沒有什麼在招呼⋯🥲","The overall layout is very stylish!There is a big screen super chill
The store manager is very tasteful and the clerk introduces this store's specialties and is very attentive
The performance of this shop's special adjustment is really excellent 😍 super favorite
Then the dessert we are the faint wine flavor of Tiramisu really taste delicious (*º ωº)
I hope more people can find this treasure Tibetan bar!The price is in Taipei I think it is relatively cheap
But I am afraid that I want to visit too many people.
-
The performance of the second visit to drink is not very good
The boss feels very busy, nothing to say, 🥲 🥲 🥲 🥲 🥲 🥲 🥲",False,0.16,0.025,0.815,0.9213
"因為住附近無意間踏入的酒吧
沒想到體驗完全令人驚艷
調酒用心好喝，甜點是有入酒的但是酒味不會太重，不喝酒的人也可以輕鬆吃
老闆也親切好客，介紹很多調酒甜點相關知識
完全沒有想到在台北相對酒吧稀少的區域可以有這種體驗
非常推薦喜歡調酒和喜歡甜點的人造訪","Because the bar you accidentally stepped in nearby
I didn't expect the experience to be completely amazing
The bartending heart is delicious, the dessert is alcohol, but the taste of the wine will not be too heavy. People who do not drink can easily eat it easily
The boss is also kind hospitality, introduce a lot of knowledge related to bartending desserts
I did not expect that this experience in the scarce area in Taipei's relatively rare bar can be
It is very recommended for artificial visits that like bartending and desserts",False,0.195,0.039,0.766,0.9504
"酒好喝
甜點很好吃～
氣氛不錯老闆人很好","Wine
The dessert is delicious ~
The atmosphere is good, the boss is very good",False,0.449,0.0,0.551,0.8687
"地中海餐酒館
汀州路上難得的小店…在今天寒冷的夜，日文課下課後晚上10點前往，調酒有特色、威士忌布丁也醇香，一個人的夜，在吧台跟簡老闆閒聊在歐洲生活的經驗…再點個海鮮燉飯，收尾料理再回家！很有歐風特色的店！","Mediterranean Restaurant
The rare small shop on Tingzhou Road ... On the cold night today, when you go at 10 pm in the evening after class, the bartending is characteristic and whiskey pudding is also mellow. A night's night with boss Jane's experience in Europe ... Order another seafood stew, and get home!Very European style shop!",False,0.0,0.0,1.0,0.0
"愜意舒適的小酒館，發現這個地方真是太好了 🍸✨

空間氛圍令人放鬆又不過度嘈雜，調酒香氣十足、口感綿密，香甜不失酒感，調酒以外，也有多種用心製作的點心，老闆與店裡夥伴都溫和有禮，是剛剛好的親切 😊

好人好酒好空間，有機會一定要再來坐坐！","The comfortable and comfortable tavern, I found that this place is really good 🍸✨

The space atmosphere is relaxed but not excessive. The aroma aroma is full, the taste is dense, the taste is sweet without losing the wine, and there are many kinds of desserts. The boss and the partners in the store are gentle and polite. It is just right and kind. Bleak

Good people, good wine and good space, if you have a chance, you must come and sit again!",False,0.355,0.0,0.645,0.9897
"很溫馨的小地方，老闆人很好
調酒都很好喝","Very warm small place, the boss is very good
Alcohol is very delicious",False,0.484,0.0,0.516,0.8548
"如果你正在尋找一家舒適且美味的餐酒館，我強烈推薦你去試試位於公館的這家酒吧，輕鬆與氣氛輕鬆愉快的空間。

這家餐酒館提供了幾道特定美食選擇，這次點了鹹派與鹹湯令人印象深刻與感動。

除了美食，Bar FEST還擁有一很多特調之調酒，這次點了諾曼第，來自法國鄉村蘋果果汁風味的清新調酒，第一口道最後一口的層次變化，帶出果香味。啡禮特調，把咖啡香氣與煙燻酒氣混合，讓人一口接一口。

這家酒吧的服務非常友好和專業，您可以在這裡享受優質的用餐體驗。無論是與朋友、家人或商務夥伴，Bar FEST都是一個完美的場所。推薦給大家。","If you are looking for a comfortable and delicious dining tavern, I strongly recommend you to try the bar in the mansion in the mansion, relaxed and relaxed and happy.

This restaurant provides several specific food options, which is impressive and impressive this time to order Xianpai and Xian Tang.

In addition to food, BAR FEST also has a lot of special bartending. This time, I ordered Normani. The fresh bartending of apple juice flavors from the French rural village.The aroma of coffee is mixed with smoky wine, making people take a bite.

The service of this bar is very friendly and professional, you can enjoy a high -quality dining experience here.Whether it is friends, family or business partners, Bar Fest is a perfect place.Recommended to everyone.",False,0.295,0.0,0.705,0.9927
"酒超好喝！！！！老闆非常讚！！！！還有投螢幕可以看影片真的超級有氣氛🥺✨❤️

真的好喜歡⋯⋯","The wine is so delicious!IntersectionIntersectionIntersectionThe boss is very good!IntersectionIntersectionIntersectionThere is also a screen to watch the video really super atmosphere 🥺✨❤️

I really like it ...",False,0.268,0.0,0.732,0.8711
"老闆人超級親切 很好聊天放鬆的一個地方
還有好吃的甜點","The boss is super kind, very good, chat and relax,
There are delicious desserts",False,0.655,0.0,0.345,0.9524
老闆跟調酒師人很好，食物很好吃，飲料很好喝，氣氛很好，以後會常來！,"The boss is very good with the bartender, the food is delicious, the drink is delicious, the atmosphere is good, and it will often come in the future!",False,0.365,0.0,0.635,0.9298
整體環境很舒服，老闆很健談！,"The overall environment is very comfortable, the boss is very talkative!",False,0.28,0.0,0.72,0.5974
"甜點好吃！尤其是草莓塔絕了！
草莓很甜，塔皮也很香,下次經過還會再來","The dessert is delicious!Especially the strawberry tower is absolutely!
Strawberry is very sweet, and the tower is also very fragrant. I will come again next time",False,0.134,0.0,0.866,0.5963
很美也很好喝的調酒。我比較老派(？)，還是希望可以有實體菜單。,"It's beautiful and delicious.I am more old (?), I still hope that there can be a physical menu.",False,0.298,0.0,0.702,0.7783
"三人派對是老闆現做的，有中東風味且是熱騰騰的！吃得出用心！
特調的酒感收的很好，桂花味很香，帶點茶感 很有特色！
老闆也很好客！完全符合五顆星啊","The three parties are made by the boss now, with the Middle East flavor and hot!Eat attentive!
The special wine feels very good, the sweet -scented osmanthus is very fragrant, and the tea feel is very distinctive!
The boss is also very good!Full of five stars",False,0.237,0.0,0.763,0.919
"氣氛很舒服，調酒很好喝！
餐點也很好吃~","The atmosphere is very comfortable, and the bartender is delicious!
The meal is also delicious ~",False,0.465,0.0,0.535,0.9059
那天剛好是台灣烏克蘭陣線援助烏克蘭的美食活動，跟老闆聊天發現是同樣法文系畢業的。老闆好聊場地舒服，是個適合社交的場所。,It happened to be the food event of the Taiwan Ukraine Front to assist Ukraine. I was chatting with the boss and found that I graduated with the same French department.The boss is comfortable to talk about the venue and is a place suitable for social.,False,0.068,0.0,0.932,0.5106
空間很舒服有大銀幕，老闆站吧台很好聊，重點是甜點很好吃~,The space is very comfortable and there are big screens.,False,0.285,0.0,0.715,0.5563
"中場休息關門後……
新老闆直接接手重新開張變「Bar FEST」啦啦啦啦啦啦🥳🥳🥳

老闆說以後除了咖啡還會有餐飲跟酒水
太神啦啦啦啦啦！！！！！！！","After the midfield rest is closed ...
The new boss directly took over and re -opened ""BAR FEST"" la la la la la la (

The boss said that in the future, there will be catering and drink in addition to coffee
Too god, la la la la la!IntersectionIntersectionIntersectionIntersectionIntersectionIntersection",False,0.047,0.0,0.953,0.3382
整體氣氛很Chill，老闆很健談、bartender 親切且服務到位，能在這裡非常放鬆的喝酒，調酒的客製化程度很高，是值得再訪的Bar🙂很有質感，帶朋友來絕對不會失望。 …,"The overall atmosphere is very chill. The boss is very talkative, Bartender is kind and served in place. It can be very relaxed here to drink. The customization of bartender is very high. disappointment.Mowing",False,0.177,0.0,0.823,0.7841
酒非常好喝，老闆很健談，推薦大家來喝。,"The wine is very delicious, the boss is very talkative, I recommend everyone to drink.",False,0.342,0.0,0.658,0.7755
酒很濃很特別很好喝! 老闆很好走之前還請我們喝shot,"The wine is very strong and very delicious! The boss is very easy to leave before, and please drink shot",False,0.448,0.049,0.503,0.9171
喝調酒、吃小點，聊聊天的好地方。,"Drink bartending, eat a little, and chat a good place.",False,0.244,0.0,0.756,0.4404
酒頗有特色 香氣不錯 老闆介紹細心,"The wine is quite distinctive, the aroma is good, the boss introduces it carefully",False,0.268,0.0,0.732,0.5267
愜意，聊天的好地方!不止甜點調酒好喝，老闆還有店員聊天也很開心,"Sweet, a good place for chatting! Not only dessert bartending is delicious, but also the boss and the clerk are also very happy to chat.",False,0.365,0.0,0.635,0.9018
"安靜 氛圍好 經典調酒不錯 有別於附近年青人的店
走英國風","The quiet atmosphere is good, the classic bartending is good, different from the shop where the young people are nearby
British style",False,0.225,0.0,0.775,0.7003
"這間的熱狗堡跟松露薯塊真的很好吃！
熱狗很多汁～調味也很棒💕","This hot dog castle and truffle potato pieces are really delicious!
Hot dogs have a lot of juice ~ seasoning is also great 💕",False,0.366,0.0,0.634,0.9285
"Super Dope
調酒超讚，甜點超神，適合聚餐","Super dope
The bartending is superb, the dessert is super god, suitable for dinner",False,0.583,0.0,0.417,0.9325
"下載Funnow，可以提前訂位，又能線上刷卡享回饋，輸入推薦碼  K23FYGH  再享額外折扣一百元，性價比高！
店家優惠，額外招待飲品！
店內環境好，法式甜點讚，而且寵物友善，根本滿分","Download Funnow, you can order in advance, and you can swipe your card online to enjoy the feedback. Enter the recommendation code K23fygh to enjoy additional discount of 100 yuan, cost -effective!
Store discounts, entertaining drinks!
The environment in the store is good, French dessert praises, and pets are friendly, full of scores",False,0.328,0.0,0.672,0.9701
"燉飯難吃到極致真的別鬧了
第一次吃燉飯可以看到一坨白色的米","It's really troublesome to stew it, so don't make trouble
You can see a pile of white rice for the first time to eat stewed rice",False,0.084,0.119,0.797,-0.2666
西班牙燉飯好吃💪💪,Spanish stewed rice is delicious 炖,False,0.425,0.0,0.575,0.5719
"老闆做的調酒層次豐富
想看帥哥老闆自己來看","The bartender made by the boss is rich
Want to see the handsome guy boss, come and see",False,0.351,0.0,0.649,0.7964
老闆人超好，非常健談，酒也很道地，來公館來酒吧，沒來喝這間真的只能說是白來,"The boss is very good, very talkative, and the wine is also very authentic. When you come to the mansion and come to the bar, you can only say that you can only say that it is white.",False,0.079,0.0,0.921,0.4927
炸雞超好吃！！酒也好喝  推推🌟,Fried chicken is super delicious!IntersectionThe wine is also delicious and pushed 推,False,0.441,0.0,0.559,0.8356
酒非常好喝！老闆健談！酒類知識豐富，還有很多甜點，非常適合搭酒,"Wine is very delicious!Boss talk!The wine is rich in knowledge, and there are many desserts, which are very suitable for wine",False,0.173,0.0,0.827,0.6351
老闆很讚😎 有機會會常來,The boss is very good.,False,0.444,0.0,0.556,0.4927
甜點真的超超超級好吃，好久沒有吃到那麼讓人驚艷的甜點，甜但不膩🥹搭配酒也是絕配！如果喜歡吃點心的人真的一定要來品嚐看看～～,"The dessert is really super delicious. I haven't eaten so amazing desserts for a long time. Sweet but not greasy 🥹 Matching wine is also a perfect match!If you like to eat snacks, you must really come to taste it ~~",False,0.347,0.0,0.653,0.9559
"整體氛圍佳，還有電影看，舒服
服務親切，廁所不錯
還有甜點可以吃","The overall atmosphere is good, and there are movies to watch, comfortable
The service is kind and the toilet is good
There are desserts to eat",False,0.362,0.0,0.638,0.91
"城市裡的星星
白琴貴妃/啡禮♥️","Stars in the city
Baiqin Guifei/Corcene ️ ️",False,0.0,0.0,1.0,0.0
"肉桂捲和特調 璀璨之花 還不錯
老廣場 就比就一般 不太合我的喜好

但主要覺得比較可惜的部分還是
我們已經提前兩天訂位了
當天卻說很多食物和非酒精類飲料沒有供應
400多的炸物拼盤份量也偏少","Cinnamon rolls and special flowers are not bad
Old square is better than me that it is generally not very good at my preference

But the main part of it is a pity
We have booked two days in advance
On the same day, I said that many foods and non -alcoholic beverages are not available
More than 400 explosive platter is also small",False,0.083,0.067,0.851,0.0293
很特別的調酒，有咖啡、茶及紅酒的調酒選擇，好看好喝，環境舒服，老闆熱情，是一聚會的好地方！,"Very special bartending, there are coffee, tea and red wine bartending choices, good -looking, delicious, comfortable environment, and enthusiasm for the boss. It is a good place for a party!",False,0.485,0.0,0.515,0.9669
"酒很好喝☺️氣氛很棒！
檸檬派超好吃～～","The wine is delicious ☺️ The atmosphere is great!
Lemon School is super delicious ~~",False,0.63,0.0,0.37,0.9622
"老闆很親切！酒吧氣氛很好！
餐點都很好吃！非常推薦！","The boss is very kind!The atmosphere of the bar is very good!
The meals are delicious!Very recommended!",False,0.291,0.0,0.709,0.732
老闆很好聊,The boss talks well,False,0.412,0.0,0.588,0.2732
老闆細心講解調酒的風味，人很好聊，調酒風味精緻好喝，食物也相當美味，推薦各位來！,"The boss carefully explained the flavor of the bartender. People are very good to talk, the flavor of the bartender is delicate and delicious, and the food is quite delicious.",False,0.352,0.0,0.648,0.9116
有深厚底子的甜點師、調酒師跟廚師（同一個人），值得你親自來品嚐，絕不會後悔。,"The dessert, the bartender, and the chef (the same person) with a deep foundation are worthy of you to taste it yourself, and you will never regret it.",False,0.168,0.0,0.832,0.6407
非常好吃的草莓塔 老闆自己做的欸,Very delicious strawberry tower owner's own 欸,False,0.4,0.0,0.6,0.6115
"老闆說為了媽媽放棄海外
根本就是推推
而且蛋糕我喜歡草莓塔檸檬塔
還有威士忌🥃💯 …","The boss said that he gave up overseas for his mother
It's just pushing
And I like the strawberry tower lemon tower
And whiskey 士 ...",False,0.091,0.0,0.909,0.3612
超級有料 酒調的很好喝 吃的也超讚 馬鈴薯自己調味超級好吃 可以給10顆星那種,Super ingredients are very delicious and delicious. You can taste the sweet potato itself.,False,0.598,0.0,0.402,0.9419
公館最頂酒吧👍 …,Mansion's top bar 酒 ...,False,0.31,0.0,0.69,0.2023
整體氛圍很舒服：）甜點很好吃！酒我也很喜歡,The overall atmosphere is very comfortable :) The dessert is delicious!I like wine too,False,0.468,0.0,0.532,0.8646
Shot有梅茶香，有夠香,"Shot has a fragrance of plum tea, which is fragrant enough",False,0.0,0.0,1.0,0.0
"很喜歡這個地方❤️
很放鬆～","I like this place very much ❤️
Very relaxed ~",False,0.4,0.0,0.6,0.7178
燈光好氣氛佳，店員親切，餐點酒水也很棒，加入口袋名單！,"The lights are good, the clerk is kind, and the meal is also great. Add the pocket list!",False,0.416,0.0,0.584,0.8932
東西好吃 牛肉湯超推薦 法式可麗餅美味升級 比法國人做的好吃,"Beef soup is super recommended by French Cake, delicious upgrade than French people make delicious than French people",False,0.483,0.0,0.517,0.9201
環境很舒服，甜點也很好吃！非常推薦,"The environment is very comfortable, and the dessert is also delicious!Very recommended",False,0.362,0.0,0.638,0.6893
超讚酒好喝，店員人也很好～,"It's so delicious, the clerk is also very good ~",False,0.473,0.0,0.527,0.8012
"左丹奴推薦好店 大家喜歡可以一起來
酒精真的很重要❤️❤️","Zuo Dannu recommends good shops, you like it, you can come together
Alcohol is really important ❤️❤️",False,0.37,0.0,0.63,0.8122
"還沒去過，
但朋友很愛這間店，
所以先給五星，
之後找時間去。","Haven't you been,
But friends love this store very much,
So give five stars first,
After looking for time.",False,0.369,0.0,0.631,0.899
"我每個禮拜五都會來
不為什麼 就是因為酒太好喝了🫶🏼

True that true that😉👌🏼","I will come every Friday
It's not because the wine is too delicious 🫶🏼

TRUE That TRUE thath",False,0.374,0.0,0.626,0.8949
颱風天好去處,Typhoon Heaven is good,False,0.756,0.0,0.244,0.7351
老闆真的很可愛，調酒很好喝。,"The boss is really cute, and the bartender is very delicious.",False,0.447,0.0,0.553,0.8067
"左丹奴喜歡的店❤️
服務品質佳
然後店員也是高雄人","Store that Zuo Dannu likes ❤️
Good service quality
Then the clerk is also Kaohsiung",False,0.289,0.0,0.711,0.6908
"老闆很親切，支持烏克蘭🇺🇦
Слава україні! …","The boss is very kind and supports Ukraine 🇺🇦
Слава слава! ...",False,0.403,0.0,0.597,0.7749
"甜點都是老闆自己做的
很好吃！","The desserts are made by the boss by themselves
Very delicious!",False,0.3,0.0,0.7,0.6468
燉飯很好吃，老闆人很好🥰,"The stew is delicious, the boss is very good",False,0.496,0.0,0.504,0.7841
"老闆人很可愛♥️
很友善👍👍","The boss is very cute 很 ️ ️
Very friendly 👍👍",False,0.361,0.0,0.639,0.7774
台北的深夜甜點，值得放鬆的好地方☺️❤️,The late night dessert in Taipei is a good place worth relaxing ☺️❤️,False,0.478,0.0,0.522,0.875
"餐點好吃
老闆親切","Meal delicious
Boss kind",False,0.78,0.0,0.22,0.7964
營業時間根本不對 11點去了完全沒開,The business hours are not right at 11 o'clock and did not open at all,False,0.0,0.0,1.0,0.0
老闆很帥(⁎⁍̴̛ᴗ⁍̴̛⁎),The boss is very handsome (帅),False,0.411,0.0,0.589,0.5413
我覺得很開心！,I feel very happy!,False,0.588,0.0,0.412,0.6468
讚讚讚,Praise,False,1.0,0.0,0.0,0.5574
老闆熱情友善，讚👍 …,"The boss is enthusiastic and friendly, praise ...",False,0.667,0.0,0.333,0.875
"甜點好吃
喝醉就醫方便","Dessert delicious
Sophisticated medical treatment",False,0.709,0.0,0.291,0.8074
老闆人超級好🥺,The boss is super good 级,False,0.63,0.0,0.37,0.7783
"老版非常和善
而且整體氛圍","The old version is very good
And the overall atmosphere",False,0.262,0.0,0.738,0.4927
讚,praise,False,1.0,0.0,0.0,0.5574
Sky調的酒好好喝,Sky tuned wine,False,0.0,0.0,1.0,0.0
調酒超專業,Sepanic is super professional,False,0.565,0.0,0.435,0.5994
頂中頂,Top,False,1.0,0.0,0.0,0.2023
甜點超好吃😍 …,The dessert is super delicious 好 ...,False,0.603,0.0,0.397,0.8225
老闆禮貌用心,The boss is polite,False,0.0,0.0,1.0,0.0
東西好吃 酒好喝,Beautiful drinks and delicious wine,False,0.717,0.0,0.283,0.8225
老闆經驗豐富,Boss is experienced,False,0.0,0.0,1.0,0.0
👍🏻🫶🏻,👍🏻🫶🏻,False,0.0,0.0,1.0,0.0
"台北的另一顆隱藏寶石。
位置非常方便，靠近綠線公館站，仍然很容易經過，從街上看不到這個酒吧。
很棒的雞尾酒和甜點，那裡的氣氛甚至更好。
丹尼斯和傑德是很棒的人，有著善良的靈魂🫶他們會向你推薦飲料以及搭配什麼🤌🍸🍮","Another hidden gem in Taipei.
The location is very convenient. It is still easy to pass by the Green Line Mansion Station. This bar cannot be seen from the street.
A great cocktail and dessert, the atmosphere there is even better.
Dennis and Jed are great people, with good souls 🫶 What will they recommend drinking and matching you?",False,0.268,0.0,0.732,0.9607
"Bar Fest是一家不錯的小酒吧，有著簡單而舒適的氛圍和室內裝飾，提供令人愉悅的飲料和甜點。
特別感謝他們舉辦烏克蘭志工活動，讓台灣民眾有機會品嚐烏克蘭美食。
身為一個烏克蘭人，我給他們的食物打高分！
好工作！","Bar Fest is a good bar, with a simple and comfortable atmosphere and interior decoration, which provides pleasant drinks and desserts.
Special thanks to them for holding Ukrainian volunteers to give Taiwanese people the opportunity to taste Ukrainian cuisine.
As a Ukrainian, I give their food high!
Good job!",False,0.337,0.0,0.663,0.9656
