Original,EN,Needs Review,Positive,Negative,Neutral,Compound
"開闊天台 看101大景
時尚裝潢 多吸引年輕人
是個令人愉悅的場所","Open the rooftop watch 101 big scenes
Fashion decoration is more attractive to young people
Is a pleasant place",False,0.276,0.0,0.724,0.7574
"🎄聖誕節超好玩，有邀請杰明、九九零距離互動，整個嗨到爆
DJ們都很會帶氣氛
我們包廂的朋友們都玩得很開心，還到舞台上跳舞🤣
調酒好喝
吃的我們點炸物，份量多，很適合邊喝酒邊吃
離101很近 視野很好！期待下次的活動

美中不足的是我們12人包，但座位空間明顯不夠，希望可以提供更多小的椅子","， Christmas is super fun, there are invitation to interact with Jeonming and 1990, the whole hi is to explosion
DJs are very atmospheric
Friends in our box are very happy, and we also dance on the stage.
Blooming is delicious
We order the fried object, and the portion is large, which is very suitable for drinking while drinking
It is very close to 101!Looking forward to the next event

The lack of beauty is our 12 -person bag, but the seat space is obviously not enough. I hope that more small chairs can be provided",False,0.134,0.044,0.822,0.821
"風景很好，可以近距離欣賞101
很好拍照，調酒推薦元宇宙、時空旅人","The scenery is very good, you can enjoy 101 at close range
Very good to take pictures, bartender recommendation of Yuan universe, time and space traveler",False,0.294,0.0,0.706,0.862
此餐廳有著極致時髦且迷人的裝潢，食物售價偏高但在可接受範圍，整體是非常優質的，建議七點以後進入。,This restaurant has an extremely fashionable and charming decoration. The food price is high but in the acceptable range. The overall is very high -quality. It is recommended to enter after seven o'clock.,False,0.204,0.0,0.796,0.7705
So good 員工都很客氣,So good employees are very polite,False,0.39,0.0,0.61,0.4927
景觀好，可以看到整根101，氣氛也不錯👍 …,"The landscape is good, you can see the whole root 101, the atmosphere is also good ...",False,0.279,0.0,0.721,0.7003
"景很厲害
酒比預想的好喝很多
我點的是太空計畫","Jing is very powerful
Wine is much better than expected
I ordered the space program",False,0.316,0.0,0.684,0.7178
活動日超好玩，跟上活動還有優惠喔！一個人來也沒關係，因為很多人會陪你玩，一群人來也好玩，從場上玩一圈都可以😆 …,"The event day is fun, there is a discount for keeping up with the event!It doesn't matter if a person comes, because many people will play with you, a group of people are fun, you can play around the field ...",False,0.24,0.022,0.738,0.8914
最難喝的長島冰茶，牛肉麵麵是黏在一起的，沒有什麼服務卻要收一成服務費，除了 view好，酒真的很水，很難喝，可惜了，如果找厲害一點的bartender，這間店真的很讚，店員感覺都是很年輕，跟他們反應問題，當下都無法好好應對，如果可以改進酒品和餐點，這真的會是一間很不錯的店☹️,"The most difficult Long Island Ice Tea, the beef noodles are sticky together, and there is no service to charge a service fee. Except for View, the wine is really water and it is difficult to drink. Unfortunately, if you find a bit more powerful one, Bartender, this shop is really great, the clerk feels very young, responds to them, and can not deal with them at the moment. If you can improve wine and meals, this will really be a very good shop ☹️",False,0.132,0.122,0.747,0.4629
"市內室外都很有氣氛的酒吧，調酒試了幾杯都沒踩雷，雖然室外偶遇小雨，但工作人員會第一時間幫忙調配到室內座位。

雖說是可吸菸的酒吧，但完全不會有煙臭味，很適合情侶、夫妻來浪漫一下。旁邊直接一根無敵海景101，這麼讚的view真的不知道去哪找。

* 水煙、牛肉麵必點","There are bars with atmospheric atmosphere in the city. After a few cups of bartending, I did not step on the mine. Although the outdoor puppet encountered light rain, the staff would help me in the indoor seat as soon as possible.

Although it is a smoking bar, there will be no smell of smoke at all, which is very suitable for couples, husbands and wives to romantic.There is an invincible sea view 101 next to it. The praise View really doesn't know where to find.

* Water smoke, beef noodles must be ordered",False,0.093,0.022,0.885,0.8074
戶外空間非常好，直接面對101，第一次喝到吐,"The outdoor space is very good, face 101 directly, the first time I drink it",False,0.186,0.0,0.814,0.4927
調酒點了七杯沒有一杯踩雷，狀可和不累都超適合女生，今天接待我們的Bobo真的給我們一個很棒的體驗，我朋友第一次來台灣覺得你的服務真的是太貼心至極了，因為你我們的爛醉不累體驗超棒！我們下次還會再來！,"After seven cups of sake, there is no cup of thunder. It is super suitable for girls. The BOBO who received us today really gives us a great experience. My friend came to Taiwan for the first time. It's so intimate, because your drunk is not tired and experience is great!We will come again next time!",False,0.206,0.067,0.727,0.8907
在台北市精華地帶的一種享受，重點美食和地點，以及安保部分都是首要因素！,"A kind of enjoyment in the essence of Taipei, key food and place, and security parts are the primary factor!",False,0.25,0.0,0.75,0.7183
"襄民報到.ᐟ .ᐟᐕ)ﾉ
漂亮的地方
適合和姐妹或男友一起來等夕陽🌇
IG：_o914","Xiangmin report to .ᐟᐕ .ﾉ)
Beautiful place
Suitable for the sunset with sisters or boyfriends 🌇
IG: _O914",False,0.187,0.0,0.813,0.5994
"在101旁的景觀 ，超好的。
甜品不錯吃。
服務態度很棒😍","The landscape next to 101 is super good.
Desserts are good.
The service attitude is great 很",False,0.515,0.0,0.485,0.93
"朋友的生日party辦在這裡～
包廂是透明的球形，很可愛耶！有冷氣所以還蠻舒服的
包廂有低消","Friend’s birthday party is here ~
The box is transparent spherical, very cute!There is air conditioner, so it's quite comfortable
The box is low",False,0.229,0.07,0.701,0.6955
"台北市信義區
很帥的喝酒地方🍾️
可看見最大支101 👍🏽
空中酒吧🪐🚀 …","Xinyi District, Taipei City
Very handsome drinking place ️️
You can see the maximum branch 101 大
Bar in the air ...",False,0.143,0.0,0.857,0.5413
"喜歡這裡的氛圍，讓人享受放鬆
夕陽照耀著，使人陶醉
但調酒可以再有層次一點，薯條偏硬","Like the atmosphere here, let people enjoy relaxation
The setting sun shines, making people intoxicating
However, there can be a little more layer of bartender, and the fries are stiff",False,0.252,0.0,0.748,0.8442
好喝好玩，如果想體驗半露天派對，這裡是挺讚的地方🤘🤘 …,"It's delicious, if you want to experience the semi -exposed party, this is a good place ...",False,0.444,0.054,0.502,0.8519
"景100%，看101。相較於Frank, 客層年輕一點，質感稍嫌不足。","Scene 100%, look at 101.Compared to Frank, the guest layer is a little younger, and the texture is slightly insufficient.",False,0.0,0.0,1.0,0.0
可以改名叫爛店不嗨 只有景色不錯而已,"You can rename it called a bad shop, but the scenery is good, only the scenery is good",False,0.309,0.09,0.601,0.7543
夜景佳，店員推薦的酒還不錯，自己點的Mai tai和old fashioned 不太行。,"The night scene is good, the wine recommended by the clerk is not bad. The Mai TAI or OLD FASHINED is not very good.",False,0.25,0.087,0.663,0.603
"環境的氣氛非常好很適合跟朋友來小酌聊天，也可以去認識新朋友，餐點非常好吃，老闆也很熱情！還有！
在這拍照怎麼拍都好看真的很絕！","The atmosphere of the environment is very good, very suitable for chatting with friends, you can also know new friends. The meal is very delicious, and the boss is very enthusiastic!besides!
How to take pictures here is really beautiful!",False,0.352,0.0,0.648,0.961
結帳服務員ㄧ直沒理，等了快20分鐘，現場沒什麼客人的情況下。,"The checkout waiter was unreasonable, waiting for almost 20 minutes, and there were no guests at the scene.",False,0.0,0.115,0.885,-0.296
"蘇服啦 ～  🤩
很適合三五好友來吹吹風，聽聽音樂喝一杯🥂
或是在這辦慶生趴踢都很優 ✨️💖🧚‍♀️🫰","Sufu ~ 啦
Very suitable for three or five friends to blow a blow, listen to music and drink a cup 🥂
Or are you playing here for a celebration and kicking. ✨️💖🧚‍♀️🫰",False,0.244,0.0,0.756,0.8834
風景很美，可是雞翅有臭味，朋友跟他們反應，他們卻說是香茅的味道！誇張我就是吃香茅長大的半個泰國人，我怎麼可能分不清楚是雞肉臭味還是香茅的味道呢？風景我是給滿分💯👍食物就是-101 ( 負101 分的意思）,"The scenery is beautiful, but the chicken wings have a odor. Friends responded to them, but they said it was the taste of lemongrass!I exaggerate. I am half of the Thai people who grew up. How could I not tell whether it was chicken odor or the taste of lemongrass?Scenery I give full score food-101 (negative 101 points)",False,0.097,0.107,0.796,-0.1635
真的是百萬夜景，近看101非常壯觀，食物普通，酒偏難喝😂 第一次嘗試水煙，不過也沒什麼特別就是,"It is really a million night view. It is very spectacular to see 101 recently. The food is ordinary. The wine is hard to drink. The first time I tried the water cigarette, but there was nothing special.",False,0.0,0.102,0.898,-0.4744
"帶位員工像路人一樣，被叫去帶位還一臉疑惑手足無措？現場店員比客人還多，到現場還有中年阿伯阿姨發酒瘋，還以為在什麼鄉下歡唱店。最扯的是跟店員點炸物，還點了兩次他也有聽到說好了，最後居然裝沒事（不想炸就直接不炸擺爛是怎樣？），然後開始跟同事在櫃檯盡情暢聊，說好的盡情暢飲怎麼會變成這樣呢？點無酒精飲料最後變成有酒精，員工素質也未免太高了。來爛醉不累真是開了我的眼界。
而且只要看到大實話留言，店家就會惱羞在底下回嗆大酸特酸，只會友善回覆那些他們自己想看見的留言，真是會笑死。
然後不要一直硬凹自己服務沒有不周的事實，客人留言了就去改善，不用一直花時間在留言詆毀客人幫自己狡辯，難道非得戴著密錄器去你們店內消費？","Like passers -by, the employees are called to bring their positions and are at a loss?There were more shoppers at the scene than guests. At the scene, Aunt Aber was mad at the scene, and thought it was a rural singing shop.The most tipped is to order the fried object with the clerk. He also ordered twice and he heard it. In the end, he didn't even have a thing (what would happen if you don't want to fry?), And then began to chat with colleagues at the counter. How can you drink it well? How can you drink it like this?Lian -no alcoholic beverages become alcohol, and the quality of employees is too high.It's my eyes to get drunk and not tired.
And as long as you see a message from Da Shi, the store will be ashamed to return to the big acid, and only will be friendly to reply to the messages they want to see, which will really laugh.
Then don't keep the fact that it is not involved in the fact that it is not available. The guests leave a message to improve. Do n’t spend time to slander the guests to help themselves. Do you have to wear a secret recorder to spend in your store?",False,0.105,0.048,0.848,0.9237
我愛這裡的歌單！,I love the song list here!,False,0.473,0.0,0.527,0.6696
"從早上到晚上 看夕陽看夜景
信義區最美view
101 第一排跨年最佳好地方💗
調酒好喝 食物好吃 讚讚👍🏻","Watch the sunset from morning to night to watch the night view
The most beautiful view in Xinyi District
101 The best place in the first row of New Year's Eve 💗
Blooming delicious food is delicious and praise 食",False,0.427,0.0,0.573,0.9783
可以拍到101、調酒好喝💞酸酸甜甜🥰炸物普普~,"You can take 101, bartender delicious, sour, sweet and sweet 🥰 🥰 🥰 🥰 🥰 🥰 🥰 🥰 🥰 🥰 🥰 🥰 🥰 ~",False,0.69,0.0,0.31,0.9987
"調酒比意象中的還好喝！！
通常這種型態的店調酒都普普不然就不好
但爛醉有顧到調酒的部分👍🏽 …","Blooming is better than the image!Intersection
Usually this type of shop adjustment is not good, otherwise it is not good
But the drunk part of the bartending part ...",False,0.058,0.201,0.741,-0.5924
"看101位置很好
酒也蠻好喝的（當時是吧台特調）
價格中高，聯名餐點好吃😋","Look at the 101 position very good
The wine is also pretty delicious (at that time, it was special tone)
The price is high, the joint meal is delicious 😋",False,0.379,0.0,0.621,0.9476
體驗真的很爛啊 等了快兩個小時的餐點 啊廚房有問題跟sing go合作是不能協調好嗎？為什麼餐點需要客人親自去問才給啊？是我們服務你們還是？都冷掉請問那個餐點到底是放了多久？水晶餃超爆小三顆160 綠茶跟紅茶都沒什麼味道感覺成本大概20？然後賣180&200 超不合理 飲料甚至等了30分鐘 服務態度也很差啊跟你們反映還有空嬉皮笑臉 連退錢都要等 在這邊畫了三個小時全部都在等 整個餐廳得人都在等沒有任何一個服務員有做事 還說人手不足 我看一堆店員在吧檯那邊不知道在幹嘛還可以不上菜。要個杯子到最後我們退費也沒有給 不知道怎麼了欸～QQ,"The experience is really bad. Wait for a meal for almost two hours. If you have any questions about the kitchen, can you not coordinate with Sing Go?Why do I need to ask the guests in person to give it?Are we serving you or?How long did the meal have been cold?Crystal dumplings are ultra -explosive small three 160 green tea and black tea.Then sell 180 & 200 unreasonable drinks or even wait for 30 minutes to have a poor service attitude. The service attitude is very poor. I reflect you and the empty hippie smiley face. Even if the money is refunded here, you have to wait for three hours. Without any waiter, he said that he was insufficient. I saw a bunch of clerks on the bar. I didn't know why they could not cook.I want a cup to the end, we have no refund, I don’t know what's wrong 欸 ~ QQ",False,0.016,0.145,0.84,-0.9643
酒不怎樣，問了服務生也對酒品不了解，這點很瞎，就是環境不錯。,"The wine is not so good. I asked the waiter and did not know the wine. This was very blind, but the environment was good.",False,0.129,0.134,0.737,0.2118
環境超好！調酒師服務也超好😘😘 …,The environment is super good!The bartender service is also super good ...,False,0.55,0.0,0.45,0.8999
"睽違三年再次光顧
整個場地燈光紅通通
完全沒辦法拍照
露天酒吧就是想拍美照🥲🥲🥲
喇叭放太大聲要聊天很吃力
酒普通
炸物拼盤每個都乾乾扁扁
有一個還幾乎都只有麵皮
研究到最後竟然是炸魚🤣
服務還可以","Cutting again in three years
The entire venue lights red
There is no way to take pictures
The open -air bar just wants to take a beautiful photo 🥲🥲🥲
It's hard to chat with the speaker too loudly
Alcohol
Every dry and flat -flat frying platter
There is almost all one with noodles
In the end, it turned out to be fried fish 研究
Serving",False,0.056,0.073,0.871,0.2023
不專業、貴、好奇怎麼有辦法撐到現在,"Unprofessional, expensive, curious how can there be ways to support it now",False,0.289,0.191,0.52,0.1779
"我給這家店的服務態度六顆星
這是多出來的那一顆

來這邊有種被羞辱的感覺
2023/12/28晚上來訪
有位高瘦的男店員站櫃檯（臉頰肉肉的）態度超跩
一進門就擺著一張臭臉
好像我欠他錢一樣= =
話也說的不清不楚
感受很差 整個興致都被澆熄
員工訓練真的要再加強","I have a service attitude of this store six stars
This is the extra one

Come here, there is a feeling of being humiliated
2023/12/28 Visit in the evening
There is a tall male clerk station counter (cheese meat and flesh) attitude is super 跩
As soon as I entered the door, there was a stinky face
As if I owe him money ==
It's unclear if you say it
Feeling is very poor, the whole interest is extinguished
Employee training really needs to be strengthened",False,0.127,0.103,0.77,0.3415
體驗真的很爛 從一開始進去點餐到到餐時間總共要等1個半小時？重點是還是我們去問餐點才上菜的 就算當天廚房沒開也該給出很好的餐點吧每個人抵銷要$500欸有問題嗎？隨便敷衍一個感覺我自己氣炸就可以的炸物拼盤來敷衍 飲品也超爛 梔子花綠茶一杯要$180喝起來完全喝不出什麼特別還不如自己去便利商店買罐裝飲料 蘋果紅茶$200喝起來跟開水一樣完全沒味道 服務態度超差 水晶蝦餃三顆$130是怎樣超難吃還沒有附醬 我還不如去吃鼎泰豐 想要退費的時候服務員整個人態度超差還在偷笑 有些的還站在後面不知道在幹嘛像木頭一樣以為在跟我玩木頭人嗎？退費等超久大概半小時 總之我來這裡不知道要幹嘛 就是一直在浪費時間 建議不要來,"The experience is really bad from the beginning to order to the meal time for a total of 1 and a half hours?The point is that we can ask meals before serving. Even if the kitchen did not open that day, it should give a good meal. Is there any problem with each person to offset it?Just perfunctory a frying platter that feels qi to fry to perfunctory drinks and super rotten gardenia green tea. One cup is $ 180. Like Kaishui, it is completely unsightly. The attitude is super poor. The three $ 130 of the crystal shrimp dumplings is superb. I ’m not as good as it’ s. I ’m better to eat Ding Taifeng. Standing behind, don't you know why he was playing with a wooden man like a wood?The refund is about half an hour. In short, I don’t know what to do here. I have been wasting time.",False,0.137,0.106,0.757,0.7744
環境舒適酒也好喝！推推,Environment comfortable wine is also good!Push,False,0.418,0.0,0.582,0.5562
好好玩👍剛好碰到活動，店員也都很熱情招呼🫶 …,"It's so fun. I just met the event, and the clerk was very enthusiastic.",False,0.371,0.0,0.629,0.7956
"景色很漂亮，調酒也好喝，
傍晚來可以吹吹晚風喝喝酒，很舒服","The scenery is very beautiful, and the bartender is also delicious,
You can blow the evening wind and drink in the evening, it's very comfortable",False,0.343,0.0,0.657,0.9097
"好玩有趣的地方
晚上101的夜景超美的
慶生聚會的好地方","Fun and interesting place
The night view of 101 is super beautiful
A good place to celebrate the birthday party",False,0.64,0.0,0.36,0.9723
"跟前面幾位一樣 開開心心很期待的來結果氣到不行的走
體驗有夠差
東西上的慢 難吃難喝
不管是餐點還是退錢都要一直在等～等～等～～～～
希望你們的廚房趕快開喔！不要再依賴樓下了啦～這樣才不會再發生一整層一堆客人的和我們一樣不爽到退錢走人😘要加油！不會再來了❤️❤️","Just like the previous one, I was very happy to look forward to it, and I was so angry that I couldn't go.
The experience is poor enough
Slowly and difficult to drink on things
Whether it is meals or refund, I have to wait ~ wait ~~~~
I hope your kitchen will open it quickly!Don't rely on it downstairs ~ This will not happen that a whole layer of guests will not happen again.I won't come again ❤️ ❤️️",False,0.098,0.106,0.796,-0.1877
環境簡陋 服務一般 喝到一半還有一隻老鼠跑出來嚇人… 給一顆是因為酒還不錯ㄏ^_^,The environmental simple service generally drinks half of the drink and a mouse runs out of scary ... It is not bad because the wine is not bad^_^,False,0.168,0.094,0.737,0.3612
"很愛爛醉 平常也會來 跨年也在這！
氣氛佳 超愛這裡❤️ 很推","I love drunk and I usually come to New Year's Eve!
The atmosphere is good here ❤️ Very pushing",False,0.276,0.09,0.635,0.7177
景色很美，可以看到很清楚的101。而酒算是妹酒，喜歡的人會喜歡！至於炸物的部分真的有待加強，不知道是不是炸太久之類的，吃起來都偏乾😢,"The scenery is beautiful, you can see very clear 101.And wine is a sister wine, people who like it will like it!As for the frying part, it really needs to be strengthened. I don’t know if it ’s too long.",False,0.298,0.0,0.702,0.9311
"燈光景色非常好的一家
最喜歡室外區了 涼風吹襲 微醺酒杯 舒暢","The lights of the lights are very good
I like the outdoor area, the cool breeze blows the micro -wine glass comfortable",False,0.391,0.0,0.609,0.8899
開放式的空間不會有壓迫感,Open space will not have a sense of oppression,False,0.0,0.0,1.0,0.0
"每次來這裡都感覺非常愜意🤭
氛圍超棒 …","Every time I come here, I feel very comfortable 每
The atmosphere is great ...",False,0.372,0.0,0.628,0.8268
很適合跟朋友來小酌，而且很喜歡這邊的view，整體來說就是chill chill 的🤭比較可惜的是當天去是平日，沒有遇到DJ ，但依然期待下次去可以玩得更開心🤩🤩 …,"It is very suitable for friends with friends, and I like the view here very much. Overall is the chill chill. Unfortunately, it is on weekdays that day. 🤩 🤩 ...",False,0.234,0.063,0.704,0.7624
五顆星都是給bobo的 服務超好！另一個服務生直接把歌單推掉不知道什麼意思？建議：多放點英文歌🍺,Five stars are super good for BOBO's service!Another waiter directly pushed the song list and did not know what it meant?Suggestion: Put more English songs 放,False,0.228,0.0,0.772,0.7959
"那天跟朋友去玩，有一位綁馬尾的小姐姐服務超棒；調酒不會到特別貴味道也都好喝而且速度快；現場DJ的互動很高很有趣。

在包廂喝完再到戶外拍照，外面的景真的是很好拍，位置得天獨厚的阿。","I went to play with my friends that day. A young lady tied to a ponytail was superb; the bartender would not be particularly expensive and it was delicious and fast; the interaction of DJs at the scene was very high and interesting.

After drinking in the box, I took a picture outdoors. The scenery outside was really good, and the location was unique.",False,0.251,0.0,0.749,0.961
體驗真的極爛 等了一個半小時給不出餐點 就算是廚房問題跟其他店家配合 是否不需要查明清楚出餐狀況 餐點還是向服務員詢問後才給出來的 親自拿餐還收取服務費 工作人員問了什麼也不知道 一問三不知 只會呆站在那邊 也不會前來詢問客人 我不懂 感受極差誒 態度也感受不到歉意 只會說不好意思 真的是該不好意思 食物還是涼的最後退錢速度也很慢 一直等 到底要等多久 反正原本是期待已久的餐廳 現在完全不會想再來謝謝😊 …,"The experience is really bad and waited for an hour and a half to give me a meal. Even if the kitchen problem is cooperated with other stores whether you do not need to find out whether the meals are clear or whether the meal is asked to ask the waiter before he will get the meal in person and charge the service fee The staff asked what I didn't know if I didn't know that I would only stand there, but I wouldn't come to ask the guests. I don’t know how bad. It ’s still cool at the end of the return. I’ m also very slow to wait. How long does it take to wait?",False,0.037,0.071,0.892,-0.6424
"基底調酒跟喝水一樣，沒味道⋯

坐在位子上已經喝了兩杯，餐點也都吃完了
然後冒出另一個店員跟我們說選的消費方式是沒有座位的？？？是在哈囉？
只說一句「一開始店員沒跟我們解釋清楚」，一點歉意都沒有，還要我們用單點的方式達到「包廂低消」才有位子坐⋯

自己員工出錯，卻要消費者去彌補員工的錯，貴公司人員的待客之道真是讓我大開眼界，素質真的是有待加強！

原本覺得酒跟水一樣沒味道就算了，至少景還OK，但被這樣對待，給一顆星都浪費。","Base bartending is the same as drinking water.

I have drank two glasses on my seat, and the meals have been eaten.
Then another clerk told us that the consumption method of choosing is no seat?IntersectionIntersectionIs it Harbin?
Just say ""the shop clerk did not explain clearly with us at first"", there was no apology, and we needed to reach the ""box low"" in a single point.

I have made a mistake in my own employees, but consumers are required to make up for the employee's fault. The way of hospitality of your company's staff is really eye -catching. The quality is really needed to be strengthened!

I originally felt that wine was as good as water. At least the scene was OK, but wasted like this, it wasted a star.",False,0.078,0.135,0.787,-0.7583
