Original,EN,Needs Review,Positive,Negative,Neutral,Compound
"近距離整支完整的101呈現在眼前，十分震撼！天氣好除了賞月以外，連星星都看得很清楚！中秋特調很讚好喝！
餐點松露薯條大推👍無法自拔！","The complete 101 of the whole range is shocking!In addition to the moonlight, even the stars can be seen clearly!The Mid -Autumn Festival is very good!
Meal some truffle potato strips can't extricate themselves!",False,0.191,0.0,0.809,0.8206
"520爛醉之夜
讓你/妳體驗
微醺的100種方式

DRUNK PLAY 爛醉不累包廂私訊
Line📱ID:luluchen05

ATT 信義區 10樓 Drunk Play 爛醉不累","520 Drunk Night
Let you/you experience
100 kinds of way

Drunk Play drunk is not tired box private message
Line📱id: luluchen05

Drunk Play, 10th floor of ATT Xinyi District, is drunk and not tired",False,0.198,0.247,0.555,-0.3374
"景色真的很好
戶外景色好的包廂20,000
座位比較不太好坐","The scenery is really good
The box with good outdoor view 20,000
The seat is not very easy to sit",False,0.237,0.102,0.661,0.5377
進入這家酒吧，彷彿踏入了一片音樂與燈光的仙境。暖暖的燈光與微醺的音樂交織，營造出溫馨又放鬆的氛圍。友善的招待與笑容，使整個空間充滿著親切感。舒適的沙發和擁有獨特調性的裝潢，讓人彷彿沉浸在別樣的夜晚。酒吧裡彙聚了各式美酒，經驗豐富的調酒師為每位顧客調製獨特口感的飲品。這裡不僅是品味美酒的天堂，更是交流與歡樂的聚會場所。,"Entering this bar, it seems to have entered a wonderland of music and lighting.The warm light and the mighty music are intertwined, creating a warm and relaxed atmosphere.Friendly hospitality and smiles make the whole space full of intimacy.Comfortable sofas and unique decorations make people seem to be immersed in other nights.The bar brings together a variety of wines, and the experienced bartenders make unique drinks for each customer.This is not only a paradise for wine, but also a place for communication and joy.",False,0.15,0.024,0.826,0.8647
"到的時間有點早17:30左右，所以順利坐到想要的位置。
調酒好看又好喝，放鬆心情，室內室外都很好拍，聊聊天、放放炮、哈哈笑，時間很快就到了兩小時，詢問服務員加點可以續坐嗎（因為颱風天店內客人沒很多），服務員表示可以續坐到9點，立馬再點一輪美美的調酒。
服務員態度都很好哦，很認真的解說酒類協助我們點到想喝的。
相約下次來21：00場次，不限時間、無限暢飲😁😁😁

第一輪酒名：離開地球，地球很危險星際迷航，元宇宙，外加沒有酒精的飲料-
第二輪不記得了，但都很好喝哦。","The time I arrived was a bit around 17:30, so I sat smoothly to the desired position.
The bartending is beautiful and delicious, relaxed, the indoor and outdoor are very easy to shoot, chatting, showing cannons, haha ​​laughing, the time will be two hours soon, can I ask the waiter if you can continue sitting (because there are not many guests in the typhoon Tiandian) The waiter said that he could continue to sit until 9 o'clock, and immediately order another beautiful bartender.
The waiter's attitude is very good, and it is very serious to explain the wine to help us order what we want to drink.
Meet the next time at 21:00, unlimited time, unlimited drinking 😁😁😁

The first round of wine name: Leaving the earth, the earth is very dangerous to the interstellar voyage, the Yuan universe, plus drinks without alcohol-
I don't remember the second round, but they are all delicious.",False,0.166,0.028,0.805,0.9675
"氣氛超High、調酒超好喝、工作人員服務專業體面、環境整潔，難得的是，廁所超乾淨，清潔人員長駐在旁打掃，辛苦了🥰
推薦大家到場放鬆身心，感受不凡😘","The atmosphere is super high, the bartending is super good, the staff service is decent and the environment is neat. It is rare that the toilet is super clean.
Recommend everyone to relax and feel extraordinary 😘",False,0.479,0.0,0.521,0.9808
"💟【梵靈乾坤】二人組的藝術行動~2024/01/05

能一次跟多位許久不見的藝術家朋友一起參加藝術未來畫展的party非常難得也開心
活動精彩
走秀很有特色
謝謝主辦單位的用心
謝謝辛苦的工作人員","坤 [Brahma Ling Qiankun] The art action of the two -person group ~ 2024/01/05

It is very rare and happy to be able to participate in the art Future Painting Exhibition with a number of artists and friends who have long been seen in the arts exhibition at a time
Exciting
The show is very distinctive
Thank you for the intention of the organizer
Thank you for your hard work",False,0.207,0.017,0.775,0.9376
那天下雨 地板是濕的 所以外面沒有開放位子 也是平常日沒什麼人正常也沒活動 氛圍偏無聊，食物味道普通到不行 這邊食物真心不推 又很少東西 ，牛肉麵超難吃 肉還行 麵整個一團口感極差，炸三小拼盤也是味道普通蠻大份，調酒算還可以 菜單上都沒有食物和調酒照片可以看 菜單用掃描的 然後在雲端上看菜單，服務態度不錯 就是那個員工服會讓人分不清 哪個是員工跟客人 都黑黑的，最大優點就是靠101超近,"The rainy floor was wet that day, so there is no open seat outside. It is usually normally normally and no atmosphere. The food taste is normal. The whole group of mouth is very poor, and the three small platter of fried three small platter is also tasteless. There is no food and alcohol photos on the menu. You can see the menu with scanning. Employee service will make people distinguish between which employees and guests are black and black, the biggest advantage is that 101 is nearly nearly",False,0.021,0.12,0.86,-0.8204
"平日沒有活動真的超級無聊
員工比客人還多
員工也是各過各的
整體氛圍不好
買了暢飲券，有限定酒單，不好喝也完全不想再喝
使用暢飲券只能坐吧臺區
要做戶外區的話，一個座位區的低消起跳是$5000，建議多一點人一起分
炸物表現也普普通通
唯一賣點是有101的景

若要吸引人潮，還是要用對方式，不然客人不會想要再訪。","There is no activity on weekdays, it's really boring
There are more employees than guests
Employees are also different
The overall atmosphere is not good
I bought a drinking coupon, a limited order, and I didn't want to drink it at all if it was not delicious.
You can only sit on the bar area with Changlin Voucher
If you want to do an outdoor area, the low -rise and jump of the seat area is $ 5000. It is recommended to divide it together.
Fried objects are also ordinary
The only selling point is that there are 101 scenes

If you want to attract people, you still have to use the right way, otherwise guests will not want to visit again.",False,0.052,0.125,0.824,-0.829
"2023/01/07 17:30，低銷$500/人，有另加一成服務費，景緻很美，能看到101夜景，裝潢氛圍很時尚，戶外有暖氣跟遮雨棚，滿推薦
半筋半肉牛肉麵$350：肉質尚可，麵條Q彈，湯頭略鹹
炸物拼盤（鹹酥雞、洋蔥圈、薯條）$580：酥脆好吃，必點
熱拿鐵$200：不會苦澀，咖啡味很香
玫瑰熱拿鐵$200：淡淡玫瑰味，拿鐵滑順香濃
燦爛蘿莉$300：酸甜順口","2023/01/07 17:30, low sales of $ 500/person, there is another one -dollar service fee, the scenery is beautiful, you can see the 101 night view, the decoration atmosphere is very fashionable, there is heating and a shed outdoor outdoors, it is recommended to be full
Semi -gluten, half -beef beef noodles $ 350: meat quality is acceptable, noodles Q bomb, soup is slightly salty
Fried objects (salty crispy chicken, onion ring, fries) $ 580: crispy and delicious, must order
Hot latte $ 200: It won't be bitter, coffee flavor is very fragrant
Rose hot latte $ 200: light rose flavor, take iron smooth and smooth fragrance
Lily $ 300: Sweet and Sour smooth mouth",False,0.133,0.041,0.826,0.8941
氣氛好好，喜愛Sky Bar的與超愛拍照打卡你們可以來喲拍101夜景的好地方，可惜這貴桑桑的牛肉麵讓我們等了1小時，下次一定讓老闆再請我一次,"The atmosphere is good. If you love Sky Bar and take pictures with super love, you can come to take a good place for 101 night views. Unfortunately, this Guisang's beef noodles let us wait for 1 hour. Next time, let the boss invite me to ask me again.",False,0.307,0.037,0.655,0.9538
"景：非週末來，戶外的位置可以看到整棟101，雖然不算高，但還是可以遠眺台北夜景。
食物：牛肉麵是真心好吃。但那天廚房不知道在炸物出了什麼問題，洋蔥圈整個炸黑，點了兩份炸櫛瓜卻等了一個多小時，等到服務人員自己也無言。
煙酒：水煙我覺得還ok。調酒普通，真的蠻見仁見智的，後來乾脆直接開威士忌和紅酒。
服務：還可以，服務我們那一桌的男生，給五星。但那個櫛瓜真的太久了，想取消也不行。
綜合：天氣好的平日，有時間會再去。","Scenery: In the weekend, the entire 101st is seen in the outdoor location. Although it is not high, you can still overlook the night view of Taipei.
Food: Beef noodles are really delicious.But that day the kitchen didn't know what had problems in the fried objects. The onion circle fried and black, and I ordered two fried melons for more than an hour.
Tobacco and alcohol: I think it's OK.The bartender is ordinary, and it is really good. Later, he simply opened whiskey and wine.
Services: Okay, to serve our table for five stars.But that long gourd is really too long, it can't be canceled.
Comprehensive: The weather is good on weekdays, and you will go again when you have time.",False,0.062,0.035,0.903,0.5504
"之前都晚上來蹦迪或小酌。
特定挑了週末下午來訪，白天真的巨好拍照，推薦給愛拍照的朋友，室內戶外都好拍，超近距離拍101。
下午時間食物選擇並不多，調酒和飲品正常供應。大推冰淇淋！焦糖布丁冰淇淋 $120 巨好吃！點起來！
低消大人$550/人 小孩$220
音樂很chill，下午時段人少挺舒服的。","I came to bump or drink at night.
After a specific weekend afternoon visit, I really take pictures during the day. I recommend it to friends who love to take pictures. The indoor and outdoor are easy to take.
There are not many food choices in the afternoon, and the normal supply of bartending and drinking.Big ice cream!Caramel pudding ice cream $ 120 is delicious!Click it!
Low eliminating adults $ 550/child child $ 220
The music is very chill, and there are fewer people in the afternoon.",False,0.139,0.021,0.84,0.9095
"🙌🏻真的很chill的地方，很適合認識朋友跟微醺3 chill。這次是因為Solana hacker house的side event才有機會來，之前想來的時候，都訂不到，有一陣子甚至不在信義區。終於來一窺究竟！

🌍很適合朋友一起來，或是不是那麼熟的朋友一起來，在Drunk play享受爛醉不累的氣氛！
也很適合在這裡求婚！
食物不錯！酒也還行，重點是氣氛佳！
DJ的歌也很有水準！","L l is really a place where it is very suitable for knowing friends and Weiyi 3 Chill.This time it was because the Side Event of Solana Hacker House had the opportunity to come. When I thought about it before, I couldn't order it, and it was not even in Xinyi District for a while.Finally glance!

来 It is very suitable for friends to come together, or friends who are not so familiar, enjoy the drunk atmosphere in Drunk Play!
It is also very suitable to propose here!
Good food!The wine is OK, the point is that the atmosphere is good!
DJ's song is also very standard!",False,0.217,0.058,0.725,0.9676
適合喝酒近距觀賞101,Suitable for drinking close to watch 101,False,0.0,0.0,1.0,0.0
"好險當天沒下雨🥺
受疫情影響週六其實沒有很多人～
剛好可以坐包廂😍
View很美很好拍
酒都是他們家特調
我和朋友都蠻喜歡！🥰","No rain on the day of good danger 没 没 没 没
Affected by the epidemic on Saturday, there are not many people ~
You can just take the box 坐
View is beautiful and very good to shoot
The wine is their special tune
My friends and I like it!Bleak",False,0.268,0.142,0.59,0.8664
"環境很好，氣氛及格調上也很棒
現場服務員及調酒師也非常親切
跟朋友想找個地方觀賞台北夜景+喝酒
我們的首選總是喜歡來這👍🏻

到了週末或連續假期
店家還會不定時舉辦主題活動
會有專業舞者跟大家互動 超有趣🙌🏻
現場還有專業的DJ在店裡演奏音樂!!!
是我推薦給身邊朋友信義派對的首選","The environment is very good, and the atmosphere and style are also great
On -site waiters and bartender are also very kind
I want to find a place with friends to watch Taipei night scene+drink
Our preferred always likes here 总

By weekend or consecutive holiday
The store will also hold the theme activities from time to time
There will be professional dancers interacting with you are super interesting 🙌🏻
There are also professional DJs on the scene to play music in the store !!!
I recommend the first choice for my friend Xinyi parties around me",False,0.309,0.0,0.691,0.9894
"時隔四年又來了～～

國語作業簿X探探
活動辦得讚！","After four years, I came again ~~

Mandarin workbook X exploration
The event is praised!",False,0.293,0.0,0.707,0.6588
"景很美！在這裡看101超漂亮
平日去人不多可以舒服喝酒
但調酒比較普通
店員會來詢問酒有沒有地方要調整
生日有招待一杯shot

這個景讓我不知不覺喝了五個小時
有喜歡有推","The scenery is beautiful!See here 101 super beautiful
There are not many people who go to it on weekdays to drink comfortably
But bartending is more ordinary
The clerk will come to ask if there is any place to adjust the wine
There is a cup of shot on birthday

This scene made me unknowingly drink for five hours
I like to push",False,0.149,0.0,0.851,0.8534
"雖然今天來下雨～沒辦法戶外拍照～不過內用的感覺也還ok~ （還是建議提早預約，才有位子）
起士蛋糕、炸薯條、夢幻海灣、奶蓋厚烏龍CP值不錯～","Although it is raining today ~ I can't take pictures outdoors ~ However, the feeling of internal use is still OK ~ (It is recommended to make an appointment early before you have a seat)
Clerpan cakes, french fries, fantasy bays, and milk cover thick oolong CP value is good ~",False,0.2,0.0,0.8,0.8602
"很適合小酌一杯的地方，氣氛很不錯
朋友、情侶都可以相約來
去的時候當晚沒有太多人還蠻舒適的

服務： 服務員很令人滿意，有耐心，態度我都覺得非常的滿意，因為服務態度良好而覺得下次可以再來。

食品： 調酒個人覺得味道普通，本人沒有特愛飲酒可能覺得還好，只有少數幾杯覺得好喝，但是炸物、牛肉麵蠻不錯的可以點。（記得好像是一定要點酒然後再加食物）

環境： 不會有明顯的菸味，除了在走進店裡的樓梯間會聞到，當天都沒有再聞到，我想也是因為在戶外的緣故，廁所也是整潔可以的。","It's very suitable for a drink, the atmosphere is very good
Friends and couples can meet
When I went there, there were not many people who were quite comfortable that night

Services: The waiter is very satisfactory, patient, and I feel very satisfied with attitude, because the service attitude is good, I feel that I can come again next time.

Food: I feel that it tastes ordinary. I do n’t think it ’s okay to drink alcohol. There are only a few cups that feel delicious, but fried and beef noodles are pretty good.(Remember it seems that you must order wine and then add food)

Environment: There will be no obvious smell of smoke. Except for the stairwells in the store, I will smell it again. I did n’t smell it again that day. I think it ’s because of the outdoor. The toilet is also clean.",False,0.148,0.017,0.835,0.954
"餐點選擇有點少
調酒沒什麼味道⋯⋯但不難喝～
不過是個可以坐很久大聊特聊的地方👍
也適合帶想看101的朋友一起來拍拍照👍","There is a little choice of meals
There is no taste of bartender ... but it's not difficult to drink ~
But it's a place where you can sit and chat for a long time 👍
It is also suitable for friends who want to see 101 to take pictures together 👍",False,0.138,0.027,0.835,0.7694
"景色美 環境舒服 很適合下午酒
東西也不錯 員工訓練需要加強
對酒單不太了解 問口味說不太出來😂 …","The beautiful environment is comfortable and suitable for the afternoon wine
Things are also good employee training needs to be strengthened
I do n’t know how to ask the wine list and I don’t know how to say 😂 ...",False,0.295,0.034,0.671,0.9413
"第一次來剛好是12/24「雪白聖誕之夜」🤍
DJ Linmix跟Natira根本絕配‼️超會炒熱氣氛！
讓很怕生的我也能放鬆的跟著音樂一起嗨起來🔥
當天還有請歌手～真的Chill到爆😭😭😭
爛醉的場地很大，眼前就是101還能看到星星✨
總之這場活動真的辦的很棒！好開心有個這麼特別又開心的聖誕節🎄❤️
是個能來看看風景、聽音樂放鬆一下的好地方🥰","The first time is just 12/24 ""Snow White Christmas Night"" 🤍
DJ Linmix and Natira are fundamentally perfect‼️ Super -fry atmosphere!
I can relax with the music with the fear of being very afraid of being born.
There are also singers that day ~ really chill to explode
The drunk venue is very large, and you can still see the stars in front of you 101
In short, this event is really great!So happy, there is such a particularly happy Christmas 🎄❤️
It's a good place to see the scenery and listen to music to relax.",False,0.201,0.045,0.753,0.965
去的時段是平日下午三點～五點，所以提供的熟食有限制，餐點多是炸物及麵食所以，比較無法評論餐點的部分，調酒的部分有小酌，覺得尚可😅，但是景色真的很好無可挑剔,"The time period is from 3 to five in the afternoon, so the cooked foods are limited. Most of the meals are fried and pasta. Therefore, it is more unable to comment on the meal. But the scenery is really good and impeccable",False,0.092,0.031,0.877,0.5913
"終於強勢回歸 ！
剛好嚐鮮了下午的氛圍
非常喜歡
有好音樂、好酒、高質感的環境 以及美食
推薦來下午一路chill到晚上","Finally returning strongly!
Just try the atmosphere of the afternoon
Like it very much
Have good music, good wine, high -quality environment and food
Recommended all the afternoon chill until the evening",False,0.321,0.0,0.679,0.8947
"週末走走，氣氛還不錯，可是怎麼沒什麼餐點，只有牛肉麵和水餃，真是可惜了
不然看它的滷味拼盤感覺還不錯","Walking on the weekend, the atmosphere is not bad, but why is there no meal? Only beef noodles and dumplings are a pity.
Otherwise, it feels good to look at its lovry platter",False,0.141,0.173,0.686,-0.0708
試營運期間還沒有餐點，但可以叫外送很不錯，調酒很好喝價格不高，百萬夜景的這樣消費覺得很棒，非常放鬆😌😌😌,"There is no meal during the trial operation, but it can be called very good delivery. The price of bartender is not high. The consumption of millions of night views is great, very relaxed.",False,0.317,0.035,0.648,0.944
如果可以帶狗就太棒了👏，上次去喝酒結果遇到活動，11點入場才知道酒水只供應到12.，有點不高興，但是去了很多次風景都美到不行，希望可以下午就開放下午茶時段,"If you can bring a dog, it is great. I encountered an event when I went to drink last time. I only learned that the wine was supplied at 11 o'clock. It was a bit unhappy, but it was so beautiful that the scenery was so beautiful. I hope that in the afternoon Open afternoon tea period",False,0.278,0.025,0.696,0.9715
每一杯調酒都超特別的🥴 印象最深刻是元宇宙！有在喝葡萄汁的感覺🍇 跟朋友聚會有放鬆到 一邊喝酒抽水煙一邊觀賞101看風景超棒噠✨,Each cup of bartender is super special. The most impressive is the Yuan universe!I feel like drinking grape juice 葡 Meet with friends to relax and drink water while watching 101 to watch the scenery is great,False,0.435,0.0,0.565,0.9722
"跟閨蜜來慶生訂19:00的很幸運還能看到夕陽到晚上夜景🌃店員推薦的特殊版長島冰茶也很好喝我很喜歡，會為了這杯再來！
7月來的所以戶外區還是很熱，但輕鬆氛圍跟信義區夜景還是很棒，入秋後會再來🍹
（然後薯條超好吃） …","Fortunately, we can celebrate your birthday with your girlfriend. You can also see the special edition of the special edition of the long island ice tea recommended by the sunset to the night scene at night. I also like it. I will come again for this cup!
The outdoor area is still very hot in July, but the relaxed atmosphere and the night view of Xinyi District are still great. After autumn, I will come again.
(Then the fries are super delicious) ...",False,0.287,0.0,0.713,0.9832
"拍過不少年101跨年煙火，
這裡的位置應該是最佳選擇。
再加上天氣不好吹東北季風，
只有受一點煙的影響。
如果是好天氣，一定超級美！

缺點就是人超多
從1樓等電梯也等超久
好不容易差10分鐘倒數，
到了樓上人多到連站的位置都快沒有，
建議：
（票可以賣貴但人數還是要控管一下）
跨年夜的吧台人手也是不夠
點一杯酒也是要等超級的久⋯","I have taken a lot of New Year's Eve fireworks,
The position here should be the best choice.
In addition, the weather is not good to blow the Northeast monsoon,
Only affected by a little cigarette.
If it is a good weather, it must be super beautiful!

The disadvantage is that there are so many people
The elevator from the first floor is also waiting for a long time
After finally counting the countdown for 10 minutes,
There are more people upstairs so that there are no more positions on the station.
suggestion:
(Tickets can be sold expensive but the number of people still controls it)
The handwriting of the New Year's Eve is not enough
I also have to wait for a long time to wait for a long time.",False,0.08,0.047,0.873,0.6897
"Mostly ok cocktails, some food available (recommend wings!) but everyone here is for the view and the vibes, which are unbeatable. Come during the golden hour for a stunning view of 101!

調酒跟吃的還OK，主要是氣氛跟view很好！建議早點來看夕陽🌇","Mostly OK Cocktails, SOME FOOD Available (Recommend Wings!) But Every is for the view and the vibes, which are during the Golden Hour FOR nning view of 101!

The bartending and eating are also OK, mainly because the atmosphere is very good with View!It is recommended to look at the sunset earlier 来",False,0.184,0.0,0.816,0.8774
3月5號參加期待已久位的天選音樂會～由 麗絲 Liz  莉卡 Licca  溫盈鈞 江晴  高雨璿 等國樂才女一起舉辦的創新國樂音樂會～國樂新體驗與舞蹈和各國歌曲的巧妙結合讓人耳目一新聆聽不同以往的音樂饗宴～當天環境風景很美就在101旁的 Drunk Play 爛醉不累  演出結束剛好迎接美麗的夕陽 搭配上當天WAT 好喝的雞尾酒氣泡飲～新推出的草莓口味酸酸甜甜草莓香味濃郁很好喝～,"Participated in the long -awaited concert on March 5 ~ The innovative national music concerts organized by the national music of the national music with the talents of the national music and the cleverness of the national music and the cleverness of the national music and the talents of the talents of the talented daughter -in -law and other national music were organized by Liz Licca Licca. Combining people's eyes refreshing listening to different previous music feasts ~ The environmental scenery that day is beautiful, and Drunk Play beside 101 is drunk. Sour sour strawberry fragrance is rich and delicious ~",False,0.276,0.046,0.678,0.9842
"View超好，很適合跨年去看101，
聖誕節去是特別菜單，調酒蠻特別的，DJ、藝人都請的不錯音樂好聽，店員人也都很好，還一起喝酒🥂但可能那天太忙上餐速度偏慢 但整體感受還不錯👍","View is super good, it is very suitable for New Year's Eve to see 101,
It is a special menu for Christmas. The bartending is quite special. DJs and artists are good for good music. The clerks are also very good. They also drink together but may be too busy to go to the meal that day.",False,0.222,0.0,0.778,0.8818
下午和晚氛圍截然不同，各有各的好。在這裡放鬆又愉快，有空會再回訪,"The atmosphere in the afternoon and the evening atmosphere is completely different, each with its own good.Relax and enjoy here, I will return to visit if I have time",False,0.103,0.0,0.897,0.4939
"調酒非常好喝
而且景色真的很美
消費算是比較高的","Blooming is very delicious
And the scenery is really beautiful
Consumption is relatively high",False,0.406,0.0,0.594,0.8476
使用Google 有點難找、進到店裡有點小失望、跟網上看到的不一樣、應該是有改過裝潢風格了,"It's a bit difficult to find using Google, it's a little disappointed in entering the store, and different from what you see on the Internet. It should have changed the decoration style.",False,0.0,0.15,0.85,-0.6494
