Original,EN,Needs Review,Positive,Negative,Neutral,Compound
"每年都跟著官方公布的遊戲規則走
但每次作業流程都爛到誇張

去年公布可以提前領票結果到現場等很久完全沒工作人員 電話也打不通
只好打到爛醉咖啡請店員幫忙聯繫
後來的票卷是連同手環跟票價一起寄出

今年一樣按照官方公布的時間先去取票 結果只有給我票卷 告知我手環跨年當天再至一樓領取
公布說提前領票就不用跟現場一起排隊
然後我先提前取票了還是一樣跟現場排同一個隊伍等拿手環 排了一個小時才進場
那請問我為什麼需要提前取票？

結果12/30先至現場取票的朋友有拿到手環跟票卷
所以是我在公布可以取票的時間領取但手環還沒製作完成所以只能先給我票卷？
都是特地跑一趟取票我不能理解為什麼每年按照遊戲規則走都會有這種問題

下次不會再去了","Follow the official game rules every year
But each job process is rotten to exaggerated

I announced last year that I could get the ticket in advance to the scene and wait for a long time without a staff phone call at all.
I had to hit the drunk coffee, please help the clerk to contact
The subsequent ticket roll was sent with the fare with the fare

This year, follow the official announcement time to pick up the ticket results. Only the ticket roll is told to the hand ring to get the day on the day of the new year to get it to the first floor
The announcement said that you don't need to line up with the scene in advance
Then I took the ticket in advance or was the same as the same team on the scene and waited for an hour to enter the field before entering the field.
So why do I need to pick up tickets in advance?

Results 12/30 Friends who pick up tickets to the scene first get the bracelet and ticket roll
So I will receive the time when I can pick up the ticket, but the bracelet has not been produced, so I can only give me a ticket first?
I have run a special ticket to pick up tickets. I can’t understand why there will be such a problem in accordance with the rules of the game every year.

I won't go again next time",False,0.07,0.047,0.883,0.7998
"辦生日Party的好場所
旁邊有101可以看
幫朋友慶祝生日好開心能包這個場地","A good place for birthday party
There are 101 next to it to watch
Help a friend to celebrate your birthday, happy and happy, you can package this venue",False,0.507,0.0,0.493,0.9705
氣氛很好缺點目前只提供炸物、沒有餐點可以吃,"The atmosphere is very good disadvantages. At present, only fried objects are available, no meals can be eaten",False,0.137,0.222,0.642,-0.2466
風景很好氣氛很棒,The scenery is very good atmosphere and great,False,0.549,0.0,0.451,0.807
"現場大約五組，餐點卻等了將近將近一小時，上來的餐點（牛肉麵）也不是熱的（微溫偏涼）口味偏鹹。鬆餅吃到後面非常的膩。無提供水。
風景部分只有101可看。
沒什麼服務（有收服務費），態度有待加強。","There were about five groups at the scene, but the meal waited for nearly an hour. The meal (beef noodles) came up is not hot (slightly warm and cool).The muffins are very greasy after eating.No water.
The landscape part is only 101 to see.
There is no service (there is a service fee), and the attitude needs to be strengthened.",False,0.057,0.069,0.875,0.0583
聖誕節活動很讓我驚艷！中間有個橋段聖誕女孩跳舞還隨機發禮物活動過程中玩的很開心！夜晚的101夜景超美真的是百萬夜景❤️,"Christmas activities are amazing!There is a bridge in the middle of the Christmas girl dancing and a random gift event!The night scene of the night is super beautiful, it is really a million night view ❤️",False,0.249,0.0,0.751,0.9059
"服務態度差，員工也沒有訓練，酒類無能力簡單介紹，點了炸物結果根本沒有送單讓我們在那邊空等
酒淡特調單調，音樂也會忽大忽小聲。整間的特色大概就是風景不錯，其餘完全不推","The service attitude is poor, and the employees are not trained. The alcohol is unable to introduce it briefly. The result of the fried fried material has not been sent to let us empty there.
The wine is specially tuned, and the music will whisper.The entire characteristics are probably the scenery is good, and the rest will not be pushed at all",False,0.043,0.073,0.883,-0.25
"第一次吃到酒吧食物是難吃的
炸物拼盤的薯條甚至是冷的==？
酒類和服務普普通通 沒特別好也沒特別差
夏天坐包廂（有透明圓頂罩子的位置）不通風有點熱
音樂放超大聲 不適合聊天","It is difficult to eat food for the first time to eat bar food
The fries of the frying platter are even cold ==?
The wine and service are generally not particularly good or not particularly bad
It is a bit hot in summer to sit in the box (the position with a transparent rounded cover) without ventilation
Music is super loud and not suitable for chatting",False,0.093,0.068,0.839,0.4299
"燈光美氣氛佳
欣賞101的好地方","Beautiful light atmosphere
Appreciate the good place of 101",False,0.613,0.0,0.387,0.8591
"很chill的地方，當天下雨還能幫我們拍很氣派的照片，還貼心符合我的需求讓我們能夠在包廂式比較隱密的空間聚會！
下次還會想去，希望是好天氣能在戶外","It is very Chill. It rains that day to help us take pictures of very elegant pictures. It is also intimate that I can meet my needs in the box.
I would like to go next time, I hope it can be outdoor outdoors",False,0.223,0.0,0.777,0.8883
"超好拍照的網美景點❤️❤️
酒也不錯喝😆😆 …","The beautiful attraction of the super good photo ❤️❤️
Alcohol is also good 喝 ...",False,0.561,0.0,0.439,0.9485
"地理位置非常好、拍照非常美。如果一生來一次拍張美美的照片算是還滿值得的～
但除此之外，就沒什麼值得稱讚的（餐點品項很少、飲料也不好喝，人員服務品質更是不佳）","The geographical location is very good and the photo is very beautiful.If you take a picture of Zhang Meimei once a lifetime, it is worth it ~
But in addition, there is nothing to praise (there are few meals, the drinks are not good, and the quality of personnel service is not good)",False,0.058,0.164,0.779,-0.8204
"服務態度奇差。我們一群專業人士帶來台開會演講的知名外賓去。擋著不讓已訂位的我們進去。非常失禮。在我們前面另一對客人也被擋。
這輩子不會想再見到或聽到這店名。","The service attitude is strange.A group of professional professionals brought the well -known foreign guests who brought a meeting of the Taiwan meeting.Stop it from we who have reached in.Very rude.Another pair of guests in front of us were also blocked.
I won't want to see or hear the name of this shop in my life.",False,0.06,0.056,0.884,0.0459
接近快傍晚的時間去，又可以看到夕陽在連接到晚上很美很好拍，環境很放鬆舒適，偶爾休閒和姊妹朋友來聊天拍照都很適合，我當天點的調酒炸物也很滿意。,"As soon as it is near the evening, you can see that the sunset is very beautiful and easy to shoot at night. The environment is very relaxed and comfortable. Occasionally, leisure and sister friends come to chat and take pictures. Essence",False,0.313,0.043,0.644,0.9443
"跨年來這要三思！排隊動線超爛！在樓下等了快一小時上不去，還給包廂客人一直插隊，那買個人票是空氣嗎？插隊就算了！可以內部口徑動作一致嗎？資淺的一直一直一直帶客人插隊，後來後面排隊的人問資深的說：我有訂包廂可以先上嗎？資深的說：有訂包廂還是要排隊喔…我真的無語🙄 還有很多各種傻眼事蹟..
跨年來請三思。 …","Think about it here during the New Year!Line lines are super bad!After waiting downstairs, I can't go up for an hour, and I will keep it in line for the boxes. Is it air to buy a personal ticket?It's okay!Can the internal diameter move the same?Zi Qian has always taken the guests to cut in line. Later, the person who lined up later asked the senior to say: Do I have a box to put it on first?Senior saying: There are still a box or queue ... I really have a lot of dumbfounded deeds ..
Please think twice in the New Year.Mowing",False,0.068,0.042,0.889,0.6015
景色很美 但食物巨難吃 廚師是人才吧 連薯條炸雞如此簡單的東西都能做到讓人難以下嚥 然後店家要注意一下 可能因為露天 最近又一直下雨 一直有霉味跑出來,"The scenery is beautiful, but the food is unpalatable. The chef is a talent. Even the fried chicken such as fried chicken can make it difficult to swallow.",False,0.179,0.094,0.727,0.4404
包廂五千不貴 風景好,"The box five thousand is not expensive, the scenery is good",False,0.225,0.0,0.775,0.4404
"故意僱用最糟糕的人在門口迎接
是一個胖子
他給我的態度好像
我把他家祖宗十八代骨灰罈摔破","The worst person who deliberately hires the worst person at the door
Is a fat man
The attitude he gave me seemed to
I broke the eighteenth generation of his ancestors",False,0.0,0.282,0.718,-0.9001
"風景很美 服務態度佳
尤其是門口接待的兩個男生
包廂 消費模式都介紹的很詳細
下次還會在來♥","The landscape is very beautiful service attitude
Especially the two boys received at the door
The box consumption model is introduced in detail
Will be here next time",False,0.134,0.0,0.866,0.6361
跨年不用來了 完全不推薦^_^下雨也沒有因應措施 有包廂還要在外面排隊排到快12.才能進去 是要跨年搶錢一波再休店嗎？,The New Year's Eve does not need to be recommended at all.^_^It has no measures to have a box and lift up to 12. To enter the outside of 12. Can you get a wave of money for the New Year?,False,0.042,0.051,0.907,-0.1027
"原本想去跨年因為有其他局
所以挑選聖誕來爛醉聚會
意外好玩活動也太用心了吧❤️","Originally I wanted to go to the New Year because there are other bureaus
So choose Christmas to drunk party
Unexpected fun activities are too attentive, right? ❤️",False,0.174,0.07,0.756,0.5574
東西好吃，服務快，景觀很棒,"The things are delicious, the service is fast, and the landscape is great",False,0.415,0.0,0.585,0.8316
"皇圖霸業談笑間
不勝人生一場醉","Emperor Tu Da Yeye talks
A lifeless life",False,0.0,0.0,1.0,0.0
"服務人員素質極差 服務品質0還要服務費
帶入座位後還要客人主動去詢問menu 問了兩次後終於來了卻只丟平板在桌上 酒類只有說這邊酸那邊甜 連簡單介紹是什麼酒都不會就飄走了…","The quality of the service personnel is poor. The quality of the service is 0 and the service fee needs to be
After bringing in the seat, the guests took the initiative to ask Menu and asked me twice, but finally left the tablet, but only lost the tablet on the table. I only said that the sweetness of the sour side was briefly introduced.",False,0.06,0.07,0.87,0.0772
"這裡的服務很不錯
小菜也很好吃
而且還有美麗的觀景台可以瞭望101
是個很適合打卡欣賞風景的酒吧","The service here is very good
The side dishes are also delicious
And there are beautiful observations to look at 101
It is a bar that is very suitable for checking in the scenery",False,0.258,0.0,0.742,0.8955
"舉辦抽獎活動時，非常細心的私訊通知中獎，現場工作人員也很親切，非常值得一訪再訪的露天酒吧💕💕
氣氛好又美還能直觀101太棒惹🥰🥰 …","When holding a lottery, the very careful private message notification won the prize. The on -site staff was also very kind. It was worth visiting the open -air bar.
The atmosphere is good and beautiful, and it can be intuitive 101 too great ...",False,0.414,0.0,0.586,0.9761
台北市娛樂場地第一首選指標！服務夜景，調酒，環境衛生，空間的，完全一級棒的，外地朋友來台北市玩，大推噢！超級好玩超級棒😍❤️‍🔥❤️‍🔥,"The first choice indicator of Taipei Entertainment venues!Serving night view, bartender, environmental sanitation, space, complete first -class, friends from other places come to Taipei to play, push!Super fun and super stick ‍🔥❤️‍🔥❤️ 超",False,0.304,0.091,0.605,0.9059
很棒氣氛很好的地方拍照也很好看 會在去的🥰,Very good atmosphere and good places to take pictures are also good -looking. I will go.,False,0.409,0.0,0.591,0.8399
"整體環境空間都還不錯
抬頭就是101","The overall environmental space is not bad
Look up is 101",False,0.222,0.0,0.778,0.431
"面對101的視野很好
但是只能喝酒跟吃些簡單的下酒菜沒有提供正餐","Facing 101 vision is good
But you can only drink alcohol and eat some simple jams and do not provide meals.",False,0.154,0.0,0.846,0.3506
"可近距離看101不錯
氣氛不錯
去的時候剛好是下午又毛毛雨
不然晚上沒下雨氣氛應該會更好","You can watch 101 good at close range
The atmosphere is good
It happened to be in the afternoon when I went
Otherwise, the atmosphere of no rain at night should be better",False,0.218,0.055,0.727,0.7579
超近距離看101，下次想白天來感覺會很好拍，櫃台小姐也介紹的清楚態度也很好，會推薦給朋友👍 …,Look at 101 in the closer distance. I want to take a good picture during the day when I want to come to the day. The Miss Counter also introduces a clear attitude. I will recommend it to my friends ...,False,0.278,0.032,0.69,0.8779
跨年煙火都是煙看不太清楚，現場與粉專的示意圖質感也差距很大...櫃台人員態度超級差  但保全人很好,"The New Year's Eve fireworks are not clear to smoke, and the texture of the show on the scene is also very different ... The counter personnel attitude is super poor, but the preservation is very good.",False,0.155,0.084,0.761,0.6246
晚上來這邊小聚是不錯的選擇👍 …,Come here at night is a good choice 👍 ...,False,0.225,0.0,0.775,0.4404
這裡好棒！酒也好喝！,It's great here!The wine is also delicious!,False,0.626,0.0,0.374,0.855
"感覺還好酒普通價格不便宜
沙發位子還有很多缺只給很硬的位子","It feels okay for wine to be generally not cheap
There are still many lacks of sofa seat",False,0.101,0.0,0.899,0.2263
環境很乾淨也非常的好景色也很優美.店員服務態度 👍🏻下次會在光顧,"The environment is very clean and very good, and the color is very beautiful. The service attitude of the clerk will be patronized next time",False,0.321,0.0,0.679,0.8854
沒什麼服務....調酒也普通.在ATT裡也是蠻讓人吃驚能生存的下去...,There is no service .... Alcohol is also ordinary. It is also quite surprising in ATT that people can survive ...,False,0.101,0.093,0.805,0.0498
晚上氣氛很好 在101正前方很美👍服務生Leo 服務的很棒 一定會再去～ …,The atmosphere at night is very good. The ahead of the 101 is very beautiful.,False,0.362,0.0,0.638,0.8119
有漂亮的風景 好聽的音樂 美味的餐食及飲料🥤很放鬆☺️☺️☺️ …,There are beautiful scenery and delicious music delicious meals and drinks 🥤 ☺ ️☺️☺️ …… ...,False,0.544,0.0,0.456,0.9652
風景好，調酒很漂亮，領檯男生口條很棒！！,"The scenery is good, the bartending is very beautiful, and the boys are great!Intersection",False,0.381,0.0,0.619,0.8118
有夠無聊，就是學生店，待10分鐘就受不了走了,"It's boring enough, that is, the student shop, I can't stand it for 10 minutes",False,0.0,0.141,0.859,-0.3182
公關超沒禮貌，且要檢查兩次證件意義在哪⁉️⁉️⁉️,"The public relations are super polite, and where is the significance of the two documents ⁉️⁉️⁉️",False,0.214,0.0,0.786,0.7184
服務好、景觀讚！在這裡和朋友待了一個晚上超chill的🧡 …,"Good service, landscape praise!Here I stayed with my friends for a night that super chill ...",False,0.439,0.0,0.561,0.8805
餐點跟酒都很棒，夜景漂亮,"The meals and wine are great, the night scene is beautiful",False,0.471,0.0,0.529,0.8402
特地來台北跨年 煙火很美 但現場安管很兇 服務很爛 難怪叫爛醉 實在太爛了⋯,"Special place to come to Taipei New Year's Eve fireworks is beautiful, but the on -site security is very fierce.",False,0.303,0.0,0.697,0.7506
"景色很美
氛圍chill
傍晚來
可以同時觀賞夕陽跟夜晚的美景","The scenery is beautiful
Atmosphere chill
Coming in the evening
You can watch the sunset and the beauty of the night at the same time",False,0.251,0.0,0.749,0.8271
潘妮廣告傳播/接續推播一週五天250元/0900196971_簡訊洽詢/,Penny Advertising Communication/Continuation of 250 yuan on Friday/0900196971_Segae,False,0.0,0.0,1.0,0.0
調酒很好喝，安管也非常貼心的提醒我們注意樓梯,"The bartender is delicious, and the security tube also reminds us to pay attention to the stairs",False,0.284,0.065,0.651,0.6908
燈光好氣氛佳,Good light atmosphere is good,False,0.659,0.0,0.341,0.7003
服務態度好，離101近煙火好看，氣氛很棒推,"The service attitude is good, it looks good at 101 near the fireworks, and the atmosphere is great",False,0.398,0.0,0.602,0.872
地點很漂亮 領台也很漂亮 跨年負責樓上胖胖的安管人很好,The location is very beautiful.,False,0.512,0.0,0.488,0.6361
氣氛滿滿 讚的,Full of atmosphere,False,0.0,0.0,1.0,0.0
S2O pre party 優秀會再回顧🫶 …,"S2O Pre Party is excellent, and I will review it again ...",False,0.39,0.0,0.61,0.7506
氣氛好，價錢合理，歌好聽！,"The atmosphere is good, the price is reasonable, the song is nice!",False,0.375,0.0,0.625,0.7177
讓人覺得 繁忙的都市中  有個舒壓的地方,There is a place where people feel busy in the busy city,False,0.0,0.0,1.0,0.0
很美很愜意的地方🔆 …,The beautiful and comfortable place ...,False,0.643,0.0,0.357,0.802
氣氛100 值得推薦！,Atmosphere 100 is worth recommending!,False,0.354,0.0,0.646,0.2942
夜風涼涼，景色棒呆了～,"The night wind is cool, the scenery is sticky ~",False,0.204,0.0,0.796,0.3182
仰望101與夜空的好景點！,Look up at the good attraction of 101 and the night sky!,False,0.382,0.0,0.618,0.7345
氣氛100分～,The atmosphere is 100 points ~,False,0.0,0.0,1.0,0.0
看101煙火很近,Seeing 101 fireworks is very close,False,0.0,0.0,1.0,0.0
地方好美超級喜歡的😍,The place is so beautiful and super favorite 级,False,0.67,0.0,0.33,0.921
👍 …,👍 …,False,0.0,0.0,1.0,0.0
體驗非常棒🥰 …,Experience is great ...,False,0.577,0.0,0.423,0.6249
被趕出去了,I was kicked out,False,0.0,0.0,1.0,0.0
景很讚👍🏼 …,Jing is very good ...,False,0.444,0.0,0.556,0.4927
🥸🥸🥸,🥸🥸🥸,False,0.0,0.0,1.0,0.0
讚,praise,False,1.0,0.0,0.0,0.5574
🎉🎉🎉 …,🎉🎉🎉 …,False,0.669,0.0,0.331,0.7964
❤️❤️,❤️❤️,False,0.0,0.0,1.0,0.0
喝了「回到過去」的飲料。非常美味，果香濃鬱，頂部帶有玫瑰花香，喝一口時有一股淡淡的芳香。我們來到這裡是一個星期四的晚上。從字面上看，它已經死了。我們是唯一的一桌。沒有其他人在場，但這是一個很好的環境空間，服務速度很快。絕對地。那裡沒有人幫我們點台灣朋友的訂單。總的來說，我們一起來的人氛圍很有趣。但除此之外，它已經死了。,"Drink a ""back to the past"" drink.Very delicious, rich fruity, rose fragrance on the top, and a faint aroma when drinking a bite.We came here a Thursday night.Literally, it is dead.We are the only table.No one else is present, but this is a good environmental space, and the service speed is fast.Absolutely.No one can help us order the order of Taiwanese friends.In general, the atmosphere of the people we came together is very interesting.But in addition, it is dead.",False,0.146,0.064,0.79,0.6705
一個提供沉浸式體驗的酒吧。這個地方很寬敞，景色優美，設計很酷。飲料還可以，價格也很合理。服務速度令人滿意。,"A bar providing immersive experience.This place is spacious, beautiful, and cool.Drinks are okay, and the price is reasonable.The service speed is satisfactory.",False,0.304,0.0,0.696,0.8074
"這座城市最好的屋頂景觀之一。價格很好，飲料的品質也很好。
一邊看 101 一邊喝一杯的好地方。","One of the best roof landscapes in this city.The price is very good, and the quality of the drink is also very good.
Look at 101 and drink a good place.",False,0.333,0.0,0.667,0.9258
"週六晚上我們去了 DRUNK PLAY。他們向所有人開放了飲酒挑戰，獲勝者將獲得一瓶免費的酒。我不確定這是一個常規活動還是只是那天晚上的一個特殊場合。我們沒有參加，因為我們覺得有點太老了，但觀看很有趣。

DRUNK PLAY 的景色非常棒，可以清楚地看到台北 101。

對外國人的服務很一般，工作人員會說基本的英語。","We went to Drunk Play on Saturday night.They opened the challenge of drinking to everyone, and the winner will get a bottle of free wine.I'm not sure whether this is a regular event or just a special occasion that night.We did not participate because we felt a bit too old, but it was interesting to watch.

Drunk Play's scenery is very good, you can clearly see Taipei 101.

The service of foreigners is very average, and the staff will speak basic English.",False,0.211,0.064,0.725,0.924
"雞尾酒還不錯，但我認為來這裡的主要原因是 101 和城市的壯麗景色。我們去得很早，因為我們老了，所以沒有什麼事情發生，但它是享受這個涼爽天氣的完美屋頂酒吧。
每人最低消費 500 新台幣，這似乎是該地區的標準，但如果您只是想喝一杯，請記住這一點。","Cocktails are not bad, but I think the main reason for coming here is the magnificent scenery of 101 and the city.We went very early because we were old, so nothing happened, but it was the perfect roof bar that enjoyed this cool weather.
The minimum consumption of NT $ 500 per person seems to be the standard of the area, but if you just want to drink a drink, please remember this.",False,0.272,0.0,0.728,0.9767
"當我第一次來到這裡時，其中一位員工的態度有些重要，但是nbd，而且景色非常棒。這些飲料聽起來很花哨，但實際上有一些層次。每人500NT。如果您不想多喝一杯，大家可以分享一些食物。

第二次來這裡，只待了大約40分鐘，但這次服務很好。當我們把一些雞尾酒混合在一起時，他們很有耐心，在 iPad 上介紹了他們的飲料。他們還給了我們組裡最後兩個留下 6 個免費鏡頭的夫婦。只有那個人喝酒，他能夠喝完全部六杯，所以他們一定是真的被淡化了，但仍然是一個非常好的姿態。

我們去的時候桌子幾乎是空的，他們讓我們坐在任何地方。下雨時，氣泡下有一些漂亮的戶外桌子。裡面的酒吧燈光也很好。","When I came here for the first time, one of the employees was a bit important, but the NBD, and the scenery was great.These drinks sound fancy, but there are actually some levels.500NT per person.If you don't want to drink one more glass, you can share some food.

I came here for the second time, only about 40 minutes, but this service is good.When we mixed some cocktails together, they were very patient and introduced their drinks on the iPad.They also gave us the last two couples who left 6 free shots in the group.Only that person drinks, he can drink all six cups, so they must really be diluted, but they are still a very good posture.

When we went, the table was almost empty, and they asked us to sit anywhere.When it rains, there are some beautiful outdoor tables under the bubble.The lights inside are also very good.",False,0.156,0.018,0.826,0.9789
"口味：4.3/5
環境：4.6/5
服務：4.2/5

另一個屋頂遊樂場，你可以欣賞 101 的美景。
您會體驗到更少的擁擠體驗。
我知道在酒吧點牛肉麵聽起來很奇怪，但實際上相當不錯。除此之外你沒有太多選擇😌
。","Taste: 4.3/5
Environment: 4.6/5
Service: 4.2/5

Another roof playground, you can enjoy the beauty of 101.
You will experience less crowded experience.
I know that ordering beef noodles in the bar sounds strange, but it is actually quite good.In addition, you don't have much choice 你
Essence",False,0.09,0.028,0.882,0.4767
