Original,EN,Needs Review,Positive,Negative,Neutral,Compound
燈光美、氣氛佳，吧台很有水準，會推薦好酒，每一款都有特殊風味，適合和三五好友來，當然約會也很棒❤️,The lights are beautiful and the atmosphere is good.,False,0.493,0.0,0.507,0.7783
"泡麵好吃，刈包不錯，情人節限定甜點很棒，
調酒也好喝，
牛肉塔塔 雷🙄

有機會會再回訪的店","The instant noodles are delicious, the bag is good, the limited dessert on Valentine's Day is great,
The bartender is also delicious,
Beef Tata Lei 塔

There is a chance to return to the shop again",False,0.34,0.039,0.621,0.9382
"餐點融合原住民特色
覺得太多元素 可以再簡單一點
餐點介紹也可以再精簡一些
服務很好 很親切的介紹各種威士忌","Meal integrates Aboriginal characteristics
I think too much element can be simpler
Introduction to the meal can also be streamlined
The service is very good and kindly introduced to various whiskey",False,0.187,0.0,0.813,0.7688
"食物好吃，但份量很少，種類也不多
空間也沒有很大
但服務非常好
比較適合喝酒聊天就好

主打威士忌 &葡萄酒
漂亮的調酒不在這邊

下次想去大直店試試
原來兩邊並不一樣","The food is delicious, but the portion is very small, and there are not many types
The space is not very big
But the service is very good
It's more suitable for drinking and chatting

Subject to whiskey & wine
Beautiful bartending is not here

I want to go to the Dazhi store next time to try
It turned out to be different on both sides",False,0.159,0.018,0.823,0.9128
Whisky 品酒的好地方，餐點也很特別，一般時段應該沒提供，有機會一定要再去。,"WHISKY is a good place for wine tasting, and the meal is also very special. Generally, it should not be provided during the period. If you have a chance, you must go again.",False,0.208,0.0,0.792,0.7841
"延續後院的傳統，加上精緻的美食。

不得不說，是個適合品酒的好地方。名符其實的大人遊樂園。","Continuing the tradition of the backyard, plus exquisite food.

I have to say that it is a good place suitable for wine tasting.Actual adult amusement park.",False,0.184,0.0,0.816,0.6597
"第一次來這種威士忌酒吧
可以選威士忌、紅酒跟香檳，調酒好像比較少
坐吧台可以聽到酒的說明與建議，也可以聞香氣，感覺比後面的座位有趣
完全沒喝過的菜鳥也可以請吧檯建議款式，說明詳細認真，還可以問要怎麼喝😂
熟食表現也很驚艷，點了炸雞、蝦猴跟薯條
炸雞嫩又多汁，剝皮辣椒醬很刷嘴
蝦要配蒜頭辣椒一起吃，蠻大份的
薯條煙燻沾醬很特別，跟威士忌一起喝又是另一種味道
環境蠻舒服的","The first time I came to this whiskey bar
You can choose whiskey, red wine and champagne.
You can hear the instructions and suggestions of the wine, you can also smell the aroma, and it feels more interesting than the seat behind
Rookies that have never been drank can also ask the bar to recommend the style, explain detailed and serious, you can also ask how to drink 😂
Cooked food performance is also amazing, ordered fried chicken, shrimp monkeys and fries
The fried chicken is tender and juicy, peeling pepper sauce is very brushing
Eat the shrimp with garlic peppers, which is quite large
French fries smoked sauce is very special, drinking with whiskey is another taste
The environment is pretty comfortable",False,0.171,0.022,0.807,0.9705
"點了雞肉和牛肉套餐各一份
已經喝的滿醉了
只記得每一道都很好吃
主餐雞肉沒拍好 但還滿驚豔的
另外店員也很友善
價位的話威士忌酒吧通常都不低就是了","Ordered chicken and beef sets each
I have been drunk
I just remember that every way is delicious
The main meal chicken is not shot well but it is still amazing
In addition, the clerk is also very friendly
At the price, the whiskey bar is usually not low",False,0.239,0.051,0.709,0.9246
"食物不錯
和牛鵝肝卷真的很好吃，搭配酸甜果乾很適合，還加點了一次
牛小排也不錯
炒泡麵就是普通的炒泡麵，不過份量蠻大的
當天喝了威士忌調酒及紅酒
餐點有水準氣氛放鬆
缺點是實在太貴了
週六晚上低消$800
小鳥胃的兩人+只喝了2杯酒就要1900/人
根本不怕沒過低消啊🥲","Good food
The liver rolls of the cattle and goose are really delicious. It is very suitable with dried sour and sweet fruit.
Niu Xiaoping is also good
Fried noodles are ordinary fried noodles, but the portion is quite large
I drank whiskey and wine on the same day
The meal has a standard atmosphere relaxation
The disadvantage is that it is too expensive
Saturday night, low -disappearing $ 800
Two people of the bird's stomach+only 2 glasses of wine after drinking 2 glasses of wine cost/person
I'm not afraid to disappear too much at all",False,0.137,0.058,0.805,0.7681
"套餐2200/2500牛豬

工作人員很忙，所以我有時間拍照⋯⋯

餐點食味可以但食量稍大的人不適合來吃，這樣的價位有其他更好選擇。

食物都偏冷盤（不論前菜主菜都是）在冬季非常的不適合。不如乾脆去吃無菜單日料算了

唯一亮點是甜點非常值得吃ㄧ下","Package 2200/2500 cattle pig

The staff is very busy, so I have time to take pictures ...

Meals can be delicious, but people with a small amount of food are not suitable for eating. There are other better choices in such a price.

The food is cold (regardless of the former dishes). It is very unsuitable in winter.It's better to go to eat a dishless menu.

The only highlight is that the dessert is very worth eating",False,0.181,0.0,0.819,0.9427
"適合下班後小酌，和朋友聚餐。食物有些類似創意料理，單價不便宜，但氣氛佳，我覺得值得。
不太適合不愛威士忌的朋友。
推薦松露薯條，會撒上威士忌粉，非常好吃，很特別！","Suitable for drinking after get off work, dinner with friends.Food is similar to creative dishes. The unit price is not cheap, but the atmosphere is good. I think it is worth it.
Not suitable for friends who do not love whiskey.
Recommend truffle potato strips, it will sprinkle with whiskey powder, it is very delicious and special!",False,0.231,0.136,0.633,0.8089
"不想太吵想小酌的好地方。
十三香滷味好吃，敢吃辣的辣椒必沾。","Don't want to be too noisy.
Thirteen fragrant four flavors are delicious, and hot peppers who dare to eat spicy will be stained.",False,0.139,0.11,0.751,0.4172
"服務人員相當專業親切
坐在非吧台區也可點好吃的bar food
可以體驗優雅吃臺菜的舒適感
最厲害的就是店裡的威士忌
第一杯點了Old Fashioned就讚不絕口
第二杯是服務人員推薦的Whisky Negroni
用威士忌取代琴酒的Negroni
不誇張，這是從我成年可以喝酒以來，喝到最好喝的一杯調酒","The service staff is quite professional and kind
Sitting in the non -bar area can also order the delicious Bar Food
You can experience the comfort of elegant Taiwanese food
The most powerful is the whiskey in the store
The first cup ordered Old Fashioned to praise
The second cup is the whisky neigroni recommended by the service staff
Negroni who replaces the piano wine with whiskey
No exaggeration, this is the best drink of drinking from my adult to drink",False,0.257,0.022,0.721,0.9734
主打威士忌的餐酒館，調酒選項不多，點威士忌先以果香、花香為類型選擇，店員會再推薦酒款試聞。餐點類型是創新台菜。單價微高，適合威士忌愛好人士。,"There are not many bartending options for whiskey. The whiskey is selected by the fruit fragrance and flower fragrance first. The shop staff will recommend wine trials.The type of meals is innovative Taiwan dishes.The unit price is slightly high, suitable for whiskey lovers.",False,0.18,0.0,0.82,0.8316
"【舌尖上的藝術】威士忌的後樂園，鮮食材的伸展台。如果到酒吧品美酒就嚐不到美食有遺憾，在這是魚與熊掌兼得，化遺憾為震撼…!

食材新鮮不在話下，餐盤上的展演看得出廚師善待食材的用心。酒侍對於酒品的來源背景有專業而不油腔的陳述，讓每個人可以尋找到屬於於自己味蕾的感動，儘情的在威士忌樂園中玩樂肆FUN…!

隱身處在信義精品百貨時尚大道盡頭處，卻是卸下繁瑣麈世的休憩放鬆空間。在現代主義聞學詩人的對話中；大摩與波摩忘情的流動著，喧譁中波本與雪莉之間的差異逐漸靠近著。最終進入心中的，是面具下許久未露面的真性情。","[Art on the tip of the tongue] The background of whiskey, the stretching platform of fresh ingredients.If you go to the bar, you ca n’t taste the food. There is regrets. Here you have both fish and bear's paw.

If the ingredients are fresh, the performance on the plate can see the intention of the chef to wait for the ingredients.Jiu Shi has a professional and oily statement of the source of the wine, so that everyone can find the touch of their own taste buds, and enjoy the fun in the whiskey garden ...!

At the end of the Xinyi Boutique Department Store Fashion Avenue, it is the room to relax and relax.In the dialogue between the poets of modernism; the difference between Damo and Bomo, the difference between Buben and Shirley gradually approached.What finally entered the heart is the true temperament of the mask for a long time.",False,0.128,0.015,0.856,0.9571
剝皮唐揚炸雞皮薄肉質嫩，剝皮辣椒醬很棒，炒泡麵調味很棒，沒有很喜歡炸中捲的呈現方式，牛肉麵味道很淡,"Peeling Tang Yang fried chicken skin is thin and tender, peeling pepper sauce is great, fried instant noodles are very good.",False,0.277,0.0,0.723,0.807
"林一峰老師的專業威士忌 bar, 進階與入門顧客都適合, 價格偏高

1. 威士忌種類多
2. Bartender 相當專業
3. 食物精緻，有依據不同組合搭配不同下酒菜與威士忌酒（e.g. 日據時期或夜市小吃, e.g. 鹽酥雞 搭配哪組威士忌較順口）
4. 也有威士忌 set, e.g. 海島三雄
5. 氣氛佳","Teacher Lin Yifeng's professional whiskey BAR, advanced and entry customers are suitable, the price is high

1. There are many types of whiskey
2. Bartender is quite professional
3. Exquisite food, with different combinations with different wines and whiskey (E.G. Japanese occupation or night market snacks, e.g. salt crispy chicken with which group of whiskey is smooth)
4. There are also whiskey Set, E.G. Island Sanxiong
5. The atmosphere is good",False,0.066,0.0,0.934,0.5994
"假日下午店裡人不多
逛街後，來喝杯調酒
還蠻愜意的

調酒價格略貴
Old fashion 400
Whisky sour 450","There are not many people in the shop on holiday afternoon
After shopping, come to drink a glass of bartender
Pretty comfortable

Bart -up price is slightly expensive
Old Fashion 400
Whisky sour 450",False,0.229,0.0,0.771,0.8481
店內放著輕音樂，是個可以安靜用餐和品酒的地方，調酒師會詢問客人的需求調酒，今天點oldfashion 、whiskeysour 、godfathter 、gintonic四杯調酒，選的基酒都很不錯，下次有機會來除了調酒之外還想試試看餐點,"There are light music in the store, which is a place where you can eat quietly and wine tasting. The bartender will ask the guests' needs. Today, order OldFasyion, WhiskeySour, GODFATHTER, GINTONIC four cups of bartender. I have a chance to try to see the meals in addition to bartending",False,0.039,0.0,0.961,0.25
"酒類豐富，服務人員態度親切、酒品介紹專業、人又很帥，非常推薦大家來喝一杯！
今天泥煤味的威士忌看似清透，味道卻很飽滿，與服務人員介紹的感受貼切，搭配松露薯條，愜意生活！","The wine is rich, the service staff attitude is cordial, the wine introduction is professional, and the person is very handsome. I recommend everyone to have a drink!
Today, the mud -flavored whiskey seems to be clear, but the taste is full. The feelings introduced with the service staff are appropriate, with truffle potato strips, a pleasant life!",False,0.2,0.0,0.8,0.9055
"環境：⭐⭐⭐⭐⭐
食物：⭐⭐⭐⭐
調酒：⭐⭐⭐⭐
服務：⭐⭐⭐
感受：上菜與調酒的時間有點久，第一道菜到下一道菜隔了40分鐘左右..
另外,服務生幫忙放包包在置物盒的時候讓人有點害怕,
居然用塞的放進置物盒,這樣很容易刮傷別人的包包呀...","Environment: ⭐⭐⭐⭐⭐
Food: ⭐⭐⭐⭐
Bartender: ⭐⭐⭐⭐
Service: ⭐⭐⭐
Feeling: The time for serving and bartending is a bit long. The first dish is about 40 minutes ..
In addition, the waiter helps to put the bag when putting the bag in the storage box, which is a bit scared,
In fact, put it in the storage box with the plug, so it is easy to scratch others' bags ...",False,0.083,0.033,0.883,0.5209
"其實是衝著老闆的名號一直很想去的一家「博物館」，我覺得酒吧這個名詞不適合形容這家店，一進到店就有一種很舒服又很高端的感覺，不管是前面的領檯或是調酒師、品酒師都很專業。
我們兩個女生平常沒有喝威士忌的習慣，也對於這個酒種不太熟悉，但是Bartender非常的專業介紹我們喝法及其產地，在品酒的過程，不太想在一般酒吧，請Bartender做一杯我喜歡口感的酒，反而是跟你說這杯酒的故事的製作的口感，再請你聞過，最後在品嘗，讓我們兩個對於這家店有更不同的感受，最後再要離開的時候，那杯清爽的shot也是令人印象深刻。除了喝到了很多不一樣的威士忌之外，更重要是!!!學到了很多知識
btw當天因為是吃飽飽才過去的，所以食物沒有點很多，但是!!!松露薯條真的很好吃~~","In fact, it is a ""museum"" that I have always wanted to go to the boss’s name. I think the term of the bar is not suitable for describing this shop. As soon as I entered the store, there is a very comfortable and high -end feeling. Taiwan or bartenders and alcoholics are very professional.
The two girls usually do not have the habit of drinking whiskey, and they are not very familiar with this wine, but Bartender is very professional to introduce us to drinking methods and its origin. In the process of wine tasting, I do n’t want to be in a general bar. Please do a cup of Bartender. I like the taste of taste, but to tell you the taste of the story of the story of this glass of wine. Then please smell it, and finally taste it, so that the two of us have different feelings about this shop. Finally, we will leave At the time, the refreshing shot was also impressive.In addition to drinking a lot of different whiskeys, it is more important !!! I learned a lot of knowledge
BTW has passed because it was full of food that day, so the food didn't have a lot of food, but !!! truffle potato strip is really delicious ~~",False,0.101,0.006,0.893,0.9688
"東西很好吃，酒也滿好，甜點稍弱一些
店裡的氛圍是輕快的，雖然聽得見週遭客人的交談聲但不顯吵鬧
中午菜單滿簡單的，一張點心一張主餐，主餐可以加價成套餐
沒有提供酒單，調酒師表示：我就是酒單
點了兩杯調酒一杯威士忌，味道都滿好

◆炒青菜(高麗菜)
油鹽足夠，蝦蝦很香，讓高麗菜很有味道
◆剝皮唐揚炸雞
外皮脆脆內裡鮮嫩多汁的炸雞好好吃，搭配的醬汁有加入剝皮辣椒，甜中帶了微微的麻辣感，單吃也好配酒也好
◆酥炸小卷
小卷給滿多的，味道挺豐富，另外這道調味較重口偏鹹算是微辣到小辣
◆煙燻牛小排丹麥漢堡
感覺是高級的漢堡XD
這個漢堡一上來、看到丹麥麵包大家就覺得會好吃，也果然不負期望，中間的主角牛小排質地很嫩，熟度也很好
◆乾煎海鱸魚
一整條海鱸魚煎得表皮金黃酥脆，但下面的魚肉還是很嫩，讓我超級認真吃它，幾乎剩下骨頭啦

◆巧芋
卡士達泡芙、芋泥+椰子甘甜酒泡芙，味道沒有讓人驚豔之處；亮點我們認為是下方的微辣爆米花...
◆威士忌布朗尼
雖然能感受到威士忌的香氣但整體不是很融合，另外布朗尼本身也不是很出色；個人最喜歡的是單吃甘納許","The things are delicious, the wine is full, and the dessert is slightly weaker
The atmosphere in the store is brisk, although I can hear the conversation of guests around, but noisy
The menu menu is full of simple, one snack and one main meal, the main meal can increase the price to become a package
No wine list, the bartender said: I am the wine list
I ordered two cups of bartending and one cup of whiskey, the taste is good

◆ Stir -fried vegetables (Korean vegetables)
There are enough oil and salt, and the shrimp is very fragrant, which makes the cabbage taste very delicious
◆ Dipping Tang Yang fried chicken
The delicate and juicy fried chicken in the outer skin is delicious. The sauce with the sauce is added with peeling peppers. It has a slight spicy feeling in the sweetness.
◆ Crispy fried small roll
The small roll is full of full, the taste is very rich, in addition, this seasoning is heavy and salty, it is slightly spicy to small spicy
◆ Smoking cattle small platoon Danish burger
It feels like a high -level burger XD
As soon as this burger comes up, everyone feels delicious when they see Danish bread, and they really live up to expectations.
◆ Dry -dried sea bass
A whole piece of sea bass is fried with golden and crispy, but the fish below is still very tender, making me very serious to eat it, almost left bones.

◆ ◆ taro
The taste of Kasida puffs, taro puree+coconut sweet wine, the taste is not amazing; the highlights we think it is the slightly spicy popcorn below ...
◆ Whiskey Browni
Although I can feel the aroma of whiskey, the overall is not very integrated, and Browni itself is not very good; the personal favorite is to eat Ganner",False,0.156,0.045,0.8,0.9922
".
捌月
📍剝皮辣椒牛肋條
切小塊狀的牛肋條
搭配烏魚子、果乾、烤小蕃茄
每一口多了一層香氣
很適合搭著酒一起食

📍炒青菜
原以為小酒館會出普通的炒菜
出乎意料地是裹著高湯果凍皮
經由火燒掉外層後
融入高麗菜 味道好合

📍魷魚螺肉蒜
螺肉本身味道很重
搭配酥脆的餅皮
衝突地口感 融在嘴裡

📍梅干扣肉戰斧豬
這道個人覺得被梅干蓋過
整體吃起來些許違和感
想好好吃豬排本人😆

三個女生點了2人套餐份量很足
除了菜上齊但白飯一直沒送上桌有點尷尬

整體吃起來氣氛很不錯
剛好朋友生日 還贈送了三杯茶酒不錯喝👍

08-2020","Then, then
Lunar month
牛 Peeling pepper beef ribs
Cut small pieces of beef ribs
With mullet, dried fruit, grilled small tomatoes
There is a layer of aroma every bite
Very suitable for eating with wine

Stir -fried vegetables
I thought the tavern would have ordinary cooking food
Unexpectedly, it is wrapped in broth jelly skin
After the outer layer is burned by fire
Integrate the taste of cabbage

Squid snail meat garlic
The snail itself tastes very heavy
With crispy cake skin
The sense of conflict is melted into the mouth

战 战 战 📍 📍 📍 📍 📍 干 📍 📍
This personally feels that I have been covered by Mei Gan
Overall it tastes a little bit of disobedience
I want to eat pork chops, I am

Three girls ordered a 2 -person package for a very sufficient amount
It ’s a bit embarrassing except that the rice has never been delivered to the table.

Overall the atmosphere is very good
Just a friend's birthday also gave three cups of tea, good drink 👍

08-2020",False,0.038,0.048,0.914,-0.2516
服務人員態度很好，只是因為午餐時間來下午還有其他行程不便飲酒，下次應該試試這裡的酒。,"The service staff attitude is very good, just because the lunch time comes in the afternoon that there are other strokes that are inconvenient to drink. Next time, you should try the wine here.",False,0.085,0.064,0.851,0.2006
會詢問想要喝什麼酒，然後直接拿上桌逐一介紹，最後在選擇想要喝哪一種，有戶外空間，在百貨公司3樓，可以滿足下午就想喝酒的酒空，酒的單價偏高,"I will ask what wine I want to drink, and then I will introduce one by one to the table one by one. Finally, I choose which one you want to drink. There is an outdoor space. On the 3rd floor of the department store, you can satisfy the wine that you want to drink in the afternoon. high",False,0.111,0.0,0.889,0.5994
新光三越才剛打烊冷氣就停掉了，整間店沒有冷氣蠻熱的，雖然有水冷扇但是好小台，晚上來用餐喝酒的可能要考慮一下。,"Shin Kong Sanyue stopped the air -conditioned and stopped. There was no air -cooled fan in the whole store. Although there are water -cooled fans, they are so small. It may be considered if you come to dinner and drink at night.",False,0.05,0.13,0.821,-0.4019
氣氛很好，很適合三五好友下班後小酌聚會。在新光三越A9三樓，營業到12點，還可走到市府搭捷運回家，交通非常方便。服務人員很專業，可依個人需要提供客製化調酒。下酒菜每一道都精緻且有特色，很好吃，分量不大，可點很多樣。平均一人消費1300左右，價格合理，應該會常常來。,"The atmosphere is very good, it is very suitable for three or five friends to have a drink after get off work.On the third floor of Shin Kong Mitsukoshi A9, it is open until 12 o'clock, and you can go home to the city government to go home. The transportation is very convenient.The service staff is very professional and can provide customized bartending according to individual needs.Each of the wine and vegetables is exquisite and distinctive. It is delicious, the weight is not large, and the order is very diverse.The average person consumption is about 1300, and the price is reasonable, and it should come often.",False,0.088,0.0,0.912,0.8748
如果對whisky很有興趣 這間就很推 可以嘗試很多不同又少見的whisky 也有推出餐點專門搭酒 但不是特別推薦 反而等酒吧時間比較好 但價格偏上 搭餐吃基本差不多要兩千上下,"If you are very interested in Whisky, you can try many different and rare Whisky. There are also meals to launch a meal for specializing in wine, but it is not particularly recommended to wait for the bar time.",False,0.048,0.054,0.898,-0.0559
"在新光三越開的分店已經一陣子了，但是還沒有機會造訪。剛好朋友想要一個比較安靜的地方，就選了這裡。一進去就是古典裝潢的酒吧，個人還滿喜歡這種風格的，本來要點一杯新的夏天Negroni, 但是調酒師還沒上班，所以換了一杯Whiskey sour ，不知道是不是剛好在交班時間，即使店裡感覺沒很多人，調酒等了快20分鐘。朋友點了Ginger ale, 充滿薑的香氣，很讚。整體來說還是不錯的一家店，消費比較高一點，但是氣氛很好，調酒也是很到位。還是滿推薦的。","It has been a while in Shin Kong Sanyue's branch, but there is no chance to visit.Just a friend wanted a quieter place and chose it here.As soon as I go in, it is a classic decoration bar. I personally like this style. I originally ordered a new cup of new summer Negroni, but the bartender has not yet been at work, so I changed a glass of Whiskey Sour. There are not many people in the store. I waited for almost 20 minutes.The friend ordered Ginger Ale, full of ginger aroma, very good.Overall is a good shop, consumption is a bit higher, but the atmosphere is very good, and bartending is also in place.Still recommended.",False,0.164,0.016,0.82,0.9669
"喜歡小後苑的酒和威士忌，而且有專業的酒類介紹，什麼故事跟品味都能說明，不論是早班還是晚班主管笑容親切，都很會照顧用餐客戶。

這次吃了大家推薦的炒泡麵（微辣），好好吃啊！
現在變成兩團麵份量很足，搭配溫泉蛋，九層塔，以及豬肉片，真的好好吃。

很喜歡跟朋友在這裡小聚放鬆 ❤️","I like the wine and whiskey of Xiaoyuanyuan, and there are professional wine introductions. Both stories and taste can be explained. Whether it is morning or evening shift supervisor smiles, they will take care of dinner customers.

This time I ate the fried noodles (slightly spicy) recommended by everyone this time, so delicious!
Now it becomes a very large amount of noodles, with hot spring eggs, nine -story towers, and pork slices, which are really delicious.

I really like to relax with friends here ❤️",False,0.269,0.0,0.731,0.9807
"是一個威士忌種類非常齊全的地方
音樂調性屬於偏爵士風格，很適合放鬆
服務人員會很用心介紹每種酒款的不同，而且可以找到很多各種各樣產地與年份的酒。
服務人員也會適時的與你聊天。
食物偏台式，黑白切蠻好吃的。
價格偏高，不過考量地點與整體特色，還是推薦一來。","Is a very complete type of whiskey
Music tone is a jazz style, which is very suitable for relaxation
The service staff will introduce the differences between each wine, and you can find a lot of wines of all kinds of origin and years.
The service staff will also chat with you in a timely manner.
The food is desktop, and the black and white is pretty delicious.
The price is high, but the considering location and the overall characteristics are still recommended.",False,0.102,0.0,0.898,0.7895
