Original,EN,Needs Review,Positive,Negative,Neutral,Compound
"去過大概10次了吧，每次幾乎都會有新菜色，東西菜色的品質也都有維持著，也都有創新，酒也是都可以克制化蠻好的，希望之後可以再次恢復之前的聯名甜點系列，

氣氛來說，是真的有點吵位置有點起來，其實那一步這麼多年如果可以重新配置一下，然後下面的位置多一點點也是會比較好","I have been to 10 times, almost every time there will be new dishes, the quality of the east and west dishes has been maintained, and there are innovations. The wine can be restrained. series,

For the atmosphere, it is really a bit noisy. In fact",False,0.0,0.042,0.958,-0.2415
"其實知道小後苑很久了
終於找到機會來體驗～
今天只有兩個人，太太和我～
所以沒辦法點太多🤭😶
加上太太是孕媽咪所以飲品只有一種無酒精的選擇
重點提醒！康普茶是發酵過的，所以是有微量酒精的，不建議孕婦飲用噢！
我們在薯條和炸雞之間猶豫了好久😆
選擇障礙～
最後，點了炸雞和虱目魚炊飯～
炸雞搭配的是特製剝皮辣椒特調醬料
太太的飲品是紅心芭樂氣泡飲搭配上層莓果泡沫（？）
我點的則是house wine～
意外的好喝～服務人員貼心提醒可以醒酒一下再喝～
沒想到！越來越好喝！最後直接點一瓶！
一杯350元一瓶1500元～
推薦大家直接點一瓶，喝不完帶回家繼續喝
回到食物的點評～
個人喜好比較偏好這道炊飯不需要有荷包蛋和魚魯😂
單純一致性的保留炊飯、吻仔魚乾以及煎的恰到好處的虱目魚和現磨山葵就行
我們剛好是被安排到吧台座位～
很幸運了，因為星期五晚上沒有先訂位～
服務人員都很好聊很熱情，就算一個人來也不會尷尬～
差點忘了黑蒜頭餛飩雞湯～
把雞肉變成餛飩
湯裡面的香菇也非常好吃
太太整碗完食😍😍😍
很多純飲的酒品～
馬上推薦給懂酒的朋友～
整體而言，是一間會再訪的餐廳🥰","Actually knowing that Xiaoshouyuan has been for a long time
Finally find a chance to experience it ~
There are only two people today, wife and me ~
So there is no way to order too much 法 法 法 法 点 法 法
In addition, my wife is a pregnant mommy, so there is only one choice of alcohol without alcoholic drinks
Focus on reminder!Kangpu tea has been fermented, so there are trace alcohol. It is not recommended to drink it!
We have hesitated between the fries and fried chicken for a long time.
Choose obstacles ~
Finally, ordered fried chicken and milkfish for rice ~
The fried chicken is paired with special peel peeling pepper sauce
The wife's drink is a red -hearted Bale ingot drink with the upper berry foam (?)
I ordered House Wine ~
Unexpectedly delicious ~ The service staff can remind you to wake up and drink before drinking ~
Unexpectedly!More and better!Finally, just click a bottle!
One cup of 350 yuan a bottle 1500 yuan ~
Recommend everyone to click a bottle directly, take it home and take it home to continue drinking
Back to the review of food ~
Personal preferences prefer this cooking rice, do not need to have poached eggs and fish Lu 😂
Simply consistent retention of cooking rice, dried fish kiss, and fried milkfish and existing mountains.
We happened to be arranged to the bar seat ~
Fortunately, because there is no booking on Friday night ~
The service staff are very good and enthusiastic, even if a person comes, it will not be embarrassing ~
I almost forgot the black garlic and chicken soup ~
Turn the chicken into a ravioli
The shiitake mushrooms in the soup are also very delicious
My wife's whole bowl is eaten 碗 完 完 碗 完 完
Many pure drinks ~
Immediately recommend it to friends who know wine ~
On the whole, it is a restaurant that will be visited.",False,0.101,0.036,0.863,0.9777
信義區『小後苑』位於於新光三越A9館裡頭，專業威士忌酒吧餐廳，有大量的威士忌藏酒。運氣很好竟然還有空位。深褐色沙發搭配木紋桌椅地板，英倫貴族氛圍濃厚，調酒師專業。搭配酒的配搭餐點都很恰當，點了一份三顆新鮮生蠔、辣炒泡麵、松露薯條、牛舌炸刈包（表皮很像銀絲卷的口感，微辣辣但很開胃），甜點吃了很耐看的紅玉紅茶布丁🍮，喝了Mocktail 紅心芭樂氣泡飲，很好喝非常好入口。某人喝了日本威士忌Highball，下次時間充足想來嚐嚐晚間套餐🤤🤤看起來非常好🍽️吃。營業時間到02：00，很適合信義區下班後，散步走來小酌放鬆的好場所。🍷🍹🍺,"Xinyi District ""Xiaoshouyuan"" is located in the A9 Hall of Shin Kong, a professional whiskey bar restaurant with a large number of whiskey hidden wine.Good luck, there is still a vacant position.Dark brown sofa with wood grain tables and chair floor, British nobles have a strong atmosphere and a bartender specialty.The meal with wine is very appropriate. I ordered a piece of three fresh oysters, spicy frying noodles, truffle fries, and beef tongue fried bags (the skin is like a silver silk roll, slightly spicy but appetizing) The dessert ate a very resistant red jade black tea pudding. I drank Mocktail's red -hearted bubble, which was delicious and good.Someone drank Japanese whiskey Highball, and next time I wanted to try the evening package 🤤🤤 It looks very good 🍽️ Eat.The business hours are 02:00, which is very suitable for a good place to relax when you get off work after get off work.Bleak",False,0.146,0.0,0.854,0.9743
"小後苑Backyard Jr. (信義Xinyi)
中高消費的場所之一，
考量酒味濃烈，
餐點也較重口味但美味，
低消平日每人600，週五六800，
一成服務費，
距離101捷運15分，
店內環境氣氛不錯，
很適合聚會或約會，
烤牛小排炊飯780，
起司小米麵疙瘩540，
烤虱目魚炊飯520，
煙燻飛魚拉麵480NTD已是日本鹽味等級，
金香白蘭地560，
Half Omar wine cask 560，
紅心芭樂汽泡飲350甜順好喝。","Xiaoshouyuan Backyard Jr. (Xinyi XINYI)
One of the places for medium and high consumption,
Considering the strong taste of wine,
The meal is also heavy but delicious,
600 per person on a low low, Friday 800, Friday 800,
10 % service fee,
15 points from 101 MRT,
The atmosphere of the environment in the store is good,
Very suitable for party or date,
Baked beef stew for rice 780,
Cheese Xiaomi noodles 540,
Baked milkfish cooking 520,
Smoked flying fish ramen 480NTD is already a Japanese salt flavor level,
Jinxiang Bailan 560,
Half Omar Wine Cask 560,
Red -hearted guava steam bubble drink 350 sweet and delicious.",False,0.187,0.041,0.771,0.9672
好難得嘅體驗，推薦嘅酒品都很好喝，東西也好好吃，特別喜歡鯖魚的鮮甜，刈包包皮還像炸饅頭那樣😋,"It's a very rare experience, the recommended wine tasting is very good, east and west also good to eat, especially like mackerel fresh and sweet, the foreskin is also like fried buns 😋",False,0.401,0.0,0.599,0.9497
"一直以來的口袋名單！
對於威士忌愛好者來說，
很讚的威士忌吧！
可以品嚐到不同的威士忌！","List of pockets!
For whiskey lovers,
A great whiskey!
You can taste different whiskey!",False,0.411,0.0,0.589,0.8547
"威士忌種類超多
一次喝不完 要細細品味
餐點很美味","There are many types of whiskey
Taste carefully after drinking
The meal is delicious",False,0.302,0.0,0.698,0.6369
之前去過大直分店幾次印象都很不錯，第一次來信義店用餐，告訴服務生喜歡的味道，服務生拿了6款威士忌給我們選，當下有拍照，單杯價位介於500-1000間，朋友選了500多的那款，結果結帳那杯是900多，原本以為是我們當時價格聽錯，後來回去整理照片才發現服務生送錯⋯等於朋友花了900喝了一杯不是自己要的酒，但他也真的喝到了最貴的那款，所以好像也沒立場要求退費什麼的，只能說以這樣的價位但服務確完全不及格,"I have been to the big direct stores a few times before. I have been very impressed by a few times. For the first time I came to Xinyi Store to dine, tell the waiter's favorite taste. The waiter took 6 whiskey for us to choose. In 1,000, my friend chose more than 500 models. As a result, the cup at the checkout was more than 900. Originally thought it was the wrong price at the time, and then I went back to sort out the photos to find that the waiter sent the wrong. The wine he wants, but he really drank the most expensive one, so it seems that there is no position to ask for a refund or something. It can only be said that at such a price, but the service is really failed.",False,0.042,0.079,0.879,-0.7574
"服務給三🌟是覺得好像沒有感覺到什麼服務，做吧台區～就是上菜收盤子，包含酒其實也沒有多做介紹。不管是依照食物搭餐、號稱威士忌酒吧也沒有給酒單或是針對個人喜好詢問之類的

餐點口味上我覺得價格雖然高，但是細緻度和口味有做出差別度，算是不錯

沙拉就一般

薯條厚度熟度適中，份量也不少搭配醬料兩種

期待過高的剝皮辣椒醬炸雞，醬味道可以如果雞肉再切小塊或是醃製搭配醬料的口味，多點層次會更好

烤澎湖透抽，蠻喜歡的！口味新鮮而且有處理到焦香口感，不單純只是弄熟上菜，保有外皮的風味也可以吃到鮮甜

滷味，覺得一般還可以，可能會期待吃到很厲害的豆乾之類的，但是還是很花時間慢慢入味那種

炒泡麵，推薦的一道、肉品、蔥花、辣椒、溫泉蛋、配上金桔，鹹香酸甜帶有口感的泡沫一起吃很滿足

當天只有喝啤酒，可能有機會小酌吃東西配點小酒再來拜訪看看，畢竟牆上許多名氣酒款","It seems that the service does not seem to feel any service. It is a bar area ~ It is the closing of the dish. In fact, there is no more introduction to the wine.Whether it is meal in food, known as whiskey bars, it has not given wine orders or asked for personal preferences.

In terms of meals, I think that although the price is high, the details and tastes make a difference, which is good

Salad is average

The thickness of the fries is moderate, and there are many types of portion with a lot of sauces.

Looking forward to the high peel peeling chili sauce fried chicken, the sauce taste can be cut if the chicken is cut or pickled with the flavor of the sauce, it will be better.

Bake Penghu through pumping, I like it!The taste is fresh and has a sense of scorching the taste. It is not simply to get cooked. You can also eat fresh sweet flavor to keep the flavor of the outer skin.

I think it ’s okay, I may look forward to eating very good dried beans and the like, but it still takes time to taste slowly.

Speed ​​instant noodles, recommended, meat, green onions, chili, hot spring eggs, golden oranges, salty sour, sweet and tasteful foam together

Only drinking beer on the day, there may be a chance to eat food with a little wine and come to visit. After all, many famous wines on the wall",False,0.092,0.018,0.89,0.9386
"在信義區A 9，很熱門的酒吧，氣氛很好，有隱藏包廂，低消$15000。
超級誇張的菜單價格，可能要用美國價格來想，才吃的下去。","In Xinyi District A 9, a very popular bar, the atmosphere is very good, there are hidden boxes, low -elimination of $ 15000.
The price of super exaggerated menu may be used in the US price before eating.",False,0.218,0.075,0.707,0.8265
好久沒晚上去東區了，變得超級chilling，酒好喝，東西也很好吃，和好朋友一起喝酒聊天就是開心,"I have not been to the East District at night for a long time, and I have become super chilling. The wine is delicious and the stuff is delicious. Drinking and chatting with good friends is happy.",False,0.403,0.021,0.576,0.9678
"2024.02.12 初次造訪 小後苑

服務：接待人員服務熱情

氣氛：餐酒館和酒吧的氛圍，輕鬆小酌幾杯

餐點：
1.  水果油醋沙拉，正常水平
2. 炙燒午仔魚小點，好吃
3. 廣島生蠔，新鮮美味
4. 剝皮辣椒炸雞沾醬好吃，下酒菜之一
5. 滷肉飯一般般
6. 十三香滷味，好吃
7. 濃抹茶巴斯克，特別的甜點

搭餐酒：
1. Aultmore 18y
2. Speyside 1998 23y","2024.02.12 Visit Xiaoshouyuan for the first time

Services: The reception staff service enthusiasm

Atmosphere: The atmosphere of the restaurant and bar, a few drinks

Meal:
1. Fruit oil vinegar salad, normal level
2. Burning noon fishes, delicious
3. Hiroshima oyster, fresh and delicious
4. Peeling pepper fried chicken with delicious sauce, one of the wine and vegetables
5. Salted meat rice is general
6. Thirteen fragrant braisedness, delicious delicious
7. Luliang Bask, special dessert

Meal wine:
1. AULTMORE 18Y
2. Speyside 1998 23y",False,0.26,0.0,0.74,0.9786
"新菜單海島之島總共10道菜，以這個價位來說很划算欸～而且吃完是有飽足感的🥹以下分享幾個我特別喜歡的！

「三種麵包」中的手工自製紅麴貝果，是馬祖特有的繼光餅，外層裹上芝麻糖讓口感酥酥脆脆的，內層則是貝果的Q軟，夾入午仔魚火腿，鹹香滋味好好吃🤤

「小吃攤」以一整尾草蝦來呈現澎湖小吃炸粿，這擺盤精緻度一上桌就驚呼連連，七分熟草蝦的口感超讚，吃完真的想再來一份！

「燒烤店」非常名副其實，上桌就能聞到濃郁的燒烤香氣，兩串分別是臭肚魚和小卷，我好像是第一次吃臭肚魚(？覺得肉質軟嫩中帶有一點彈性，口感很好，炭烤塗抹的醬汁也很加分～

「蘭嶼的空氣」是最後一道甜點，芒果青、香氛萬壽菊製成的冰沙，搭配野薑花冰淇淋，再畫龍點睛淋上一滴刺蔥綠油，辛辣感讓本來就很清新的一道冰品更加透心涼，是很好的收尾🥰","A total of 10 dishes on the island of the new menu island. At this price, it is very cost -effective ~ and after eating, I share a few full -full. I like it!

The handmade self -made red cricket Beiguo in ""Three Bread"" is a relay cake some of Matsute. The outer layer is wrapped in sesame sugar to make the taste crispy and crispy. , The salty flavor is delicious 滋

The ""Snack Stall"" presents Penghu snack fried with a whole tail, and it is exclaimed as soon as the exquisitely served on the table.

The ""barbecue restaurant"" is very named. In fact, you can smell the strong grilled aroma when you serve. The two skewers are stinky belly fish and small rolls. , The taste is very good, the sauce coated with charcoal is also very extra points ~

""The Air of Lanyu"" is the last dessert. Mango green, fragrance, and flavors, with wild ginger flower ice cream, and drew a drop of scallion green oil on the finished eye. Even more cold, it is a good ending 🥰",False,0.138,0.031,0.832,0.9731
"《海島之島》套餐$2680+10%/人
-甲殼類與落果
-三個島嶼三種貝
-三個島嶼三種麵包
-小吃攤
-燒烤店
-魚
-滷”肉”飯
-羊
-澎湖的甜味
-蘭嶼的空氣

餐點每道都像藝術品般精緻漂亮！感受得出來主廚的用心，味道也是富有新意！","""Island Island"" package $ 2680+10%/person
-The shells and fruits
-Three islands and three shells
-Three islands and three kinds of bread
-Ax snack stall
-Scarbing restaurant
-fish
-Braised Rice with Pork and Soy Sauce
-sheep
-The sweetness of Penghu
-The air of Lanyu

Every meal is as delicate as art!Feeling the care of the chef, the taste is also new!",False,0.124,0.027,0.849,0.7494
"今天主要是好餐廳都訂位客滿，為了吃晚餐才來這間酒吧！😝
所以，我們的重點當然不是酒囉，哈，畫錯重點！ 點的香檳及紅酒好喝，當然，價格也很不便宜！ 套餐及單點的龍蝦煎餃也都好吃，當然，價格也是不親民！ 二個人點了三杯酒，一份套餐及單點煎餃，總共花費近4,500大洋！
服務生服務都很到位，看得出店家有重視這塊！店內酒吧氣氛也很好，不在乎價高，要喝好酒，來這就對了！","Today, the main restaurant is full of booking. I only come to this bar for dinner!Bleak
Therefore, of course, our focus is not wine, ha, the focus of painting!Point champagne and red wine are delicious, of course, the price is not cheap!The package and a single lobster fried dumplings are also delicious. Of course, the price is not close to the people!The two ordered three glasses of wine, a package and a single -order fried dumplings, which cost a total of nearly 4,500 oceans!
The waiter's service is in place, and the store can see that the store attaches great importance to this!The atmosphere of the bar in the shop is also very good. It is not high in price. You have to drink good wine. It ’s right to come!",False,0.158,0.018,0.824,0.9715
"服務很強 威士忌選擇很豐富 餐點以台菜新做的方式呈現 使用當地食材 不過畢竟位處精華地段 消費較高 但合理
吧台位置舒服 但美中不足的是 感覺空間悶熱 感覺冷氣不夠強~","The service is very strong for whiskey selection. The meal is very rich. The new way of making Taiwanese dishes is used to present the use of local ingredients.
The position of the bar is comfortable but the lack of beauty is that the space feels stuffy and feels not strong enough ~",False,0.184,0.099,0.717,0.6798
"結論：威士忌愛好者適合的店，餐點水平也不差，想要很舒服喝杯威士忌跟吃點東西時可以考慮的店。

威士忌：不僅種類十分多元，也能喝到平時較難購買到的酒款，搭配服務人員專業的介紹與服務，整體非常好的體驗

煙燻飛魚拉麵：台灣較少見的魚介湯底，搭配微酸的配料，整體口感還不錯。主菜是叉燒及干貝，跟湯底以及選用的麵條算是蠻搭的，用料也算大氣。煙燻飛魚好像是湯底的一部份不是作為主菜，乍看餐點名字會誤會，算是水準以上的一道菜

松露薯條：中規中矩而已，台北不少店家的松露薯條比這個更出色。

白酒：少見微酸不偏甜的口感，搭配餐點還不錯

服務及用餐環境：優秀，下班想放鬆來吃點東西喝兩杯來說算是不錯選擇，價格來說算是略高但還能接受","Conclusion: The shop is suitable for whiskey enthusiasts, and the level of meals is not bad. If you want to drink a cup of whiskey and you can consider when you eat something.

Whiskey: Not only is the types very diverse, but also the wine that is more difficult to buy. It is a very good experience with the professional introduction and service of the service staff. The overall experience is very good

Smoked flying fish ramen: Taiwan's rare fish soup base, with slightly acidic ingredients, the overall taste is not bad.The main course is barbecued and scallops. The noodles with the soup base and the selected noodles are quite good, and the ingredients are also atmospheric.The smoky flying fish seems to be part of the soup base as the main dish. At first glance, the name of the meal will be misunderstood.

Todgeflies: Just well, the truffle fries of many stores in Taipei are better than this.

Liquor: Rarely sour and sweet taste, and it is not bad to match meals

Service and dining environment: Excellent, you want to relax from get off work to eat something for two glasses, which is a good choice. The price is slightly tall but acceptable",False,0.186,0.042,0.773,0.9869
"1大1小進去只是點個炒泡麵，拉麵，薯條，烤小卷+2杯可樂和1杯無酒精飲料，共要價$2570，飲料賣貴點我可以理解，炒個泡麵要價$500左右感覺就是進去被當肥羊宰。

可：碳烤小卷$480（份量不大），松露薯條$280（份量也不大）

不推：炒泡麵（雪花牛）辣度是小辣以上$450,煙燻飛魚拉麵$480（價高外重點也不美味）

【不喜歡進去被當肥羊，最好看清楚價格再決定。】","1 big 1 small in just order a fried noodle, ramen, fries, grilled small rolls+2 cups of Coca -Cola and 1 cup of alcoholic drinks, a total of $ 2570, I can understand the expensive drink, the price of fried noodles is about $ 500 or so It feels like going in and being slaughtered as fat sheep.

Can: $ 480 of carbon roasted rolls (small portion), truffle potato strip $ 280 (not large portion)

Do not push: fried instant noodles (snowflake cow) spicy is small spicy or more $ 450, smoky flying fish ramen $ 480 (high price is not delicious)

[I don't like to go in and be used as a fat sheep, it is best to see the price and decide..",False,0.053,0.039,0.909,0.4321
"這是個號稱以威士忌為主題的餐酒館，但很神奇的是，我坐下後只給了一個三折頁的 Bar 菜單，服務生另外解釋中間是套餐只有晚上才提供，所以中午只提供左右兩邊的選項。我接著再要求看酒單的時候，服務生兩手一攤直接說沒有。

蠻神奇的一次用餐體驗。","This is a tavern known as the theme of whiskey, but it is amazing that I only gave a three -fold BAR menu after I sat down. Options.When I then asked for the wine list, the waiter said nothing.

A magical meal experience.",False,0.11,0.0,0.89,0.7351
新光才剛打烊就超級熱！超熱的！真的很煩，怎麼會這麼大的一間店？用水冷單太誇張了吧？？？,"Xin Guang was super hot as soon as it was closed!Super hot!It's really annoying, how can there be such a big shop?Is it too exaggerated to use the water cooling list?IntersectionIntersection",False,0.105,0.143,0.752,0.3508
"滷肉飯膠原蛋白多 調味好吃
旁邊的辣醬c很香
五仔魚+鮭魚卵+米香 新鮮
非常好吃
香檳覆盆子調酒和白酒綠茶調酒清爽順口","Journal of meat rice collagen is more seasoning and delicious
The hot sauce C is very fragrant
Wuzi fish+salmon eggs+rice fragrant fresh
Very delicious
Champagne raspberry bartending and liquor green tea bartender refreshing and smooth mouth",False,0.285,0.0,0.715,0.9142
菜色好吃、bartender 對於酒的知識也很豐富，有不懂的地方都可以跟他們請教。這麼多種威士忌，想要試試看真的只能多來幾次了！,"The dishes are delicious, Bartender's knowledge of wine is also very rich, and you can ask them if you don't understand.With so many types of whiskey, you can only try to try it, you can only come a few more times!",False,0.168,0.0,0.832,0.8353
"食物的調味出乎意料得好，幾乎每道菜都好吃，焢肉飯、炸物、戰斧豬排，都有表現在水準以上。
唯一比較失望的是炒泡麵，以及螺肉蒜。

另外，酒水的部分沒有什麼彈性，全部都要開整瓶，因為不想要被強迫消費，乾脆就不開了。
唯一的生啤酒，還故障，強迫朋友一定要點整瓶的啤酒。這樣子對餐廳而言，到底是好還是不好呢？是不是要考慮提供更有彈性的酒水選擇呢？","The seasoning of the food is unexpectedly good. Almost every dish is delicious.
The only disappointment is fried noodles and snail garlic.

In addition, there is no elasticity of the alcohol, and all of them must be opened, because they do not want to be forced to consume, they simply do not open.
The only raw beer is also a failure, forcing friends to order the whole bottle of beer.Is this good or bad for the restaurant?Is it necessary to consider providing more flexible drinking choices?",False,0.142,0.158,0.7,-0.1566
"沒想到在酒吧也能吃到讓人驚豔的餐點
特殊燻烤的手法讓人大開眼界，且主廚還會親自為每道餐點進行解說。能把那麼多元素融匯在一起真的很厲害
個人印象最深刻的是洛神花佐鴨肝達克瓦茲。看到外觀原以為是甜點，想說怎麼會擺在前菜。咬下去瞬間被鴨肝和洛神花卡士達醬給嚇到，鹹甜鹹甜的非常搭
酒類收藏也非常豐富，喝的到許多獨立酒廠的威士忌
整體價格偏高，但適合和家人朋友來這裡享受fine dinig","I didn't expect to eat amazing meals in the bar
The special smoking method makes people eye -catching, and the chef will also explain for each meal.It is really amazing to blend so many elements together
The most impressive person is the most impressive is the Luo Shenhua duck liver Dakwaz.When I saw the appearance, I thought it was a dessert, and I wanted to say how to put it in the front dish.It was scared by the duck liver and Luoshen Hua Sida sauce at the moment of bite, the salty sweetness and sweetness were very good
The wine collection is also very rich, drinking many independent winery whiskey
The overall price is high, but it is suitable for friends and friends to enjoy Fine Dinig here",False,0.232,0.013,0.756,0.9834
"之前姐姐帶我來品嚐這間。
這間的氛圍很棒，如果會品酒的人。
很適合在用餐時搭配美酒提升美食的口感喔～
如果不知道如何選擇店員也會很貼心的介紹。
整體給人感覺很不錯。另外一個小巧思就是燈泡。
原來每個燈泡的設置是有原因的。好奇可問店員喔～","My sister took me to taste this before.
The atmosphere of this room is great, if you can taste the wine.
It is very suitable for the taste of food to enhance the food with wine ~
If you do n’t know how to choose a clerk, you will introduce it very intimately.
The overall feels good.Another small ingenuity is a bulb.
There is a reason for the setting of each bulb.Curious, please ask the clerk ~",False,0.079,0.0,0.921,0.7506
