Original,EN,Needs Review
"口味偏清淡的泰式料理，紅、綠咖哩和飯可續，覺得不夠辣能另外要一碟辣椒。

餐點味道佳，且以綠咖哩牛肉而言，內含飯、牛肉咖哩、抹醬烤吐司、溫泉蛋（可做全熟）、飲料（可加價升級）。內用環境佳，衛生且精心裝潢，適合聚餐。","Thai dishes with light taste, red, green curry and rice can be continued. If you don't feel spicy enough, you can need a plate of peppers.

The meal is good, and in terms of green curry beef, it contains rice, beef curry, grilled toast, hot spring eggs (can be made of all cooked), drinks (can be upgraded by price increase).The environment is good, hygienic and carefully decorated, suitable for dinner.",False
"很普通的泰式料理餐酒館…。
🌟五星評論送榴槤冰。

先說，這家店我覺得並不像典型的餐酒館，當作有酒單的日常小餐廳感覺比較接近。
我覺得體驗會差有一個部分就是我以餐酒館的型態來想像這家店，假設當作一般巷口泰式小吃店、不收服務費的話，至少不會有這麼大的落差感。

說說餐點，餐點部分完全不ok🤧，我們幾人幾乎點完菜單上主要料理，只有兩道好吃：鹽烤松阪豬和爆漿椰汁球。其他不是普就是雷。
冷椒麻雞就是白斬雞那種雞肉片涼拌了淋醬，但醬一點兒椒麻味都沒有…。
綠咖哩雞的綠咖哩醬有股很奇特的化工味（同行友人說像洗髮精的味道xD…）
甩泰蝦餅上面一塊小而且不怎麼好吃的蝦餅鋪在零嘴的那種蝦餅上（就是熱炒店鳳梨蝦球旁邊會放的蝦餅），跟一般泰式蝦餅也差很多。
炒泡麵超級軟，完全不像炒泡麵的口感。
泰奶還行，但要去冰，有冰的會很稀。
沒提到但照片有的，就是普普。

然後東西缺蠻多的，用餐尖峰時刻很多東西點不到☹️

唯一吃到比較開心的就是爆漿椰汁球，很特別，是內餡很像摩摩渣渣，包著椰汁西米露和（可能是）亞達枳，外層炸成芝麻球的形狀，蠻特別且味道好吃，是整餐唯一的亮點。

服務的部分中規中矩，但因為點餐也是線上掃碼點餐，除了上菜也不需要店員幹什麼，我是不太理解為什麼要收服務費，因此從中間值向下扣一顆星。

——————
以下是未查證的部分。
以前在六張犁那邊吃到一家叫甩泰咖哩的，有日式也有泰式口味，覺得很好吃，不過前陣子回去收掉了，google map顯示找新店面中，但同時推薦搜尋又跳出了這家餐酒館，便好奇是不是同一家。
然而這家就連綠咖哩都很普，因此猜測應該只是剛好用同個店名而已，謹記之。","Very ordinary Thai cooking restaurant ...
梿 Five -star comments Send durian ice.

First of all, I don't think this restaurant is like a typical dining tavern. It feels closer to the daily small restaurant with wine lists.
I think there is a part of the experience. I imagine this store in the style of the dining tavern. Assuming that it is regarded as a Thai snack bar as a general alley and does not charge the service fee, at least there will be no sense of gap.

Talking about the meal, the meal part is not OK🤧 at all. Several of us almost finished the main dishes on the menu, only two delicious foods: salt grilled paddy Saka pigs and burst coconut balls.Others are either general or thunder.
Cold pepper hemp chicken is the chicken with white chopped chicken.
Green Curry Chicken Green Curry Sauce has a very strange chemical flavor (accompanying friends say like the taste of shampoo XD ...)
A small and not delicious shrimp cake on the shrimp cake on the tanning shrimp cake is spread on the shrimp cake (that is, the shrimp cake that will be placed next to the hot fried shop pineapple shrimp ball), which is much worse than the general Thai shrimp cake.
Frying noodles are super soft, not like the taste of frying noodles at all.
Thai milk is okay, but if you want to go to ice, you will be thin if you have ice.
I didn't mention it, but some photos were Pop.

Then there are quite a lot of things, and there are many things at the peak of the meal.

The only thing that is happier to eat is the bursting coconut juice ball. It is very special. It is pretty special and delicious, it is the only highlight of meals.

Part of the service is quite satisfactory, but because ordering is also online scanning and ordering meals. I do n’t need to do anything except the food. I do n’t understand why the service fee is charged, so I buckle a star from the middle value.

——————————
The following is an unpaid part.
I used to eat a Thai curry on the six parts of Liuzhangli. There are Japanese styles and Thai flavors. I feel delicious, but I went back to collect it a while ago. After jumping out of this dining tavern, he was curious whether it was the same house.
However, this house is universal, so guessing should just use the same name of the same store, remember it.",False
"咖喱炒蝦球很好吃，椰奶味很香！
調味滿剛好的，不會太鹹～
不過份量沒有很多，三個人點三盤會太少🤣","Curry fried shrimp balls are delicious, coconut milk flavor is very fragrant!
The seasoning is just right, it will not be too salty ~
However, the portion is not much, and three people will be too few to order three sets.",False
店家在師大公館校區旁邊的巷子裡面，感覺搭到公館站會萬隆更近一點。餐點口味都蠻好吃的，五星評論還有送榴蓮冰淇淋，這次點了甩泰紅咖哩牛、甩泰蝦餅、冬陰功湯，湯很容易冷掉但是有拿回去請店員幫忙加熱，這個還不錯，酒的部分完全是飲料，非常非常淡基本上到喝不出來，但作為飲料口味也是好的，榴蓮冰淇淋也好吃。之後有機會會回訪,"The store was in the alley next to the Normal University Mansion Campus, and it felt that it was closer to the Mansion Station to Wandong.The taste of the meal is pretty delicious. Five -star comments also have durian ice cream. This is not bad. The wine part is completely beverage. It is very, very light, and basically cannot be drunk, but it is also good as the taste of beverages, and durian ice cream is also delicious.Afterwards, I will visit back to visit",False
"評論送榴槤冰
椒麻雞很好吃
泰式炒泡麵應該叫打拋豬炒泡麵😅 …","Comment to send durian ice
Pepper hemp chicken is delicious
Thai fried instant noodles should be called frying pig fried noodles ...",False
看起來好吃，除了松阪豬其他的味道都不道地,"It looks delicious, except for the other taste of Matsusaka pig",False
"師大旁高CP值泰式餐酒館
台泰友好做法
適合家人 商聚小酌","High CP value Thai dining tavern restaurant next to the Normal University
Taitai friendly practice
Suitable for family members to gather together",False
"店內氣氛不錯，桌距不擁擠，坐在窗邊視野好！服務方面也很棒，服務生是旁邊師範大學的學生很有氣質美女。說說餐點吧，炒泡麵和雞肉青木瓜超讚！尤其是咖哩沾咖椰吐司印象深刻的好吃！其他品項也不錯有在水準之上，但就是有點台泰式的感覺。
整桌吃下來五個大人中等食量有吃飽，四杯生啤兩杯飲料，這樣總共$5000！","The atmosphere in the store is good, the table distance is not crowded, sitting on the window is good!The service is also great. The waiter is a student of the students next to the Normal University.Let's talk about meals, fried noodles and chicken green papaya!Especially the curry coconut coconut toast is impressed!Other items are also good at the level, but it feels like a Thai -style style.
The whole table eats the five adults and eats full of medium consumption.",False
"店內的排煙系統不太好，如果坐在裡面稍微一點悶
菜色份量還可以，餐點口味還算家常
店員們在忙碌之餘還算服務親切","The smoke exhaust system in the store is not very good, if you sit in it a little bit of boring
The amount of dishes is OK, the taste of the meal is quite homely
The clerk is still intimate when busy",False
外送的份量少的可憐，綠咖哩半碗不到，空心菜更是少得像是吃剩外帶一樣…,"The delivery of the delivery is poor, the green curry is half a bowl, and the spinning vegetables are as small as eating leftover ...",False
"跟家人一起來吃，他們都覺得不太划算
炒泡麵份量不多就要180
紅咖哩牛肉的醬味道有點太鹹且跟想像中有點落差
松露薯條份量還可以","Come to eat with family members, they all feel that it is not cost -effective
There is not much to stir fry noodles, it takes 180
The sauce of red curry beef tastes a bit too salty and a bit gap with imagination
Todgeflalefathers are okay",False
"店不大的餐酒館
座位沒有很多要訂位比較好
線上點餐直接掃QR code很方便
餐點沒有到很多但是該有的都有
四人點了
冷的椒麻雞 空心菜 炒泡麵 松阪豬
蝦餅 綠咖哩 炸魷魚球 鱸魚跟冬蔭湯
單品價格不會非常貴
份量也比想像中的大
口味偏台式如果想要吃很道地的可能會有點失望
但是整體來說都是好吃的
炒泡麵跟蝦餅還有椒麻雞都很喜歡
冬蔭湯比較像有辣的蕃茄湯
香料味沒有很濃
綠咖哩偏鹹
跟搭配的咖椰吐司沒有很搭
感覺配白飯可能比較好
鱸魚蠻大隻還不錯
松阪豬也是很嫩
飲料的部分都不會過甜
不過這次沒有點泰奶
整體來說很不錯
以價位來說算實惠
有機會會想二訪","The restaurant with a small shop
There are not many seats to book a better place
It is convenient to order QR Code directly online
There is not a lot of meals, but there should be everything
The four were ordered
Cold pepper hemp chicken hollow vegetables fried noodles Matsusaka pig
Shrimp cake green curry fried squid ball bass and winter shade soup
The price of single items will not be very expensive
The portion is also larger than expected
If you want to eat it, it may be a bit disappointed if you want to eat very authentic
But overall is delicious
I like fried noodles, shrimp cakes, and pepper hemp chicken very much
Dongyin soup is more like spicy tomato soup
The flavor is not very strong
Green curry is salty
It's not very good with the matching coffee coconut toast
It feels better to match white rice
The sea bass is quite big and not bad
Matsusaka pigs are also very tender
The drinking part will not be too sweet
But this time there is no order of Thai milk
Overall is very good
In terms of price, it is affordable
If you have a chance, you will want to visit the second visit",False
最好吃的是松阪豬上面的那碗醬，如果沒有醬全部都很普通，有了醬之後又都還可以，所以松阪豬是必點，但也只是還可以，真的每一道都很普通味道都差了一點讓人覺得不是專業的，好在有兩個可愛妹妹，點菜的單純小女服務生贏得了不少分跟星星，不然根本不值得，蝦餅是我覺得最雷的，不怎麼實在很做生意的店,"The best thing is the bowl of sauce on Matsusaka pigs. If there is no sauce, all of them are ordinary, and it is okay after having the sauce, so Matsusaka pigs must be ordered, but it is only okay. Each one is really ordinary. The taste is a bit worse, it makes people feel that it is not professional. Fortunately, there are two cute sisters. The simple little waiter who ordered the food won a lot of points and stars, otherwise it is not worth it at all. How can I really do a business shop",False
"本身是喜歡吃正宗的泰式，看了評論我的標準與期待已經降低一些。

清炒空心菜-有雜貨的那種味道，個人不太喜歡（不懂什麼味道可以點看看）

月亮蝦餅-看IG說很厚，實際吃到還可以

牛肉紅咖哩-味道不是我喜歡的，牛肉不錯是嫩的，吐司好吃😋

最期待的泰式椒麻雞-只能說是炸雞排（？味道不夠酸辣、魚露放太多，所以尾味不愛

泰式奶茶-味道偏淡，茶和煉乳都放不夠

玫瑰蝶豆花氣泡-好喝👍🏻加了檸檬讚讚！

青木瓜舒肥沙拉-又是一個失望，酸辣也不夠、也不習慣吃到有加洋蔥的青木瓜絲，因為洋蔥味會壓過去，但雞肉很好吃😋

以上是我個人口味最真實的評價：）","I like to eat authentic Thai style. After watching the comments and my standards and expectations, I have reduced it.

Stir-fried spinach-the taste of grocery, personally don’t like it.

Moon Shrimp Cake-Seeing IG is very thick, it is okay to eat it in actual

Beef red curry-taste is not what I like, the beef is good and tender, the toast is delicious

The most anticipated Thai pepper hemp chicken-can only be said to be fried chicken steak (? The taste is not hot and sour enough, and the fish is too much, so the tail taste does not love

Thai-style milk tea-light taste, tea and refining milk are not enough

Rose Butterfly Dancan Bubbles-Eliminated Lemon Praise!

Green Papaya Shufu Salad-Another disappointment, not enough hot and sour, and not used to eating green wood gourd with onions, because the onion flavor will overlap, but the chicken is delicious.

The above is the most authentic evaluation of my personal taste :)",False
"五星送榴槤冰
一直有小果蠅飛來飛去，影響用餐品質
餐點也普通但有點貴","Five -star durian ice
There have been small fruit flies flying around, affecting the quality of dining
The meal is also ordinary but a bit expensive",False
"平日中午只提供咖喱飯，如需點菜單上的要前一天預約。
口味尚可，松阪豬好吃","Only curry rice is provided at noon on weekdays.
The taste is acceptable, Matsusaka pigs are delicious",False
"地點在很舒服的師大分部外
空間比較簡約沒什麼裝潢
但透過一些燈光跟壁畫點綴
搭配熱炒感的泰式餐點
以及一些調酒選擇
不過炒空青菜太鹹了
蝦餅形狀很特別（小塊）
蝦仁有點不新鮮（雖然本就不該期待）
不過整體來說還不差  還行","The location is outside the division of the University of Normal University
The space is relatively simple and there is no decoration
But use some lights and mural embellishments
Thai meal with hot fried feeling
And some bartending choices
But fried green vegetables are too salty
Shrimp cake shape is very special (small pieces)
Shrimp is a bit not fresh (although you shouldn't expect it)
But overall is not bad, it's okay",False
"2023/10/1

每次經過都看到生意很好，所以決定試試。店裡環境算舒適，但因為今天系統出問題（用QR code點餐)，上菜有點慢。

綠咖哩的麵包好吃但咖哩過鹹，炒泡麵的味道我喜歡但麵太軟且無泰式味道，椒麻雞還可以。

在等待過程時，油煙味很重。","2023/10/1

Every time I see the business, I decide to try it.The environment in the store is comfortable, but because there is a problem with the system today (ordering with QR Code), the food is a bit slow.

The green curry bread is delicious but the curry is too salty. I like the taste of frying noodles but it is too soft and has no Thai flavor.

When waiting for the process, the smell of oil fume is very heavy.",False
"餐點好吃.平價.份量還OK
+10%服務費","The meal is delicious. The price is ok
+10%service fee",False
環境佈置得不錯，餐點推蝦餅與雞翅，但非常油……紅咖哩牛上來是冷得!看網友推炒飯於是加點，結果超級難吃，吃起來一點都不像泰國米，還濕濕爛爛的，超失望!!!,"The environment is well -arranged, and the meal push the shrimp cake and chicken wings, but it is very oily ... the red curry cow is cold! See the netizens push the fried rice, so add it, but it is not like Thai Donmy, it is wet and wet, but also wet. Rotten, super disappointed !!!",False
"我準時到餐廳，我們前一天就訂位了，同時店內只有兩組客人，兩組各六個人，就只給他們菜單，對我說可以用QR Code點餐，說菜單可能不夠，後面來了兩個客人，短髮女服務生卻都給他們菜單、放包包的籃子。

我這桌也才兩個人🙄衛生紙只放一張，短髮女服務生服務都非常敷衍。

餐點真的要聽留言的點，又小又貴，味道普通，月亮蝦餅是讓我最傻眼的，看看那份量就知道","I arrived at the restaurant on time. We booked the day before. At the same time, there were only two groups of guests in the store and six people in the two groups. They only gave them the menu. I can order to me. Both guests, short -haired female waiters give them menu and bags.

I only put only one toilet paper at this table. The short -haired female waiter service was very perfunctory.

The meal really needs to listen to the message of the message, it is small and expensive, the taste is ordinary, the moon shrimp cake makes me the most dumbfounded, just look at the amount",False
"酒好喝
推爆椰汁炸球
氣氛也很好～","Wine
Push coconut juice fried ball
The atmosphere is also very good ~",False
餐點都不難吃但口味沒有泰式的感覺,"The meal is not difficult to eat, but the taste does not feel Thai -style",False
"氣氛很好 適合聚餐
五星好評送榴槤冰","The atmosphere is very good suitable for dinner
Five -star praise to send durian ice",False
"首先這名字就滿有趣的，最近剛好很愛用甩態這個詞。店面位於一個巷子的十字轉角，裝潢沒有很引人注目，但是在冷清的巷弄內顯的特別溫暖。當天平日去只有我們一桌，後來吃完也只多了一組客人，雖然對店家來說可能不是好事，但我還滿喜歡這樣靜靜的氛圍。

食物真的不錯吃，每一道都有泰式卻似乎也有調和了台灣人的口味。辣度不能調整有點可惜，因為吃小辣的人會真的覺得滿辣的。泰式奶茶很好喝，可惜這次開車前往，沒有辦法喝調酒，畢竟這間是餐酒館，很多酒類可以選。

附近路邊有汽車停車格，如果都停滿會有點尷尬，因為附近沒什麼停車場。建議還是騎車或坐公車，不然就要平日晚上之類的可能還會有一兩格可以停。

整體五星，東西好吃是關鍵，應該被更多人發現。","First of all, this name is full of interesting.The store is located in a cross corner of an alley. The decoration is not very eye -catching, but it is particularly warm in the deserted alley.On the day, there was only one table of us, and then there were only one group of guests after eating. Although it may not be a good thing for the store, I also like such a quiet atmosphere.

The food is really good, and each Thai style also seems to have reconciled the taste of Taiwanese.It is a pity not to adjust the spicy degree, because people who eat little spicy will really feel spicy.Thai -style milk tea is delicious. Unfortunately, there is no way to drink alcohol. After all, this is a dining tavern. Many wines can be selected.

There is a car parking grid on the side of the road. If it is full, it will be a bit embarrassing, because there are no parking lots nearby.It is recommended to ride or take a bus, otherwise there may be one or two grids to stop on weekdays.

The overall five -star, what is delicious is the key and should be discovered by more people.",False
"蝦醬空心菜味道太重，不能接受太鹹的要三思
乾的椒麻雞加檸檬後，味道提升很多
綠咖哩有點太水，沒有很推
炒泡麵今天的畫龍點睛之筆，推薦大家必點！","Shrimp sauce hollow vegetables are too heavy, and those who cannot accept too salty should think twice
After the dried pepper hemp chicken plus lemon, the taste is much improved
Green curry is a bit too water, not very pushing
Fried instant noodles today's finishing touch, recommend everyone to order!",False
"泰式炒泡麵口味很讚 有一點小辣
烤類的鹽烤松阪豬很嫩 叻沙嫩雞串有些會有一點點柴
酒類在這附近算是CP值很高的
環境乾淨 整體用餐體驗推推","Thai fried instant noodle taste is a little bit spicy
Baked salt roasted Matsusaka pigs are very tender laksa and tender chicken skewers will have a little bit of firewood
The wine is a high CP value nearby
The environment is clean and overall dining experience push push",False
金沙巴沙魚和雞翅非常好吃，還有蝦醬空心菜也不錯，值得再回訪,"Golden Sabah sand fish and chicken wings are very delicious, and shrimp sauce is also good, and it is worth visiting again.",False
"環境：☆
服務：☆☆
食物：☆
初來乍到，甩泰，是在師大分部附近，學生時期大多在這邊
鹽烤豬五花
說不上好也說不上壞，就是個…市售鹹豬肉的味道，同時，店家可能為求出餐速度，稍微熱過就上餐，沒有鹽烤沒有香煎感，且沾醬是水水的甜辣醬
蝦醬空心菜
沒什麼蝦醬味，空心菜不油亮不脆口
綠咖哩雞
創意料理，椰香土司加綠咖哩雞，不過，咖哩溫溫的，且雞肉感覺是料理包的舒肥雞胸，單純拼湊吃不出店家手藝
甩泰蝦餅
蝦餅外皮酥脆，但魚漿有冰箱凍氣，打底的餅乾呢不脆有點溼氣，和鹹豬肉的醬汁一樣，是水水的甜辣醬
白飯
在菜上完後，服務生說明正在煮，約莫再等兩分鐘，但也不是熱騰騰的那種，是溫溫的
螺絲起子
既然是餐酒館，因該對於自身的酒水很有信心，但螺絲起子的柳橙與酒行同陌路
綜合以上，開放式廚房，導致室內用餐區油煙特別的重，食材餐點與酒水的部份不到位，外場迅速態度良好，吧檯服務無熱誠，最後一張照片是桌上有小蟲、蜘蛛…","Environment: ☆
Service: ☆☆
Food: ☆
When you first arrived, you dumped Thailand, near the Division of the Normal University. Most of the students were here.
Salt grilled pig five flowers
It ’s not good or bad, it’ s ... the taste of commercially available salted pork. At the same time, the store may be hot for meals for meals.
Shrimp sauce hollow vegetables
There is no shrimp sauce flavor, hollow vegetables are not oily or crispy
Green Curry Chicken
Creative cooking, coconut toast plus green curry chicken, but curry is warm, and chicken feels like a delicious chicken breast for cooking bags, simply patch together to eat the shop craftsmanship
Thai shrimp cake
The shrimp cakes are crispy, but the fish paste has a refrigerator frozen gas. The biscuits that are bottomed are not crispy and a little moist. Like the salted pork sauce, it is a sweet and spicy sauce of water.
Rice
After the dishes are over, the waiter explained that it is cooking. It is not the kind of hot, but it is warm.
Screw up
Since it is a dining tavern, because I should have confidence in my own wine, but the screw orange and the wine shop are on the same way.
Based on the above, the open kitchen leads to the particularly heavy oil fume in the indoor dining area. The ingredients meal and the part of the wine are not in place.",False
