Original,EN,Needs Review
"💰價錢
甩泰蝦餅$180
蝦醬高麗菜$150
鹽烤松阪豬$250
甩泰綠咖喱雞$180
泰奶$70
-
👻
這家每道菜幾乎都$200以下，真的是有夠便宜，想說來踩個點吃吃看，如果不好吃就算了，結果意外發現這家真的是又便宜又好吃🤩好適合餐聚或是三五好友揪一揪來吃。
-
🥠甩泰蝦餅：
可以一次吃到兩種「蝦餅」，月亮蝦餅&脆脆的蝦餅，這種雙蝦餅的組合還是第一次看到～月亮蝦餅熱熱的吃意外的很清爽，雖然是用油下去煎的，不過很鮮甜不會油膩，下面的蝦餅也很好吃，像在吃小餅乾一樣能夠一口接一個。
-
🫕綠咖喱雞：（可以續加一次咖哩醬！）
這家著名的就是咖哩系列，我想大家會這麼說是因為他們把綠咖喱做的很創新🤣
在吃的時候除了可以把醬汁淋在飯上吃，還可以拿旁邊附的熱壓奶酥吐司來沾，這樣鹹甜交織的味道真的意外的很搭，奶酥大大加分。而且雞肉是用舒肥過的雞胸肉，優質蛋白質一定要吃的吧，雖然口感還是不像一般的咖喱雞那樣軟嫩，但很適合在健康飲食的朋友（蛋白質含量高ㄚ
-
🍖鹽烤松阪豬：
肉質軟嫩，同行來的友人很愛這道，不過我就還好，覺得可點可不點
-
🥗蝦醬高麗菜：
蝦醬的味道不像典型的蝦醬味，不過是好吃的，可以點來配飯吃。
-
🥤泰奶：
不會過甜，大概是3分糖再甜一點點的甜度，就是普通好喝的一杯泰奶。
-
🌟總體來說每道菜都不會踩雷，但是等餐的時候會聞到廚房的蝦醬味，有點臭，不過除了這個之外都很棒，店員人也友善，是一間可以再來二訪的店🤩而且主要是夠便宜，多人一起吃的話還可以吃到很多不一樣的菜色～","💰 💰 💰
Thai shrimp cake $ 180
Shrimp Sauce Gaolica $ 150
Salt grilled padsa pigs $ 250
Plustering green curry chicken $ 180
Thai milk $ 70
-
Bleak
Each dish is almost $ 200. It is really cheap enough. If you want to say that you can step on a little bit, if it ’s not delicious, it’ s not good to find that this one is really cheap and delicious. Gathering or three or five friends to eat.
-
🥠 🥠 🥠 🥠 🥠:
You can eat two ""shrimp cakes"" at a time, the moon shrimp cake & crunchy shrimp cake, the combination of this double shrimp cake is the first time to see it ~ Moon shrimp cake is hot and unexpectedly refreshing. Fry the oil, but it is very sweet and not greasy. The shrimp cake below is also delicious. It can take a bite like eating small biscuits.
-
鸡 Green Curry Chicken: (You can continue to add curry sauce once!)
This famous one is the curry series. I think everyone will say so because they make green curry very innovative
In addition to eating the sauce on the rice when eating, you can also use the hot -pressed beacon toast next to it. This is really surprising that the salty and sweet taste is really unexpected.And chicken is a fat chicken breast, high -quality protein must be eaten. Although the taste is still not as soft as ordinary curry chicken, it is very suitable for friends with a healthy diet (high protein content is high.
-
： Salt grilled padsa pig:
The meat is soft and tender, and my friends who come with each other love this, but I am okay, I think it can be ordered
-
： Shrimp sauce Korean cabbage:
The taste of shrimp sauce is not like a typical shrimp sauce flavor, but it is delicious. You can order to eat with rice.
-
🥤 🥤 🥤:
It won't be too sweet, it is about 3 points of sugar a little sweet, which is a cup of thai milk that is delicious.
-
菜 Generally speaking, every dish will not step on the mine, but when you wait for meals, you will smell the shrimp sauce of the kitchen, which is a bit smelly, but it is great except this. The clerk is also friendly. The visit to the shop is mainly cheap enough. If many people eat together, you can also eat a lot of different dishes ~",False
"1.餐點後等了一小時十分鐘才吃到餐點
2.漏做餐點：
最後還漏掉一份餐點，當面跟服務人員說後才知道是漏做
3.漏給荷包蛋（後面補上）
4.服務人員於點餐時，未告知會等一小時以上

如有造謠，歡迎提告","1. After the meal, I waited for an hour and ten minutes before eating the meal
2. Make meals:
In the end, I missed a meal. I told the service personnel in person to know that it was missing.
3. Leak to poached eggs (supplemented later)
4. When the service staff is ordered, it will not be informed for more than an hour

If there is a rumor, please report",False
"泰式炒泡麵
有一顆溫泉蛋很讚
好吃！","Thai frying instant noodles
There is a hot spring egg very good
tasty!",False
"冷的椒麻雞：肉質鮮嫩，菜絲與番茄搭配得宜，但底部泡的醬汁的味道設計完全是失敗的。該醬汁是比較像是醬油味的醬汁而且微微帶苦，如果能設計成以酸甜為主軸的味道，會讓這道菜從3顆星升為5顆星。

甩泰蝦餅：就是一般還算符合標準的蝦餅，大約3-3.5顆星。如果能夠在蝦餅漿當中加入實際的小蝦仁或是其他適當的料，能夠讓這道菜的檔次往上攀升。

紅咖哩牛：0分，徹底0分的非常非常糟糕的一道菜，連在自己家的廚房都不會做出這種失敗的東西。咖喱的部分非常水，也沒有足夠的味道能夠下飯或是沾麵包；但真正最可怕的是那個牛肉，我真的是從來沒有在餐廳吃過這麼劣質的牛肉。非常的水、非常的粉（不是嫩），然後也完全沒有燉透，整個就是一塊咬不爛的粉粉的肉，吃到覺得真的很噁心。這代表的是你們選用的肉品非常劣質，烹調技巧也非常劣質。這一道菜是我最高只能給你們兩顆星的原因。

泰式炒泡麵：4顆星，在炒泡麵上面放溫泉蛋是一個非常好的作法，拌進去之後吃起來會有一種黏膩的爽感，增添了不少風味跟特色。小缺點是整道麵會偏乾、偏黏膩，建議最好是搭配另外點的的蔬菜或能解膩的東西食用，才能最大化這道炒泡麵的美味。

總體來說我不明白為什麼這家店能夠在Google上面拿到4.8，這完全是不合理也不應該的（或許是因為這價位在台北來說很便宜吧），就算扣掉那道雷到令人詫異的牛肉，這家店的分數也應該最高會在4.0上下才是反應真實的水準。","Cold pepper chicken: The meat is tender and the vegetable shreds are suitable for tomatoes, but the flavor design of the sauce at the bottom is completely failed.The sauce is more like a sauce -flavored sauce and slightly bitter. If it can be designed as a taste of sweet and sour as the main axis, it will make this dish rise from 3 stars to 5 stars.

Thai shrimp cake: It is generally the standard shrimp cake, about 3-3.5 stars.If you can add actual shrimp or other appropriate ingredients to the shrimp cake pulp, the grade of this dish can be risen up.

Red Curry Cow: 0 points, a very, very bad dish, even the kitchen in his own home will not make such failed things.The curry part is very water, and there is no enough taste to get meals or dipped in bread; but the most terrible thing is the beef, I really have never eaten such inferior beef in the restaurant.Very water, very pink (not tender), and then there is no stew at all. The whole is a piece of meat that cannot be bitten. It feels really disgusting when it is eaten.This means that the meat you choose is very inferior, and the cooking skills are also very inferior.This dish is the reason why I can only give you two stars.

Thai -style frying noodles: 4 stars. Putting hot spring eggs on fried instant noodles is a very good method. After mixing it, it will have a sticky refreshing feeling, adding a lot of flavors and features.The small disadvantage is that the whole noodles will be dry and sticky. It is recommended to use another vegetable or the things that can be worn to be eaten to maximize the deliciousness of this fried noodles.

Overall, I don’t understand why this shop can get 4.8 on Google. This is completely unreasonable or should not be (maybe because the price is cheap in Taipei), even if the thunder is deducted from that thunder to the order, People with surprised beef, the score of this shop should also be up to 4.0 to reflect the real level.",False
"氣氛很好 服務、環境都很舒服 音樂好聽❤️
餐點很好吃 蝦仁炒飯味道也很好小孩也很喜歡
鹽烤豬五花好推薦","The atmosphere is very good service, the environment is very comfortable to music, nice ❤️
The meal is very delicious, the shrimp fried rice tastes good and very good children and like it
Salt grilled pig five flowers are good recommended",False
"氣氛舒服 餐點好吃
炸雞翅又酥又香
打拋豬和綠咖哩很下飯～
冬陰功海鮮料很多","The atmosphere is comfortable and delicious
Fried chicken wings are crispy and fragrant
Drop pigs and green curry are very good ~
Winter Yin Gong Seafood Food",False
環境和店內營造得很好，但實際吃起來覺得偏普通，感到可惜的一間店。比較不像是大家既定印象中的餐酒館，我覺得以日常餐廳但有備酒來稱呼比較合適，上菜的速度真的挺慢的。點了很多道，但覺得比較好吃的只有鹽烤松阪豬以及爆將椰汁球。其他的都算普通：冷椒麻雞的雞肉片就是普通的白斬雞淋了椒麻的醬汁，但醬汁吃起來一點都沒有椒麻的爽感。綠咖哩吃起來也不夠香，味道上有種無法解釋但我不太喜歡的味道。甩泰蝦餅的大小偏小，和想像中的泰式蝦餅有一段差距。炒泡麵的口感太軟了！完全不是好吃炒泡麵該有的水準。對我個人而言就是一間一次店，有吃過就好。,"The environment and the store are created very well, but it actually tastes ordinary and feels a pity.It is less like a dining tavern in everyone's own impression. I think it is more appropriate to use daily restaurants but have wine preparation. The speed of serving is really slow.I ordered a lot of ways, but I felt that the only delicious one was the salt -grilled Matsusaka pig and the coconut balls were burst.The others are all ordinary: The chicken slices of cold pepper hemp chicken are ordinary white chopped chickens drizzled with pepper sauce, but the sauce has no refreshment of pepper hemp at all.Green curry is not fragrant enough, there is a taste that cannot be explained in the taste, but I don't like it.The size of the Thai shrimp cake is small, and there is a gap with the Thai shrimp cake in imagination.The taste of fried noodles is too soft!It is not the level of delicious fried noodles at all.Personally, it is a shop once, just have eaten it.",False
"餐點：1 服務：1 氣氛：4

真的給1顆星都太多。
一句話講結論：你點的可能不是紅咖哩是冰咖哩！

商業午餐椒麻雞上來沒提供醬汁，被提醒，但服務生只是一臉抱歉。
接著上的紅咖哩整碗是冰的，問咖哩是冰的是正常的嗎？服務生拿走只說，啊忘了加熱，幫你加熱。

結帳時也沒有再次針對餐點是冰的事件有任何口語道歉。

噢，不過午餐時段免服務費。

希望吃了一大口才發現是冰咖哩的朋友不要腸胃炎。","Meal: 1 Service: 1 Atmosphere: 4

There are too many stars.
Conclusion in a word: You may not order red curry but ice curry!

The commercial lunch pepper hemp chicken did not provide sauce and was reminded, but the waiter just looked sorry.
Then the red curry bowl is ice. Is it normal to ask the curry?The waiter took away and said, ah, forgot to heat and help you heated.

At the checkout, I did not apologize for the meal again.

Oh, but free service fee during lunch.

I hope that a big bite to find that it is a friend who is ice curry.",False
"地點很方便，可以喝酒吃飯🍽️
咖喱會配奶酥吐司，很喜歡💕
炒泡麵的味道跟打拋豬一樣，雞翅也很好吃（這次是點香茅口味）","The location is very convenient, you can drink and eat 🍽️
Curry can be equipped with milkcisy toast, I like it very much
The smell of frying instant noodles is the same as playing pigs, and chicken wings are delicious (this time it is the flavor of lemongrass)",False
"用QRcode點餐還要收服務費( ? _ ? )

一個人吃快$700，不能刷卡

馬桶不通有點可怕：）

食物和酒都很普通，完全沒有餐酒館的水準，說是熱炒還差不多，價格也比較符合。店內油煙味超重，不建議介意身上沾染食物味的人來吃

建議店名把「餐酒館」拿掉，比較不會引人誤會…","To order with QRCODE, you need to charge a service fee (? _?)

Eat it alone for $ 700 and cannot swipe the card

The toilet is not terrible :)

Food and wine are very ordinary. There is no level of restaurant and tavern. It is said that it is similar to hot frying, and the price is more consistent.The smell of oil fume in the store is overweight.

It is recommended that the store name remove the ""meal tavern"", which will not be misunderstood ...",False
"可惜今天來炒泡麵沒了
打拋豬跟綠咖哩都不錯，份量足夠

但打拋豬稍微油了一點
不過還是很下飯

綠咖哩椰奶味很足我很愛
雞肉量也不少，也軟嫩
搭配的烤土司是有夾奶酥的

特別的是飯是選用台梗九號，很讚
而且有罕見的碟豆花

價位也合理，有機會再來試試別的餐點","Unfortunately, I'm gone today
Bad pigs and green curry are good, the portion is sufficient

But the piglets are a bit oily
But it's still very good

Green curry coconut milk flavor is very sufficient, I love it
There is also a lot of chicken, soft and tender
The grilled grilled soil is cigarette

The special is that the rice is used to choose the No. 9 of the stalk, which is very good
And there are rare discans

The price is also reasonable, I have the opportunity to try other meals again",False
每一道菜都少了泰國味的泰國料理餐廳，量很少,"Each dish has less Thai cuisine restaurants in Thailand, and the amount is very small.",False
"金沙沙巴魚好吃😋
商業午餐可以無限續飯續醬
泰國米的飯很好吃😋
今日商業午餐綠咖喱🍛
打拋豬飯，因為只有2人這樣就蠻飽的
下次有機會再點松阪豬
打卡五星評論還有送榴槤冰","Jinshababit fish is delicious 鱼
Commercial lunch can be continuously renewed and renewed
Thai rice is delicious
Today's commercial lunch green curry 🍛
Put pig rice, because only two people are quite full like this
Next time I have the opportunity to order Matsusaka pig again
Pickup five -star comments and durian ice",False
"餐點好吃😋雞翅夠味，綠咖哩牛很下飯，不會太辣
椒麻雞走清爽口感，還不錯👍","The meal is delicious, the chicken wings are delicious enough, the green curry beef is very delicious, it will not be too spicy
The pepper hemp chicken is refreshing, not bad",False
"今日蒞臨朋友合開的餐廳用餐，主打泰式料理的餐酒館尤其少見，中午和晚上賣的餐點是不一樣的，中午賣咖哩飯，晚上變身餐酒館，中午販售的咖哩飯醬汁非常濃郁，在店內用加醬加飯不用錢，外帶更便宜，非常適合附近的學區以及家庭來吃，下次二訪就是餐酒館時段啦！再po文給大家看！
更二訪
就說會來二訪吧！
晚上真的變身餐酒館耶
這次一起來吃的人不多
所以沒有每道菜都來一遍😂
我本身沒有喝酒的習慣有點可惜
每道料理都是學生價
點五道就很飽了🥴","I have dine restaurants that I will open together today. The restaurant that focuses on Thai cuisine is particularly rare. The meals sold at noon and evening are different. Selling curry rice at noon, turning into a restaurant at night, curry rice sauce sold at noon Very rich. Use sauce and rice without money in the store. It is cheaper. It is very suitable for nearby school districts and families to eat. The next second visit is the dining tavern time!Let's show you again!
Two visit
Just say that you will come to the second visit!
I really transform into a dining tavern at night
There are not many people who come to eat together this time
So there is no dish for a while 所以 所以 所以 所以 所以
It's a pity that I don't have the habit of drinking
Each dish is a student price
You're full of five ways 很",False
"上菜速度雖然有點慢
但東西是好吃，很多下飯的東西
金沙巴沙魚好吃特別推一個👍","Although the speed of serving is a bit slow
But things are delicious, a lot of food for meals
Golden Sabah Sand Fish is delicious and push a special push",False
"難怪谷歌搜尋多星好評！
店家不僅服務親切熱情，
菜色更是了得！
台梗9號白飯配上夠味的泰式料理，
👍👍👍","No wonder Google search for multi -star praise!
The store not only serves intimate enthusiasm,
The dishes are even more good!
Thailand No. 9 white rice with enough Thai cuisine,
Bleak",False
"我吃過最難吃的泰式料理
裡面根本都是冷凍的微波食品吧
而且餐廳室內油煙超大超級臭吃完還以為自己泡在油鍋裡面
是非常糟糕的體驗 請大家不要相信這種打卡餐廳","I have eaten the most difficult Thai dishes
There are frozen microwave foods at all
And the restaurant's indoor oil fume is very super stinky and thinks that you are soaked in the oil pan.
It's a very bad experience, please don't believe this kind of punch -in restaurant",False
"白飯粒粒分明 軟硬適中 還伴著椰香味很好吃
咖喱雞肉很軟嫩
打拋豬味道濃厚適合配飯
蝦餅酥脆不過硬
整體餐點很讚","The rice grains are clear, soft and hard, and the coconut aroma is delicious
Curry chicken is very soft and tender
Putting pigs is strong and suitable for meals
Shrimp cakes are crispy but hard
The overall meal is great",False
"綠咖哩雞肉很嫩！
白飯也煮的恰到好處
第一次嘗試泰式奶茶shot
可以嘗試看看還不錯！
梅荔佳人很適合女生喝～
店家服務也是100分
大推～","Green curry chicken is tender!
The rice is also cooked just right
The first time I tried Thai -style milk tea shot
It's not bad to try to see it!
Mei Li is very suitable for girls to drink ~
The store service is also 100 points
Big push ~",False
"餐點還可以接受，但店員拿餐點過來，還沒有放到桌上就翻倒，我們楞住了，店員也楞住了，因為倒出了一大半，家人趕緊把部分食物放回去，擔心散落到地上，我們以為店員會拿回去處理，結果店員只把還留在桌上的部分用紙巾包一包拿走，什麼話也沒有說，一句抱歉、不好意思也沒有。
我們一直在等，以為後續會拿回去重做一份或者補回少掉的部分，結果什麼都沒有，少掉的部分也沒有補，而店內的員工只顧著在聊天，真的很傻眼。結帳時也沒有對食物翻落餐桌的事情問一下情形，只問餐點可以接受嗎？","The meal is acceptable, but the clerk took the meal and turned it over. Before it was put on the table, we turned it down. When we were scattered on the ground, we thought that the clerk would take it back to deal with it. As a result, the clerk only took part of the part of the table with a paper towels and took it away. He didn't say anything, sorry, sorry.
We have been waiting, thinking that we will take it back to make a copy or make up for less. As a result, there is nothing, and there is no replenishment of the less part, and the employees in the store only care about chatting, which is really dumbfounded.I did n’t ask about the situation when I checked the food at the dining table. Can I only ask me the meal?",False
學校門口對學生很方便，燈光美氣氛佳，可能是學生口味較重，口味偏鹹，尤其蝦醬空心菜湯汁很鹹。,"The school entrance is very convenient for students. The lights are beautiful. It may be that the students have a heavy taste and salty taste, especially the shrimp sauce, serving of the cabbage soup, and the soup is very salty.",False
"看到這家泰式評價不錯決定來吃吃看，點了泰式蝦餅吃起來有點像冷凍食品拿來煎熟的感覺，還點了一份綠咖喱結果送上來的時候，也不是熱，而且味道很淡水水的。還在點了一份冬蔭鍋，味道也很普通。裡面的海鮮用料很多值得稱讚。但是味道可能要再加強。
我覺得撇除食物上，內用的環境燈光氣氛都很好。服務人員的態度也都很好，會隨時注意客人需要什麼。
後來發現評價那麼高不知道是不是因為評論五星有送榴槤冰。
總結環境跟氣氛還有服務人員都很好的店，希望在食物的美味程度上可以更加提升。
也許每個人的味蕾不同，但是光送上來的綠咖喱不熱，這就是很嚴重的問題。兩個人吃下來也要快900元，不算是平價美食。","Seeing this Thai -style evaluation, I decided to eat and eat. I ordered the Thai shrimp cake to eat a bit like frozen food to be fried. When I ordered a green curry result, it was not hot. And the taste is very fresh.I was still ordering a shade pot, and the taste was very ordinary.Many seafood materials are praised.But the taste may be strengthened.
I think the atmosphere of the environmental lighting atmosphere is very good.The attitude of the service staff is also very good, and they will always pay attention to what the guests need.
Later, I found out that the evaluation was so high. I don't know if it was because the five -star was given durian ice.
Summarize the environment and the atmosphere of the atmosphere, and the service staff are very good. I hope that the deliciousness of food can be improved.
Maybe everyone's taste buds are different, but the green curry sent by light is not hot, which is a very serious problem.Two people eat it almost 900 yuan, not a cheap food.",False
"漲價了….漲很多🥲
金沙巴沙魚炸的很好吃（比較油） 蛋黃醬愈濃郁愈好😍
蝦醬空心菜偏死鹹 香味沒有炒出來
綠咖哩雞醬是較淡的那種 配麵包友人很愛 個人喜歡濃郁一點
炒泡麵調味不錯 但麵體太軟不Q 200元偏貴
建議店家能加個起司","The price has increased ....
Golden Sabah sand fish is delicious (more oily) egg yolk sauce, the stronger the more stronger, the better
Shrimp sauce empty fragrance is not fried without salty fragrance
Green Curry Chicken Sauce is a lighter kind of bread friend who loves it. Individuals are more rich.
Frying instant noodles are good, but the facade is too soft and not q 200 yuan is expensive
It is recommended that the store can add a cheese",False
泰式料理有創意有傳統，年輕人的巧思與努力值得鼓勵,"Thai cuisine is creative and tradition, and the ingenuity and efforts of young people are worthy of encouragement",False
在師大附近安靜的巷口，內部溫馨，松阪豬可惜有點冷掉味道與口感依然好，紅咖哩很下飯，可以續一次咖哩醬，也有酒單，適合聚會,"At the quiet alley near the Normal University, the inside is warm. The Matsusaka pig is a bit cold and the taste is still good. The red curry is very delicious. You can continue the curry sauce once.",False
"外帶的話是可以接受的價格！
綠咖哩135超好吃（水煮蛋我自己加的，抱歉）
雞肉不確定是胸還是里肌，但是超嫩，比起用雞腿真的好吃太多了
感謝開在學校附近，以後有事沒事會去吃吃喝喝的","If you take it, it is acceptable price!
Green Curry 135 is super delicious (I add the boiled eggs, sorry)
The chicken is not sure whether it is the chest or the muscle, but it is super tender, which is much more delicious than using chicken legs.
Thank you for driving near the school. If you have something to do in the future",False
"巴沙魚很好吃
打拋豬也不錯
雞翅還行
湯nono
炒泡麵Nono","Basha fish is delicious
Putting pigs is also good
Chicken wings are okay
Tang Nono
Fried instant noodles NONO",False
氣氛不錯，好喜歡他炸魚！！,"The atmosphere is good, I really like his fried fish!Intersection",False
綠咖哩非常濃郁；酥炸豬五花口感鮮脆、味道很好🥰 品嘗到新品熱的椒麻雞，非常幸運❤️全都是下飯好菜～配上好酒，適合朋友家人聚餐 …,"Green curry is very strong; crispy pigs have fresh and crispy mouth, and the taste is very good. Taste new hot pepper chicken, very lucky ❤️ All are good foods ~ accompanied by good wine, suitable for friends and family to dinner ...",False
店家服務員很客氣！態度很好，餐點好吃價格合理、還有調酒飲品 適合聊天吃飯！,"The waiter is very polite!The attitude is very good, the meal is delicious, the price is reasonable, and the bartending drink is suitable for chatting and eating!",False
食物份量稍微少一點，但服務員都有提前說明過～ 味道都還不錯，喜歡綠咖喱的麵包和巴沙魚～,"The amount of food is slightly less, but the waiters have explained it in advance ~ The taste is not bad. I like green curry bread and Basha fish ~",False
