Original,EN,Needs Review,Positive,Negative,Neutral,Compound
"2023/8/25

與友人來訪。

十分喜歡店裡的氛圍，音樂美式復古風、裝潢奢華優雅，很有大亨小傳年代感。

點的兩款調酒都十分順口風味迷人，
小點心炸細薯條也可口。

調酒約$400～500/杯

服務態度也十分熱情，整體感覺很優的一家店，會再來訪","2023/8/25

Visit with friends.

I like the atmosphere in the store very much. Music American retro style, luxurious decoration and elegant decoration, very typhoons.

The two types of bartender are very smooth and charming.
Small snacks fried fried fries are also delicious.

Mixing about $ 400 ～ 500/cup

The service attitude is also very enthusiastic. A shop with a very good overall feeling will be visited again",False,0.297,0.0,0.703,0.9748
喝到第三杯德瀧特地幫忙調了一杯松露口味的，有點出乎意料，又再增加起司奶泡改版給我，超好喝！！！推推，推薦朋友再來~,"Drinking the third cup of Demo Special Truth to help adjust a glass of truffle flavor. It was a bit unexpected, and then added the cheese milk bubble to me. It was super delicious!IntersectionIntersectionPush, recommend friends to come again ~",False,0.34,0.0,0.66,0.9476
蘇菲真的太棒了！不僅調酒技術一流，而且非常親切友善，讓人一進來就感覺很輕鬆自在。和她聊天非常有趣，幽默又好聊，完全沒有距離感。下次一定還會再來找她喝一杯！,"Sophie is really great!Not only is the bartending technology first -class, but also very kind and friendly, it makes people feel very relaxed as soon as they come in.Chatting with her is very interesting, humorous and easy to chat, there is no sense of distance at all.Next time, I will come to her to have a drink again!",False,0.332,0.035,0.633,0.9797
店員們都超美人超好又很親切，讓人覺得很舒服的一家店。裡面空間很舒適，覺得跟朋友一起喝酒起來不負擔。酒品類名字都取的很有趣，長島算是台北幾家喝起來誠意十足又好喝的店家🥺食物也非常優秀，唯獨份量比較小了一些，但整體還是非常棒🫶🏻,"The clerk is super beautiful and very kind, and it makes people feel very comfortable.The space inside is very comfortable, and I feel that drinking with my friends is not affordable.The names of the wine category are very interesting. Long Island is considered to be good and delicious in Taipei. It is also very good.",False,0.402,0.0,0.598,0.9848
門口好過癮😆食物好好食🤤飲品名有趣，個人鐘意水果調酒👍🏼bar 枱打卡應該會幾靚🤩氛圍很好，工作人員很友善。廁所嘅設置非常貼心❤️整體體驗好好，推薦大家黎台北一試～,"The door is very addictive 😆 good food 🤤 interesting drinks names, personal hours fruit cocktail 👍🏼bar table photography should be quite beautiful 🤩 Very good atmosphere, the staff is very friendly.The toilet is very courteous ❤️ The overall experience is good, I recommend you to come to Taipei ~",False,0.331,0.0,0.669,0.9743
"服務超棒超貼心🥰
餐點好好吃
調酒還沒喝酒醉了推薦大家來","Serving superb and super intimate 贴
Meal delicious
I have not drunk yet, I recommend everyone to come, I recommend everyone",False,0.555,0.0,0.445,0.9567
"超喜歡🥹🥹
完全可以變成常來的基地
調酒好喝是基本，很難得的是酒單也很有創意！預計之後來把所有水果系列的喝遍～
餐點也很有水準，甚至味道重的辛香料都很貼心地分開放，非常適合約會（？） …","I like 喜欢 🥹🥹 🥹🥹 🥹🥹
It can be turned into a common base
The bartender is basic, and it is rare that the wine list is also very creative!It is expected to drink all the fruit series later ~
The meal is also very standard, and even the heavy spices that are heavy are openly open, which is very suitable for dating (?) ...",False,0.042,0.0,0.958,0.4199
"河中女神超讚的是我的愛
松露請思考後小心飲用

Anywayyyyy週末放鬆的好地方with best friend 真的是太棒了❤️❤️❤️","The goddess in the river is my love is my love
Truck please think carefully after thinking

Anywayyyyy's good place with a good place with weekend, With Best Friend is really great ❤️❤️❤️",False,0.507,0.0,0.493,0.9831
"氛圍很好，點的酒都很好喝
該濃的濃也很順口
在現在動輒每人低消都要5-600的酒吧裡面，少數低消只需一杯酒或餐食的bar，真的很難得～
哦對了，Brian也很棒～謝謝招待的shot","The atmosphere is very good, the order of the order is very good
The thickness is also smooth
In the bar that is low at 5-600 at a low disappearance of each person now, a small number of low consumption only needs a glass of wine or meals. It is really rare ~
Oh yes, Brian is also great ~ Thank you for the entertainment shot",False,0.241,0.077,0.682,0.9258
"環境乾淨，有氣氛。
沒想到捷運站附近的建築物暗藏酒吧。

服務人員親切。
調酒好喝 ，純，不像有的其他酒吧加太多水 。
奶油啤酒超順口。
調酒的酒精濃度如酒單的內容介紹 ，可以參考。

食物有點過雞翅 巧克力薯條都蠻美味的。
是一間會一直去的店","The environment is clean and there is an atmosphere.
I did not expect a hidden bar near the MRT station.

The service staff is kind.
The bartending is delicious, pure, unlike some other bars add too much water.
Cream beer is super smooth.
The concentration of alcoholic alcohol is introduced like the content of the wine list, which can be referred to.

The food is a bit more delicious.
It's a shop that will always go",False,0.224,0.0,0.776,0.9647
"位子在雙連捷運站出來2分鐘
從中山站走過來也大概5分鐘而已

店內氣氛很好，相對東區店是新開
但更為寬敞舒適
除了吧台的位子都是舒服的沙發座
大推松露薯條，比一般酒吧的薯條都好吃很多
是那種很細很脆的薯條！
酒的話推薦搖搖晃晃的湖中女神
很濃很好喝，一杯就夠勁那種

Bartender 人都很 nice
過年期間來人沒有那麼多
真的非常舒服
3,000 以上才可以刷卡","Sites stand out for 2 minutes at Shuanglian MRT
It is only about 5 minutes to walk from Zhongshan Station

The atmosphere in the store is very good.
But more spacious and comfortable
Except for the seats of the bar is a comfortable sofa seat
Large tweef potato strip is much better than the fries of the average bar
It is the kind of fine and crispy fries!
I recommend shaking the goddess in the lake
Very thick and delicious, a cup is enough

Bartender people are very nice
There are not so many people who come during the New Year
Really comfortable
You can swipe the card for more than 3,000 or more",False,0.248,0.015,0.737,0.9882
梨進來了很讚👍🏻松露薯條很好吃～,"The pears come in, so it is very delicious.",False,0.333,0.0,0.667,0.6115
"這次是二訪
食物依舊非常優秀，每一款炸物都讓人一口接一口，最推薦可可粉薯條，真心好吃唰嘴讓人停不下來，不過份量偏精緻，若想當正餐吃飽可能有點貴

調酒選擇多而且有各種主題非常特別，這次喝了兩杯都是電影主題，Gatsby那杯滿足我所有想像、黑暗騎士則是讓人品嚐黑白正邪之中的拉扯，十分有趣

空間也很愜意，能夠讓人舒適放鬆；服務親切到位，也不會讓人感受到壓力！","This time is the second visit
The food is still very excellent. Each fried material makes people take a bite. The most recommended cocoa fries. It is really delicious.

There are many choices of bartending and there are various themes. This time I drink two cups this time is a movie theme. The Gatsby's cup satisfies all my imagination and dark knights.

The space is also very comfortable, which can make people comfortable and relax; the service is intimate, and it will not make people feel stressful!",False,0.218,0.031,0.75,0.9621
超頂！跟朋友來喝很開心～店員非常友善！也是很好的體驗，有專門的吸菸區超讚，下次還會想來～,Super top!It's very happy to have a friend with friends ~ The clerk is very friendly!It is also a good experience. There is a special smoking area. I will come to the next time ~,False,0.413,0.0,0.587,0.9656
"入口很有特色非常有趣，服務態度很好👍
食物好吃 酒也不錯，店內空間也是寬敞乾淨
期待再訪。","The entrance is very distinctive, very interesting, and the service attitude is very good.
The food is delicious, and the space in the store is also spacious and clean
Looking forward to visiting again.",False,0.3,0.0,0.7,0.9161
"一進門我直接愛上！！店裡的味道真的太棒！太棒了！非常喜歡！！
連酒都還沒上我就想先給五顆星！！！","I fell in love when I entered the door!IntersectionThe taste in the shop is really great!marvelous!I like it very much!Intersection
Before the wine is on, I want to give five stars first!IntersectionIntersection",False,0.246,0.0,0.754,0.8572
"酒類都很有創意
王牌天神分酒海有驚艷到
很像在喝泰國菜🤣 味道超級妙 但是好喝的那種
長島有伯爵香氣 非常好喝
奧黛麗的香水味 真的很好聞 有種木質調的香氣 喝起來也很棒
炸生蠔很優秀
點的薯條是起司跟可可粉融合的口味
沒有想到這麼搭！
但有個店員說要等一下再來幫我們點餐
結果沒過多久去幫我旁邊的妹子點餐 不是很懂？
不是妹子就會晚一點才幫點餐嗎 哈哈哈
除此之外 餐點跟酒類都很棒！","The wine is very creative
Ace Tianshen dividing the sea of ​​wine is amazing
It's like drinking Thai cuisine. The taste is super wonderful but delicious
There is a count of counts in Long Island. The aroma is very delicious
Audrey's perfume flavor is really good to smell a kind of wooden tone.
Fried oysters are excellent
The fries of the order are the flavor of the fusion of cheese and cocoa powder
I didn't expect that!
But a clerk said that he would wait for us to order for us to order
It didn't take long to help the girl next to me to order meals.
Will it be a little too late to help or order? Hahaha
In addition, the meals and wine are great!",False,0.301,0.0,0.699,0.9943
Book ing Bar是入口有機關的酒吧，傳說要撬開牆壁按下發亮的書本才能開門（笑）。結果我初訪時因為門口等開門的人很多，店家就直接開門，也就沒體驗到了（擺手）。食物和酒都很不錯，裝潢也很有質感，相當不錯。,"Book ING BAR is a bar where there is an at the entrance. It is said that it is necessary to pry open the wall and press the shiny books to open the door (laughs).As a result, when I first visited the door, because there were many people waiting at the door, the shop opened the door directly, and I did not experience it (wave).Food and wine are very good, the decoration is also very textured, and it is quite good.",False,0.075,0.0,0.925,0.7496
"結論：水果系調酒必點、空間大又舒適（廁所有三間）、鹹酥雞曼谷麵肉醬薄餅很值得吃。

剛好沒拍到調酒有點扼腕.....
今天的調酒真的滿分！！！
捷運站旁邊的酒吧好選擇，空間很大而且感覺得出來很乾淨，連廁所都有三間（這真的超級重要）

水果系調酒都很好喝，當日最喜歡的是柚豫不決，平常喜歡喝龜記的紅柚翡翠的會很愛，但有加肉桂提味。

第二喜歡的是長島冰茶（伯爵茶版本），相對於一般的長島冰茶更加爽口，甜度也較低一點。

當日點的調酒shot，酸甜滋味非常討喜，另外有一盤純琴酒的，非常順口且味道超級香，非常推薦點個shot試試。

吃的部分主要是小點，但我們也是大撒幣當主餐在點，個人最喜歡的是曼谷麵（喜歡到點了兩碗）、鹹酥雞還有超級好吃的肉醬薄餅，要注意一下四季豆個人覺得沒處理很好，沒有撥絲所以很硬，建議可避開。薯條好吃但偏油。","Conclusion: Fruits must be tuned, large and comfortable in space (three toilets), salty crispy chicken Bangkok noodle meat sauce pancakes are worth eating.

It's a bit stretch if I didn't take a drink ...
Today's bartending is really full!IntersectionIntersection
The bar next to the MRT station is good, the space is very large and feels very clean, there are three toilets (this is really super important)

Fruits are very delicious. The favorite of the day is the pomelo. I usually like to drink the red grapefruit emeralds who drink turtle.

The second favorite is the long island ice tea (Earl Tea version), which is more refreshing than the general Long Island ice tea and a lower sweetness.

The sibling Shot on the day, the sweet and sour taste is very pleasing. In addition, there is a plate of pure piano wine, which is very smooth and the taste is super fragrant. It is recommended to try a shot.

The main part of the food is a small point, but we are also the main meal of big coins. Personally, my favorite is Bangkok Noodles (I like to order two bowls), salty crispy chicken, and super delicious meat sauce cakes. Pay attention to pay attention to I personally think that the four seasons do not feel good, so it is not very hard, it is recommended to avoid it.French fries are delicious but oily.",False,0.209,0.039,0.752,0.9916
同為牡羊座的白雪，服務態度很讚👍,"The white snow, who is also a Aries, has a great service attitude.",False,0.255,0.0,0.745,0.6249
這裡的氛圍絕佳，非常舒適。Winnie非常友善和專業，從我們進門到離開一直都非常照顧我們。酒單豐富多樣，我特別喜歡他們的長島伯爵，每一口都充滿驚喜和創意。也強烈推薦他們的可可薯條,"The atmosphere here is excellent and very comfortable.Winnie is very friendly and professional, and we have always taken care of us from entering the door to departure.The wine list is rich and diverse. I especially like their Earl of Long Island. Each bite is full of surprises and creativity.It is also highly recommended for their cocoa fries",False,0.294,0.0,0.706,0.9627
水果類調酒果香充足酸甜得宜，幸福口餃口味超絕，可可粉起司薯條鹹甜蹦出煉乳香很特別，音樂選曲偏swing很chill，很適合來休息放鬆喝兩杯,"Fruit sorting fruit aroma is full of sweetness and sweetness, and the taste of happiness dumplings is superb. Cocoa pink flavors of flavors are sweet and sweet.",False,0.486,0.031,0.483,0.9628
小白服務好！耐心介紹我們喝調酒🍸請我們喝shorter 大家有事沒事都來喝一杯吧❤️,"Xiaobai has good service!Patiently introduce us to drink alcohol 我们 Please drink a drink for everyone, everyone, let's have a drink ❤️",False,0.207,0.0,0.793,0.6696
"Speakeasy 風格的酒吧
門口是隱藏暗門

交通超方便
在雙連捷運站一號出口旁邊

口水醬水餃超級好吃
醬肉餅口味特別
類似肉醬起司打拋豬的感覺
調酒發想都很特別

氣氛好環境舒適
Bartender 好聊
冷氣偏冷需要多穿一點
雖然有毯子可以借","Speakeasy style bar
The door is hidden secret door

Transportation is super convenient
Next to the exit of Double MRT Station

Salm sauce dumplings are super delicious
Sauce meat cake taste is special
Similar to the feeling of meat sauce cheese, throwing pigs
Introduction to bartender is very special

The atmosphere is good and the environment is comfortable
Bartender talked well
Cold air conditioner needs to wear more
Although there are blankets to borrow",False,0.292,0.014,0.693,0.9769
"舒服輕鬆歡樂的氣氛

雷娜Raina超讚超正超可愛👍","A comfortable and happy atmosphere

Raina Raina is super loved and cute 👍",False,0.664,0.0,0.336,0.9571
"入口好玩！東西好吃！氣氛超讚🤤🤤🤤
詩詩 Brian 讚讚！","The entrance is fun!Things are delicious!The atmosphere is superb 赞
Poetry Brian praises!",False,0.432,0.0,0.568,0.8547
"調酒超好喝～😍😍
喝了大概三四款，尾韻都很香很有特色，不苦
點了寶貝老闆能量飲 用奶瓶裝超酷！
建議大家可以點鹹酥雞～非常好吃～
泰式水餃也很開胃
bar tender 服務優質
還請我們喝shot（超級好喝）
不過這間價位偏中高，
一杯調酒跟朋友合點四樣炸物均銷700左右
但覺得內容物很值得！！推推","Mixing is super delicious ~ 喝
After drinking about three or four, the rhyme is very fragrant and distinctive, not bitter
Order the baby boss energy and drinking the bottle is super cool!
It is recommended that you order salty crispy chicken ~ Very delicious ~
Thai -style dumplings are also appetizing
Bar Tender service high quality
Please also ask us to drink shot (super delicious)
But this price is high,
A cup of bartending and friends are sold around 700
But I think the content is worth it!IntersectionPush",False,0.28,0.011,0.71,0.9732
店員招待兩次Shot都好好喝♡♡,The clerk entertains shot twice and drinks it.,False,0.327,0.0,0.673,0.5267
"松露薯條很好吃、調味很讚。
調酒點了桂花紅心芭樂，味道也很不錯。
服務我們這桌的是Winnie，態度親切。","Todgeflies are delicious and flavored.
The bartender ordered the osmanthus red -hearted guava, and the taste was also very good.
Winnie serving our table is kind.",False,0.309,0.0,0.691,0.8832
"給君君一百分😍 薯條必吃😍
但酒都是酒精味爆擊 有點喝不懂
不過長島蠻好喝的
均一杯四百多塊 加服務費和一些吃的
一個人也要六七百塊
份量沒有很多","Give Junjun a hundred points of fries must be eaten 😍
But the wine is full of alcohol flavor.
But Long Island is pretty delicious
More than 400 pieces of service fees and some foods for a cup
Six or seven hundred yuan for a person
There is not much portion",False,0.182,0.0,0.818,0.9072
"環境氣氛佳，歡迎大家來挑戰「寶貝老闆的能量飲」
小白bartender很親切","Good environment atmosphere, welcome everyone to challenge ""Baby Boss's Energy Drink""
Xiaobai Bartender is very kind",False,0.542,0.0,0.458,0.8999
"蘇菲很熱情。

我點的葡萄柚普通、朋友點的奶油啤酒不太好喝，奶油跟啤酒是分開的。然後松露薯條是細的薯條我蠻喜歡，但醬的部分我覺得有一個起司味我不喜歡，朋友是滿喜歡。","Sophie is very enthusiastic.

I ordered the cream beer at ordinary grapefruit and friends ordered cream beer. The cream is separated from beer.Then the truffle fried fries are fine fries. I like it, but I think there is a cheese flavor. I don't like it. My friends like it.",False,0.249,0.045,0.706,0.8802
"餐點好吃 調酒出色
本日外場四大金釵 winnie sofie 璇璇 chloe
美麗親切服務好又有耐心  好棒棒 五星好評一生推","The meal is delicious and alcohol is excellent
Winnie Sofie Xuan Xuan Chloe
Beautiful and kind service is good, patient, good, five -star praise for a lifetime push",False,0.534,0.0,0.466,0.9753
"每款調酒都很有個性
而且炸物真的真的很好吃
甜不辣不會炸到整個酥脆 保留一半本身口感
餛飩 糯米椒也印象深刻的好吃

服務很好 不知道該喝什麼會介紹自家每款飲品口感和酒感高低

氣氛氛圍舒適 空間很大有大沙發
廁所也很貼心有很多補品

會想再去","Each alcohol is very individual
And the fried object is really delicious
Sweet and not spicy will not be fried to the whole crispy crispy and keep half of the taste
The glutinous rice pepper is also impressed with delicious

The service is good, I don’t know what to drink, I will introduce the taste and alcohol of each drink in each drink

The atmosphere is comfortable and the space is very large.
The toilet is also very intimate and there are many supplements

Will want to go again",False,0.208,0.0,0.792,0.9664
"花雕酒水餃很有特色 可以點點看
我只是一個葡通人蠻好喝的適合當第一杯
鹽酥雞 必點 有夠香
Winnie 很nice 熱情滿滿 拍照技術也一流","Flower carving wine dumplings are very distinctive.
I'm just a Portuguese people who are pretty delicious for the first cup
Salt crispy chicken must be fragrant enough
Winnie is very nice enthusiastic camera technology is also first -rate",False,0.282,0.027,0.691,0.9212
白雪很漂亮，很會玩遊戲，白雪贏我了，給他五顆星。,"Bai Xue is very beautiful, and he can play games very much. Bai Xue won me and gave him five stars.",False,0.364,0.0,0.636,0.8832
"氣氛很好～店長很帥
重點是調酒很好喝！！
也很有特色～～值得來😍","The atmosphere is very good ~ the manager is handsome
The point is that bartending is delicious!Intersection
It is also very distinctive ~~ It is worth coming 😍",False,0.3,0.0,0.7,0.8906
"第一次來～
氣氛很不錯 店員Raina超級nice 會來跟我們聊天
酒也很清爽順口","Come for the first time ~
The atmosphere is very good, the clerk Raina Super Nice will come to chat with us
酒也很清爽順口",False,0.331,0.0,0.669,0.8718
Booking bar 氣氛很好、酒好喝，和朋友都很喜歡 ，調酒師Mars 人很親切， 下次還會再來❤️,"Booking Bar atmosphere is very good, wine is good, and I like it with friends. The bartender MARS is very kind.",False,0.49,0.0,0.51,0.937
"薯條跟酒都很不錯，但
1. 結帳金額多了一杯缺料沒來的酒錢，客人主動提出才修正帳單
2. 有刷卡機但卻說只能現金或轉帳(轉帳還不用qrcode而需要逐一輸入)也未說明原因

其中第1點蠻關鍵的，是否有很高比例的客人會逐一檢視帳單明細上面表列的項目金額(在酒醉的狀況下視力仍好到可以看清每個數字)，我是存疑的。況且，為什麼客人有這個義務要幫店家找bug呢？

或許有些朋友看到會說：Hey dude, 結果你沒任何損失呀，餐點也沒問題，負評不公道吧？
我必須說，您說的沒錯，只要我視力沒那麼好，懶得檢查明細，平常也都習慣現金結帳，就不會有這個負評了","French fries and wine are very good, but
1. The amount of the checkout is more cup of wine, and the guests take the initiative to propose to correct the bill.
2. There are swiping machines but said that they can only be cash or transfer (the transfer does not need QRCODE and needs to be entered one by one).

Among them, it is quite critical. Whether there are very high percentages of guests will check the amount of the bill of listing one by one one by one (the vision is still good at the drunken condition, you can see each number). I am doubtful. EssenceMoreover, why do guests have this obligation to help the store find BUG?

Maybe some friends will say: Hey dude, but you have no loss, the meal is no problem, and the negative review is unfairly?
I have to say that you are right. As long as my vision is not so good, I am too lazy to check the details, and I usually get used to cash to check out, so I won't have this negative comment.",False,0.117,0.113,0.769,-0.5897
食物好吃～推薦水果酒～,Food is delicious ~ Recommended fruit wine ~,False,0.478,0.0,0.522,0.6705
"之前去過另一家分店，覺得酒好喝所以再來中山店
這家更大間體會更好👍
其中很喜歡Gatsby的金箔風暴這杯調酒，酸甜很讚😍
松露薯條超好吃，謝謝店長博文請喝SHOT，下次一定會再訪🫶🏻","I have been to another branch before, I think the wine is good, so I come to Zhongshan Store again
This bigger experience is better 间
Among them, I like Gatsby's gold foil storm. This cup of bartending is sophisticated.
Tulu French fries are super delicious. Thank you for the shop chief to drink Shot. I will visit again next time",False,0.289,0.0,0.711,0.9682
酒感和口味都很優，MARS很會推薦，整體氣氛和環境非常讚讚,"Both wine and taste are very good, MARS is very recommended, the overall atmosphere and environment are very praised",False,0.354,0.0,0.646,0.8307
入口的小巧思，讓人覺得有趣又難忘；鹹酥雞、泰式涼麵，非常好吃；特色調酒不止好看也好喝，空間、座位很舒適讓人覺得很放鬆😌❤️ 值得再訪 …,"The small ingenuity at the entrance makes people feel interesting and unforgettable; salty crispy chicken, Thai cold noodles are very delicious; specialty bartending is not only good -looking and delicious, and the space and seats are very comfortable.",False,0.283,0.049,0.668,0.9114
"遇到超級nice的白雪 🥰
細心的介紹酒單！
店裡的氣氛很棒！餐點的水準也很好！","Encountered the super nice white snow 🥰
Introduce the wine list carefully!
The atmosphere in the store is great!The level of meals is also very good!",False,0.449,0.0,0.551,0.9616
強烈推薦長島伯爵和河中小姐，炸物/鹹酥雞和口水餃都好好吃，店裡整體環境和氣味更是舒服，待了4小時以上，回到家衣服都是有很清新的味道。超讚的一家店！👍🏼 …,"It is highly recommended that the Earl of Long Island and Miss Hezhong. The fried/salty crispy chicken and mouth dumplings are delicious. The overall environment and smell in the store are even more comfortable. After staying for more than 4 hours, they have a fresh taste when they return home.A great shop!👍🏼 👍🏼 ...",False,0.214,0.039,0.747,0.9346
"門口真的有夠神秘，找了好久才打開哈哈
Btw Adan超親切！酒單介紹很詳細～超用心","The door is really mysterious enough, I opened it for a long time to open haha
BTW ADAN is super kind!The introduction of wine list is very detailed ~ super intentional",False,0.289,0.0,0.711,0.9073
