Original,EN,Needs Review,Positive,Negative,Neutral,Compound
氣氛跟服務都一級棒，調酒也都很有特色很好喝🥺可惜這次沒有粄條可以吃，但松露薯條也讚讚！,"The atmosphere and service are first -level, and the bartending is also very special. Unfortunately, there is no bars to eat this time, but truffle potato strips also praise!",False,0.202,0.097,0.702,0.6955
"酒調的真的好喝 餐點也好吃
重點 店員服務都很好喔
超值得推薦","The tone is really delicious and delicious.
The service of key clerks is very good
Recommended",False,0.524,0.0,0.476,0.9221
"氣氛非常好，奧戴麗的香水體驗感相當好，尋找靈感的好去所。

想像一下那種間諜戲碼。

古典杯從吧台滑過你順手接住，酒杯的寒意與你的掌心接吻，瓊漿正在搖曳與純淨透亮的冰共舞。

氣氛棒極了。

放著嬉皮爵士人們的嘻笑酒杯輕碰空氣瀰漫著麝香，像是玩笑俏皮的輕拍過臉頰，挑釁般的與音樂碰杯。","The atmosphere is very good, Odari's perfume experience is quite good, and he is looking for a good place to go.

Imagine that spy scene.

The classical cup slipped through the bar and caught it. The chills of the wine glass kissed your palm. Qiong Juffy was swaying with the pure and translucent ice dance.

The atmosphere is great.

Putting the Hippie people's hee laughing glass gently touching the air permeated the musk, like a joke and playful, she patted her cheeks and touched the cup with music.",False,0.276,0.0,0.724,0.9814
"很有特色

氛圍很棒

酒單豐富

餐點也好吃

酒保超熱情！","Very distinctive

The atmosphere is great

Rich wine

The meals are delicious

Wine guarantee is super enthusiastic!",False,0.654,0.0,0.346,0.9674
"臨時晚上找地方想幫朋友慶生，滿幸運的我們晚上還訂的到位置~
店家很Nice的讓我們先冰蛋糕跟上蛋糕，Winnie也跟我們一起幫壽星慶祝跟唱歌🎉
還招待一盤壽星的Shot~

酒很有創意，請按照個人喜好點選🎁
食物個人推薦可可薯條！！！","Temporarily find a place to help friends celebrate the birthday at night. Fortunately, we also booked the location at night ~
The store is very nice, let's keep the cake with the cake first, and Winnie also helps us Shouxing to celebrate and sing 🎉
Also entertain the Shot of a Shouxing ~

Wine is very creative, please click according to personal preferences 🎁 🎁 🎁
Personal food is recommended for cocoa fries!IntersectionIntersection",False,0.391,0.0,0.609,0.9895
"餐點很好吃😋但份量有點少 吃不飽
酒的話推薦黎明的黑暗騎士！
店家知道我們有壽星
還特別招待我們酒
超級感謝❤️","The meal is delicious, but the portion is a bit less.
Wine is recommended to Dawn's Dark Knight!
The store knows that we have Shouxing
Also entertaining our wine
Super thanks ❤️",False,0.385,0.0,0.615,0.9552
"開門居然要機關，路過的我完全不知道只知道開不了門，還以為上鎖🤣可惜，如果知道的話我就會尋找機關了
bartender很友善，會冷居然還提供毛毯
沒什麼在喝調酒，不久前才喝到超難喝的，本來還有點擔心，沒想到蠻好喝的","The door opened the door. I didn't know that I couldn't know that I couldn't open the door. I thought it was a pity. If I knew it, I would find an agency.
Bartender is very friendly, and it will provide a blanket when it will be cold.
Nothing is drinking alcohol, I only drank it for a lot of trouble not long ago. I was still a little worried. I didn't expect it",False,0.043,0.085,0.872,-0.3213
服務態度親切，白雪人很好，酒單上的酒都很有特色，氣氛十足,"The service attitude is cordial, the white snowman is very good, the wine on the wine list is very distinctive, the atmosphere is full",False,0.122,0.0,0.878,0.4927
第一次來到這個特別有氛圍的酒吧。入口的設計非常有趣，店員（Winnie)也非常有禮貌，會給我們詳細的介紹餐點，餐點也是特別美味！會讓人想再來的！,"The first time I came to this particularly atmospheric bar.The design of the entrance is very interesting, and Winnie is also very polite. It will give us a detailed introduction to meals. The meal is also particularly delicious!It will make people want to come again!",False,0.102,0.0,0.898,0.5963
"與朋友第一次來這間酒bar
很不起眼的地方
但卻很熱鬧
環境很好 舒服
哈利波特奶的奶油啤酒與幸福口餃推推讚讚👍👍
謝謝Winnie維尼招待✌️✌️","For the first time with friends, I came to this wine BAR
Very inconspicuous place
But it's very lively
The environment is very comfortable
Harry Botic's cream beer and happy mouth dumplings push praise
Thank you Winnie Pooh for your hospitality ✌️✌️",False,0.382,0.023,0.595,0.9776
氛圍感不錯，很適合朋友聚會，Winnie小姐也十分熱心的介紹我們各個餐點，幫助我們更快找到適合自己的食物♡,"The atmosphere is good, it is very suitable for friends to meet. Miss Winnie also introduces our various meals very enthusiastically to help us find food that suits them faster.",False,0.33,0.04,0.629,0.9104
"氣氛很不錯的bar，而且因為專注在調酒，所以酒很好喝，就不需要靠各種下酒菜充數(啊不過下酒菜好吃也不是不好喔，只是我就想喝杯放鬆，並不是要吃晚餐、吃點心)。

服務生小白很不錯，所以特地來給個五星好評，下次該請我喝杯吧😉","The atmosphere is very good, and because it is focused on bartending, the wine is delicious, so there is no need to rely on all kinds of jams (ah, but it is not bad for the delicious food and vegetables. It's not to eat dinner and snacks).

The waiter Xiaobai is very good, so come to give a five -star praise. Next time, I should invite me to drink cup 😉",False,0.288,0.019,0.693,0.9762
燈光美氣氛佳，多人聚會好去處，酒品豐富，葡萄柚調酒好喝，Winnie服務佳,"The lights are beautiful, and many people gather places, rich wines, grapefruit bartending and drinking, good Winnie service",False,0.409,0.0,0.591,0.886
隱身在騎樓裡的2樓酒吧，入口非常特別，必須按個神秘按鍵才能打開門🤣按下去門打開還嚇到，覺得太酷了～但賣個關子讓你們自己去找哈哈哈，裡面蠻寬敞舒服的，自己來也不會覺得尷尬，因為服務人員也都很親切～不會有壓力，還蠻放鬆的，酒也好喝，食物也好吃，菜單都介紹的蠻清楚的，而且服務人員也會跟你介紹詳細，那裡也有陽台吸煙區，也不用跑去樓下，會讓人想再去的酒吧～～～推推🫶🏻,"The bars on the second floor of the hidden building are very special at the entrance. You must press a mysterious button to open the door. Comfortable, I won't feel embarrassed by myself, because the service staff are very kind ~ there will be no pressure, it is quite relaxed, the wine is delicious, the food is also delicious, the menu is quite clear, and the service staff I will also introduce you to you in detail. There is also a balcony smoking area there, and you don’t have to run downstairs. The bar that people want to go again ~~~ Push",False,0.24,0.0,0.76,0.98
酒好喝，很適合朋友聚會，還有壽星shot,"The wine is delicious, it is very suitable for friends gatherings, and Shouxing Shot",False,0.371,0.0,0.629,0.7943
點了Last word非常有水準，風味很平衡，調酒師Morris很貼心，提供專業的建議！值得回訪～,"Last word is very standard, the flavor is very balanced, and the bartender Morris is very intimate and provides professional advice!It is worth visiting ~",False,0.084,0.0,0.916,0.2942
"燈光美 氣氛佳

那不是松露薯條 是甜的Oreo薯條","Beautiful light atmosphere

That's not a truffle fries, but the sweet Oreo fries",False,0.37,0.0,0.63,0.7543
"開開心心、輕鬆喝酒的好地方～喜歡特調，建議點一杯酒單上的，再點一杯特調👍特調shot也很好喝
鹹酥雞好吃😋","A good place to open happiness and drink easily ~ I like special adjustments, it is recommended to order a glass of wine list, and then order a special cup of special 👍 special shot
Salty crispy chicken delicious 鸡",False,0.472,0.0,0.528,0.9769
"店內氣氛很棒，調酒和鹹食都好讚～
推松露薯條跟雞翅💕
Winnie 很熱情❤️","The atmosphere in the store is great, bartending and salty food are well praised ~
Push loose potatoes and chicken wings 推
Winnie is very enthusiastic ❤️",False,0.338,0.06,0.602,0.8908
之前朋友帶我來過 這次特別介紹這間好喝又好吃的！！好啦下次會再帶不同朋友來 推啦,"I used to take me to this special introduction to this delicious and delicious!IntersectionOkay, I will bring different friends to push it next time",False,0.342,0.0,0.658,0.8977
進門很像闖關活動很有趣，金箔風暴好好喝，小白服務親切人很好。希望可以換個音樂曲風：）,"It is very interesting to enter the door. It is very interesting. The golden foil storm is good, and the small white service is very good.Hope to change the music style :)",False,0.298,0.0,0.702,0.8976
"這絕對是充滿創意與好玩的酒吧！

有耐心、好奇心及看過推理劇的人，才有可能找到進入酒吧的開關！(到底是什麼呢？就讓第一次拜訪的人自行體驗囉～)

店內吧台燈光氣氛佳，雙人及多人沙發區座椅寬大且舒適。

最重要的是，調酒跟炸物都好吃，第一次喝調酒喝得如此快速，於是又再點了第二杯，風味依舊清爽。喜歡喝花草茶為基底的人，大推《最熟悉的茉生人》及《不是Wonder girls的NoBody》這兩杯！

炸物的話，我和朋友都對他們的《松露美乃滋薯條》感到驚豔不已，薯條的厚度雖不及知名美式速食餐廳，但是松露美奶滋醬的風味完美地調和了這一切。下次再來的話，肯定會嘗試他們其他的炸物。","This is definitely a creative and fun bar!

Those who have patience, curiosity, and watching the reasoning drama can find the switch entering the bar!(What exactly is it? Let the person who visit the first visit experience it yourself ~)

The bar lights in the shop have a good light atmosphere.

The most important thing is that the bartending and fried objects are delicious. The first time I drink alcohol and drink so quickly, so I ordered the second cup again, and the flavor was still refreshing.Those who like to drink flower tea are the two cups of ""The Most Familiar Mo Shengren"" and ""Not Wonder Girls Nobody""!

In the case of fried objects, my friends and I were amazing about their ""Tulu Mei Niji French fries"". Although the thickness of French fries is not as good as well -known American fast -food restaurants, the flavor of truffle Milk Sauce perfectly reconciles all of this.The next time you come again, you will definitely try their other fried objects.",False,0.19,0.012,0.798,0.9866
入口很神秘，客人很多且有氛圍的店，酒瓶都取得很有趣，也能按照客人想要的口味做特調，餐點稍貴，松露薯條濃郁,The entrance is very mysterious. There are many guests with a lot of guests and atmosphere. The bottle is very interesting. You can also make special tuning according to the taste that the guest wants. The meal is slightly more expensive.,False,0.127,0.0,0.873,0.6901
店內的氣氛讓人很放鬆 進門的方式也很特別 很喜歡 也遇到很棒的服務生Winnie 讓我有很特別的經驗在這個地方,The atmosphere in the store makes people relax and enters the door. I like it very much and I encounter a great waiter Winnie. I have a very special experience in this place.,False,0.301,0.0,0.699,0.9099
"氣氛很棒酒也很好喝！！店員很熱情介紹聊天
Brian 很好聊","The atmosphere is great and delicious!IntersectionThe clerk introduced the chat very warmly
Brian is very good to talk",False,0.414,0.0,0.586,0.8904
"入口設計很有趣
整體氛圍很放鬆舒服
服務 介紹都好
酒與食物都很棒

過了一年menu還是一樣😆","The entrance design is very interesting
The overall atmosphere is very relaxed and comfortable
The service introduction is good
Both wine and food are great

After a year, Menu is still the same 过",False,0.37,0.0,0.63,0.952
"🍸Book ing 中山🍸
這家是位於捷運雙連站旁邊的酒吧，很推薦大家來這邊喝酒吃東西。調酒、食物、服務、環境都有在水準上。
⭐調酒有特色，有質感，喝起來都是很舒服的
⭐食物很好吃，但是份量少，建議吃完正餐再過來
⭐服務優質，店員都很熱情，很好聊，也會招待shot
⭐環境有質感，衛生整潔，空間很大，沙發區座位舒適。有吸煙區，相當方便

🍸調酒
奧黛麗的香水味
調酒呈現相當有特色，利用噴霧香水瓶盛裝調酒。除了造型上有巧思，調酒本身也很厲害。

Gatsby的金箔風暴
很喜歡這杯，酒很順口，酸甜平衡上也剛好是我喜歡的感覺，加上金箔的點綴，有質感的一杯酒。

🍗食物
鹽酥雞
非常推薦！比外面的鹽酥雞好吃很多，肉質軟嫩外皮酥脆。不過份量略少。

松露薯條
薯條是細的那種，口感酥脆好吃，搭配松露醬完美，推推！

宮保豬肉炒粄條
可惜沒辦法吃到粄條，但是炒泡麵也不錯。香辣過癮，推推！

🤵🏻服務
服務的部分親切友善，餐點介紹、補水都做得不錯。當天有在店內慶生，店員也很熱情的協助處理蛋糕以及招待shot。
希望之後能主動提供盤子給餐食的部分，有盤子來分食薯條炸雞等等會更方便一些。","GBook Ing Zhongshan 🍸
This bar is located next to the MRT Shuanglian Station. I recommend everyone to come here to drink and eat.Alcohol, food, service, and environment are all at the level.
有 Blooming has characteristics, texture, and it is very comfortable to drink
但是 The food is delicious, but the portion is small. It is recommended to come over after eating
都 The service is high -quality, the clerk is very enthusiastic, very good to talk, and will also entertain Shot
卫 The environment has texture, hygiene and neat, large space, and comfortable seats in the sofa area.There is a smoking area, which is quite convenient

Bartender
Audrey's perfume flavor
The bartending presentation is quite distinctive, and the spray perfume bottle is equipped with bartender.In addition to the ingenuity in style, the bartender itself is also very powerful.

Gatsby's gold foil storm
I like this cup very much. The wine is smooth. The sweet and sour balance is just my favorite. With the embellishment of gold foil, a glass of wine with texture.

🍗 🍗 🍗
Salted chicken
Very recommended!It is much better than the salted chicken outside, and the meat is soft and crispy.But the amount is slightly less.

Truffle fries
French fries are thin, crispy and delicious, perfect with truffle sauce, push push!

Gongbao pork fry
Unfortunately, there is no way to eat a bar, but fried noodles are also good.Spicy, push!

🤵🏻 🤵🏻 🤵🏻 🤵🏻 🤵🏻 🤵🏻 🤵🏻
The service part is kind and friendly, and the meal introduction and hydration are well done.On the same day, there was a birthday in the store, and the clerk also enthusiastically assisted the cake and entertain Shot.
I hope that it will be more convenient to provide a plate for the meal for the meal for the meal for meals.",False,0.204,0.015,0.782,0.9977
地點很讚之外，酒單很台灣人很好笑諧音梗給過！服務很好裡面很寬敞很乾淨東西也超好吃。。。價格很合理！！！！！絕對會再回訪！！！好好喝真的。。。（松露薯條真的要點。。。去過的酒吧中目前吃到第一名的薯條。。。還有墨西哥雞翅,"In addition to the location, the wine list is very funny to the harmonic stalk!The service is very spacious and clean, and it is super delicious.EssenceEssenceThe price is reasonable!IntersectionIntersectionIntersectionIntersectionAbsolutely return to visit!IntersectionIntersectionIt's really good.EssenceEssence(Todgefans are really point... I have eaten the first place in the bar I have eaten in the first place... And Mexican chicken wings",False,0.206,0.0,0.794,0.9291
"非常好的氣氛，從门口開始，大家雖不認識，但是都很熱情，，不是wonder girls  的nody,琴酒基底，不錯喝。Sophie 的服務很棒，必需按讚👍","A very good atmosphere, from the door, although everyone does not know it, they are all very enthusiastic. It is not the nody, piano wine base of Wonder Girls, and drink well.Sophie's service is great, you must like it",False,0.275,0.0,0.725,0.9229
"環境寬敞舒適, 調酒好喝, 小翟也很好聊, 還有生日bonus, 是個值得再訪的好地方","The environment is spacious and comfortable, and the bartending is delicious. Xiao Zhai is also very good to talk. There is also a birthday bonus. It is a good place worth visiting again.",False,0.407,0.0,0.593,0.9552
酒好喝，薯條鹹酥雞都很好吃，店員也很nice。,"The wine is delicious, the fries are delicious and crispy chicken, and the clerk is also nice.",False,0.421,0.0,0.579,0.8807
"也可以點無酒精，餐點不錯，白雪服務很熱情
開門的方式很有趣，差點進不去","You can also order no alcohol, the meal is good, the white snow service is very enthusiastic
The way to open the door is very interesting, I almost can't get in",False,0.243,0.057,0.7,0.8012
氣氛很棒，葡通人好喝，坐吧臺跟小翟聊天很放鬆很開心～,"The atmosphere is great, the people of Portuguese are delicious, and the chat on the bar with Xiao Zhai is very relaxed and happy ~",False,0.421,0.0,0.579,0.9456
"特別推薦Aaron！超棒！服務很親切！人非常nice！
第一次來可是非常棒的體驗！","Special recommend Aaron!Bet!The service is very kind!People are very nice!
The first time is a great experience!",False,0.511,0.0,0.489,0.9268
"入口機關真的很有趣，酒也很好喝
鹹酥雞大推必點！

店長人好好QQ","The entrance agency is really interesting, and the wine is also delicious
The salty crispy chicken must be pushed!

The store manager is good QQ",False,0.284,0.113,0.603,0.7142
"調酒定價4-500/杯，加一成大概就要價$500/杯

調酒有部分酒精濃度較高的，整體調酒名字有巧思，很能讓人會心一笑，而且味道組合都滿特別的，不過蠻小杯的就是。店家招牌是長島伯爵，算是台北地區蠻好喝的長島

優點就是位子很寬敞很舒服，沙發距離也遠，不太會被隔壁桌干擾；但音樂太大聲，不太容易聊天

服務生都很有特色，男生可帥可美，女生也漂亮很有耐心有禮貌，喝酒起來是滿舒服的","The bartending pricing is 4-500/cup, and the price is about $ 500/cup for plus 10 %

Some alcoholic concentrations are high. The overall bartending name is ingenious, which makes people laugh, and the combination of taste is full, but it is quite a small cup.The store's signboard is the Earl of Long Island, which is a very delicious Long Island in Taipei

The advantage is that the seat is very spacious and comfortable, the sofa distance is far away, and it is not interfered by the table next door; but the music is too loud, it is not easy to chat

The waiters are very distinctive. The boys are handsome and beautiful, and girls are beautiful and patient. It is comfortable to drink.",False,0.228,0.02,0.752,0.9877
"一進門超酷欸🤩
酒好喝～餐點又好吃
巧克力薯條超推❤️❤️❤️","As soon as you enter the door
The wine is delicious ~ the meal is delicious
Chocolate French fries ❤️❤️❤️",False,0.243,0.0,0.757,0.8126
"酒很好喝
入口設計很有小巧思
環境超棒 還有戶外小空間
Bartender很親民","Wine is delicious
The entrance design is very compact
The environment is superb and there are small outdoor spaces
Bartender is very close to the people",False,0.245,0.0,0.755,0.8316
"環境美氣氛佳酒又好喝
大推調酒很好喝","The environment is beautiful and delicious
Big pushing wine is delicious",False,0.585,0.0,0.415,0.9062
"Arron服務很棒，喜歡最後百香果跟白菜
風味的byebye shot!
Sophie很棒, 身為單身狗還有來聊個2,3句話覺得窩心～～～
今天也喝到灰狼系列覆盆莓的琴酒，感謝bartender ☺️","ARRON service is great, I like the last passion fruit and cabbage
The flavor of Byebye Shot!
Sophie is great. As a single dog, I have a 2,3 sentence and feels heart -hearted ~~~
I also drank the piano wine of the gray wolf series today, thank Bartender ☺️",False,0.373,0.0,0.627,0.975
"好玩又好喝，而且鹹酥雞超好吃必點
這次點寶貝老闆，整個笑的很開心🤣🤣喜歡牛奶又怕酒味太重的我覺得點的剛剛好～～

服務也很好
但拜託大家不要來訂位不然我怕下次訂不到了🤣🤣🤣","Fun and delicious, and the salty crispy chicken is super delicious.
This time, the baby boss, the whole smile is very happy. I like milk and afraid of the taste of the wine. I think it ’s just right ~~

The service is also very good
But please don’t book a place, otherwise I am afraid that I will not be able to order next time 🤣🤣🤣",False,0.329,0.0,0.671,0.9845
"門口機關好玩
昏暗的燈光
很有微醺的氣氛
食物不錯吃
酒的話沒有喝很多
但不要點寶貝老闆能量飲謝謝（太小太甜）","The entrance at the door is fun
Dim light
Very sloppy atmosphere
Good food
I didn't drink a lot if I wine
But don't order the baby boss energy to drink thanks (too small and too sweet)",False,0.315,0.0,0.685,0.9291
"氣氛不錯，整體是很歡樂的，店員都很樂意與客人互動
酒的部分都有平均以上，味道的部分很符合大眾口味，香氣的部分可以再加強一點
服務生 白雪 很喜歡與客人互動，增進喝酒的氛圍","The atmosphere is good, the overall is very happy, the clerk is happy to interact with the guests
The part of the wine has more than the average, the taste part is in line with the taste of the public, and the aroma can be strengthened a little bit.
Worship Bai Xue likes to interact with guests and enhance the atmosphere of drinking",False,0.241,0.0,0.759,0.9525
很好吃！調酒選項很多，也都調得很好喝，重點是酒精濃度也沒有很低，很實在。,"Very delicious!There are many bartending options, and they are also tuned very well. The focus is that the concentration of alcohol is not very low, and it is very real.",False,0.144,0.0,0.856,0.5741
整間店跟酒都很有特色跟巧思！進店的時候需要用點心思才能進去，很像在解密室逃脫🤣氣氛也相當好！當天還被招待了2杯shots覺得很開心😍,"The whole shop and wine are very unique and ingenious!When entering the store, you need to think about it with snacks. It is very good like escaping at the decryption room!I was also entertaining 2 cups of shots that day, I feel very happy 😍",False,0.302,0.0,0.698,0.9531
"竟然在毫不起眼的捷運轉角大樓隱藏寬敞好喝酒吧！
進去一開始也卡關不過找到當下很興奮😆
空間很大，感覺舒適。
廁所多間也乾淨！
可惜沒有點食物因為吃飽了
兩杯都很好喝！
1. 我只想當個葡通人
2. Gatsby的金箔風暴

出入口分開一進一出，出去之後感覺做了場愉快的夢☺️","It actually hides the spacious and good bars in the inconspicuous MRT Township!
At the beginning, I got stuck, but I was very excited at the moment.
The space is very large and feels comfortable.
Many toilets are also clean!
Unfortunately, I have no food because I am full
Both cups are delicious!
1. I just want to be a Portuguese
2. Gatsby's gold foil storm

The entrance and exit are separated and out, and after going out, I feel like I have a happy dream ☺️",False,0.301,0.074,0.625,0.9833
"書瑋很帥，讓我朋友整個暈船了。
而且人超親切，很好聊！
有美女想要年輕帥哥陪你聊天的話，就趕快來，不然就來不及了！","Shu Wei is very handsome, let my friend the entire seasick.
And people are very kind, very good to talk!
If a beautiful woman wants to chat with you, hurry up, otherwise it will be too late!",False,0.364,0.0,0.636,0.9603
"整體很讚
只是價格就是貴 但食物氣氛都很好","Overall
It's just that the price is expensive but the food atmosphere is very good",False,0.235,0.0,0.765,0.6474
服務人員白雪親切，待人親切，可以來找他聊天，大推奶油啤酒,"The service staff Bai Xue is kind and treats others, you can come to him to chat and push the cream beer",False,0.139,0.0,0.861,0.5267
"酒好喝！食物好吃！氣氛好！服務生也很棒！
值得再訪的店","The wine is delicious!The food is delicious!The atmosphere is good!The waiter is also great!
It is worth visiting",False,0.309,0.0,0.691,0.8002
書瑋很有趣，水果系列調酒很猛，其他調酒平衡也很好，值得一試,"Shu Wei is very interesting, the fruit series is very fierce, other bartending balance is also very good, it is worth trying",False,0.299,0.0,0.701,0.7956
