Original,EN,Needs Review,Positive,Negative,Neutral,Compound
這家酒吧真是太棒了！一定要找Winnie 雞翅絕對是這裡的一大亮點，外酥內嫩，調味完美，每一口都讓人回味無窮。除了美味的食物，酒吧的氛圍也非常好，服務員熱情友好，讓人感到賓至如歸。不僅適合和朋友聚會，也適合放鬆小酌，強烈推薦給所有喜愛美食和美酒的人。,"This bar is really great!Be sure to find Winnie chicken wings is definitely a highlight here. It is crispy and tender inside, perfect, and has an endless flavor.In addition to delicious food, the atmosphere of the bar is also very good. The waiter is enthusiastic and friendly, making people feel that they are home.Not only is it suitable for gathering with friends, but also suitable for relaxation and drinking, strongly recommend it to all people who love food and wine.",False,0.336,0.0,0.664,0.9832
"雙連站旁的酒吧
調酒很好喝 選擇很多
一群朋友來
一個晚上可以試超多種口味
鹽酥雞也好吃
但是開門的開關比仁愛店難找","Double -Corporation next to the bar
Blooming is very delicious, choose a lot
A group of friends come
You can try a variety of flavors in one night
Salt crispy chicken is also delicious
But the opening switch is difficult to find than Renai Store",False,0.135,0.064,0.802,0.3912
"Brian超級棒
松露薯條超級好吃 酒100分⋯⋯","Brian superb
Tulu French fries are super delicious wine 100 points ...",False,0.565,0.0,0.435,0.9136
"第一次來中山區附近的酒吧 就選到了很喜歡的酒吧 從一進門那種可以很自在聊天的氛圍開始 就一路滿分到離開 調酒很優秀 我最喜歡P.S我愛你 好喝滑順到一下子就會想再看一下menu
無論是人還是酒還是氛圍都非常剛剛好 想要放鬆聊天 這裡很適合 bartender 跟店員也都非常親切 可以很舒適坐在吧台也不會覺得很彆扭 反而很舒適
知道是壽星 店員跟bartender也會祝你生日快樂！","The first time I came to the bar near Zhongshan District, I chose a favorite bar since I entered the door that can be chatted very freely. Zi will want to look at menu again
Both people and wine or atmosphere are very very just wanting to relax and chat. This is suitable for Bartender and the clerk. You can sit on the bar. You don’t feel awkward.
Knowing that Shouxing clerk and Bartender will also wish you a happy birthday!",False,0.184,0.017,0.798,0.938
"店長人很好又好聊
酒又讚氣氛超好下次會帶朋友來～","The store manager is very good and easy to talk
The wine is also good at the atmosphere. I will bring friends next time ~",False,0.37,0.0,0.63,0.9073
"巧克力細薯條好吃😋
水果味調酒蠻順到好喝！ …","Chocolate Fragrance Strip is delicious 细
Fruit flavor bartending is so good!Mowing",False,0.266,0.0,0.734,0.6114
"服務很棒 調酒也很棒
氣氛很好 推薦找Morris 他超棒","The service is great and bartender and great
The atmosphere is very good recommended to find morris he is great",False,0.539,0.0,0.461,0.9557
入口的設計很有進入禁酒年代的感覺，服務非常周到、特色調酒好喝😊對於人員會注意桌邊狀況補充水資感到貼心！,The design of the entrance has a very feeling that it has entered the ban on wine. The service is very thoughtful and the specialty bartender is delicious.,False,0.233,0.1,0.667,0.584
入口好有巧思好喜歡～ 餐點好吃，鹹酥雞必點，調酒也好喝，松露味的威士忌調酒還有香水的調酒都好特別，座位也好舒服，非常享受的一晚，大推❤️,"The entrance is so ingenious and I like it ~ The meal is delicious, the salty crispy chicken must be ordered, the bartender is also delicious, the whiskey of the truffle flavor is good, and the seat is very comfortable. Late, push ❤️",False,0.296,0.0,0.704,0.9468
"環境隱密 氣氛舒適 調酒好喝 僅收現金/轉帳
沙發好坐 店員親切 附菜單 有機會會二訪","The environmental hidden atmosphere is comfortable and alcohol.
The sofa is good at the clerk to have a cordially attached menu and have a chance to visit the second visit",False,0.233,0.0,0.767,0.802
調酒還不錯，點了長島和寶寶老闆。但酒但希望可以更有質感。,"The bartender is not bad, ordered the long island and the boss boss.But wine but hope can be more textured.",False,0.243,0.0,0.757,0.698
難得找到氣氛優秀到不行的酒吧，下班來小酌非常適合，環境服務一級棒，小白很讚，對每位客人都很照顧，推推,It is rare to find a bar with an excellent atmosphere. It is very suitable to have a drink after get off work.,False,0.144,0.0,0.856,0.5719
"昨天晚上臨時找離家最近的酒吧，要進門時還有一個小關卡需要破解，只想說，有些門不是門、有些牆不是牆🤣最努力找的我但最後是站在一旁動都沒動的男友破解的🙃

酒類的微醺度真的要相信！整體來說酒類真的蠻不錯的，價錢也很合理～而且每杯酒都有自己獨特的名字，會忍不住每個都看完
食物也是有很有趣的名字，口味上也很推薦！連平常最普通的銀絲卷都可以做的很法式，吃起來好幸福，水餃口味好特別好喜歡
環境一進去就讓人覺得有放鬆到，雖然講話聲很多音樂也很大，但還是讓人覺得舒服，室外還有吸煙區，完全不會飄到裡面空間（我對煙味超級無敵敏感），室內的味道也很清新沒有怪味，呼吸起來很舒服
店員看起來雖然冷冷的，不過應該是熱情在心裡（？）給人的感覺也是舒服不會覺得是臭臉或是不好相處，最後結帳時有請喝shot，shot杯乾時也是放在客人之下，雖然我也是很緊張，不過小小細節店員也都有注意到覺得很強

整體來說都很不錯～是會再回訪的酒吧
沒有留評論就給什麼優惠或是可以換什麼，卻能讓人心甘情願的來評價，應該可以一同感覺到我昨日的好感受吧😍","Last night, I temporarily found the bar closest to home. When I had to enter the door, there was still a small level to crack. I just want to say that some doors are not door, some walls are not the wall 🤣 🤣. My boyfriend cracked 解

The micro -sluggishness of the wine really believes!Overall, the wine is really good, and the price is reasonable ~ and each glass of wine has its own unique name, and I can’t help but watch it.
Food is also a very interesting name, and it is recommended in taste!Even the most common silver silk rolls can be done very French, so happy to eat, the taste of dumplings is very good, I like it
As soon as the environment enters, people feel that they are relaxed. Although a lot of music is also very strong, it still makes people feel comfortable. There are smoking areas outdoors, and they will not float in the space at all (I am super invincible to the smell of smoke), The indoor taste is also very fresh, no strange smell, it is very comfortable to breathe
Although the clerk looks cold, it should be enthusiastically in the heart (?) It feels comfortable, it will not feel that it is stinky or difficult to get along with each other. Please drink shot when you check out. Under the guests, although I am also very nervous, the small details also noticed that I felt very strong

Overall is very good ~ is the bar that I will return to visit again
If you don't have a comment, you give any discounts or what you can change, but you can make people willingly evaluate. You should feel that I feel good yesterday.",False,0.258,0.029,0.713,0.9982
"酒很好喝❤
沙發很舒服❤❤
入口很神奇❤❤❤
機關在左手邊的紅磚推開
按下會發亮的那本書❤❤❤❤","The wine is delicious ❤
The sofa is very comfortable ❤❤
The entrance is amazing ❤❤❤
The red brick on the left hand is pushed open
Press the book that will shine ❤❤❤❤",False,0.618,0.0,0.382,0.9959
博文 小宅 德龍 蘇菲 馬斯 書瑋 糖糖 亞當 胖胖 艾倫 睿志 布萊恩 白雪快認識所有店員了 大家都好棒我都好喜歡哦🥰🥰🥰,"Bowen small house Delong Sophos Book Wei Sugar Sugar Adam's fat Allen Rui Zhizhi Blav white snowy knows all the clerks, everyone is good, I like it 🥰🥰🥰 🥰🥰🥰 🥰🥰🥰",False,0.578,0.0,0.422,0.9971
"跨年提前訂位，衝著網路上的特色飲品及食材才來的⋯沒想到跨年當天有限定的menu，能點的品項很少 ：（  餐點都是用紙盒裝，飲品也都只是塑膠杯⋯跟平常都不太一樣：（

想吃到的沒有吃到，且有10000元低消 很失望：/","The New Year's Eve reservation is booked in advance, and the special drinks and ingredients on the Internet come. I did not expect that there are limited menu on the New Year's Day. It's just that plastic cups are different from usual: (

If you want to eat, you do n’t eat it, and it ’s disappointed with 10,000 yuan low:/",False,0.06,0.106,0.835,-0.4767
松露薯條好吃，服務員Winnie介紹的很詳細，推薦的酒也真的好喝，會再訪。,Todgeflains are delicious. Winnie introduced in detail. The recommended wines are really delicious and will visit again.,False,0.404,0.0,0.596,0.8588
"調酒跟整體氣氛很不錯
但食物的水平不太ok😅","Blooming and the overall atmosphere are very good
But the level of food is not too OK 的",False,0.099,0.148,0.753,-0.2615
"餐點好吃
音樂好聽
氣氛不錯
今日10人齊聚慶生
酒喝得開心
餐點吃得歡喜
服務有夠貼心
謝謝蘇妃罩著我們
人潮洶湧是缺點也是優點（代表最高評價
希望有機會再來聚","Meal delicious
Nice music
The atmosphere is good
10 people today gathered in celebration
Drink happily
Eat the meal and eat happy
The service is intimate
Thank you Su Fei to cover us
The crowd is the disadvantage and the advantages (representing the highest evaluation
Hope to have a chance to come together again",False,0.362,0.038,0.599,0.9712
謝謝招待～酒很好喝！🤎,Thank you for your entertainment ~ Wine is delicious!Bleak,False,0.444,0.0,0.556,0.68
氣氛很不錯，服務也相當好！好喜歡百香果的調酒🥰🥰我給100分,"The atmosphere is very good and the service is pretty good!I really like the bartending of Passion Fruit 给 I give 100 points, I give 100 points",False,0.352,0.0,0.648,0.9096
回訪第二次，店員人都超讚，酒都在水準之上，推一波🫡🫡🫡🫡,"For the second time back to the visit, the clerks are all amazing, and the wine is above the standard.",False,0.167,0.0,0.833,0.5859
酒單很有趣，員工服務很好互動感覺很親切,"The wine list is very interesting, the employee service is very good interactive, it feels very kind",False,0.414,0.0,0.586,0.8714
"點了寶貝老闆，杯子竟然是奶瓶造型，甚至是真的奶嘴，可愛到不行~  味道也很好，不苦，甜甜的（我個人覺得有芝士奶蓋的味道哈哈）

鹹酥雞外酥內軟超好吃！！算是有小小的驚喜到","I ordered the baby boss. The cup turned out to be a bottle shape, or even a real pacifier. It was so cute ~ The taste is also good, not bitter, sweet (I personally think of the taste of the cheese milk cover haha)

The salty crispy chicken is soft and delicious!IntersectionThere is a small surprise",False,0.216,0.037,0.747,0.9003
"水餃好好吃，寶貝老闆的奶酒推薦😊
維尼服務貼心  超親切👍
值得來放鬆喝酒的好地方😊","The dumplings are delicious, the baby boss's milk wine is recommended 😊
Winnie service is intimate 心
It's worth relaxing a good place to drink 😊",False,0.502,0.026,0.472,0.9726
"比東區的店還要寬敞！
薯條是細的！！！激賞
🔍IG:yveyen …","It is even more spacious than the stores in the East District!
French fries are thin!IntersectionIntersectionReward
EIg: yveyen ...",False,0.0,0.0,1.0,0.0
這裡真的好讚！！！ 來這裡居然會有豔遇❤️,"It's really good here!IntersectionIntersectionCome here, there will be a good encounter ❤️",False,0.367,0.0,0.633,0.7495
"離捷運站超近，交通方便。
位於大樓的二樓，開門方式太酷啦有夠好玩
店裡位置滿多的，店員友善熱情，酒類滿好的，餐點較不推，會一直招待很讚，靠近入口的位置音樂聲有些太大，聊天會聽不太清楚，適合朋友聚會，還會再訪。","It is super closer to the MRT station and convenient transportation.
Located on the second floor of the building, the door opening is too cool. It is fun enough
There are a lot of locations in the store. The clerk is friendly and enthusiastic, the wine is good, and the meal is less pushing. It will always entertain it. The sound of music near the entrance is a bit too loud. The chat will not be clear. Will visit again.",False,0.221,0.023,0.756,0.9579
服務很好！ 書瑋人超好 服務很讚！裡面的人都很熱情 慶生聊天都很適合！,The service was excellent!Shu Weiren's super good service is great!The people in it are very enthusiastic about celebrating birthdays!,False,0.502,0.0,0.498,0.9445
"2022/9/24
服務好，調酒入口很舒服，整體氣氛讓人放鬆，忘記竟然是在社區樓上的感覺，餐點下酒菜真的很好吃，必吃鹹酥雞外酥內多汁，搭配特調醬超美味，另外台式法國麵包也是一定要點，外表酥脆，內裡柔軟，加上煉乳跟奶粉提味，甜而不膩！","2022/9/24
The service is good, the entrance to the bartender is very comfortable, and the overall atmosphere is relaxed. The feeling of forgetting it is on the community. The meal is really delicious. Super delicious, in addition, the desktop French bread is also a certain point. The appearance is crispy, the inside is soft, and the flavor of the milk and milk powder is sweet but not greasy!",False,0.244,0.0,0.756,0.9326
"十三香鹹酥雞很好吃！店員幽默好笑
服務100分，值得光顧","Shisanxiang and salty crispy chicken is delicious!The clerk is humorous and funny
The service is 100 points, it is worth visiting",False,0.299,0.0,0.701,0.7712
"MVP：  蕾娜~~

你來了就明白了 🫣","MVP: Rena ~~

You will understand when you are here",False,0.0,0.0,1.0,0.0
"環境舒適～水果系列調酒讚讚ㄉ🌝
Bartender Morris非常專業！點什麼都做得很好喝！","Comfortable environment ~ Fruit series bartending praise
Bartender Morris is very professional!Do everything you do!",False,0.365,0.0,0.635,0.8168
"我是老師！
這裡的松露薯條跟調酒驚艷到我了
大推喇 不來後悔😍😍","I am a teacher!
The truffle fries and bartending here are amazing to me
Great push and not to come and regret it 来",False,0.256,0.088,0.656,0.75
服務很好，包廂空間足夠，酒還不錯，Brian很棒,"The service is very good, the box space is enough, the wine is not bad, Brian is great",False,0.403,0.0,0.597,0.8791
"服務態度超好
食物好吃，調酒也特別，推薦！","The service attitude is super good
The food is delicious, and the bartender is also special, it is recommended!",False,0.522,0.0,0.478,0.9359
"酒  餐點 氛圍 神秘入口 都好讚
服務生都很好","The meal atmosphere is mysterious and the entrance is great.
The waiters are very good",False,0.359,0.0,0.641,0.807
餐點味道不錯，店員服務親切、環境放鬆，適合朋友聊天聚餐,"The meal tastes good, the clerk has a kind service and the environment is relaxed, suitable for friends to chat and dinner",False,0.412,0.0,0.588,0.9118
氛圍環境服務都很好 店長Bowen超讚><,The atmosphere and environmental service is very good.,False,0.313,0.0,0.687,0.4927
"氣氛不錯
餐點跟酒都很有特色
服務人員也都非常熱情周到有耐心","The atmosphere is good
Meals and wine are very distinctive
The service staff are also very enthusiastic and thoughtful and patient",False,0.34,0.0,0.66,0.8503
"很舒服的地方 🙌
雞翅 - 還好 😪
薯條 - 很好吃 😋
蝦麵 - 還好 😪 …","Very comfortable place 的
Chicken Wings -Fortunately
French fries -very delicious 很
Shrimp Noodles -Fortunately ...",False,0.351,0.0,0.649,0.8218
"入口很隱密，要用心一點才找得到🤣

松露薯條是細薯，好吃❤️
渣男餃一盤6顆，味道還不錯。
辣雞翅辣度蠻剛好，好吃！

• 桂花紅心芭樂
芭樂味很濃，沒什麼桂花味，酒感很低，鹹甜鹹甜蠻酷的。

• 我只想當個葡通人、回憶中的梅柚醬
甜甜的不錯喝，適合喜歡果香的女生。

• 不是wonder girls的nobody
蠻香，不過喝起來有點水水的。

• 長島伯爵、河中女神
酒感真的蠻重，喜歡濃一點的可以點，河中女神的威士忌味蠻重。

• 可可夜總會
和朋友一致覺得不好喝，喝起來很澀🥲

評分是對整間店的感覺，服務還不錯，氣氛很好，餐點也好吃，調酒蠻有創意，不過味道還是要看品項。","The entrance is very secretive, you need to find it with your heart to find it 🤣

Tulu potato strip is fine potato, delicious ❤️
There are 6 plates of dumplings of scum, and the taste is pretty good.
The spicy chicken wings are pretty good, delicious!

• Osmanthus Red Heart Barler
Berlite is very strong, there is no osmanthus flavor, the wine feels very low, salty, sweet and sweet.

• I just want to be a Portuguese, Meiyou sauce in memories
Sweet and good, suitable for girls who like fruity.

• Not the nobody of Wonder Girls
It's pretty fragrant, but it is a bit water.

• Earl of Long Island, Goddess of River
The wine feels really heavy. If you like a little more, you can order. The whiskey of the goddess of the river is quite heavy.

• Cocoa Night Club
I feel that it is not good with my friends, and it is very astringent.

The scoring is the feeling of the whole store. The service is not bad, the atmosphere is good, the meal is also delicious, and the bartending is quite creative, but it still depends on the items.",False,0.262,0.031,0.707,0.9938
調酒師跟服務生都很親切，很有耐心的講解，食物跟酒都很滿意！整體氣氛也很舒服放鬆，期待下次再跟朋友一起來玩。,"The bartender and the waiter are very kind and patient, and they are very satisfied with food and wine!The overall atmosphere is also very comfortable and relaxed, looking forward to playing with friends next time.",False,0.396,0.0,0.604,0.9586
烏龍奶茶很好喝，薯條炸得很脆很剛好～燉飯也很好吃,"Oolong milk tea is delicious, fries are fried very crispy and just right ~ stewed rice is also delicious",False,0.303,0.0,0.697,0.8126
"小白超讚
食物超好吃
酒超好喝
氣氛超好
推到不行❤️","Xiaobai Superb
Food is super delicious
The wine is super delicious
The atmosphere is super good
Push to ❤️",False,0.668,0.0,0.332,0.9801
酒很好喝 店員態度都很好 主吧人很好,"The wine is very delicious, the shop clerk is very good, the master is very good",False,0.444,0.0,0.556,0.8854
Bartender 非常專業，奶油啤酒是此生喝過最特別的調酒！,Bartender is very professional. Cream beer is the most special bartending in this life!,False,0.202,0.0,0.798,0.5081
非常漂亮又有趣的酒吧！他們的菜單也很獨特。這裡嘗試了最好的長島，即長島2.0！你實際上可以在雞尾酒中品嚐到「茶」的味道，醉酒程度為 9-10😂，一杯大約 400 美元，看起來非常值得。這位花花公子也很棒。很想回來！,"Very beautiful and interesting bar!Their menu is also very unique.Here I tried the best Long Island, Nagashima 2.0!You can actually taste the taste of ""tea"" in cocktails. The degree of drunk is 9-10😂, and a cup of about 400 US dollars, which looks very worthwhile.The playboy is also great.Want to come back!",False,0.225,0.06,0.715,0.9291
一個非常酷的地下酒吧，有一個隱藏的入口，你需要發揮你的思考能力才能找到！一旦進入，氛圍充滿活力和休閒。  特色雞尾酒很美味，我特別喜歡哈利波特（黃油啤酒加啤酒！） Bowen 是一位非常友好的調酒師，他非常照顧我們，並向我們介紹了台灣的飲酒文化 - 強烈推薦！,"A very cool underground bar, there is a hidden entrance, you need to use your ability to think to find!Once you enter, the atmosphere is full of vitality and leisure.The special cocktails are delicious. I especially like Harry Potter (butter beer plus beer!) Bowen is a very friendly bartender. He takes care of us very much and introduces us to Taiwan's drinking culture -strong recommendation!",False,0.327,0.0,0.673,0.9782
"非常好的speak easy酒吧體驗，調酒師都非常nice和友善，你可以感受到他們調製雞尾酒的認真程度。

工作人員會在您點餐前解釋飲料菜單。

這絕對是我每次來台北必去的酒吧！","Very good Speak Easy Bar experience, bartenders are very nice and friendly, you can feel the seriousness of their cocktails.

The staff will explain the drink menu before ordering.

This is definitely a bar I must go to Taipei every time I come to Taipei!",False,0.283,0.021,0.695,0.9404
友善的調酒師，火星和莫里斯。良好的氛圍和非常好的飲料。我點了一些菜單外的飲料，是老式飲料和威士忌酸酒。他們努力讓我的飲料完美。 一百分💯,"Friendly bartender, Mars and Morris.A good atmosphere and a very good drink.I ordered some drinks outside the menu, which is an old -fashioned drink and whiskey acid wine.They work hard to make my drink perfect.One hundred points 💯",False,0.203,0.031,0.766,0.8357
酒吧的入口很有創意，東西也非常好。但我不得不說飲料價格過高而且可以更好。,The entrance to the bar is very creative and things are very good.But I have to say that the price of drinks is too high and can be better.,False,0.184,0.0,0.816,0.7264
"當我漫步在夕陽下的中山昏暗的街道上時，我想知道是否有什麼可做的。就在那時，我偶然發現了牆上的這個洞。從一開始，我就被驚呆了，進入這個美觀、輝煌的酒吧。

酒吧不僅有煙燻酷炫的氛圍，還提供各種創意飲品，例如著名的Boss Baby和神奇的哈利波特。這些雞尾酒中的創新概念給我留下了深刻的印象。向調酒師致敬。

總而言之，這是一家頂級酒吧，適合坐下來與您的朋友度過一個愉快的夜晚。","When I strolled on the dim street in Zhongshan under the setting sun, I would like to know if there is anything to do.At that time, I accidentally discovered the hole on the wall.From the beginning, I was stunned and entered this beautiful and brilliant bar.

The bar not only has a smoky and cool atmosphere, but also provides a variety of creative drinks, such as the famous BOSS BABY and the magical Harry Potter.The concept of innovation in these cocktails left a deep impression on me.Tribute to the bartender.

All in all, this is a top bar, suitable for sitting down with your friends through a pleasant night.",False,0.225,0.022,0.752,0.9779
鮑文是一位出色的調酒師！那裡很擁擠，我們沒有空間，但我們只想喝一杯，所以他們在預訂之前就把我們擠進去了。令人驚嘆的氛圍，優質的服務和對話。會推薦給遊客或當地人！,"Bao Wen is an excellent bartender!It was crowded there, we had no room, but we just wanted to drink a drink, so they squeezed us in before booking.Amazing atmosphere, high -quality services and dialogue.It will recommend to tourists or locals!",False,0.138,0.036,0.826,0.6792
喜歡這裡的氣氛。就像電影主題雞尾酒搭配哈利波特的奶油啤酒、蓋茲比、蝙蝠俠等等！,"Like the atmosphere here.Just like the movie theme of the movie with Harry Potter's cream beer, Gazbi, Batman and so on!",False,0.218,0.0,0.782,0.6476
老實說，這是一次奇妙的經歷💘找到大門很有趣而且很有趣😂裡面的氣氛優雅而親密，工作人員非常友好和真誠❤️他們還幫助我找到了適合我的完美雞尾酒💘 ，如果你來台北吧🥰,"Honestly, this is a wonderful experience 💘 It is fun and fun in finding the door to find the door. The atmosphere in it is elegant and intimate. The staff is very friendly and sincere ❤️ They also help me find the perfect cocktail that is suitable for me. If you come to Taipei, right? Bleak",False,0.406,0.0,0.594,0.9866
"氣氛很棒 調酒很特別也很好喝
泡麵跟炸物超好吃","The atmosphere is great and alcohol, very special and delicious
Instant noodles and fried objects are super delicious",False,0.589,0.0,0.411,0.9621
位於二樓的一個獨立位置，氛圍舒適，呈現出熟悉的頂級品質酒吧的外觀和感覺。調酒師也曾在新加坡Taylor Adam酒吧工作過。 「Book ing Bar」兩年前在這個地點開業，就在即將到來的時尚街區。,"A separate position on the second floor, the atmosphere is comfortable, showing the appearance and feeling of a familiar top -quality bar.The bartender also worked at the Taylor Adam bar in Singapore.""Book Ing Bar"" opened at this place two years ago and was in the upcoming fashion block.",False,0.123,0.054,0.822,0.4019
他們還會說日語，非常友善！很有趣！飲料時尚又好喝👍 …,"They also speak Japanese, very friendly!Very interesting!Drinks are fashionable and delicious ...",False,0.28,0.0,0.72,0.6467
"好喝、又很有趣的酒🎉
神秘的入口增添不少趣味～ …","A delicious and interesting wine 很
The mysterious entrance adds a lot of interest ~ ...",False,0.42,0.0,0.58,0.8555
