Original,EN,Needs Review,Positive,Negative,Neutral,Compound
店員感覺不想做生意，態度很不友善。不推👎👎,"The clerk didn't want to do business, and his attitude was very unfriendly.Not to push 👎👎",False,0.0,0.064,0.936,-0.0572
炸雞好吃,Fried chicken delicious,False,0.649,0.0,0.351,0.5719
開心,happy,False,1.0,0.0,0.0,0.5719
店家親切客氣，食物中規中矩,"The store is kind and polite, and the food is quite satisfactory",False,0.382,0.0,0.618,0.7346
一個非常酷的地方，有很棒的食物。強烈推薦！,A very cool place with great food.Recommended strongly!,False,0.645,0.0,0.355,0.8436
