Original,EN,Needs Review,Positive,Negative,Neutral,Compound
"拿鐵喝起來味道平衡，沒有混雜煙燻或果香味
香蕉花生帕尼尼搭配的不錯，好吃，感覺有用心
人手較少，候餐時間長一點；空間略小，感覺溫馨，但四人以上團體聚會較擁擠","Latte's drinking taste is balanced, no mixed smoke or fruity aroma
Banana peanut Panini is good, delicious, and feel attentive
There are fewer people, waiting for a long time; the space is slightly smaller and feels warm, but the group gathering of more than four people is more crowded.",False,0.11,0.031,0.86,0.4854
"【假日早上，坐在「公雞咖啡」復古的木質空間內，嚼著麵包，喝上一口Expresso，在現代的都市旁，像個法國人一樣緩慢而優雅，推薦給不趕時間，有耐心慢慢等後的妳。】

十一點左右的陽光，空氣乾乾的，中山站附近的人潮還不是很多，偶有幾個騎自行車的經過，公雞咖啡，就位在捷運線狀公園旁邊，橘色的木頭店面，在早晨的陽光之下，顯得格外明顯。

燻鮭魚烤可頌 110元
可頌、煙燻鮭魚片、酸黃瓜，一樣有炒蛋。

好事花生牛肉堡 180元
雜糧麵包、特選牛漢堡肉、香脆花生醬、蔬菜，額外放了炒蛋跟可愛的葡萄四顆。

羅賓三明治 110元
全麥土司、俄式風味抹醬、牛肩肉、德國酸菜，額外放的炒蛋一份，似乎只要是全（黑）麥的麵包，夾上鹹牛肉德國泡菜跟起士的這種組合，就可以被稱為羅賓三明治，起源有一說，來自一個愛打牌的雜貨店老闆，為了給牌友充飢，隨手做出的餐點。

「公雞咖啡」的羅賓三明治生菜比例較高，吃來口味輕鬆，雖然組合的原料看來皆屬重口味的，但相加一起反倒不會，清爽脆口的食感，適合曬著慵懶的淡色晨光慢慢吃。","[Holiday morning, sit in the retro wooden space of ""Rooster Coffee"", chew bread, drink an Expresso, and beside the modern city, it is as slow and elegant as a French. After waiting for you..

At about eleven o'clock, the air is dry, and there are not many crowds near Zhongshan Station. Occasionally there are a few cycling. Under the sun in the morning, it looks particularly obvious.

Smoked salmon can be praised for 110 yuan
You can also have scrambled eggs, smoked salmon slices, sour cucumber.

Good things peanut beef castle 180 yuan
Miscellaneous bread, special options of beef burger, crispy peanut butter, vegetables, and four additional scrambled eggs and cute grapes.

Robin Sandwich 110 yuan
Quanmai Tu, Russian flavor sauce, beef shoulder beef, German sauerkraut, extra sacred eggs, seem to be as long as the whole (black) wheat bread, sandwiched with salted beef kimchi and cheese, this combination, It can be called Robin Sandwich. The origin of the origin is that the owner of a grocery store who loves to play cards, in order to fill the hunger to the brand, make a meal.

Robin sandwiches with ""rooster coffee"" is relatively high, and the taste is easy. Although the raw materials of the combination seem to be heavy, it will not be added together. Light color morning light is slowly eaten.",False,0.111,0.008,0.881,0.9738
"三星多有點委屈，晚上來，叫隔壁的碳烤來吃，隔壁的碳烤比較慢，但是老闆的經典調酒，店裡面的三款生啤酒都好喝
推1966的白啤酒，帶有點花香跟檸檬味道","Samsung is a bit aggrieved. At night, the carbon roasted next door to eat. The carbon grilled next door is slow, but the classic bartending of the boss and the three raw beer in the shop are delicious.
Push 1966 white beer, with a little flower fragrance and lemon flavor",False,0.093,0.0,0.907,0.7227
小酌好去處,Drink a good place,False,0.492,0.0,0.508,0.4404
每次來都有不同的遭遇！有人訂位不早講，都坐著等了才來趕人。明明還有位子，好幾對客人來卻說沒有⋯還放一大箱食材佔位子。雖平價，但份量不多，也沒多特別。最後一次來很傻眼，等餐等了30分鐘才上，態度又不好⋯,"There are different encounters every time!Someone did not booked early, and they were sitting and waited before they came to catch people.Obviously there are still seats, but several pairs of guests did not say that there was no big box of ingredients to occupy the seats.Although it is cheap, but the portion is not much, it is not special.The last time I came was dumbfounded, I waited for 30 minutes to wait for the meal, and the attitude was not good.",False,0.0,0.11,0.89,-0.8625
酒在台北算便宜，環境稍小但是相當舒適。點了一杯Godfather喝起來味道到位，很喜歡。不知道有沒有店的特調？如果僅限酒單上的選擇稍少,"Wine is cheap in Taipei, and the environment is slightly smaller but quite comfortable.I ordered a glass of Godfather to drink in place and like it very much.I wonder if there is a special tone?If only the choice on the wine list is slightly less",False,0.137,0.0,0.863,0.7783
血腥瑪麗相較於傳統配方來說比較甜、比較不辣，是泰式風味的血腥瑪麗！蠻好喝,Bloody Mary is sweeter and not spicy than traditional formulas. It is a Thai -style bloody Mary!Pretty delicious,False,0.149,0.246,0.605,-0.3382
"服務/雖然沒特別熱情但很輕鬆非常好，很像自家一樣，適合能安靜的好好用餐
餐點/
煙燻鮭魚早午餐-是我目前吃過早午餐最大方的鮭魚肉，沙拉很普通但很新鮮
飲料/鮮奶茶不甜很單純好喝","Service/Although it is not particularly enthusiastic, it is very easy and very good.
Meal/
Smoked salmon breakfast-is the largest salmon meat I have for lunch at present, salad is very ordinary but fresh
Drinks/fresh milk tea is not sweet and very simple and delicious",False,0.231,0.092,0.677,0.8335
"很有特色的個人咖啡店，在中山走累了請推門進來，如果早點來可以享用 男子漢早餐，會元氣滿滿哦！

覺得好，幫我按讚👍啦！ …","Very distinctive personal coffee shop, please push the door when you walk in Zhongshan. If you can enjoy the men's breakfast earlier, you will be full of vitality!

I think it's okay, help me like it!Mowing",False,0.34,0.0,0.66,0.9258
特別喜歡店內外的設計，整體感覺很好,I especially like the design inside and outside the store.,False,0.237,0.0,0.763,0.4201
在生菜裡看到ㄧ根陰毛，跟店員反應後只回答了聲不好意思就整盤被收走，之後也沒有再補上新餐點。結帳時再次向店員詢問，店員猶豫了一會兒才決定將低價餐點退費，但發現有問題的是較高價的餐點！並不是在意退費或有沒有補上餐點，而是整個過程店員的態度都非常無所謂，彷彿餐點裡有陰毛是一件尋常瑣事的樣子～那不是頭髮是陰毛耶！！！！！！,"I saw the root pubic hair in the lettuce. After responding to the clerk, I only answered the sound and was embarrassed and was taken away throughout the market. After that, I did not make up for a new meal.At the checkout, I asked the clerk again that the clerk hesitated for a while before deciding to refund the low price meal, but found that there was a problem with a higher price meal!It is not to pay attention to the refund or whether to make up for meals, but that the attitude of the clerk the entire process is very indifferent, as if there is pubic hair in the meal, it is an ordinary trivial ~ that is not the hair is pubic hair!IntersectionIntersectionIntersectionIntersectionIntersection",False,0.011,0.097,0.892,-0.8566
好好吃又好好喝 ！ 老闆善良又好正,It's delicious and delicious!The boss is kind and good,False,0.632,0.0,0.368,0.8832
"空間頗小 又等太久
餐點肉品皆是加工食品 相較之下CP值很低 計算下來容易過油熱量過高
貝果反而是當中覺得最好吃的 奶茶也不錯
但不會再訪","The space is small and wait too long
Meats of meat are all processed foods. Compared with low CP value, calculate it.
Instead, Beigu is the best milk tea in it.
But I won't visit again",False,0.111,0.04,0.849,0.4118
"三不五時半夜給我在店內大聲唱歌 放音樂
當附近住戶不用睡覺的嗎
好不容易睡著又被你們的音樂聲吵醒

自私
惡劣
可惡至極

只顧自記爽 完全不管別人死活
警察來了幾次也不見改善
無良店家","Singing me in the middle of the night in the middle of the night, singing and playing music in the store
Do you need to sleep when nearby residents need to sleep?
After finally falling asleep and being awakened by your music sound

Selfish
bad
Abominable

Just remember that it is completely cool, regardless of others and lives
The police have not seen a few times without seeing the improvement
Unscrupulous shop",False,0.054,0.132,0.814,-0.742
"付現，茶水自己倒，沒服務費
位子不多，大概只能做12～15人以內
份量適中，花生醬牛肉堡搭配熱的鮮奶茶很不錯","Give the tea, the tea itself is poured, there is no service fee
There are not many seats, and it can only be done within 12 to 15 people
Moderate portion, peanut butter beef castle with hot fresh milk tea is very good",False,0.115,0.046,0.839,0.5095
"破店一間！路旁蟑螂老鼠一堆在散步
這酒水品質可以算酒吧？？","Break a shop!Ast to walk on the roadside cockroach mice
Can this wine quality be counted?Intersection",False,0.0,0.0,1.0,0.0
氣氛很溫馨的小店，餐點也好吃，和朋友坐了很久～但是坐在吧台區所以廚房製作餐點時的油煙味比較重,"The small shop with a warm atmosphere, the meal is delicious, I have been sitting with my friends for a long time ~ but sitting in the bar area, so the oil smoke taste when making meals in the kitchen",False,0.137,0.0,0.863,0.5927
動作很慢，態度不好很不耐煩，千層麵最下面還溫溫生生的，反應請幫忙加熱也只說了「喔」通常不是會道個歉或解釋一下嗎,"The movement is very slow, the attitude is not very impatient, the bottom of the thousand levels is still warm and warm. Please help heated the reaction and only say ""Oh"". Do n’t you apologize or explain?",False,0.284,0.0,0.716,0.8521
店員人都很好,The clerk is very good,False,0.444,0.0,0.556,0.4927
"ㄧ顆星都不值
本來不信網路負評價 所言服務態度很差
果然超級糟
建議不用浪費時間去踩雷了

點菜時對於菜單不太了解
請該店男性留小鬍子店員過來 協助解釋菜單內容
該店員 不但不走過來
直接站在原地傲慢而且不清楚的回答菜單內容

由於距離太遠，根本不知道他在說什麼
請他過來
態度更是不耐煩
該店員不但不解釋菜單
還反問客人一個是sandwich 跟brunch
上面已經寫的很清楚，難道你看不懂嗎
⋯⋯

客人不熟悉 該店的菜單是正常的
店員熟悉，並懂得介紹自己店裡的菜單是應該的
不知道在不爽什麼
相當傲慢無禮而且不專業

尤其東西更不怎樣，服務又超級糟
完全完全不推薦！！","ㄧ A star is not worth it
I didn’t believe the service attitude of the online negative evaluation. The service attitude is very poor
It's really bad
It is recommended not to waste time to step on the mine

I don’t know much about the menu when ordering
Please stay in the shop to stay with a beard clerk to help the explanation of the menu content
The clerk not only does not come over
Standing directly in the place of arrogance and unclear answering menu content

Because the distance is too far, I don’t know what he is talking about
Please come over
Attitude is even more impatient
The clerk not only does not explain the menu
Also ask the guests to be Sandwich and Brunch
The above has been written very clearly, don't you understand?
...

It is normal for guests to be familiar with the menu of the store
The clerk is familiar and knows how to introduce the menu in his store should be
I don't know what I am upset
Quite arrogant and unprofessional

Especially things are not so good, the service is super bad
Not recommended at all!Intersection",False,0.079,0.167,0.754,-0.9647
"早午餐蠻好吃的
但是當時現場只有一位工作人員，要等比較久一點，位置沒有很多","Lunch is pretty delicious
However, there was only one staff member at the time at the time, so I had to wait a little longer, and there were not many positions.",False,0.192,0.0,0.808,0.7845
"夜間喧嘩，警察勸導多次無效
酒客還會跑到線型公園大吼大叫
當附近居民都不用睡覺？","Noise at night, the police persuaded multiple times to invalidate
The wine guest will also run to the line park and yell
When nearby residents do not have to sleep?",False,0.0,0.0,1.0,0.0
音樂很好聽 可是香蕉蛋糕的價位以及份量讓我倒吸一口冷氣 是鍍金的香蕉嗎？還是什麼北海道進口麵粉之類的嗎？就算是也太小塊了吧⋯⋯,"The music is very nice, but the price and weight of the banana cake have made me take a bite of air -plated bananas?Still what Hokkaido imported flour is?Even if it's too small, right?",False,0.073,0.0,0.927,0.3791
"好吃，氣氛舒服，愜意的享受~
就算一個也很可以~
另外闆娘也有很多好酒唷~","Delicious, comfortable atmosphere, comfortable enjoyment ~
Even one is very good ~
In addition, Ban Niang also has a lot of good wine ~",False,0.493,0.089,0.419,0.9468
覺得餐點還可以，但廁所真的要加強，其實可以再多增設一間蹲式馬桶，希望清潔度可以再加強,"I think the meal is okay, but the toilet is really strengthened. In fact, you can add another squat toilet. I hope that the cleanliness can be strengthened.",False,0.354,0.0,0.646,0.9207
很有氣氛的酒吧！有機會想去小酌幾杯☺️,Very atmospheric bar!Have a chance to have a drink a few cups ☺️,False,0.306,0.0,0.694,0.6476
"🇹🇼🥪☕️．男子漢早餐
➖
這叫「男子漢早餐」
所以真的超大份
➖
a big breakfast
➖
#upoint #upoint通天工作室 #utaipei2018
#nationalday #taiwan #台灣共好
#雙連 #早餐 #shuanglian #breakfast
#hongkonger #hongkong #uFood #uFood點食","🇹🇼🥪☕️.Breakfast
Bleak
This is called ""Men's Breakfast""
So it's really super large
Bleak
a big breakfast
Bleak
#Upoint #UPOINT Tongtian Studio #UTAIPEI2018
#NATIONALDAY #Taiwan #
# #Breakfast #Shuanglian #Breakfast
#Hongkonger #Hongkong #UFOOD #UFOOD order",False,0.11,0.0,0.89,0.6659
氣氛很棒！平價早午餐～,The atmosphere is great!Biccessive brunch ~,False,0.0,0.0,1.0,0.0
"風景好
飲料份量多","Good scenery
Drink a lot",False,0.42,0.0,0.58,0.4404
"桌椅有點舊了，希望再使用一陣子可以更換
好事花生牛肉堡好吃，朋友點的培根也煎得超香","The table and chairs are a bit old, I hope to use it for a while to replace it
Good things peanut beef castle is delicious, and the bacon of friends order is also fried",False,0.289,0.0,0.711,0.9118
"問了店內是否提供插座，店員說有卻沒有提到額外的費用30NTD; 結帳時感覺被搶劫。Asked if there's power socket inside, the stuff said yes without mentioning an extra charge of 30NTD; feel like being robbed afterwards..😑 …","Asked whether the shop was provided in the store, the clerk said that he did not mention the extra cost of 30NTD; he felt robbed at the checkout.Asked if there are power socket inside, the stuff said yes with isouting an extra charge of 30NTD; feel like being robbed afterwards..😑 ...",False,0.093,0.0,0.907,0.6369
"點了一杯調酒 喝起來像很淡很淡的橘子氣泡水

380元的氣泡水 好貴🥺 …","I ordered a glass of alcohol to drink like a very light orange bubble water

380 yuan bubble water is so expensive ...",False,0.102,0.0,0.898,0.3612
"超可愛的小店
位置不多但店員都很友善
食物很好吃
擺盤拉花也都很精緻","Super cute shop
There are not many positions, but the clerk is very friendly
Food is delicious
Playing flowers are also very delicate",False,0.517,0.0,0.483,0.953
半開放式的門，坐在裡面不用開冷氣也覺得很涼爽，餐點簡單好吃,"The semi -open door, it feels cool to sit inside without having to turn on the air -conditioning, the meal is simple and delicious",False,0.214,0.0,0.786,0.7184
"位子不多假日可能要等，不過餐點還滿好吃的，出餐也算快
裝潢滿有特色，很好拍","You may have to wait for the seat without many holidays, but the meal is still delicious, and the meal is fast.
The decoration is full of characteristics, very easy to shoot",False,0.22,0.12,0.66,0.7393
餐點不錯吃，擺盤精製，內部裝潢也蠻復古的，喜歡他的奶茶。,"The meal is good, the plate is refined, and the interior decoration is quite retro. I like his milk tea.",False,0.239,0.0,0.761,0.6872
用料新鮮實在，店內裝潢擺設呈復古風格，播放音樂走輕快方式，適合悠閒的下午時光。,"Fresh and fresh materials, the interior decoration of the store is retro style, playing music and gently, suitable for leisurely afternoon.",False,0.356,0.0,0.644,0.8126
"老闆娘人很好，不小心喝錯，還多給我們一杯
很熱情人有非常好👍 …","The boss is very good, accidentally drink it wrong, and give us a more glass
Very enthusiastic person is very good ...",False,0.308,0.176,0.516,0.6558
舒服怡然的台北咖啡店，喜歡這裡的氣氛，放鬆的待在這裡一個下午，享受台北的文化，享受一杯咖啡，享受一份健康好吃的早午餐，一點悠閒，一點台北，我愛的台北。,"The comfortable Taipei coffee shop, like the atmosphere here, relax here for an afternoon, enjoy the culture of Taipei, enjoy a cup of coffee, enjoy a healthy and delicious brunch, a little leisurely, a little Taipei, I love Taipei.",False,0.488,0.0,0.512,0.9811
"一周前訂位10:30 到了現場鐵門卻是拉下來的
這次的經驗非常不好","Booking a week ago at 10:30, the iron gate was pulled down
The experience this time is very bad",False,0.0,0.174,0.826,-0.5849
平價，但份量不大，環境舒適但位子不多，常常外面很多人在等就不太好意思久坐,"Pakistic, but the portion is not large, the environment is comfortable but the seat is not much. Often, many people outside are waiting for a long time.",False,0.146,0.0,0.854,0.6652
"椅子坐到布都破了還不換⋯
餐點表現平平不難吃但也不特別驚豔
員工親切","The chair is broken and the cloth is broken. I don’t change it.
The performance of the meal is flat, but it is not particularly amazing
Cordial employee",False,0.0,0.254,0.746,-0.8193
"餐點好吃、氣氛好
窗戶時常開著通風、陽光斜倚
適合愜意的人們聊天或工作的好地方","The meals are delicious and the atmosphere is good
Windows often open ventilation, sunlight oblique
Suitable for people who are comfortable to chat or work",False,0.31,0.0,0.69,0.872
跟旁邊的居酒屋是一起的，可以點隔壁熱食,"It is together with the izakaya next to the izakaya, you can order the hot food next door",False,0.0,0.0,1.0,0.0
甜點、早午餐都不錯，開店時間早，但人多，座位少，不太適合念書XD,"Desserts and brunch are good. I opened the store early, but there are many people, few seats, and they are not suitable for studying XD",False,0.264,0.0,0.736,0.85
"位子少就算了
餐點份量少 也不好吃
同樣價位 CP太低 吃到生氣","Little seats
The meal is small and not delicious
The same price CP is too low to eat and get angry",False,0.0,0.318,0.682,-0.8125
店內空間有點小，冷氣很微弱，夏天可能會邊流汗邊吃,"The space in the store is a bit small, and the air -conditioning is very weak. It may be sweaty in summer",False,0.0,0.132,0.868,-0.4927
紅酒很推～,Red wine is pushed ~,False,0.0,0.0,1.0,0.0
氣氛很好，復古風，桌邊裝飾物上灰塵能也注意到會更好,"The atmosphere is very good, retro wind, the dust on the table on the table can also notice that it will be better",False,0.225,0.0,0.775,0.7264
調酒很可以，餐也很好吃,"Into the bartending, the meal is also delicious",False,0.346,0.0,0.654,0.5719
鬧中取靜，很舒適的地方,"Quiet, very comfortable place in trouble",False,0.349,0.262,0.389,0.2247
餐點超好吃，每週六音樂活動很棒,"The meal is super delicious, and the music activities are great every Saturday",False,0.539,0.0,0.461,0.9136
店家前面的擺飾很美，環境不錯，適合在這兒久坐。,"The decoration in front of the store is beautiful, the environment is good, suitable for sitting here for a long time.",False,0.264,0.0,0.736,0.7783
很舒服的小店 東西有點小貴但蠻好吃的！,Very comfortable small shop is a bit expensive but delicious!,False,0.488,0.0,0.512,0.8243
"除了酒，連檸檬汁都好喝。
❤️❤️❤️❤️❤️
老闆好帥ㄋㄡ","Except for wine, even lemon juice is delicious.
❤️❤️❤️❤️❤️
The boss is so handsome",False,0.271,0.0,0.729,0.8323
因為座位數不是太多，所以也不會太吵。,"Because the number of seats is not too much, it will not be too noisy.",False,0.178,0.0,0.822,0.2066
"老闆娘很可愛❤️❤️
度過愉快的一晚，希望能常來","The boss is very cute ❤️❤️
After a happy night, I hope I can come often",False,0.382,0.0,0.618,0.8718
氣氛不錯 很適合跟女朋友一起來,"The atmosphere is good, very suitable for your girlfriend",False,0.266,0.0,0.734,0.4404
有插座但是要收 30 元，咖啡還不錯,"There are sockets but 30 yuan, coffee is not bad",False,0.295,0.0,0.705,0.5824
"老闆很忙 要等一下下
血腥瑪麗好喝","The boss is very busy to wait
Bloody Mary is delicious",False,0.237,0.186,0.577,0.2023
油煙味太重，候餐太久 其他都很好,"The smell of oil fume is too heavy, and the other time is too long.",False,0.0,0.136,0.864,-0.296
老闆親切而且細膩，完全能滿足當下喝酒的想望。,"The boss is kind and delicate, which can fully satisfy the current desire of drinking.",False,0.491,0.0,0.509,0.8622
"服務好,口味佳!! 座位有限,請耐心等候!!","Good service, good taste !! The seat is limited, please wait patiently !!",False,0.46,0.094,0.446,0.811
"那個奶茶我以為在喝透明奶茶
透明的不是外觀是味道","I thought that milk tea was drinking transparent milk tea
What is transparent is not the appearance is taste",False,0.0,0.0,1.0,0.0
喜歡這邊的氛圍，花生拿鐵好喝,"Like the atmosphere here, peanuts take the iron to drink",False,0.217,0.0,0.783,0.3612
"整個被店員遺忘。。。。
早午餐的炒蛋有點鹹","The whole clerk was forgotten.EssenceEssenceEssence
The scrambled eggs of brunch are a bit salty",False,0.0,0.0,1.0,0.0
"抹茶拿鐵好喝值得品嚐
伯爵蛋糕👍🏻 …","Matcha with iron is delicious and tasting
Earl Cake 蛋 ...",False,0.27,0.0,0.73,0.5719
東西好吃～只是比較難等,It's delicious ~ It's just difficult to wait,False,0.303,0.205,0.492,0.296
拍照好地方 不過夏天會有點曬,"It's a good place to take pictures, but it will be a bit sunny in summer",False,0.288,0.0,0.712,0.6858
氣氛好，餐點普通,"The atmosphere is good, the meal is ordinary",False,0.293,0.0,0.707,0.4404
氣氛溫暖，餐點精緻！,The atmosphere is warm and the meals are exquisite!,False,0.215,0.0,0.785,0.2942
有放鬆舒服的感覺，很自在,"There is a feeling of relaxation and comfort, very comfortable",False,0.647,0.0,0.353,0.8748
適合慢活且喜歡暖色喧囂的城市旅人,Suitable for urban travelers who like to live slowly and like warm hustle and bustle,False,0.365,0.0,0.635,0.7096
不錯吃，店別緻,"Not bad, the store is unique",False,0.363,0.0,0.637,0.431
第一次good，第二次 有點慢。。,"For the first time, the second time is a bit slow.Essence",False,0.0,0.0,1.0,0.0
咖啡還行，就是有點慢,"Coffee is okay, it's a bit slow",False,0.241,0.0,0.759,0.2263
"氣氛很好的小酒吧，伴隨著輕鬆的音樂，散發著古老的日本酒吧氛圍。在和朋友去其他地方之前，我來這裡喝了一杯酒。他們提供價格合理的生啤酒和雞尾酒等其他飲料。天氣好的時候，坐在外面的沙發上也是不錯的選擇。

您也可以在隔壁的商店訂購日本料理！","The atmosphere is very good, accompanied by relaxed music, exuding an old Japanese bar atmosphere.Before going to other places with friends, I came here to drink a glass of wine.They offer other drinks such as raw beer and cocktails.When the weather is good, it is also a good choice to sit on the sofa outside.

You can also order Japanese cuisine at the store next door!",False,0.203,0.0,0.797,0.9391
有點像美國的咖啡館，音樂及擺設家具都是舊古董，很有特色，但位子很少，經常要訂位才行。食物與價格算中等，還不錯，但感覺坐不久……年輕老闆酷酷的沒有笑容，有點可惜,"It is a bit like the American cafe. Music and furniture are old antiques. They are very distinctive, but they have very few seats. They often have to book.Food and price are medium, pretty good, but I feel like sitting ... The young boss has no smile, a pity",False,0.213,0.089,0.698,0.8264
我喜歡這個地方。業主和工作人員都很好。氛圍很棒。我喜歡坐在這裡閱讀或看著人們走過。價格很優惠，六點之後你可以從隔壁點餐，他們會送你。我在這裡從未有過糟糕的經歷。它輕鬆又完美。,"I like this place.The owners and staff are very good.The atmosphere is great.I like to sit here or watch people walk through.The price is very favorable. After 6 o'clock, you can eat from the next door, and they will send you.I have never had a bad experience here.It is easy and perfect.",False,0.279,0.0,0.721,0.9505
