Original,EN,Needs Review,Positive,Negative,Neutral,Compound
"東西還可以，老宅開放式廚房，油煙有影響。
位子約10來個","Things are ok, the old house is open kitchen, and the oil fume has an impact.
About 10 seats",False,0.0,0.109,0.891,-0.296
"環境棒，氣氛好，出菜速度不慢。
餐點擺盤棒，量稍少適合女生。
另外竟然有提供手機無線充電，佩服佩服","The environment is great, the atmosphere is good, and the speed of dishes is not slow.
Meal a rod, slightly less measured for girls.
In addition, there is a wireless charging of mobile phones, admiring and admiring",False,0.27,0.0,0.73,0.9042
雙十節的早上路過，店內有一點復古風，上餐動作不快，等待時飲料也不會先上，點了牛肩佛卡夏，三明治和炒蛋都算ok，價格偏高，適合早上閒閒沒事做的人過來吃,"Passing by in the morning in Double Ten Festival, there is a retro style in the store, and the meal is not fast. The drinks will not go first when you wait. You ordered the bull -shoulder Buddha Katham. People who have nothing to do when they have nothing to do to eat",False,0.058,0.0,0.942,0.4939
"食物是隔壁的居酒屋煮的
不錯吃
調酒很普通
沒有什麼特色調酒
都是基本款","The food is cooked in the izakaya next door
Good food
Blooming is very ordinary
No specialty bartending
All basic models",False,0.119,0.102,0.779,0.1082
東西好吃，裝潢蠻有特色，可惜店面小，位子少了點,"The stuff is delicious, the decoration is quite unique, but unfortunately the store is small, the seat is less,",False,0.103,0.153,0.744,-0.2836
"朋友提前好幾天預約訂位了下午一點的位子，到了地點看到鐵門深鎖一度懷疑自己跑錯地方，打電話詢問後竟然得到中午沒有營業的答案，所以店家是幫我們登記凌晨一點的訂位嗎？？？
（google營業時間為8:30-23:30）","Friends made an appointment for a few days in advance and booked a seat at 1 pm. When I arrived at the location, I saw the iron door deep locks. I suspected that I ran the wrong place. After calling and asking, I got the answer to no business at noon. Is it reservation?IntersectionIntersection
(Google business hours are 8: 30-23: 30)",False,0.046,0.107,0.847,-0.4767
"《女朋友早餐》
空間不大，舒適度60分，輕鬆感倒是不錯
餐點部分普通，法式土司隱約有肉桂味道（我怕呀～）！出餐速度稍慢…
店裡只有中華電信的熱點，InforCharge無限充電！","""Girlfriend Breakfast""
The space is not large, the comfort is 60 points, the relaxation is good
The meal part is ordinary, and the French Tuska has a faint cinnamon flavor (I'm afraid ~)!The speed of meals is slightly slow ...
There is only the hotspot of Chunghwa Telecom in the store, Informcharge is unlimited!",False,0.115,0.035,0.85,0.6979
內用油煙味極重，但餐點上菜速度快又可口！,"The flavor of the oil fume is extremely heavy, but the meal is fast and delicious!",False,0.255,0.076,0.669,0.6948
內部頗具特色的小店  但口味普通  份量中等  奶茶一杯170不知道貴在哪裡,"The internal shop with distinctive characteristics, but the taste is ordinary, medium -sized milk tea, a cup of 170, 170, I don’t know where the expensive is.",False,0.0,0.0,1.0,0.0
"味道還不錯👍
適合和朋友聚會的早午餐～ …","The taste is pretty good 还
Suitable for brunch with friends to meet with friends ~ ...",False,0.486,0.0,0.514,0.9062
"復古風格的早午餐店
氣氛還不錯","Retro -style breakfast restaurant
The atmosphere is not bad",False,0.263,0.0,0.737,0.431
"油醋佛卡夏拼盤⋯$230
空間不大/ 店員一人/ 位子雖少///
但卻非常喜歡👍👍👍

喜歡 佛卡夏的真材實料
喜歡 店員親切的笑容😊
喜歡 這樣簡單溫暖的小空間🏡✨","Oil Vinegar Faxi Platform ... $ 230
There is a small space/ a shop clerk/ though less /////////////
But I like it very much

Like the real material of Foxia
Like the clerk's kind smile 切
Like this simple and warm small space 喜欢",False,0.39,0.0,0.61,0.9739
餐點好吃、環境舒服、音樂好聽，還想再來,"The meal is delicious, the environment is comfortable, the music is good, and I want to come again",False,0.444,0.0,0.556,0.8807
"假日的早午餐,沒訂位過去店裡享用
雖然店面小小的,還滿有特色的~
可惜在點餐時服務人員一直恍神,所以一直重複詢問我們要什麼餐點~
份量還OK....口味還能接受!!!","Holiday breakfast, no booking, enjoy the store in the past
Although the store is small, it is full of characteristics ~
Unfortunately, the service staff has been stunned when ordering, so I have been repeatedly asked what meals we want ~
The weight is OK ... The taste can be accepted !!!",False,0.158,0.138,0.704,0.314
下班小酌聊天放鬆的好地方，讚讚👍 …,"Chat and relax when chatting from work, praise ...",False,0.481,0.0,0.519,0.7579
很好吃 氣氛放鬆 非常用心的料理 適合步調慢的客人 別隨便給差評,"Very delicious atmosphere, relaxing and very intentional dishes, suitable for customers who are slow in pace",False,0.348,0.0,0.652,0.8155
"需要時間等待 如果很趕的不建議在這用餐
出餐速度30分鐘，花生漢堡很好吃推薦","It takes time to wait, if it is very hurry, it is not recommended to eat here
The meal speed is 30 minutes, and the peanut burger is very delicious",False,0.119,0.047,0.834,0.5269
餐點好吃 cp值高 但座位很少,"The meal is delicious, the CP value is high, but the seat is very small",False,0.238,0.0,0.762,0.4678
早上8 點就可吃早餐的咖啡廳，飲料不錯，但餐點還好哦！,"You can eat breakfast at 8 am. The drink is good, but the meal is okay!",False,0.247,0.0,0.753,0.5562
"酒吧老闆不知道是不是心情不好，菜單上面標示屁孩和玻璃心的人不要來，想說也許老闆是經營風格較為性格，並沒有太在意，整間店共用一本酒品菜單也非常的節儉，老闆好幾次來催促餐點完了沒有。
點酒的態度上，詢問老闆關於調酒的口感，老闆口氣極為不耐煩，還問我大家都有喝一樣是怎樣？感受不太到老闆對於客人的基本尊重，如果真的心情不好建議乾脆休息好心情再營業。
點餐的服務員也令人一頭霧水，和第一位服務人員確認餐點過後，第二位又來做同樣的確認，強買強賣這樣的店家不會再有下一次的光臨，更要注意的是店員穿梭在酒吧和居酒屋之間並不會戴上口罩，奉勸注重個人防疫的人去之前要多加三思。","The bar owner does n’t know if it ’s a bad mood. Do n’t come on the menu that marked fart children and glass hearts. I want to say that maybe the boss has a more personality personality and does not care too much. Fack, the boss has come to urge meals several times.
In the attitude of ordering alcohol, asking the boss's taste about bartending, the boss was extremely impatient, and asked what everyone was drinking?I do n’t feel the basic respect of the boss for the guests.
The waiter who ordered the food was also confused. After the first service staff confirmed the meal, the second one came to make the same confirmation. Note that the clerk shuttled between the bar and the izakaya will not wear a mask, and advised those who pay attention to the personal epidemic prevention to go three more thoughts before going.",False,0.054,0.076,0.87,-0.3861
店內空間雖小，不過很舒適，餐點好吃份量也相當夠，飲料也好喝～,"Although the space in the store is small, it is very comfortable, the meal is delicious enough, and the drink is also good ~",False,0.327,0.0,0.673,0.8805
"酒好喝 現場live音樂好好聽 還可以點歌
闆娘活潑熱情好可愛 下次再去😍 …","The wine is delicious live live music, you can sing well
Ban Niang is lively and enthusiastic, so cute, next time I go ...",False,0.422,0.096,0.482,0.9035
"環境優雅,價格合理不錯優","Elegant environment, reasonable price, good and good",False,0.69,0.0,0.31,0.836
很喜歡路邊喝咖啡的感覺，但很隨性的營業時間有點可惜只享受了15分鐘寧靜片刻,"I really like the feeling of drinking coffee on the roadside, but the business time is a bit unfortunately only enjoyed for 15 minutes.",False,0.251,0.101,0.649,0.5615
店面算小間，味道還不錯~,"The store is considered a small room, the taste is pretty good ~",False,0.357,0.0,0.643,0.7269
"復古摩登，很有氣氛的空間，各個視角拍照都好美 <3
-Nostalgia&Modern Space-","Retro Modern, very atmospheric space, taking pictures of each perspective is so beautiful <3
-Nostalgia & Modern Space-",False,0.338,0.0,0.662,0.8469
"別再查評價了！直接進去看看今天老闆有什麼驚喜：）
意外總是有趣可愛的","Don't check the evaluation anymore!Go in directly to see what surprises there are today's boss :)
Accidents are always interesting and cute",False,0.361,0.076,0.563,0.8221
前幾天就預約9:30，但抵達現場卻大門深鎖，打電話還進語音信箱，超傻眼😡 …,"I made an appointment at 9:30 a few days ago, but the door was locked at the scene, and the phone call back to the voice mail, super dumbfounded ...",False,0.146,0.093,0.762,0.4497
怕蟑螂的不要去隔壁居酒屋，整家店都是蟑螂，一隻也就算了，坐不到一小時看到兩三隻，真的很誇張,"If you are afraid of cockroaches, do n’t go to the izakaya next door. The entire shop is cockroaches. Even if you sit for an hour or three, it ’s really exaggerated.",False,0.0,0.052,0.948,-0.1761
氣氛悠閒 老闆娘友善 東西也非常好吃 推薦貓王三明治,"The atmosphere is leisurely, the boss is friendly and very delicious. Recommended Elvis Sandami",False,0.457,0.0,0.543,0.8508
"難得跟朋友下班開心聚會，點了食物遲遲未上菜，最後才通知食材不足，我們也妥協取消所有原本點的菜，打算喝完飲品去別的地方續攤。
當正要離開時，突然上了幾道剛剛點的餐點，大家一臉錯愕（不是取消了嗎？），很明顯是剛才的溝通有誤會，但重點是後續處理的態度極差，流程上的疏失卻是顧客全部承擔，就無論結果誰對誰錯，用餐體驗太差了，不會再次光顧。","Rarely meet with friends from get off work, ordered the food to be late, and finally notified the ingredients insufficient. We also compromised to cancel all the original dishes.
When I was leaving, I suddenly went to the meal that I just ordered, and everyone looked wrong (isn't it canceled?), It is obvious that the communication has been misunderstood, but the point is that the attitude of the subsequent processing is extremely poor. The process is in the process. The negligence is all the customer's borne. No matter who the result is right, who is wrong, the dining experience is too poor, and it will not be patronized again.",False,0.013,0.171,0.815,-0.9544
"8.點晚餐9.才來說餐點沒了？？？中間兩度確認餐點（我們很明確說如果東西沒了就全部不用點了）
最後結帳我們都要走了餐點上上來單字丟在桌上要我們付錢感受真的很差，可以接受有個性的店但個性跟禮貌一線之間，重點我們全程態度都很好，沒有要求要特別好的服務，但消費來被這樣對待感受真的很差給一顆星都嫌多⋯","8. Late dinner 9. Only the meal is gone?IntersectionIntersectionMake a meal twice in the middle (we are very clear that if the things are gone, you don't need to order it)
Finally, we all have to go to the meal. We have to go up and throw it on the table for us to pay for it. It ’s really poor to pay. You can accept the personality of personalities but between your personality and politeness. It is required to be particularly good service, but consumption is really poor to be treated like this.",False,0.106,0.087,0.807,0.453
晚上放著音樂，來杯小酒，很chill,"Put music at night, come to a glass of wine, very chill",False,0.0,0.0,1.0,0.0
"闆娘超直爽海派
環境舒適 自在
讓人心情放鬆
🥰🥰🥰🥰🥰🥰🥰🥰 …","Banniang Super straightforward sea school
Comfortable environment
Relax
🥰🥰🥰🥰🥰🥰🥰🥰 🥰🥰🥰🥰🥰🥰🥰🥰 ...",False,0.701,0.0,0.299,0.9991
店家座位約15人滿座空間，所以如果是想找個安靜空間，享受老台北的安靜早餐，那可以來這家。但由於座位數真的很少，所以先電話來詢問定位吧！這樣店家營運方便，客人也不用撲空還多等。因人手簡單，上餐速度不講求快，但因為跟朋友慢慢聊，不趕時間，可接受。食物最後體驗也不錯。,"The shop seat is about 15 people in the seat, so if you want to find a quiet space and enjoy the quiet breakfast in the old Taipei, you can come to this house.But because the number of seats is really small, let's call the positioning first!In this way, the store is easy to operate, and guests do not need to flutter.Because the hand is simple, the meal speed does not pay attention to it, but because I talk slowly with my friends, do not hurry up, it can be accepted.The last experience of the food is also good.",False,0.165,0.0,0.835,0.9328
"生平第一次寫評論，貢獻給這服務態度真的是我見過史上最爛的一家店
前一天晚上打電話訂位時，一位先生跟我說不限時間後完成訂位，掛完電話不久，另一位店員打給我很多通，於是我看到後馬上回電，他說不好意思 ，剛剛那位先生新來的，我們假日有限時一個半小時，請問能接受嗎？我說我很能接受並表示這也是正常的沒關係，小姐就說好那先生不好意思謝謝你(態度親切很好)一樣幫你定位。
後來我在訂位時間出現，現場滿座，於是就詢問一位戴著毛帽的男服務生說不好意思我有訂位，他說抱歉我這沒有紀錄你要吃就現場排。
我覺得很扯，就再問他我昨天明明有訂位，應該不是跟我說我沒紀錄請現場排吧，我沒訂位也不會跟你在這邊坳?
於是最扯的事情發生了，那毛帽兄不斷回我""不是我接的，接電話的是我嗎？昨天又不是我接的，我這邊就是沒紀錄，現在就是客滿要吃請排隊就這樣""然後又說""先生你態度也不好""聽到他不斷這樣鬼打牆的回答我也醉了，我也沒大聲跟他揮，也是心平氣和跟他說，難道發生這種事情誰會笑笑說好沒關係你繼續忙，客人會打電話訂位，難道要先指定服務生? 心想這位毛帽兄是不是頭悶到了，撇責一流，我也當過服務生，也知道服務生的辛苦，更不可能有""客人至上""的心態。
隨後我把手機對話紀錄給他看，上面明顯顯示通話紀錄，他還是一直跟我說那也不是我打的，後來我問他是不是店長，好險他回答不是，問店長在哪一直說不在，然後說我們客人很多你要吃就排隊，之後的狀況也不重要，其實他真的一開始簡單說個不好意思我相信以台灣人有八成都能接受也不會刁難。
這家店或許有特色，餐點或許好吃，但評論過低不是沒原因，我不知道老闆是誰，我只知道再多用幾個這種員工遲早倒閉，這種服務態度我真的是不敢領教，生平第一次評論就獻給這位94狂的毛帽兄。","For the first time in my life, I wrote a comment and contributed to this service attitude. I have really seen the worst shop in history.
When I called the reservation the night before, a gentleman told me that I completed the reservation after the unlimited time. Soon after hanging up the phone, the other clerk called me a lot, so I immediately called back after seeing it. He said he was embarrassed. Just now, the gentleman is new, and we have a limited time for one and a half hours. Can I accept it?I said that I can accept and say that this is normal. The lady said that my husband is embarrassed. Thank you for helping you.
Later, I appeared at the booking time, and the scene was full, so I asked a male waiter wearing a hairy hat and said I was embarrassed. I said that I was sorry that I had no record.
I think it ’s very tumbling, so I asked him again yesterday. I had a reservation yesterday. It should not be told me that I did n’t record that I did n’t record the scene.
So what happened to the most happened. Brother Mao Hao kept returning to me. ""It wasn't me who answered me, was it me who answered the phone? Yesterday, I didn’t pick it up. I have no record on my side. That's it. ""Then I said,"" Sir, your attitude is not good. ""I heard that he was drunk and I didn't wave loudly. With a smile, it's okay. You continue to be busy. The guests will call to order. Do you want to designate the waiter first? Watching this hairy brother is stuffy and blame. I have also been a waiter and knows the service of the service. The hard work of life is even more impossible to have the mentality of ""guest first"".
Then I showed him the record of the mobile phone dialogue. The call record was clearly displayed above. He still told me that it was not me. Later, I asked him if he was the manager, and he answered that he did not answer. If you are not, then say that if you eat a lot of our guests, you can queue up, and the situation is not important. In fact, he really simply said that I was embarrassed at first I believe that I believe that eight Chengdu in Taiwanese can accept it.
This shop may be distinctive, and the meal may be delicious, but the comment is too low. I don’t know who the boss is. I only know that I will use a few more employees sooner or later. Dare to teach, the first comments in your life were dedicated to the 94 -murmical hat brother.",False,0.044,0.054,0.902,-0.2431
"想請幫忙介紹酒
也有看到店員在忙
有在等待一下請店員來
態度是要介紹不介紹的 給人的感覺很差
態度不好氣氛也跟著不好

請問 謝謝 好的
這些我們都有做到也沒有擺臭臉給店員
我們喝完直接換下一間
完全不推薦這間","Want to help introduce wine
I also saw that the clerk was busy
I am waiting for the clerk to come
The attitude is to introduce the feeling that it does not introduce.
The atmosphere is not good and the atmosphere is not good

Excuse me, thank you good
We have all did not have a stinky face for the clerk
We will change the next one after drinking
Don't recommend this at all",False,0.153,0.096,0.752,0.5948
"♠環境與Style：中山商圈難得一早就有營業的咖啡店，適合一早的約會，店裡走有點拼裝的美式復古風格，有些沙發椅不知從哪裡撿來的，也太沒有彈性了。店內有很多有的沒的小玩具，座位不多。
♠食物：漢堡、熱狗堡都不錯，份量不小。
♠服務：這家店最被詬病的，應該是服務吧！去的那次店員態度還ＯＫ，但我們明明有訂位也準時到，結果超過了我們預定的時間還是沒有位子，等了好長一段時間終於有位子，結果吃完沒多久用餐時間就到了，只好再轉移陣地，結論就是有訂位跟沒訂位好像沒什麼差。","： Environment and Style: Zhongshan Business District rarely has a business coffee shop in the morning. It is suitable for dating early in the morning. The store is a bit of American retro style. Some sofa chairs do not know where to pick up, and it is too elastic.There are many small toys in the store, and there are not many seats.
、 Food: Burger and Hot Dog Castle are all good, and the portion is not small.
被 Service: This store is the most criticized, it should be the service!The attitude of the clerk to go was OK, but we obviously had a reservation and it was on time. As a result, there was still no seat that we had to book. After waiting for a long time, there was finally a person. I had to transfer the position again, and the conclusion was that there seemed to be no difference between the order and no booking.",False,0.012,0.064,0.924,-0.8243
"老闆態度親切，但價格不低，送餐速度較慢（烹飪區看來很小），食物及飲料的份量或口味並沒有特色。
店內狹小擁擠，當天坐在沙發上，相當低矮的位子，且並不是很舒適。","The boss has a kind attitude, but the price is not low, and the meal is slower (the cooking area seems small), and the weight or taste of food and beverages is not unique.
The store was crowded in the store. Sitting on the sofa that day was quite low, and it was not very comfortable.",False,0.07,0.11,0.82,-0.5494
"說九點營業，結果十點才開始？
餐點等很久，我能解釋成只有一個店員，而且餐點其實蠻好吃的。
店員冷漠態度差，也能解釋成不想打擾客人。
但是粉專說九點開始營業，卻九點二十還大門深鎖，九點四十才來，還說店還沒開好，要我們在外面等，終於到快十點我們才能走入用餐！
不知道大家是比較晚起還是知道他開店都會遲到？其他客人都蠻晚才來的，但是位子很少，也有許多人晚來就沒位子了。
食物雖然好吃，但還有很多好吃的餐廳，想不出這間咖啡廳的特色是什麼。","Said to open at nine o'clock, but the result did not start at 10 o'clock?
The meal has been waiting for a long time. I can explain it as only one clerk, and the meal is actually very delicious.
The clerk's indifferent attitude can also be explained as not to disturb the guests.
However, Fan said that it started to open at nine o'clock, but at 9:20, the door was locked deeply, and it came only at 9.40. He also said that the store has not yet opened. We must wait outside. Intersection
I do n’t know if you are late or know that he will be late when he opens a store?Other guests came late, but there were very few seats, and many people had no seats late.
Although the food is delicious, there are many delicious restaurants. I can't figure out what the features of this cafe are.",False,0.128,0.029,0.842,0.9627
久久會想念來吃一下的店，但食物好像縮水了😂 …,"I will miss the shop that I will eat for a long time, but the food seems to shrink ...",False,0.0,0.064,0.936,-0.0772
"座位真的很不舒服 餐桌跟沙發比起來矮很多 吃個午餐吃到腰酸背痛 老闆有想過客人的用餐體驗嗎？ 還是只是撿二手家具塞進來？
餐點份量真的很少 考量到這附近的店租也沒辦法 但是cp值真的很低","The seat is really uncomfortable that the dining table is shorter than the sofa, and a lot of lunch eats backache and back pain Boss. Have you ever thought about the guest's dining experience?Still just picking up second -hand furniture?
There is really no way to take the meal amount. There is no way to rent the restaurant nearby, but the CP value is really low",False,0.069,0.145,0.786,-0.5708
好吃 好美 推花雕雞飯,"It's delicious and beautiful, push flowers carving chicken rice",False,0.521,0.0,0.479,0.8225
酒客每晚對外大吼大叫當作方圓百里自己家沒住人，最屌的是業主不會管，店外的事都不甘他們事了真的好棒的店，專賣對外吼唱到天明特調雞尾酒,"The wine guest yelled every night as Fang Yuan Baili, who had no one to live in his own home. The most obedient is that the owner would not care. The things outside the store were unwilling to be a really good shop. Special cocktail",False,0.118,0.093,0.789,0.3245
"一進店裡我問有營業嗎？
女店員蹲在吧檯裡說有啊
在忙的話，好歹妳也跟我說等一下吧
讓我們空等然後口氣很差是在哈囉？？？

我當然知道有營業啊
我會問就是要讓妳知道有客人啊==

我們點一杯，我快喝完了就直接說要結帳
小姐妳在趕啥？
然後調酒時還沒戴口罩？？？？？？","As soon as I entered the store, I asked if there was business?
The female clerk squatted on the bar and said yes
If you're busy, let me tell me too much about it
Let's wait for us to wait for a bad tone and a bad breath?IntersectionIntersection

Of course I know that there is business
I will ask you to let you know that there are guests ==

Let's click a glass, I will say it will check the checkout after drinking it.
Miss, what are you catching?
Then I didn't wear a mask when I bloom?IntersectionIntersectionIntersectionIntersectionIntersection",False,0.025,0.09,0.885,-0.782
今天點的是「女朋友的早餐」很喜歡這盤的內容組合，配鮮奶茶不用加價覺得很棒!店裡位子不多，今天去只有老闆娘一個人在做，所以人多的話要稍微等一下。,"Today I ordered ""Girlfriend's Breakfast"" very much like this content combination. With fresh milk tea, it is great to increase the price! There are not many seats in the store. Today, only the boss is doing it alone, so if there are many people, you have to wait a little. one time.",False,0.194,0.033,0.773,0.868
很難在台北找到200一下的早午餐了，食物清爽好吃～,"It's hard to find a 200 -time brunch in Taipei, the food is refreshing and delicious ~",False,0.184,0.07,0.746,0.5106
價格稍貴，cp值低。,"The price is slightly more expensive, and the CP value is low.",False,0.166,0.145,0.69,0.0772
