Original,EN,Needs Review,Positive,Negative,Neutral,Compound
"2023.01.04 （補評價）晚上
邁泰＄350 長島冰茶＄380

座位不多 跟一些朋友來小酌滿適合的，
店內的燈光和音樂都很有氛圍感。

酒類和加點的肉串點心品質都很不錯，
價格就跟一般酒吧差不多 很好吃～
不過酒吧是開放抽菸的，
當時客人和老闆都在吞雲吐霧，
因為自己跟朋友本身不抽菸所以就沒有久待，
會介意煙味的可能要選擇室外的位置！

整體來說酒類和食物表現都很好，
老闆也很親民，
可以來這邊嘗試看看～","2023.01.04 (Make -up Evaluation) In the evening
Mai Tai 5 350 Long Island Ice Tea ＄ 380

The seat is not much to drink with some friends.
The lights and music in the store are at an atmosphere.

The quality of alcohol and adding meat skewers is very good,
The price is almost delicious than the average bar ~
But the bar is open to smoke,
At that time, the guests and the boss were swallowing the clouds and vomiting.
Because I do n’t smoke my friends, I do n’t treat it for a long time.
If you mind the smell of smoke, you may choose the outdoor location!

On the whole
The boss is also very close to the people,
You can come here to try it ~",False,0.104,0.0,0.896,0.9238
"明明就可以點隔壁居酒屋的熱食
不曉得哪裡冒出來的老阿姨硬是不給點
後面進來的客人也都有點小菜來配酒
結果我們只能純喝酒
沒有一套標準的店家","Obviously you can order the hot food of izakaya next door
I don’t know where the old aunt who came out of it wouldn't give it
The guests who came in later also had some side dishes to match the wine
As a result, we can only drink purely
There is no standard store",False,0.0,0.044,0.956,-0.3535
第一次來霓光時，約凌晨1:30，附近的酒吧都已關門，也是我第一次到酒吧就來到霓光，算是奇妙的緣分。之前我沒到過酒吧，不會點酒，請調酒師幫我調20%的酒，喝起來非常爽口，服務人員又親切。,"When I came to Neuton for the first time, about 1:30 in the morning, the nearby bars were closed. It was also the first time I came to the bar when I came to the bar. It was a wonderful fate.I haven't been to the bar before, I won't order wine. Please bartender to help me adjust 20%of the wine. It is very refreshing and the service staff is kind.",False,0.126,0.025,0.849,0.8333
酒水價格不高，算是對應品質吧，普普通通。,"The price of drinks is not high, it is a corresponding quality, ordinary.",False,0.0,0.0,1.0,0.0
"（📍喝酒不開車／不酒駕）
和姐妹們聚餐完畢～來酒吧微醺一下～氣氛佳、服務讚、調酒師超會調酒～好好喝呀～厲害👍！也有生啤酒乾杯一番！想吃串燒＆小菜～隔壁可以點來品嚐、一邊聊天+暢快喝酒到凌晨～🍻🥂","(📍 Drink without driving / not drunk driving)
After dinner with the sisters ~ come to the bar slightly ~ The atmosphere is good, the service praise, the bartender will be alcohol ~ it tastes good ~ great!There are also raw beer toasts!Want to eat skewers & side dishes ~ You can order next door to taste, chat and drink, drink until the early morning ~ 🍻🥂",False,0.148,0.0,0.852,0.9005
酒水食物的價格偏高，份量不多，網頁上菜單沒更新，女店員眼神厭世。吃一次足矣🙃 …,"The price of drinks and foods is high, the portion is not large, the menu on the webpage is not updated, and the female clerk's eyes are annoyed.Eating once is enough ...",False,0.0,0.0,1.0,0.0
"一年多前就說要來的口袋名單
不負眾望很喜歡還會再來
🖼室外賞海景室內復古文青混風
2訪還會想再去3訪4訪5訪⋯
大概是所有景觀餐廳裡最厲害
除了造景吸晴竟然每道餐都好吃
—————————————————————
位於淡水淺水灣的海景餐廳，一開始純粹為了景而收納成口袋名單，第一次去時門口設計跟海景有點衝突設計，門口為復古懷舊文青風，店員態度一副就是人多的厭世感但不致於到態度差，自己找喜歡的位置坐，一進去位置不少耶！且不同衝突的設計搭配蠻有藝術味道，海景餐廳不免俗一定要選擇看得到海的室外位置，點了餐抱著就是海景餐廳的餐貴應該又難吃，上餐後視覺效果完美👍吃起來哇靠完全顛覆我對景觀餐廳餐點的觀感，每道餐點都超好食！讓我很少會二訪的人都決定絕對要再來！
第二訪是帶家人親戚去，心想我媽跟阿姨很挑嘴，這家年輕人店應該是安全牌，帶著他們去用餐，八個人一次點了很多餐，上餐整個壯觀，家人親戚品嚐後，他們的評價說不錯耶！連長輩都能接受的餐點！這景觀餐廳目前是我最推的
風景美好拍又好食","I said more than a year ago that the pocket list I was coming
If you live up to everyone, you like it and you will come again
室 Outdoor reward sea view room indoors retro Wenqing mixed wind
2 Visits will also want to go to 3 visit and 4 visit and 5 visit.
Probably the most powerful in all landscape restaurants
Except for the landscaping and sucking sunny, every meal is delicious
——————————————————————————————————
The sea -view restaurant located in Freshwater shallow water bay was originally stored in a pocket list purely for the landscape. When I first went to the door, the design was a little conflict with the sea view. But not in the poor attitude, find your favorite position, and you will have a lot of position as soon as you go in!And different conflict design is quite artistic. The sea view restaurant must not help but choose to see the outdoor location of the sea. If you order meals, you should eat the meals of the sea view restaurant. Wow, I completely subverts my perception of the meals of the landscape restaurant, each meal is super good!Make me rarely visit the second visit to decide to come again!
The second visit was to take my family and relatives. I thought my mother and auntie were very picky. This young people should be a safe card. They took them to dine. Eight people ordered a lot of meals at a time. The whole meal was spectacular. Later, their evaluation was good!Even the meals that even elders can accept!This landscape restaurant is currently my most pushing
Beautiful scenery and good food",False,0.142,0.024,0.834,0.9897
Orion 冰鎮的很好喝，紅酒溫度再低一點就更好了，氣氛好，人來來往往很多。推介,"Orion is very delicious, and the temperature of red wine is even lower. It is better. The atmosphere is good. There are many people come and go.Promotion",False,0.28,0.063,0.657,0.8221
"可以點隔壁的燒烤來吃，搭配生啤很讚。但店面比較小，推薦兩三個朋友聚會就好，人數再多就有點不方便了。
看起來很酷的店員其實很友善，好好詢問都可以得到幫助😊 …","You can order the barbecue next door to eat, and it is great with raw beer.However, the store is relatively small. It is a bit inconvenient to recommend two or three friends to meet.
The cool clerk is actually very friendly. If you ask well, you can get help ...",False,0.314,0.037,0.649,0.9509
超推薦全天早午餐！好看好吃份量也多！副餐還有鮮奶茶可以選，雖然冰糖都是固定的，但不會太甜而且是去冰的！半開放的店面位置不多但是非常舒適放鬆！,"Super recommended all day brunch!There are many good foods!There are fresh milk tea to choose from. Although the rock sugar is fixed, it will not be too sweet and it is iced!The semi -open store is not much but very comfortable and relaxed!",False,0.325,0.031,0.644,0.9474
"應該算是第三四次來到，每次來到中山區如果晚飯後想找一個地方坐一下喝一小杯，這裡我會超推薦人家來，他營造的氛圍，讓人發呆或是想聊聊天，如果沒下雨，面向外面的桌位或許是最好的位置，因為可以看著外面的街景流動，霓光跟旁邊的打鐵町是同個老闆，在這喝酒還可以叫上隔壁的下酒菜，(但可能有供應時間，請詢問店家)，畢竟這間是喝酒的，就像老闆個性貼上屁孩勿進，我覺得很好啊，每個店就應該有自己的個性去吸引同質的人，畢竟了解的溝通起來不會那麼累，大家別浪費時間，這裡的環境真的會讓人一直想拍照，總覺得能拍出什麼有趣的畫面，或是別桌喝下幾杯後會說出一些什麼故事.
白天這裡也會有開門，賣的是咖啡，白天晚上兩種風格，白天會感覺是個文青的小店，晚上就像電影裡會發生點什麼故事的小酒吧，如同店名的霓光一樣，霓虹燈光下，酒和咖啡都能喝出不同的情懷．
離開台灣前應該還會來這喝上一小杯發個呆吧。","It should be regarded as the third or fourth time. Every time I come to Zhongshan District, if I want to find a place to drink a small cup after dinner, I will recommend others here. If it doesn't rain, the tables outside may be the best position, because you can watch the flow of the street outside. Neuton is the same boss as the Daguyachi next to it. (But there may be supply time, please ask the store), after all, this is drinking, just like the boss's personality sticks to the fart, do not enter, I think it is good, each store should have your own personality to attract homogeneousness People, after all, you will not be so tired to communicate. Do n’t waste time. The environment here really makes people want to take pictures. I always feel that I can take any interesting pictures, or do n’t table after drinking a few cups. What stories.
There will be open doors here during the day, selling coffee, two styles during the day and night. It will feel like a small shop during the day. At night, it is like a small bar in the movie. Under the light, wine and coffee can drink different feelings.
You should come here to drink a small cup before leaving Taiwan.",False,0.126,0.036,0.838,0.9577
"我想我點到了雷中雷-太陽蛋吐司
乾硬切不動也咬不動
詢問店員，還說是我太慢吃冷掉了
1.其實一點也不冷還溫溫的
2.怎麼樣叫慢，拍個照片？聊個天？就不能吃了嗎？又不是外帶
3.店員的處理方式是再回去加熱，真的一點幫助也沒有
要不要自己吃吃看有多難吃
要不要在菜單加註上餐請一分鐘內食用完畢
看分數很高，但店員態度0分","I think I ordered Leizhong Lei-Sun Egg Toast
Dry hard and hard, can't bite
Ask the clerk, I also said that I was too slow to eat and cold
1. In fact, it is not cold and warm
2. How is it slow, take a picture?Talk about it?Can't you eat it?Not taking out
3. The clerk's processing method is to go back to heat again.
Do you want to eat it yourself?
Do you want to eat in the menu and get a minute?
The score is very high, but the staff attitude 0 points",False,0.024,0.048,0.928,-0.3384
"文青小店，外面還有賣衣服
味道尚可
但不知道是不是沒有抽油煙機
感覺空氣有點黏呼呼的","Wenqing shop, there is also clothes outside
The taste is good
But I don't know if there is no range hood
I feel that the air is a bit sticky",False,0.06,0.085,0.855,-0.2144
氣氛很悠閒，食物好吃。奶茶好喝。老闆跟老闆娘不會趕客人，位子是不多，所以如果你有充足的時間，挑個晴朗的早晨，來份早午餐，是個不錯的享受。,"The atmosphere is very leisurely and the food is delicious.Milk tea is delicious.The boss and the boss will not catch the guests. There are not many seats, so if you have enough time, pick a clear morning, and come to brunch, it is a good enjoyment.",False,0.175,0.0,0.825,0.8442
"1.週末要收服務費，但是點餐也要去櫃檯點，水也是放在桌上自己加，我覺得服務費不太合理。
2.整體環境很漂亮，但是沙發真的太低了。使用正餐都要把托盤放在腿上吃
3.入店後不能換位子，假如你進去是室內的話，你等再久也無法到室外
4.炸物拼盤380元，裡面只有四塊雞柳，薯條跟洋蔥圈和地瓜球。覺得比KTV的CP質還低
總結：建議只去拍照就可以了，或是點飲料。正餐就不用了","1. The service fee is to be charged on the weekend, but you have to order to order at the counter.
2. The overall environment is very beautiful, but the sofa is really too low.Put the tray on your legs for dining
3. You can’t change your place after entering the store. If you go in indoors, you can't get out of the outdoor for a long time.
4. Fried objects are 380 yuan, only four chicken willows, fries and onion rings and sweet potato balls.I feel lower than the CP of KTV
Summary: It is recommended to only take a picture, or order a drink.I don't need to eat for a meal",False,0.097,0.034,0.87,0.8686
"路過 就坐在外面的沙發喝一杯Negroni
(Recipe 利苦酒+琴酒+甜艾酒)
濃度約20%

喝起來有點淡，酒感不夠濃郁，
應該要到30%才對

苦味明顯，聞起來有橘香，澀後會回甘

氣氛⭐️⭐️⭐️⭐️⭐️
酒⭐️⭐️⭐️
食物（隔壁的）⭐️⭐️⭐️","Sitting on the sofa outside and drinking a cup of Negroni
(RECIPE Lili Wine+Qinjiu+Sweet Aiwan)
Concentration is about 20%

It is a bit light to drink, the wine feels not strong enough,
It should be 30%until it is right

The bitter taste is obvious, there is orange flavor to smell, and it will return to sweet after astringency

Atmosphere ⭐️⭐️⭐️⭐️⭐️⭐️
Wine ⭐️⭐️⭐️
Food (next door) ⭐️⭐️⭐️",False,0.037,0.068,0.894,-0.3616
"不得不說，這間是整個中山站咖啡店的一股清流，沒有假掰網美、只有親切闆美，早午餐營養完整又好吃，而且還附一杯飲料。喜歡的不只是食物和啤酒，還有這裡溫暖的感覺，就像friends裡面的central park cafe一樣，你會不斷的想和老朋友來，和帶新朋友來。

下午來也可以邊吃邊喝，晚上搖身一變成了爵士酒吧，bartender 是爵士樂手，可以依照你的心情給你一杯都會調酒，層次豐富且酒精充足，滿滿的誠意。

It's definitely my favorite cafe/bar in Taipei!!","I have to say that this is a clear stream of the entire Zhongshan Station coffee shop. There is no fake net beauty, only the kind of friendly board beauty, the nutrition and delicious breakfast of the brunch, and a drink with a drink.I like not only food and beer, but also a warm feeling here, just like the Central Park Cafe in Friends, you will constantly want to come with old friends and bring new friends.

In the afternoon, you can also eat and drink. At night, it becomes a jazz bar. Bartender is a jazz. You can bartender for you according to your mood.

It's definitely my favorant cafe/bar in Taipei !!",False,0.287,0.0,0.713,0.988
"下午時候是咖啡廳 到了晚上變身成酒吧
走進店內 裝潢很有氛圍呢！！！
就算坐在戶外沙發區也很愜意
真的很適合坐在這裡喝喝調酒呀 🍻 …","In the afternoon, the cafe is turned into a bar at night
Entering the interior of the store is very atmospheric!IntersectionIntersection
Even if you sit in the outdoor sofa area are very comfortable
It's really suitable for sitting here to drink and drink alcohol 🍻 ...",False,0.076,0.0,0.924,0.5974
"這家店是走鄉村民宅style，店面非常小，食物都是現做，是個不錯特別的店，味道也不賴。

照片上麥兜漢堡、花生香蕉帕尼尼","This shop is a rural house style. The store is very small. The food is all done. It is a good special store and the taste is not bad.

In the photo, Mcgo Burger, Peanut Banana Panini",False,0.199,0.0,0.801,0.8151
"戶外座位非常chill, 酒也好喝
價位適中","Outdoor seats are very chill, and wine is also delicious
Moderate price",False,0.252,0.0,0.748,0.5719
"晚上值得Fun一下好去處
老闆雖然不太主動互動，但酒調的很好喝，又不貴，CP值高！
雖然空間晚上會與隔壁居酒屋分享，但還是保有這間店自己的格調。
會抽煙的人或想享受外面氛圍的人，可選擇坐在外面的沙發上。品酒吐霧作樂之間，看者外面行人來回穿梭，很是放鬆😌
晚上不提供餐點（只有酒🤣，有調酒及啤酒，或是你想請老闆幫忙調的酒），所以要點東西吃，可以跟隔壁居酒屋點餐，我們點了毛豆來配酒😂🤔
白天的時段沒去過，改天可以再試試，但晚上我一定還會再來","It's worth a good place at night
Although the boss does not take the initiative to interact, the wine is delicious, not expensive, and the CP value is high!
Although the space will be shared with the izakaya next door at night, it still keeps this store's own style.
People who can smoke or those who want to enjoy the atmosphere outside can choose to sit on the sofa outside.Between the wine and spitting the fog, the pedestrians outside the viewer will shuttle back and forth, very relaxed 😌
Do not provide meals at night (only wine, bartending and beer, or you want to ask the boss to help the wine), so if you order something, you can order to eat with the next door.
I haven't been there during the daytime, I can try it again, but I will definitely come again at night",False,0.149,0.0,0.851,0.9471
"餐點好吃座位舒適，重點是鮮奶茶很好喝！
本身不喝有加糖的飲料，可是鮮奶茶已經做好了沒辦法調整，老闆說不會很甜，我心裡OS每個老闆都馬這樣說...結果真的沒有很甜然後茶味也有超讚👍🏻👍🏻👍🏻 …","The meal is delicious, and the focus is that fresh milk tea is delicious!
I do n’t drink sugar drinks, but fresh milk tea has been done, and there is no way to adjust. The boss said that it will not be very sweet. Every boss in my heart is said ... the result is really not very sweet and then the tea flavor is super superior. Praise ...",False,0.308,0.104,0.588,0.9687
"公雞經典早餐-搭配熱鮮奶茶
藍莓貝果上面有起士，
冷了以後口感有點軟不Q.
培根跟火腿煎過，正常。
炒蛋一般、沙拉正常、水果跟地瓜泥不好吃。
插座要$30
生意絡繹不絕
服務一般
座位不多，環境普通的工業風，有點破舊不喜歡。
只有早午餐的貝果、法式吐司，還有漢堡套餐跟飲料。","Classic Breakfast of Rooster
There is a cheese on the blueberry Beiguo,
After cold, the taste is a bit soft and not Q.
Bacon and ham fry, normal.
The scrambled eggs are normal, the salad is normal, the fruit and the sweet potato mud are not delicious.
The socket is $ 30
Endless business
Average service
There are not many seats, and the environmental style of ordinary environment is a bit dilapidated.
Only lunch, bellies, French toast, and a burger set and drink.",False,0.034,0.034,0.931,0.0005
烹調的時候會有油煙，坐在靠門邊的沙發位子也會有煙味飄進來，除此之外因為在心中山旁邊晚上是蠻舒服愜意的，也喜歡沙發的位子，沙拉份量少了點。但是老闆娘親切好聊天，只是我真的對味道蠻敏感～,"When cooking, there will be oil fume. The sofa seat sitting by the door will also have a smell of smoke. In addition, it is quite comfortable and comfortable at night next to the heart of the heart. I also like the seat of the sofa.But the boss chats kindly, but I really really sensitive to the taste ~",False,0.203,0.024,0.773,0.8758
"調酒很好喝
喜歡店內氛圍
老闆人蠻好的 這間怎麼會只有3.8顆星
不應該！","Blooming is delicious
Like the atmosphere in the store
How can the boss have only 3.8 stars?
Should not!",False,0.276,0.0,0.724,0.7574
有特色，簡單簡樸又文青，咖啡好喝簡餐好吃。座落位置光線好，白天去頗享受。,"It has characteristics, simple, simple and green, coffee is delicious and delicious.Light in the seat is good, so I enjoy it during the day.",False,0.324,0.0,0.676,0.8773
"2021.09.15
晚餐後散步至中山街區，平日的夜晚難得沒有客滿，進來享受一下霓光的夜晚。","2021.09.15
After dinner, take a walk to Zhongshan District. It is rare to be full on weekdays.",False,0.0,0.0,1.0,0.0
"煙燻鮭魚很夠味
白巧克力抹茶味道甜而不膩
班尼迪克蛋配麵包很讚","Smoked salmon is enough
White chocolate matcha tastes sweet but not greasy
Bennetik egg bread is great",False,0.338,0.0,0.662,0.8248
"地點方便，離雙聯捷運站很近，但店面偏小，建議事先訂位
店員態度親切，餐點中規中矩，附餐飲料有點太小杯
菜單有點破舊，翻閱時感覺不太好
裝潢走的是復古風，門口還有販賣古著","The location is convenient, and it is very close to the Dual Union MRT station, but the storefront is small. It is recommended to order in advance
The clerk's attitude is kind, the meal is quite satisfactory, and the dining drink is a bit too small
The menu is a bit dilapidated, it feels not very good when I read it
The decoration is a retro style, and there is still an ancient trafficking at the door",False,0.121,0.04,0.84,0.7938
今天經過這間很有日式風格的小店，但沒有營業，因為要陪女兒過生日，覺得爸媽很用心，對客人應該也會很用心,"Today, after this very Japanese -style shop, but not business, because I have to accompany my daughter's birthday, I feel that my parents are very attentive, and they should be very careful about the guests.",False,0.064,0.0,0.936,0.3269
老板妹很可愛，也很健談，食物也好吃(都是親做，不是料理包)，環境也很舒服，晚上變身成Bar，是個很容易讓人放鬆自我，紓解一天壓力的地方~,"The boss girl is very cute and talkative, and the food is delicious (all of them do, not a cooking package), and the environment is very comfortable. It is a place that can easily relax and relieve the pressure of the day ~",False,0.325,0.039,0.636,0.945
店內播我喜歡的歌就加分，喜歡戶外座位，雖然不抽菸，但是店的氛圍很棒，門口面對的是捷運站旁的巷子，所以風景很不錯。如果再來點涼風，那就更愜意了！調酒價格合理，讚！,"The song I like in the store will add points. I like outdoor seats. Although I do n’t smoke, the atmosphere of the store is great. The door is faced with the alleys next to the MRT station, so the scenery is very good.If you come again, it will be more comfortable!The price of bartender is reasonable, praise!",False,0.197,0.0,0.803,0.9229
"這間酒吧有與隔壁的打鐵鋪合作
所以餐點也可以在座位點
酒跟食物以中山區的價位來講都不貴
烏龍麵很讚一定要點！
酒吧店員十分熱情，多跟店員聊聊或許會有意想不到的收穫😎","This bar has cooperation with the iron shop next door
So the meal can also be at the seat
The price of wine and food is not expensive at the price of Zhongshan District
Oolong noodles are very good!
The shop clerk is very enthusiastic, and it may be unexpected harvest to talk to the clerk.",False,0.114,0.0,0.886,0.7893
早午餐不錯吃小精緻（但飲料有點小杯），整體氣氛舒適，店面很小大概10個位子，建議先訂位,"It is good to eat small and delicate breakfast (but the drink is a little cup), the overall atmosphere is comfortable, the store is very small about 10 digits, it is recommended to book a place first",False,0.227,0.0,0.773,0.8271
屋內空間不大，服務和餐點味道中等，唯一想抱怨的是用餐時一直有蚊子在身邊繞，覺得可惜，要不然是還蠻喜歡整間店的文青氣息。,"The room in the house is not large, and the service and meals are medium. The only thing I want to complain about is that there have been mosquitoes around me during meals. I feel unfortunately, otherwise I still like Wenqing's atmosphere in the whole store.",False,0.075,0.097,0.828,-0.2732
餐點還不錯吃，但依價位來比較，可以再用心烹調一點點會更好，整體來說，三顆星以上，但不到四顆星。,"The meals are still good to eat, but according to the price point to compare, can be cooked with heart again a little bit will be better, overall three stars, but not four stars.",False,0.272,0.0,0.728,0.9118
"複合式小店 很有文青氣息
餐點就是間單的早午餐三明治
美式很好喝👍🏻 …","Composite shop is very green
Meal is the Summer Sandwich Sandworm
American style is delicious ...",False,0.198,0.0,0.802,0.5719
早晨或是午後很適合放鬆的好地方，餐點跟咖啡都非常的好！舒服～,It is very suitable for relaxation in the morning or afternoon. The meals and coffee are very good!Comfortable ~,False,0.18,0.0,0.82,0.6067
空間不大，但餐點還不錯，CP值高，也很早開始營業。,"The space is not large, but the meal is not bad, the CP value is high, and it has started to open early.",False,0.247,0.0,0.753,0.783
"早午餐份量很大,味道不錯!只是店鋪比較小,不能做太,久","Lunch is very large, and the taste is good! It's just that the shop is relatively small.",False,0.166,0.0,0.834,0.4926
"有趣、舒服的小店
主要提供罐頭類的食物
其他食物可以和隔壁打鐵町叫。","Interesting, comfortable small shop
Mainly providing canned food
Other foods can be called Tittachi next door.",False,0.3,0.0,0.7,0.7184
喜歡店裡面的裝潢、很有懷舊的感覺，而且有的時候還蠻嗨的！,"I like the decoration in the store, I feel nostalgic, and sometimes it is pretty hilarious!",False,0.401,0.0,0.599,0.8268
