Original,EN,Needs Review,Positive,Negative,Neutral,Compound
謝謝老闆的生命之水32cc，讓我有點清醒。,"Thank you for the 32cc of the water of the boss, making me a little sober.",False,0.143,0.0,0.857,0.3612
酒都蠻好喝的 老闆人也很好聊 牛逼帥帥帥,The bosses who are pretty delicious and delicious are also very good to chat with handsome and handsome,False,0.627,0.0,0.373,0.9647
"螺絲起子：很順也很有柳橙香和其他家不一樣，有酒感
荔枝特調：濃烈的香味
提拉米蘇：像極了愛情，有奶香，同時又夾雜了巧克力苦
教父：杏仁味威士忌
草莓特調(冬季限定)：說不出來的味道，只有種身處外國的fu~~
Old Fashion：經典好味道","Screw from the screw: Very smooth and very orange fragrance is different from other homes.
Litchi special tone: a strong fragrance
Tiramisu: It looks like love, has milk fragrance, and is mixed with chocolate bitterness
Godfather: almond flavor whiskey
Strawberry special (limited winter): The taste that can't be said, only a FU in a foreign country ~~
OLD FASHION: Classic good taste",False,0.223,0.156,0.621,0.7556
"CP值很高的酒吧
從MENU就看得出老闆的貼心跟用心
寫下各種調酒的酒譜，讓首次前來的人有個基礎印象，對各種調酒的味道先有個概念
認真閱讀完菜單後
進而詢問老闆來找到自己想要嘗試的風味
三個女生第一次來，連基酒都不曉得是什麼味道
老闆大方的將酒讓我試聞，還耐心簡單的向我們解釋道（雖然我們也聽得一知半解，隔行如隔山）
價格透明，在台北市有這個價格真的大佛了boss

同行的妹子跟老闆要了杯酒味不這麼濃的調酒
老闆說：酒喝沒有酒味的，真的不知道再喝什麼
隨即用他強壯的手臂Shake起來，帥
不懂酒，無法對風味上提供太多資訊
（等我多來幾次在更新吧）
但知道酒不馬虎，一杯有醉，微醺最棒

同行姐姐點了Mojito
老闆表示：又要去殺薄荷了（為表示真的新鮮現殺，有圖為證）
老闆真的很風趣
粉紅色那杯尬花瓣的是玫瑰，也是老闆推薦基礎者可以嘗試看看的漂亮小粉紅

餐點我們點了炸物拼盤（薯條，鱈魚條，雞柳條）
老闆還跟我們說：鱈魚條只有四條耶（老闆看我們三個人去而已🤣）
欸~這個拼盤的份量，很多欸！
大家一起分食當下酒菜很適合呢
要吃點東西才不會醉太快哦

聊天到一半，朋友表示想一起拍拍立得
現場燈光真是意外的搭配
待老闆稍微不忙碌時，很迅速的拜託老闆幫我們拍了張合照，真的人很好🥺
現場的夥伴姐妹也很熱心用手機幫我們拍了好幾張
後來人越來越多，連外面吸煙區都坐滿了人

在吧台也有看見獨自前來的客人
就這麼坐著看老闆調酒，看人來人往
並不會看起來尷尬或是不自在
戶外吸煙區，天氣開始轉涼
坐在外面看著車來車往，享受夜晚的台北
都讓人感覺別有一番風味
都是讓人想再來體驗的

現場黑板是有寫，留五星好評可以送shot
我沒有當下就寫
我想寫評論，認真的寫，不馬虎的寫
我不是為了shot，是為了老闆","Bar with a high CP value
From menu, you can see the boss's intimateness and intentions
Write a variety of alcoholic alcohol, so that the first person who came to have a basic impression. There is a concept of the taste of various bartender.
After reading the menu carefully
Then ask the boss to find the flavor you want to try
For the first time in the three girls, I don’t even know what the base wine is.
The boss generously asked me to try the wine, and patiently explained to us patiently (although we can also hear a half -knowledge, the interval is like a mountain)
The price is transparent, and there is this price in Taipei.

The colleagues and the boss asked for a glass of alcohol that was not so strong.
The boss said: I do n’t know what to drink without drinking wine, I really do n’t know what to drink
Then use his strong arm shake, handsome
Don't understand wine, you can't provide too much information on the flavor
(Wait for me to update a few more times)
But knowing that wine is not sloppy, a cup is drunk, and the best is the best

Sister Sister ordered Mojito
The boss said: It is going to kill mint again (to indicate the freshness of freshness, there are pictures as evidence)
The boss is really funny
The pink cup of embarrassing petals is a rose, and it is also a beautiful little pink that the boss recommends the foundation.

Over the meal, we ordered the fried frying platter (fries, cod bars, chicken willow strips)
The boss also told us: There are only four cod strips (the boss sees the three of us go)
~ Many of the platter portion, many 欸!
It's very suitable for everyone to eat the current wine and vegetables together
You have to eat something so you won't get drunk too fast

Chat until half, my friend said that he wanted to make a picture together
Live lighting is really an unexpected match
When the boss is not busy, I quickly asked the boss to take a photo of Zhang, really a good person.
The partners and sisters at the scene were also very enthusiastic about using the mobile phone to help us take several photos
Later, there were more and more people, and even the outside smoking area was full of people

I also saw guests who came alone on the bar
Just sit like this to watch the boss bartender and see people come and go
It doesn't look embarrassed or uncomfortable
Outdoor smoking area, the weather starts to cool down
Sit outside and watch the car come and go, enjoy the Taipei at night
Everyone makes people feel unique
All make people want to experience it again

The blackboard on the spot is written.
I write without the moment
I want to write comments, write seriously, do not write badly
I'm not for shot, but for the boss",False,0.133,0.043,0.824,0.9935
"原本舊店是賣精釀啤酒，但不知什麼原因它關門了，老闆在因緣巧合之下決定把他頂下來，我問老闆：「你怎麼會想開這間酒吧？」他回答道：「我只是想找件事做，剛好這裡關了，那我就來把他重開。」雖然是這樣講，但這邊完全不走精釀啤酒，而只提供一般經典調酒、紅白酒和一些美式食物，主打小資族和想要和朋友輕鬆喝的朋友，來這邊和老闆聊天做朋友，我這天點了一個牛肉漢堡搭套餐，配上經典調酒，總共只花費了420元。在台北這種大都市中，大家都走質感路線，很多酒吧不管裝潢、酒款或是穿搭都走向很不一樣的世界，相對起來，這種家庭酒吧就完全不一樣，給人溫馨、人情味濃厚的感覺。就像黑白切與熱炒店，甚至是老先生老太太的存在，他們雖然看起來不起眼，但是背後卻藏有很多的故事與溫暖，等待著有緣人來陪伴。

歡迎追蹤IG: @alcoholneal 來認識更多酒吧

Originally the old shop was selling craft beer, but for some reason, it was closed. I asked the owner: ""Why do you want to open this bar?"" He replied: ""I just want to find something to do.” Although it sounds like it's just a common thing, here became a new place. Only provide classic cocktails, wines, and some American food. the main customers are petty bourgeoisie and friends who want to drink with friends easily. I ordered a beef burger set on this day, accompanied by a cocktail, it only cost NT$420. In a metropolis such as Taipei, everyone takes a texture route. Many bars go to a very different world regardless of decoration, wine, or dress. Compared to this, the family bar is completely different, giving people a warm and human touch. Like old gentlemen and old ladies, although they seem inconspicuous, they have a lot of stories and warmth behind them, waiting for someone to accompany them","Originally the old shop was selling craft beer, but for some reason, it was closed. The boss decided to push him down because of coincidence. I asked the boss: ""Why do you want to open this wine?"" He replied: ""I am I just want to find something, just turn it here, then I will come back to the back. Food, the main specialty and friends who want to drink easily with friends, come here to chat with the boss to be friends. I ordered a beef burger set this day, coupled with classic bartending, only spent 420 yuan in total.In the large and cities such as Taipei, everyone has a sense of quality. Many bars are going to a very different world regardless of decoration, wine or wear. A strong feeling.Just like black and white cutting and hot stir -fry shops, and even the existence of old ladies and old ladies, although they look inconspicuous, there are many stories and warmth hidden behind them behind them, waiting for people to accompany them.

Welcome to track: @alcoholneal to get to know more bars

Originally the Old Shop Was Selling Craft Beer, But for Some Reason, it was closed. I asked the Owner: ""WHY Do You WANT TONT THIS BAR? d some to do. ""Although it Sounds like it's just a common thing, here beCame a New Place. Only provided classic Cocktails, and some American Food. Sie and Friends Who Want to Drink with Friends Easily. I Ordered A Beef Burger Set on this Day, accoming by a cocktail, it only cost nt $ 420. In a metropolis such as taipei, Everyone takes a texture route. s of decoration, wine, or dress. Compared to this, the family bar Is Completely Diffeffeier, Giving people a warm and human touch. Like Old Gentlemen and Old Ladies, Although they seem inconspicuous, then a lot of stors and war MTH BeHIND THEM, Waiting for Someone to Accompany them",False,0.172,0.019,0.809,0.995
"放鬆的好地方
只營業到1點要注意時間
點了兩杯
諾曼第冰茶+極光冰茶
各種酒的混合、非常大杯、酒味夠重
一杯就微醺
值得推薦","Relaxed place
Pay attention to time only by opening to 1 o'clock
Ordered two cups
Norman Ice Tea+Aurora Ice Tea
The mixed, very large cups, and wine taste of various wines are heavy enough
Just a cup
Worth recommending",False,0.12,0.033,0.847,0.5719
很適合小酌聊天的小店，老闆親切風趣。酒類選項多，戶外的位子舒服愜意。是家很不錯的社區小酒吧～,"It is very suitable for small shops that chat, the boss is kind and fun.There are many wine options, and the outdoor seats are comfortable and comfortable.It is a very good community bar ~",False,0.242,0.0,0.758,0.8718
"調酒非常優秀，價格雖然稍高但值得。
炸物拼盤的雞柳條很多汁，蠻推薦大家點點看。

個人最喜歡的是他們家的諾曼第冰茶，是有多種酒類的一杯調酒，濃度偏高要注意。
比較特別的是他有加生命之水在裡面，比較少見的調酒類型。

另外除了一般常見的長島冰茶，該店也有長灘冰茶與東京冰茶，在酒類跟調味上有做出不同的分別。

性感海灘、龍舌蘭日出等調酒也相當出色，算是還沒遇過雷酒的一間店。

老闆跟服務人員也相當親切，真的要說就是店面稍小囉。

很推薦大家可以試試看他們家的調酒跟炸物（尤其雞柳條），不會失望的！","The bartender is very good, although the price is slightly higher, it is worth it.
There are many juice of the chicken willow strips of the fried picker. I recommend everyone to see it.

Personally, the most favorite is the Norman ice tea. It is a glass of bartending with a variety of wines. Pay attention to the high concentration.
It is more special that he has a rare type of bartending in the water that adds life.

In addition, in addition to the common Long Island ice tea, the store also has long beach ice tea and Tokyo ice tea. There is a different difference between alcohol and seasoning.

Sexy beaches, lined sunrise and other bartender are also quite good.

The boss and the service staff are also quite kind. I really want to say that the store is slightly smaller.

It is recommended that you can try their sake and fried objects (especially chicken wicker), which will not be disappointed!",False,0.167,0.008,0.825,0.9799
"老闆很nice,調酒好喝，放的音樂都是國中名曲忍不住想唱歌😂打卡送shot噢 …","The boss is very nice, the bartending is delicious, the music is the famous middle school famous songs that I can't help but want to sing.",False,0.15,0.101,0.749,0.3473
"老闆說：這裡的酒都是比較有酒感的，不過怕的話當然還是可以下輕一點啦～
不過老闆接著說：既然都要喝酒了，就是要喝有感的！
所以我還是決定挑戰原比例！！

今天第一杯，來個「東京冰茶」試試，
真的有酒感，對於女生來說是一杯好喝的調酒，沒有想像中的濃厚酒精味❤️","The boss said: The wine here is more alcohol, but of course, you can still be lighter if you are afraid ~
But the boss went on to say: Since they have to drink, they just want to drink!
So I still decide to challenge the original proportion!Intersection

In the first cup of today, try a ""Tokyo Ice Tea"" and try,
There is really a sense of wine. For girls, it is a delicious bartending, and there is no strong alcoholic flavor in imagination ❤️",False,0.12,0.037,0.843,0.7864
"一如評價所說
酒好喝比外面一般酒吧來得濃但又很順口
老闆真的很好聊 又貼心
還沒試過的真的很可以","As the evaluation said
The wine is better than the general bars outside the bars outside
The boss is really good and intimate
It's really okay if you haven't tried it yet",False,0.222,0.0,0.778,0.8067
"調酒很好喝，酒精濃度到位，喝了兩倍，+打卡送shot,有微醺的感覺
環境很舒適，炸物好吃😍！ …","The bartending is delicious, the alcohol concentration is in place, drink it twice,+punch the card to send the shot, it feels like a slightly sloppy feeling
The environment is very comfortable, and the fried objects are delicious!Mowing",False,0.255,0.0,0.745,0.8835
謝謝老闆還特地幫我們準備驚喜，酒很好喝老闆人也很nice❤️,Thank you boss for helping us prepare surprises. The wine is very delicious.,False,0.541,0.0,0.459,0.8622
"酒很好喝！
酒味不重但酒感意外地重
氛圍也不錯 喜歡","The wine is delicious!
The taste is not heavy, but the wine feels unexpectedly
The atmosphere is also good, I like it",False,0.339,0.0,0.661,0.8671
"調酒都非常厲害
無雷
11點後會關暗
很適合聊天 有氣氛","Blooming is very powerful
Thunderless
It will be dark after 11 o'clock
Very suitable for chatting and having an atmosphere",False,0.14,0.0,0.86,0.4754
"老闆會親切的跟客人聊天，卻柚不覺得受打擾
店面小小的，不會太吵雜","The boss will chat with the guests kindly, but the grapefruit doesn’t feel disturbed
The store is small, it will not be too noisy",False,0.137,0.12,0.743,-0.1338
"誠意十足的酒吧（喝一杯就有足夠的醉意，賺）
炸物表現也在水準之上
是臨時起意想小酌一番的絕佳候選💜 …","The sincere bar (drinking a drink is enough to get drunk, earn)
Fried objects are also above the level
It is an excellent candidate that I want to drink temporarily 💜 ...",False,0.281,0.057,0.662,0.8591
"真材實料的一間bar，難怪網路上說是買醉好地方😂

雖然酒味重，但很順口；
薯條很好吃，但沒有拍照；
老闆人很好，也很好聊；
是個就算一個女生也可以安心去喝酒的bar。","A real material bar, no wonder the Internet is said to buy a good place to buy a good place.

Although the wine taste is heavy, it is very smooth;
French fries are delicious, but there is no photo;
The boss is very good and talks well;
It is a BAR who can drink with peace of mind even a girl.",False,0.238,0.058,0.703,0.9265
"很好喝
價格親民
很好喝
經典調酒都有 量都很多
酒感也很足 很順口
喝完會想再訪","Delicious
Price -friendly
Delicious
There are a lot of classic bartending
The wine feels very smooth
I want to visit again after drinking",False,0.39,0.0,0.61,0.9035
"價格親民
酒好喝
老闆親和力十足很nice會跟客人聊天
氣氛很好
很適合朋友相聚小酌一波！","Price -friendly
Wine
The boss is full of affinity NICE and will chat with guests
The atmosphere is very good
It's very suitable for friends to gather together!",False,0.361,0.0,0.639,0.9271
"Tuesday Night with friends💚
酒好好喝，熱紅酒好溫暖還有肉桂整支來調味
超級讚，老闆人很好🤟🏼🤟🏼🤟🏼 …","Tuesday Night with Friends💚
The wine is delicious, the hot red wine is warm and the cinnamon is seasoned to season
Super praise, the boss is very good ...",False,0.496,0.0,0.504,0.9738
"調酒蠻大杯的，冰融化也沒有淡掉
實在的酒吧👍
可惜炸物有點微焦😦","The bartending is quite large, and the ice melting does not fade away
Real bar 吧
It's a pity that the explosive is a bit slightly burnt 物",False,0.0,0.075,0.925,-0.296
餐點好吃，飲料非常好喝，店員親切,"The meal is delicious, the drink is very delicious, and the clerk is kind",False,0.502,0.0,0.498,0.902
"調酒很好喝 老闆和bartender 人都很好
一間讓人感到很放鬆的店
會想要再訪💕💕💕💕💕 …","The bartender is very delicious, the boss and Bartnder are very good
A shop that makes people feel very relaxed
I want to visit again ...",False,0.358,0.0,0.642,0.9051
氣氛很chill，吃喝的東西都很讚👍,"The atmosphere is very chill, and the things you eat and drink are great.",False,0.24,0.0,0.76,0.6249
"好棒小巧的店❤️ 舒服～ 好喝～
還有東西可以吃～～下次還要來～
酒很有特色～～","A great shop ❤️ comfortable ~ delicious ~
There are things to eat ~~ I will come next time ~
Wine is very distinctive ~~",False,0.326,0.0,0.674,0.9022
CP值超級高、地理位置方便、氣氛超讚、可以看到小情侶好讚（？已二訪❤️,"The CP value is super high, the geographical location is convenient, the atmosphere is superb, and you can see the little couple good (? Two visits ❤️",False,0.352,0.0,0.648,0.9189
"恨不得給老闆六顆星⭐️⭐️⭐️⭐️⭐️⭐️
調酒好喝，炸物好吃😋
離捷運站很近🙌🏻
地點又好老闆友善100分
打趴東區一票調酒店","I can't wait to give the boss six stars ⭐️⭐️⭐️⭐️⭐️⭐️⭐️
Blooming is delicious, fried is delicious 调
Very close to the MRT station 站
The place is good for the boss 100 points, the boss is 100 points
One -vote adjustment hotel in East District",False,0.177,0.0,0.823,0.8834
"老闆推薦的調酒很好喝！
環境小而舒適，地點方便、服務員親切漂亮又溫柔！推推推","The bartender recommended by the boss is delicious!
The environment is small and comfortable, the location is convenient, the waiter is kind, beautiful and gentle!Push",False,0.455,0.0,0.545,0.9492
很適合跟朋友們聚會的酒吧，點到一杯骷顱頭杯子很炫,It is very suitable for a bar that meets with friends. It is very dazzling to click on a cup of skull head cups.,False,0.119,0.0,0.881,0.4767
"炸物還不錯吃 酒味也夠
喝個兩杯微醺 度過愉快的週末～","Fried objects are not bad to eat wine and taste enough
Drink two cups of micro -weekends ~",False,0.144,0.0,0.856,0.431
精典調酒很到位！炸物也很平價，適合假日小酌，朋友聚會！,"Classic bartending is in place!Fried objects are also very cheap, suitable for holiday drinks, friends gathering!",False,0.313,0.0,0.687,0.7494
"老闆人很好，很親切
會詢問客人的口味，再做調整
CP值很高😊😊😊 …","The boss is very good, very kind
Will ask the taste of the guests, and then make adjustments
CP value is very high ...",False,0.313,0.0,0.687,0.8608
"老闆很親切 就很好喝 便宜又大杯 氣氛好音樂佳
適合來小酌一杯🥂💖 …","The boss is very kind, it is very delicious, cheap, and a big glass of atmosphere good music
Suitable for a drink 小 ...",False,0.335,0.0,0.665,0.8906
"調酒不錯，店內環境燈光微暗
適合聊天","The bartending is good, the light in the store is slightly darker
Suitable for chatting",False,0.172,0.0,0.828,0.4404
氣氛很棒，調酒平價，冰茶系列有很多選擇，之後會再回訪,"The atmosphere is great, the bartender is cheap, the ice tea series has a lot of choices, and I will return to visit afterwards",False,0.151,0.0,0.849,0.6249
舒服的老店，調酒非果汁，超有酒感,"A comfortable old shop, bartending non -juice, super wine feel",False,0.474,0.0,0.526,0.802
"大熱天還能提供熱調酒讓人覺得暖心，
朋友的Mojito薄荷和檸檬的比例也很棒！
打卡還會再送一杯調酒，CP值很高：）","It can also provide hot drinks on a hot day, which makes people feel warm.
The proportion of friends' Mojito mint and lemon is also great!
Pickings will give another cup of bartending, CP value is very high :)",False,0.307,0.0,0.693,0.9334
調酒價格公道經濟實惠，最推薦諾曼第冰茶，最適合買醉，店長傑哥熱情好聊，沒人的時候推薦坐吧台和傑哥一起度過夜晚~是士林除了榕和放感情以外，適合跟朋友小酌的好去處！,"The bartending price is fair and economical. The most recommended Norman ice tea is the most suitable for buying drunkenness. In addition, it is suitable for a good place with friends!",False,0.284,0.0,0.716,0.8653
"台北第一攤

住在附近飯店，一看到評價力馬大隊拉過來

從開店還沒營業就進來吹冷氣等候，喜得老闆善心一顆星

點了炸物雞翅還有義大利麵，雖然老闆說這兒主要是賣酒的，但小孩肚子要顧，然後，我覺得老闆是想照顧附近店家，其實食物真的是粉不錯的，老闆誠實一顆星

調酒東京冰茶，長灘冰茶以及玫瑰。。。因為三種，所以自然三顆星（好喝，好順，不會醉）

最後，我醉了。 ps 回去還要洗小孩","Taipei First Stall

Living in a nearby restaurant, I saw the evaluation of the Lima brigade pulled over

Since opening the store, I have come in and wait for air -conditioned.

Ordered fried chicken wings and pasta. Although the boss said that it was mainly selling wine here, the child's belly had to be taken care of. Then, I think the boss wants to take care of the nearby shops. In fact, the food is really good. One star

Toast Tokyo ice tea, long beach ice tea and roses.EssenceEssenceBecause of three types, natural three stars (delicious, so smooth, not drunk)

In the end, I was drunk.PS goes back and still have to wash children",False,0.143,0.014,0.843,0.9459
非常讓人放鬆的酒吧 很開心 酒好喝,"Very relaxed bar is very happy, wine and drink",False,0.517,0.0,0.483,0.8169
諾曼地冰茶喝起來很濃卻不至於難以入口，大推！！,"Norman ice tea is very strong, but it is not difficult to enter, push!Intersection",False,0.304,0.0,0.696,0.6432
酒好喝老闆人很好,"The wine is good, the boss is very good",False,0.465,0.0,0.535,0.7264
"老闆人很好～ 調酒便宜濃度夠又大杯🥳
P.S圖-慾望海灘 …","The boss is very good ~ the concentration of the bartender is enough and a large cup 🥳
P.S Figure-Desire Beach ...",False,0.216,0.0,0.784,0.6997
"小遺憾：座位偏少，夏天室內還是熱
「環境衛生期望可優化」門口進入左邊蠻多雜物，僅剩2人座
但「剋蟑盒」就在餐桌前....飲食慾望大被影響

回到正題
濃厚系bar，空間小但調酒風味質感渾厚
內格羅尼一杯愛上，苦中帶甜滋味很棒

若喜歡渾厚紮實；(不愛清淡、華麗裝飾)，真的推薦

琴酒類蠻多選擇，酒單好閱讀，基底類別清楚
(不會搞些花招名稱)

餐桌部分共3桌體感較舒適好酌飲，中間區塊；這區間常客滿
(不包含高腳椅、吧台）","Small regrets: there are few seats, and the room is still hot in summer
""Environmental Sanitation Expectation can be optimized"" entrance to the left is quite many debris, only 2 people are left
But the ""Ketca Box"" is in front of the dining table .... Being desire is greatly affected

Back to the topic
Strong BAR, small space but bartending flavor and thick texture
Negrani fell in love with a glass of bitterness, with sweetness in bitterness

If you like thick and solid; (do not like light and gorgeous decoration), it is really recommended

The piano wine is quite selected, the wine list is easy to read, the base category is clear
(Can't engage in the name of the flowers)

There are 3 tables in the dining table. The body feels more comfortable and drinks, and the intermediate block; this interval is full.
(No high chair, bar)",False,0.235,0.105,0.661,0.9822
老闆很親切，餐點好吃，適合朋友聚會，下次還會在回訪,"The boss is very kind, the meals are delicious, suitable for friends to meet, and will be visiting the next time",False,0.368,0.0,0.632,0.8883
肯定是士林酒吧一級戰區榜首,It must be the top of the first -level theater of the Shilin Bar,False,0.122,0.0,0.878,0.2023
特調好入口，炸物好吃，價格實惠，圖片上兩杯特調（一杯300）及三份炸物（250）共300+300+250=850,"The specialties are good, the fried objects are delicious, the price is affordable, the two cups on the picture (one cup 300) and three fried materials (250) total 300+300+250 = 850",False,0.185,0.0,0.815,0.765
"順口好喝～老闆態度很好～沒有名片：）
整體環境很好👍 …","It's delicious ~ The boss has a good attitude ~ No business card :)
The overall environment is very good ...",False,0.413,0.071,0.516,0.8908
