Original,EN,Needs Review,Positive,Negative,Neutral,Compound
喝酒小聚放鬆的好地方,A good place for drinking and relaxing,False,0.55,0.0,0.45,0.7269
東西好吃，酒好喝,"It's delicious, wine is delicious",False,0.712,0.0,0.288,0.8126
晚上外面ㄧ堆人喧鬧超吵,There are noisy people outside at night,False,0.0,0.221,0.779,-0.1779
酒好喝 氣氛chill 每天都有營業 很適合放鬆聚會,"The good atmosphere of wine, ChILL is open every day, it is suitable for relaxation party",False,0.409,0.0,0.591,0.8402
氣氛組👍酒超好喝,The atmosphere group is so good that wine is super delicious,False,0.586,0.0,0.414,0.907
好喝的酒吧 老闆帥年輕,The delicious bar owner is handsome and young,False,0.535,0.0,0.465,0.7845
"老闆人超好又帥
其他員工顏值都超高
來這邊喝就對了
會喝得很開心","The boss is super good and handsome
Other employees have super high value
Just come here to drink
Will drink well",False,0.551,0.0,0.449,0.9545
"老闆親切
氣氛好
至於酒 就等你來體驗
總之有種讓你一直坐下去的魔力","Boss kind
Good atmosphere
As for wine, you can experience it
In short, there is a magic that makes you sit down all the time",False,0.215,0.0,0.785,0.743
"平日時間～安靜且舒服😌 是跟朋友喝酒聊天的好地方。
也有寵物友善。很推薦的新地點","Normal time ~ Quiet and comfortable is a good place to drink and chat with friends.
There are also pets friendly.Recommended new location",False,0.317,0.0,0.683,0.8519
