Original,EN,Positive,Negative,Neutral,Compound
公司聚餐選在這裡。我是覺得難吃到不行！除了上菜非常慢.. 薯條無法給蕃茄醬(店員直接回我沒有蕃茄醬)、我點的松露牛排麵難吃到爆。牛排免強吞了、麵一口都吞不下去。Pizza也不怎麼樣。我從來不在網上評價餐廳的、這是第一次。因為太難吃太令我驚嚇。,"The company's dinner is selected here.I feel uncomfortable!Except that the food is very slow .. French fries cannot give tomato sauce (the clerk directly returns to me without tomato sauce), and the truffle noodles I ordered are unpalatable.The steak is not swallowed, and you can't swallow your face.Pizza is not good.I have never evaluated the restaurant online, this is the first time.Because it was too unbelievable, I was so frightened.",0.024,0.055,0.921,-0.4995
第一次跟男友來這邊吃飯，我覺得食物蠻好吃的，但是湯上來的時候是溫的，有跟店員反應之後，後面的燉飯就很熱，整體上覺得非常好吃，會再去～吃飯的過程中有看到女店員在巡視環境還有聞桌子的味道，感覺老闆應該是處女座因為很講求衛生，廚師做飯的空間也很乾乾淨淨，單純純分享，感覺試衣間非常重視環境衛生的餐廳,"The first time I came here with my boyfriend to eat here. I think the food is pretty delicious, but when the soup comes up, it is warm. After responding to the clerk, the stew in the back is very hot. During the meal, I saw that the female clerk also smelled the table in the inspection environment and smelled the table. I feel that the boss should be a Virgo because of the sanitation, and the space for cooking is very clean. A restaurant that attaches great importance to environmental sanitation",0.186,0.0,0.814,0.9622
很推薦這裡的燉飯。米吸滿了湯汁米心微硬，很道地的義式料理，推薦大家,"It is recommended to stew here.Mito is full of soup, and Mi is slightly hard -hearted, very authentic, and very authentic dishes, recommend everyone",0.171,0.042,0.787,0.5356
非常好吃，氣氛又好，下次會再來吃,"Very delicious, the atmosphere is good, I will eat again next time",0.408,0.0,0.592,0.7841
餐點還不錯的，出餐稍慢,"The meal is not bad, the meal is slightly slower",0.241,0.0,0.759,0.431
餐點高水準，服務人員態度讓我印象深刻，親切但不會有壓力,"The meal is high, and the attitude of the service staff impressed me.",0.205,0.0,0.795,0.4767
"出餐等了50分鐘，上班族中午用餐需謹慎..
牛肉麵的麵是義大利麵，上面是煎牛排","After 50 minutes of delivery, the office workers need to be cautious at noon ..
The noodles of the beef noodles are pasta, and fried steak on it",0.0,0.049,0.951,-0.1027
餐點好吃精緻，份量剛剛好，服務態度也超好的☺️,"The meal is delicious and delicate, the portion is just right, and the service attitude is super good ☺️",0.495,0.0,0.505,0.9287
蒜辣蛤蠣前菜和松露牛排的味道表現讓人印象深刻！份量十足，非常對的起價格，多人聚餐的好去處,"The taste of garlic oyster dishes and truffle steaks is impressive!The portion is full, very right price, a good place for many people to dinner",0.117,0.0,0.883,0.4926
前菜、主餐、湯品、咖啡、甜點都很好吃，服務人員也都很客氣專業，值得推薦,"The former dishes, main meals, soups, coffee, and desserts are all delicious, and the service staff are very polite and professional. It is worth recommending",0.196,0.0,0.804,0.6808
"非常美味
來過N次
希望份量可以再多一點🌟","Very delicious
I have been to N times
Hope the portion can be a little more 可以",0.315,0.0,0.685,0.7841
氣氛佳 菜色好 份量足 服務親切得體,"The atmosphere is good, good for the serving, the service is intimate and decent",0.326,0.0,0.674,0.7003
已期待內湖店開幕許久，一進門挑高在加上店內昏暗的設計，讓人非常放鬆，跟朋友在這大肆聊天、喝酒，感受店內音樂和氣氛。,"I have been looking forward to the opening of the Neihu Store for a long time. As soon as I entered the door, the dark design in the store was very relaxed. It was very relaxed. I chatted, drinking with my friends, and feeling the music and atmosphere in the store.",0.198,0.0,0.802,0.8906
很好吃推薦大家來吃喔！,"It's delicious, I recommend everyone to eat!",0.565,0.0,0.435,0.7574
第一次用餐，湯品、主食、甜點都非常美味，服務人員也很親切，5顆星推薦～,"For the first time, soup, staple food, desserts are very delicious, and the service staff is very kind. 5 stars are recommended ~",0.322,0.0,0.678,0.8586
好吃，份量十足值得推薦,"It's delicious, it's worth recommending",0.651,0.0,0.349,0.6808
服務人員非常親切 服務200分,The service staff is very intimately serving 200 points,0.0,0.0,1.0,0.0
很重視細節的好餐廳，會再訪,"Good restaurants that attach great importance to details, you will visit again",0.514,0.0,0.486,0.8591
每一道餐點都是好吃的，本來地圖上隨便選一間，沒想到就選到這麼好吃的，服務業非常好，很幸運,Each meal is delicious. I chose one room on the map. I did n’t expect to choose such delicious one. The service industry is very good and lucky.,0.363,0.0,0.637,0.9281
羅勒干貝麵好吃，醬汁很濃稠吃光光,"The noodles of the Lales Damn are delicious, and the sauce is very thick and eats light",0.173,0.126,0.701,0.25
"跟著同事一起來為主管慶生，
服務品質超好，餐點也非常美味，
想要客製餐點，配合刁鑽的我，也可以配合，
我給予讚讚讚👍","Come with colleagues to celebrate your birthday,
The service quality is super good, and the meal is also very delicious,
If you want to make a customer -made meal, you can cooperate with me, you can also cooperate,
I give praise 赞",0.35,0.0,0.65,0.9606
氣氛很棒 餐點好吃～,The atmosphere is very good meal ~,0.347,0.0,0.653,0.4927
"午餐時間
服務超級好","Lunch time
Serving is super good",0.63,0.0,0.37,0.7783
用餐環境安靜，湯很鮮！,"The dining environment is quiet, the soup is very fresh!",0.243,0.0,0.757,0.4376
環境整潔舒適，服務人員用心，餐點十分美味，和家人都很喜歡💕,"The environment is neat and comfortable, the service staff is attentive, the meal is very delicious, and the family likes it very much.",0.408,0.0,0.592,0.92
服務好，餐點極佳，蝦子有去泥腸，很用心，平時不喜歡乳酪蛋糕，但他們的乳酪蛋糕竟然很好吃,"The service is good, the meal is excellent, the shrimp has a mud sausage, very careful, usually does not like cheese cake, but their cheese cake is delicious",0.305,0.044,0.651,0.8497
鴨肉義大利爽口 好吃👍氣氛好,Duck meat is refreshing and delicious. The atmosphere is good,0.452,0.0,0.548,0.765
點的主食都好吃，巴斯克乳酪蛋糕很驚艷！請點👍🏼,"The staple foods are delicious, and the Basque cheese cake is amazing!Please click 👍🏼",0.19,0.0,0.81,0.6114
餐點精緻好吃，用餐環境佳，服務親切,"The meals are delicate and delicious, the dining environment is good, and the service is cordial",0.375,0.0,0.625,0.7783
"希望能夠裝窗簾，不然這麼高級的餐廳坐在窗邊，感覺好像猴子吃給人家看
窗戶外面就是大樓的卸貨區碼頭，又是在一樓的樓層","I hope to install curtains, otherwise such a high -end restaurant is sitting by the window, it feels like a monkey eats it for others
Outside the window is the dock of the unloading area of ​​the building, and the floor on the first floor",0.112,0.0,0.888,0.6597
服務親切，餐點有特色！,The service is cordial and the meals are distinctive!,0.0,0.0,1.0,0.0
💖肉質鮮嫩好吃 服務好💖,好 The meat is fresh and delicious.,0.545,0.0,0.455,0.7184
波特紅酒茄酪肉醬義大利麵好吃,Potter wine eggplant meat sauce is delicious,0.381,0.0,0.619,0.5719
"店內氣氛舒服放鬆, 料理精緻好吃, 是內科餐廳的好選擇","The atmosphere in the store is comfortable and relaxed, and the dishes are delicate and delicious.",0.487,0.0,0.513,0.886
"好吃  內湖已經不知道要吃什麼
新開的~口味都好吃!食材新鮮~
2/7 回訪多次, 還是好吃~他們的薄餅堪稱一絕!!","It's delicious, I don’t know what to eat
Newly opened ~ The taste is delicious! The ingredients are fresh ~
2/7 visits many times, it is still delicious ~ their pancakes are a must !!",0.315,0.0,0.685,0.9357
餐點美味，老饕牛排值得推薦,"The meal is delicious, the old steak is worth recommending",0.412,0.0,0.588,0.6808
餐點好吃、氣氛服務也很喜歡,The meal is delicious and the atmosphere service also likes it very much,0.371,0.0,0.629,0.7579
"餐點不錯，服務極佳
氣氛也好
反應問題都能得到快速解決","The meal is good and the service is excellent
The atmosphere is good
The reaction problems can be quickly solved",0.396,0.092,0.512,0.836
"環境很舒適大器，適合聚餐
食物多樣化，推薦鮭魚燉飯","The environment is very comfortable, suitable for dinner
Food diversified, recommended salmon stew rice",0.31,0.0,0.69,0.659
用餐環境好，餐點好吃，尤其是主餐的豬肋排神到爆，推薦大家來這裡吃飯～,"The dining environment is good, and the meal is delicious, especially the pork ribs of the main meal are explosive. I recommend everyone to come here for dinner ~",0.259,0.0,0.741,0.8442
"氣氛好，服務很棒，東西好吃。
龍蝦是現撈的很鮮甜。","The atmosphere is good, the service is great, and the things are delicious.
Lobster is very sweet.",0.518,0.0,0.482,0.9324
洽談生意吃美食真的很讚，尤其牡蠣超級新鮮,"It is really good to discuss business and eat food, especially oysters are super fresh",0.446,0.0,0.554,0.8643
今天點了肋眼牛排 牛排軟嫩很好吃,Today I ordered the rib eye steak steak soft tender and delicious,0.252,0.0,0.748,0.5719
食材很新鮮！料理很細心！很好吃，值得推薦哦！,"The ingredients are very fresh!Cooking is very careful!It's delicious, it is worth recommending!",0.38,0.0,0.62,0.7753
餐廳環境不錯～～,The restaurant environment is good ~~,0.367,0.0,0.633,0.4404
餐點水準保持的很好；服務人員親切體貼。,The level of meals is very good; the service staff is intimate and considerate.,0.337,0.0,0.663,0.7264
環境不錯，餐點很精緻,The environment is good and the meal is exquisite,0.266,0.0,0.734,0.4404
服務生很專業，蛋糕好吃,"The waiter is very professional, the cake is delicious",0.316,0.0,0.684,0.5719
燉飯好吃,Stewed rice delicious,0.649,0.0,0.351,0.5719
干貝新鮮好吃， 氣氛佳,"The scallops are fresh and delicious, the atmosphere is good",0.56,0.0,0.44,0.836
餐點喜歡 環境舒適,I like the environment comfortable,0.659,0.0,0.341,0.7003
浪漫的餐廳 ：）,Romantic restaurant :),0.851,0.0,0.149,0.6908
餐點美味，份量充足，服務好,"Meal delicious, sufficient portion, good service",0.623,0.0,0.377,0.765
好吃美味，服務非常好,"It's delicious and delicious, the service is very good",0.638,0.0,0.362,0.8908
鮭魚很美味～～,Salmon is delicious ~~,0.552,0.0,0.448,0.5719
薄餅好吃，服務人員很友善,"The pancake is delicious, and the service staff is very friendly",0.444,0.0,0.556,0.8016
精釀哪裡都喝得到 環境食物真不錯,It's good to drink the environment where you can drink wherever you drink.,0.195,0.0,0.805,0.4404
不錯,good,1.0,0.0,0.0,0.4404
舒服的用餐體驗,A comfortable dining experience,0.524,0.0,0.476,0.5106
"牛排確實不錯，但服務人員需要更多訓練。點了一杯酒作為開胃菜，但他們堅持只和我的主菜一起上桌🤷‍♂️

牡蠣是生的而不是火烤的。

烤箱烤的蔬菜和湯都可以。

牛排是主角菜。

麵食令人失望。煮過頭了。","The steak is really good, but the service staff needs more training.I ordered a glass of wine as an appetizer, but they insisted on only on my main dish 🤷‍♂️

Oysters are raw rather than baked.

Booth baked vegetables and soups can be.

Steak is the protagonist.

The pasta is disappointing.Cook the head.",0.037,0.0,0.963,0.2724
菜餚擺盤精美。然而，午餐後直到晚上我都感到很口渴，這通常是對味精的反應（對我來說）。另外，玫瑰荔枝馬卡龍缺乏荔枝味。,"The dishes are exquisite.However, after lunch, I feel very thirsty until night, which is usually a reaction to MSG (for me).In addition, rose lychee macaron lacks litchi flavor.",0.0,0.0,1.0,0.0
優質的服務和食物，最重要的是，這是一家真正的寵物友善餐廳，不能推薦更多，我一定會再次光臨！,"High -quality services and food, the most important thing is that this is a real pet friendly restaurant. I ca n’t recommend more. I will definitely come again!",0.315,0.0,0.685,0.8764
好吃,tasty,0.0,0.0,1.0,0.0
我們在午餐期間得到了優質的服務，謝謝！,"We got high -quality services during lunch, thank you!",0.259,0.0,0.741,0.4199
"好吃😋

值得一探究竟😋","Delicious

It is worth exploring",0.651,0.0,0.349,0.6808
好吃,tasty,0.0,0.0,1.0,0.0
