Original,EN,Positive,Negative,Neutral,Compound
一個人點了套餐 一個人單點，共花費了2500元，雖說價位偏中上，但食物美味很值得，滿額還招待每人紅酒或白酒，生日壽星招待金箔茶，空間跟服務也值得五顆星，連喝不完的外帶杯也如此高級，真的大推。下次若單點義大利麵或是薄餅，應該會較為平價些🥰,"One person ordered a package alone, spent a total of 2,500 yuan. Although the price is medium, the food is delicious. It is also worthy of entertaining each person's red wine or liquor. Star, even the endless take -off cup is so advanced, really pushing.Next time, if a single -point split noodles or pancakes, it should be more cheap",0.178,0.029,0.793,0.8783
氣氛很棒！服務人員貼心！今天點了肋眼牛排和小羔羊，肉質鮮嫩 ，值得推薦哦！,"The atmosphere is great!The service staff is intimate!Today, I ordered the rib eye steak and the little lamb. The meat is tender and it is worth recommending!",0.096,0.0,0.904,0.4168
前菜干貝生食等級十分鮮嫩，鮭魚炙燒熟度也恰到好處，湯品推薦松露濃湯及馬賽魚湯，豬肋排必點 ！飲品及甜點也感受得出大廚用心。餐廳環境寬敞舒適，主廚細心解說及服務人員貼心服務，完美的一餐 ：）,"The raw raw grade of the former vegetable scallops is very tender, and the salmon is also good. It is also good for salmon. The soup recommends truffle soup and Marseille fish soup. The pork ribs must be ordered!Drinks and desserts also feel the chef intention.The restaurant environment is spacious and comfortable. The chef carefully explains and serves the intimate service of the service staff. A perfect meal :)",0.239,0.0,0.761,0.9551
主廚煎牛排的功力很高，商業午餐的茄汁牛排湯麵，感受到新鮮用心熬煮番茄味，搭配義大利麵條，入口很順（好吃到忘了拍），鮭魚燉飯也不錯，香氣十足！,"The chef's skills of fried steaks are very high, and the commercial lunch soup noodles, feel fresh to boil the tomato flavor with freshness, with the Italian noodles, the entrance is very smooth (forgot to shoot) It's full!",0.056,0.066,0.878,-0.1007
"餐廳好大 但服務生感覺人手不太充足
收盤子忘記換新的
上菜後也沒有盤子可以使用
想要叫服務生但大家都低頭忙自己事
看起來非常的忙 無法眼神交會只能用叫的
Pizza烤好廚師都按鈴了
但沒有外場送餐
就眼睜睜看他放在那裡一陣子
是說 可以自己去端嗎…
上桌時都有點涼了

食物好吃 價格也蠻正常的
吃個中午好像還可以","The restaurant is so big, but the waiter feels that the person is not sufficient
Forgot to change new ones
There are no plates to use after serving
Want to make a waiter, but everyone bowed his head and busy yourself
It looks very busy and can't be used by the eye.
Pizza baked chefs all bells
But there is no food delivery
Just watched him put it there for a while
Is it possible to go to your own ...
It's a bit cold when I put on the table

The food is delicious and the price is quite normal
It seems okay to eat noon",0.076,0.048,0.876,0.5023
突然不知道要吃什麼，發現老公公司附近開了一家新店，決定來探訪看看好不好吃。可能是因為晚餐時段沒啥人，服務生有禮貌很客氣，耐心的幫我們介紹菜單，想說他主打活龍蝦當然要點來吃看看，反正我們其實不餓，點的是套餐（兩個人），前菜選麵包，溫度適中沾醬好吃，松露濃湯溫厚順口，主餐的🦞上桌有驚訝（因為海味有點重），但是處理得很棒（不用在那邊搓啊搓挑肉吃），肉質Q彈但我還是想不透如果生猛新鮮，為什麼龍蝦的海味如此重（我本人是味道高敏者），無解。最後的起士蛋糕很中規中矩，整體來說餐點味道服務都有水準之上，但相對來說價格不算親民，店員推薦下次可以來吃午間套餐，若荷包充裕值得二訪。,"Suddenly I didn't know what to eat. I found that a new store opened near her husband's company, and decided to visit to see not to be delicious.It may be because there are no people during dinner. The waiter is polite and polite, and patiently introduce the menu to us. I want to say that he is the main way to eat lobster. , Overcost in bread, the temperature is moderate and the sauce is delicious, the truffle thick soup is warm and smooth, and the main meal is surprised (because the seafood is a bit heavy), but it is greatly handled (do not need to rub it over there, pick the meat to eat) , Meat Q bombs, but I still can't think of it. If it is fierce and fresh, why the lobster is so heavy (I am a high -sensitivity person) and have no solution.The last cheese cake is very satisfactory. Overall, the taste of meals has a standard service, but the price is not close to the people. The clerk recommends that you can come to have a lunch package next time.",0.078,0.022,0.899,0.8397
龍蝦湯加入茴香讓味道更有層次感，目前是我心中龍蝦湯第一名。生蠔大顆又新鮮，濕式熟成翼板牛排搭配海鹽，讓它的味道彰顯出來！他們竟然也有我的最愛法國🇫🇷M F 茶,"The lobster soup is added to the fennel to make the taste more layered. It is currently the first place in my heart.The oysters are large and fresh, and the wet cooked wingspan steak with sea salt makes it taste!They even have my favorite French 🇫🇷m F tea",0.108,0.0,0.892,0.68
很標準的西餐廳，點的是套餐，包含前菜、湯品、主餐、飲品、甜點。大約3000～4000左右。蝦、海鮮跟羔羊非常完美。服務生也很好。,"Very standard Western restaurants, set meals, including previous dishes, soups, main meals, drinks, desserts.About 3000 to 4000.Shrimp, seafood and lambs are perfect.The waiter is also very good.",0.109,0.0,0.891,0.4927
"服務態度很好，馬賽魚湯好喝
松露牛排燉飯也不錯，飯保留米芯的口感","The service attitude is very good, Marseille fish soup is delicious
Tuffy steak stew rice is also good, the taste of the rice core is retained",0.331,0.0,0.669,0.8718
"龍蝦湯好喝，一喝就想要加點麵包，多享受一個吃法。
牛排處理不錯，熟度跟醬汁我個人很喜歡，雖然有細筋，但瑕不掩瑜。","Lobster soup is delicious. When you drink, you want to add some bread and enjoy one more way of eating.
The steak is good. I personally like the cookedness and sauce. Although there are fine tendons, the flaws are not covered.",0.306,0.0,0.694,0.9246
"服務、氣氛、餐點都極好的一間義式餐廳
個人覺得CP值相當高 用中間價位的價格就能吃到高檔的食材！相當推薦朋友或家人聚餐的選擇！","A Italian restaurant with excellent service, atmosphere, and meals
Personally, I think that the CP value is quite high -purpose in the middle price. You can eat high -end ingredients!Very recommended friends or family members to choose meals!",0.254,0.0,0.746,0.8906
"因為在對面上班，洲子街上的餐廳都吃過，所以一直很好奇這間餐廳，今天點了小圓法、菌菇蛤蜊、法式小羔羊、鮭魚乳酪義大利麵跟橙檸重乳酪，我只能說每道都好吃，服務、餐點、店裝都很棒，餐點價格又相較內湖餐廳親名，我能說以該店各項的品質，在內湖的物價兩倍甚至三倍都能接受。👍👍👍
真擔心以該店的品質，未來會不好訂...😂😂","Because I have eaten in the restaurants on Zhouzi Street, I have always been curious about this restaurant. Today I ordered the small circle, mushrooms, clams, French lambs, salmon cheese, and orange lemon heavy cheese, I It can only be said that every channel is delicious, the service, meal, and store installation are great. The price of meals is compared to Neihu Restaurant. I can say that the quality of the store is twice as the price in Neihu Even three times acceptable.Bleak
I am really worried that the quality of the store will be difficult to order in the future ... 😂😂",0.137,0.068,0.795,0.8981
牛排非常好吃～小羔羊也是一級棒。生日當天還有一個小蛋糕唷，行政主廚服務很讚👍大推～,"The steak is very delicious ~ Lamb is also a first -class.There is also a small cake on his birthday, and the administrative chef service is very good.",0.217,0.0,0.783,0.8012
"第一顆星是給老饕牛排的，但是你們的做法明明就是外焦內嫩的正宗翡冷翠牛排，怎麼沒有在菜單行銷宣傳？
另外半顆星是給野生蝦的醬汁，以及半顆星給龍蝦湯的湯頭，至於龍蝦要扣整整一顆星，怎麼能做到這麼老的肉質。
最後扣最多的是紅酒，虧我還請你們推薦適合老饕牛排的紅酒，怎麼會推一支帶酸莓果醋酸栗的酒，難道只因為評價97分嗎？這個行政主廚的教育訓練要負責。
這支酒只能配瑪格麗特，莓果冰淇淋。牛排跟起士蛋糕都很不達，希望我下次帶家人來吃牛排時能改進了。","The first star is a steak for the old lady, but your approach is obviously the authentic emerald cow steak in the outer coke. Why didn't you promote it in the menu marketing?
The other half of the star is the sauce for wild shrimp, and the soup of half a star to lobster soup. As for the lobster to deduct a whole star, how can you achieve such old meat.
In the end, the most deducted red wine. I also asked you to recommend red wine suitable for old -fashioned steaks. How can you push a wine with sour berry and chestnuts? Is it because of 97 points?The education and training of this administrative chef should be responsible.
This wine can only be equipped with Margaret, berry ice cream.The steak and the cheese cake are very uncomfortable. I hope I can improve when I bring my family to eat steak next time.",0.088,0.039,0.873,0.8489
餐點好吃、服務周到，環境也很舒適！推一個～🆙(￣∇￣),"The meal is delicious, the service is thoughtful, and the environment is very comfortable!Push one ~ ￣∇￣ (￣∇￣)",0.292,0.0,0.708,0.7644
今天帶爸爸來慶生，服務態度超級好，食物也是一百分💯很愉快的用餐體驗❤️謝謝你們現做的巧克力蛋糕 我們都很喜歡,"Today I brought my father to celebrate the birthday, the service attitude is super good, and the food is also a very happy meal experience ❤️ Thank you for your current chocolate cake",0.369,0.0,0.631,0.9516
"餐點真的太好吃 墨魚麵入口到最後帶著一點微辣十分爽口 配上店員介紹的 維蘇威火山白酒 鮮味又提升了一個檔次
前菜的鮮鮭莎莎薄餅和香草蒜辣蛤蜊十分開胃 主餐也都不負期待的十分好吃
還有其他沒有拍到的照片
最推薦翼板牛排搭配 瓦爾波利賽拉紅 葡萄酒
和櫻桃香草酸辣義大利麵","The meal is really delicious. The entrance to the noodle noodles is at the end, with a little spicy, very refreshing, and the Weisuway volcano white wine introduced by the clerk, another grade
The fresh salmon Sansha and vanilla garlic of the former dish are very appetizing and the main meal is also very delicious.
There are other photos that I haven't taken
The most recommended wingspan steak with Valplisaira red wine
And cherry vanide spicy spicy pasta",0.143,0.0,0.857,0.9077
奧古斯托義大利餐廳餐點十分美味，侍者服務專業親切，店內播放義大利輕音樂，就像是在義大利國境內用餐一樣輕鬆愉快，家人們都非常喜歡。,Augusto Italian restaurant meals are very delicious. The waiters are professional and kind. Playing Italian light music in the store is as relaxed and happy as meals in Italy. The family likes it very much.,0.394,0.0,0.606,0.9577
餐點好吃，東西份量足，服務人員很親切還幫我們切鴨胸和牛排,"The meal is delicious, the content is sufficient, and the service staff is very kind to help us cut duck breasts and steak",0.329,0.067,0.604,0.8503
今日點了2~3人套餐~馬賽魚湯好喝，牛排軟韌外皮帶點焦脆感，小羊好咬軟韌~價位不低，但好吃~,"I ordered 2 ~ 3 people today ~ Marseille fish soup is delicious, steak soft and tough outer belt is scorched, and the lamb is bite soft and tough ~ the price is not low, but it is delicious ~",0.19,0.054,0.756,0.8078
叫過幾次外送，包裝很嚴實，原本印象還不錯，結果這次餐點裡有頭髮，而且還不只一根，非常噁心。,"Called several times, the packaging was very tight, and the original impression was not bad. As a result, there was hair in the meal, and there were more than one, which was very disgusting.",0.173,0.091,0.736,0.3307
"服務親切有禮
餐點也樣樣美味
挑嘴的我有被驚艷到
生日有送小蛋糕
活動還送紅白酒
價格親民很推薦
ㄧ間會再回訪的店家","Careful and polite service
The meal is also delicious
I was stunned by picking my mouth
There is a small cake for birthday
The event also gives red white wine
Price and people are very recommended
ㄧ The shop that will return to visit again",0.148,0.028,0.823,0.7178
很好吃、服務也很好❤️願意再造訪👍🏻,"Very delicious, the service is also very good ❤️ I willing to visit again 👍🏻",0.285,0.0,0.715,0.8012
"二次來訪！食物依舊美味有水準
餐點無雷！整體好吃
大推濕式熟成牛排燉飯","Visit!Food is still delicious and standardized
Meal without thunder!Overall delicious
Big moisturizing cooked steak stewed rice",0.201,0.141,0.658,0.3151
"今天中午跟大學朋友一起來這裡聚會，想說來吃看看剛開幕的餐廳，沒想到意外的令人非常驚豔！
而且店員還推薦給我們適合餐點的酒，服務品質高又親切，整體給人的感覺非常舒服，已經考慮下次要帶家人來用餐了🥰","I came here to meet with college friends at noon today. I wanted to say to eat and see the restaurant just opened. I did not expect that it was very amazing!
Moreover, the clerk also recommends that we are suitable for meals. The quality of service is high and kind. The overall feeling is very comfortable. I have considered it to take my family to dine next time 🥰",0.276,0.0,0.724,0.9755
"第一次去內湖完全不知道要吃什麼
突然逛到這間從外面就看起來很漂亮的店，挑高的天花板，整體是灰色調又有點工業風，看起來就非常chill又帶點高級感

後來才發現我之前去過他們分店，原來最近又在內湖新開幕，餐點跟分店沒有區別都是高水準的好吃，服務人員也都很親切跟耐心

之前沒有吃過他們的馬卡龍，這次點了不同口味來嘗試，說真的都很好吃，特別是紅心芭樂有驚豔到我，非常濃郁的水果香氣，還有焦糖口味的，帶點苦味讓整體不會吃起來太過於甜膩

聽說之後會更新菜單，期待新的菜單之後再來三訪","The first time I went to Neihu, I didn't know what to eat at all
Suddenly strolling around this shop that looks beautiful from the outside, the high ceiling, the overall gray tone and a bit industrial style, it looks very chill and a little high -level sense

Later, I discovered that I have been to their branches before. It turned out to be newly opened in Neihu recently. There is no difference between meals and branches. It is high -level and delicious. The service staff are very kind and patient.

I haven't eaten their macarons before. This time I ordered different flavors to try it. It is really delicious, especially the red -hearted guava is amazing. It is very rich in fruit aroma and caramel. With a bit bitter taste so that the whole will not taste too sweet

I heard that the menu will be updated after I heard that I look forward to the new menu and then come to three visit",0.123,0.04,0.837,0.9552
"很棒的一間餐廳
餐點精緻好吃
環境乾淨舒服
推薦給大家","A great restaurant
The meals are delicate and delicious
The environment is clean and comfortable
Recommend to everyone",0.593,0.0,0.407,0.9477
"超推牛排燉飯  義大利米米芯吸飽滿滿牛排湯汁   非常超值
薄餅料多起司香   搭配餐前賽魚湯或濃湯  完美的週末午餐","Super push -stewed rice stewed rice, Italian rice core is full of beef soup, very good value
Porter ingredients with cheese incense with a perfect weekend lunch with the perfect weekend lunch",0.389,0.0,0.611,0.9529
"399元的義大利麵有干貝、牛排等選項真的是不多見，況且還很好吃！
會氣死欸！就開在公司樓下想要我怎樣！
對不起了錢錢😂以後會常光顧的！","It is really rare for the 399 yuan pasta to have scallops, steaks and other options, and it is still delicious!
Will be angry!Just open it downstairs in the company!
I'm sorry for money, I will often patronize in the future!",0.108,0.029,0.863,0.6776
環境很舒服，餐點調味很用心，下次會在回訪,"The environment is very comfortable, the meals are very careful, and will be visiting the next time",0.268,0.0,0.732,0.669
"這是我第二次來這家餐廳用餐。第一次來時，由於和朋友聊天聊得太開心，沒有好好品味餐點，所以決定第二天再來一次。主要吸引我的是這裡的波士頓龍蝦，兩個人一共花了三千多塊，雖然價格不算便宜，但仍然決定再來體驗一番。

這次我們各點了一份波士頓龍蝦，另外還點了一份綜合時蔬。龍蝦非常新鮮，餐廳內有水箱，可以看到活龍蝦，這點讓人覺得食材非常有保障。餐廳可能是因為剛開業不久，所以人不多。第一次來時，訂位的時候被告知有用餐時間限制，本來心裡有些猶豫，但因為沒有其他選擇，還是決定來看看。來了之後發現餐廳並沒有坐滿，自然也不會催促客人離開，這讓我們可以悠閒地享受美食。

龍蝦的品質確實不錯，肉質鮮嫩多汁，烹調的味道也很棒，無論是蒸煮還是烤制，都能感受到廚師的用心。綜合時蔬則是一個驚喜。這道菜包含了多種蔬菜，種類豐富，份量也很足，是一道既健康又美味的料理。這道菜不僅色彩繽紛，口感也很不錯，讓我們在享受海鮮的同時也能攝取到足夠的蔬菜營養。

可能是因為餐廳新開業的原因，服務人員看起來還比較沒有經驗，不過他們都非常可愛，服務態度也很熱情。雖然在點餐和上菜的過程中有些小失誤，但整體來說還是令人愉快的用餐體驗。

總結來說，這家餐廳的波士頓龍蝦和綜合時蔬都值得推薦，食材新鮮，烹調用心，是一次愉快的美食體驗。希望餐廳能夠在未來持續改進服務品質，吸引更多的顧客。相信隨著時間的推移，這家餐廳一定會越來越受到食客的喜愛。","This is the second time I have come to this restaurant for dining.When I first came, I decided to come again the next day because I chatted with friends and didn't taste meals well.What attracted me was the Boston Lobster here. The two spent more than 3,000 yuan. Although the price is not cheap, it still decides to experience it again.

This time we ordered a Boston lobster, and we also ordered a comprehensive seasonal vegetable.The lobster is very fresh, and there is a water tank in the restaurant. You can see live lobsters. This makes people feel that the ingredients are very guaranteed.The restaurant may be because they have just opened, so there are not many people.When I first came, I was told that there was a restriction on meals at the time of order. I was a little hesitant, but because there were no other choices, I decided to take a look.After coming, I found that the restaurant was not full, and naturally it would not urge the guests to leave, which allowed us to enjoy the food leisurely.

The quality of lobster is really good, the meat is fresh and juicy, and the taste of cooking is great. Whether it is cooking or grilled, you can feel the chef's intentions.Comprehensive time vegetables are a surprise.This dish contains a variety of vegetables, which are rich in types and sufficient portion. It is a healthy and delicious dish.This dish is not only colorful, but also a good taste. Let us enjoy enough vegetable nutrition while enjoying seafood.

It may be because of the new opening of the restaurant. The service staff looks less experienced, but they are very cute and the service attitude is very enthusiastic.Although there are some small mistakes in the process of ordering and serving, it is still a pleasant dining experience as a whole.

In summary, the Boston lobster and comprehensive seasonal vegetables in this restaurant are recommended. The ingredients are fresh and the cooking is attentive. It is a pleasant gourmet experience.It is hoped that the restaurant will continue to improve service quality in the future and attract more customers.I believe that over time, this restaurant will be more and more loved by diners.",0.201,0.023,0.776,0.9979
食物精緻、氣氛良好！,The food is exquisite and the atmosphere is good!,0.285,0.0,0.715,0.4926
餐點好吃 服務親切 會讓人想再訪的一家餐廳☺️,"Meal delicious service, kind service will make people want to visit a restaurant ☺️",0.509,0.0,0.491,0.886
服務人員的態度很好、很有耐心，餐點也非常好吃，用餐環境乾淨寬敞，是目前內科最好的用餐地點。,"The attitude of the service staff is very good, patient, and the meal is also very delicious. The dining environment is clean and spacious. It is currently the best dining place in the Department of Internal Medicine.",0.299,0.0,0.701,0.9335
前菜烤時蔬調味適中，可以吃得出食材的原味，肋眼牛排外表酥脆，內部軟嫩，整體在水準之上，值得推薦,"When the former vegetables are grilled, the vegetables are seasoned. You can eat the original flavor of the ingredients. The rib eye steak is crispy, the inside is soft and tender, and the overall level is worth recommending",0.104,0.0,0.896,0.4939
餐點好吃、服務態度很好,The meal is delicious and the service attitude is very good,0.434,0.0,0.566,0.7841
在Agusto度過難忘的生日🎂，整體空間、服務與食材可感受滿滿用心，喜歡高級典雅卻不拘束的氛圍，店員與闆娘親切，小圓麵包、湯、燉飯、蛋糕味道口感都很驚豔！！❤️,"After spending an unforgettable birthday in Agusto, the overall space, service and ingredients can be full of intentions, and they like high -level elegant but unconstrained atmosphere. The clerk and Ban Niang are kind. Stunning!Intersection❤️",0.187,0.105,0.708,0.4199
"每位服務人員都很親切，服務更好
環境優，氣氛不錯，每樣東西都好吃、尤其是牛排，👍","Each service staff is very kind and the service is better
The environment is good, the atmosphere is good, everything is delicious, especially steak, 👍",0.434,0.0,0.566,0.9441
"海鮮超級不新鮮，蛤蜊沒有吐沙🥲🥲🥲生蠔有噁心的味道！
義大利麵是99元的那種麵條
冰美式是比超商咖啡還難喝像咖啡水一樣的那種
大雷店😤😤😤😤🤯🤯🤯
吃過這麼多義式餐廳~真的沒想到這家評價這麼高卻是這樣子...","The seafood is super fresh, and the clams have no disgusting smell of oysters!
The pasta is the kind of noodles of 99 yuan
Bing American style is more difficult to drink than super commercial coffee like coffee water
Daaidian 😤😤😤😤🤯🤯🤯
I have eaten so many Italian restaurants ~ I really did n’t expect that this evaluation is so high but this is like this ...",0.138,0.019,0.843,0.87
餐點現做須稍等，價位稍高，口味不錯，店裡氣氛很好。,"The meal is now necessary to wait a little, the price is slightly higher, the taste is good, and the atmosphere in the store is very good.",0.196,0.0,0.804,0.7264
"牛肉麵用肉嫩湯鮮，好吃！
豬肋排Q彈多汁烤得香味四溢
烤蔬菜新鮮香甜美味！","The beef noodles are delicious with meat and tender soup, delicious!
Pork ribs Q bomb juice grilled fragrance overflow
Baked vegetables are fresh and sweet!",0.364,0.088,0.548,0.8774
"人手不足，上餐速度慢，
餐點美味，份量足夠，
服務態度佳，環境乾淨👍🏻","Insufficient manpower, slow mealing speed,
The meal is delicious, and the portion is sufficient,
Good service attitude, clean environment 服务",0.354,0.0,0.646,0.8519
"這家的燉飯真的太讓人驚艷了！好喜歡這種米心偏硬的燉飯，吃得出主廚的用心👍🏻
店家的外場服務生親切貼心又專業，佷棒的用餐體驗❤️","This stewed rice is really amazing!I really like this kind of stewed rice with a hard heart.
The shop's out -of -field waiter is intimate and caring and professional, a sticky dining experience ❤️",0.249,0.032,0.718,0.8847
點了最後一頁套餐，有印象好吃的是干貝、雞湯、馬賽魚湯、豬肋排、重乳酪、抹茶鮮奶,"Ordered the last page package. The impressive is scallion, chicken soup, Marseille fish soup, pork ribs, heavy cheese, matcha fresh milk",0.228,0.0,0.772,0.6808
飲料好喝 薯條配松露醬跟另外要的莎莎醬都很好吃 服務人員很親切 喜歡🫶🏻,Drinks are delicious French fries with truffle sauce and the other Sasha sauce are very delicious.,0.355,0.0,0.645,0.8268
