Original,EN,Needs Review,Positive,Negative,Neutral,Compound
"真的是很適合放鬆的地方！
調酒真心好喝，有酒感又不讓你卻步
食物好吃！

真的要把實驗的調酒拿出來 茶酒超棒～
珍珠shot也是！","It's really suitable for relaxation!
I bartender is really delicious, and I feel wine without letting you go.
The food is delicious!

I really have to take out the experimental bartending and the tea wine is great ~
The pearl shot too!",False,0.301,0.0,0.699,0.9541
"二訪的酒吧!✨ 氛圍裝潢都一級棒🥹
一定要跟bartender馬沙聊天!🩶有趣的靈魂🧡
餐點都好吃!最愛蘋果披薩!🥰 調酒喝到現在都沒踩雷的!!🥹","The bar of the second visit!
Be sure to chat with Bartender Masha! 🩶 Interesting souls 🧡
The meals are delicious! I love apple pizza the most! 🥰 I have n’t stepped on the thunder until now !! 🥹",False,0.411,0.0,0.589,0.9796
會為了藝術品展覽特別設計一款調酒的酒吧應該是不多，以高粱基底製作的不辣 順口空間也挺放鬆的,It should be designed for a special bartending bar for art exhibitions.,False,0.197,0.0,0.803,0.4019
"超頂！披薩跟燉飯超好吃！😚
調酒師人超好！一定要二訪😍😍價錢也不貴！","Super top!Pizza and stewed rice are so delicious!Bleak
The bartender is super good!Be sure to visit the second visit. The price is not expensive!",False,0.349,0.0,0.651,0.9056
"調酒很好特別，而且很好喝。
餐點也很美味，嫩雞燉飯、pizza跟新的漢堡好讚😋
店員們都很親切，還可以邊喝酒邊欣賞藝術品！","The bartender is very good and special.
The meal is also very delicious, tender chicken stew, Pizza and the new burger are so praise 😋
The clerk is very kind, and you can also enjoy the artwork while drinking!",False,0.385,0.0,0.615,0.9718
"每樣東西都超好吃….找到寶藏店了😭
馬沙很好聊 店裡放的歌也好好聽～～
一定會再訪！！！！","Everything is super delicious .... I found the treasure shop 😭
Masha is very good to talk about the songs in the shop are so nice ~~
Will definitely visit again!IntersectionIntersectionIntersection",False,0.402,0.064,0.534,0.9477
這家餐廳真的是讓人驚艷的好味道啊！每道菜都讓人回味無窮，而且服務態度也非常親切，讓整個用餐體驗更加完美。我真的很推薦這家餐廳，絕對是值得一試的好地方！,"This restaurant is really amazing!Each dish is endless, and the service attitude is very kind, making the entire dining experience more perfect.I really recommend this restaurant, which is definitely a good place to try!",False,0.301,0.0,0.699,0.9175
燒烤好吃、牛肉很嫩、西班牙蒜味蝦配上軟法麵包這道菜我太愛了沒話說、甜的肉桂蘋果披薩也很厲害、酒類也很不錯,"Barbecue is delicious, beef is very tender, Spanish garlic shrimp with soft bread, I love it too much, sweet cinnamon apple pizza is also very powerful, the alcohol is also very good",False,0.389,0.0,0.611,0.953
有可愛狗勾，氛圍很好～,"There are cute dog hooks, the atmosphere is very good ~",False,0.408,0.0,0.592,0.7346
老闆服務很親切，餐點都不錯吃，雞腿串很嫩，氣氛不錯的一間店,"The boss's service is very kind, the meals are good, the chicken legs are tender, and a shop with a good atmosphere",False,0.333,0.0,0.667,0.8588
"海膽櫻花蝦義大利麵跟肉桂蘋果披薩 必點！
燈光氣氛佳 環境舒適","Sea urchin cherry shrimp pasta and cinnamon apple pizza must be ordered!
The light atmosphere is comfortable and the environment is comfortable",False,0.256,0.0,0.744,0.784
超好吃的餐點，店家超好還招待shot😍,"In the super delicious meal, the store is still entertaining Shot😍",False,0.551,0.0,0.449,0.926
"第一 沒辦法刷卡沒差，給人轉帳代號還給錯有夠誇張
第二 pizza小的六寸，我真看不出來6寸，看起來就是四寸啊？？？？？？
酒像果汁，餐點還好 （酒吧酒好喝餐不好吃就算，但兩個都很平平！）","First, there is no way to swipe the card, and the transfer code is too exaggerated to give people wrong.
The second pizza is a small six inches, I really can't see 6 inches, it looks like four inches?IntersectionIntersectionIntersectionIntersectionIntersection
Wine is like fruit juice, meals are okay (Bar wine is not delicious, but both are flat!)",False,0.081,0.117,0.802,-0.2939
"氣氛讚讚老闆帥
放鬆喝🍺還能逛畫展😍😍","The atmosphere praise the boss handsome
Relax and drink 能 can also visit the painting exhibition 😍😍",False,0.452,0.0,0.548,0.9403
比薩炸物都有水準，而且老闆招待shot 完全不手軟，太優質了,"Pizza fried objects are all standard, and the boss's hospitality is not soft at all, too high quality",False,0.0,0.0,1.0,0.0
店員很熱情 披薩很好吃 招待很多東西,The clerk is very enthusiastic about pizza and it is delicious and entertaining a lot of things,False,0.419,0.0,0.581,0.8777
餐點超好吃，推薦海膽奶油麵，又濃又香，調酒也超好喝的，很多種類可以選～讚讚讚,"The meal is super delicious. It is recommended for sea urchin cream noodles, which are thick and fragrant, and the bartending is also super delicious. Many types can be selected ~ Praise",False,0.442,0.0,0.558,0.9666
老人家說酒味不夠濃，但服務生男生對我家三老很有耐心，餐點都好吃，也讓我們換位置,"The old man said that the taste of the wine was not strong enough, but the waiter was very patient with my three old old old old old old old old old old old old old old old old old old old old old old old old old old old old old old old. The meals were delicious.",False,0.08,0.029,0.89,0.6368
餐點價格在信義東區這邊真的是非常佛心，雖然價格便宜但是水準非常之高，調酒也是，馬沙會詳細跟你介紹，而且時不時shot杯就出現你的眼前，聊天起來也不會有壓迫感！非常有人情味的酒吧，一定要來這裡試試看，,"The price of meals is really a good heart on the side of Xinyi East District. Although the price is cheap but the standard is very high, the bartender is also introduced to you in detail, and from time to time, you will appear in front of you. There will be a sense of oppression!Very humane bar, be sure to come here to try it out,",False,0.113,0.0,0.887,0.7943
"熱情的調酒師
溫柔的雞尾酒
像家的店環境
好喝的招待shot","Passionate bartender
Gentle cocktail
The shop environment like home
A delicious entertainment shot",False,0.657,0.0,0.343,0.936
"節瓜、牛肉串、松露薯條⋯等餐點都超級好吃 價格很佛
氣氛很適合一群朋友來玩 很放鬆 酒也很好喝⋯推","Meatsus, beef skewers, truffle fries and other meals are super delicious and the price is very Buddha
The atmosphere is very suitable for a group of friends to play very relaxed and delicious.",False,0.432,0.0,0.568,0.9664
老闆很帥氣，餐點很好吃！推薦大家😍,The boss is very handsome and the meal is delicious!Recommend everyone 😍,False,0.343,0.0,0.657,0.7773
焦糖肉桂蘋果披薩超級好吃，青醬海鮮披薩也很讚，調酒還能客製，氣氛很輕鬆可以放心跟朋友玩不會被嫌吵～超棒的,"Curdine Cinnamon Apple Pizza is super delicious, green sauce seafood pizza is also very good, can also be customized by bartend",False,0.375,0.0,0.625,0.8955
有戶外座位可以抽菸抽雪茄，老闆也很熱情一直招待shot，大家都會玩在一起，很輕鬆的店家,There are outdoor seats to smoke and smoke cigars. The boss is also very enthusiastic to entertain Shot. Everyone will play together.,False,0.308,0.0,0.692,0.8155
"新開的餐酒館 好有範兒
氣氛環境好
餐點好吃感覺廚師很用心
調酒還有送shot 太讚了吧","The newly opened restaurant is so good
Good atmosphere environment
The meal is delicious, and the chef is very attentive
Blooming and sending shot too much, right?",False,0.307,0.0,0.693,0.8915
"焦糖蘋果披薩超好吃 一定要點
酒也好喝～","Caramel apple pizza is super delicious, it must be some
The wine is also delicious ~",False,0.465,0.0,0.535,0.9062
餐點都很好吃！超推！調酒也好喝🥹,The meals are delicious!Super push!Alcohol is also delicious 喝,False,0.349,0.0,0.651,0.6467
氣氛很好。老闆又帥,The atmosphere is very good.The boss is handsome and handsome,False,0.444,0.0,0.556,0.7506
調酒好喝，食物好吃😋 …,"Blooming is delicious, the food is delicious ...",False,0.552,0.0,0.448,0.8126
老闆nice 氣氛活潑 食物跟酒非常好喝好吃 一定要來嘗試看看！！,The boss nice atmosphere lively food and wine are very delicious and delicious. Be sure to try it!Intersection,False,0.556,0.0,0.444,0.9455
超好吃 氣氛很好,Super delicious atmosphere is good,False,0.84,0.0,0.16,0.8885
店外面那台車珍珠白 很帥,The car outside the shop is white and handsome,False,0.286,0.0,0.714,0.4939
老闆很帥 披薩頂的 雞腿麵大推 酒保很熱情,"The boss is very handsome, the chicken legs of the pizza top push the wine and the wine is very enthusiastic",False,0.328,0.0,0.672,0.831
"店內的燒烤非常有料
調酒也非常的爽口
調酒師很親切
現場環境氣氛大推","The barbecue in the store is very ingredient
Blooming is also very refreshing
Winemaster is very kind
On -site environmental atmosphere push",False,0.15,0.0,0.85,0.5709
環境很不錯，老闆很可愛，跟姐妹小喝聊聊很適合😍😍,"The environment is very good, the boss is very cute, it is very suitable for talking with the sister's drinking.",False,0.265,0.0,0.735,0.7569
店員很熱情 點一杯招待的比點的還多 披薩超級好吃,The clerk is very enthusiastic about a cup of hospitality. The pizza is super delicious,False,0.48,0.0,0.52,0.902
披薩頂穿 特調的抹茶奶酒也超讚 燈光氣氛都很好 值得推薦,Pizza top of the special matcha milk wine is also very good at the light atmosphere is very good worth recommending,False,0.449,0.0,0.551,0.9014
剛開幕 讚👍 酒好喝 餐好吃,"Just opened and like wine, drink good meals and delicious",False,0.565,0.0,0.435,0.8442
"食物好吃,店內特調都不賴👍👍👍推","The food is delicious, and the special adjustment in the store is not bad.",False,0.457,0.0,0.543,0.85
餐點美味，物美價廉，有一羣年青人創業，加油。,"The meal is delicious, the quality is cheap, and a group of young people start a business and come on.",False,0.163,0.0,0.837,0.5719
東西好吃 服務態度也很好 調酒也不錯 適合下班小聚的地方 義大利麵大推,"The good service attitude is also very good, and the bartender is also good.",False,0.45,0.0,0.55,0.8399
蘋果披薩超好吃 來這邊必點,Apple pizza is super delicious and you must order here,False,0.487,0.0,0.513,0.8225
餐點環境都超棒老闆熱情服務以及招待 讓顧客有賓至如歸的感覺,"The meal environment is superb, the boss enthusiastically serves and entertains the feeling of guests who are guests at home",False,0.441,0.0,0.559,0.9118
餐點很好吃 肉桂蘋果披薩非常推！！！服務也很好 會很想再帶朋友來吃,"The meal is delicious, cinnamon apple pizza is very pushing!IntersectionIntersectionThe service is also very good and I want to take friends again to eat",False,0.367,0.0,0.633,0.8906
餐點非常好吃！,The meal is very delicious!,False,0.517,0.0,0.483,0.6468
披薩好吃、酒好喝，重點是瑪莎阿莎力，超讚。,The pizza is delicious and the wine is delicious. The focus is on Masesa.,False,0.381,0.0,0.619,0.8126
"東西好吃而且便宜
Cp值很高","The things are delicious and cheap
CP value is very high",False,0.404,0.0,0.596,0.7269
"氛圍很不錯 歌很舒服 調酒好喝老闆會一直招待
食物有很多驚艷的地方 披薩 燒烤 義大利麵","The atmosphere is very good.
There are many amazing places in the food. Pizza barbecue pasta",False,0.333,0.0,0.667,0.7902
我自認我嘴很挑 但這家披薩全台灣水準之上,"I think my mouth is very picky, but this pizza is above Taiwan's standard",False,0.0,0.0,1.0,0.0
"服務態度良好 調酒跟餐點都很不錯
有機會會再來光顧","The service attitude is good and the meals are very good
If you have a chance, you will come to visit again",False,0.299,0.0,0.701,0.796
餐點調酒都超棒,Meal bartending is great,False,0.577,0.0,0.423,0.6249
餐點很好吃！環境也很好 還有可愛的邊牧😍,"The meal is delicious!The environment is also very good, and the cute border herd 😍",False,0.387,0.0,0.613,0.8585
食物超讚,Superb food,False,0.804,0.0,0.196,0.6249
讚讚 推推 老闆很大方 瘋狂請shot,"Zanzan pushed the boss very generous crazy, please shot",False,0.415,0.181,0.404,0.539
披薩很好吃 調酒師很熱情,Pizza is very delicious bartender very enthusiastic,False,0.6,0.0,0.4,0.8169
"東西好吃 酒也超讚
重點是單男可來～妹子超讚","Good wine and wine
The point is that the single man can come ~ The girl is super happy",False,0.396,0.0,0.604,0.8885
"奶油鮮蝦義大利麵好吃
Shot也很適合酒感不好的人","Cream of fresh shrimp pasta is delicious
SHOT is also very suitable for people with poor alcoholic",False,0.26,0.134,0.606,0.4404
餐點有驚艷到，調酒很好喝順口，整體氣氛也很讚,"The meal is amazing, the bartender is delicious, and the overall atmosphere is very good",False,0.471,0.0,0.529,0.8932
酒好喝，披薩好吃，馬沙哥幽默！,"The wine is delicious, the pizza is delicious, Mashage is humorous!",False,0.563,0.0,0.437,0.8832
餐點很好吃，酒也很好喝，適合小酌愜意享受,"The meal is delicious, the wine is also delicious, it is suitable for drinking and enjoyment",False,0.458,0.0,0.542,0.9001
服務好，人員專業，餐點好吃,"Good service, professional personnel, delicious meals",False,0.623,0.0,0.377,0.765
服務好，酒好喝～～～👍🏻👍🏻👍🏻,"The service is good, the wine is good ~~~ 服务",False,0.42,0.0,0.58,0.7003
餐點好吃！整體氛圍感很好ʕ •ᴥ•ʔ,The meal is delicious!The overall atmosphere is very good • • ᴥ • ʔ,False,0.211,0.0,0.789,0.54
"李昇紘喝醉了
要我去載她","Li Shengzheng was drunk
Want me to carry her",False,0.121,0.224,0.654,-0.2732
調酒好喝，很熱情，很好下班小酌的好地方👍,"The bartending is delicious, very enthusiastic, very good place to drink off work 👍",False,0.47,0.0,0.53,0.8922
老闆會招待shot 很棒,The boss will entertain the shot is great,False,0.516,0.0,0.484,0.7506
老闆人超讚 在信義的優質好店不能錯過,The boss must not miss the high -quality good store in Xinyi,False,0.303,0.0,0.697,0.5178
餐點好吃 服務讚 酒好喝,"Meal delicious service, praise wine, drink delicious drink",False,0.688,0.0,0.312,0.9001
酒很好喝 老闆很帥 一定要來,"The wine is delicious, the boss is handsome, so you must come",False,0.408,0.0,0.592,0.7845
老闆親切，氛圍好~,The boss is kind and the atmosphere is good ~,False,0.441,0.0,0.559,0.743
妹子超多，東西好吃，酒有順,"There are so many girls, delicious things, and smooth wine",False,0.306,0.0,0.694,0.6077
店員很讚 老闆很讚 狗狗很讚,"The clerk is great, the boss is very good, the dog is very good",False,0.488,0.0,0.512,0.8882
酒好喝 下次可以試試看餐點,You can try the meal for a good drink next time,False,0.225,0.0,0.775,0.4404
調酒好喝～～～,Blooming is delicious ~~~,False,0.552,0.0,0.448,0.5719
好好好好吃 值得來,It's good to come and delicious,False,0.623,0.0,0.377,0.765
"老闆超讚，送一堆shot,老闆牛逼","The boss is so praised, send a bunch of shot, boss Niubi",False,0.272,0.0,0.728,0.6269
好吃又好喝好快樂,"It's delicious, delicious, happy",False,0.917,0.0,0.083,0.9022
老闆親切，餐點佳,"The boss is kind, the meals are good",False,0.512,0.0,0.488,0.743
披薩很好吃,Pizza is delicious,False,0.649,0.0,0.351,0.5719
馬莎調的酒絕對的,Marta's wine is absolutely,False,0.0,0.0,1.0,0.0
起司披薩，怎麼輸,"Cheese pizza, how to lose",False,0.0,0.403,0.597,-0.4019
餐點好吃 老闆客氣,"The meal is delicious, the boss is polite",False,0.346,0.0,0.654,0.5719
餐點好吃！推推❤️,The meal is delicious!Push ❤️,False,0.0,0.0,1.0,0.0
服務員超讚,The waiter is superb,False,0.577,0.0,0.423,0.6249
氣氛很好！,The atmosphere is good!,False,0.516,0.0,0.484,0.4926
為了馬莎二訪,For Martha's second visit,False,0.0,0.0,1.0,0.0
讚的 室外可抽菸,Praise the outdoor smoking,False,0.545,0.0,0.455,0.5574
烤蘋果披薩香爆,Baked apple pizza incense explosion,False,0.0,0.0,1.0,0.0
蜂蜜蘋果披薩推推,Honey apple pizza push,False,0.0,0.0,1.0,0.0
老闆很帥,The boss is very handsome,False,0.466,0.0,0.534,0.5413
順口 讚 來來來,Come on,False,0.0,0.0,1.0,0.0
服務很好,The service was excellent,False,0.552,0.0,0.448,0.5719
大哥我錯了,Brother I was wrong,False,0.0,0.508,0.492,-0.4767
聚會好地方,Good place,False,0.744,0.0,0.256,0.4404
氣氛佳,Good atmosphere,False,0.744,0.0,0.256,0.4404
欸讚👍,欸 👍 👍 👍 👍,False,0.0,0.0,1.0,0.0
俗擱大碗,Vulgar bowl,False,0.0,0.0,1.0,0.0
太讚讚讚讚讚讚讚讚了🫰🫰🫰,"Too praised praise, praise, praise, praise, praise,",False,0.955,0.0,0.045,0.969
Bartender 親切熱情，食物好吃，調酒很妹😋,"Bartender is kind and enthusiastic, the food is delicious, and the bartender is very sister 😋",False,0.407,0.0,0.593,0.8834
老闆很有趣 食物很好吃 酒很有風味 非常推薦 推薦迷迭香雞腿義大利麵,"The boss is very interesting food, delicious food, wine, very flavor, it is recommended, recommended rosemary chicken legs Italian noodles",False,0.398,0.0,0.602,0.861
我以前從未去過任何其他酒吧，但這是我在餐廳經歷過的最好的體驗之一。食物和飲料都很好，那裡的人也很好。如果您正在尋找酒吧，請務必嘗試這個地方。,"I have never been to any other bar before, but this is one of the best experiences I have experienced in the restaurant.Food and drinks are very good, and the people there are also very good.If you are looking for a bar, be sure to try this place.",False,0.225,0.0,0.775,0.933
好吃,tasty,False,0.0,0.0,1.0,0.0
這裡的工作人員非常隨和，是喝點飲料的好地方。,The staff here is very easy -going and is a good place to drink some drinks.,False,0.303,0.0,0.697,0.7264
食物很不錯，而且人們很樂意與之聊天:),"The food is very good, and people are happy to chat with it :)",False,0.474,0.0,0.526,0.8718
好喝好玩！ ！ ！ ！ ！ ！,It's delicious!IntersectionIntersectionIntersectionIntersectionIntersection,False,0.0,0.0,1.0,0.0
食物五告好吃的==,Food Five Ceremony is delicious ==,False,0.425,0.0,0.575,0.5719
友善店家…,Friendly shop ...,False,0.615,0.0,0.385,0.4939
很棒的酒吧🤍🤍 …,A great bar 酒 ...,False,0.506,0.0,0.494,0.6249
