Original,EN,Needs Review,Positive,Negative,Neutral,Compound
員工服務細心，食物好吃，調酒好喝,"Employee services are careful, food is delicious, bartending is delicious",False,0.562,0.0,0.438,0.8402
"推，有薄的有厚的，
表現的都很不錯👍🏾
店員也都非常Nice","Push, there are thin and thick ones,
The performance is very good 很
The clerk is also very nice",False,0.27,0.0,0.73,0.742
"田說五星老闆就去男模店
雞胸真的很好吃","Tian said that the five -star boss went to the male model shop
Chicken breasts are really delicious",False,0.19,0.0,0.81,0.6115
下次必須來老闆人很好，酒感,"The boss must be good next time, the wine feels, the wine feels",False,0.195,0.0,0.805,0.4404
"剛好在生日月的最後一天來到這，超熱情的招待，讓我受寵若驚，加上好喝精緻的調酒，好吃的料理，充滿故鄉台南的老宅bar風格，讓我覺得很幸運在台北遇到這家店！一定會約朋友再來！
今晚，感謝招待！（合十）","I came here on the last day of the birthday of the birthday. The super enthusiastic hospitality made me be flattered, plus delicious sake, delicious food, and the old house BAR style full of my hometown, which made me feel lucky to be in Taipei in Taipei Meet this shop!I will definitely ask friends again!
Tonight, thank you for your hospitality!(He 10)",False,0.354,0.0,0.646,0.9819
"很不錯的老宅氣息
調酒有特色 個人最喜歡春光乍洩
餐點部分除了麵，還有店員推薦的甜不辣都很好吃
補水也很快
而且服務人員好親切
值得推薦👍","Very good old house atmosphere
Sketching is characteristic. Individuals like spring light.
In addition to the meals, the sweetness recommended by the clerk is delicious
Moisturize quickly
And the service staff is so kind
It is worth recommending 👍",False,0.385,0.0,0.615,0.9621
氣氛舒適，環境乾淨。,The atmosphere is comfortable and the environment is clean.,False,0.462,0.0,0.538,0.7184
裝潢很復古，餐點真的超級好吃，調酒很有層次，是一個吃飯喝酒約會的好地方💗,"The decoration is very retro, the meal is really delicious, and the bartending is very layered. It is a good place to eat, drink, and date.",False,0.223,0.0,0.777,0.7841
很棒的酒吧，很舒服輕鬆的飲酒地方,"A great bar, very comfortable and relaxed place to drink",False,0.614,0.0,0.386,0.9033
調酒好喝，店內裝潢走懷舊風，非常讓人放鬆，薯條的蒜味很讚,"The bartending is delicious, the interior decoration of the store is pregnant, it is very relaxed. The garlic taste of the fries is very good.",False,0.321,0.0,0.679,0.8856
店員都很友善。調酒很好喝！推薦酸甜感平衡帶有果香跟茶味的橘次郎之春。,The clerk is very friendly.The bartender is delicious!It is recommended that the sweet and sour balancing Orange Jiro Spring with fruit aroma and tea flavor.,False,0.181,0.0,0.819,0.6239
服務熱情、東門喝酒好去處,"The service enthusiasm, drinking a good place in the east gate",False,0.392,0.0,0.608,0.7003
Bartenders 跟老闆都很親切好聊，加上老宅的氛圍，讓人好放鬆，小酌一杯，這個環境，挺讚的！,"Bartenders talks with the boss very kindly, and the atmosphere of the old house makes people relax. A drink, this environment is quite praised!",False,0.326,0.0,0.674,0.8801
很有氣氛的一間老宅酒吧，老闆偶爾還會跟客人閒聊，還順便招待shot,"A very atmosphere of old house bar, the boss occasionally chats with the guests, and also entertains Shot by the way",False,0.145,0.0,0.855,0.5267
超喜歡店裡氣氛💕酒好喝😘古宅超有fu,I really like the atmosphere in the store 喝 wine is good 😘 ancient house is super FU,False,0.366,0.161,0.473,0.7149
"店員親切服從態度良好
調酒還蠻有趣又好喝的～推薦","The clerk obeyed a good attitude
Blooming is quite interesting and delicious ~ Recommended",False,0.538,0.0,0.462,0.8923
"酒不錯
餐點選擇可以再多些","Good wine
You can choose more meals",False,0.326,0.0,0.674,0.4404
環境好氣氛佳店內裝潢走復古老宅風，很喜歡裡面輕鬆的氛圍，大推👏,The environment is good at the atmosphere.,False,0.326,0.0,0.674,0.4404
下班聚餐的好地方，氣氛不錯，酒跟餐點都好吃,"A good place for meals after get off work, the atmosphere is good, the wine and the meal are delicious",False,0.358,0.0,0.642,0.8591
調酒很好喝，食物也很不錯，真心推薦,"The bartender is delicious, the food is also very good, I really recommend it",False,0.468,0.0,0.532,0.8653
"近期酒吧餐酒館到處開
唯獨這間讓我有驚豔的感覺","Recently, bars and dining taverns are opened everywhere
Only this makes me feel amazing",False,0.226,0.0,0.774,0.5859
音樂沙發跟調酒都很優的新銳老宅酒吧 大安區罕見,"Music sofa and bartending are very good, the emerging old house bar, Da'an District is rare",False,0.176,0.0,0.824,0.4927
第一次覺得很不錯,I feel very good for the first time,False,0.313,0.0,0.687,0.4927
燈光美氣氛佳，酒好喝食物又好吃♥️,"The lights are beautiful, the wine is delicious and delicious ♥ ️",False,0.633,0.0,0.367,0.9477
人美、裝潢舒服、酒好喝，還不多去～,"People are beautiful, the decoration is comfortable, the wine is delicious, so I don’t go too much ~",False,0.421,0.0,0.579,0.8979
燈光美，氣氛佳，帶曖昧對象來一定中,"The lights are beautiful, the atmosphere is good, and the object of ambiguous objects must be in the middle",False,0.286,0.0,0.714,0.7783
新店開幕，服務跟酒都很棒,"The opening of the new store, the service and wine are great",False,0.272,0.0,0.728,0.6249
氛圍營造很用心,The atmosphere is very attentive,False,0.0,0.0,1.0,0.0
餐點異常好吃,The meal is extremely delicious,False,0.5,0.0,0.5,0.6115
東西好吃.久超好喝的啦！,The things are delicious.,False,0.552,0.0,0.448,0.5719
善變和烏龍院推推,Ficking up and pushing of Wulongyuan,False,0.0,0.0,1.0,0.0
好喝好吃氣氛佳,"It's delicious, delicious and delicious",False,0.847,0.0,0.153,0.9022
環境很好 讓人放鬆,The environment is very good to relax,False,0.56,0.0,0.44,0.7474
薯條好吃,French fries are delicious,False,0.552,0.0,0.448,0.5719
讚讚5星,Praise 5 stars,False,0.643,0.0,0.357,0.5574
非常特別值得去的酒吧,Very particular worth going to bar,False,0.303,0.0,0.697,0.2911
五星評價,Five -star evaluation,False,0.0,0.0,1.0,0.0
女店員很可愛,Female clerk is cute,False,0.5,0.0,0.5,0.4588
超級讚,Super like,False,1.0,0.0,0.0,0.7506
喜歡,like,False,1.0,0.0,0.0,0.3612
絕妙的好酒,Wonderful good wine,False,0.868,0.0,0.132,0.765
好吃好喝又好玩,"It's delicious, delicious and fun",False,0.843,0.0,0.157,0.8934
很棒的酒吧，完美的員工，總是照顧我們並尊重我們，同時與我們一起享受樂趣。這個月我們來過這裡兩次，強烈推薦！飲料也很棒！,"A great bar, perfect employees, always take care of us and respect us, and enjoy fun with us.We have been to here this month twice, highly recommended!The drink is also great!",False,0.513,0.0,0.487,0.9783
ㄤ,ㄤ,False,0.0,0.0,1.0,0.0
"舒服的！
好聊天！
好喝的！","Comfortable!
Good chat!
It's delicious!",False,0.843,0.0,0.157,0.8951
舒服,Comfortable,False,1.0,0.0,0.0,0.5106
Highball超好喝!!!,Highball is super delicious !!!,False,0.739,0.0,0.261,0.8582
超棒,Great,False,1.0,0.0,0.0,0.6249
享用一些冷飲的絕佳雞尾酒場所。,Enjoy some excellent cocktail venues for cold drinks.,False,0.535,0.0,0.465,0.7845
完美,Perfect,False,1.0,0.0,0.0,0.5719
寒意,chill,False,0.0,0.0,1.0,0.0
五星交流,Five -star exchange,False,0.0,0.0,1.0,0.0
很棒的地方,Great place,False,0.804,0.0,0.196,0.6249
