Original,EN,Needs Review
環境很好，服務很好，雞尾酒也很好喝,"The environment is very good, the service is very good, and the cocktails are also delicious",False
好地方。艾琳很棒。,Good place.Irene is great.,False
運動酒吧,Sports bar,False
生啤酒配魷魚乾,Raw beer with squid,False
良好的氛圍和優質的服務,Good atmosphere and high -quality service,False
世界盃好地方,World Cup good place,False
喝一杯和放鬆的好地方,Drink a cup and relaxing place,False
好地方好食物,Good place and good food,False
與朋友聚會的好地方,A good place to meet with friends,False
好的,OK,False
深夜喝酒。,Drink late at night.,False
很棒的氛圍,A great atmosphere,False
食物普普,Food,False
