Original,EN,Needs Review
"令人驚嘆的正宗法國小餐廳，

食物很美味，但這家餐廳真正的亮點是葡萄酒——侍酒師卡洛斯和女領班妮可將確保您不會忘記您的住宿。

如果你在天母地區 - 親自去看看你不會不滿意的，除了你希望份量更大，因為嘿太美味了，尤其是他們的魚類菜餚。

非常愉快的經歷，可以放心推薦，氣氛也很輕鬆。","Amazing authentic French restaurant,

The food is delicious, but the real highlight of this restaurant is the wine -the sommelier Carlos and the female leader Ban Nicole will ensure that you will not forget your accommodation.

If you look at it in the Tenmu area, you will not be dissatisfied, except for you, you want to have a larger portion, because hey is too delicious, especially their fish dishes.

A very pleasant experience, you can recommend it with confidence, and the atmosphere is easy.",False
'道地的南法料理精緻美味、不定期舉辦品酒與餐灑會、桌邊有專業侍灑師服務、讓賓客享用餐點賓至如歸感覺。 '.,"'The authentic South French cuisine is exquisite and delicious, holds wine tasting and meal sprinklers, and has a professional service teacher service at the table, so that guests can enjoy meals and guests.'.",False
我喜歡這個地方。這是我的最愛！,I like this place.This is my favorite!,False
環境太棒了！工作人員快速而友善，對葡萄酒非常了解。我第二次來這裡，食物很好吃！,"The environment is great!The staff is fast and friendly, and knows the wine very well.I come here for the second time, the food is delicious!",False
很棒的氛圍，精心製作的“法國鄉村”美食，優質的酒單（幾乎都是法國的）。強烈推薦。,"A great atmosphere, the ""French countryside"" food carefully made, high -quality wine lists (almost all France).Strongly recommended.",False
一家很棒的法國餐廳！,A great French restaurant!,False
這是城裡最好的小酒館。,This is the best tavern in the city.,False
"超神料理，加上完美的搭餐酒。
Oh là là, c’est magnifique !","Super God cuisine, plus perfect meal wine.
Oh là là, c’est magnifique!",False
食物很棒。環境溫馨但優雅。服務無可挑剔。,The food is great.The environment is warm but elegant.The service is impeccable.,False
美味的食物和良好的氛圍，牛排和海鮮是該地區最好的，是我們的最愛之一！,"Delicious food and good atmosphere, steak and seafood are the best in the region and one of our favorite!",False
很棒的法國餐廳！,Great French restaurant!,False
相當標準的法國菜。  食物品質很好。  雖然沒有真正彈出,Quite standard French cuisine.Food quality is very good.Although there is no real pop -up,False
可口的,Delicious,False
這個地方是一個隱藏的寶藏！  很棒的員工。很棒的食物。很棒的葡萄酒。,This place is a hidden treasure!Great employees.Great food.Great wine.,False
好吃！料理很棒，值得去吃,"tasty!The cuisine is great, it is worth eating",False
美味,tasty,False
田螺、肋眼牛排、薯條、蘑菇、麵包、奶油……葡萄酒……一切都太棒了！,"Tian snails, ribs, fries, mushrooms, bread, cream ... wine ... everything is great!",False
如果您在天母地區，附近的法式小酒館很不錯,"If you are in the Tianmu area, the nearby French tavern is very good",False
份量不小,The portion is not small,False
"🥰
好吃！ …","Bleak
tasty!Mowing",False
最好吃的法式料理～～,The best French cuisine ~~,False
很好吃的法式料理,Very delicious French cuisine,False
超過 40 多種單杯葡萄酒可供選擇,More than 40 single cups of wine to choose from,False
台北不錯的法國餐廳。,Good French restaurant in Taipei.,False
鄰裡偶像！以及未被發現的台北寶藏,Neighbor idols!And the Taipei treasure that has not been discovered,False
法餐~美酒~享受,French meal ~ wine ~ enjoy,False
"서비스優秀
牛排不錯","서비스 서비스 秀 서비스
Steak good",False
美妙的食物美妙的酒,Wonderful food and wonderful wine,False
好吃啊😋,Delicious,False
肉的筋太多...,There are too many meat muscles ...,False
好的,OK,False
不過還好！,But okay!,False
不錯,good,False
