Original,EN,Needs Review
"店內氣氛溫馨 老闆店員人都超好
不只咖啡好喝 還有酒可以喝 用的酒杯也超讚
能不來嗎？","The atmosphere in the store is warm boss shop staff is super good
Not only the coffee is delicious, but also the wine glass that can be used for wine is also very happy
Can you come?",False
"☕️咖啡好喝👍
沖泡的老闆很詳細的介紹

多款式不同款式手工玻璃杯！🥂
喝起來真的有不同的風味！🍷🍇","👍️ Coffee is delicious 咖
The brewing boss is very detailed introduction

Multi -style different styles of handmade glass!Bleak
It really has a different flavor!Bleak",False
老闆專業親切~  非常值得來尋寶,The boss is professional and kind -worthy of treasure hunting,False
很棒的體驗，老闆很專業也很有耐心,"A great experience, the boss is very professional and patient",False
網路購買 東西好像是福利品 封條拆了,It seems that the purchase of things on the Internet seems to be a welfare product sealing,False
"🥰喜歡它
氣氛很好","I like it
The atmosphere is very good",False
