Original,EN,Needs Review
"這是一家 師大附近
覺得很讚 又有點詭異的BAR

1. 禮拜一 有開
2. 九點前有 happy hour
3. 起司超好吃
4. 音樂是英式迷幻風嗎？

啤酒派的我 無法形容太多
有 無敵新鮮 生 Asahi
還有 23 Public的 Taiwan No1
台虎 唯一喝的 TAIHU IPA
我愛喝的campari shot
PS: 發音 [kæmˈpɑ:ri]

只能愛了 😍
何時相遇的酒吧 與人  都是注定的~","This is near a Normal University
I think it's great and a little weird Bar

1. Once you worship
2. Happy Hour before nine o'clock
3. The cheese is super delicious
4. Is music a British psychedelic style?

I can't describe too much in the beer school
There is an invincible freshheng asahi
There is also 23 PUBLIC TAIWAN NO1
The only taihu ipa that Taiwanese tiger drinks
I love to drink Campari Shot
Ps: pronunciation [kˈm 发pɑ: ri]

I can only love
When the bars meet are doomed ~",False
台電大樓站旁有一家風格獨特的酒吧，彷彿城市中的一處綠洲。充滿中國風格的裝潢，卻不失神秘與俏皮的氛圍。這裡提供多樣的啤酒選擇，包括生啤與精釀，但讓人意外地也能品嚐到精緻的白紅酒，且價格實惠貼心。店內供應的食物偏向蔬食，為健康養生的顧客提供了更多選擇。總的來說，這是一家令人讚嘆的好地方，值得多次光臨,"There is a unique bar next to Taipower Building, like an oasis in the city.The decoration full of Chinese style is not lost without mystery and playful atmosphere.There are a variety of beer choices, including raw beer and crafts, but it can also taste exquisite white wine, and the price is affordable and intimate.The food supplied in the store is biased towards vegetables and food, providing more choices for health care customers.In general, this is a good place to be amazing, and it is worth visiting many times.",False
"113.06.17（星期一）造訪
蠻有風格的一家酒吧！調酒也都蠻特別的～而且價位不貴！適合小酌的地方👍","113.06.17 (Monday) Visit
There is a style of style!Blooming is quite special ~ and the price is not expensive!Suitable for drinking 的",False
"台電大樓站旁的有風格酒吧
感覺就是在城市的一角有著一個綠州一樣
裡面的風格應該偏中國風
不應該是東方風格
帶點神秘又有些俏皮

裡面有不少的啤酒可以選擇
有生啤或是精釀
可是這氣氛讓我想來點白紅酒
價格也實惠
真是一家佛心的店

還有一些食物可以選擇
可是應該是偏蔬食
很棒的好地方","There is a style bar next to Taipower Building Station
It feels like a green state in the corner of the city
The style inside should be Chinese style
It should not be oriental style
A little mysterious and a little playful

There are a lot of beer in it to choose from
Have raw beer or craft
But this atmosphere made me want to have some white red wine
Price is also affordable
Really a Buddha's heart shop

There are some foods to choose from
But it should be partial vegetables
A great place",False
有點小失望，只能點酒單上面的酒，沒有經典調酒。例如Side car、old fashion或between the sheet之類的，希望之後可以增加一些經典調酒，之後應該是不會再來了。,"A little disappointed, you can only order the wine on the wine list without classic bartending.For example, Side Car, Old Fashion, or Between The Sheet. I hope that some classic bartending can be added later, and it should not come again.",False
燈光美，氣氛佳，裝潢別緻，價格實惠，值得再訪,"The lights are beautiful, the atmosphere is good, the decoration is unique, the price is affordable, it is worth visiting",False
"調酒、生啤、精釀都有。低消$300。
調酒漂亮，酒感不重，但價位中上，適合小酌喝舒適氣氛的。
精釀選的都很有品味！
會有每天不同的當日優惠酒款。

看似是美式酒吧，實際裝潢卻滿滿的中式風格，但完全不違和，非常特別。
把大紅色的中式特色都融入裝潢裡，卻又有種美式的狂野任性感，各個角落都非常精細，還有很多小小的有趣細節，看得出來店家非常用心佈置。

外面有吸煙區，當時蠻多外國客人都坐在戶外區，感覺讓人很自在的店。
Bartender似乎是比較有個性的那種，當天沒有多聊，但下次有機會會想要聊幾句。

整體很推，各方面都無可挑剔。","Alcohol, raw beer, and crafts.Low $ 300.
The bartender is beautiful and the wine feels not heavy, but the price is suitable for drinking a comfortable atmosphere.
The craft selection is very delicious!
There will be different discounts every day.

It seems to be an American bar, but the actual decoration is full of Chinese style, but it is completely unacceptable and very special.
The big red Chinese characteristics are incorporated into the decoration, but there are American wild will be sexy. All corners are very fine, and there are many small interesting details. It can be seen that the store is very careful.

There were smoking areas outside. At that time, many foreign guests were sitting in the outdoor area, and it felt very comfortable.
Bartender seems to be more individual. I didn't talk much on the same day, but I would like to talk a few words next time.

The overall push is very pushing, and it is impeccable in all aspects.",False
"位於捷運站出口外，地點交通超級方便。有低消。位子多，室外也可以坐。啤酒好喝、有調酒，食物好吃。
除此之外那吸引人的還有裝潢，玲琅滿目又微妙的平衡，實在讓人想多看幾眼。吃完夜市的美食後想來點放鬆的酒精，這裡是很推薦的選項！","It is located outside the MRT station exit, and the locations are super convenient.There is a low.There are many seats, and you can sit outdoors.Beer is delicious, alcohol, and delicious food.
In addition, the attractive decoration, the dazzling and delicate balance, really makes people want to see a few more.After eating the food of the night market, I want to have some relaxed alcohol. This is a recommended option!",False
"店員沒什麼服務，交通超方便
就在台電大樓站出口旁邊
店內裝潢挺講究，雖然店不大卻很有氣氛
酒都偏淡，shot不錯
如果沒什麼選擇，又想找不貴的地方坐下來聊聊，可以考慮","The clerk has no service, the transportation is super convenient
Just next to the exit of Taipower Building Station
The interior decoration of the store is very particular, although the store is not large, it is very atmospheric
The wine is lighter, the shop is good
If there is no choice, you want to find a place to sit down and chat, you can consider",False
Alfred精釀之旅：台北 The Shrine，來自英國的Lee開了6年的店，主要服務師大附近的外國留學生和居民，近捷運站，也會有上班族來喝一杯，走平價路線,"Alfred craft trip: Taipei The Shrine, a store from Lee from the UK for 6 years. It is mainly a foreign student and residents near the teacher's University.",False
"這間bar風格屬於異國混合風,空間小巧,聊聊喝喝吃吃是舒適的,如果想要安靜一點,建議早一點過來~
長島這一杯喝完 東西南北摸不著方向~一定要搭別的東西喝,毛豆,爆米花 .....","This BAR style belongs to a foreign mixed style, small space, and it is comfortable to talk about drinking and eating. If you want to be quiet, it is recommended to come earlier ~
This cup of Long Island can't touch the direction after drinking the north and south ~ Be sure to drink other things, edamame, popcorn ...",False
"instagram: kou_vintage (賣古著的)

廁所的門是用啦的不是推的
氣氛很棒
非常chill的bar
起士拼盤非常適合配酒","Instagram: Kou_vintage (selling ancient)

The door of the toilet is used, not pushed
The atmosphere is great
Very Chill's Bar
The cheese platter is very suitable for wine with wine",False
酒好喝，價格實惠，音樂好聽，會再訪。,"The wine is delicious, the price is affordable, the music is good, and you will visit again.",False
"印度雞肉瑪薩拉咖喱超好吃！被酒精耽誤的咖喱店😍
巧遇週三淑女之夜贈一杯招待酒，不是小杯shot而是一大杯調酒，受寵若驚！還很好喝欸！看完「咒」再來這裡顯得更有感覺得，店內裝飾很特別！ …","Indian chicken Masala curry is super delicious!Curry shop delayed by alcohol 被
Coincidentally, on Wednesday Lady's Night, a glass of entertaining wine, not a small cup of shot but a large cup of bartending, being flattered!It's delicious!After reading the ""Mantra"", I feel more here. I feel that the interior decoration is very special!Mowing",False
很有氣氛的酒吧，調酒好喝，氣氛不錯，也很乾淨。很適合休息聊天👍👍 …,"A very atmospheric bar, the bartender is delicious, the atmosphere is good, and it is very clean.Very suitable for rest and chat 休 ...",False
"素食為主的Bar，有賣精釀啤酒、生啤酒、調酒、醇飲，店內裝潢很明亮，還有亞洲風格？裡面的外國人真的很多......
我們點的餐點都還不錯吃✌🏻
🥔炸馬鈴薯，是帶皮的，搭配番茄美奶滋超搭🤣🤣🤣
🥔牧羊人派，下面滿滿是菇和醬，上面是馬鈴薯泥
🥔千層麵真的很麵粉？但也不算不好吃......
酒類除了點生啤酒23可可娜神神拳，味道滿特別的!!!!!'
長島冰茶真的酒感滿重的，但很好喝
日義大利，琴酒為基底!!!!!!
白酒桑格利格，看起來還不錯吃，餐廳佈景深的
#美食 #heShrine #台北餐酒館 #Bistro #台電大樓站美食 #台北酒吧","Vegetarian BAR, which sells craft beer, raw beer, bartender, mellow drink, the interior of the store is bright, and Asian style?There are really many foreigners in it ...
The meals we ordered are pretty good ✌🏻
是 Fried potato, with skin, with tomato beautiful milk
， Shepherd, full of mushrooms and sauce below, potato puree above
很 很 🥔 🥔 really flour?But it's not delicious ...
In addition to ordering beer 23 cocoa god boxing, the taste is full of special !!!!!!
Long Island Ice Tea is really heavy, but it is delicious
In Italy, piano wine is based on !!!!!!!
Baijiu Sanglig, it looks pretty good, the restaurant is deep
##Heshrine #Taipei Restaurant #Bistro # #Taipei Bar",False
風格特別但位置不多的小酒吧，氣氛輕鬆自在，三五好友一起聚聚喝酒聊天的好地方！,"The style is particularly stylish but not much position, and the atmosphere is relaxed. The three or five friends gather together to drink and chat together!",False
16:00- 21:00的happy hour令人感動，裝潢相當獨到，裡面飄散著某種特別的麝香味，吃的是啤酒加一片披薩的兩百元套餐，迷迭香下手過重，另點的胡蘿蔔蛋糕很綿密，味道不錯，跟啤酒很搭，去的人不妨一嚐。,"16: 00-21:00 Happy Hour is moving, and the decoration is quite unique. There is some special musk in it. Eat a 200 yuan package for beer and a pizza. The carrot cake is dense, the taste is good, and it is very good with beer.",False
環境非常舒適，裝潢與擺設都非常有特色，很有名字：shrine 聖殿的感覺，非常酷！happy hours的vodka&lime還不錯，乳酪蛋糕好吃，肉桂捲大推！非常香非常美味！會想再次拜訪的一家店，很喜歡哦。,"The environment is very comfortable, the decoration and furnishings are very distinctive. It is very named: the feeling of the Shrine Temple, very cool!HAPPY HOURS's Vodka & Lime is pretty good, cheese cake is delicious, cinnamon rolls are pushed!Very fragrant and delicious!A shop I want to visit again, I like it very much.",False
"感謝同事們在我人生低潮（？）的時候帶我來喝個酒
環境風格很有特色，非常喜歡
有happy hour的時段，但提供的就是一般常見的虎牌啤酒跟Whiskey Coke, Vodka Lime
另外調酒就略為普通，喝了就是，嗯xD
應該會有比這家好喝的酒吧～
但是勝在
1.價格真的是學生價
2.離捷運超近
如果是以要放鬆閒聊的話蠻推薦的，但如果是想喝好喝的專業的，就先pass摟w
很適合放空的坐著、小酌、聽個音樂沈澱一下","Thank you colleagues for taking me a drink when my life is low (?)
The environmental style is very distinctive, I like it very much
There are happy hours, but what is provided is common tiger beer and Whiskey Coke, Vodka Lime
In addition, bartending is slightly ordinary, just drink it, um XD
There should be a delicious bar more delicious ~
But win
1. The price is really a student price
2. Close to the MRT
If you want to relax and chat, it is quite recommended, but if you want to drink a good major, you will be PASS first
It's very suitable for sitting, drinking, listening to a music precipitation",False
特別想說一位黑長髮女店員(有著美美的像是金龜子金屬色指甲油）態度超好又專業，有三顆星都是給她的，謝謝她的服務～另一顆星是店內裝潢酷。Pika ◉‿‿◉,I especially want to say that a black long -haired female clerk (with beautiful ones like golden turtle metal nail polish) is very good and professional. There are three stars for her. Thank you for her service ~ The other star is cool in the store. EssencePika ◉‿‿◉,False
"The Shrine 位在台電大樓捷運站四號出口附近，超級好找，我這大路癡都可以輕鬆找到。

外觀黑的徹底，裏頭色彩鮮豔並帶有異國風情與東方色彩，連氣味也是，非常特別的一家店。

餐點跟飲品因為在學區所以不算貴，香菇蔬菜餃$150、焗烤千層麵$240、布朗尼$140。

整體口感很不錯，用餐環境也很舒適。","The Shrine is located near the exit of No. 4 of the Taipower Building MRT Station. It is super easy to find. I can easily find this big road.

The appearance is completely dark, with bright colors and exotic style and oriental colors. Even the smell is also a very special shop.

The meal and the drink are not expensive because of the school district. The mushrooms and vegetable dumplings are $ 150, the grilled thousands of levels are $ 240, and the Browni is $ 140.

The overall taste is very good, and the dining environment is also very comfortable.",False
"店員拍照技術很好👍
店內音樂跟氛圍都覺得很舒適
颱風天還有營業是個救贖也辛苦店內人員了～","The clerk's photo technology is very good 照
The music and atmosphere in the store feel very comfortable
Typhoon Tian and business are a redemption and hard -working person in the store ~",False
酒還不錯喝，爆米花有點沒什麼味道，水餃以素食的來說算好吃！很多外國人，可能都是師大的外籍生（？服務人員態度都很好！服務也很好！,"The wine is not bad, the popcorn is a bit tasteless, the dumplings are delicious in terms of vegetarian food!Many foreigners may be foreign students of the Normal University (? The service staff is very good! The service is also good!",False
裝潢相當特別的酒吧，有混合印度、中國風的感覺，每天4-9pm是happy hour，每杯130很划算，調酒蠻實在不偷工減料，推,"The decoration is quite special bar, which has the feeling of mixed India and Chinese style. 4-9PM every day is Happy Hour. 130 per cup is very cost-effective.",False
"靠近台電大樓4號出口。酒類、食物價錢合理，Happy Hour酒錢很便宜！
酒吧的裝潢風格挺特殊的XD融合了各種宗教元素，有種神秘的異國氛圍。","Exit near Taipower Building 4.The price of wine and food is reasonable, and the wine money is cheap!
The decoration style of the bar is very special XD that combines various religious elements, with a mysterious exotic atmosphere.",False
台電大樓四號出口出來就到了！超方便！很有宗教特色的酒吧，重點是酒價格不貴，適合跟朋友約小酌，很多老外客人，店面不大，一定要到櫃檯點餐唷！,"The export of Taipower Building No. 4 will arrive!Super convenient!A very religious bar. The focus is that the price of the wine is not expensive. It is suitable for friends with friends. Many foreigners and guests, the store is not large, be sure to order at the counter!",False
"每日15:00-21:00有Happy Hour很貼心
一個人帶電腦去 有插座可以使用 也不會被趕👍🏻
只不過因為是營業到02:00的咖啡廳酒吧
所以比較不適合做需要思考的事情唷～
是個很適合跟三五好友聚會的地方🍻","15: 00-21: 00 daily happy hour is very intimate
If a person takes a computer to a socket, you can use it to use it or you will not be rushed.
It's just because it is a cafe bar at 02:00
So it's not suitable for doing things that need to be considered ~ ~
It is a place that is very suitable for meeting with three or five friends.",False
"欸都…..因為看到評論評價很好人在附近決定在那邊續攤，發現酒的品質普遍很差+調味也很可怕（我跟朋友分別點了old school & sangria)，點了一杯sangria味道酸臭有一個壞掉的味道，第一次發現原來這種安全牌的調酒也會失敗🥺
喝不到一半覺得胃開始不舒服，不敢喝完。
優點是環境不錯氣氛蠻好的。 …","评 看到 欸 欸 ... because I saw a good comment, a good person decided to continue the stall there, and found that the quality of the wine is generally poor+seasonings are terrible (I ordered Old SCHOOL & SANGRIA respectively, and ordered a cup of Sangriaa The taste sour has a bad taste. For the first time, I found that the original savage tuning will also fail.
I felt uncomfortable when I didn't drink it, and I didn't dare to finish it.
The advantage is that the environment is good. The atmosphere is pretty good.Mowing",False
"非常喜歡這裡裝潢的調性。
東西好吃，是蔬食，純素的只有香菇水餃。一小杯咖啡雞尾酒要$200……請自己評估貴和便宜。除此以外很酷的店，下次會再來。","I like the tone of decoration here very much.
It is delicious, vegetables, and the only vegan is mushroom dumplings.A small cup of coffee cocktail is $ 200 ... Please evaluate your own expensive and cheap.In addition, the cool shop will come again next time.",False
"氣氛不錯，朋友說調酒偏藥水流
店員很有個性 (不知道是不是心情不好，臉色不算好)
要有點心理準備，不能說是很好的體驗","The atmosphere is good, friends say
The clerk is very individual (I don’t know if I am in a bad mood, my face is not good)
If you have a little psychological preparation, you can't say it is a good experience",False
"整體來說是滿推薦的一間店。
服務很好，調酒算是有CP值但較為平庸。
Happy Hour的基本酒款真的是很划算，比較推薦這些！
/
調酒晚上才供應，下午3點以後有供應Happy Hour的酒。
3pm-9pm是Happy Hour，
Gin Tonic, Whiskey Coke, Vodka Lime, 紅白酒跟台虎925生啤都是110元。
/
The Shrine算是滿特別的，白天是咖啡店，晚上則轉換成酒吧。
個人比較喜歡晚上的調調，有燈籠真的大加分。
白天則因為店面較小，又有很多靠窗座位會直接靠騎樓外側，
所以感覺比較尷尬一點xD
/
餐點部分有試過幾項：

蒜蒜與莎莎簡單來說就是焗烤大蒜麵包附上莎莎醬。
滿用心也很好吃，但個人覺得莎莎醬沒有到相輔相成，會淡化大蒜跟起司的味道，也會影響麵包的酥脆度。
但無論如何，他還是一份有CP值且好吃的料理。

爆米花就是...爆米花。
本次店員有招待一小碗爆米花，謝謝店員 :)
鹹鹹的挺配酒。

披薩是一片大大的披薩，還算有厚度料也滿多，比很多連鎖披薩好了。
一片賣90元還算可以接受，但就沒有特別之處囉。

千層麵味道還不錯，價格也算是合理。
會附上兩塊小佛卡夏讓你配著吃，喜歡千層的可以試試看。
/
酒類有試過Happy Hour的台虎925生啤、琴通寧、Vodka Lime
另外也嘗試過晚上的長島冰茶。

前三樣都是110元，喜愛程度大概是琴通寧>台虎925>Vodka Lime。
但這些都就是基本款（生啤就只是弄到杯子而已XDD)
琴通寧跟Vodka Lime的酒味也有到位，很OK。
又比其他店家便宜，雖然小了一些但我覺得還是很有CP值。

長島冰茶個人覺得比較普通，喝起來並沒有那麼順口。
酸甜味較濃，又有點水了一些，但可能是個人喜好問題，可以試試看。
但整體來說還是OK，但CP值相較Happy Hour的酒們就是比較平庸一點。
（被Happy Hour養壞了）

整體來說我應該會給4~4.5星吧xD
但店員態度都滿好的，第一次有協助換位+請爆米花，
第二次有大位子也主動詢問是否要換位，相當貼心。
服務生態度直接幫忙補到5分xDD
很推薦白天想喝酒或有不喝酒的朋友可以拖來這裡拜訪~","Overall is a recommended shop.
The service is very good, and the bartending is a CP value but more mediocre.
Happy Hour's basic wine is really cost -effective, and it is recommended!
/ /
Skymoring is only available at night, and wine supplied to Happy Hour after 3 pm.
3 PM-9PM is Happy Hour,
Gin Tonic, Whiskey Coke, Vodka Lime, red and white wine and Taiwanese tiger 925 raw beer are 110 yuan.
/ /
The shrine is full of special, it is a coffee shop during the day, and it is converted into a bar at night.
Personally, I like the tone at night. There are really big points for lanterns.
During the day, because the storefront is small, there are many windows relying on the windows of the windows directly on the outside of the building.
So it feels embarrassing a bit XD
/ /
There are a few trials in the meal part:

In short, garlic and Sasa are baked and grilled garlic noodles with Sasa sauce.
It is also delicious, but I personally think that Sasha sauce is not complementary, it will fade the taste of garlic and cheese, and it will also affect the crispyness of the bread.
But in any case, he is still a CP value and delicious dish.

Jump rice flowers are ... popcorn.
This clerk has entertaining a small bowl of popcorn, thank you the clerk :)
Silently matched with wine.

Pizza is a large pizza, and there are still a lot of thickness, which is better than many chain pizza.
It is acceptable to sell 90 yuan, but there is nothing special.

The taste of the thousand levels is not bad, and the price is reasonable.
There will be two pieces of small Buddha Kaxia for you to eat. Those who like a thousand layers can try it.
/ /
There are Taiwanese tiger 925 raw beer, Qin Ning, Vodka Lime, who have tried Happy Hour
In addition, I also tried long island ice tea at night.

The first three are 110 yuan.
But these are the basic models (just getting the cup for raw beer XDD)
Qin Tongning and Vodka Lime have also been in place, which is OK.
It is cheaper than other stores. Although it is smaller, I still think it has a CP value.

Long Island Ice Tea personally feels more ordinary, and it is not so smooth.
The sweet and sour taste is strong and a little water, but it may be a problem with personal preferences. You can try it.
But it is OK as a whole, but the CP value is more mediocre compared to the Happy Hour.
(Raised by Happy Hour)

On the whole, I should give 4 ~ 4.5 stars xd
However, the staff attitude is good. For the first time, I will assist in the replacement+please popcorn,
For the second time, there was a big place and also asked if it was necessary to change the place, which was quite intimate.
The service ecosystem directly helps to make up for 5 points XDD
It is recommended that friends who want to drink or drink during the day can be dragged here to visit ~",False
"店家整體裝潢融合詭異以及強烈的異國宗教風情，非常看個人喜好。
餐點的部分吃的選項有點少，但千層麵出餐很快且還不差，就是分量略少。
調酒的部分價位不貴但選項和量都有點少，啤酒時常有優惠。","The overall decoration of the store is weird and a strong exotic religious style, which depends on personal preferences.
The options for the meal are a bit less, but the meals at the thousands of levels are very fast and not bad, but the weight is slightly less.
The price of part of the bartender is not expensive, but the options and quantities are a bit small, and there are often discounts in beer.",False
店員有時候態度不好 要做好心理準備 酒還不錯,Sometimes the clerk's attitude is not good to prepare for the psychological preparation.,False
氛圍相當熱鬧的一家小店，酒類選項不少，但是長島冰茶不太好喝，啤酒相對很安全。內部裝潢混合多種亞洲文化，很有意思。,"A small shop with a very lively atmosphere, there are many wine options, but Long Island ice tea is not very delicious, and beer is relatively safe.The interior decoration is mixed with a variety of Asian culture, which is very interesting.",False
"非常特別的一間小酒吧！在裡面你可以看見各種宗教的神像或是代表，但是可能我對於這種無形界的很敏感，所以進去之後，身體很不舒服。
餐點的部分，它的葡萄牙咖啡，搭配的會讓人超乎想像！","A very special bar!You can see the idols or representatives of various religions, but maybe I am very sensitive to this intangible world, so after entering, my body is uncomfortable.
For the meal part, its Portuguese coffee will be beyond imagination!",False
