Original,EN,Needs Review
師大旁邊一間新的店～咖啡很好喝 跟店內甜點非常搭調！甜點斯康跟肉桂捲都是手工製作的喔 非常好吃😋店內風格華麗又充滿趣味～是一間適合三五好友一起來聚聚舒服的店喔！ …,A new shop next to the Normal University ~ Coffee is very delicious with the dessert in the store!Dessert Sikang and cinnamon rolls are handmade. It is very delicious. The style of the shop is gorgeous and full of fun ~ It is a shop that is suitable for three or five friends to gather comfortably together!Mowing,False
"ㄧ個好地方、被工讀生搞垮、工讀生不知變通、室內煙味那麼重、竟然跟我說外面不能抽雪茄、過了晚上7點沒有菜單上的美式咖啡、拿鐵等等、剩酒跟冰釀咖啡、試問冰釀咖啡跟美式喝起來不是一樣嗎？拿小水杯裝、賣比冰美式貴40，天曉得是不是被你們A走。

欲前往者三思","A good place, the crash of the workers, the unknown of the working students, the smell of indoor smoke is so heavy, I told me that the cigars cannot be smoked outside, there is no American coffee, latte, etc. on the menu at 7 pm Isn't it the same as Ice coffee, iconic coffee is the same as American style?Take the small water cup and sell it more expensive than the ice American style. God knows if it is taken away by you.

Think twice",False
店員推薦的餐點都蠻好吃的，調酒就非常普通，不過一般的啤酒之類的就還不錯，價格也非常ok，特別推薦店員服務很好喔～,"The meals recommended by the clerk are quite delicious, and the bartending is very common, but the general beer is good, and the price is very OK. The special recommender is very good.",False
一間異國風的酒吧 下班後跟朋友來聊天的絕佳地點,A exotic bar to chat with friends after get off work,False
小胖妞服務態度很差,Little Fat girl service attitude is poor,False
酒讚讚氣氛也讚讚，手機忘在店裡店員還會幫自己留紀念照(^_^)a 有夠可愛,"Jiu praise the atmosphere and praise, the mobile phone forgot in the store will also help themselves to keep commemorative photos (^_^) A is cute enough",False
裝潢不錯，人很多，但調酒蠻普通的，當天喝了四款不同口味調酒，沒有特別驚艷。,"The decoration is good, there are many people, but the bartender is quite ordinary. I drank four different flavors of alcohol that day, not particularly amazing.",False
熱紅酒很普通，長島冰茶亦是，只有非調酒飲品能入喉,"Hot red wine is very ordinary, as well as Long Island ice tea, only non -alcoholic drinks can enter the throat",False
"音樂很有特色又有品味
Bartender熱情過頭
整個空間都很熱鬧又不會太吵
爾且整間店的牆壁都是老闆的作品
稀奇古怪的通通來","Music is very distinctive and tasteful
Bartender enthusiastic
The whole space is very lively but not too noisy
The walls of the entire shop are the works of the boss
Strangely coming",False
會放 Men I Trust 的酒吧，愛死，去哪裡找？快來！,"I will put the Men I trust bar, love to die, where can I find?Come!",False
已經不知道是第幾次被附近居民叫警察來制止酒客大吼大叫了，完全無視附近居民的一家爛店，從開店以來就持續有深夜吵鬧問題，但是店家背台很硬吧，外國人老闆就是屌，吃定有AIT當靠山警察不敢管是吧~囂,"I don't know if it was the first time that the nearby residents called the police to stop the wine guest yelling and yelled, completely ignoring a rotten shop of nearby residents. Since opening the store, there has been no problem in the night. The boss is a puppet, and the ate of AIT should be a backing police.",False
還不錯，算比較有聲音的酒吧，但酒不太合我個人口味就是了,"Not bad, the bar that is more sound, but the wine is not very good at me.",False
"真可惜本來很喜歡的
上次喝到一半被趕
酒都還沒喝完欸⋯⋯
又不是沒有加點 傻眼","It's a pity
I was drunk half last time I was driven
The wine hasn't been drank yet ⋯ ⋯ ⋯ ⋯ ⋯
Didn’t you add a little dumbfounded?",False
非常美的酒吧 不喝酒的人也有很多選擇 服務很貼心 很推蛋糕 酒吧內空氣也很好,"A very beautiful bar does not drink alcohol also have many choices of services, very intimate, push the air in the bar and the air in the bar is also very good",False
地點方便，調酒好喝，氣氛佳！非常適合獨自或跟親友小酌的地方。,"Easy place, good bartender, good atmosphere!It is very suitable for places where you are alone or with relatives and friends.",False
裝潢有特色。happy hour到9pm很不錯。調酒大多是基本款，有一定水準。,"The decoration is distinctive.Happy Hour to 9pm is very good.Most of the bartending is the basic model, with a certain level.",False
"Vodka lime跟檸檬生啤好好喝
爆米花調味超讚 超大份 有夠唰嘴
店員人很好
Happy hour很划算～❤️","Vodka Lime and Lemon Brewery
Jiemi flowers are beautiful and super large, there are enough pouting
The clerk is very good
Happy Hour is very cost -effective ~ ❤️",False
"很舒適，有點英式+日本神社的風格
食物也好吃，價位合理，適合小酌的好地方","Very comfortable, a bit British+Japanese shrine style
The food is also delicious, the price is reasonable, and it is suitable for a good place for drinking",False
訂個位態度很差 店員講完還直接掛電話的,"Booking a position is very poor, the clerk is still hung up after finishing talking",False
調酒一般般，spicy rum 味道真的奇怪的，要有心理準備,"Like bartending, Spicy Rum tastes really strange, you have to prepare psychological preparation",False
"氣氛佳、很休閒、讓人很放鬆
裝潢融合多國特色很特別
雞尾酒好喝","Good atmosphere, very casual, and relaxing
The characteristics of the decoration are very special
Cocktails are good",False
酒類很有誠意，只是食物選擇太少，烤薯角療癒好吃，但小披薩不怎麼樣,"The wine is very sincere, but there are too few food choices. The grilled potato corner therapy is more delicious, but the small pizza is not very good.",False
氣氛很好，下酒菜選擇比較少一些。,"The atmosphere is very good, there are fewer choices for wine and vegetables.",False
剛離開，找錢不老實，不過已經離開現場了才發現因此沒多說什麼。去的人請多留意現場男店員,"I just left and it was not honest to find money, but I had left the scene before I found that I didn't say much.For those who go, please pay more attention to the on -site male clerk",False
"很帥的店
調酒好喝
氣氛環境超棒超舒適！
非常適合好友聚會的地方","A handsome shop
Blooming is delicious
The atmosphere environment is super comfortable!
It is very suitable for friends to meet",False
環境舒適，但是上週五的男生長髮店員態度非常惡劣，非常沒有禮貌，所以不會再去了。,"The environment is comfortable, but last Friday, the boys' long -haired clerks were very bad and very polite, so they would not go again.",False
酒好喝、音樂好聽、店員誠懇，混合東南亞元素的擺設頗具巧思。,"The wine is good, the music is good, the clerk is sincere, and the layout of the mixed Southeast Asian elements is quite ingenious.",False
裝潢很棒，氣氛很好，走過經過喝杯咖啡喝杯啤酒都很享受，很值得推薦的地方,The decoration is great and the atmosphere is very good. It is very enjoyable to walk through drinking a cup of coffee and drinking beer. It is worth recommending,False
感覺來到了無神主義的一家酒吧；相當具有自己特殊的感覺與特色！推薦大家前往一探究竟,I feel like I have come to a dedicated bar; it has its own special feelings and characteristics!Recommend everyone to find out,False
環境風格特別，氣氛不錯，但調酒目前喝到的都有點普通,"The environmental style is special and the atmosphere is good, but the current drinking is a bit ordinary drinking",False
輕鬆舒服的酒吧，酒款選擇不多但品項還行，也有調酒，窗邊開窗很舒服,"A relaxed and comfortable bar, there are not many choices of wine, but the items are okay. There are also bartending. The window on the window is very comfortable.",False
"飲料好喝
但服務人員態度極差
抱歉也只能給1星了","Drinks delicious
But the attitude of the service staff is poor
Sorry, you can only give 1 star",False
Nice place，位置相對較少較小，happy hour時段很划算,"NICE PLACE, relatively small position, Happy Hour time is very cost -effective",False
很有特色的酒吧，裝飾很特別，酒也不貴！,"Very distinctive bars, the decoration is very special, the wine is not expensive!",False
happy hour 3-9 pm. 有一些酒類120元，很划算，氛圍也不錯,"Happy Hour 3-9 PM. There are 120 yuan of wine, which is very cost-effective, and the atmosphere is also good",False
"真的很shrine的店！
裡面像一間小美術館，下午坐在窗邊座位很舒適～期待下次來喝酒！","Really Shrine's shop!
It is like a small art museum. It is very comfortable to sit by the window in the afternoon ~ Looking forward to drinking next time!",False
超棒的 奇異美學！,Abottic strange aesthetics!,False
Happy hour酒很便宜，音樂不錯，但調酒口味偏淡,"Happy Hour wine is very cheap, good music, but the taste of bartender is light",False
台北數一數二氣氛輕鬆的酒吧，啤酒調酒都很好喝,There are the best bars with the best atmosphere in Taipei. Beer bartender is delicious,False
讚地方,Place of praise,False
今天的男店員很帥氣，被外面客人騷擾也有即時反映，喝的很開心,"Today’s male clerk is very handsome, and the harassment of outside guests is also reflected immediately.",False
90元泰式奶茶 喝一口就沒了 可惜不能拍照 是真的一口就沒 整杯冰塊,"90 yuan Thai -style milk tea is gone, but unfortunately you can’t take a picture.",False
"店內擺設很酷！
酒的價格不貴又好喝
推薦❤️❤️","The shop is cool!
The price of wine is not expensive and delicious
Recommended ❤️️️",False
假如路過突然想喝一杯，我會來上一杯，就一杯,"If you pass by suddenly, I want to have a drink, I will come to a cup, just a cup",False
Cp值滿高的一家酒吧，泰式冰茶很特別可以試試看,"A bar with a high CP value, Thai -style ice tea is very special to try",False
Happy hour真的很划算，酒也不錯！,"Happy Hour is really cost -effective, and wine is also good!",False
"帥燒好喝
整間店很有特色
很放鬆舒服的地方","Handsome burning delicious
The whole store is very distinctive
Very relaxed and comfortable place",False
超棒 音樂很好聽  氣氛超棒 酒好喝,"Superb music is very nice atmosphere, superb wine, good wine, delicious drink",False
擺設佳、無菸味、離捷運站近、價格平價,"Good furnishings, no smoke, close to the MRT station, price parity",False
生啤新鮮價格實惠，下酒菜品項略少,Fresh prices for raw beer are affordable.,False
"輕鬆、有活力的酒吧
消費實惠，交通方便","Easy, dynamic bar
Affordable consumption and convenient transportation",False
環境很舒服，裝潢、氣氛很讚,"The environment is very comfortable, the decoration and atmosphere are great",False
櫃檯點酒的男生服務生態度非常差,The service of boys at the counter is very poor in service.,False
工讀生態度極度消極不好，下次不會再來,"The ecosystem of work is extremely negative, and will not come again next time",False
在同價位的酒吧，酒精算濃,"At the same price bar, the wine is actuated",False
燈光美，氣氛佳，價格實惠,"Beautiful light, good atmosphere, affordable price",False
這是馬鈴薯🍠 …,This is potato 薯 ...,False
還是喜歡這裡的服務跟氣氛的,I still like the service and atmosphere here,False
喝就對了,Just drink it,False
味道母湯 音樂母湯 掰,Taste Mother Soup Music Mother Soup 掰,False
酒平價好喝,Linerity is delicious,False
無與倫比的聚會體驗,Unparalleled party experience,False
特別調酒很棒,Special bartending is great,False
老闆很帥,The boss is very handsome,False
"酒吧食物調味過度。關於飲料，對於那些想要不加糖和酒精的人來說，沒有太多選擇，但在喝了第一杯果汁蘇打水後，我們發現他們實際上得到了蘇打水。
除了這些食物和飲料之外，他們的室內裝飾實際上也有獨特的風格。","The flavoring of the bar food is excessive.Regarding drinks, there are not many choices for those who want to not add sugar and alcohol, but after drinking the first glass of juice, we found that they actually got soda.
In addition to these foods and drinks, their interior decoration actually has a unique style.",False
"充滿異國風情的酒吧。這是住宅區的一個安靜的地方，但一旦你走進去，你會感覺自己身處曼谷唐人街或考山路的亞洲雜貨店。音樂的選擇也不錯，背景音樂的音量很大，可以聽到同伴的竊竊私語，但音量完美到幾乎聽不到鄰桌的人的聲音。不管怎樣，還是很舒服的。
雞尾酒有多種顏色，其中一些含有大量水果和香草，有些則採用創新的茶佈置。它很甜，很清爽，而且都很美味。由於是無菸房，所以沒有異味，空調運作正常。食物也很推薦。尤其是馬薩曼咖哩，和專賣店一樣美味。裡面充滿了大塊的雞肉，魚露和香料完美地融合在一起。一個神秘的空間，非常適合那些想要體驗異國情調或想要暫時逃離現實的人（笑）。","Bar full of exotic style.This is a quiet place in the residential area, but once you walk in, you will feel that you are in the Asian grocery store in Bangkok Chinatown or Kokushan Road.The choice of music is also good. The volume of background music is very large. You can hear the whispering of your companions, but the volume is perfect to the sound of people who can hardly hear the neighboring table.Anyway, it is still very comfortable.
There are many colors of cocktails, some of which contain a lot of fruits and vanilla, and some use innovative tea layout.It is sweet, refreshing, and delicious.Because it is a smoke -free house, there is no odor, and the air conditioning operation is normal.Food is also recommended.Especially Masman curry is as delicious as specialty stores.It is full of large pieces of chicken, fish dew and spices are perfectly integrated together.A mysterious space is very suitable for those who want to experience exotic or temporarily escape from reality (laughs).",False
"位於捷運泰電塔旁的酒吧。
異國風情、時尚氣息讓遊客著迷。
我們有用天然原料製成的素食小吃。

室內裝潢採用國際藝術風格。晚上燈光昏暗的時候尤其好看。

菜單包括小吃、披薩和薯條。
酒類包括生啤酒、葡萄酒、烈酒和雞尾酒。
也提供咖啡和軟性飲料。

我在工作日下午 4 點左右使用過它。

我點了酒和小吃。
您將被帶到您的座位上。在酒吧點餐並付款。

紐約酸酒
威士忌、紅酒和酸橙雞尾酒
威士忌的醇厚與葡萄酒的葡萄風味相得益彰。

芥末花生
塗有芥末的花生零食。
芥末會刺激你的鼻子。

薯角佐純素蛋黃醬和番茄醬
烤厚片馬鈴薯。
大蒜素食蛋黃醬是我最喜歡的口味。

服務很好。您可以慢慢地享用飲品。
女士之夜每週二晚上 9 點開始。
歡樂時光為下午 4 點至 9 點。價格為120元。","Bar next to the MRT Thai Tower.
Exotic style and fashion atmosphere fascinate tourists.
We use vegetarian snacks made of natural raw materials.

Interior decoration adopts international artistic style.The lights at night are particularly beautiful when the lights are dim.

The menu includes snacks, pizza and fries.
The wine includes raw beer, wine, spirits and cocktails.
Coffee and soft drinks are also available.

I used it around 4 pm on working day.

I ordered wine and snacks.
You will be taken to your seat.Ordered at a bar and pay.

New York sour wine
Whiskey, red wine and lime cocktail
The mellow of whiskey complements the grape flavor of wine.

Mustard peanut
Cosmetic snacks with mustard.
Mustard can stimulate your nose.

Potato horny vegan egg yolk sauce and tomato sauce
Bake thick sliced ​​potato.
Garlicin egg yolk sauce is my favorite taste.

The service was excellent.You can enjoy the drink slowly.
Women's night starts at 9pm every Tuesday.
Happy time is from 4 to 9 pm.The price is 120 yuan.",False
"我最近去了 The Shrine 酒吧，總體來說體驗很好。氣氛很活躍，工作人員都非常友善。飲料的選擇令人印象深刻，我很喜歡我點的杜松子酒 - 口味均衡，杜松子酒質量上乘。

然而，我確實有一個問題影響了我的經驗。酒吧的餐桌佔用時間為 90 分鐘。雖然我知道這是酒吧和餐廳的常見做法，目的是保持秩序並為其他顧客騰出空間，但感到匆忙並且必須購買額外的飲料才能停留更長時間，這有點令人沮喪。

除了這個問題之外，我會推薦 The Shrine 酒吧與朋友一起度過一個夜晚。飲料很美味，氣氛也很活躍。但是，如果您打算在那裡度過更長的夜晚，請注意 90 分鐘的限制。四顆星。","I went to The Shrine bar recently, and the experience is very good overall.The atmosphere is very active, and the staff are very friendly.The choice of drinks is impressive. I like the Du Songzi wine I ordered, the taste is balanced, and the quality of Du Songzi wine is superior.

However, I did have a problem that affected my experience.The dining time of the bar is 90 minutes.Although I know this is a common practice of bar and restaurants, the purpose is to maintain order and make room for other customers, but I feel hurried and must buy additional drinks to stay for a longer time, which is a bit frustrating.

In addition to this issue, I will recommend spent a night with my friends with friends.The drink is delicious and the atmosphere is very active.However, if you plan to spend longer nights there, please pay attention to 90 minutes of restrictions.Four stars.",False
不錯的酒吧，從 3 點到 9 點一直提供歡樂時光，供應標誌性的 taihu 925 啤酒。全世界的精神都給人一種特別的感覺。那裡的人也很好。,"A good bar, it has always provided joy time from 3 to 9 to supply iconic TAIHU 925 beer.The spirit of the world gives a special feeling.The people there are also very good.",False
真的很不錯的酒吧！來自世界各地的設計和插圖令人驚嘆，創造了一個非常獨特的空間。,"Really good bar!The design and illustrations from all over the world are amazing, creating a very unique space.",False
"+ : 歡樂時光！下午 4 點到 9 點，130 元啤酒或簡單的雞尾酒，精美的裝飾，很棒的廁所，輕鬆的音樂
- : 薯角好像是冷凍工業包裝的，沒有味道，先付款政策不酷","+: Happy Time!From 4 pm to 9 pm, 130 yuan beer or simple cocktail, exquisite decoration, great toilet, relaxed music
-: The potato horns seem to be freezing in the freezing industry. There is no taste. The payment policy first is not cool.",False
整體而言調酒的味道偏淡，可能點啤酒會好一些，下午3pm-9pm有happy hour，像是臺虎925啤酒、Whisky coke、Gin Tonic等都是一杯$110，不過味道就是偏淡，沒有很喜歡。裝潢倒是蠻酷的，很多像神的圖像，說不上是什麼風格，但很有自己獨特的味道。,"Overall, the taste of bartender is lighter. It may be better to order beer. In the afternoon, 3 PM-9PM has Happy Hour, such as the Taiwanese Tiger 925 Beer, Whist Coke, Gin Tonic, etc. I like it very much.The decoration is quite cool. Many images of God are not what style, but it has its own unique taste.",False
我在這裡嘗試過冰鎮果汁朗姆酒和內格羅尼。調酒師的雞尾酒調製技術還不錯。我喜歡我在這裡點的雞尾酒。雞尾酒的價格並不高。這裡的tapas選擇不是太多，味道還可以，沒有太驚艷。,"I have tried frozen juice and Negrani here.The cocktail adjustment technology of the bartender is not bad.I like the cocktail I ordered here.The price of cocktails is not high.There are not too many Tapas here, the taste is okay, not too amazing.",False
基本上都是我們本地的！營業時間為下午早些時候至深夜。他們有城裡最好的歡樂時光…啤酒、葡萄酒或烈酒 120 新台幣。氣氛很酷，有室內和室外座位。他們還提供美味的小吃。絕對適合團體入住，但如果您想喝杯咖啡放鬆一下也很棒。,"Basically, we are all local!The business hours are early in the afternoon to late at night.They have the best happy time in the city ... beer, wine or spirits of NT $ 120.The atmosphere is cool, there are indoor and outdoor seats.They also provide delicious snacks.It is definitely suitable for group check -in, but it is great if you want to drink a cup of coffee.",False
"在神社的體驗真的很好！
感覺就像我環遊世界瀏覽所有的圖片和裝飾品！
我們是星期六晚上去的，人不是很多，所以很舒服！
飲料也很好，工作人員非常友善和禮貌，絕對推薦！

*去之前記得先預約😉","The experience of the shrine is really good!
It feels like I travel around the world to browse all pictures and decorations!
We went on Saturday night, there were not many people, so it was very comfortable!
The drink is also very good, the staff is very friendly and polite, and it is absolutely recommended!

*Remember to make an appointment before going",False
很棒的地方。裝飾精美，充滿異國情調的紀念品。享受價格合理的飲品，度過漫長的歡樂時光。我喝了一杯搖勻的冰茶，他們演奏的曲子很好聽。就連浴室的裝飾也很有趣。,"A great place.Exquisite decorative, exotic souvenirs.Enjoy a reasonable price of drinks and spend a long happy time.I drank a cup of ice tea, and their music was very nice.Even the bathroom decoration is very interesting.",False
"就在台北車站附近。營業到凌晨2點，而且靠近大學，所以價格沒那麼貴！老實說，雞尾酒在 Instagram 上看起來很棒！它並不像聽起來那麼漂亮，但非常適合與朋友一起喝酒。
小吃也很精緻，都是廚房裡手工製作的。蘿蔔糕（140元）也是自製的，不是買的。顯然披薩也沒有冷凍。所有菜餚似乎都是素食。
內部裝飾很有趣，歡樂時光是從16:00到21:00。享受！","Just near Taipei Station.Open until 2 am, and close to college, so the price is not so expensive!Honestly, cocktail looks great on Instagram!It is not as beautiful as it sounds, but it is very suitable for drinking with friends.
The snacks are also exquisite, all made in the kitchen.Radish cake (140 yuan) is also self -made, not bought.Obviously the pizza is not frozen.All dishes seem to be vegetarian.
The interior decoration is very interesting, the joy time is from 16:00 to 21:00.enjoy!",False
這是一家氣氛獨特的酒吧。我們有各種帶有可愛瓶標的台灣精釀啤酒。,This is a unique bar.We have various Taiwanese craft beer with a cute bottle.,False
"非常小的酒吧，有特殊的風格。啤酒的選擇很好，但當時我在那裡，過了一段時間就只喝了瓶裝啤酒，因為他們的生啤酒出現了故障。
食物很美味，但僅限素食。
工作人員非常友好。","A very small bar, with a special style.The choice of beer was very good, but I was there at the time, and after a while I only drank a bottle of beer, because their raw beer failed.
The food is delicious, but only the element.
The staff is very friendly.",False
"我們的餐桌在晚上 9 點左右到達，並持續為 6 個人重新訂購飲料，直到 10:45。然而，儘管上面寫著如果你不重新訂購的話，時間限制是120分鐘，但他們卻在11點準時趕我們出去。

我不會再回到酒吧了。氣氛還不錯，感覺很匆忙。","Our dining table arrived around 9pm and continued to order drinks for 6 people until 10:45.However, although the time limit is 120 minutes if you say that if you do not order again, they rush us out on time at 11 o'clock.

I won't go back to the bar again.The atmosphere is pretty good and feels very hurried.",False
氣氛很有趣。我們喝了咖啡，味道不錯，但考慮到杯子很小，有點貴。然而，我是在下午參觀的，這更像是酒吧，而不是一家咖啡店。,"The atmosphere is very interesting.We drank coffee and taste good, but considering that the cup is small and a bit expensive.However, I visited in the afternoon, which is more like a bar, not a coffee shop.",False
喜歡這裡涼爽的氣氛。雞尾酒很棒。裝飾非常迷人和舒適。服務也很好，非常友好和熱情。總的來說，這是與一群親密朋友一起出去玩或進行 Tinder 約會的完美場所;-),"Like the cool atmosphere here.Cocktails are great.The decoration is very charming and comfortable.The service is also very good, very friendly and enthusiastic.In general, this is the perfect place for going out to play with a group of close friends or dating Tinder ;-)",False
