Original,EN,Needs Review
店家的每樣收藏都很有風格，在擺放上花了很多心思，雖然數量多但一點也不凌亂，小小的一個空間卻值得細細品味。IPA好好喝，菠菜鹹派也相當優秀！,"Every collection of the store is very stylish, and it has spent a lot of thoughts on the placement. Although the number is large, it is not messy at all, but a small space is worthy of careful taste.The ipa is good, and the spinach salty school is also quite good!",False
店面不大，裡面很異國風，掛了各種神秘的圖片和畫，適合和朋友喝點酒聊聊天，happy hour 的生啤酒120,"The store is not large, and it is very exotic. It has a variety of mysterious pictures and paintings, which is suitable for drinking and chatting with friends. Happy Hour's raw beer 120",False
因為躱雨就進來了，很特殊的店，混雜的中、泰、西、日各國的擺設，但井然有序，很難說出感覺。,"Because the rain came in, the special store, mixed with the furnishings of countries in China, Thailand, West, and Japan, but it was orderly and difficult to say.",False
"去過幾次
但最近一次真的覺得調酒好難喝...不得不評論

目前下午時段沒有營業了
晚上的熱食只剩一種咖哩飯 和一些小點心如水餃 爆米花之類

店裡音樂算是偏大聲 晚上過了一個時間點店員會把燈關得更暗

我喜歡的是它的地理位置和店內風格
每天都有Happy Hour 主題不同
不過有時候是Happy Night
例如禮拜四 整晚Asahi生啤都是$140

📍台電大樓站#4出口
或者5也可以啦只是要過個馬路

店裡有洗手間 維護得很不錯 至少通常都不會聞到什麼異味

大概是這樣
結論是
想喝好喝調酒的 真的不要去 你有更好的選擇","A few times
But in the last time I really feel that bartender is so difficult to drink ... I have to comment

There is no business in the afternoon in the afternoon
There is only one curry rice and some small snacks such as dumplings popcorn at night

The music in the store can be regarded as a loud at night, the shop clerk will turn the lights darker

What I like is its geographical location and in -store style
Every day, there are happy hour themes
But sometimes it is happy night
For example, all night in the night of ASAHI raw beer is $ 140

Takashima Building#4 Exit
Or 5 can just have a road

There is a good maintenance in the store in the store. At least usually I don’t smell any odor

Probably like this
Concluded
If you want to drink delicious and bartender, don't go to you have a better choice",False
"裝璜很漂亮特別，在這裡喝酒超開心♡
氛圍跟音樂都很讚！不管下午來或晚上來都很舒服！
店裡賣的Pizza也很好吃，東西訂價合理，會常常光顧！","The decoration is very beautiful and special, drinking here is super happy ♡
The atmosphere and music are very good!It is very comfortable to come in the afternoon or night!
The Pizza sold in the store is also delicious, the price is reasonable, and it will often patronize!",False
"氛圍很舒服，酒也很讚👍
很推薦晚上來這裡喝兩杯🫰","The atmosphere is very comfortable, and the wine is also very good
It is recommended to come here to drink two glasses at night 很 很 很 很 很",False
就在我開車回新店必經過的路上，上水源快速公路前，今晚經過進去點了肉桂餅，和番茄檸檬汁，一個太酸，一個太甜，沒法子接受；好幾輛的，消防車，警車開到對面馬路上後，沒多久，這家夜店停電了，洋人三三兩兩在屋外喝酒聊天，氣氛自在，不受影響,"Just on the way I go back to the new store, in front of the Shangshui Source Expressway, I went in and ordered the cinnamon cake, and tomato lemon juice. One was too sour, one was too sweet, and I couldn't accept it. After the police car drove on the opposite road, it didn't take long for this nightclub to stop the power. Foreigners drank and chat outside the house. The atmosphere was free and not affected.",False
"離臺電大樓捷運站超級～近
店裡氣氛滿好的 整體裝潢有點異國風 很多擺飾 算滿放鬆 小小缺點 當天可能外面天氣算涼 所以室內沒開冷氣 稍嫌悶了一點 酒的部分當天是喝調酒 滿多經典調酒 當天點了2杯 喝起來都算比較清爽的走向 下次可能會想試一些奶奶類型的或者威士忌類","Super ~ near the Taipower Building MRT Station Super ~ Near
The overall decoration in the store is a bit exotic. Many exotic decorations are full of relaxation. The shortcomings may be cold outside the day. I ordered 2 cups to drink, which is more refreshing. I may want to try some grandma type or whiskey.",False
酒很好喝 餐點的部分 肉桂派特別好吃! 店內裝潢氣氛舒適 相當適合朋友來喝酒聊天聚一聚,"Some of the cinnamon factions with delicious meals are particularly delicious! The interior decoration atmosphere is comfortable, which is suitable for friends to drink and chat together",False
裝潢很讚，音樂完美，食物加分，飲品也不會太貴，是值得再訪的店家,"The decoration is great, the music is perfect, the food is added, and the drink will not be too expensive. It is a store worth visiting.",False
費絲沒泡泡 應該要搖二十分鐘 真的母湯 威士忌冰塊下三顆 融化後真的母湯 吸管的金色包裝還會掉 扣五分 喔氣氣氣氣氣,Feise has no bubbles to shake for 20 minutes. Really maternal soup whiskey is melted under the ice cubes.,False
"很讚的酒吧，裝潢很有異域風情，客人也有些外國人（但背景聲過於吵雜）
配合一週的每一天會有不同的活動很有趣。調酒的味道都不錯，個人最喜歡帥騷和阿基拉。
小菜（水餃、毛豆、爆米花）中規中矩。
總之是一家很有趣的酒吧","The bars are very good, the decoration is very exotic, and the guests also have some foreigners (but the background is too noisy)
It is interesting to have different activities every day with each day.The taste of bartending is good. I personally like Shuai Sao and Aquira the most.
Small dishes (dumplings, edamame, popcorn) are satisfactory.
In short, a very interesting bar",False
白天是咖啡廳，晚上是小酒吧，是個三五好友聊天放鬆喝喝咖啡小酒的好地方！👍🏻👍🏻👍🏻 …,"During the day is a cafe, a small bar in the evening, a good place to chat and drink coffee wine for three or five friends!👍🏻👍🏻👍🏻 👍🏻👍🏻👍🏻 ...",False
裝潢超級酷，室內擺滿個國的神像藝品，還有很多風格強烈的畫和照片。整間店是黑色調但是在水泥剝落處用金色七填滿真的很特別。啤酒是臺虎精釀，調酒類的味道很一般，偏淡，但是價格便宜，想買醉的不適合。在吧台點酒結帳，拿酒回座位，喝完了服務人員收空杯。,"The decoration is super cool, the room is full of idol arts, and there are many strong paintings and photos.The whole store is black but it is really special with golden seven in the cement.Beer is a Taiwanese craft. The taste of alcohol is very average, light, but the price is cheap. It is not suitable to buy drunk.Pat off at the bar to check out, take the wine back to the seat, and finish the service staff to collect the cup.",False
要理不理！環境很特別很有特色！酒很…..sor,Reasonable!The environment is particularly distinctive!Wine is very ... ....sor,False
"裝潢有特色。
酒類價格合理。","The decoration is distinctive.
The price of alcohol is reasonable.",False
很特別的小店，酒類飲品很平價，隨時來喝一杯感覺不錯。,"Very special shop, wine drinks are very cheap, it feels good to have a drink at any time.",False
"從大學喝到出社會的酒吧
風格特別非常悠閒
服務人員親切酒也好喝
每次來都有回到家的感覺
適合下班或放假來喝一杯👍","Drink from university to out of society bars
The style is particularly very leisurely
The service staff is also delicious and delicious
Every time I come home, I feel
Suitable for get off work or vacation to drink a cup of 👍",False
"限定時間2小時，低消300元，不包含餐點，更誇張的是不可以帶外食進入，說必須放在店外？！一個稍微豐滿的女服務人員非常不友善，瘦高的男服務生堅持不讓我們將外食放在屋內，即使我們說不會吃…… 還限定2小時……這是什麼酒吧的作風？？！
沒消費，離開，去附近其他的酒吧，友善多了！","The limited time is 2 hours, the low is 300 yuan, no meal is included, and it is even more exaggerated that it cannot be entered with external food. It is said that it must be placed outside the store?IntersectionA slightly plump female service staff is very unfriendly. The thin male waiter insists not to let us put our food in the house, even if we say that we won't eat ... it is limited to 2 hours ... What kind of bar is the style of the bar?IntersectionIntersection
No consumption, leave, go to other bar nearby, it is much more friendly!",False
裝潢風格相當有個性的店，開到半夜2點，非常適合夜貓子鬼混一下再回家😄番茄檸檬超級酸～ …,The decoration style is quite personalized shop. It is opened until 2 o'clock in the middle of the night.,False
"店員都很有個性，可能生意很好吧
詢問是否有無酒精飲料，居然叫客人自己蹲下去地面冰箱看品項？中間點了水餃，因為沒有明細以為自己漏點，再回去確認時，店員不耐煩的回：不是已經在煮了嗎？只能說不太適合我類型的酒吧","The clerk is very personal, maybe the business is good, right?
Asked if there is a wine fine drink, the guests actually squatted down the ground refrigerator to see the items?I ordered the dumplings in the middle, because there was no detail that I thought I was missing, and when I went back to confirm, the clerk returned impatiently: Isn't it already cooked?I can only say that it is not suitable for my type of bar",False
像是進到了另一個國度般，推開了門映入眼簾就是滿滿的異國風情的感覺，是一個讓人非常chilling 的地方,"Like entering another country, pushing away the feeling of being full of exotic style is a place where people are full of exotic customs.",False
3-9pm多種酒類110！老闆親切，用電腦好地方，音樂好聽放TizzyBac好感動，黑糖薑茶用心,"3-9pm Various wines 110!The boss is kind, uses a computer with a good computer, the music is good to play tizzybac well, and the brown sugar ginger tea is attentive",False
氣氛好，裝潢佳，推山地啤酒,"Good atmosphere, good decoration, push mountain beer",False
來喝調酒的 喝過螺絲起子跟長島冰茶~螺絲起子順口，適合當妹酒;長島冰茶沒有蓋過酒的嗆感，感覺不是很專業...但爆米花跟環境都很棒，非常適合聊天,I have been drinking the screws and drinking the screws. Very suitable for chatting,False
店內裝潢非常酷，酒類價位合理，啤酒種類多，食物也好吃。,"The interior of the store is very cool, the price of alcohol is reasonable, there are many types of beer, and the food is delicious.",False
happy hour下午三點到晚上九點飲品有優惠,Happy Hour will have discounts at 3 pm to 9 pm drinks,False
"空間舒適氣氛佳 飲品實惠又好喝
不論是學生 還是上班族
平日下班下課後煩悶時
三五好友談天紓壓好處所","Space comfortable atmosphere is affordable and delicious
Whether it is a student or an office worker
When I am upset after class on weekdays
Three or five friends talk about the benefits of relief of the stress",False
"台北引以為傲的一直都是一個不夜城，當你心情不好的時候可以在街頭喝酒，沒有在打擾到其他人的狀況下我覺得台北的人們都是友善的，在週日1:00時看到店裡還有人，因友人內急區域詢問是否方便借用廁所，店員沒有看我一眼就回覆到不行，我希望在當日沒有消費的情況下，也能得到友好的對待與態度，考慮到可能打擾到店家，或是上班的辛勞，也有來店裡消費過，我不是一個習慣留下評論的消費者，留下五星代表對店家的肯定，也不想影響店家評價，但希望下次再接待到如我友人一樣有內急的朋友，可以好好溝通，畢竟我們都不喜歡自己的城市有人隨地大小便。

祝 生意興隆","Taipei has always been proud of a night city. When you are in a bad mood, you can drink on the street. In the case of disturbing other people, I think the people in Taipei are friendly. Seeing that there are still people in the store, because the internal area of ​​friends asked if it was convenient to borrow the toilet, the clerk did not respond to me at a glance. I hope that if there is no consumption on the day, I can get friendly treatment and attitude. Considering that it may disturb may disturb the disturbances. When I arrived at the store, or to work at work, I also spent time in the store. I am not a consumer who is used to commentary. The five -star representatives have affirmed the store and do not want to affect the evaluation of the store, but I hope that the next time I will receive it like me Friends who have internal anxiety can communicate well. After all, we don't like our cities and someone will urinate anywhere.

I wish the business a prosperous",False
"單價不高又好喝的調酒，值得來試試
氣氛很不錯，離捷運站很近","The unit price is not high and delicious, it is worth trying
The atmosphere is very good, very close to the MRT station",False
店內的氛圍不錯，價格還算合理，就是不太明白沒賣咖啡那招牌幹嘛寫「caffe&bar」?只好離開。,The atmosphere in the store is good and the price is reasonable. I don't quite understand why I did n’t sell coffee. What did the signature “Caffe & Bar”? I had to leave.,False
"離台電大樓捷運站3號出口很近,交通方便
裝潢特殊且有自己特色
接骨木酒好喝
服務也親切
店內外國人不少
會再回訪😊","The exit of No. 3 from Taipower Building MRT Station is very close, and the transportation is convenient
The decoration is special and has its own characteristics
Solid wood wine is delicious
The service is also kind
There are many people inside and outside the store
Will return to 😊",False
不錯的小酒館和咖啡館，可惜因為沒有廚房，餐點選擇不多。,"Good tavern and cafe, unfortunately because there is no kitchen, there are not many meals.",False
風格很異域，但氣氛很棒~威士忌shot口味特別、啤酒選擇不多不少，週四晚上21：30沒預約有位子，但也一下就客滿了，位子不多外國人多，低消大概兩杯2小時，平日下班小酌剛好！,"The style is very exotic, but the atmosphere is great ~ The whiskey SHOT taste is special and the beer choices are not much. There is no appointment at 21:30 on Thursday night, but it is full. Two cups for 2 hours, just work on weekdays!",False
環境氣氛超棒，可惜有限時🥲 …,"The environment atmosphere is great, but unfortunately limited ...",False
價格實惠，有室內室外座位,"The price is affordable, there are indoor and outdoor seats",False
"和友人一人點了兩杯
第一杯Rum系列忘了叫什麼
第二杯Shrine系列的第一個
都滿好喝的
一杯210、220","I ordered two cups with friends
What did the first cup Rum series forget?
The first one of the second cup SHRINE series
It's all delicious
One cup 220, 220",False
"#0709
近捷運台電大樓
出口5過馬路左轉即抵達
令人眼睛一亮的裝潢","#0709
Near MRT Taipower Building
Exit 5 Crossing the road left and then arrive at the left
The eye -catching decoration",False
跟朋友約吃飯聊天，店內裝潢非常特別，各種東南亞風的小東西都掛在牆上，店內還有各種酒類（包含啤酒）。咖喱飯很好吃，搭配一點點紅酒，非常完美。,"I have a meal and chat with my friends. The interior of the store is very special. Various small things in Southeast Asian style are hung on the wall. There are various alcohol (including beer) in the store.The curry rice is delicious, with a little red wine, which is perfect.",False
"很酷的地方 ！
喜歡這裡的酒
氣氛很讚∠( ᐛ 」∠)＿","Very cool place!
Like the wine here
The atmosphere is great ∠ (∠ ""∠) _",False
"很舒服的小空間，店內有很多很奇特的小物件。

用餐時間為兩個小時，但由於當天店裏沒有特別多人，所以店員也沒有特別趕人。

Chicha Jerry 很好喝！","Very comfortable small space, there are many strange small objects in the store.

The meal time is two hours, but because there are no particularly many people in the store that day, the clerk is not particularly rushing.

Chicha Jerry is delicious!",False
"非常適合下班跟朋友小聚聊天的地方。
氛圍輕鬆無壓力。","It is very suitable for the place where you are chatting with friends from get off work.
The atmosphere is easy and pressureless.",False
老闆人很好，我們沒吃飯讓我們帶東西進去吃，奶酒還幫我加牛奶，超好喝！,The boss is very good. We do n’t eat for us to bring things in to eat. Milk wine also helps me add milk.,False
前天我因為找不到兒子，但我只知道他常常在台電大樓附近的酒吧買醉。雖然我搜尋找不到原本店址，但該店邱先生很熱心教我用gllloe地圖搜尋，後續還打電話詢問是否有找到本人兒子。真的很感謝邱先生體諒一個母親的心。雖然我們沒有去該店消費過，但這種熱誠的心會讓一個母親的心倍感溫暖。真的謝謝邱先生。,"The day before yesterday I couldn't find my son, but I only knew that he often bought drunk at the bar near the Taipower Building.Although I couldn't find the original store, Mr. Qiu was enthusiastic about teaching me to search on the GLLLOE map, and then called to ask if he found his son.I really thank Mr. Qiu for thinking about the heart of a mother.Although we have not been in the store, this kind of enthusiastic heart will make a mother feel warm.Thank you Mr. Qiu.",False
"最愛的bar,從開幕就跟老公常常光顧，但一直沒有寫評論。總結台北各個夜店、酒吧，這是最愛的一家，店員都很親切，自己去吧檯點餐結帳，完全不用怕喝多被灌單(大家都有類似經驗吧😝😝)。生啤新鮮、調酒好喝，怎能不愛上它？ …","The favorite BAR often patronizes with her husband from the opening, but has not written comments.Summarize all nightclubs and bars in Taipei. This is the favorite one. The clerk is very kind. Go to the bar to check out for a meal. You do n’t have to be afraid to drink more.How can I not fall in love with it?Mowing",False
價格合理，店內裝潢很特別。,The price is reasonable and the interior decoration of the store is very special.,False
服務親切，酒好喝！happy hour 也划算～～～,The service is cordial and the wine is delicious!Happy Hour is also cost -effective ~~~,False
"東西氣氛還不錯
一個綁頭髮的男店員不知道在跩什麼挺好笑的","East and west atmosphere is not bad
A male clerk who tied his hair does not know what is funny",False
音樂讚氛圍好，改回沒低消很棒，好店需要支持！,"The music likes are good, and it is great to change it back. Good shops need to support it!",False
"長島冰茶好喝
室內裝飾有特色","Long Island ice tea is delicious
Interior decoration is distinctive",False
"整體沒酒味，比較像果汁
適合學生，環境熱鬧","There is no wine overall, more like fruit juice
Suitable for students, the environment is lively",False
Happy hour 的飲料很便宜，臺虎的啤酒蠻推薦的，沒試到紅白酒下次可以再試試看，咖啡普通，東西還不錯但是不是哪種非常好吃的類型。大體來說蠻適合朋友們一起來聊天打發時間的地方。,"Happy Hour's drinks are very cheap. Taiwan tiger's beer is recommended. I can try red and white wine next time. The coffee is ordinary, and things are not bad but not a very delicious type.Generally speaking, it is quite suitable for friends to chat together to pass the time.",False
"酒cp值高好喝+1星
但果蠅飛進酒裡沒有一點表示也太扯了吧
所以...喝到一半果蠅進去酒裡是顧客要負責的？
拜託 什麼叫「不要了還是撈掉」
不想喝有果蠅泡過的酒也不行啊？
到底？？？
我真的很少給低星 這個真的太扯==","Wine CP value is high, good, good, good, 1 star
But there is no one showing the fruit fly into the wine, right?
So ... it was the customer responsible for drinking half of the fruit fly in the wine?
Please, what is ""don't want it or get rid of it""
Don't want to drink wine with fruit flies?
in the end?IntersectionIntersection
I really rarely give the low star really too much ==",False
很酷的店！ 在台北應該找不到一樣的了！ 氣氛很輕鬆， 很適合好朋友一起來聚一聚。 啤酒和調酒價位很親民，喜歡換這種舒適又特別的店！ will bring some friends here definitely!!!,"Cool shop!You can't find the same in Taipei!The atmosphere is very easy, it is very suitable for good friends to come and gather together.The price of beer and bartender is very close to the people, and like to change this comfortable and special shop!Will Bring some Friends Here Definitely !!!",False
一位姓羅的店員很有氣質服務佳 下次會再來👍 …,"A clerk named Luo is very temperamental service. Next time, I will come again ...",False
台北最強酒吧！基本上來過這你就不會想離開啦🍻🍻🍻🍻 …,"The strongest bar in Taipei!Basically, you will never want to leave 🍻🍻🍻🍻 ...",False
氣氛很棒很讓人放鬆，酒類的選擇也很多，價格公道，整體CP值很高！還有被招待好吃的爆米花，非常推薦，願意再訪！,"The atmosphere is great and relaxed, there are many choices of alcohol, the price is fair, and the overall CP value is high!There is also the delicious popcorn that has been entertaining. It is very recommended and willing to visit again!",False
住附近而已，見證這個店面位置的世代更迭XD 每天工作經過看著 The Shrine 從無到有的裝潢過程，好不容易開了一家用心、小點心好吃、咖啡非常棒，白天晚上都能和朋友聚會聊天的好地方，一定要支持！大推落地窗戶和非常合理的價位，連洗手間裝潢都非常用心的店，台電大樓地區必訪之地。,"Just live nearby, witness the generation of this store's location XD work every day, after watching The Shrine's decoration process from scratch. You must support the good place to chat!The stores and a very reasonable price of the floor -to -ceiling windows, even the shops with very careful decoration of the toilet, the must be visited by the Taipower Building area.",False
"氣氛佳適合三五好友小聚
Happy hour 的酒都偏清淡口味，但划算，喝啤酒聊天不錯
其他酒款也還可以但並沒有特別驚艷之處
另外服務人員都滿不錯的喔","The atmosphere is good for three or five friends Xiaoju
Happy Hour's wine is light, but it is cost -effective, drinking beer to chat well
Other wines are okay but there is nothing particularly amazing
In addition, the service staff are full of good",False
"價位平價 調酒很好喝也很美~
裝潢更是特別!
短髮的酒保姐姐很熱情 幫我拍照 給我解酒 笑容超可愛!
會再訪!!","The price is very delicious and beautiful ~
The decoration is even more special!
Short -haired Sister Jiu Bao is very enthusiastic to help me take pictures to give me a beanis and smile super cute!
Will visit again !!",False
"酒不貴（一杯兩百左右）
但是不論是酒還是店內的氛圍都非常有特色
品質也很好
平常不是很喜歡喝whisky
但是最推薦他們紐約的春天
Whisky sour的調酒
真的非常好喝","Wine is not expensive (about two hundred hundred)
But both wine and the atmosphere in the store are very distinctive
The quality is also very good
I usually don't like to drink whisky very much
But the most recommended spring in New York
Whisky Sour's bartending
Really delicious",False
"價格公道，氛圍超讚，裝潢很講究細節的小酒吧。
在這裡，你可以思考宗教有不一樣的可能性，你可以有不一樣的信仰，可以有不一樣的期待。
下午的時候很安靜，一個人來也不會覺得奇怪。","The price is fair, the atmosphere is superb, and the decoration is very particular about the details.
Here, you can think that religion has different possibilities. You can have different faith and have different expectations.
It was quiet in the afternoon, and it would not be strange to come alone.",False
氣氛很特別，Happy Hour 價格便宜，每週定期有不同的促銷價格。但酒的品質不是這樣好。,"The atmosphere is very special. Happy Hour's price is cheap, with different promotional prices regularly every week.But the quality of wine is not so good.",False
氣氛很好，有Happy Hour,"The atmosphere is good, there are happy hour",False
