Original,EN,Needs Review
"牆面兩側大螢幕投射國外美景🗺
浩瀚壯觀 華麗氣派！
音樂充滿異國風情 品味高大尚至極🏝
在聽覺·視覺·味覺以及氛圍
都下了十足功夫🫡

⚜️雙人雅緻饗宴 3688$ For 2⚜️

♦︎ J WOW精選雞尾酒🍹
可詢問 會有親切解說～
-藍色賊窩
藍柑橘顏色 顏色漂亮 酒韻比較厚
-採茶姑娘
水果加茶香的組合 清爽清新

♦︎手工麵包佐摩德納陳年醋🍞
蔓越莓佛卡夏 搭配特調油醋
不會太硬 麵包Q軟

♦主廚例湯-俄羅斯蔬菜湯🇷🇺
湯微辣 辣椒粉層次更提升
有迷迭香 馬鈴薯 洋蔥
與煎過的柳松菇 共同搭配
完全沒有菇腥味
口感好 辛香料味 口味偏重
趁熱喝最好喝🤗

♦尼斯沙拉佐第戎芥末籽醬
最喜歡的一道🤩
視覺好看之外 料理有新意！
像蛋糕夾層🍰
每層由切片馬鈴薯做分層
蛋黃·蛋白·羅旺斯橄欖醬
最後一層是四季豆收尾
搭配檸檬芥末籽醬 更為爽口🍋

♦干貝松露球佐檸檬泡泡🫧
松露球上面是神秘的竹炭粉
健康養生的創意料理！
內餡有酪梨🥑蕃茄🍅
搭配檸檬泡泡 酸酸口感
不會有多餘膩感☺️

♦博多明太子奶油鮮蝦細扁麵🍝
明太子分布均勻
每口都吃到滿滿滿的明太子
濃郁攪拌 味蕾完全大開！
兩隻大蝦是炙燒過的 新鮮不用髒手🦐

♦西班牙伊比利極黑豬佐酸豆鯷魚紅酒醋汁
非常驚艷 肉質超嫩 兩大塊厚切 飽足感十足
酸豆鯷魚汁 酸辣整個太好吃😋

♦炙烤慢煮鮭魚佐勃根地式鮮魚汁
鮭魚嫩滑細緻 炙烤過的香氣加上鮮魚汁
完美搭配🐟
淋的醬汁是用鮭魚的骨頭下去熬製 口味出眾的原味！
配菜煙燻火腿 蘑菇 洋蔥 生菜
火腿煙燻的香氣
在嘴裡久久不能散去😚
非常喜歡 建議直接淋上使用😉

♦甜點-紅絲絨蛋糕 漂亮收尾
♦茶品-六種茶 喝杯茶 暖胃好滿足

整體感受 餐點或服務都值得給予很高評價💯
「下足功夫的藝術創意料理」
非常適合約會或重要節日的慶祝喔🎉😍

需加收10%服務費","Large screens on both sides of the wall projected foreign beauty abroad
The vast and spectacular gorgeous style!
Music is full of exotic flavors
In hearing, visual, visual, taste and atmosphere
It's all all the effort 足

️ Double elegant feast 3688 $ for 2⚜️

J wow Select cocktail🍹
You can ask a cordial explanation ~
-A blue thief nest
Blue citrus color and colorful wine rhyme is thicker
-The tea girl
The combination of fruit and tea fragrance is refreshing and fresh

德 Handmade bread Zooma Old Vinegar🍞
Caberon Berry Buddha Katham with special oil -oriented vinegar
Not too hard bread Q soft

Chef Example Soup-Russian Vegetable Soup 🇷🇺
The level of soup pepper pepper powder is more improved
There are rosemary potato onions
Together with the fried willow mushrooms
There is no mushroom smell at all
The taste of the taste is good
It is best to drink while drinking 最

第 Nice Salazo Di Rong Mustang Sauce
My favorite 道
Visual good -looking dishes are new!
Like a cake mezzanine
Each layer is layered by sliced ​​potatoes
Egg yolk · protein Rwus olive sauce
The last layer is the end of the four seasons beans
It is more refreshing with lemon mustard seed sauce 🍋

露 ♦ ♦ ♦ ♦ ♦ ♦ ♦ 🫧 🫧
On the truffle ball is the mysterious bamboo charcoal powder
Creative cuisine of health!
The filling is avocado 茄 tomato 🍅
Sour with lemon bubbles
There will be no redundant feeling 余️

奶 Bogo Prince Prince Cream Shrimp Fine Flat Noodles 🍝
Prince Ming Prince is evenly distributed
Each mouth is full of prince Ming
The strong stirring taste buds are completely open!
Two prawns are burning fresh and don’t need dirty hands.

利 Spain, Ibine Ibine Pig Black Pig Sour Douya Catfish Red Wine Vinegar
Very stunning meat quality, super tender, two big pieces are full of thick and full fullness
Sour bean catfish juice is hot and sour, so delicious 😋

煮 Boil and boasting Slow -boiled salmon Suben -style fresh fish juice
Salmon and smooth and delicate aroma with fresh fish juice
Perfect matching 🐟
The dried sauce is the original flavor of the flavor with the bones of salmon!
Cai smoke ham Mushroom onion and lettuce
Ham smoked aroma
Can't disperse in my mouth for a long time
I like it very much to use it directly to use 直接 直接

Dessert-red velvet cake is beautifully ended
种 种 ♦-Six kinds of tea to drink cups of tea to warm the stomach and satisfy the stomach

The overall experience of meals or services is worthy of high evaluations 💯
""The artistic creative cuisine of the next footwork""
Very suitable for the celebration of dating or important festivals 🎉😍

Need to charge 10%service fee",False
餐點好吃 環境輕鬆 推薦,The delicious environment is easy to recommend,False
咖啡很好喝、餐點不錯、氛圍很棒！,"The coffee is delicious, the meals are good, and the atmosphere is great!",False
"料理口感香味層次分明，
熱騰騰上桌讓人很開心🥰

奶醬與平衡明亮的酸味融貫在每一道菜裡，這蠻特別的，很有記憶點
推薦叨沙海鮮細扁麵跟羅宋湯🍲

調酒有點弱…三杯都不愛，
風味不平衡不太喜歡😌

立體結構真的太美了，是間裝潢極美，
感覺得出老闆真心投入照顧的店。","The taste of the taste is clear and the aroma is clear,
Hot and steaming on the table is very happy 热

Milk sauce and balanced sour taste blends into every dish. This is quite special and very memorable
Recommended Sand Seafood Film Flat Noodles and Lord Song Decoction 🍲

Blooming is a bit weak ... I don’t love three cups,
Unbalanced flavor, I don’t like it too much 衡

The three -dimensional structure is really beautiful, it is very beautiful in the decoration.
It feels like the shop that the boss really is in care.",False
氣氛滿點，服務滿分，態度親切，笑容滿分，羊排好吃,"The atmosphere is full, the service is full, the attitude is kind, the smile is full, the sheep chop is delicious",False
青醬義大利麵~超好吃！,Green sauce Italian noodles ~ super delicious!,False
"在安和路上的美味早午餐，開業一年多還沒有很多人潮，但是味道、環境、服務都在水準之上，中午多半是附近的上班族來用餐，整間餐廳寬敞舒適，趁著火熱之前趕快來享受一下寧靜的早午餐！
歐姆蛋捲比較乾，吃起來不膩很棒，旁邊的配菜是薯條，但可以換成沙拉，是非常注重消費者喜好的彈性調整，加分👍 三明治是採用比法棍或歐式麵包軟的黑麥或全麥核桃麵包，感覺店家做了很多的調研，針對台灣消費者調整了餐點的食材；紅茶、美式也都有一定的水準，小白也是香濃順口，檸檬磅蛋糕酸甜適中值得加點。人均消費約在500元左右，這樣的餐點與環境是可以接受的。","On the delicious brunch on Anhe Road, there are not many crowds of people for more than a year, but the taste, environment, and services are all above the standard. More than at noon is nearby office workers to dine. The whole restaurant is spacious and comfortable. Come and enjoy the quiet brunch!
The Ohm egg roll is relatively dry, and it is not greasy to taste. The side dishes next to it are fries, but it can be replaced with salads. It is very popular for consumers' preferences. The rye or whole wheat walnut bread, I feel that the shop has made a lot of investigations, and the ingredients of the meals have been adjusted for Taiwanese consumers; black tea and American style also have a certain level. Xiaobai is also fragrant and smooth. Moderate worth adding points.The per capita consumption is about 500 yuan, and such meals and environment are acceptable.",False
粉紅海鮮麵好好吃，蔬果沙拉非常新鮮！,"Pink seafood noodles are delicious, and fruits and vegetable salads are very fresh!",False
"店員說今天是轉型的第一天
滿多品項沒有的
建議點餐前先告知甚麼品項沒有
不然選好了又沒有
真的不知道要喝什麼

馬丁尼  酒感滿烈的 整體是好喝
價格是450+10% 個人覺得偏貴
果香紅茶? 入口前的果香很棒 紅茶味很順口
最後有一個香甜感會留在口中

打卡有送 薯條搭配特製沾醬
很不錯 搭酒喝很適合 太飽不然想多點一份

起司蛋糕不錯 好吃

蝦子炒野菇偏鹹 蝦子新鮮蝦味十足 配酒也滿適合的","The clerk said today is the first day of the transformation
No one -quality item
It is recommended to inform what item before ordering
Otherwise, there is no choice
I really don't know what to drink

The whole of Martini is full of wine, which is delicious
The price is 450+10%. Personally, I think it is too expensive
Fruit fragrance black tea? The fruity aroma in front of the entrance is great black tea flavor is smooth
Finally, a sweet feeling will stay in the mouth

Pickings have french fries with special dipping sauce
Very nice to drink wine, it is suitable for being too full, otherwise I want to have more parts

Cheese cake is good and delicious

Shrimp fried wild mushrooms, salty shrimp, fresh shrimp flavor, full of wine, it is suitable",False
餐點美味，環境舒適，氣氛佳，適合聚會,"The meal is delicious, the environment is comfortable, the atmosphere is good, suitable for party",False
"Nice atmosphere and great food
早午餐三明治麵包蠻大份、薯條份量也不少，可以吃很飽！
$50加點檸檬磅蛋糕相當實惠，鬆鬆的，不是很硬的那種
義大利麵口味偏重，但麵體入味頗濃郁
價位偏高但餐點用心好吃，種類豐富讓人有選擇障礙！","Nice Atmosphere and Great Food
Bunch of the sandwich noodles is quite large, and the amount of fries is also large. You can eat it!
$ 50 plus some lemon pound cake is very affordable, loose, not very hard
The taste of the pasta is heavy, but the flavor of the facade is quite rich
The price is high, but the meals are delicious, and the variety is rich and there are optional obstacles!",False
"吃過兩次了，兩次我都覺得很棒
服務人員態度也很好，會細心介紹
只是咖喱飯的口味不是很合我的胃口
（我覺得咖喱的口味吃起來有點像日本酸梅糖的味道？）
但店員說蠻多人喜歡的
所以可能還是要看人～
但其他的餐點我都覺得非常好吃！！
我最喜歡的還是酸溜溜溜檸檬生乳酪
（真的會酸 不喜歡酸的人不要點）
一開始還以為是沒退冰就拿來
問了之後才知道是因為不含吉利丁
所以不能等完全解凍再吃會太軟～
但還是非常好吃～

牛排分享餐也很好吃
看起來有點生，但吃起來很軟嫩
我也是不敢吃很生的人
但這個牛排不會讓我感到排斥
也不會像一般牛排有時候吃到最後就興趣缺缺
是會想好好把他吃完那種
小小不喜歡的是
馬鈴薯泥上面一樣有那個像酸梅糖味道的醬🤣

但整體來說我還是很喜歡啦
大家一定要來吃看看❤️😋","I have eaten it twice, I feel very great twice
The attitude of the service staff is also very good, I will introduce it carefully
It's just that the taste of curry rice is not very good for my appetite
(I think the taste of curry is a bit like the taste of Japanese sour plum candy?)
But the clerk said that many people like it
So you may still depend on people ~
But I feel very delicious for other meals!Intersection
My favorite is sour sloping lemon raw cheese
(Don't order people who don't like sourness)
At the beginning, I thought it was taken without retreating.
After asking, I knew it was because I did not contain Geely Ding
So you ca n’t wait for the whole thawing and then eat it too soft ~
But it's still very delicious ~

Steak sharing meals are also delicious
It looks a bit raw, but it tastes soft and tender
I also dare not eat very people
But this steak will not make me feel exclusive
It won't be like a general steak. Sometimes when you eat it at the end, you will be in lack of interest.
I would like to eat him well
What I don't like is
The potato puree has the same sauce like a sour plum sugar 🤣 🤣

But overall I still like it very much
Everyone must come and see ❤️ 来",False
服務親切，菜色美味,"Good service, delicious dishes",False
用餐環境挺好的，內部裝潢採用一個低調奢華的風格，餐點上算是有品質跟一定的水準，但沒有到非常驚艷，不過如果把價格納入考量，是非常超值的，畢竟能有個可以跟朋友輕鬆聊天的環境，又有高級的氛圍，而不用付超過1000元（當然也可以點超過1000元啦），我認為是值得去的一家店！所以給五星評價嘍～～,"The dining environment is very good. The interior decoration adopts a low -key luxury style. The meal is considered quality and a certain level, but it is not very amazing. The environment where you can easily chat with friends and have a high -level atmosphere without paying more than 1,000 yuan (of course, you can also order more than 1,000 yuan), I think it is a store worth going!So give five -star evaluation ~~",False
飲品及餐點很讚！環境優！,Drinks and meals are very good!Good environment!,False
氣氛好口味佳～,The atmosphere is good ~,False
義大利麵還非常好吃，排餐也很美味，材料新鮮，服務週到。,"The pasta is also very delicious, the meals are also delicious, the materials are fresh, and the service is thoughtful.",False
好吃又好喝😋服務超好🫶🏻,It's delicious and delicious. The service is super good 好,False
整體裝潢氣氛很不錯，餐具桌椅有質感，空間寬敞舒適，餐點算ok，義大利麵和法式吐司還不錯，牛排有點韌且邊邊有點烤焦，馬鈴薯薯條比地瓜薯條好，整體來說比適合吃氣氛約會或聊天,"The overall decoration atmosphere is very good, tableware tables and chairs have texture, spacious and comfortable space, meals are OK, Italian noodles and French toast are pretty good, steak is a bit tough and a little baked, potato fries are better than melon and potato strips. Overall is more suitable for eating atmosphere, dating or chatting",False
公司聚餐，氣氛好，餐點好吃！,"The company has a meal, the atmosphere is good, and the meals are delicious!",False
餐點好吃，尤其是招待的麵包，味道很香,"The meal is delicious, especially the hospitality bread, the taste is very fragrant",False
用餐環境很好，餐點精緻美味，且餐廳裝潢風格很美，挑高的空間令人感到放鬆。午間特餐在假日中午也可以點，隨餐附紅茶或咖啡。餐點份量對男生來說有點偏少，但是整體用餐體驗很好，價格合理，值得推薦。,"The dining environment is very good, the meal is delicate and delicious, and the restaurant decoration style is beautiful, and the high space is relaxed.At noon at noon, you can also order at noon, with black tea or coffee with meals.The amount of meals is a bit small for boys, but the overall meal experience is very good, the price is reasonable, and it is worth recommending.",False
"挑高玻璃景觀餐廳很氣派
不過換來的就是冷氣分佈不均
窗邊尤其在冷氣出口下面完全空氣不流通
店家可能需要多點地扇

這樣的餐廳居然備有手沖咖啡
且豆子跟技術不差
食材也出乎意料的新鮮
調味算是清淡裡面能襯托食材的濃淡
午餐時間八成滿
是會再訪
適合聚會的餐廳","Picking high glass landscape restaurant is very angry
But in exchange is the uneven distribution of air -conditioning
The window is especially under the air outlet and the air does not circulate completely
The store may need more ground fan

Such a restaurant is actually equipped with hand -coffee coffee
And beans are not bad from technology
The ingredients are also unexpectedly fresh
Seasoning is considered to be light in the light that can set off the ingredients
Lunch is 80 % full
Will visit again
Restaurant suitable for party",False
"下午在特定的時間來吧台，可以看到陽光透過酒杯，見到彩虹色的調酒，十分美麗。

餐點的部分，清炒海味義大利麵超經典！微辣但口感非常好。
紅絲絨蛋糕中間的鮮奶油，把甜點的層次感帶出，值得一嚐。
咖啡口感順口，也還不錯。

很適合跟朋友聚餐，情侶來喝下午茶，或是一人來品嚐美味的調酒。","In the afternoon, when you come to the bar at a certain time, you can see the sunshine through the wine glass. Seeing the rainbow -colored bartender, it is very beautiful.

For meals, stir -fried seafood spaghetti is super classic!Slightly spicy but taste very good.
The fresh cream in the middle of the red velvet cake brings out the sense of hierarchy of the dessert, which is worth trying.
Coffee tastes smooth and pretty good.

It is very suitable for meals with friends. Couples come to drink afternoon tea, or one person to taste delicious alcohol.",False
"2023.二訪
餐廳經過調整後，前幾天重新營業，改為餐酒館形式，餐點依然好吃，又加入了各國的飲食元素，例如近期夯的陝西肉夾饃、台式蔥油拌麵、印度三角餅，另外加了外婆菜的肉菜飯令同行友人讚不絕口，除了餐點，透明的新式調酒有新奇感，當天點了由檜木精油和橙花萃取的調酒，口感清新獨特，下班後想喝點小酒，悠閒的吃頓晚餐，是很不錯的選擇~
----------------------------------------------
店內空間寬敞，光線明亮，有舒服的沙發座位區，看的出在裝潢上的用心；餐點內容也是誠意滿滿，一碗蛤蠣菇菇清湯清爽可口，菇菇先處理煎過，散發菇類特有香氣，蛤蠣給非常的大方；麵包與油醋醬完美搭配，加上新鮮鱸魚主餐，讓人感覺在這裡用餐是一種很愉悅的享受~","2023. Second visit
After the restaurant was adjusted, it was restarted a few days ago and changed to the form of a dining tavern. The meal was still delicious. In addition, the meat and rice of grandmother's vegetables made my friends praise. In addition to meals, the transparent new bartender has a new sense of bartending. On the same day, I ordered the bartender extracted by Ichigi essential oil and orange blossoms. It is a good choice to drink a little wine and eat dinner leisurely ~
----------------------------------------------
The space in the store is spacious, bright in light, and a comfortable sofa seat area. The content of the meal is also full of content. The category unique aroma, the oyster is very generous; the perfect combination of bread and oil vinegar sauce, plus the fresh sea bass main meal, makes people feel that eating here is a very pleasant enjoyment ~",False
"這是一家美麗的餐廳，主廚製作的牛排美味絕倫。我享用的蘑菇濃湯風味獨特，而家人點的海鮮湯則料多味美，讓人回味無窮。油封海鮮也同樣令人讚不絕口。

飲料同樣令人滿意，每一口都充滿了新鮮感。餐廳的氣氛浪漫，裝潢精緻典雅，物超所值。麵包是歐包，搭配湯品，美味到一滴不剩，令人難以抗拒。

此外，老闆非常風趣，言談之間總能讓人會心一笑，為整個用餐體驗增添了更多的愉悅。","The steak is delicious and excellent in the chef.I enjoy the unique flavor of mushroom soup, and now the people of people are expected to taste and delicious, which makes people reminiscate endlessly.Oil-sealed seafood is also praised.

The beverages are equally satisfactory, every bite is full of freshness.The atmosphere of the restaurant is romantic, decorated and elegant, great value for money.Bread, Euro Bao, with soup, delicious to a drop of leftover, irresistible.

In addition, the boss is very funny, between talking can always make people smile, to add to more and more pleasant to the entire dining experience.",False
氣氛不錯，短髮女服務員很親切！,"The atmosphere is good, the short -haired female waiter is very kind!",False
來這家店四五次了～整體都很棒，不管是食物、飲品還是裝潢氣氛！,"It ’s great to come to this shop four or five times ~ the whole is great, whether it is food, drink or decoration atmosphere!",False
牛舌好吃，義大利麵好吃,"The beef tongue is delicious, the pasta is delicious",False
舒服的空間，好吃的食物和酒～,"A comfortable space, delicious food and wine ~",False
"初訪，環境很棒，服務人員很親切。餐點、甜點、咖啡都相當驚艷，非常享受！
P.S. 點了一杯我不愛的美式咖啡來搭配熔岩巧克力蛋糕，意外的好喝！改變我對美式咖啡的印象。","The first visit, the environment is great, the service staff is very kind.Meals, desserts, and coffee are very amazing and enjoy it very much!
P.S. ordered a cup of American coffee that I don't love to pair with lava chocolate cake, which is unexpectedly delicious!Change my impression of American coffee.",False
"感受的到經驗者的用心
從一進門就覺得整間餐廳的氣氛非常舒服
餐點也都很棒 感覺全時段我都會想來","Feel the intention of the experiencer
I feel that the atmosphere of the whole restaurant is very comfortable since I entered the door
The meals are great, I feel that I will come all at all times",False
"地點🚌🚇大眾運輸交通還算方便
店內環境讚 空間足夠不擁擠

價格中高 但餐點品質還不錯
新鮮、份量👌👌
也許有千元以下的套餐 會更有競爭力吧
(不過🍞麵包真的太普、空虛 很沒記憶點)

服務人員態度非常親切 不過
消費當日 有非店內客人在店門口外抽菸
🙄🙄煙味都飄進店內了🚬
希望下次有類似這樣情形的話
服務人員可以出面處理一下🙏","Location 输 Volkswagen transportation and transportation is quite convenient
Environmental praise space in the store is not crowded enough

The price is high, but the quality of the meal is not bad
Fresh, portion 份
Maybe there will be a package of less than 1,000 yuan. It will be more competitive.
;

The attitude of the service staff is very kind
On the day of consumption, there are non -store guests smoking outside the door of the store
进 🙄🙄 🙄🙄 🙄🙄 🙄🙄 🙄🙄 🙄🙄 🙄🙄 🚬 🚬 🚬
I hope there will be similar situations next time
Service staff can come up with it 面",False
"很舒適的一個地方，一進門敞亮的落地玻璃，很炫酷的一個吧台，還有大螢幕可以看，還有幾幅很可愛的猴子的畫，非常賞心悅目，裝修精緻
可以感覺到經營者的用心，另外餐點也精緻好吃，相對性價比也非常的高，非常推薦的餐廳⋯🤩🤩🤩 …","A very comfortable place, a bright floor -to -ceiling glass in the door, a very cool bar, and a large screen can be seen. There are also a few cute monkeys.
You can feel the intention of the operator, and the meals are also delicate and delicious, and the relatively high cost performance is very high.",False
裝潢氣氛很有質感，餐點也好吃！看著窗外下雨享受美食超讚！,"The decoration atmosphere is very textured, and the meal is delicious!Watching the window rain and enjoying the food!",False
