Original,EN,Needs Review
"確實是一家專業的清酒酒吧，擁有舒適的內部裝飾和氛圍
特別是你可以嘗試一些零售店裡不常見的小眾清酒品種
與清酒風味相得益彰的食物也是一大亮點
絕對是值得再去的地方","It is indeed a professional sake bar, with comfortable internal decoration and atmosphere
Especially you can try some uncommon niche sake varieties in retail stores
The food that complements the flavor of the sake is also a highlight
Definitely worth going",False
"我注意到這個地方有我最喜歡的清酒之一（日日），我知道我必須去。

櫃檯座位和沙發可供放鬆的空間，令人放鬆。主人對清酒很了解，會問你平常喜歡喝什麼，並給你一些建議。房東很細心，會根據您的回饋推薦飲品，讓您感覺在這裡受到了很好的照顧。

每杯360台幣，如果總共購買4/8/12個，還有小折扣。

每種清酒都裝在特定的玻璃杯中，以增強風味和香氣。有些眼鏡還提前冷藏，我很欣賞對細節的關注！

我們3個人一共喝了9杯，每杯清酒都很美味。他們有如此獨特的選擇！我們喝了一杯提前放入冰箱的桂花高粱酒來結束這個夜晚，以賦予它美妙的口感。真正美味，甜美，花香濃鬱。

我希望我附近有一家這麼好的酒吧，我希望很快就能回來！","I noticed that there is one of my favorite sake (day) in this place, I know I must go.

The seats and sofas are relaxed.The owner knows how to clear sake, and will ask you what you like to drink and give you some suggestions.The landlord is very careful that you will recommend drinking drinks according to your feedback, so that you feel that you have been taken well here.

360 Taiwan dollars per cup, if you buy 4/8/12 in total, there are small discounts.

Each sake is installed in a specific glass to enhance the flavor and aroma.Some glasses are refrigerated in advance, I appreciate the attention of details!

Our three people drank a total of 9 cups, and each cup of sake was delicious.They have such a unique choice!We drank a cup of osmanthus sorghum wine in the refrigerator in advance to end this night to give it a wonderful taste.It's really delicious, sweet, and rich in floral.

I hope there is such a good bar near me, and I hope I will be back soon!",False
超級涼爽可愛的小地方，提供高級街頭美食和優雅的清酒！工作人員超級友好和熱情！非常適合在漫長的一天工作後吃點東西和喝點飲料！我想說的是治療經驗！ 🤗 …,"Super cool and lovely small places, provide high -end street food and elegant sake!Staff is super friendly and enthusiastic!It is very suitable for eating something and drinking after a long day of work!What I want to say is treatment experience!🤗 🤗 ...",False
"這顆隱藏的寶石隱藏在迷人的台北小巷中。店主多麗絲（Doris）是一位經過認證的清酒“侍酒師”，是一位出色的女主人，知識淵博且友善。

我和我女朋友根據我們的個人喜好提供了清酒：我們都很喜歡。當我們告訴多麗絲我的女朋友喜歡杜松子酒時，她拿出了一瓶漂亮的酒，我們在房子裡喝了兩輪。 100% 一次難忘的經驗。

價格也很合理：我們的4杯高級清酒總共1800元台幣。","This hidden gem was hidden in the charming Taipei alley.Doris, the owner, is a certified sake ""sommelier"". He is an excellent hostess, knowledgeable and friendly.

My girlfriend and I provide sake based on our personal preferences: we all like it.When we told Doris my girlfriend like Du Songzi wine, she took out a bottle of beautiful wine and we drank two rounds in the house.100% an unforgettable experience.

The price is also very reasonable: our 4 cups of senior sake of sake a total of 1,800 Taiwan dollars.",False
非常好喝每一瓶酒都很好喝，老闆店長都非常有心，每瓶灑都有他的故事，每道菜都有故事，真的很有❤️,Very delicious every bottle of wine is delicious. The owner's manager is very intentional. Each bottle has his story. Each dish has a story.,False
Leo是一位專業的清酒侍酒師，我很喜歡他的銷售推薦，他教了我們很多清酒知識。我在這個清酒酒吧度過了一段美好的時光。  一定會回來的。,LEO is a professional sommelier. I like his sales recommendation. He taught us a lot of sake knowledge.I spent a good time in this bartender bar.Will definitely come back.,False
"新發現的小酌一杯的好去處
選酒有獨到的見解，小吃也都正合心意
適合兩三密友聚聚聊天，推薦🥰 …","The new discovered drink is a good place to go
There is a unique insight in choosing wine, and the snacks are also in my heart
Suitable for two or three close friends to gather chat, recommend 🥰 ...",False
大推,Push,False
多麼棒的清酒吧啊！良好的氛圍和優質的清酒選擇同時出現！,What a great bar!A good atmosphere and high -quality sake choice appear at the same time!,False
一切都很好只是價格過高,"Everything is good, but the price is too high",False
感謝您度過了一個愉快的夜晚,Thank you for spending a pleasant night,False
