Original,EN,Needs Review,Positive,Negative,Neutral,Compound
環境非常適合線上開會,The environment is very suitable for online meetings,False,0.0,0.0,1.0,0.0
"水煙、咖啡、食物皆優質
店員最讚","Water smoke, coffee, and food are all high -quality
The clerk is the best",False,0.244,0.0,0.756,0.6369
燈光好氣氛佳老闆人超nice,"Lighting good atmosphere, boss super nice",False,0.762,0.0,0.238,0.8625
服務親切餐點好吃,The service kinder is delicious,False,0.697,0.0,0.303,0.7845
咖啡超級好喝 焗烤也超讚,"Coffee is super delicious, baked roasted",False,0.655,0.0,0.345,0.8225
超棒的咖啡館❤️晚上還有超棒的水煙☺️,Better cafe ❤️ There is a great water smoke at night ☺️,False,0.476,0.0,0.524,0.875
好棒 竟然是咖啡廳,It's great to be a cafe,False,0.451,0.0,0.549,0.6249
最讚的地方🥹🫶🏻又在政大多了一個家🥰 …,The best place 🥹🫶🏻 🥹🫶🏻 There is a home in Zhengzhong ...,False,0.198,0.0,0.802,0.6369
服務好品質氣氛佳,Good quality atmosphere is good,False,0.659,0.0,0.341,0.7003
不要去水煙館 所有動作都超級慢,Don't go to the water -tobacco hall all the movements are super slow,False,0.245,0.0,0.755,0.5994
水煙讚 爆米花讚 米香奶茶讚,Water smoke like popcorn rice fragrant milk tea praise,False,0.466,0.0,0.534,0.7269
巧克力千層好吃！老闆很親切,Chocolate is delicious!The boss is very kind,False,0.399,0.0,0.601,0.6105
很特別的茶，其它地方喝不到,"Very special tea, I can't drink it elsewhere",False,0.3,0.0,0.7,0.4576
水煙完全沒話說，超讚！,"Water smoke has nothing to say at all, so amazing!",False,0.364,0.0,0.636,0.7318
能夠放鬆的好地方～,A good place to relax ~,False,0.592,0.0,0.408,0.7003
咖啡好喝 水煙好抽 老闆nice,"Coffee delicious water cigarettes, soy sauce boss nice",False,0.52,0.0,0.48,0.7579
安靜又有好喝的咖啡❤️,Quiet and delicious coffee ❤️,False,0.425,0.0,0.575,0.5719
開到深夜的咖啡廳，讀書可以來,"Open the cafe late at night, you can come to read",False,0.0,0.0,1.0,0.0
店員耐斯 咖啡好喝 讚讚,The clerk Minsa coffee is delicious and praise,False,0.549,0.0,0.451,0.8074
餐點好吃 品牌用心 環保,Meal delicious brand is environmentally friendly,False,0.633,0.0,0.367,0.7845
必點隱藏套餐：老闆推拿,Must order hidden package: boss massage,False,0.0,0.0,1.0,0.0
店員非常親切😊 …,Clerk Emergency kind 😊…,False,0.588,0.163,0.25,0.7783
讚,praise,False,1.0,0.0,0.0,0.5574
環境憂，好喝好吃,"Environmental worry, delicious delicious",False,0.655,0.257,0.088,0.6705
專門為他的咖啡而來！,Come for his coffee!,False,0.0,0.0,1.0,0.0
悠閒寧靜放鬆的品嚐咖啡,Small and quiet taste coffee,False,0.0,0.0,1.0,0.0
服務很讚,The service is great,False,0.577,0.0,0.423,0.6249
環境很好 咖啡很好喝,The environment is very good coffee and delicious,False,0.535,0.0,0.465,0.7841
牛肉麵好粗,Beef noodles are so thick,False,0.0,0.0,1.0,0.0
水煙讚！老闆熱情,Water smoke like!Boss enthusiasm,False,0.516,0.0,0.484,0.4926
服務好氣氛佳,Good atmosphere,False,0.744,0.0,0.256,0.4404
店員很親切👍👍很放鬆 …,The clerk is very kind and relaxed ...,False,0.544,0.0,0.456,0.7996
念書的好地方,Good place to study,False,0.492,0.0,0.508,0.4404
老闆很nice👍 …,The boss is very nicei ...,False,0.0,0.0,1.0,0.0
氣氛佳,Good atmosphere,False,0.744,0.0,0.256,0.4404
調酒好喝,Blooming is delicious,False,0.649,0.0,0.351,0.5719
很放鬆的地方,Very relaxed place,False,0.636,0.0,0.364,0.5413
頂,top,False,1.0,0.0,0.0,0.2023
讚,praise,False,1.0,0.0,0.0,0.5574
服務很棒,The service is great,False,0.577,0.0,0.423,0.6249
讚ㄛ,Praise,False,1.0,0.0,0.0,0.5574
讚讚,Praise,False,1.0,0.0,0.0,0.5574
讚讚讚讚讚,Praise praise,False,1.0,0.0,0.0,0.802
老闆真的很好而且樂於助人，我們嘗試了水煙，它真的很好而且有很多口味。,The boss is really good and helpful. We tried the water smoke. It was really good and has a lot of flavors.,False,0.332,0.0,0.668,0.8573
這裡的水煙非常好，服務也很棒！傑夫耐心地解釋了它的工作原理以及可用的口味！,"The water smoke here is very good, and the service is great!Jeff patiently explained its working principle and available taste!",False,0.166,0.0,0.834,0.5827
深夜喝飲料/咖啡的好地方！時間也很方便,Drink beverage/coffee in the middle of the night!Time is also very convenient,False,0.0,0.0,1.0,0.0
氣氛很好,The atmosphere is very good,False,0.444,0.0,0.556,0.4927
好喝 好抽❤️,"Good taste, soble ❤️",False,0.42,0.0,0.58,0.4404
很棒,great,False,1.0,0.0,0.0,0.6249
感謝令人驚嘆的氣氛！,Thank you amazing atmosphere!,False,0.767,0.0,0.233,0.7644
可以,Can,False,0.0,0.0,1.0,0.0
一定是大拇指的啦,It must be a thumb,False,0.0,0.0,1.0,0.0
咖啡好喝,Coffee is delicious,False,0.649,0.0,0.351,0.5719
咖啡不錯😍 …,Coffee is good ...,False,0.492,0.0,0.508,0.4404
推推～～,Push ~~,False,0.0,0.0,1.0,0.0
很chill,Very chill,False,0.0,0.0,1.0,0.0
