Original,EN,Needs Review
"目前此餐廳只有提供兩種牛肉麵且無酒單；紅燒湯頭讓我聯想到滿漢全席，白湯部分則是比較像排骨湯，價格讓人驚訝。

調酒部分第一杯Gin fizz 氣泡感幾乎沒有，融水過度導致味道分離；第二杯Bee's knees喝起來蜂蜜與檸檬的味道沒有銜接的很好，主角Gin味道幾乎消失。

但店員服務態度很棒。","At present, there are only two kinds of beef noodles in this restaurant and no wine list; the braised soup heads reminds me of the full seat of Manhan, and the white soup part is more like pork rib soup. The price is surprising.

The first cup of the bartender part of the GIN FIZZ bubbles are almost absent, and the excessive melting water causes the taste to separate; the second cup of Bee's Knees has no connection with the taste of honey and lemon, and the protagonist GIN tastes almost disappear.

But the clerk's service attitude is great.",False
"酒吧和咖啡廳是在同個場地，也可以選擇吧檯的位置，晚上只提供調酒，沒有咖啡。

鹹食的部分只有兩款牛肉麵，上回吃過紅燒，這回選擇清燉。
清燉的白湯比較清淡些，但麵體一樣好吃，不過我個人比較喜歡紅燒，湯頭更有味道。

調酒的部分點了一杯“西西里的天空”，威士忌的味道比較嗆。
另外，還點了一杯「無酒精調酒」AKA Bubble，作為收尾。

調酒師很親切，耐心解說menu，剛好同時段有16人在戶外花園座位，頗熱鬧！

夜晚的氛圍感和白天很不一樣，但同樣頗有氣氛。","Bar and cafes are in the same venue. You can also choose the location of the bar. It only provides bartender at night without coffee.

There are only two beef noodles in the salty food. I have eaten braised burn last time.
The stewed white soup is lighter, but the face body is as delicious, but I personally prefer braised, and the soup is more flavorful.

The bartending part ordered a cup of ""Sicily Sky"", and the taste of whiskey was more stunned.
In addition, I also ordered a cup of ""wineless"" Aka Bubble as the end.

The bartender is very kind and patiently explained Menu. It happened that 16 people were in the outdoor garden at the same time, which was quite lively!

The sense of atmosphere at night is very different from the day, but it is also quite atmospheric.",False
"喜歡老宅改建的Vibe 燈光昏暗但不至於到連菜單酒單都看不到那種 貼心
調酒的酒感偏重但是香氣與味道相得益彰 搭配的很好 不是妹酒風格 可以感受調酒師的用心 聽說也都會每幾季換一次酒單
紅燒牛肉麵的牛肉無敵軟嫩 入口即化
服務人員友善 細心 還幫我們短短介紹了老宅的歷史

有機會會再訪的好店👍🏼","The VIBE light that likes the old house is dark, but I don’t even see that kind of intimateness when even the menu liquor
The alcoholic wine feels heavy, but the aroma and the taste complement each other well, not the girl's wine style, you can feel the bartender’s heart, you can change the wine list every few seasons
The beef beef beef beef is invincible soft tender entrance
The service staff is friendly and careful, and also helped us to introduce the history of the old house shortly

Good shops that have a chance to visit again 再",False
"晚上的 AKA，變身成為酒吧
進來要按鈴等Bartender 來帶
最好先訂位
當天週六晚上21:00來都還有位子

缺點是進入後覺得網路真的超級慢
店家表示也不提供Wifi,
希望讓大家好好聊天
嗯⋯⋯好吧

裡面有些區域是沒有冷氣的
在這種天氣下真的還蠻熱的
戶外是肯定受不了
但當天來室內的吧台都有人了

Bartender 解釋的很細心
加水速度也很快
每人有低消500，要記得點到

夏季酒單上的四杯調酒還不賴
但都偏濃，不是妹子會喜歡的
要找好喝的建議問一下

整體體驗普普通通","Aka at night, transformed into a bar
Come in and lock the bell and wait for Bartender to bring
It's best to book a place first
There are still seats on Saturday night at 21:00 that day

The disadvantage is that after entering, I feel that the Internet is really super slow
The store said that it does not provide WIFI,
I hope everyone can chat well
Hmm ... Okay

There are some areas there are no air -conditioning in it
It's really hot in this kind of weather
I can't stand outdoors
But there are people who came to the room that day

Bartender explained very carefully
The speed of adding water is also fast
Each person has a low consumption of 500, remember to come

The four cups of sake on the summer wine list are not bad
But it's all thick, not a girl will like it
Suggest it for a good suggestion to ask

Overall experience is ordinary",False
第一次跟朋友來慶生就愛上這家迪化街附近的酒吧，剛好當天大稻埕煙火也能些微看見。店內裝潢很有質感且氣氛非常棒，調酒也非常好喝且不貴。壽星朋友相當滿意，大力推薦！,"For the first time, I fell in love with this bar near Dihua Street with my friends. It was just that the Dadaocheng fireworks could be seen slightly that day.The interior of the store is very textured and the atmosphere is great, and the bartending is also very delicious and not expensive.Shouxing friend is quite satisfied and highly recommended!",False
很棒的環境！酒也好喝~,A great environment!The wine is also delicious ~,False
"第一次來大稻埕一帶喝酒，來之前必須預約，到場後按下電鈴等待帶位穿過特別的小巷弄。食物和調酒都別具特色，調酒的酒都給的很實在，和旅伴一杯就歇菜了，食物上調理的不錯，可惜泰式沙拉少了青木瓜一味還是少了點甚麼。除此之外座位間的間隔和店內花的擺飾都令人賞心悅目。離開前到了吧檯參訪才知道別有洞天，吧台有自己的酒單！最後一杯茶系列的ByeBye Shot作為句點讓人很想馬上再去二訪。
不過夏季的新酒單以琴酒居多，不喜琴酒的人不要對新酒單過度期待lol","When you come to Dadaocheng for the first time to drink, you must make an appointment before you come. After arriving at the scene, press the electric bell to wait for the seat to cross the special alley.Food and bartending are unique. The bartending wine is very real. I rest in a cup with the travel partner. The food is well conditioned. Unfortunately, the Thai salad is less or less.In addition, the interval between the seats and the decoration of the flower in the shop are pleasing to the eye.I visited the bar before I left before I realized that there are no holes, the bar has its own wine list!Byebye Shot in the last cup of tea series makes people want to go to the second visit immediately.
However, there are many new wines in summer. People who do n’t like piano wine do n’t look forward to LOL too much about the new wine list",False
"很酷的老宅酒吧。
得先預約按電鈴，就有人從狹長的巷子出來接你。在古時候的豪宅喝酒，別有一番風味，調酒類口感好又漂亮，熱炒好吃。","Cool old house bar.
You have to make an appointment for the bell, and someone will come out of the narrow alley to pick you up.Drinking in the mansion in ancient times, don't have a flavor. The bartending taste is good and beautiful, and it is delicious.",False
"隱藏在大稻埕巷弄的老宅改造酒吧
要入內請先在門口按鈴等候帶位，並且需要出示兩劑疫苗接種證明，這一點做得非常好值得讚許
古色古香且結合現代的高雅室內裝潢，無論室內、吧台或戶外的座位都不錯任君挑選，但戶外的座位天氣暖的時候應該比較適合
一直以來都聽說大稻埕充滿文青咖啡廳跟酒吧，老街整體改造的很不錯，今天隨意點名了一間試試，非常慶幸沒有踩雷
如果喜歡高雅幽嫻沒有一些年紀特別小的孩子們的酒吧，那你不妨試試這間在疫情期間誕生的新店
調酒都算是滿順口的，若是吧台的酒單還會附上一份下酒一口食，整體氣氛佳，店員十分親切
是近期造訪的新店中最喜歡的一間
會再訪
人均消費約NTD1,200(兩杯酒)","Hidden in Great Inari Lane Old Houses Remodeling Bar
To enter the first place in the door of the door to the salon waiting for the seat, and need to show the two doses of vaccination certificate, a little bit worthy of praise
Ancient colors and combining modern and elegant indoor decoration, both indoor, bar and outdoor seating are not wrong to choose, but the outdoors should be more suitable for the warm seats of the outdoors
I have always heard that the Great Hips is full of hipster cafes and bars. The overall renovation of Old Street is very good, and today, as he will name a try, it is very glad to be ridden
If you like the Gao Ya Guan Yu there is an age especially small children ying bars, Gao You could not try to try the new store during the pandemic
The cocktails are quite surviving, and if the wine list will also attach a bite to eat, the overall atmosphere is good, the clerk is very friendly
One of the most popular in the new store in recent visits
Will visit again
Consumption of about NTD1, 200 per person (two glasses)",False
"老宅風格環境很典雅
吧檯酒單很值得ㄧ試
台式熱炒給上適合的搭酒
Bartender 介紹的很棒","The old house style environment is very elegant
Bar wine list is worth trying
Fry the tabletable on the table for suitable wine
Bartender introduced greatly",False
百年古宅的文化內涵，靜謐的夜晚品著好酒，彷彿穿梭在現代與過去的時空體驗，以喝的藝術帶領感官進入大大稻埕的百年文化。,"The cultural connotation of a century -old house, a quiet night with good wine, as if traveling through the modern and past space -time experience, and led the senses to the century -old culture of Dadaocheng with the artist.",False
氣氛好只是有點太昏暗，建議訂位有蠻多種類的座位區域，當天抵達客人不多但這感覺很好，很像家中的客廳，有機會會想坐在吧台✨,The atmosphere is just a bit too dim. It is recommended that there are many types of seats in the reservation. There are not many guests on the same day but it feels good. It is very good like the living room in the home. I have the opportunity to sit in the bar.,False
"真的很舒服的一個空間
在大稻埕古宅裡面，很容易不小心就錯過了
庭院位置等部分可能等秋冬在試試看
酒的部分不是走特別特別有創意的那類型
但是都說好喝順口的","Really comfortable space
In Dadaocheng's ancient house, it is easy to accident
The garden position and other parts may wait for autumn and winter to try
The part of the wine is not the type that is particularly creative
But they all say that they are delicious",False
很細心解釋調酒並可以客製化調整，很推薦坐在庭園裡面，另外插花擺飾都很有意境！,"It is very careful to explain the bartending and can be customized. It is recommended to sit in the garden. In addition, the flower arrangement decoration is very artistic!",False
甜點擺設優美,Beautiful dessert furnishings,False
"酒都好好喝！尤其是招待的shot😆
在老洋房裡喝酒氣氛很特別，非常推薦！ …","The wine is delicious!Especially entertaining shot😆
The atmosphere of drinking in the old house is very special, it is very recommended!Mowing",False
"東西平凡但價格不平凡
服務人員態度也不符合這個不平凡的價格","Ordinary but extraordinary price
The attitude of service staff does not meet this extraordinary price",False
"茶酒跟長島冰茶都在水準之上
酒很好喝，推薦～
很有韻味的一間bar","Both tea wine and Long Island ice tea are above the standard
The wine is delicious, it is recommended ~
Very charm Bar",False
環境舒服愜意，調酒非常好喝，推推👍🏻👍🏻 …,"The environment is comfortable and comfortable, and the bartending is very delicious, push ...",False
"是個慵懶舒適的好地方
該店的特色調酒很好喝也有層次
絕對還會再來的好店🙂 …","It's a lazy and comfortable place
The shop's characteristic bartending is very good and there are layers
A good shop that will definitely come again ...",False
調酒很豐富，有融入大稻埕的特色，推薦！！,"The bartending is very rich, and it has the characteristics of integrating into Dadaocheng. Recommended!Intersection",False
推薦到位酒都很好喝，有機會會再來嘗試吧檯位子，大推,"It is recommended that the wine is delicious. If you have a chance, you will try it again.",False
"最特別順口好喝的長島～～
整體酒吧營造的氣氛獨樹一格 超級喜歡💕 …","The most special long island ~~
The atmosphere created by the overall bar is unique.",False
"裝潢非常美，甚至還有庭園造景。
服務人員都很親切，酒也很好喝！
是有做變化的經典調酒吧，也有提供特調。
整個很開心的喝酒體驗～","The decoration is very beautiful, and there are even garden landscapes.
The service staff are very kind, and the wine is also delicious!
There are classic bartenders who make changes, and there are also special adjustments.
The whole happy drinking experience ~",False
"My favorite bar in the town!
百年老宅挑高建築，從裡到外都充滿韻味，外廳特意保留原裝磁磚走入歷史，園景佈置精巧，飲酒同時催化想像力進入另個時空。
整體氛圍舒適自然，一再回訪的好店。謝謝調酒師帶領我們脫離喧囂。","My Favorite Bar in the TOWN!
The century -old house is full of charm from the inside out. The outer hall deliberately retains the original tiles into history. The garden scene is exquisitely arranged.
The overall atmosphere is comfortable and natural.Thank you bartender for led us to get rid of the hustle and bustle.",False
"那天剛好和朋友相約在寧夏夜市附近，想說找一家舒適可以聊天的酒吧，Google了一下，意外發現了AKA Quando Bar，真的是意外的驚喜！先打電話去詢問是否有營業，店員也很有禮貌的指引方向～
到了酒吧更是驚喜連連，酒吧保持了老宅邸的韻味非常的時髦同時又是一個很適合聊天放鬆的空間。酒吧分為兩區分別有不同的體驗，那天我兩區分別都有喝到不同的酒品，味道也非常有特色！個人非常喜歡！也非常推薦大家～","I just happened to meet with my friends near Ningxia Night Market that day. I wanted to find a bar that could be chatted comfortably. Google was unexpectedly discovered by Aka Quando Bar. It was really an unexpected surprise!First call to ask if there is business, the clerk is also very politely guided ~
When it comes to the bar, it is even more surprising. The bar maintains the charm of the old mansion is very fashionable. At the same time, it is a space that is very suitable for chatting and relaxing.The bar is divided into two districts with different experiences. On the day, I had different wines, and the taste was very distinctive!Personally like it!I also recommend everyone ~",False
好喜歡的酒吧，禮拜三晚上去的，雖然因為天氣很冷所以人沒有很多但是店員人非常的好也超級熱情酒也好好喝。我們坐在外面店員還會一直問我冷不冷要不要開暖氣跟毛毯🤍🫶🏼超級喜歡 已經承諾要再帶更多朋友去了😍🤠 …,"The favorite bar, I went to the evening of the evening, although because the weather was very cold, there were not many people, but the shopkeeper was very good and super enthusiastic.We sitting outside will always ask me to be cold or cold. Do you want to turn on the heating and blanket?",False
"有特定活動不推，有被取消訂位風險。
本來要幫朋友慶生，在生日前幾天訂位直接被取消，也沒說原因只說緊急無法接客，還沒進店體驗就很差。","There are specific activities that are not pushed, and the risk of reservation is canceled.
Originally, I had to help my friends to celebrate my birthday. A few days before my birthday was canceled, I did not say that the reason was that I could not pick up the guests in an urgent, and it was poor if I had an urgency.",False
酒 & 氛圍都是好中好的等級,The wine & atmosphere is a good level,False
"喝了Gin tonic 選用極Craft琴酒來飲用
香氣表現十足，唯一不完美的是氣泡感不足🥲
第二杯Caiprinha 知道這款酒但第一次飲用
很好喝，但不小心打翻，對調酒師感到萬分抱歉 …","Drink Gin Tonic to choose the polar CRAFT piano wine to drink
The aroma is full, the only imperfection is the insufficient bubble feeling 🥲
The second cup of Caiprinha knows this wine but the first time I drink
It's delicious, but I accidentally overturned and felt sorry for the bartender ...",False
"空間很美
調酒好喝","The space is beautiful
Blooming is delicious",False
店家不老實 訂位人數7位 電話中還有特別詢問是否有7人的位子  店家表確認後回電 都還沒接到店家回電 訂位訊息就收到已訂位完成 後續有接到回電後並告知目前有7人的位子 都搭車到店家了 店員才又告知店家有特殊規定7個人低消要8千  詢問為何剛剛電話中沒說 店員並告知那個電話是辦公室回電的和店家分開？？？ 是店家的特殊規定？？？ 價格我們也都接受了 但店員後續又說目前低消不能抵調酒只能抵開瓶（必須開整隻的）？ 這樣的服務真的很不能接受…,"The number of people who are not honest in the number of people who are not honest, and 7 of the 7 -calls of the number of people who specially inquire about whether there are 7 seat shops who have been confirmed after confirming that they have not received a call back to the store. At present, the seats of 7 people have taken the ride to the store. Only then did the store staff notify that the store had special regulations that 7 people had a low consumption of 8,000 to ask why the clerk did not say that the clerk was just on the phone and informed the call from the office to separate from the store?IntersectionIntersectionIs it a special regulation of the store?IntersectionIntersectionWe have also accepted the price, but the clerk later said that the current low consumption cannot be turned on to open the bottle (must be opened)?Such a service is really unacceptable ...",False
餐點只有牛肉麵，選項有點少。,"The meal is only beef noodles, and there are few options.",False
"超好喝的真的
CP值很高
雖然價格比較高
但調酒的層次非常豐富
喜愛品酒的朋友真的可以來試試看
主理人SAM的品質管控非常高
很值得過來試試看","Super delicious
CP value is very high
Although the price is relatively high
But the level of bartender is very rich
Friends who love wine tasting can really try to try
The quality control of SAM, the manager, is very high
Very worth trying to try",False
差勁的訂位服務，接聽人員不清楚現場狀況，並無告知到現場七人低消八千，且沒有辦法提供調酒，到店人員才告知，誰會去一個酒吧不能喝調酒的，還浪費計程車錢到店，現場人員說接聽訂位的人是辦公室人員不清楚規定……這素質…,"The poor booking service, the reception staff did not know the situation on the scene, and did not tell the seven people to consume 8,000 in the seven people at the scene, and there was no way to provide bartending. Wasting the taxi money to the store, the on -site staff said that the person who answered the booking was unclear ... this quality ...",False
調酒好喝，茶的香氣很足。,"The bartender is delicious, and the aroma of tea is enough.",False
"調酒很好喝，工作人員都很帥很好聊
非常謝謝今日兩位的貼心服務。
下次有機會一定會二訪😁 …","The bartender is delicious, the staff is handsome and very good to talk
Thank you very much for the two thoughtful services today.
I will visit the next time next time I have a chance ...",False
美麗的老洋宅，在店主的用心經營下，白天有水準的咖啡，晚上有特色的調酒，我喜歡的台北市調酒，這家絕對在前三名,"The beautiful old house, under the intention of the owner, has a standard coffee during the day, and has a distinctive bartending at night. My favorite Taipei City bartender. This one is definitely in the top three.",False
氣氛很好，每一個區域都各有特色，調酒很不錯,"The atmosphere is very good, each area has its own characteristics, and the bartender is very good",False
很棒！大稻埕就該喝這樣！,great!Dadaocheng should drink this!,False
"訂位到店後 才說低消8000
調酒不算低消 開瓶才算
就是爛 不推","After booking the store, I said that the low consumption is low 8000
The bartender is not a low and the bottle is not counted.
Just don't push",False
環境舒適安靜有設計感，調酒多樣味道很有層次和深度,"The environment is comfortable and quiet, and the taste is very layered and depth.",False
"位於迪化街老宅的隱藏酒吧
完美融合vintage跟新潮
非常喜歡這裡的氛圍跟酒","Hidden bar located on the old house of Dihua Street
Perfect fusion vintage and trendy
I like the atmosphere and wine here very much",False
"調酒非常精緻、場地也很有自己的風格
大推","The bartender is very delicate and the venue has its own style
Push",False
空間美，氣氛舒適,"The space is beautiful, the atmosphere is comfortable",False
氣氛不錯,The atmosphere is good,False
燈光美氣氛佳，品酒放鬆的好地方！,"The lights are beautiful, and the wine tasting is good!",False
位置很隱密,The location is very secretive,False
隱身在巷弄內的小酒館，環境優美，推推推,"The small tavern in the alley is beautiful, the environment is beautiful, push push",False
"酒好喝、氣氛也棒
推推","The wine is delicious and the atmosphere is also great
Push",False
氣氛好！調酒強,The atmosphere is good!Bartender,False
非常推薦，一定要來,"Recommended, must you come",False
室外空間很舒服,Outdoor space is very comfortable,False
真的讚死,Really praise,False
喝就對了,Just drink it,False
讚的要命,Terrible,False
空間驚艷,Spatial stunning,False
💪💪💪 …,💪💪💪 …,False
"這曾經是我在台北最喜歡的工藝雞尾酒吧。雞尾酒美味且原創，調酒師友好且才華橫溢。我和我的朋友每次回到台北都會在這裡至少喝一次酒（上次是一年多前）。

昨晚我終於回到了 AKA 酒吧，經歷了一次極其令人失望的經歷。長直髮的男調酒師似乎對我們想坐在吧台的位置感到惱火（儘管我們特意預訂了兩個吧台座位）。他懶得向我第一次來的朋友解釋他們的無菜單概念，所以我不得不向她講述整個故事，就像我在那裡工作一樣。由於雞尾酒是調酒師根據我們的口味在現場調製的，所以調酒師通常會在上桌時向我們介紹飲品。這位長髮調酒師一言不發地把飲料遞給我們，當我要求他簡單解釋一下飲料是什麼時，他再次表現出了他的惱怒。最糟糕的是，在他們關門前一個小時，他開始打哈欠並抱怨太晚了，讓我們感到不受歡迎。

如果這位調酒師製作的飲料非常棒，那麼他的惡劣態度也許還可以忍受，但說實話，它們很平庸。發生了什麼事，又名 Quando 酒吧？

跳過這個地方，試試 PUN 或 Bar Pine 的 Nest。","This was my favorite craft cocktail bar in Taipei.The cocktails are delicious and original, and the bartender is friendly and talented.Every time my friends and I return to Taipei, I will drink at least once here (last time it was more than a year ago).

Last night I finally returned to the AKA bar, experiencing an extremely disappointing experience.Long -hair male winemakers seem to be annoyed by the position of us wanting to sit on the bar (although we deliberately book two bar seats).He was too lazy to explain to my first friend to explain their menu concept, so I had to tell her the whole story, just like I was working there.Since cocktails are prepared on the spot according to our taste, the bartender usually introduces us drinks to us when serving.The long -haired winemaker gave us the drink without saying a word. When I asked him to explain what the drink was, he showed his anger again.The worst thing is that one hour before they closed the door, he began to yawn and complained too late, making us feel uncomfortable.

If the drink made by the bartender is great, then his bad attitude may be tolerated, but to be honest, they are mediocre.What happened, also known as Quando bar?

Skip this place, try the Nest of Pun or Bar Pine.",False
"老民居改造而成的咖啡吧📍

氣氛非常好，工作人員友善而有禮貌。

不過，或許是因為每杯飲品都是用心製作的，所以上飲品的時間比較長，所以要耐心等待。
（一杯雞尾酒約2,000日圓）","Coffee made from old people's residence 📍

The atmosphere is very good, the staff is friendly and polite.

However, perhaps because each drink is made of intention, it takes a long time to get on the drink, so wait patiently.
(A cup of cocktail is about 2,000 yen)",False
