Original,EN,Needs Review
"絕對喜歡這個地方！ 🔥💯
非常獨特和特別的酒吧，飲料也不錯，但遺憾的是我們去那裡的那天，其他顧客太吵了。這真的很破壞心情，我們無法真正享受這段時光，很快就離開了💔
它是為了保持安靜而寫的，但事實並非如此。

但無論如何，我們還是很想回來。希望下次我們能更好地享受它。","I definitely like this place!Bleak
Very unique and special bar, drinking well, but unfortunately, the day we went there, other customers were too noisy.This is really destroying the mood. We can't really enjoy this time, and soon left 💔
It is written to keep quiet, but this is not the case.

But in any case, we still want to come back.I hope we can enjoy it better next time.",False
"空間是如此的寬敞和美妙，你無法從非常狹窄的入口想像它。
咖啡很好吃","The space is so spacious and wonderful, you can't imagine it from a very narrow entrance.
Coffee is delicious",False
"很高興坐在花園裡，但也對家庭團體的噪音翻白眼……好吧，你不能魚與熊掌兼得。

#food #dessert #sweet #teaset #coffee #cafe #taipei #taiwan #holiday #oldhouse #treat #garden #預約制","I am very happy to sit in the garden, but also turn my eyes on the noise of family groups ... Well, you can't have both fish and bear's paw.

#Food #Dessert #Sweet #Teaset #Coffee #cafe #Taipei #Taiwan #Holiday #OLDHOUSE #Treat #Garden #",False
"避免避免避免。可怕的服務。平庸的飲料。不會再回來了。

台北還有很多很多更好的酒吧可以去。","Avoid avoid.Terrible service.A mediocre drink.I won't come back again.

There are many, many better bars in Taipei.",False
與店主和調酒師的美妙體驗。他們策劃場地和飲料的方式是獨一無二的。友善的團隊總是讓你感覺像和親密的朋友一起出去玩，他們會照顧到一切細節。,"The wonderful experience of the owner and the bartender.The way they plan the venue and drinks are unique.The friendly team always makes you feel like you go out with friends who are close, and they will take care of all details.",False
平日晚上喝睡前飲料的好地方。安靜祥和，是在漫長的工作日後享用精心調製的雞尾酒來平靜/放鬆靈魂的完美場所。服務、環境和氛圍都很棒。強烈推薦！,"Drink a good place for bedtime in the evening.The quiet and peaceful is the perfect place where the cocktails are carefully prepared in the future to calmly/relax the soul.Service, environment and atmosphere are great.Recommended strongly!",False
一個難以辨認的酒吧。完美的服務。令人眼花撩亂的雞尾酒。舒適的環境。還碰巧提供了令人難忘的牛肉麵。一本是記憶書。,An incredible bar.Perfect service.The dazzling cocktail.A comfortable environment.It also happened to provide unforgettable beef noodles.One is a memory.,False
氣氛很好。好喝的飲料。友好的調酒師。來台北一定要去的酒吧。,The atmosphere is very good.Drink drink.Friendly bartender.The bar you must go to Taipei must go.,False
"我們在最後一刻取消了。沒有給出理由。當詢問時非常粗魯的主人。

不要去這裡！","We canceled it at the last moment.No reason is given.When asked very rudely.

Don't go here!",False
即使谷歌地圖上說這個地方是開放的，但這個地方還是關門了。我們無法到達酒吧。,"Even though Google Map said that this place is open, this place is still closed.We can't reach the bar.",False
齁拎,Sorrow,False
很棒的氛圍很棒的雞尾酒,A great atmosphere is great cocktail,False
