Original,EN,Needs Review
"氣氛超好🩵🩵Betty很健談也很耐心地跟我們介紹不同的調酒~~ 抱歉另外一位沒問到名字QQ
Cocktail的部分嘗試了 You Are the Apple of My Eye! 當時介紹的時候有提到這一款會比較甜~ 因為我本身比較怕甜，Bartender有根據我們的口味調整cocktail的甜度🥺🩵 讚讚絕對會回訪🥰","The atmosphere is super good 🩵🩵Betty is very talkative and patiently introduce different sake of bartending to us ~~ Sorry for another one without asking the name QQ
Part of the Cocktail tried You are the apple of my eyes! When I introduced it at the time, I mentioned that this one would be sweeter ~ because I am more afraid of sweetness, Bartender has adjusted Cocktail's sweetness according to our taste. Will return to visit 🥰",False
"氛圍很好的酒吧！
老闆人很nice又健談，bartender也都非常樂意幫忙做符合各個客人期待的調酒，Mojito使用的薄荷還是酒吧門口盆栽現摘的😂超新鮮超好喝
去過幾次，每次不管是台灣客人還是外國客人在這間酒吧都玩得很開心🥺❤️ …","Bar with good atmosphere!
The boss is very nice and talk, Bartender is also very happy to help the bartender that meets the expectations of each guest.
I have been to this bar every time, whether it is Taiwanese or foreign guests in this bar very happy 🥺 ❤️ ...",False
"新開幕！白天咖啡廳, 餐點強調健康低Gi。減醣料理~好吃又沒負擔,老闆用心配色配菜,每個都現做現煮, 非常推薦大家來品嚐~","New opening!During the day, the meal emphasizes low GI.Sugar reduction ~ delicious and no burden, the boss's heart color matching side dishes, each of which is made of cooked, it is recommended to taste it very much ~",False
雙連2號出口右轉巷弄有著可愛的cafe.舒適，咖啡不錯！資深營養師把關的餐點，超推～,"Shuanglian 2 exit and right -turning alley with cute Cafe. Comfortable, coffee is good!The meal that the senior nutritionist checks is super pushed ~",False
來到一間不錯的餐廳，對個人比較在意的是寵物友善的餐廳，餐點非常的在乎健康~!口味上好吃又不負擔!!我特別喜歡軟法的口感像極了高級飛機餐~! 如果喜歡唱歌，也有一個秘境可以開會的地方~!8,"When I came to a good restaurant, I was more concerned about the friendly restaurant of pets. The meal cares very much about health ~! The taste is delicious and irresistible !! I especially like the taste of the soft method like a high -end aircraft meal ~ ! If you like to sing, there is a place where you can meet ~! 8",False
舒肥雞餐主食選用紫米飯，蔬菜沙拉調味恰到好處，雞肉不油膩，是營養相當均衡豐富的低GI餐點。交通方便。老闆非常親切,The main food of Shu fat chicken meals is used for purple rice. The seasoning of vegetable salad is just right. The chicken is not greasy. It is a low -GI meal with a very balanced nutrition.Convenient transportation.The boss is very kind,False
"跟朋友臨時起意的酒吧～
氣氛不錯，美女服務員很熱情介紹&貼心的滿足朋友的炸薯條心願🤣
聽說這家的餐點屬於養生系列，今天大廚不在，下次可以再來試試看❣️ …","Bar that is temporarily coming with friends ~
The atmosphere is good, the beauty waiters are very enthusiastic about introducing & intimately satisfying friends’s fries' wishes 🤣
I heard that this meal is a health series. Today the chef is not there. I can try again next time ❣️ ...",False
新開幕！試賣中的早午餐與下午茶！ 晚上原本就是Vault 酒吧！ 樓上是很有風格的混搭設計樓下則是晚上酒吧包場的VIP區域！ 8/1剛試賣打折中，粉推薦！,"New opening!Sub -trial breakfast and afternoon tea!It was originally a Vault bar at night!Upstairs is a very stylish mixed design downstairs, downstairs is the VIP area of ​​the bar charter at night!8/1 Just trial selling discounts, fans recommend!",False
"雖然餐點選擇不多，但十分美味。
軟嫩不柴的雞胸肉很不客氣的給好給滿，配菜們也都非常好吃！","Although there are not many meals, they are very delicious.
The soft and tender chicken breasts are very polite, and the side dishes are very delicious!",False
新開的咖啡廳喔！重點是這餐點健康低Gi。減醣料理～咖啡也很好喝！,Newly opened cafes!The point is that this meal is healthy and low.Sugar reduction ~ coffee is also delicious!,False
"八天的知道我是菜鳥後特別為我調製的特調🥰
初嚐是甜甜的味道 到後面帶點檸檬的酸味 很好喝
不會一下子就醉 可以慢慢品嚐酒的層次
第二杯摩西多的薄荷和酒超搭❤️‍🔥
知道我不喜歡酒味太久 bartender 把氣泡加多一點 降低酒的味道 結果超好喝！！！
是我喝過最好喝的調酒 不會醉 又可以享受到酒帶給我的層次 🤩
裡面的姐姐很專業 也很好聊 這家酒吧推推！","After knowing that I was a rookie, I was specially prepared for me after I was a rookie 🥰
The first taste is a sweet taste to the sour taste of the lemon behind
If you don’t get drunk at once, you can slowly taste the level of wine
The second cup of Moses of Mint and wine superb ❤️‍🔥
Knowing that I don't like the taste of wine for too long Bartender, add a bit more to reduce the taste of the wine, the result is super delicious!IntersectionIntersection
It ’s the best bartender I have ever drinking. I’ m not drunk. I can enjoy the levels that wine brought to me.
The sister in it is very professional and very good to talk about this bar push!",False
調味十分不錯，有別於相同價位的義大利麵，蛤蜊很多顆，可以五星XD,"The seasoning is very good, different from the pasta at the same price, there are many clams, which can be five -star XD",False
餐點好吃，晚上8：00後變酒吧，店內乾淨無煙味，非常適合三五好友小酌一杯！,"The meal is delicious. After 8:00 in the evening, the bar will be changed. The shop is clean and non -smoke. It is very suitable for a drink of three or five friends!",False
"食物超多 超美
吃起來很沒負擔
貓店長超可愛，
老闆娘很漂亮，
老闆很帥，但有點發福
應該是為了幫老闆減肥菜色才這麼健康好吃

#有貓店長就給讚 (y)","The food is super beautiful
It is very unreasonable to eat
The cat shop is super cute,
The boss is very beautiful,
The boss is very handsome, but a bit blessed
It should be to help the boss to lose weight to the dishes so healthy and delicious

#(Y)",False
晚上八點前是餐廳，八點後是酒吧。餐廳標榜的是健康環保，不油不膩，味道出奇的好,"Before eight o'clock in the evening, there is a restaurant, and it is a bar after 8 o'clock.The restaurant is advertised as healthy and environmentally friendly, not oily, non -greasy, and surprisingly tasteful.",False
店內的吧檯團隊真誠、健談，雞尾酒的基酒也不隨便，很高興能發現這個地方，度過一個看似孤單卻不孤單的夜晚時光。,"The bar team in the shop is sincere and talkative, and the cocktails are not casual. I am glad to find this place and spend a seemingly lonely but not alone night time.",False
"牛肉超嫩
沙拉醬清爽可口
飲料好喝
甜點不過甜不膩

真的很優👍很好吃欸！","Beef super tender
Salad sauce refreshing and delicious
Drinks delicious
Dessert is not sweet and not greasy

It's really good and delicious!",False
"白天重新開幕，營業時段10：00開始
新餐點主打健康低熱量，份量誠意十足，重點是店員都好可愛！推~","Open again during the day, starting at 10:00 business hours, starting at 10:00
The new meal is mainly healthy and low -calorie, with sincerity, the focus is that the staff is so cute!Push ~",False
舌尖上的滿足，如果你品調酒，如果你想要一個會過12點的私人環境，這裡是個好選擇。,"The satisfaction on the tip of the tongue, if you tube bartender, if you want a private environment that will pass at 12 o'clock, this is a good choice.",False
"離捷運站超近的～回家可以很方便😆
酒也是可以跟Bartender 討論出自己想要的風味～不喝酒的也可以在這邊喝到有特色的通寧水～ …","It's closer to the MRT station ~ It can be very convenient to go home 😆
You can also discuss the flavor you want with Bartender ~ Those who do not drink can also drink the distinctive Tongning water here ~ ...",False
"紅玉那堤很香、今日有草莓千層蛋糕非常好吃，層層分明且奶油很滑順不膩🥰

（不過我原本以為是裡面也有草莓，結果是上面有草莓、口味應該是原味的🤣） …","Red jade is very fragrant. Today, strawberry thousands of cakes are very delicious.

(But I originally thought that there were strawberries inside, but there were strawberries on it.",False
"看過來 看我的評論準沒錯
很有特色的餐點
而且價格划算
吃超飽～

招待的私房起司蛋糕很美味
跟坐我對面的妹仔一樣
讚讚讚

不過這是招待的
你們沒有
跟坐我對面的妹仔一樣

哈哈哈","Look at my comments, right
Very distinctive meal
And the price is cost -effective
Full of food ~

The private housing cheese cake entertainment is delicious
Like the sister who is sitting opposite me
Praise

But this is entertaining
You do not
Like the sister who is sitting opposite me

Hahaha",False
"沙拉新鮮好吃、環境舒適、交通方便
店員親切熱情
適合與朋友放鬆小酌的好地方","Fresh and delicious salad, comfortable environment, convenient transportation
Careful enthusiasm for the clerk
Suitable for a good place to relax with friends",False
酒好喝！氣氛很好！來慶生很開心🥳,The wine is delicious!The atmosphere is good!I am very happy to come to celebrate 很,False
老闆娘美麗又熱情，環境舒適，讓我們三個女生在那能夠很放鬆的喝酒聊天💕 …,"The boss lady is beautiful and enthusiastic, and the environment is comfortable. Let the three of us three girls drink very relaxed and drink 💕 ...",False
"像家裡附近的咖啡廳
親和 自在
適合週五下班後藏匿的避難所","Like a cafe near home
Affection
Suitable for the refuge hidden after get off work on Friday",False
"商業午餐的醬燒牛肉蓋飯/黑胡椒骰子牛肉飯CP值超高
地點靠近捷運站又很方便
飲料超級大一杯！極推~~~","Commercial lunch beef rice rice rice/black pepper dice beef rice CP value is super high
The location is close to the MRT station and it is very convenient
Drink is a big cup!Push ~~~",False
氣氛好，酒好喝，跟Betty聊天很開心❤️有療癒到的感覺，下次帶朋友來～,"The atmosphere is good, the wine is delicious, and I am very happy to chat with Betty.",False
"新開幕的Cafe，東西好吃環境很舒服
是個朋友聚餐打發時間的好地方！👍👍 …","The newly opened Cafe, the delicious environment is very comfortable
It's a good place for a friend to dinner and pass the time!👍👍 👍👍 ...",False
餐點超好吃!!擺盤配色看了賞心悅目，觀感極佳的好店~大推!!,"The meal is super delicious !! The scheme of the disk is pleasing to the eye, the good shop with excellent view ~ Da push !!",False
點壺果茶，配上一口口的糕點，再來些悅耳的音樂，很放鬆、很舒服的環境，很適合洗滌心靈，遠離城市的吵雜！,"Point pot of fruit tea, with a mouthful of pastry, and some pleasant music, a very relaxed and comfortable environment, it is very suitable for washing the soul and far from the city's noisy!",False
"點了冰滴，看錯價格，雖可接受，但內用卻是外帶的兩倍呢…
冰滴不錯，香，濃，醇~","I ordered the ice droplet and saw the wrong price. Although it was acceptable, it was twice the internal use ...
The ice drops are good, fragrant, thick, mellow ~",False
離捷運站hen近，貝果很好吃，蘋果優格飲超好喝~推推推!,"Near the MRT station HEN, Beigu is delicious, Apple Yogeng is super delicious ~ Push push!",False
早上11：00-20：00可以用餐，用餐環境很輕鬆，偶爾店員也會跟你聊ㄧ下，也能跟朋友一起渡過午後時光；晚上20：00後就是喝酒的bar，也會在這遇到ㄧ些外國人或是日本人，老闆跟bartender 服務都很親切，調酒也好喝，偶爾也會有不定期的活動，禮拜五晚上想小喝也很適合。位在雙連捷運站2號出口，交通方便，叫計程車也很快。,"You can dine at 11: 00-20: 00, and the dining environment is very easy. Occasionally, the clerk will talk to you, and you can spend the afternoon with your friends; after 20:00 in the evening, you will drink BAR. When encountering some foreigners or Japanese, the boss and Bartender are very kind, and the bartending is also delicious. Occasionally there will be irregular activities. On the Friday, it is also suitable for drinking to drink.It is located at No. 2 of Shuanglian MRT Station. The transportation is convenient and the taxi is also fast.",False
"調酒師是美女(˶‾᷄ ⁻̫ ‾᷅˵)酒也很好喝
來的話可以指定betty 通常五六出沒","The bartender is a beautiful woman (⁻̫ 美 ‾᷅˵) wine is also very delicious
If you come, you can specify Betty",False
份量足夠食材新鮮😋😋值得一訪再訪 …,"The weight is enough ingredients, fresh 😋😋 It is worth visiting again ...",False
餐點超好吃，份量也十足！店裡氣氛也很好，超推薦～,"The meal is super delicious and the portion is full!The atmosphere in the store is also very good, it is super recommended ~",False
"店裡氛圍讓人很舒服,餐點也不貴，適合幾個好朋友一起來渡過悠閒的午後時光，店員服務態度也很親切","The atmosphere in the store is very comfortable, and the meal is not expensive. It is suitable for a few good friends to come through the leisurely afternoon time. The service attitude of the clerk is also very kind.",False
下午時間過來吃， 蔬菜新鮮沙拉和風醬，牛排處理的偏熟但好吃，附的是紫米飯,"Come and eat in the afternoon, the vegetables of fresh salads and wind sauce, and the steak processing is familiar but delicious.",False
調酒師Betty活潑熱情 環境舒適 下班來喝一杯剛剛好🍺 …,"The bartender is lively and enthusiastic environment, comfortable, come from get off work to drink a cup just ...",False
店裡氣氛很好，店員很nice很認真介紹，可以找到你想要的酒，不知道要喝什麼他們也會推薦，過程中也會和你有一些互動，酒水也很不錯，是會讓人想二訪的店。,The atmosphere in the store is very good. Want to visit the shop.,False
沙拉超新鮮，舒肥牛很好吃，又有糖心蛋，優格，咖啡也很優,"The salad is super fresh, the fat beef is delicious, and there are sugar -hearted eggs, yogurt, coffee is also very good",False
"第一次來～
本身不喜歡威士忌和通寧水味道。
調酒師就猜到我不喜歡有氣泡的～
幫我特調了環遊世界，酒感重，好喝🤩
超喜歡～～
以後有機會會再來❤️","Come for the first time ~
I don't like whiskey and Tongning water.
The bartender guessed that I don't like bubbles ~
Help me swim around the world, the wine feels heavy, it's delicious 🤩
I like ~~
I will come again in the future ❤️",False
氣氛佳，環境好。附上最新菜單。,Good atmosphere and good environment.Attach the latest menu.,False
"空間不大但是酒不錯喝
店員也蠻幽默的","The space is not big, but the wine is good
The clerk is also very humorous",False
"Bartender 很專業也很健談
是一段快樂的午夜時分","Bartender is very professional and talkative
It's a happy midnight",False
Shots和調酒都很好喝，老闆和bartender 都很親切！,"Shots and bartending are delicious, both boss and Bartender are very kind!",False
舒服的用餐環境，店員服務親切，重點餐點都好好吃!!! 真的推推推~~~,"A comfortable dining environment, the clerk's service is kind, the key meals are delicious !!! Really push ~~~",False
裝潢很美，餐點好吃，還可以唱歌,"The decoration is beautiful, the meals are delicious, and you can sing",False
餐點好吃 氣氛好 晚上八點之後會換風格,The meal is delicious and the atmosphere will change the style after eight o'clock in the evening,False
"份量非常充足（照片是一人份，真的非常豐盛多樣）味道也不錯，口味走清爽路線，很適合不喜歡吃太油膩的朋友。
今天點舒肥雞胸肉沙拉餐（如照片），雞肉有點微辣，配上大量的生菜以及好吃的凱撒醬非常爽口！烤蔬菜也很豐盛多樣化，麵包烤得又酥又脆。整體來說很滿意，服務人員的服務態度也很好，有機會會再回訪~~","The portion is very sufficient (the photo is one person, it is really rich and diverse). The taste is also good. The taste is refreshing. It is very suitable for friends who don't like to eat too greasy.
Today, I ordered Shu Fei chicken breast salad (such as photos). The chicken is a bit spicy, with a large amount of lettuce and delicious Caesar sauce very refreshing!Baked vegetables are also rich and diverse, and the bread is crispy and crispy.Overall is very satisfactory, the service staff's service attitude is also very good, I have the opportunity to return to visit ~~",False
分量真的很多，東西超好吃的😋 …,"There are really a lot of weight, things are super delicious ...",False
毫無壓力氣氛非常輕鬆平易近人,"There is no pressure atmosphere, very easy and easy to get closer",False
"和朋友來到這家位於捷運站附近巷弄內的輕食小館聚餐☺️
當天和朋友各點了一份沙拉餐，大約三百元左右就能精緻豐富的餐點，份量對於女生來說非常的有飽足感！整頓飯吃下來覺得CP值滿滿🥰
餐廳還特別說明是寵物友善餐廳～會想要讓人一來再來！
因為是週六一早來的，到了尖峰時間位置已經快被坐滿，建議想來用餐的人可以事先訂位😉 …","Come to this light food gatcher in the alley near the MRT station ☺️
On the same day, I ordered a salad meal with my friends. It was a delicate and rich meal for about 300 yuan. The amount was very full for girls!Rectify the meal and eat it and feel that the CP value is full
The restaurant also specifically explained that it is a pet friendly restaurant ~ I will want to make people come again!
Because it came on the morning of Saturday, the position of the peak time was almost filled. It is recommended that those who want to eat can order in advance ...",False
營養健康好吃的早午餐料理👍🏻 …,"Nutrition, healthy and delicious brunch dishes 👍🏻 ...",False
"離雙連站步行只要2分鐘的好吃餐廳😋
這次用餐選擇沙拉餐，飽足感十足而且一個餐裡品項超豐富，真的很難得可以一次吃到10種不同的蔬果！好菜好肉和不過度的調味就是美味又滿足的一餐😋
店家不收服務費而且寵物友善，但座位數偏少可能遇假日時先訂位會比較保險👍 …","A delicious restaurant for only 2 minutes from Shuanglian Station 😋
I chose a salad meal for this meal. It is full and a meal is very rich. It is really difficult to eat 10 different fruits and vegetables at a time!Good dishes, good meat and non -excessive seasoning are delicious and satisfying meals 😋
The store does not charge the service fee and is friendly, but the number of seats may be more secure when the seat is pre -ordering ...",False
"空間舒適、蛋糕好吃、咖啡好喝
很適合喝下午茶店的一間店","Comfortable space, delicious cake, coffee delicious
It is very suitable for a shop in the afternoon tea shop",False
"早午餐好好吃～
營養又健康❤️","Summer lunch is delicious ~
Nutrition and health ❤️",False
燈光好👍氣氛佳👍價格合理👍非常推薦 …,Good lights 👍 The atmosphere is good. The price is reasonable 👍 Very recommended ...,False
"這次整完骨後，想喝杯咖啡吃個簡單的沙拉🥗，在附近找到這間咖啡廳，店內裝潢簡單舒服，也是寵物友善的餐廳唷。
餐點很推！份量很實在，尤其是沙拉餐！真的很多很好吃！肉是我最愛❤️的舒肥雞和舒肥牛！認真大推
飲料也很好喝喔⋯⋯ …","After finishing the bones this time, I want to drink a cup of coffee and eat a simple salad. I found this cafe nearby. The interior of the shop is simple and comfortable. It is also a pet -friendly restaurant.
The meal is very pushing!The weight is very real, especially salad meals!A lot of delicious!Meat is my favorite ❤️ Shu fat chicken and Shu fat cow!Seriously push
The drink is also very delicious ... ...",False
今天單純來喝酒沒用餐，調酒平平，氛圍ok,"Today, I just came to drink and did n’t eat. The bartender was flat, and the atmosphere was OK",False
外送時間快速，不到15分鐘就到了.而且訝異的是雖然是外送餐點，但包裝細心程度跟味道的堅持感覺到老闆的用心！很懷念上次去店裡吃的青醬海鮮焗烤麵讓我印象深刻！而且聽說晚上不定期會推出新式調酒，改天ㄧ定要去小酌ㄧ下！,"The delivery time is fast, and it is arrived in less than 15 minutes. And although it is the delivery point, the packaging of the packaging and the taste of the taste feel the intention of the boss!I miss the green sauce seafood baked noodles I ate in the store last time, which impressed me!And I heard that new bartending will be launched at night, and it will definitely be a drink!",False
很舒服的餐廳，餐點也不錯,"Very comfortable restaurant, meals are also good",False
"雙連站二號出口出來後右邊小路迴轉進去就看得到店家，餐點份量大方，服務周到。
沙拉醬有巧思，油醋是有層次的味道，水果茶一定要點，完全沒有喝過的香氛體驗，下次會再帶朋友光顧！！","After the exit of the No. 2 exit of Shuanglian Station, the small road turn around and see the store. The meal is generous and the service is thoughtful.
Salad sauce is ingenious. Oil vinegar has a layered flavor. Fruit tea must be clicked. The fragrance experience that has not been drank at all. I will take friends again next time!Intersection",False
"點兩杯拿鐵﹑一片厚片土司，送來一杯拿鐵後，跟我們說沒鮮奶叫我們點其他飲品。

我看了看菜單，沒多久另一店員說有鮮奶，就繼續做拿鐵，所有餐點上完約花了10～15分鐘，做餐點期間店員還出去跟別人拍照，餐點又偏貴共花了360，同樣價格我會去星巴克消費。

門口有貼悠遊卡消費，店員一句我不會用，只有晚班會用，就不給用悠遊卡，依上述經驗，我個人不會去第二次也不會推薦朋友去。","Click two cups of latte and a thick piece of earth. After sending a cup of latte, we told us that there was no fresh milk to call us other drinks.

I looked at the menu. It didn't take long for another clerk to say that there was fresh milk, so I continued to make latte. It took about 10 to 15 minutes after all meals. During the meal, the clerk went out to take pictures with others. It costs 360, and I will spend on Starbucks.

At the door, there is a Youyou card consumption. I do n’t use the shop clerk. Only the evening shift will be used. I do n’t give the Youyou card. According to the above experience, I personally do n’t recommend friends for the second time.",False
"週一因緣際會的到了雙連站,覺得肚子有些餓,於是就近找了一間餐廳用餐
看著有些文青的店面裝潢,便走了進去
原只是隨性的舉動,並未有太多的期待
但餐點送上來的那刻,著實讓我非常驚艷
料理的擺盤是精心的設計,將每項食物料理的恰到好處
保留食物的原型,更是符合現代健康飲食的習慣
牛肉的香氣令人食指大洞

用餐環境舒適,餐後點一杯香氣十足的拿鐵,相當的滿意
是值得多次到訪的餐廳,建議各位專程前往,只是店家的座位數較少,建議先預約,以免向隅","I arrived at Shuanglian Station on Monday because I was hungry, so I found a restaurant for dining nearby.
Looking at some Wenqing store decoration, I walked in
Originally, it was just a random move, and there was not much expectation
But the moment the meal came up, it really surprised me
The dish of cooking is carefully designed, and the food is just right.
The prototype of food is in line with the habit of modern healthy diet
The aroma of beef makes the index finger hole

The dining environment is comfortable, and after the meal, order a cup of aroma latte, which is quite satisfied
It is a restaurant worth visiting many times. It is recommended that you make a special trip, but the number of seats in the store is small. It is recommended to make an appointment to avoid going to it.",False
"蛤蜊特別水潤大顆
因為蛤蜊有四顆我也給四顆","The clams are particularly hydrated
Because there are four clams, I also give four",False
渡過一個安靜舒適的週六下午,Cross a quiet and comfortable Saturday afternoon,False
東西好吃。沙發很舒服。,Things are delicious.The sofa is very comfortable.,False
